{
  "id": 12613,
  "game_id": 25307,
  "game_slug": "originsro",
  "name": "OriginsRO",
  "year": 2013,
  "user": "vinisba",
  "runner": "wine",
  "slug": "originsro-originsro",
  "version": "OriginsRO",
  "description": "Downloads the latest version of OriginsRO. Please note an account is required to play: create one at http://originsro.org/join",
  "notes": "",
  "created_at": "2019-04-03T13:17:33.490000Z",
  "updated_at": "2020-03-10T18:01:47.238897Z",
  "draft": false,
  "published": true,
  "published_by": 20548,
  "rating": "",
  "steamid": null,
  "gogid": null,
  "gogslug": "",
  "humblestoreid": "",
  "script": {
    "files": [
      {
        "client": "https://dl.originsro.org/client/OriginsRO-full-2020-03-05.zip"
      }
    ],
    "game": {
      "prefix": "$GAMEDIR",
      "exe": "$GAMEDIR/OriginsroLauncher.exe",
      "arch": "win32",
      "working_dir": "$GAMEDIR"
    },
    "installer": [
      {
        "task": {
          "prefix": "$GAMEDIR",
          "arch": "win32",
          "name": "create_prefix"
        }
      },
      {
        "extract": {
          "file": "client",
          "dst": "$GAMEDIR"
        }
      },
      {
        "task": {
          "prefix": "$GAMEDIR/prefix",
          "arch": "win32",
          "app": "vcrun2008",
          "name": "winetricks"
        }
      },
      {
        "task": {
          "prefix": "$GAMEDIR/prefix",
          "arch": "win32",
          "app": "ie8",
          "name": "winetricks"
        }
      },
      {
        "task": {
          "arch": "win32",
          "name": "set_regedit",
          "key": "DirectDrawRenderer",
          "prefix": "$GAMEDIR",
          "value": "opengl",
          "path": "HKEY_CURRENT_USER\\Software\\Wine\\Direct3D",
          "type": "REG_SZ"
        }
      }
    ]
  },
  "content": "files:\n- client: https://dl.originsro.org/client/OriginsRO-full-2020-03-05.zip\ngame:\n  arch: win32\n  exe: $GAMEDIR/OriginsroLauncher.exe\n  prefix: $GAMEDIR\n  working_dir: $GAMEDIR\ninstaller:\n- task:\n    arch: win32\n    name: create_prefix\n    prefix: $GAMEDIR\n- extract:\n    dst: $GAMEDIR\n    file: client\n- task:\n    app: vcrun2008\n    arch: win32\n    name: winetricks\n    prefix: $GAMEDIR/prefix\n- task:\n    app: ie8\n    arch: win32\n    name: winetricks\n    prefix: $GAMEDIR/prefix\n- task:\n    arch: win32\n    key: DirectDrawRenderer\n    name: set_regedit\n    path: HKEY_CURRENT_USER\\Software\\Wine\\Direct3D\n    prefix: $GAMEDIR\n    type: REG_SZ\n    value: opengl\n"
}