{
  "id": 10065,
  "game_id": 21509,
  "game_slug": "battlefield-v",
  "name": "Battlefield V",
  "year": 2018,
  "user": "cxf",
  "runner": "wine",
  "slug": "battlefield-v-dxvk",
  "version": "DXVK",
  "description": "Only sets up Origin and DXVK you'll need to download Battlefield V manually.",
  "notes": "Please read before installing: <a href=\"https://github.com/lutris/lutris/wiki/Game:-Origin\">https://github.com/lutris/lutris/wiki/Game:-Origin</a>",
  "created_at": "2018-09-06T08:57:27.079000Z",
  "updated_at": "2020-04-18T07:20:38.792700Z",
  "draft": false,
  "published": true,
  "published_by": 20548,
  "rating": "",
  "steamid": null,
  "gogid": null,
  "gogslug": "",
  "humblestoreid": "",
  "script": {
    "files": [
      {
        "client": "https://origin-a.akamaihd.net/Origin-Client-Download/origin/live/OriginThinSetup.exe"
      },
      {
        "updater": "https://raw.githubusercontent.com/DrDoctor13/wine-origin-updater/master/updateorigin.sh"
      }
    ],
    "game": {
      "prefix": "$GAMEDIR",
      "exe": "drive_c/Program Files (x86)/Origin/Origin.exe",
      "arch": "win64"
    },
    "wine": {
      "overrides": {
        "xaudio2_7": "native,builtin",
        "nvapi,nvapi64": "disabled"
      },
      "dxvk": true
    },
    "system": {
      "env": {
        "STAGING_SHARED_MEMORY": "0",
        "DXVK_HUD": 0,
        "DXVK_CONFIG_FILE": "$GAMEDIR/dxvk.conf",
        "__GL_SHADER_DISK_CACHE_PATH": "$GAMEDIR/bfv-nv-shaders"
      },
      "disable_runtime": false,
      "exclude_processes": "QtWebEngineProcess.exe ActivationUI.exe OriginWebHelperService.exe"
    },
    "installer": [
      {
        "task": {
          "prefix": "$GAMEDIR",
          "arch": "win64",
          "name": "create_prefix",
          "description": "Creating Wine prefix"
        }
      },
      {
        "execute": {
          "command": "mkdir \"$GAMEDIR/bfv-nv-shaders\""
        }
      },
      {
        "input_menu": {
          "preselect": "Not needed for AMD. Ignore this.",
          "options": [
            {
              "Not needed for AMD. Ignore this.": "AMD"
            },
            {
              "dxgi.customVendorId = 10de\ndxgi.nvapiHack = False": "Nvidia"
            }
          ],
          "description": "Setting DXVK workarounds please choose your GPU:",
          "id": "GPU"
        }
      },
      {
        "write_file": {
          "file": "$GAMEDIR/dxvk.conf",
          "content": "$INPUT_GPU"
        }
      },
      {
        "task": {
          "prefix": "$GAMEDIR",
          "arch": "win64",
          "app": "arial nocrashdialog vcrun2015 vcrun2017 win7",
          "name": "winetricks"
        }
      },
      {
        "task": {
          "arch": "win64",
          "exclude_processes": "Origin.exe OriginClientService.exe OriginWebHelperService.exe QtWebEngineProcess.exe",
          "name": "wineexec",
          "description": "Installing Origin... Login window will pop-up and close.",
          "args": "/silent",
          "prefix": "$GAMEDIR",
          "executable": "client"
        }
      },
      {
        "task": {
          "prefix": "$GAMEDIR",
          "arch": "win64",
          "name": "winekill"
        }
      },
      {
        "chmodx": "updater"
      },
      {
        "merge": {
          "src": "updater",
          "dst": "$GAMEDIR/drive_c/Program Files (x86)/Origin"
        }
      }
    ]
  },
  "content": "files:\n- client: https://origin-a.akamaihd.net/Origin-Client-Download/origin/live/OriginThinSetup.exe\n- updater: https://raw.githubusercontent.com/DrDoctor13/wine-origin-updater/master/updateorigin.sh\ngame:\n  arch: win64\n  exe: drive_c/Program Files (x86)/Origin/Origin.exe\n  prefix: $GAMEDIR\ninstaller:\n- task:\n    arch: win64\n    description: Creating Wine prefix\n    name: create_prefix\n    prefix: $GAMEDIR\n- execute:\n    command: mkdir \"$GAMEDIR/bfv-nv-shaders\"\n- input_menu:\n    description: 'Setting DXVK workarounds please choose your GPU:'\n    id: GPU\n    options:\n    - Not needed for AMD. Ignore this.: AMD\n    - ? 'dxgi.customVendorId = 10de\n\n        dxgi.nvapiHack = False'\n      : Nvidia\n    preselect: Not needed for AMD. Ignore this.\n- write_file:\n    content: $INPUT_GPU\n    file: $GAMEDIR/dxvk.conf\n- task:\n    app: arial nocrashdialog vcrun2015 vcrun2017 win7\n    arch: win64\n    name: winetricks\n    prefix: $GAMEDIR\n- task:\n    arch: win64\n    args: /silent\n    description: Installing Origin... Login window will pop-up and close.\n    exclude_processes: Origin.exe OriginClientService.exe OriginWebHelperService.exe\n      QtWebEngineProcess.exe\n    executable: client\n    name: wineexec\n    prefix: $GAMEDIR\n- task:\n    arch: win64\n    name: winekill\n    prefix: $GAMEDIR\n- chmodx: updater\n- merge:\n    dst: $GAMEDIR/drive_c/Program Files (x86)/Origin\n    src: updater\nsystem:\n  disable_runtime: false\n  env:\n    DXVK_CONFIG_FILE: $GAMEDIR/dxvk.conf\n    DXVK_HUD: 0\n    STAGING_SHARED_MEMORY: '0'\n    __GL_SHADER_DISK_CACHE_PATH: $GAMEDIR/bfv-nv-shaders\n  exclude_processes: QtWebEngineProcess.exe ActivationUI.exe OriginWebHelperService.exe\nwine:\n  dxvk: true\n  overrides:\n    nvapi,nvapi64: disabled\n    xaudio2_7: native,builtin\n"
}