{
  "id": 16748,
  "game_id": 30082,
  "game_slug": "tauriwow",
  "name": "TauriWOW",
  "year": 2004,
  "user": "kuzvala88",
  "runner": "wine",
  "slug": "tauriwow-main",
  "version": "main",
  "description": null,
  "notes": "",
  "created_at": "2019-11-10T15:52:26.699000Z",
  "updated_at": "2020-03-07T09:42:57.607907Z",
  "draft": false,
  "published": true,
  "published_by": 20548,
  "rating": "",
  "steamid": null,
  "gogid": null,
  "gogslug": "",
  "humblestoreid": "",
  "script": {
    "files": [
      {
        "launcher": {
          "url": "http://launcherdata.tauri.hu/launcher/tlauncherinstaller.exe",
          "filename": "tlauncherinstaller.exe"
        }
      }
    ],
    "installer": [
      {
        "task": {
          "arch": "win64",
          "description": "Creating Wine prefix",
          "prefix": "$GAMEDIR",
          "name": "create_prefix"
        }
      },
      {
        "task": {
          "arch": "win64",
          "description": "Installing Arial font",
          "app": "arial",
          "prefix": "$GAMEDIR",
          "name": "winetricks"
        }
      },
      {
        "task": {
          "arch": "win64",
          "app": "nocrashdialog vcrun2010 win7",
          "prefix": "$GAMEDIR",
          "name": "winetricks"
        }
      },
      {
        "task": {
          "prefix": "$GAMEDIR",
          "value": "va",
          "arch": "win64",
          "key": "backend",
          "name": "set_regedit",
          "description": "Wine Staging: Enabling DXVA2",
          "path": "HKEY_CURRENT_USER\\Software\\Wine\\DXVA2"
        }
      },
      {
        "task": {
          "prefix": "$GAMEDIR",
          "name": "winekill"
        }
      },
      {
        "task": {
          "arch": "win64",
          "exclude_processes": "Launcher.exe",
          "executable": "launcher",
          "prefix": "$GAMEDIR",
          "name": "wineexec"
        }
      }
    ],
    "system": {
      "env": {
        "__GL_SHADER_DISK_CACHE_PATH": "$GAMEDIR",
        "STAGING_SHARED_MEMORY": 1,
        "DXVK_HUD": "compiler",
        "__GL_SHADER_DISK_CACHE": 1,
        "DXVK_STATE_CACHE_PATH": "$GAMEDIR"
      }
    },
    "wine": {
      "dxvk": false,
      "overrides": {
        "nvapi": "disabled",
        "d3d12": "disabled",
        "nvapi64": "disabled",
        "api-ms-win-crt-private-l1-1-0": "n,b",
        "ucrtbase": "n,b"
      },
      "esync": true
    },
    "game": {
      "arch": "win64",
      "working_dir": "$GAMEDIR",
      "prefix": "$GAMEDIR",
      "exe": "$GAMEDIR/drive_c/Tauri Launcher/Launcher.exe"
    }
  },
  "content": "files:\n- launcher:\n    filename: tlauncherinstaller.exe\n    url: http://launcherdata.tauri.hu/launcher/tlauncherinstaller.exe\ngame:\n  arch: win64\n  exe: $GAMEDIR/drive_c/Tauri Launcher/Launcher.exe\n  prefix: $GAMEDIR\n  working_dir: $GAMEDIR\ninstaller:\n- task:\n    arch: win64\n    description: Creating Wine prefix\n    name: create_prefix\n    prefix: $GAMEDIR\n- task:\n    app: arial\n    arch: win64\n    description: Installing Arial font\n    name: winetricks\n    prefix: $GAMEDIR\n- task:\n    app: nocrashdialog vcrun2010 win7\n    arch: win64\n    name: winetricks\n    prefix: $GAMEDIR\n- task:\n    arch: win64\n    description: 'Wine Staging: Enabling DXVA2'\n    key: backend\n    name: set_regedit\n    path: HKEY_CURRENT_USER\\Software\\Wine\\DXVA2\n    prefix: $GAMEDIR\n    value: va\n- task:\n    name: winekill\n    prefix: $GAMEDIR\n- task:\n    arch: win64\n    exclude_processes: Launcher.exe\n    executable: launcher\n    name: wineexec\n    prefix: $GAMEDIR\nsystem:\n  env:\n    DXVK_HUD: compiler\n    DXVK_STATE_CACHE_PATH: $GAMEDIR\n    STAGING_SHARED_MEMORY: 1\n    __GL_SHADER_DISK_CACHE: 1\n    __GL_SHADER_DISK_CACHE_PATH: $GAMEDIR\nwine:\n  dxvk: false\n  esync: true\n  overrides:\n    api-ms-win-crt-private-l1-1-0: n,b\n    d3d12: disabled\n    nvapi: disabled\n    nvapi64: disabled\n    ucrtbase: n,b\n"
}