{
  "id": 3612,
  "game_id": 1801,
  "game_slug": "space-engineers",
  "name": "Space Engineers",
  "year": 2013,
  "user": "ChillBacon",
  "runner": "winesteam",
  "slug": "space-engineers-steam",
  "version": "Steam",
  "description": null,
  "notes": "",
  "created_at": "2017-05-01T15:18:01.862000Z",
  "updated_at": "2019-05-18T06:43:57.838927Z",
  "draft": false,
  "published": true,
  "published_by": 19464,
  "rating": "",
  "steamid": 244850,
  "gogid": null,
  "gogslug": "",
  "humblestoreid": "",
  "script": {
    "game": {
      "prefix": "$GAMEDIR/prefix",
      "appid": 244850,
      "arch": "win64"
    },
    "files": [
      {
        "dx2010": "https://lutris.net/files/tools/directx-2010.tar.gz"
      }
    ],
    "system": {
      "env": {
        "DXVK_HUD": 0
      }
    },
    "installer": [
      {
        "extract": {
          "dst": "$CACHE/dxsetup",
          "file": "dx2010"
        }
      },
      {
        "task": {
          "prefix": "$GAMEDIR/prefix",
          "arch": "win64",
          "name": "create_prefix"
        }
      },
      {
        "task": {
          "args": "/silent",
          "prefix": "$GAMEDIR/prefix",
          "executable": "$CACHE/dxsetup/DXSETUP.exe",
          "name": "wineexec",
          "arch": "win64"
        }
      },
      {
        "task": {
          "prefix": "$GAMEDIR/prefix",
          "arch": "win64",
          "name": "winekill"
        }
      },
      {
        "task": {
          "arch": "win64",
          "prefix": "$GAMEDIR/prefix",
          "name": "winetricks",
          "app": "vcrun2017 xact"
        }
      },
      {
        "task": {
          "description": "Installing .NET 4.7.2. This will take a while...",
          "arch": "win64",
          "prefix": "$GAMEDIR/prefix",
          "name": "winetricks",
          "app": "dotnet472 win7"
        }
      }
    ],
    "winesteam": {
      "esync": true,
      "dxvk": true,
      "version": "tkg-protonified-4.6-x86_64"
    }
  },
  "content": "files:\n- dx2010: https://lutris.net/files/tools/directx-2010.tar.gz\ngame:\n  appid: 244850\n  arch: win64\n  prefix: $GAMEDIR/prefix\ninstaller:\n- extract:\n    dst: $CACHE/dxsetup\n    file: dx2010\n- task:\n    arch: win64\n    name: create_prefix\n    prefix: $GAMEDIR/prefix\n- task:\n    arch: win64\n    args: /silent\n    executable: $CACHE/dxsetup/DXSETUP.exe\n    name: wineexec\n    prefix: $GAMEDIR/prefix\n- task:\n    arch: win64\n    name: winekill\n    prefix: $GAMEDIR/prefix\n- task:\n    app: vcrun2017 xact\n    arch: win64\n    name: winetricks\n    prefix: $GAMEDIR/prefix\n- task:\n    app: dotnet472 win7\n    arch: win64\n    description: Installing .NET 4.7.2. This will take a while...\n    name: winetricks\n    prefix: $GAMEDIR/prefix\nsystem:\n  env:\n    DXVK_HUD: 0\nwinesteam:\n  dxvk: true\n  esync: true\n  version: tkg-protonified-4.6-x86_64\n"
}