{
  "id": 4558,
  "game_id": 11850,
  "game_slug": "anno-1503",
  "name": "Anno 1503 A.D.",
  "year": 2003,
  "user": "wackba",
  "runner": "wine",
  "slug": "anno-1503-ad-gog",
  "version": "GOG",
  "description": null,
  "notes": "",
  "created_at": "2017-06-24T12:00:42.805000Z",
  "updated_at": "2020-01-23T02:57:09.127807Z",
  "draft": false,
  "published": true,
  "published_by": 51687,
  "rating": "",
  "steamid": null,
  "gogid": null,
  "gogslug": "",
  "humblestoreid": "",
  "script": {
    "files": [
      {
        "game": "N/A:Please select the GOG.com Windows installer."
      }
    ],
    "game": {
      "prefix": "$GAMEDIR",
      "exe": "drive_c/game/1503Startup.exe",
      "arch": "win32"
    },
    "installer": [
      {
        "task": {
          "prefix": "$GAMEDIR",
          "arch": "win32",
          "name": "create_prefix",
          "description": "Creating Wine prefix"
        }
      },
      {
        "task": {
          "prefix": "$GAMEDIR",
          "executable": "game",
          "name": "wineexec",
          "description": "Installing...",
          "args": "/VERYSILENT /SP- /NOCANCEL /SUPPRESSMSGBOXES '/DIR=C:/game'"
        }
      },
      {
        "task": {
          "prefix": "$GAMEDIR",
          "app": "windowmanagermanaged=n",
          "silent": true,
          "name": "winetricks"
        }
      },
      {
        "task": {
          "prefix": "$GAMEDIR",
          "app": "directmusic",
          "silent": true,
          "name": "winetricks"
        }
      }
    ]
  },
  "content": "files:\n- game: N/A:Please select the GOG.com Windows installer.\ngame:\n  arch: win32\n  exe: drive_c/game/1503Startup.exe\n  prefix: $GAMEDIR\ninstaller:\n- task:\n    arch: win32\n    description: Creating Wine prefix\n    name: create_prefix\n    prefix: $GAMEDIR\n- task:\n    args: /VERYSILENT /SP- /NOCANCEL /SUPPRESSMSGBOXES '/DIR=C:/game'\n    description: Installing...\n    executable: game\n    name: wineexec\n    prefix: $GAMEDIR\n- task:\n    app: windowmanagermanaged=n\n    name: winetricks\n    prefix: $GAMEDIR\n    silent: true\n- task:\n    app: directmusic\n    name: winetricks\n    prefix: $GAMEDIR\n    silent: true\n"
}