{
  "id": 12081,
  "game_id": 14436,
  "game_slug": "entropia-universe",
  "name": "Entropia Universe",
  "year": 2003,
  "user": "zenobit",
  "runner": "wine",
  "slug": "entropia-universe-15202",
  "version": "15.20.2",
  "description": null,
  "notes": "Will fail to download fully on first launch. Second launch allows you to download other files.\r\n\r\nDoesn't render everything well. At least not on Nvidia.\r\n\r\nPausing download when in-game crashes the game.",
  "created_at": "2019-02-18T14:51:53.091000Z",
  "updated_at": "2019-02-19T07:44:06.260403Z",
  "draft": false,
  "published": true,
  "published_by": 19464,
  "rating": "",
  "steamid": null,
  "gogid": null,
  "gogslug": "",
  "humblestoreid": "",
  "script": {
    "game": {
      "exe": "drive_c/Program Files (x86)/Entropia Universe/bin32/ClientLoader.exe",
      "arch": "win64",
      "prefix": "$GAMEDIR"
    },
    "files": [
      {
        "setup": "http://install2.entropiauniverse.com/entropia_universe_setup.exe"
      }
    ],
    "system": {
      "env": {
        "PBA_ENABLE": 1
      }
    },
    "installer": [
      {
        "task": {
          "prefix": "$GAMEDIR",
          "arch": "win64",
          "name": "create_prefix"
        }
      },
      {
        "task": {
          "arch": "win64",
          "prefix": "$GAMEDIR",
          "name": "winetricks",
          "app": "vcrun2012 win7"
        }
      },
      {
        "task": {
          "args": "/silent",
          "prefix": "$GAMEDIR",
          "executable": "setup",
          "name": "wineexec",
          "arch": "win64"
        }
      },
      {
        "task": {
          "prefix": "$GAMEDIR",
          "name": "set_regedit",
          "path": "HKEY_LOCAL_MACHINE\\Software\\MindArk\\Entropia Universe",
          "value": "(value not set)",
          "key": "(Default)",
          "arch": "win64"
        }
      },
      {
        "task": {
          "prefix": "$GAMEDIR",
          "name": "set_regedit",
          "path": "HKEY_CURRENT_USER\\Software\\MindArk\\Entropia Universe\\Language",
          "value": "00000001",
          "key": "Language",
          "arch": "win64",
          "type": "REG_DWORD"
        }
      },
      {
        "task": {
          "prefix": "$GAMEDIR",
          "name": "set_regedit",
          "path": "HKEY_CURRENT_USER\\Software\\MindArk\\Entropia Universe\\DynamicContent",
          "value": "00000001",
          "key": "BGDownloadInitialized",
          "arch": "win64",
          "type": "REG_DWORD"
        }
      },
      {
        "task": {
          "prefix": "$GAMEDIR",
          "name": "set_regedit",
          "path": "HKEY_CURRENT_USER\\Software\\MindArk\\Entropia Universe\\DynamicContent",
          "value": "",
          "key": "BGDownloadList",
          "arch": "win64",
          "type": "REG_SZ"
        }
      },
      {
        "task": {
          "prefix": "$GAMEDIR",
          "name": "set_regedit",
          "path": "HKEY_USERS\\S-1-5-21-0-0-0-1000\\Software\\MindArk\\Entropia Universe\\Language",
          "value": "00000001",
          "key": "Language",
          "arch": "win64",
          "type": "REG_DWORD"
        }
      },
      {
        "task": {
          "prefix": "$GAMEDIR",
          "name": "set_regedit",
          "path": "HKEY_USERS\\S-1-5-21-0-0-0-1000\\Software\\MindArk\\Entropia Universe\\DynamicContent",
          "value": "00000001",
          "key": "BGDownloadInitialized",
          "arch": "win64",
          "type": "REG_DWORD"
        }
      },
      {
        "task": {
          "prefix": "$GAMEDIR",
          "name": "set_regedit",
          "path": "HKEY_USERS\\S-1-5-21-0-0-0-1000\\Software\\MindArk\\Entropia Universe\\DynamicContent",
          "value": "",
          "key": "BGDownloadList",
          "arch": "win64",
          "type": "REG_SZ"
        }
      }
    ],
    "wine": {
      "version": "esync-staging-pba-3.16-x86_64"
    }
  },
  "content": "files:\n- setup: http://install2.entropiauniverse.com/entropia_universe_setup.exe\ngame:\n  arch: win64\n  exe: drive_c/Program Files (x86)/Entropia Universe/bin32/ClientLoader.exe\n  prefix: $GAMEDIR\ninstaller:\n- task:\n    arch: win64\n    name: create_prefix\n    prefix: $GAMEDIR\n- task:\n    app: vcrun2012 win7\n    arch: win64\n    name: winetricks\n    prefix: $GAMEDIR\n- task:\n    arch: win64\n    args: /silent\n    executable: setup\n    name: wineexec\n    prefix: $GAMEDIR\n- task:\n    arch: win64\n    key: (Default)\n    name: set_regedit\n    path: HKEY_LOCAL_MACHINE\\Software\\MindArk\\Entropia Universe\n    prefix: $GAMEDIR\n    value: (value not set)\n- task:\n    arch: win64\n    key: Language\n    name: set_regedit\n    path: HKEY_CURRENT_USER\\Software\\MindArk\\Entropia Universe\\Language\n    prefix: $GAMEDIR\n    type: REG_DWORD\n    value: '00000001'\n- task:\n    arch: win64\n    key: BGDownloadInitialized\n    name: set_regedit\n    path: HKEY_CURRENT_USER\\Software\\MindArk\\Entropia Universe\\DynamicContent\n    prefix: $GAMEDIR\n    type: REG_DWORD\n    value: '00000001'\n- task:\n    arch: win64\n    key: BGDownloadList\n    name: set_regedit\n    path: HKEY_CURRENT_USER\\Software\\MindArk\\Entropia Universe\\DynamicContent\n    prefix: $GAMEDIR\n    type: REG_SZ\n    value: ''\n- task:\n    arch: win64\n    key: Language\n    name: set_regedit\n    path: HKEY_USERS\\S-1-5-21-0-0-0-1000\\Software\\MindArk\\Entropia Universe\\Language\n    prefix: $GAMEDIR\n    type: REG_DWORD\n    value: '00000001'\n- task:\n    arch: win64\n    key: BGDownloadInitialized\n    name: set_regedit\n    path: HKEY_USERS\\S-1-5-21-0-0-0-1000\\Software\\MindArk\\Entropia Universe\\DynamicContent\n    prefix: $GAMEDIR\n    type: REG_DWORD\n    value: '00000001'\n- task:\n    arch: win64\n    key: BGDownloadList\n    name: set_regedit\n    path: HKEY_USERS\\S-1-5-21-0-0-0-1000\\Software\\MindArk\\Entropia Universe\\DynamicContent\n    prefix: $GAMEDIR\n    type: REG_SZ\n    value: ''\nsystem:\n  env:\n    PBA_ENABLE: 1\nwine:\n  version: esync-staging-pba-3.16-x86_64\n"
}