{
  "id": 12683,
  "game_id": 19700,
  "game_slug": "red-faction-guerrilla-re-mars-tered",
  "name": "Red Faction Guerrilla Re-Mars-tered",
  "year": 2018,
  "user": "cxf",
  "runner": "wine",
  "slug": "red-faction-guerrilla-re-mars-gog-w-dxvk",
  "version": "GOG w/ DXVK",
  "description": null,
  "notes": "",
  "created_at": "2019-04-08T07:08:53.483325Z",
  "updated_at": "2020-01-23T02:57:14.219439Z",
  "draft": false,
  "published": true,
  "published_by": null,
  "rating": "",
  "steamid": 667720,
  "gogid": 2029222893,
  "gogslug": "red_faction_guerrilla_remarstered",
  "humblestoreid": "",
  "script": {
    "files": [
      {
        "dx2010": "https://lutris.net/files/tools/directx-2010.tar.gz"
      },
      {
        "setup": "N/A:Select gog setup exe"
      }
    ],
    "installer": [
      {
        "task": {
          "prefix": "$GAMEDIR",
          "name": "create_prefix"
        }
      },
      {
        "extract": {
          "dst": "$CACHE/dxsetup",
          "file": "dx2010"
        }
      },
      {
        "task": {
          "args": "/silent",
          "name": "wineexec",
          "arch": "win64",
          "executable": "$CACHE/dxsetup/DXSETUP.exe",
          "prefix": "$GAMEDIR"
        }
      },
      {
        "task": {
          "description": "Installing Windows dependencies",
          "name": "winetricks",
          "app": "vcrun2010 vcrun2012 vcrun2013 vcrun2015 win7",
          "prefix": "$GAMEDIR"
        }
      },
      {
        "task": {
          "args": "/SP- /SUPPRESSMSGBOXES",
          "name": "wineexec",
          "executable": "setup",
          "prefix": "$GAMEDIR"
        }
      }
    ],
    "game": {
      "prefix": "$GAMEDIR",
      "exe": "drive_c/GOG Games/Red Faction Guerrilla Re-Mars-tered/rfg.exe"
    },
    "system": {
      "env": {
        "DXVK_HUD": 0
      }
    },
    "wine": {
      "dxvk": true
    }
  },
  "content": "files:\n- dx2010: https://lutris.net/files/tools/directx-2010.tar.gz\n- setup: N/A:Select gog setup exe\ngame:\n  exe: drive_c/GOG Games/Red Faction Guerrilla Re-Mars-tered/rfg.exe\n  prefix: $GAMEDIR\ninstaller:\n- task:\n    name: create_prefix\n    prefix: $GAMEDIR\n- extract:\n    dst: $CACHE/dxsetup\n    file: dx2010\n- task:\n    arch: win64\n    args: /silent\n    executable: $CACHE/dxsetup/DXSETUP.exe\n    name: wineexec\n    prefix: $GAMEDIR\n- task:\n    app: vcrun2010 vcrun2012 vcrun2013 vcrun2015 win7\n    description: Installing Windows dependencies\n    name: winetricks\n    prefix: $GAMEDIR\n- task:\n    args: /SP- /SUPPRESSMSGBOXES\n    executable: setup\n    name: wineexec\n    prefix: $GAMEDIR\nsystem:\n  env:\n    DXVK_HUD: 0\nwine:\n  dxvk: true\n"
}