{
  "id": 14967,
  "game_id": 11357,
  "game_slug": "anarchy-online",
  "name": "Anarchy Online",
  "year": null,
  "user": "magzu",
  "runner": "wine",
  "slug": "anarchy-online-standalone-dxvk",
  "version": "Standalone | DXVK",
  "description": "New-engine with DXVK",
  "notes": "",
  "created_at": "2019-08-11T12:38:57.294000Z",
  "updated_at": "2020-01-23T02:57:19.983103Z",
  "draft": false,
  "published": true,
  "published_by": 51687,
  "rating": "",
  "steamid": 396280,
  "gogid": null,
  "gogslug": "",
  "humblestoreid": "",
  "script": {
    "installer": [
      {
        "task": {
          "arch": "win64",
          "description": "Creating Wine Prefix...",
          "prefix": "$GAMEDIR",
          "name": "create_prefix"
        }
      },
      {
        "task": {
          "description": "Installing dependencies",
          "app": "d3dcompiler_43 d3dx9 arial",
          "prefix": "$GAMEDIR",
          "name": "winetricks"
        }
      },
      {
        "task": {
          "arch": "win64",
          "executable": "AO_installer",
          "description": "Running Anarchy Online Installer. Please do not run the game until this script finishes installing.",
          "prefix": "$GAMEDIR",
          "name": "wineexec"
        }
      }
    ],
    "files": [
      {
        "AO_installer": "http://update.anarchy-online.com/download/AO/AnarchyOnline_EP2.exe"
      }
    ],
    "wine": {
      "dxvk": true,
      "esync": true
    },
    "game": {
      "arch": "win64",
      "prefix": "$GAMEDIR",
      "exe": "$GAMEDIR/drive_c/Funcom/Anarchy Online/AnarchyOnline.exe"
    }
  },
  "content": "files:\n- AO_installer: http://update.anarchy-online.com/download/AO/AnarchyOnline_EP2.exe\ngame:\n  arch: win64\n  exe: $GAMEDIR/drive_c/Funcom/Anarchy Online/AnarchyOnline.exe\n  prefix: $GAMEDIR\ninstaller:\n- task:\n    arch: win64\n    description: Creating Wine Prefix...\n    name: create_prefix\n    prefix: $GAMEDIR\n- task:\n    app: d3dcompiler_43 d3dx9 arial\n    description: Installing dependencies\n    name: winetricks\n    prefix: $GAMEDIR\n- task:\n    arch: win64\n    description: Running Anarchy Online Installer. Please do not run the game until\n      this script finishes installing.\n    executable: AO_installer\n    name: wineexec\n    prefix: $GAMEDIR\nwine:\n  dxvk: true\n  esync: true\n"
}