{
  "id": 11629,
  "game_id": 3708,
  "game_slug": "far-cry-4",
  "name": "Far Cry 4",
  "year": 2014,
  "user": "cxf",
  "runner": "winesteam",
  "slug": "far-cry-4-steam",
  "version": "Steam",
  "description": null,
  "notes": "",
  "created_at": "2019-01-18T03:43:53.747000Z",
  "updated_at": "2020-01-31T02:38:27.483537Z",
  "draft": false,
  "published": true,
  "published_by": 19464,
  "rating": "4",
  "steamid": 298110,
  "gogid": null,
  "gogslug": "",
  "humblestoreid": "",
  "script": {
    "files": [
      {
        "dx2010": "https://lutris.net/files/tools/directx-2010.tar.gz"
      },
      {
        "uplay": "https://ubistatic3-a.akamaihd.net/orbit/launcher_installer/UplayInstaller.exe"
      }
    ],
    "game": {
      "appid": 298110,
      "arch": "win64",
      "args": "-skipintro",
      "prefix": "$GAMEDIR/prefix"
    },
    "installer": [
      {
        "task": {
          "arch": "win64",
          "name": "create_prefix",
          "prefix": "$GAMEDIR/prefix"
        }
      },
      {
        "input_menu": {
          "description": "Choose your GPU:",
          "id": "GPU",
          "options": [
            {
              "#dxgi.nvapiHack = False": "AMD"
            },
            {
              "dxgi.nvapiHack = False": "Nvidia"
            }
          ],
          "preselect": "#dxgi.nvapiHack = False"
        }
      },
      {
        "write_file": {
          "content": "$INPUT_GPU",
          "file": "$GAMEDIR/dxvk.conf"
        }
      },
      {
        "extract": {
          "dst": "$CACHE/dxsetup",
          "file": "dx2010"
        }
      },
      {
        "task": {
          "arch": "win64",
          "args": "/silent",
          "executable": "$CACHE/dxsetup/DXSETUP.exe",
          "name": "wineexec",
          "prefix": "$GAMEDIR/prefix"
        }
      },
      {
        "task": {
          "app": "vcrun2010 corefonts",
          "arch": "win64",
          "name": "winetricks",
          "prefix": "$GAMEDIR/prefix"
        }
      },
      {
        "task": {
          "app": "dotnet472 win7",
          "arch": "win64",
          "description": "Please be patient while we install .NET 4.7.2",
          "name": "winetricks",
          "prefix": "$GAMEDIR/prefix"
        }
      },
      {
        "task": {
          "key": "Version",
          "name": "set_regedit",
          "path": "HKEY_CURRENT_USER\\Software\\Wine\\AppDefaults\\FarCry4.exe",
          "prefix": "$GAMEDIR/prefix",
          "value": "winxp"
        }
      },
      {
        "task": {
          "arch": "win64",
          "args": "/S",
          "executable": "uplay",
          "name": "wineexec",
          "prefix": "$GAMEDIR/prefix"
        }
      },
      {
        "task": {
          "arch": "win64",
          "name": "winekill",
          "prefix": "$GAMEDIR/prefix"
        }
      }
    ],
    "system": {
      "disable_runtime": false,
      "env": {
        "DXVK_CONFIG_FILE": "$GAMEDIR/dxvk.conf"
      }
    },
    "winesteam": {
      "dxvk": true,
      "esync": true
    }
  },
  "content": "files:\n- dx2010: https://lutris.net/files/tools/directx-2010.tar.gz\n- uplay: https://ubistatic3-a.akamaihd.net/orbit/launcher_installer/UplayInstaller.exe\ngame:\n  appid: 298110\n  arch: win64\n  args: -skipintro\n  prefix: $GAMEDIR/prefix\ninstaller:\n- task:\n    arch: win64\n    name: create_prefix\n    prefix: $GAMEDIR/prefix\n- input_menu:\n    description: 'Choose your GPU:'\n    id: GPU\n    options:\n    - '#dxgi.nvapiHack = False': AMD\n    - dxgi.nvapiHack = False: Nvidia\n    preselect: '#dxgi.nvapiHack = False'\n- write_file:\n    content: $INPUT_GPU\n    file: $GAMEDIR/dxvk.conf\n- extract:\n    dst: $CACHE/dxsetup\n    file: dx2010\n- task:\n    arch: win64\n    args: /silent\n    executable: $CACHE/dxsetup/DXSETUP.exe\n    name: wineexec\n    prefix: $GAMEDIR/prefix\n- task:\n    app: vcrun2010 corefonts\n    arch: win64\n    name: winetricks\n    prefix: $GAMEDIR/prefix\n- task:\n    app: dotnet472 win7\n    arch: win64\n    description: Please be patient while we install .NET 4.7.2\n    name: winetricks\n    prefix: $GAMEDIR/prefix\n- task:\n    key: Version\n    name: set_regedit\n    path: HKEY_CURRENT_USER\\Software\\Wine\\AppDefaults\\FarCry4.exe\n    prefix: $GAMEDIR/prefix\n    value: winxp\n- task:\n    arch: win64\n    args: /S\n    executable: uplay\n    name: wineexec\n    prefix: $GAMEDIR/prefix\n- task:\n    arch: win64\n    name: winekill\n    prefix: $GAMEDIR/prefix\nsystem:\n  disable_runtime: false\n  env:\n    DXVK_CONFIG_FILE: $GAMEDIR/dxvk.conf\nwinesteam:\n  dxvk: true\n  esync: true\n"
}