{
  "id": 10831,
  "game_id": 23230,
  "game_slug": "project-universe",
  "name": "Project Universe",
  "year": null,
  "user": "soulweaver",
  "runner": "wine",
  "slug": "project-universe-pre-alpha",
  "version": "Pre-Alpha",
  "description": "Installer for base version of game.",
  "notes": "Patches must be manually applied until game receives an actual updater/launcher.",
  "created_at": "2018-11-11T06:45:20.564000Z",
  "updated_at": "2019-02-09T23:09:54.237764Z",
  "draft": false,
  "published": true,
  "published_by": 19464,
  "rating": "",
  "steamid": null,
  "gogid": null,
  "gogslug": "",
  "humblestoreid": "",
  "script": {
    "game": {
      "exe": "$GAMEDIR/drive_c/Program Files (x86)/Project Universe/ProjectUniverse.exe",
      "arch": "win64",
      "prefix": "$GAMEDIR"
    },
    "files": [
      {
        "setup": {
          "filename": "PU Installer.exe",
          "url": "N/A:Select the \"PU Installer.exe\" for game install"
        }
      },
      {
        "innoextract": "http://constexpr.org/innoextract/files/snapshots/innoextract-1.7-rc1/innoextract-1.7-rc1-linux.tar.xz"
      }
    ],
    "wine": {
      "esync": false,
      "overrides": {
        "xaudio2_7": "native,builtin"
      },
      "dxvk": true
    },
    "installer": [
      {
        "task": {
          "description": "Creating win64 prefix",
          "prefix": "$GAMEDIR",
          "arch": "win64",
          "name": "create_prefix"
        }
      },
      {
        "task": {
          "description": "Installing xact",
          "arch": "win64",
          "prefix": "$GAMEDIR",
          "name": "winetricks",
          "app": "xact"
        }
      },
      {
        "extract": {
          "dst": "$CACHE",
          "file": "innoextract"
        }
      },
      {
        "execute": {
          "description": "Extracting game data",
          "args": "--extract $setup --output-dir $CACHE",
          "file": "$CACHE/innoextract"
        }
      },
      {
        "move": {
          "description": "Extracting game data",
          "dst": "$GAMEDIR/drive_c/Program Files (x86)/Project Universe",
          "src": "$CACHE/app"
        }
      }
    ]
  },
  "content": "files:\n- setup:\n    filename: PU Installer.exe\n    url: N/A:Select the \"PU Installer.exe\" for game install\n- innoextract: http://constexpr.org/innoextract/files/snapshots/innoextract-1.7-rc1/innoextract-1.7-rc1-linux.tar.xz\ngame:\n  arch: win64\n  exe: $GAMEDIR/drive_c/Program Files (x86)/Project Universe/ProjectUniverse.exe\n  prefix: $GAMEDIR\ninstaller:\n- task:\n    arch: win64\n    description: Creating win64 prefix\n    name: create_prefix\n    prefix: $GAMEDIR\n- task:\n    app: xact\n    arch: win64\n    description: Installing xact\n    name: winetricks\n    prefix: $GAMEDIR\n- extract:\n    dst: $CACHE\n    file: innoextract\n- execute:\n    args: --extract $setup --output-dir $CACHE\n    description: Extracting game data\n    file: $CACHE/innoextract\n- move:\n    description: Extracting game data\n    dst: $GAMEDIR/drive_c/Program Files (x86)/Project Universe\n    src: $CACHE/app\nwine:\n  dxvk: true\n  esync: false\n  overrides:\n    xaudio2_7: native,builtin\n"
}