{
  "id": 10752,
  "game_id": 15888,
  "game_slug": "destiny-2",
  "name": "Destiny 2",
  "year": 2017,
  "user": "-Atomix-",
  "runner": "wine",
  "slug": "destiny-2-battlenet-w-dxvk",
  "version": "Battle.net w/ DXVK",
  "description": "DOES NOT WORK",
  "notes": "<b>CONFIGURE AND INSTALL THE DEPENDENCIES FIRST</b>\r\n\r\nInstructions for DXVK support: <a href=\"https://github.com/lutris/lutris/wiki/How-to:-DXVK\">https://github.com/lutris/lutris/wiki/How-to:-DXVK</a>\r\n\r\nBattle.Net (+ common problems): <a href=\"https://github.com/lutris/lutris/wiki/Game:-Blizzard-App\">https://github.com/lutris/lutris/wiki/Game:-Blizzard-App</a>",
  "created_at": "2018-11-03T08:58:24.359000Z",
  "updated_at": "2019-02-14T05:46:50.973315Z",
  "draft": false,
  "published": true,
  "published_by": 19464,
  "rating": "1",
  "steamid": 1085660,
  "gogid": null,
  "gogslug": "",
  "humblestoreid": "",
  "script": {
    "game": {
      "exe": "drive_c/Program Files (x86)/Battle.net/Battle.net Launcher.exe",
      "arch": "win64",
      "prefix": "$GAMEDIR"
    },
    "files": [
      {
        "setup": {
          "filename": "Battle.net-Setup.exe",
          "url": "https://www.battle.net/download/getInstallerForGame?os=win&version=LIVE&gameProgram=BATTLENET_APP"
        }
      }
    ],
    "system": {
      "env": {
        "DXVK_HUD": 0,
        "__GL_SHADER_DISK_CACHE": 1,
        "__GL_SHADER_DISK_CACHE_PATH": "$GAMEDIR"
      },
      "exclude_processes": "Agent.exe \"Battle.net Helper.exe\""
    },
    "installer": [
      {
        "task": {
          "description": "Creating 64bit Wine prefix.",
          "prefix": "$GAMEDIR",
          "arch": "win64",
          "name": "create_prefix"
        }
      },
      {
        "task": {
          "name": "winetricks",
          "description": "Installing Arial font",
          "silent": true,
          "prefix": "$GAMEDIR",
          "app": "arial",
          "arch": "win64"
        }
      },
      {
        "task": {
          "prefix": "$GAMEDIR",
          "name": "set_regedit",
          "description": "Setting Windows 10 mode for Wine",
          "path": "HKEY_CURRENT_USER\\Software\\Wine",
          "value": "win10",
          "key": "Version",
          "arch": "win64"
        }
      },
      {
        "execute": {
          "command": "unlink \"$GAMEDIR/drive_c/users/$USER/My Documents\""
        }
      },
      {
        "write_json": {
          "description": "Disabling Sound/Hardware Acceleration/Streaming in Blizzard App and enabling background search for games.",
          "data": {
            "Client": {
              "DelayedExitAppOnLaunch": "true",
              "GameLaunchWindowBehavior": "2",
              "HardwareAcceleration": "false",
              "GameSearch": {
                "BackgroundSearch": "true"
              },
              "Streaming": {
                "StreamingEnabled": "false"
              }
            }
          },
          "file": "$GAMEDIR/drive_c/users/$USER/Application Data/Battle.net/Battle.net.config"
        }
      },
      {
        "write_json": {
          "description": "Enabling Blizzard App to exit when pressing [X]",
          "data": {
            "User": {
              "Client": {
                "DisplayExitPrompt": "false",
                "HideOnClose": "false"
              }
            }
          },
          "file": "$GAMEDIR/drive_c/users/$USER/Application Data/Battle.net/dd961b77.config"
        }
      },
      {
        "task": {
          "prefix": "$GAMEDIR",
          "name": "winekill"
        }
      },
      {
        "task": {
          "description": "Installing Blizzard App\n------------------------------\nLet Lutris installer finish first. Log in afterwards.",
          "executable": "setup",
          "arch": "win64",
          "exclude_processes": "Battle.net.exe Agent.exe \"Battle.net Helper.exe\"",
          "name": "wineexec"
        }
      },
      {
        "task": {
          "prefix": "$GAMEDIR",
          "name": "winekill"
        }
      },
      {
        "task": {
          "prefix": "$GAMEDIR",
          "name": "set_regedit",
          "description": "Wine Staging: Enabling DXVA2",
          "path": "HKEY_CURRENT_USER\\Software\\Wine\\DXVA2",
          "value": "va",
          "key": "backend",
          "arch": "win64"
        }
      }
    ],
    "wine": {
      "overrides": {
        "nvapi,nvapi64": "disabled"
      },
      "dxvk": true,
      "version": "tkg-4.0-x86_64"
    }
  },
  "content": "files:\n- setup:\n    filename: Battle.net-Setup.exe\n    url: https://www.battle.net/download/getInstallerForGame?os=win&version=LIVE&gameProgram=BATTLENET_APP\ngame:\n  arch: win64\n  exe: drive_c/Program Files (x86)/Battle.net/Battle.net Launcher.exe\n  prefix: $GAMEDIR\ninstaller:\n- task:\n    arch: win64\n    description: Creating 64bit Wine prefix.\n    name: create_prefix\n    prefix: $GAMEDIR\n- task:\n    app: arial\n    arch: win64\n    description: Installing Arial font\n    name: winetricks\n    prefix: $GAMEDIR\n    silent: true\n- task:\n    arch: win64\n    description: Setting Windows 10 mode for Wine\n    key: Version\n    name: set_regedit\n    path: HKEY_CURRENT_USER\\Software\\Wine\n    prefix: $GAMEDIR\n    value: win10\n- execute:\n    command: unlink \"$GAMEDIR/drive_c/users/$USER/My Documents\"\n- write_json:\n    data:\n      Client:\n        DelayedExitAppOnLaunch: 'true'\n        GameLaunchWindowBehavior: '2'\n        GameSearch:\n          BackgroundSearch: 'true'\n        HardwareAcceleration: 'false'\n        Streaming:\n          StreamingEnabled: 'false'\n    description: Disabling Sound/Hardware Acceleration/Streaming in Blizzard App and\n      enabling background search for games.\n    file: $GAMEDIR/drive_c/users/$USER/Application Data/Battle.net/Battle.net.config\n- write_json:\n    data:\n      User:\n        Client:\n          DisplayExitPrompt: 'false'\n          HideOnClose: 'false'\n    description: Enabling Blizzard App to exit when pressing [X]\n    file: $GAMEDIR/drive_c/users/$USER/Application Data/Battle.net/dd961b77.config\n- task:\n    name: winekill\n    prefix: $GAMEDIR\n- task:\n    arch: win64\n    description: 'Installing Blizzard App\n\n      ------------------------------\n\n      Let Lutris installer finish first. Log in afterwards.'\n    exclude_processes: Battle.net.exe Agent.exe \"Battle.net Helper.exe\"\n    executable: setup\n    name: wineexec\n- task:\n    name: winekill\n    prefix: $GAMEDIR\n- task:\n    arch: win64\n    description: 'Wine Staging: Enabling DXVA2'\n    key: backend\n    name: set_regedit\n    path: HKEY_CURRENT_USER\\Software\\Wine\\DXVA2\n    prefix: $GAMEDIR\n    value: va\nsystem:\n  env:\n    DXVK_HUD: 0\n    __GL_SHADER_DISK_CACHE: 1\n    __GL_SHADER_DISK_CACHE_PATH: $GAMEDIR\n  exclude_processes: Agent.exe \"Battle.net Helper.exe\"\nwine:\n  dxvk: true\n  overrides:\n    nvapi,nvapi64: disabled\n  version: tkg-4.0-x86_64\n"
}