{
  "id": 7631,
  "game_id": 17548,
  "game_slug": "mirrors-edge-catalyst",
  "name": "Mirror's Edge: Catalyst",
  "year": 2016,
  "user": "cxf",
  "runner": "wine",
  "slug": "mirrors-edge-catalyst-dxvk",
  "version": "DXVK",
  "description": "Only sets up Origin and DXVK you'll need to download Mirror's Edge: Catalyst manually.",
  "notes": "Please read before installing: <a href=\"https://github.com/lutris/lutris/wiki/Game:-Origin\">https://github.com/lutris/lutris/wiki/Game:-Origin</a>",
  "created_at": "2018-03-23T19:05:33.615000Z",
  "updated_at": "2020-01-23T02:57:02.211985Z",
  "draft": false,
  "published": true,
  "published_by": 19464,
  "rating": "",
  "steamid": null,
  "gogid": null,
  "gogslug": "",
  "humblestoreid": "",
  "script": {
    "files": [
      {
        "client": "https://origin-a.akamaihd.net/Origin-Client-Download/origin/live/OriginThinSetup.exe"
      },
      {
        "updater": "https://raw.githubusercontent.com/DrDoctor13/wine-origin-updater/master/updateorigin.sh"
      }
    ],
    "installer": [
      {
        "task": {
          "arch": "win64",
          "description": "Creating Wine prefix",
          "prefix": "$GAMEDIR",
          "name": "create_prefix"
        }
      },
      {
        "write_file": {
          "content": "dxgi.customVendorId = 10de\ndxgi.nvapiHack = False",
          "file": "$GAMEDIR/dxvk.conf"
        }
      },
      {
        "task": {
          "arch": "win64",
          "app": "nocrashdialog win7",
          "prefix": "$GAMEDIR",
          "name": "winetricks"
        }
      },
      {
        "task": {
          "arch": "win64",
          "prefix": "$GAMEDIR",
          "name": "wineexec",
          "exclude_processes": "Origin.exe OriginClientService.exe OriginWebHelperService.exe QtWebEngineProcess.exe",
          "args": "/silent",
          "executable": "client",
          "description": "Installing Origin... Login window will pop-up and close."
        }
      },
      {
        "task": {
          "arch": "win64",
          "prefix": "$GAMEDIR",
          "name": "winekill"
        }
      },
      {
        "chmodx": "updater"
      },
      {
        "merge": {
          "src": "updater",
          "dst": "$GAMEDIR/drive_c/Program Files (x86)/Origin"
        }
      }
    ],
    "system": {
      "disable_runtime": false,
      "env": {
        "DXVK_CONFIG_FILE": "$GAMEDIR/dxvk.conf",
        "DXVK_HUD": 0
      }
    },
    "wine": {
      "overrides": {
        "nvapi,nvapi64": "disabled"
      },
      "dxvk": true
    },
    "game": {
      "arch": "win64",
      "prefix": "$GAMEDIR",
      "exe": "drive_c/Program Files (x86)/Origin/Origin.exe"
    }
  },
  "content": "files:\n- client: https://origin-a.akamaihd.net/Origin-Client-Download/origin/live/OriginThinSetup.exe\n- updater: https://raw.githubusercontent.com/DrDoctor13/wine-origin-updater/master/updateorigin.sh\ngame:\n  arch: win64\n  exe: drive_c/Program Files (x86)/Origin/Origin.exe\n  prefix: $GAMEDIR\ninstaller:\n- task:\n    arch: win64\n    description: Creating Wine prefix\n    name: create_prefix\n    prefix: $GAMEDIR\n- write_file:\n    content: 'dxgi.customVendorId = 10de\n\n      dxgi.nvapiHack = False'\n    file: $GAMEDIR/dxvk.conf\n- task:\n    app: nocrashdialog win7\n    arch: win64\n    name: winetricks\n    prefix: $GAMEDIR\n- task:\n    arch: win64\n    args: /silent\n    description: Installing Origin... Login window will pop-up and close.\n    exclude_processes: Origin.exe OriginClientService.exe OriginWebHelperService.exe\n      QtWebEngineProcess.exe\n    executable: client\n    name: wineexec\n    prefix: $GAMEDIR\n- task:\n    arch: win64\n    name: winekill\n    prefix: $GAMEDIR\n- chmodx: updater\n- merge:\n    dst: $GAMEDIR/drive_c/Program Files (x86)/Origin\n    src: updater\nsystem:\n  disable_runtime: false\n  env:\n    DXVK_CONFIG_FILE: $GAMEDIR/dxvk.conf\n    DXVK_HUD: 0\nwine:\n  dxvk: true\n  overrides:\n    nvapi,nvapi64: disabled\n"
}