{
  "id": 2693,
  "game_id": 732,
  "game_slug": "sword-of-the-stars-the-pit",
  "name": "Sword of the Stars: The Pit",
  "year": null,
  "user": "ssf",
  "runner": "wine",
  "slug": "sword-of-the-stars-the-pit-gogcom-gold-editon",
  "version": "GOG.com - Gold Editon",
  "description": "",
  "notes": "",
  "created_at": "2016-09-07T16:29:35.760885Z",
  "updated_at": "2016-09-26T17:18:06.829320Z",
  "draft": false,
  "published": true,
  "published_by": null,
  "rating": "",
  "steamid": 233700,
  "gogid": null,
  "gogslug": "",
  "humblestoreid": "",
  "script": {
    "files": [
      {
        "game": "N/A:Please select the GOG.com Windows installer."
      }
    ],
    "game": {
      "prefix": "$GAMEDIR",
      "arch": "win32",
      "exe": "drive_c/game/ThePit.exe"
    },
    "gogid": "sword_of_the_stars_the_pit_gold_edition",
    "installer": [
      {
        "task": {
          "description": "Creating Wine prefix",
          "name": "create_prefix",
          "prefix": "$GAMEDIR"
        }
      },
      {
        "task": {
          "name": "set_regedit",
          "key": "winemenubuilder.exe",
          "prefix": "$GAMEDIR",
          "path": "HKEY_CURRENT_USER\\Software\\Wine\\DllOverrides",
          "value": "",
          "type": "REG_SZ"
        }
      },
      {
        "task": {
          "silent": true,
          "description": "Installing...",
          "name": "winetricks",
          "app": "corefonts",
          "prefix": "$GAMEDIR"
        }
      },
      {
        "task": {
          "args": "/SP- /NOCANCEL /SUPPRESSMSGBOXES '/DIR=C:/game'",
          "name": "wineexec",
          "executable": "game",
          "description": "Installing...",
          "prefix": "$GAMEDIR"
        }
      },
      {
        "task": {
          "silent": true,
          "description": "Installing .net",
          "name": "winetricks",
          "app": "dotnet40",
          "prefix": "$GAMEDIR"
        }
      },
      {
        "task": {
          "silent": true,
          "description": "Installing xna",
          "name": "winetricks",
          "app": "xna40",
          "prefix": "$GAMEDIR"
        }
      },
      {
        "task": {
          "silent": true,
          "description": "Installing...",
          "name": "winetricks",
          "app": "xinput",
          "prefix": "$GAMEDIR"
        }
      },
      {
        "task": {
          "silent": true,
          "description": "Disabling unused WINE features",
          "name": "winetricks",
          "app": "sandbox",
          "prefix": "$GAMEDIR"
        }
      }
    ]
  },
  "content": "files:\n- game: N/A:Please select the GOG.com Windows installer.\ngame:\n  arch: win32\n  exe: drive_c/game/ThePit.exe\n  prefix: $GAMEDIR\ngogid: sword_of_the_stars_the_pit_gold_edition\ninstaller:\n- task:\n    description: Creating Wine prefix\n    name: create_prefix\n    prefix: $GAMEDIR\n- task:\n    key: winemenubuilder.exe\n    name: set_regedit\n    path: HKEY_CURRENT_USER\\Software\\Wine\\DllOverrides\n    prefix: $GAMEDIR\n    type: REG_SZ\n    value: ''\n- task:\n    app: corefonts\n    description: Installing...\n    name: winetricks\n    prefix: $GAMEDIR\n    silent: true\n- task:\n    args: /SP- /NOCANCEL /SUPPRESSMSGBOXES '/DIR=C:/game'\n    description: Installing...\n    executable: game\n    name: wineexec\n    prefix: $GAMEDIR\n- task:\n    app: dotnet40\n    description: Installing .net\n    name: winetricks\n    prefix: $GAMEDIR\n    silent: true\n- task:\n    app: xna40\n    description: Installing xna\n    name: winetricks\n    prefix: $GAMEDIR\n    silent: true\n- task:\n    app: xinput\n    description: Installing...\n    name: winetricks\n    prefix: $GAMEDIR\n    silent: true\n- task:\n    app: sandbox\n    description: Disabling unused WINE features\n    name: winetricks\n    prefix: $GAMEDIR\n    silent: true\n"
}