{
  "id": 12986,
  "game_id": 24361,
  "game_slug": "star-wars-battlefront-ii-2017",
  "name": "Star Wars Battlefront II (2017)",
  "year": 2017,
  "user": "nourez",
  "runner": "wine",
  "slug": "star-wars-battlefront-ii-2017-origin",
  "version": "Origin",
  "description": "Only sets up Origin and DXVK. You will need to download Battlefront II manually within Origin.",
  "notes": "Please read before installing: <a href=\"https://github.com/lutris/lutris/wiki/Game:-Origin\">https://github.com/lutris/lutris/wiki/Game:-Origin</a>\r\n\r\nIn order for mouse controls to work while in-game, the variable GstInput.MouseRawInput 1 must be changed to GstInput.MouseRawInput 0 within drive_c/users/$USER/My Documents/STAR WARS Battlefront II/settings/ProfileOptions_profile_synced\r\nMore information is available <a href=\"https://www.reddit.com/r/wine_gaming/comments/esgl76/how_to_get_star_wars_battlefront_ii2017_to_run_on/\">https://www.reddit.com/r/wine_gaming/comments/esgl76/how_to_get_star_wars_battlefront_ii2017_to_run_on/</a>. \r\n\r\nThere has also been success using Tk-Glitch's wine builds to fix mouse input. Releases are available at: <a href=\"https://github.com/Tk-Glitch/PKGBUILDS/releases\">https://github.com/Tk-Glitch/PKGBUILDS/releases</a>",
  "created_at": "2019-04-20T15:09:17.444000Z",
  "updated_at": "2020-01-31T16:17:43.278075Z",
  "draft": false,
  "published": true,
  "published_by": 20548,
  "rating": "1",
  "steamid": null,
  "gogid": null,
  "gogslug": "",
  "humblestoreid": "",
  "script": {
    "files": [
      {
        "client": "https://origin-a.akamaihd.net/Origin-Client-Download/origin/live/OriginThinSetup.exe"
      },
      {
        "updater": "https://raw.githubusercontent.com/DrDoctor13/wine-origin-updater/master/updateorigin.sh"
      }
    ],
    "installer": [
      {
        "task": {
          "description": "Creating Wine prefix",
          "name": "create_prefix",
          "arch": "win64",
          "prefix": "$GAMEDIR"
        }
      },
      {
        "execute": {
          "command": "mkdir \"$GAMEDIR/bfv-nv-shaders\""
        }
      },
      {
        "input_menu": {
          "options": [
            {
              "Not needed for AMD. Ignore this.": "AMD"
            },
            {
              "dxgi.customVendorId = 10DE dxgi.customDeviceId = 1C81 dxgi.nvapiHack = True": "Nvidia"
            }
          ],
          "description": "Setting DXVK workarounds please choose your GPU:",
          "preselect": "Not needed for AMD. Ignore this.",
          "id": "GPU"
        }
      },
      {
        "write_file": {
          "content": "$INPUT_GPU",
          "file": "$GAMEDIR/dxvk.conf"
        }
      },
      {
        "task": {
          "prefix": "$GAMEDIR",
          "name": "winetricks",
          "arch": "win64",
          "app": "nocrashdialog vcrun2017 win7"
        }
      },
      {
        "task": {
          "description": "Installing Origin... Login window will pop-up and close.",
          "name": "wineexec",
          "arch": "win64",
          "executable": "client",
          "args": "/silent",
          "prefix": "$GAMEDIR",
          "exclude_processes": "Origin.exe OriginClientService.exe OriginWebHelperService.exe QtWebEngineProcess.exe"
        }
      },
      {
        "task": {
          "prefix": "$GAMEDIR",
          "name": "winekill",
          "arch": "win64"
        }
      },
      {
        "chmodx": "updater"
      },
      {
        "merge": {
          "dst": "$GAMEDIR/drive_c/Program Files (x86)/Origin",
          "src": "updater"
        }
      }
    ],
    "game": {
      "prefix": "$GAMEDIR",
      "arch": "win64",
      "exe": "drive_c/Program Files (x86)/Origin/Origin.exe"
    },
    "system": {
      "disable_runtime": false,
      "env": {
        "DXVK_CONFIG_FILE": "$GAMEDIR/dxvk.conf",
        "DXVK_HUD": "fps"
      }
    },
    "wine": {
      "dxvk": true,
      "esync": true,
      "overrides": {
        "OriginThinSetupInternal.exe": "disabled",
        "nvapi,nvapi64": "disabled"
      }
    }
  },
  "content": "files:\n- client: https://origin-a.akamaihd.net/Origin-Client-Download/origin/live/OriginThinSetup.exe\n- updater: https://raw.githubusercontent.com/DrDoctor13/wine-origin-updater/master/updateorigin.sh\ngame:\n  arch: win64\n  exe: drive_c/Program Files (x86)/Origin/Origin.exe\n  prefix: $GAMEDIR\ninstaller:\n- task:\n    arch: win64\n    description: Creating Wine prefix\n    name: create_prefix\n    prefix: $GAMEDIR\n- execute:\n    command: mkdir \"$GAMEDIR/bfv-nv-shaders\"\n- input_menu:\n    description: 'Setting DXVK workarounds please choose your GPU:'\n    id: GPU\n    options:\n    - Not needed for AMD. Ignore this.: AMD\n    - dxgi.customVendorId = 10DE dxgi.customDeviceId = 1C81 dxgi.nvapiHack = True: Nvidia\n    preselect: Not needed for AMD. Ignore this.\n- write_file:\n    content: $INPUT_GPU\n    file: $GAMEDIR/dxvk.conf\n- task:\n    app: nocrashdialog vcrun2017 win7\n    arch: win64\n    name: winetricks\n    prefix: $GAMEDIR\n- task:\n    arch: win64\n    args: /silent\n    description: Installing Origin... Login window will pop-up and close.\n    exclude_processes: Origin.exe OriginClientService.exe OriginWebHelperService.exe\n      QtWebEngineProcess.exe\n    executable: client\n    name: wineexec\n    prefix: $GAMEDIR\n- task:\n    arch: win64\n    name: winekill\n    prefix: $GAMEDIR\n- chmodx: updater\n- merge:\n    dst: $GAMEDIR/drive_c/Program Files (x86)/Origin\n    src: updater\nsystem:\n  disable_runtime: false\n  env:\n    DXVK_CONFIG_FILE: $GAMEDIR/dxvk.conf\n    DXVK_HUD: fps\nwine:\n  dxvk: true\n  esync: true\n  overrides:\n    OriginThinSetupInternal.exe: disabled\n    nvapi,nvapi64: disabled\n"
}