{
  "id": 2487,
  "game_id": 2258,
  "game_slug": "desperados-wanted-dead-or-alive",
  "name": "Desperados - Wanted Dead or Alive",
  "year": 2001,
  "user": "ssf",
  "runner": "wine",
  "slug": "desperados-wanted-dead-or-ali-gogcom",
  "version": "GOG.com",
  "description": "",
  "notes": "",
  "created_at": "2016-08-17T20:56:03.764886Z",
  "updated_at": "2016-09-30T21:06:07.942349Z",
  "draft": false,
  "published": true,
  "published_by": null,
  "rating": "",
  "steamid": 260730,
  "gogid": 1207658926,
  "gogslug": "desperados_wanted_dead_or_alive",
  "humblestoreid": "",
  "script": {
    "installer": [
      {
        "task": {
          "description": "Creating Wine prefix",
          "prefix": "$GAMEDIR",
          "name": "create_prefix"
        }
      },
      {
        "task": {
          "prefix": "$GAMEDIR",
          "value": "",
          "key": "winemenubuilder.exe",
          "name": "set_regedit",
          "type": "REG_SZ",
          "path": "HKEY_CURRENT_USER\\Software\\Wine\\DllOverrides"
        }
      },
      {
        "task": {
          "silent": true,
          "app": "ddr=gdi",
          "prefix": "$GAMEDIR",
          "name": "winetricks"
        }
      },
      {
        "task": {
          "silent": true,
          "app": "glsl=disabled",
          "prefix": "$GAMEDIR",
          "name": "winetricks"
        }
      },
      {
        "task": {
          "silent": true,
          "app": "multisampling=disabled",
          "prefix": "$GAMEDIR",
          "name": "winetricks"
        }
      },
      {
        "task": {
          "args": "/VERYSILENT /SP- /NOCANCEL /SUPPRESSMSGBOXES",
          "executable": "game",
          "description": "Installing...",
          "prefix": "$GAMEDIR",
          "name": "wineexec"
        }
      },
      {
        "task": {
          "silent": true,
          "description": "Disabling unused WINE features",
          "app": "sandbox",
          "prefix": "$GAMEDIR",
          "name": "winetricks"
        }
      }
    ],
    "files": [
      {
        "game": "N/A:Please select the GOG.com Windows installer."
      }
    ],
    "gogid": "desperados_wanted_dead_or_alive",
    "game": {
      "arch": "win32",
      "prefix": "$GAMEDIR",
      "exe": "drive_c/GOG Games/Desperados Wanted Dead or Alive/Desperados.exe"
    }
  },
  "content": "files:\n- game: N/A:Please select the GOG.com Windows installer.\ngame:\n  arch: win32\n  exe: drive_c/GOG Games/Desperados Wanted Dead or Alive/Desperados.exe\n  prefix: $GAMEDIR\ngogid: desperados_wanted_dead_or_alive\ninstaller:\n- task:\n    description: Creating Wine prefix\n    name: create_prefix\n    prefix: $GAMEDIR\n- task:\n    key: winemenubuilder.exe\n    name: set_regedit\n    path: HKEY_CURRENT_USER\\Software\\Wine\\DllOverrides\n    prefix: $GAMEDIR\n    type: REG_SZ\n    value: ''\n- task:\n    app: ddr=gdi\n    name: winetricks\n    prefix: $GAMEDIR\n    silent: true\n- task:\n    app: glsl=disabled\n    name: winetricks\n    prefix: $GAMEDIR\n    silent: true\n- task:\n    app: multisampling=disabled\n    name: winetricks\n    prefix: $GAMEDIR\n    silent: true\n- task:\n    args: /VERYSILENT /SP- /NOCANCEL /SUPPRESSMSGBOXES\n    description: Installing...\n    executable: game\n    name: wineexec\n    prefix: $GAMEDIR\n- task:\n    app: sandbox\n    description: Disabling unused WINE features\n    name: winetricks\n    prefix: $GAMEDIR\n    silent: true\n"
}