{
  "id": 6720,
  "game_id": 8148,
  "game_slug": "dead-by-daylight",
  "name": "Dead by Daylight",
  "year": null,
  "user": "Kuro",
  "runner": "winesteam",
  "slug": "dead-by-daylight-steam-w-dxvk",
  "version": "Steam w/ DXVK",
  "description": null,
  "notes": "",
  "created_at": "2017-12-18T02:07:28.758000Z",
  "updated_at": "2019-02-14T05:40:52.218766Z",
  "draft": false,
  "published": true,
  "published_by": 19464,
  "rating": "1",
  "steamid": 381210,
  "gogid": null,
  "gogslug": "",
  "humblestoreid": "",
  "script": {
    "system": {
      "env": {
        "DXVK_HUD": 0
      }
    },
    "winesteam": {
      "overrides": {
        "xaudio2_7": "native,builtin"
      },
      "dxvk": true,
      "version": "tkg-4.0-x86_64"
    },
    "game": {
      "arch": "win64",
      "prefix": "$GAMEDIR/prefix",
      "appid": 381210
    },
    "installer": [
      {
        "task": {
          "arch": "win64",
          "prefix": "$GAMEDIR/prefix",
          "description": "Creating Wine Prefix",
          "name": "create_prefix"
        }
      },
      {
        "task": {
          "arch": "win64",
          "prefix": "$GAMEDIR/prefix",
          "description": "Installing Visual C++ 2010",
          "name": "winetricks",
          "app": "vcrun2010"
        }
      },
      {
        "task": {
          "arch": "win64",
          "prefix": "$GAMEDIR/prefix",
          "description": "Installing Visual C++ 2013",
          "name": "winetricks",
          "app": "vcrun2013"
        }
      },
      {
        "task": {
          "arch": "win64",
          "prefix": "$GAMEDIR/prefix",
          "description": "Installing Visual C++ 2015",
          "name": "winetricks",
          "app": "vcrun2013"
        }
      },
      {
        "task": {
          "arch": "win64",
          "prefix": "$GAMEDIR/prefix",
          "description": "Installing .NET 4.7.2",
          "name": "winetricks",
          "app": "dotnet472"
        }
      },
      {
        "task": {
          "arch": "win64",
          "prefix": "$GAMEDIR/prefix",
          "description": "Switching to Windows 7",
          "name": "winetricks",
          "app": "win7"
        }
      }
    ]
  },
  "content": "game:\n  appid: 381210\n  arch: win64\n  prefix: $GAMEDIR/prefix\ninstaller:\n- task:\n    arch: win64\n    description: Creating Wine Prefix\n    name: create_prefix\n    prefix: $GAMEDIR/prefix\n- task:\n    app: vcrun2010\n    arch: win64\n    description: Installing Visual C++ 2010\n    name: winetricks\n    prefix: $GAMEDIR/prefix\n- task:\n    app: vcrun2013\n    arch: win64\n    description: Installing Visual C++ 2013\n    name: winetricks\n    prefix: $GAMEDIR/prefix\n- task:\n    app: vcrun2013\n    arch: win64\n    description: Installing Visual C++ 2015\n    name: winetricks\n    prefix: $GAMEDIR/prefix\n- task:\n    app: dotnet472\n    arch: win64\n    description: Installing .NET 4.7.2\n    name: winetricks\n    prefix: $GAMEDIR/prefix\n- task:\n    app: win7\n    arch: win64\n    description: Switching to Windows 7\n    name: winetricks\n    prefix: $GAMEDIR/prefix\nsystem:\n  env:\n    DXVK_HUD: 0\nwinesteam:\n  dxvk: true\n  overrides:\n    xaudio2_7: native,builtin\n  version: tkg-4.0-x86_64\n"
}