{
  "id": 7588,
  "game_id": 10381,
  "game_slug": "nierautomata",
  "name": "NieR:Automataâ„¢",
  "year": 2017,
  "user": "cxf",
  "runner": "winesteam",
  "slug": "nierautomatatm-dxvk",
  "version": "DXVK",
  "description": null,
  "notes": "",
  "created_at": "2018-03-17T22:38:08.753000Z",
  "updated_at": "2019-02-09T22:48:42.625158Z",
  "draft": false,
  "published": true,
  "published_by": 19464,
  "rating": "5",
  "steamid": 524220,
  "gogid": null,
  "gogslug": "",
  "humblestoreid": "",
  "script": {
    "system": {
      "pulse_latency": true,
      "env": {
        "RADV_DEBUG": "nohiz",
        "DXVK_HUD": 0
      }
    },
    "winesteam": {
      "overrides": {
        "xaudio2_7": "native,builtin"
      },
      "dxvk": true,
      "version": "tkg-protonified-3.21-x86_64"
    },
    "game": {
      "arch": "win64",
      "prefix": "$GAMEDIR/prefix",
      "appid": 524220
    },
    "installer": [
      {
        "task": {
          "arch": "win64",
          "prefix": "$GAMEDIR/prefix",
          "name": "create_prefix"
        }
      },
      {
        "task": {
          "prefix": "$GAMEDIR/prefix",
          "name": "winetricks",
          "app": "directx9"
        }
      },
      {
        "task": {
          "prefix": "$GAMEDIR/prefix",
          "name": "winetricks",
          "app": "vcrun2013"
        }
      },
      {
        "task": {
          "prefix": "$GAMEDIR/prefix",
          "name": "winetricks",
          "app": "vcrun2015"
        }
      },
      {
        "task": {
          "prefix": "$GAMEDIR/prefix",
          "name": "winetricks",
          "app": "vcrun2017"
        }
      },
      {
        "task": {
          "prefix": "$GAMEDIR/prefix",
          "name": "winetricks",
          "app": "win7"
        }
      }
    ]
  },
  "content": "game:\n  appid: 524220\n  arch: win64\n  prefix: $GAMEDIR/prefix\ninstaller:\n- task:\n    arch: win64\n    name: create_prefix\n    prefix: $GAMEDIR/prefix\n- task:\n    app: directx9\n    name: winetricks\n    prefix: $GAMEDIR/prefix\n- task:\n    app: vcrun2013\n    name: winetricks\n    prefix: $GAMEDIR/prefix\n- task:\n    app: vcrun2015\n    name: winetricks\n    prefix: $GAMEDIR/prefix\n- task:\n    app: vcrun2017\n    name: winetricks\n    prefix: $GAMEDIR/prefix\n- task:\n    app: win7\n    name: winetricks\n    prefix: $GAMEDIR/prefix\nsystem:\n  env:\n    DXVK_HUD: 0\n    RADV_DEBUG: nohiz\n  pulse_latency: true\nwinesteam:\n  dxvk: true\n  overrides:\n    xaudio2_7: native,builtin\n  version: tkg-protonified-3.21-x86_64\n"
}