{
  "id": 2768,
  "game_id": 6709,
  "game_slug": "maniac-mansion-deluxe",
  "name": "Maniac Mansion Deluxe",
  "year": 2004,
  "user": "strider",
  "runner": "ags",
  "slug": "maniac-mansion-deluxe-any-maniac-mansion-d",
  "version": "any Maniac Mansion deluxe PC",
  "description": "This script will install any \"Maniac Manson Deluxe\" PC version.\r\nBig thanks to people who gave their time to permit us playing this game in the best conditions.",
  "notes": "- You have to download and extract \"Maniac Mansion Deluxe\" game archive before to launch this script installer. Then the script installer will ask you for path where maniac.exe file stored.\r\n- Press F5 for save/load/quit... menu.\r\n- No midi music on Linux for the moment (AGS bug)\r\n- Please report issue concerning this script on my Github page:\r\nhttps://github.com/legluondunet/MyLittleLutrisScripts/",
  "created_at": "2016-09-22T21:00:12.148000Z",
  "updated_at": "2020-01-24T11:36:05.148808Z",
  "draft": false,
  "published": true,
  "published_by": 494,
  "rating": "",
  "steamid": null,
  "gogid": null,
  "gogslug": "",
  "humbleid": "",
  "humblestoreid": "",
  "humblestoreid_real": "",
  "script": {
    "ags": {
      "fullscreen": false
    },
    "custom-name": "Maniac Mansion Deluxe - AGS",
    "game": {
      "main_file": "$GAMEDIR/Maniac.exe"
    },
    "installer": [
      {
        "insert-disc": {
          "description": "Choose your preferred game's language:",
          "requires": "Maniac.exe"
        }
      },
      {
        "merge": {
          "dst": "$GAMEDIR",
          "src": "$DISC"
        }
      },
      {
        "input_menu": {
          "description": "Choose your preferred game's language:",
          "id": "LANG",
          "options": [
            {
              "English": "English"
            },
            {
              "French": "French"
            },
            {
              "Portuguese": "Portuguese"
            },
            {
              "Spanish": "Spanish"
            },
            {
              "German": "German"
            },
            {
              "Norwegian": "Norwegian"
            },
            {
              "Russian": "Russian"
            },
            {
              "Hungarian": "Hungarian"
            },
            {
              "Finnish": "Finnish"
            },
            {
              "Brazilian": "Brazilian"
            },
            {
              "Dutch": "Dutch"
            },
            {
              "Esperanto": "Esperato"
            },
            {
              "Italian": "Italian"
            },
            {
              "Maltese": "Maltese"
            }
          ],
          "preselect": "English"
        }
      },
      {
        "write_config": {
          "data": {
            "graphics": {
              "windowed": 1
            },
            "language": {
              "translation": "$INPUT_LANG"
            }
          },
          "file": "$GAMEDIR/acsetup.cfg"
        }
      }
    ]
  },
  "content": "ags:\n  fullscreen: false\ncustom-name: Maniac Mansion Deluxe - AGS\ngame:\n  main_file: $GAMEDIR/Maniac.exe\ninstaller:\n- insert-disc:\n    description: 'Choose your preferred game''s language:'\n    requires: Maniac.exe\n- merge:\n    dst: $GAMEDIR\n    src: $DISC\n- input_menu:\n    description: 'Choose your preferred game''s language:'\n    id: LANG\n    options:\n    - English: English\n    - French: French\n    - Portuguese: Portuguese\n    - Spanish: Spanish\n    - German: German\n    - Norwegian: Norwegian\n    - Russian: Russian\n    - Hungarian: Hungarian\n    - Finnish: Finnish\n    - Brazilian: Brazilian\n    - Dutch: Dutch\n    - Esperanto: Esperato\n    - Italian: Italian\n    - Maltese: Maltese\n    preselect: English\n- write_config:\n    data:\n      graphics:\n        windowed: 1\n      language:\n        translation: $INPUT_LANG\n    file: $GAMEDIR/acsetup.cfg\n"
}