{
  "id": 2385,
  "game_id": 6709,
  "game_slug": "maniac-mansion-deluxe",
  "name": "Maniac Mansion Deluxe",
  "year": 2004,
  "user": "ssf",
  "runner": "wine",
  "slug": "maniac-mansion-deluxe-14",
  "version": "1.4",
  "description": "to hear all Music, you need proper MIDI support(eg: timidity++)",
  "notes": "",
  "created_at": "2016-08-05T01:01:20.766217Z",
  "updated_at": "2018-05-19T03:41:49.113209Z",
  "draft": false,
  "published": true,
  "published_by": null,
  "rating": "",
  "steamid": null,
  "gogid": null,
  "gogslug": "",
  "humblestoreid": "",
  "script": {
    "game": {
      "prefix": "$GAMEDIR",
      "arch": "win32"
    },
    "files": [
      {
        "game": "http://www.adventurecorner.de/dl/mmd14setup.exe",
        "exe": "drive_c/Program Files/LucasFan Games/MMD/winsetup.exe",
        "arch": "win32",
        "prefix": "$GAMEDIR"
      }
    ],
    "installer": [
      {
        "task": {
          "description": "Creating Wine prefix",
          "prefix": "$GAMEDIR",
          "name": "create_prefix"
        }
      },
      {
        "task": {
          "prefix": "$GAMEDIR",
          "name": "set_regedit",
          "path": "HKEY_CURRENT_USER\\Software\\Wine\\DllOverrides",
          "value": "",
          "key": "winemenubuilder.exe",
          "type": "REG_SZ"
        }
      },
      {
        "task": {
          "silent": false,
          "prefix": "$GAMEDIR",
          "app": "sound=alsa",
          "name": "winetricks"
        }
      },
      {
        "task": {
          "silent": false,
          "prefix": "$GAMEDIR",
          "app": "vd=640x480",
          "name": "winetricks"
        }
      },
      {
        "task": {
          "description": "Installing MMD",
          "prefix": "$GAMEDIR",
          "executable": "game",
          "name": "wineexec"
        }
      },
      {
        "task": {
          "description": "Disabling unused WINE features",
          "silent": true,
          "prefix": "$GAMEDIR",
          "app": "sandbox",
          "name": "winetricks"
        }
      }
    ]
  },
  "content": "files:\n- arch: win32\n  exe: drive_c/Program Files/LucasFan Games/MMD/winsetup.exe\n  game: http://www.adventurecorner.de/dl/mmd14setup.exe\n  prefix: $GAMEDIR\ngame:\n  arch: win32\n  prefix: $GAMEDIR\ninstaller:\n- task:\n    description: Creating Wine prefix\n    name: create_prefix\n    prefix: $GAMEDIR\n- task:\n    key: winemenubuilder.exe\n    name: set_regedit\n    path: HKEY_CURRENT_USER\\Software\\Wine\\DllOverrides\n    prefix: $GAMEDIR\n    type: REG_SZ\n    value: ''\n- task:\n    app: sound=alsa\n    name: winetricks\n    prefix: $GAMEDIR\n    silent: false\n- task:\n    app: vd=640x480\n    name: winetricks\n    prefix: $GAMEDIR\n    silent: false\n- task:\n    description: Installing MMD\n    executable: game\n    name: wineexec\n    prefix: $GAMEDIR\n- task:\n    app: sandbox\n    description: Disabling unused WINE features\n    name: winetricks\n    prefix: $GAMEDIR\n    silent: true\n"
}