{
  "id": 13639,
  "game_id": 5491,
  "game_slug": "simcity-2000-special-edition",
  "name": "SimCity 2000: Special Edition",
  "year": 1995,
  "user": "rregeer",
  "runner": "dosbox",
  "slug": "simcity-2000-special-edition-gogcom",
  "version": "GOG.com",
  "description": "Will use the Windows installer from GOG.com. This installer will change the DOSBox settings to have the best available performance. The installer will also create the sim city configuration for you so sound and music will work out of the box.",
  "notes": "",
  "created_at": "2019-05-20T10:03:30.718662Z",
  "updated_at": "2019-05-20T10:03:30.718687Z",
  "draft": false,
  "published": false,
  "published_by": null,
  "rating": "",
  "steamid": null,
  "gogid": null,
  "gogslug": "",
  "humblestoreid": "",
  "script": {
    "game": {
      "main_file": "$GAMEDIR/dosboxSC2000_single.conf",
      "game_id": "simcity-2000-special-edition",
      "config_file": "$GAMEDIR/dosboxSC2000.conf"
    },
    "installer": [
      {
        "extract": {
          "file": "$fileextract",
          "dst": "$CACHE",
          "description": "Extracting innoextract application"
        }
      },
      {
        "execute": {
          "file": "$CACHE/innoextract",
          "description": "Extracting game data",
          "args": "-d \"$CACHE/game\" \"$installer\""
        }
      },
      {
        "merge": {
          "dst": "$GAMEDIR",
          "src": "$CACHE/game"
        }
      },
      {
        "move": {
          "dst": "$GAMEDIR",
          "src": "$GAMEDIR/__support/app/dosboxSC2000.conf"
        }
      },
      {
        "write_config": {
          "file": "$GAMEDIR/dosboxSC2000.conf",
          "value": "opengl",
          "key": "output",
          "section": "sdl"
        }
      },
      {
        "write_config": {
          "file": "$GAMEDIR/dosboxSC2000.conf",
          "value": true,
          "key": "fulldouble",
          "section": "sdl"
        }
      },
      {
        "write_config": {
          "file": "$GAMEDIR/dosboxSC2000.conf",
          "value": "desktop",
          "key": "fullresolution",
          "section": "sdl"
        }
      },
      {
        "write_config": {
          "file": "$GAMEDIR/dosboxSC2000.conf",
          "value": true,
          "key": "aspect",
          "section": "render"
        }
      },
      {
        "write_config": {
          "file": "$GAMEDIR/dosboxSC2000.conf",
          "value": "normal2x",
          "key": "scaler",
          "section": "render"
        }
      },
      {
        "write_file": {
          "content": "[ipx] ipx=false\n[autoexec]\nmount c .\nc:\nimgmount d SC2000SE.DAT -t iso -fs iso\nLOADFIX -1 SC2K %1\nexit\n",
          "file": "$GAMEDIR/dosboxSC2000_single.conf"
        }
      },
      {
        "write_config": {
          "file": "$GAMEDIR/SC2000.CFG",
          "value": "Sound Blaster 16",
          "key": "MUSICNAME",
          "section": "Music"
        }
      },
      {
        "write_config": {
          "file": "$GAMEDIR/SC2000.CFG",
          "value": "A32SP2FM.DLL",
          "key": "MUSICDRIVER",
          "section": "Music"
        }
      },
      {
        "write_config": {
          "file": "$GAMEDIR/SC2000.CFG",
          "value": 220,
          "key": "MUSICADDRESS",
          "section": "Music"
        }
      },
      {
        "write_config": {
          "file": "$GAMEDIR/SC2000.CFG",
          "value": 5,
          "key": "MUSICIRQ",
          "section": "Music"
        }
      },
      {
        "write_config": {
          "file": "$GAMEDIR/SC2000.CFG",
          "value": 1,
          "key": "MUSICDMA",
          "section": "Music"
        }
      }
    ],
    "files": [
      {
        "installer": "N/A:Select the GOG.com game setup file. Download it here: \nhttps://www.gog.com/downloads/simcity_2000_special_edition/en1installer0\n"
      },
      {
        "fileextract": "https://lutris.nyc3.digitaloceanspaces.com/tools/innoextract/innoextract-1.8-dev-2019-01-13-linux.tar.xz"
      }
    ]
  },
  "content": "files:\n- installer: \"N/A:Select the GOG.com game setup file. Download it here: \\nhttps://www.gog.com/downloads/simcity_2000_special_edition/en1installer0\\n\"\n- fileextract: https://lutris.nyc3.digitaloceanspaces.com/tools/innoextract/innoextract-1.8-dev-2019-01-13-linux.tar.xz\ngame:\n  config_file: $GAMEDIR/dosboxSC2000.conf\n  game_id: simcity-2000-special-edition\n  main_file: $GAMEDIR/dosboxSC2000_single.conf\ninstaller:\n- extract:\n    description: Extracting innoextract application\n    dst: $CACHE\n    file: $fileextract\n- execute:\n    args: -d \"$CACHE/game\" \"$installer\"\n    description: Extracting game data\n    file: $CACHE/innoextract\n- merge:\n    dst: $GAMEDIR\n    src: $CACHE/game\n- move:\n    dst: $GAMEDIR\n    src: $GAMEDIR/__support/app/dosboxSC2000.conf\n- write_config:\n    file: $GAMEDIR/dosboxSC2000.conf\n    key: output\n    section: sdl\n    value: opengl\n- write_config:\n    file: $GAMEDIR/dosboxSC2000.conf\n    key: fulldouble\n    section: sdl\n    value: true\n- write_config:\n    file: $GAMEDIR/dosboxSC2000.conf\n    key: fullresolution\n    section: sdl\n    value: desktop\n- write_config:\n    file: $GAMEDIR/dosboxSC2000.conf\n    key: aspect\n    section: render\n    value: true\n- write_config:\n    file: $GAMEDIR/dosboxSC2000.conf\n    key: scaler\n    section: render\n    value: normal2x\n- write_file:\n    content: '[ipx] ipx=false\n\n      [autoexec]\n\n      mount c .\n\n      c:\n\n      imgmount d SC2000SE.DAT -t iso -fs iso\n\n      LOADFIX -1 SC2K %1\n\n      exit\n\n      '\n    file: $GAMEDIR/dosboxSC2000_single.conf\n- write_config:\n    file: $GAMEDIR/SC2000.CFG\n    key: MUSICNAME\n    section: Music\n    value: Sound Blaster 16\n- write_config:\n    file: $GAMEDIR/SC2000.CFG\n    key: MUSICDRIVER\n    section: Music\n    value: A32SP2FM.DLL\n- write_config:\n    file: $GAMEDIR/SC2000.CFG\n    key: MUSICADDRESS\n    section: Music\n    value: 220\n- write_config:\n    file: $GAMEDIR/SC2000.CFG\n    key: MUSICIRQ\n    section: Music\n    value: 5\n- write_config:\n    file: $GAMEDIR/SC2000.CFG\n    key: MUSICDMA\n    section: Music\n    value: 1\n"
}