{
  "id": 10995,
  "game_id": 1072,
  "game_slug": "everquest-ii",
  "name": "EverQuest II",
  "year": 2004,
  "user": "Epaphus",
  "runner": "wine",
  "slug": "everquest-ii-standalone",
  "version": "Standalone",
  "description": null,
  "notes": "",
  "created_at": "2018-11-26T16:40:43.746000Z",
  "updated_at": "2019-10-28T20:57:32.016543Z",
  "draft": false,
  "published": true,
  "published_by": 51687,
  "rating": "",
  "steamid": 201230,
  "gogid": null,
  "gogslug": "",
  "humblestoreid": "",
  "script": {
    "files": [
      {
        "setup": "https://launch.daybreakgames.com/installer/EQ2_setup.exe"
      }
    ],
    "game": {
      "prefix": "$GAMEDIR",
      "exe": "/drive_c/users/Public/Daybreak Game Company/Installed Games/EverQuest II/LaunchPad.exe"
    },
    "installer": [
      {
        "task": {
          "prefix": "$GAMEDIR",
          "name": "create_prefix",
          "description": "Creating Wine prefix"
        }
      },
      {
        "task": {
          "prefix": "$GAMEDIR",
          "arch": "win64",
          "app": "win7",
          "name": "winetricks"
        }
      },
      {
        "task": {
          "prefix": "$GAMEDIR",
          "description": "Installing Corefonts",
          "app": "corefonts",
          "silent": true,
          "name": "winetricks"
        }
      },
      {
        "task": {
          "prefix": "$GAMEDIR",
          "executable": "wineboot",
          "name": "wineexec",
          "description": "Simulating Windows reboot."
        }
      },
      {
        "task": {
          "prefix": "$GAMEDIR",
          "executable": "setup",
          "name": "wine.wineexec",
          "description": "Installing EverQuest 2"
        }
      }
    ]
  },
  "content": "files:\n- setup: https://launch.daybreakgames.com/installer/EQ2_setup.exe\ngame:\n  exe: /drive_c/users/Public/Daybreak Game Company/Installed Games/EverQuest II/LaunchPad.exe\n  prefix: $GAMEDIR\ninstaller:\n- task:\n    description: Creating Wine prefix\n    name: create_prefix\n    prefix: $GAMEDIR\n- task:\n    app: win7\n    arch: win64\n    name: winetricks\n    prefix: $GAMEDIR\n- task:\n    app: corefonts\n    description: Installing Corefonts\n    name: winetricks\n    prefix: $GAMEDIR\n    silent: true\n- task:\n    description: Simulating Windows reboot.\n    executable: wineboot\n    name: wineexec\n    prefix: $GAMEDIR\n- task:\n    description: Installing EverQuest 2\n    executable: setup\n    name: wine.wineexec\n    prefix: $GAMEDIR\n"
}