{
  "id": 18362,
  "game_id": 17988,
  "game_slug": "magic-the-gathering-arena",
  "name": "Magic: The Gathering Arena",
  "year": 2017,
  "user": "BiteMe6223",
  "runner": "wine",
  "slug": "magic-the-gathering-arena-012133772345-install",
  "version": "0.1.2133.772345 Installer",
  "description": "MTG update 2020-03-26  Fresh Install",
  "notes": "Wizards bricked us again.",
  "created_at": "2020-02-14T05:44:32.947000Z",
  "updated_at": "2020-03-28T18:18:12.683418Z",
  "draft": false,
  "published": true,
  "published_by": 1,
  "rating": "",
  "steamid": null,
  "gogid": null,
  "gogslug": "",
  "humblestoreid": "",
  "script": {
    "installer": [
      {
        "task": {
          "arch": "win32",
          "description": "Creating Wine prefix",
          "prefix": "$GAMEDIR",
          "name": "create_prefix"
        }
      },
      {
        "task": {
          "prefix": "$GAMEDIR",
          "value": "Y",
          "arch": "win32",
          "key": "GrabFullscreen",
          "name": "set_regedit",
          "path": "HKEY_CURRENT_USER\\Software\\Wine\\X11 Driver"
        }
      },
      {
        "task": {
          "prefix": "$GAMEDIR",
          "value": "N",
          "arch": "win32",
          "key": "UseTakeFocus",
          "name": "set_regedit",
          "path": "HKEY_CURRENT_USER\\Software\\Wine\\X11 Driver"
        }
      },
      {
        "task": {
          "arch": "win32",
          "description": "Installing .NET 4.7.2. This will take a while...",
          "app": "dotnet472",
          "prefix": "$GAMEDIR",
          "name": "winetricks"
        }
      },
      {
        "task": {
          "arch": "win32",
          "app": "xact arial win10",
          "prefix": "$GAMEDIR",
          "name": "winetricks"
        }
      },
      {
        "task": {
          "prefix": "$GAMEDIR",
          "name": "winekill"
        }
      },
      {
        "copy": {
          "src": "setup",
          "dst": "$CACHE/mtg-arena/"
        }
      },
      {
        "task": {
          "arch": "win32",
          "prefix": "$GAMEDIR",
          "name": "wineexec",
          "exclude_processes": "mscorsvw.exe rundll32.exe MTGA.exe UnityCrashHandler32.exe",
          "args": "/i \"$CACHE/mtg-arena/MTGAInstaller_0.1.2133.772345.msi\" /q",
          "executable": "msiexec",
          "description": "Installing Magic the Gathering Arena"
        }
      },
      {
        "task": {
          "prefix": "$GAMEDIR",
          "name": "winekill"
        }
      }
    ],
    "files": [
      {
        "setup": "https://mtgarena.downloads.wizards.com/Live/Windows32/versions/2133.772345/MTGAInstaller_0.1.2133.772345.msi"
      }
    ],
    "wine": {
      "version": "lutris-mtga-4.21-x86_64"
    },
    "game": {
      "arch": "win32",
      "prefix": "$GAMEDIR",
      "exe": "drive_c/Program Files/Wizards of the Coast/MTGA/MTGA.exe"
    }
  },
  "content": "files:\r\n- setup: https://mtgarena.downloads.wizards.com/Live/Windows32/versions/2133.772345/MTGAInstaller_0.1.2133.772345.msi\r\ngame:\r\n  arch: win32\r\n  exe: drive_c/Program Files/Wizards of the Coast/MTGA/MTGA.exe\r\n  prefix: $GAMEDIR\r\ninstaller:\r\n- task:\r\n    arch: win32\r\n    description: Creating Wine prefix\r\n    name: create_prefix\r\n    prefix: $GAMEDIR\r\n- task:\r\n    arch: win32\r\n    key: GrabFullscreen\r\n    name: set_regedit\r\n    path: HKEY_CURRENT_USER\\Software\\Wine\\X11 Driver\r\n    prefix: $GAMEDIR\r\n    value: Y\r\n- task:\r\n    arch: win32\r\n    key: UseTakeFocus\r\n    name: set_regedit\r\n    path: HKEY_CURRENT_USER\\Software\\Wine\\X11 Driver\r\n    prefix: $GAMEDIR\r\n    value: N\r\n- task:\r\n    app: dotnet472\r\n    arch: win32\r\n    description: Installing .NET 4.7.2. This will take a while...\r\n    name: winetricks\r\n    prefix: $GAMEDIR\r\n- task:\r\n    app: xact arial win10\r\n    arch: win32\r\n    name: winetricks\r\n    prefix: $GAMEDIR\r\n- task:\r\n    name: winekill\r\n    prefix: $GAMEDIR\r\n- copy:\r\n    dst: $CACHE/mtg-arena/\r\n    src: setup\r\n- task:\r\n    arch: win32\r\n    args: /i \"$CACHE/mtg-arena/MTGAInstaller_0.1.2133.772345.msi\" /q\r\n    description: Installing Magic the Gathering Arena\r\n    exclude_processes: mscorsvw.exe rundll32.exe MTGA.exe UnityCrashHandler32.exe\r\n    executable: msiexec\r\n    name: wineexec\r\n    prefix: $GAMEDIR\r\n- task:\r\n    name: winekill\r\n    prefix: $GAMEDIR\r\nwine:\r\n  Desktop: true\r\n  esync: true\r\nwine:\r\n  version: lutris-mtga-4.21-x86_64"
}