{
  "id": 8306,
  "game_id": 17988,
  "game_slug": "magic-the-gathering-arena",
  "name": "Magic: The Gathering - Arena",
  "year": 2017,
  "user": "alexsim92",
  "runner": "wine",
  "slug": "magic-the-gathering-arena-latest",
  "version": "Latest",
  "description": null,
  "notes": "Known issues: <a href=\"https://forums.mtgarena.com/forums/threads/37048\">https://forums.mtgarena.com/forums/threads/37048</a>\r\n\r\nMTGA Pro Tracker does not work.",
  "created_at": "2018-05-16T21:55:30.514000Z",
  "updated_at": "2019-08-15T19:22:22.748957Z",
  "draft": false,
  "published": true,
  "published_by": 51687,
  "rating": "4",
  "steamid": null,
  "gogid": null,
  "gogslug": "",
  "humblestoreid": "",
  "script": {
    "game": {
      "exe": "drive_c/Program Files/Wizards of the Coast/MTGA/MTGA.exe",
      "arch": "win32",
      "prefix": "$GAMEDIR"
    },
    "files": [
      {
        "setup": "https://mtgarena.downloads.wizards.com/Live/Windows32/versions/1622.721726/MTGAInstaller_0.1.1622.721726.msi"
      }
    ],
    "wine": {
      "Desktop": true,
      "esync": true,
      "version": "tkg-unity-4.1-x86_64"
    },
    "installer": [
      {
        "task": {
          "description": "Creating Wine prefix",
          "prefix": "$GAMEDIR",
          "arch": "win32",
          "name": "create_prefix"
        }
      },
      {
        "task": {
          "prefix": "$GAMEDIR",
          "name": "set_regedit",
          "path": "HKEY_CURRENT_USER\\Software\\Wine\\X11 Driver",
          "value": "Y",
          "key": "GrabFullscreen",
          "arch": "win32"
        }
      },
      {
        "task": {
          "prefix": "$GAMEDIR",
          "name": "set_regedit",
          "path": "HKEY_CURRENT_USER\\Software\\Wine\\X11 Driver",
          "value": "N",
          "key": "UseTakeFocus",
          "arch": "win32"
        }
      },
      {
        "task": {
          "description": "Installing .NET 4.7.2. This will take a while...",
          "arch": "win32",
          "prefix": "$GAMEDIR",
          "name": "winetricks",
          "app": "dotnet472"
        }
      },
      {
        "task": {
          "arch": "win32",
          "prefix": "$GAMEDIR",
          "name": "winetricks",
          "app": "xact arial win10"
        }
      },
      {
        "task": {
          "prefix": "$GAMEDIR",
          "name": "winekill"
        }
      },
      {
        "copy": {
          "dst": "$CACHE/mtg-arena/",
          "src": "setup"
        }
      },
      {
        "task": {
          "name": "wineexec",
          "args": "/i \"$CACHE/mtg-arena/MTGAInstaller_0.1.1622.721726.msi\" /q",
          "description": "Installing Magic the Gathering Arena",
          "prefix": "$GAMEDIR",
          "executable": "msiexec",
          "arch": "win32",
          "exclude_processes": "mscorsvw.exe rundll32.exe MTGA.exe UnityCrashHandler32.exe"
        }
      },
      {
        "task": {
          "prefix": "$GAMEDIR",
          "name": "winekill"
        }
      }
    ]
  },
  "content": "files:\n- setup: https://mtgarena.downloads.wizards.com/Live/Windows32/versions/1622.721726/MTGAInstaller_0.1.1622.721726.msi\ngame:\n  arch: win32\n  exe: drive_c/Program Files/Wizards of the Coast/MTGA/MTGA.exe\n  prefix: $GAMEDIR\ninstaller:\n- task:\n    arch: win32\n    description: Creating Wine prefix\n    name: create_prefix\n    prefix: $GAMEDIR\n- task:\n    arch: win32\n    key: GrabFullscreen\n    name: set_regedit\n    path: HKEY_CURRENT_USER\\Software\\Wine\\X11 Driver\n    prefix: $GAMEDIR\n    value: Y\n- task:\n    arch: win32\n    key: UseTakeFocus\n    name: set_regedit\n    path: HKEY_CURRENT_USER\\Software\\Wine\\X11 Driver\n    prefix: $GAMEDIR\n    value: N\n- task:\n    app: dotnet472\n    arch: win32\n    description: Installing .NET 4.7.2. This will take a while...\n    name: winetricks\n    prefix: $GAMEDIR\n- task:\n    app: xact arial win10\n    arch: win32\n    name: winetricks\n    prefix: $GAMEDIR\n- task:\n    name: winekill\n    prefix: $GAMEDIR\n- copy:\n    dst: $CACHE/mtg-arena/\n    src: setup\n- task:\n    arch: win32\n    args: /i \"$CACHE/mtg-arena/MTGAInstaller_0.1.1622.721726.msi\" /q\n    description: Installing Magic the Gathering Arena\n    exclude_processes: mscorsvw.exe rundll32.exe MTGA.exe UnityCrashHandler32.exe\n    executable: msiexec\n    name: wineexec\n    prefix: $GAMEDIR\n- task:\n    name: winekill\n    prefix: $GAMEDIR\nwine:\n  Desktop: true\n  esync: true\n  version: tkg-unity-4.1-x86_64\n"
}