{
  "id": 19381,
  "game_id": 17988,
  "game_slug": "magic-the-gathering-arena",
  "name": "Magic: The Gathering Arena",
  "year": 2017,
  "user": "blenderfox",
  "runner": "wine",
  "slug": "magic-the-gathering-arena-dxvk-off",
  "version": "dxvk-off",
  "description": "Fixes 16nd April update and disables dxvk to prevent unity crash on bootCan update an existing install if you used the previous version of this installer.",
  "notes": "",
  "created_at": "2020-04-02T19:29:55.474000Z",
  "updated_at": "2020-04-21T22:52:44.524425Z",
  "draft": false,
  "published": false,
  "published_by": 51687,
  "rating": "",
  "steamid": null,
  "gogid": null,
  "gogslug": "",
  "humblestoreid": "",
  "script": {
    "files": [
      {
        "setup": "https://mtgarena.downloads.wizards.com/Live/Windows32/versions/2165.777492/MTGAInstaller_0.1.2165.777492.msi"
      }
    ],
    "game": {
      "prefix": "$GAMEDIR",
      "exe": "drive_c/Program Files (x86)/Wizards of the Coast/MTGA/MTGA.exe",
      "arch": "win64"
    },
    "wine": {
      "version": "lutris-mtga-4.21-x86_64",
      "dxvk": false
    },
    "installer": [
      {
        "task": {
          "prefix": "$GAMEDIR",
          "arch": "win64",
          "name": "create_prefix",
          "description": "Creating Wine prefix"
        }
      },
      {
        "task": {
          "arch": "win64",
          "name": "set_regedit",
          "key": "GrabFullscreen",
          "prefix": "$GAMEDIR",
          "value": "Y",
          "path": "HKEY_CURRENT_USER\\Software\\Wine\\X11 Driver"
        }
      },
      {
        "task": {
          "arch": "win64",
          "name": "set_regedit",
          "key": "UseTakeFocus",
          "prefix": "$GAMEDIR",
          "value": "N",
          "path": "HKEY_CURRENT_USER\\Software\\Wine\\X11 Driver"
        }
      },
      {
        "task": {
          "prefix": "$GAMEDIR",
          "arch": "win64",
          "app": "dotnet472",
          "description": "Installing .NET 4.7.2. This will take a while...",
          "name": "winetricks"
        }
      },
      {
        "task": {
          "prefix": "$GAMEDIR",
          "arch": "win32",
          "app": "xact arial win10",
          "name": "winetricks"
        }
      },
      {
        "task": {
          "prefix": "$GAMEDIR",
          "name": "winekill"
        }
      },
      {
        "copy": {
          "src": "setup",
          "dst": "$CACHE/mtg-arena/"
        }
      },
      {
        "task": {
          "arch": "win64",
          "exclude_processes": "mscorsvw.exe rundll32.exe MTGA.exe UnityCrashHandler32.exe",
          "name": "wineexec",
          "description": "Installing Magic the Gathering Arena",
          "args": "/i \"$CACHE/mtg-arena/MTGAInstaller_0.1.2165.777492.msi\" /q",
          "prefix": "$GAMEDIR",
          "executable": "msiexec"
        }
      },
      {
        "task": {
          "prefix": "$GAMEDIR",
          "name": "winekill"
        }
      }
    ]
  },
  "content": "files:\r\n- setup: https://mtgarena.downloads.wizards.com/Live/Windows32/versions/2165.777492/MTGAInstaller_0.1.2165.777492.msi\r\ngame:\r\n  arch: win64\r\n  exe: drive_c/Program Files (x86)/Wizards of the Coast/MTGA/MTGA.exe\r\n  prefix: $GAMEDIR\r\ninstaller:\r\n- task:\r\n    arch: win64\r\n    description: Creating Wine prefix\r\n    name: create_prefix\r\n    prefix: $GAMEDIR\r\n- task:\r\n    arch: win64\r\n    key: GrabFullscreen\r\n    name: set_regedit\r\n    path: HKEY_CURRENT_USER\\Software\\Wine\\X11 Driver\r\n    prefix: $GAMEDIR\r\n    value: Y\r\n- task:\r\n    arch: win64\r\n    key: UseTakeFocus\r\n    name: set_regedit\r\n    path: HKEY_CURRENT_USER\\Software\\Wine\\X11 Driver\r\n    prefix: $GAMEDIR\r\n    value: N\r\n- task:\r\n    app: dotnet472\r\n    arch: win64\r\n    description: Installing .NET 4.7.2. This will take a while...\r\n    name: winetricks\r\n    prefix: $GAMEDIR\r\n- task:\r\n    app: xact arial win10\r\n    arch: win32\r\n    name: winetricks\r\n    prefix: $GAMEDIR\r\n- task:\r\n    name: winekill\r\n    prefix: $GAMEDIR\r\n- copy:\r\n    dst: $CACHE/mtg-arena/\r\n    src: setup\r\n- task:\r\n    arch: win64\r\n    args: /i \"$CACHE/mtg-arena/MTGAInstaller_0.1.2165.777492.msi\" /q\r\n    description: Installing Magic the Gathering Arena\r\n    exclude_processes: mscorsvw.exe rundll32.exe MTGA.exe UnityCrashHandler32.exe\r\n    executable: msiexec\r\n    name: wineexec\r\n    prefix: $GAMEDIR\r\n- task:\r\n    name: winekill\r\n    prefix: $GAMEDIR\r\nwine:\r\n  dxvk: false\r\n  version: lutris-mtga-4.21-x86_64"
}