{
  "id": 13601,
  "game_id": 954,
  "game_slug": "the-sims-3",
  "name": "The Sims 3",
  "year": 2009,
  "user": "citrusalex",
  "runner": "wine",
  "slug": "the-sims-3-dvd",
  "version": "DVD",
  "description": null,
  "notes": "- It is highly suggested to install ErrorTrap, Traveler and Overwatch mods by nRaas to improve game's stability.",
  "created_at": "2019-05-18T10:48:05.089000Z",
  "updated_at": "2020-04-15T16:31:29.588491Z",
  "draft": false,
  "published": true,
  "published_by": 51687,
  "rating": "",
  "steamid": 47890,
  "gogid": null,
  "gogslug": "",
  "humblestoreid": "",
  "script": {
    "files": [
      {
        "setup": "N/A:Please select the setup file for The Sims 3"
      }
    ],
    "game": {
      "prefix": "$GAMEDIR",
      "exe": "drive_c/Program Files (x86)/Electronic Arts/The Sims 3/The Sims 3/Game/Bin/Sims3LauncherW.exe",
      "arch": "win64"
    },
    "wine": {
      "overrides": {
        "nvapi,nvapi64": "disabled"
      },
      "esync": true,
      "dxvk": true
    },
    "system": {
      "env": {
        "DXVK_STATE_CACHE_PATH": "$GAMEDIR",
        "__GL_SHADER_DISK_CACHE": 1,
        "DXVK_CONFIG_FILE": "$GAMEDIR/dxvk.conf",
        "WINE_LARGE_ADDRESS_AWARE": 1,
        "__GL_SHADER_DISK_CACHE_PATH": "$GAMEDIR"
      },
      "disable_compositor": true
    },
    "installer": [
      {
        "task": {
          "prefix": "$GAMEDIR",
          "arch": "win64",
          "name": "create_prefix",
          "description": "Creating Wine prefix..."
        }
      },
      {
        "write_file": {
          "file": "$GAMEDIR/dxvk.conf",
          "content": "dxgi.nvapiHack = False"
        }
      },
      {
        "task": {
          "silent": true,
          "arch": "win64",
          "name": "winetricks",
          "description": "Installing dependencies...",
          "prefix": "$GAMEDIR",
          "app": "dotnet20 mfc42 d3dx9 vcrun2005 vcrun2010"
        }
      },
      {
        "task": {
          "arch": "win64",
          "name": "set_regedit",
          "description": "Setting version to XP for Sims3LauncherW...",
          "key": "Version",
          "prefix": "$GAMEDIR",
          "value": "winxp",
          "path": "HKEY_CURRENT_USER\\Software\\Wine\\AppDefaults\\Sims3LauncherW.exe"
        }
      },
      {
        "task": {
          "arch": "win64",
          "name": "set_regedit",
          "description": "Setting version to 7 for default...",
          "key": "Version",
          "prefix": "$GAMEDIR",
          "value": "win7",
          "path": "HKEY_CURRENT_USER\\Software\\Wine"
        }
      },
      {
        "task": {
          "prefix": "$GAMEDIR",
          "arch": "win64",
          "executable": "setup",
          "name": "wineexec",
          "description": "Installing The Sims 3 from setup..."
        }
      },
      {
        "task": {
          "prefix": "$GAMEDIR",
          "name": "winekill"
        }
      }
    ]
  },
  "content": "files:\n- setup: N/A:Please select the setup file for The Sims 3\ngame:\n  arch: win64\n  exe: drive_c/Program Files (x86)/Electronic Arts/The Sims 3/The Sims 3/Game/Bin/Sims3LauncherW.exe\n  prefix: $GAMEDIR\ninstaller:\n- task:\n    arch: win64\n    description: Creating Wine prefix...\n    name: create_prefix\n    prefix: $GAMEDIR\n- write_file:\n    content: dxgi.nvapiHack = False\n    file: $GAMEDIR/dxvk.conf\n- task:\n    app: dotnet20 mfc42 d3dx9 vcrun2005 vcrun2010\n    arch: win64\n    description: Installing dependencies...\n    name: winetricks\n    prefix: $GAMEDIR\n    silent: true\n- task:\n    arch: win64\n    description: Setting version to XP for Sims3LauncherW...\n    key: Version\n    name: set_regedit\n    path: HKEY_CURRENT_USER\\Software\\Wine\\AppDefaults\\Sims3LauncherW.exe\n    prefix: $GAMEDIR\n    value: winxp\n- task:\n    arch: win64\n    description: Setting version to 7 for default...\n    key: Version\n    name: set_regedit\n    path: HKEY_CURRENT_USER\\Software\\Wine\n    prefix: $GAMEDIR\n    value: win7\n- task:\n    arch: win64\n    description: Installing The Sims 3 from setup...\n    executable: setup\n    name: wineexec\n    prefix: $GAMEDIR\n- task:\n    name: winekill\n    prefix: $GAMEDIR\nsystem:\n  disable_compositor: true\n  env:\n    DXVK_CONFIG_FILE: $GAMEDIR/dxvk.conf\n    DXVK_STATE_CACHE_PATH: $GAMEDIR\n    WINE_LARGE_ADDRESS_AWARE: 1\n    __GL_SHADER_DISK_CACHE: 1\n    __GL_SHADER_DISK_CACHE_PATH: $GAMEDIR\nwine:\n  dxvk: true\n  esync: true\n  overrides:\n    nvapi,nvapi64: disabled\n"
}