{
  "id": 15059,
  "game_id": 954,
  "game_slug": "the-sims-3",
  "name": "The Sims 3",
  "year": 2009,
  "user": "divadsn",
  "runner": "wine",
  "slug": "the-sims-3-change-me",
  "version": "Change Me",
  "description": "Install Sims 3 DVD-Version, requires real DVD",
  "notes": "Please check the installation path is \"c:\\Program Files\\Electronic Arts\\The Sims 3\\\" if you have the multilang version the last folder change for you localization, for example \"Los Sims 3\" for spanish countries, \"Leis Sims 3\" for french countries and lancher not work.",
  "created_at": "2019-08-19T21:06:25.814482Z",
  "updated_at": "2019-08-19T21:06:25.814511Z",
  "draft": false,
  "published": false,
  "published_by": 51687,
  "rating": "",
  "steamid": 47890,
  "gogid": null,
  "gogslug": "",
  "humblestoreid": "",
  "script": {
    "system": {
      "restore_gamma": true
    },
    "game": {
      "arch": "win32",
      "prefix": "$GAMEDIR",
      "exe": "drive_c/Program Files/Electronic Arts/The Sims 3/Game/Bin/TS3.exe"
    },
    "wine": {
      "UseXVidMode": true,
      "version": "tkg-oldnvidia-sims3-4.1-x86_64",
      "esync": true
    },
    "files": [
      {
        "file1": "N/A:Please select the Sims 3 setup file"
      }
    ],
    "installer": [
      {
        "task": {
          "arch": "win32",
          "prefix": "$GAMEDIR",
          "name": "create_prefix"
        }
      },
      {
        "task": {
          "prefix": "$GAMEDIR",
          "description": "Installing .Net 2.0",
          "app": "dotnet20",
          "arch": "win32",
          "name": "winetricks",
          "silent": true
        }
      },
      {
        "task": {
          "prefix": "$GAMEDIR",
          "description": "Installing MFC42",
          "app": "mfc42",
          "arch": "win32",
          "name": "winetricks",
          "silent": true
        }
      },
      {
        "task": {
          "prefix": "$GAMEDIR",
          "description": "Setting version to xp for Sims3LauncherW...",
          "value": "winxp",
          "arch": "win32",
          "path": "HKEY_CURRENT_USER\\Software\\Wine\\AppDefaults\\Sims3LauncherW.exe",
          "key": "Version",
          "name": "set_regedit"
        }
      },
      {
        "task": {
          "prefix": "$GAMEDIR",
          "description": "Setting version to 7 for default...",
          "value": "win7",
          "arch": "win32",
          "path": "HKEY_CURRENT_USER\\Software\\Wine",
          "key": "Version",
          "name": "set_regedit"
        }
      },
      {
        "task": {
          "prefix": "$GAMEDIR",
          "executable": "file1",
          "name": "wineexec"
        }
      },
      {
        "task": {
          "prefix": "$GAMEDIR",
          "name": "winekill"
        }
      }
    ]
  },
  "content": "files:\n- file1: N/A:Please select the Sims 3 setup file\ngame:\n  arch: win32\n  exe: drive_c/Program Files/Electronic Arts/The Sims 3/Game/Bin/TS3.exe\n  prefix: $GAMEDIR\ninstaller:\n- task:\n    arch: win32\n    name: create_prefix\n    prefix: $GAMEDIR\n- task:\n    app: dotnet20\n    arch: win32\n    description: Installing .Net 2.0\n    name: winetricks\n    prefix: $GAMEDIR\n    silent: true\n- task:\n    app: mfc42\n    arch: win32\n    description: Installing MFC42\n    name: winetricks\n    prefix: $GAMEDIR\n    silent: true\n- task:\n    arch: win32\n    description: Setting version to xp for Sims3LauncherW...\n    key: Version\n    name: set_regedit\n    path: HKEY_CURRENT_USER\\Software\\Wine\\AppDefaults\\Sims3LauncherW.exe\n    prefix: $GAMEDIR\n    value: winxp\n- task:\n    arch: win32\n    description: Setting version to 7 for default...\n    key: Version\n    name: set_regedit\n    path: HKEY_CURRENT_USER\\Software\\Wine\n    prefix: $GAMEDIR\n    value: win7\n- task:\n    executable: file1\n    name: wineexec\n    prefix: $GAMEDIR\n- task:\n    name: winekill\n    prefix: $GAMEDIR\nsystem:\n  restore_gamma: true\nwine:\n  UseXVidMode: true\n  esync: true\n  version: tkg-oldnvidia-sims3-4.1-x86_64\n"
}