{
  "id": 12821,
  "game_id": 676,
  "game_slug": "stronghold-kingdoms",
  "name": "Stronghold Kingdoms",
  "year": 2012,
  "user": "thmarth",
  "runner": "wine",
  "slug": "stronghold-kingdoms-latest",
  "version": "Latest",
  "description": null,
  "notes": "",
  "created_at": "2019-04-15T19:00:13.948637Z",
  "updated_at": "2019-05-18T07:40:59.040336Z",
  "draft": false,
  "published": true,
  "published_by": null,
  "rating": "",
  "steamid": 47410,
  "gogid": null,
  "gogslug": "",
  "humblestoreid": "",
  "script": {
    "game": {
      "exe": "$GAMEDIR/drive_c/Program Files/Firefly Studios/Stronghold Kingdoms/StrongholdKingdoms.exe",
      "arch": "win32",
      "prefix": "$GAMEDIR"
    },
    "files": [
      {
        "gameinstaller": "https://static.strongholdkingdoms.com/Kingdoms/StrongholdKingdoms-Setup.exe"
      }
    ],
    "wine": {
      "version": "tkg-protonified-4.5-x86_64"
    },
    "installer": [
      {
        "task": {
          "description": "Creating Wine prefix",
          "prefix": "$GAMEDIR",
          "arch": "win32",
          "name": "create_prefix"
        }
      },
      {
        "task": {
          "description": "Installing dependencies",
          "prefix": "$GAMEDIR",
          "app": "riched20 dotnet35sp1",
          "name": "winetricks"
        }
      },
      {
        "task": {
          "description": "Installing Stronghold Kingdoms",
          "prefix": "$GAMEDIR",
          "executable": "$gameinstaller",
          "name": "wineexec"
        }
      }
    ]
  },
  "content": "files:\r\n- gameinstaller: https://static.strongholdkingdoms.com/Kingdoms/StrongholdKingdoms-Setup.exe\r\ngame:\r\n  arch: win32\r\n  exe: $GAMEDIR/drive_c/Program Files/Firefly Studios/Stronghold Kingdoms/StrongholdKingdoms.exe\r\n  prefix: $GAMEDIR\r\ninstaller:\r\n- task:\r\n    arch: win32\r\n    description: Creating Wine prefix\r\n    name: create_prefix\r\n    prefix: $GAMEDIR\r\n- task:\r\n    app: riched20 dotnet35sp1\r\n    description: Installing dependencies\r\n    name: winetricks\r\n    prefix: $GAMEDIR\r\n- task:\r\n    description: Installing Stronghold Kingdoms\r\n    executable: $gameinstaller\r\n    name: wineexec\r\n    prefix: $GAMEDIR\r\nwine:\r\n  version: tkg-protonified-4.5-x86_64"
}