{
  "id": 22949,
  "game_id": 38394,
  "game_slug": "painttool-sai-2",
  "name": "PaintTool SAI 2",
  "year": 2020,
  "user": "NkoliTheWlfdg",
  "runner": "wine",
  "slug": "painttool-sai-2-20200617-64bit-en",
  "version": "20200617-64bit-en",
  "description": "This is a technical preview version of SAI Ver.2. Please remember this version will includes some bugs and inconveniences because this version is under development. Please do not use this version if you want to use stable version. And, this version requires basic skills for Windows operation. Please never use this version if you have not basic skills for Windows operation.",
  "notes": "",
  "created_at": "2020-08-19T23:53:03.628000Z",
  "updated_at": "2020-08-21T01:54:25.462859Z",
  "draft": false,
  "published": true,
  "published_by": 494,
  "rating": "",
  "steamid": null,
  "gogid": null,
  "gogslug": "",
  "humbleid": "",
  "humblestoreid": "",
  "humblestoreid_real": "",
  "script": {
    "files": [
      {
        "setup": "https://www.systemax.jp/bin/sai2-20200617-64bit-en.zip"
      }
    ],
    "game": {
      "arch": "win64",
      "exe": "$GAMEDIR/drive_c/Program Files (x86)/SYSTEMAX/PaintToolSAI2/sai2.exe",
      "prefix": "$GAMEDIR"
    },
    "install_complete_text": "In order to use this software, you will need to obtain a software license  from https://www.systemax.jp/en/license.html. You can obtain your System ID  by opening PaintTool SAI 2 and clicking \"[Others] -> [System ID]\". After  downloading your software license certificate, navigate to wherever you  installed PTS, then go to `./drive_c/Program Files/PaintTool SAI 2/` and  move the certificate to this folder. After this is complete, if PaintTool  SAI 2 is running, please restart it. You will no longer recieve that trial  message.\nHappy arting!",
    "installer": [
      {
        "task": {
          "arch": "win64",
          "install_gecko": false,
          "install_mono": false,
          "name": "create_prefix"
        }
      },
      {
        "task": {
          "app": "win7",
          "name": "winetricks",
          "prefix": "$GAMEDIR"
        }
      },
      {
        "extract": {
          "dst": "$GAMEDIR/drive_c/Program Files (x86)/SYSTEMAX/PaintToolSAI2/",
          "file": "setup",
          "format": "zip"
        }
      }
    ]
  },
  "content": "files:\n- setup: https://www.systemax.jp/bin/sai2-20200617-64bit-en.zip\ngame:\n  arch: win64\n  exe: $GAMEDIR/drive_c/Program Files (x86)/SYSTEMAX/PaintToolSAI2/sai2.exe\n  prefix: $GAMEDIR\ninstall_complete_text: 'In order to use this software, you will need to obtain a software\n  license  from https://www.systemax.jp/en/license.html. You can obtain your System\n  ID  by opening PaintTool SAI 2 and clicking \"[Others] -> [System ID]\". After  downloading\n  your software license certificate, navigate to wherever you  installed PTS, then\n  go to `./drive_c/Program Files/PaintTool SAI 2/` and  move the certificate to this\n  folder. After this is complete, if PaintTool  SAI 2 is running, please restart it.\n  You will no longer recieve that trial  message.\n\n  Happy arting!'\ninstaller:\n- task:\n    arch: win64\n    install_gecko: false\n    install_mono: false\n    name: create_prefix\n- task:\n    app: win7\n    name: winetricks\n    prefix: $GAMEDIR\n- extract:\n    dst: $GAMEDIR/drive_c/Program Files (x86)/SYSTEMAX/PaintToolSAI2/\n    file: setup\n    format: zip\n"
}