{
  "id": 17678,
  "game_id": 4300,
  "game_slug": "city-of-heroes",
  "name": "City of Heroes",
  "year": null,
  "user": "Korvinagor",
  "runner": "wine",
  "slug": "city-of-heroes-change-me-1",
  "version": "Change Me",
  "description": "For additional install instructions:\r\nhttps://forums.homecomingservers.com/topic/584-dredds-guide-to-loading-city-of-heroes/",
  "notes": "When run for the first  time it will ask for an install directory.  You can use what is selected by default.\r\n\r\nThe Tequila client may have issues downloading some of the other software it can run like paragon chat.  This will prevent the play button from appearing.  You can by pass that by just double clicking on Homecoming in the navbar to load the game.\r\n\r\nAfter loading the game you might need to hit \"Alt-Enter\" to change to windowed mode as the resolution may not be supported.",
  "created_at": "2020-01-01T03:00:20.846188Z",
  "updated_at": "2020-01-01T03:00:20.846214Z",
  "draft": false,
  "published": false,
  "published_by": 1,
  "rating": "",
  "steamid": 29550,
  "gogid": null,
  "gogslug": "",
  "humblestoreid": "",
  "script": {
    "game": {
      "exe": "drive_c/Games/CoH/tequila.exe",
      "arch": "win32",
      "prefix": "$GAMEDIR"
    },
    "installer": [
      {
        "task": {
          "arch": "win32",
          "description": "Creating Wine prefix",
          "prefix": "$GAMEDIR",
          "name": "create_prefix"
        }
      },
      {
        "task": {
          "app": "corefonts",
          "silent": true,
          "description": "Installing Corefonts",
          "prefix": "$GAMEDIR",
          "name": "winetricks"
        }
      },
      {
        "task": {
          "app": "dotnet35",
          "silent": true,
          "description": "Installing MS .NET 3.5",
          "prefix": "$GAMEDIR",
          "name": "winetricks"
        }
      },
      {
        "task": {
          "app": "dinput8",
          "silent": true,
          "description": "Installing DirectInput 8",
          "prefix": "$GAMEDIR",
          "name": "winetricks"
        }
      },
      {
        "execute": {
          "command": "mkdir -p \"$GAMEDIR/drive_c/Games/CoH\""
        }
      },
      {
        "move": {
          "dst": "$GAMEDIR/drive_c/Games/CoH/tequila.exe",
          "src": "client"
        }
      }
    ],
    "files": [
      {
        "client": "http://patch.savecoh.com/tequila.exe"
      }
    ]
  },
  "content": "files:\n- client: http://patch.savecoh.com/tequila.exe\ngame:\n  arch: win32\n  exe: drive_c/Games/CoH/tequila.exe\n  prefix: $GAMEDIR\ninstaller:\n- task:\n    arch: win32\n    description: Creating Wine prefix\n    name: create_prefix\n    prefix: $GAMEDIR\n- task:\n    app: corefonts\n    description: Installing Corefonts\n    name: winetricks\n    prefix: $GAMEDIR\n    silent: true\n- task:\n    app: dotnet35\n    description: Installing MS .NET 3.5\n    name: winetricks\n    prefix: $GAMEDIR\n    silent: true\n- task:\n    app: dinput8\n    description: Installing DirectInput 8\n    name: winetricks\n    prefix: $GAMEDIR\n    silent: true\n- execute:\n    command: mkdir -p \"$GAMEDIR/drive_c/Games/CoH\"\n- move:\n    dst: $GAMEDIR/drive_c/Games/CoH/tequila.exe\n    src: client\n"
}