{
  "id": 15221,
  "game_id": 4300,
  "game_slug": "city-of-heroes",
  "name": "City of Heroes",
  "year": null,
  "user": "nuggetsauce",
  "runner": "wine",
  "slug": "city-of-heroes-homecoming",
  "version": "Homecoming",
  "description": null,
  "notes": "",
  "created_at": "2019-08-31T16:27:28.542429Z",
  "updated_at": "2019-08-31T16:27:28.542457Z",
  "draft": true,
  "published": false,
  "published_by": null,
  "rating": "",
  "steamid": 29550,
  "gogid": null,
  "gogslug": "",
  "humblestoreid": "",
  "script": {
    "game": {
      "exe": "drive_c/Games/CoH/tequila.exe",
      "prefix": "$GAMEDIR"
    },
    "files": [
      {
        "setup": "http://patch.savecoh.com/tequila.exe"
      }
    ],
    "system": {
      "env": {
        "PBA_ENABLE": 1
      }
    },
    "installer": [
      {
        "task": {
          "description": "Creating Wine prefix",
          "prefix": "$GAMEDIR",
          "arch": "win32",
          "name": "create_prefix"
        }
      },
      {
        "task": {
          "arch": "win32",
          "prefix": "$GAMEDIR",
          "name": "winetricks",
          "app": "win7"
        }
      },
      {
        "task": {
          "description": "Installing Corefonts",
          "silent": true,
          "prefix": "$GAMEDIR",
          "app": "corefonts",
          "name": "winetricks"
        }
      },
      {
        "task": {
          "description": "Installing Windows Management Interface",
          "silent": false,
          "prefix": "$GAMEDIR",
          "app": "wmi",
          "name": "winetricks"
        }
      },
      {
        "task": {
          "description": "Simulating Windows reboot.",
          "prefix": "$GAMEDIR",
          "executable": "wineboot",
          "name": "wineexec"
        }
      },
      {
        "task": {
          "description": "Installing Tequila",
          "prefix": "$GAMEDIR",
          "executable": "tequila",
          "name": "wineexec"
        }
      },
      {
        "execute": {
          "command": "mkdir -p \"$GAMEDIR/drive_c/Games/CoH\""
        }
      }
    ],
    "wine": {
      "esync": true,
      "version": "esync-staging-pba-3.16-x86_64"
    }
  },
  "content": "files:\n- setup: http://patch.savecoh.com/tequila.exe\ngame:\n  exe: drive_c/Games/CoH/tequila.exe\n  prefix: $GAMEDIR\ninstaller:\n- task:\n    arch: win32\n    description: Creating Wine prefix\n    name: create_prefix\n    prefix: $GAMEDIR\n- task:\n    app: win7\n    arch: win32\n    name: winetricks\n    prefix: $GAMEDIR\n- task:\n    app: corefonts\n    description: Installing Corefonts\n    name: winetricks\n    prefix: $GAMEDIR\n    silent: true\n- task:\n    app: wmi\n    description: Installing Windows Management Interface\n    name: winetricks\n    prefix: $GAMEDIR\n    silent: false\n- task:\n    description: Simulating Windows reboot.\n    executable: wineboot\n    name: wineexec\n    prefix: $GAMEDIR\n- task:\n    description: Installing Tequila\n    executable: tequila\n    name: wineexec\n    prefix: $GAMEDIR\n- execute:\n    command: mkdir -p \"$GAMEDIR/drive_c/Games/CoH\"\nsystem:\n  env:\n    PBA_ENABLE: 1\nwine:\n  esync: true\n  version: esync-staging-pba-3.16-x86_64\n"
}