{
  "id": 15018,
  "game_id": 23880,
  "game_slug": "combat-mission-beyond-overlord",
  "name": "Combat Mission: Beyond Overlord",
  "year": 2001,
  "user": "odziom91",
  "runner": "wine",
  "slug": "combat-mission-beyond-overlor-standalone",
  "version": "Standalone",
  "description": "This game requires dgVoodoo2 for Graphic Card detection.",
  "notes": "",
  "created_at": "2019-08-15T20:41:40.811974Z",
  "updated_at": "2019-08-15T20:41:40.812001Z",
  "draft": true,
  "published": false,
  "published_by": null,
  "rating": "",
  "steamid": null,
  "gogid": 1207658821,
  "gogslug": "combat_mission_beyond_overlord",
  "humblestoreid": "",
  "script": {
    "script": {
      "game": {
        "exe": "drive_c/Program Files/Combat Mission - Beyond Overlord/Combat Mission.exe",
        "arch": "win32",
        "prefix": "$GAMEDIR"
      },
      "files": [
        {
          "dgvoodoo": "https://lutris.net/files/tools/dgvoodoo_2.55.4_dx1-7.tar.xz"
        },
        {
          "installer": "N/A:Select the Setup executable from your CD:"
        }
      ],
      "installer": [
        {
          "description": "Creating prefix",
          "install_mono": false,
          "name": "create_prefix",
          "task": null,
          "prefix": "$GAMEDIR",
          "arch": "win32"
        },
        {
          "description": "Installing d3dcompiler_43 and d3dcompiler_47...",
          "name": "winetricks",
          "task": null,
          "prefix": "$GAMEDIR",
          "app": "d3dcompiler_43 d3dcompiler_47 quartz",
          "arch": "win32"
        },
        {
          "task": null,
          "prefix": "$GAMEDIR",
          "executable": "installer",
          "arch": "win32",
          "name": "wineexec"
        },
        {
          "task": null,
          "prefix": "$GAMEDIR",
          "name": "winekill"
        },
        {
          "dst": "drive_c/Program Files/Combat Mission - Beyond Overlord/",
          "extract": null,
          "file": "dgvoodoo"
        },
        {
          "section": "DirectX",
          "write_config": null,
          "value": false,
          "key": "dgVoodooWatermark",
          "file": "drive_c/Program Files/Combat Mission - Beyond Overlord/dgVoodoo.conf"
        }
      ]
    },
    "wine": {
      "overrides": {
        "ddraw.dll": "native"
      }
    }
  },
  "content": "script:\n  files:\n  - dgvoodoo: https://lutris.net/files/tools/dgvoodoo_2.55.4_dx1-7.tar.xz\n  - installer: 'N/A:Select the Setup executable from your CD:'\n  game:\n    arch: win32\n    exe: drive_c/Program Files/Combat Mission - Beyond Overlord/Combat Mission.exe\n    prefix: $GAMEDIR\n  installer:\n  - arch: win32\n    description: Creating prefix\n    install_mono: false\n    name: create_prefix\n    prefix: $GAMEDIR\n    task: null\n  - app: d3dcompiler_43 d3dcompiler_47 quartz\n    arch: win32\n    description: Installing d3dcompiler_43 and d3dcompiler_47...\n    name: winetricks\n    prefix: $GAMEDIR\n    task: null\n  - arch: win32\n    executable: installer\n    name: wineexec\n    prefix: $GAMEDIR\n    task: null\n  - name: winekill\n    prefix: $GAMEDIR\n    task: null\n  - dst: drive_c/Program Files/Combat Mission - Beyond Overlord/\n    extract: null\n    file: dgvoodoo\n  - file: drive_c/Program Files/Combat Mission - Beyond Overlord/dgVoodoo.conf\n    key: dgVoodooWatermark\n    section: DirectX\n    value: false\n    write_config: null\nwine:\n  overrides:\n    ddraw.dll: native\n"
}