{
  "id": 14746,
  "game_id": 28594,
  "game_slug": "world-of-warcraft-classic",
  "name": "World of Warcraft (Classic)",
  "year": 2019,
  "user": "galross",
  "runner": "wine",
  "slug": "world-of-warcraft-classic-battlenet",
  "version": "Battle.net",
  "description": "Platinum: installs and runs flawlessly",
  "notes": "**IMPORTANT: INSTALL THE DEPENDENCIES FIRST**\r\nRead: Game: World-of-Warcraft before trying to install World of Warcraft. And install the needed dependencies for Wine into your system. Also, make sure you have Vulkan set up correctly.\r\nSame steps as with WoW retail, if you've already installed retail successfully you can just download Classic within your Battle.net launcher.",
  "created_at": "2019-07-27T22:21:31.830000Z",
  "updated_at": "2020-03-30T13:42:32.338580Z",
  "draft": false,
  "published": true,
  "published_by": 51687,
  "rating": "",
  "steamid": null,
  "gogid": null,
  "gogslug": "",
  "humbleid": "",
  "humblestoreid": "",
  "humblestoreid_real": "",
  "script": {
    "files": [
      {
        "setup": {
          "filename": "Battle.net-Setup-enUS.exe",
          "url": "http://dist.blizzard.com/downloads/bna-installers/322d5bb9ae0318de3d4cde7641c96425/retail.1/Battle.net-Setup-enUS.exe"
        }
      }
    ],
    "game": {
      "arch": "win64",
      "exe": "drive_c/Program Files (x86)/Battle.net/Battle.net.exe",
      "prefix": "$GAMEDIR"
    },
    "installer": [
      {
        "task": {
          "arch": "win64",
          "description": "Creating 64bit Wine prefix.",
          "name": "create_prefix",
          "prefix": "$GAMEDIR"
        }
      },
      {
        "task": {
          "app": "arial",
          "arch": "win64",
          "description": "Installing Arial font",
          "name": "winetricks",
          "prefix": "$GAMEDIR"
        }
      },
      {
        "task": {
          "arch": "win64",
          "description": "Wine Staging: Enabling DXVA2",
          "key": "backend",
          "name": "set_regedit",
          "path": "HKEY_CURRENT_USER\\Software\\Wine\\DXVA2",
          "prefix": "$GAMEDIR",
          "value": "va"
        }
      },
      {
        "task": {
          "name": "winekill",
          "prefix": "$GAMEDIR"
        }
      },
      {
        "write_json": {
          "data": {
            "Client": {
              "GameLaunchWindowBehavior": "2",
              "HardwareAcceleration": "false",
              "Sound": {
                "Enabled": "false"
              },
              "Streaming": {
                "StreamingEnabled": "false"
              }
            }
          },
          "description": "Disabling Sound/Hardware Acceleration/Streaming in Blizzard App",
          "file": "$GAMEDIR/drive_c/users/$USER/Application Data/Battle.net/Battle.net.config"
        }
      },
      {
        "task": {
          "arch": "win64",
          "description": "Installing Blizzard App\n------------------------------\nDo not try to log into Battle.net. Lutris will automatically close the login window. After Lutris installer is finished, you can start Blizzard App with \"Launch the game\", and install / locate your Blizzard game.",
          "exclude_processes": "Battle.net.exe Agent.exe \"Battle.net Helper.exe\"",
          "executable": "setup",
          "name": "wineexec"
        }
      },
      {
        "task": {
          "name": "winekill",
          "prefix": "$GAMEDIR"
        }
      }
    ],
    "system": {
      "env": {
        "DXVK_HUD": "compiler",
        "DXVK_STATE_CACHE_PATH": "$GAMEDIR",
        "STAGING_SHARED_MEMORY": 1,
        "__GL_SHADER_DISK_CACHE": 1,
        "__GL_SHADER_DISK_CACHE_PATH": "$GAMEDIR"
      },
      "exclude_processes": "Agent.exe \"Battle.net Helper.exe\""
    },
    "wine": {
      "dxvk": true,
      "esync": true,
      "overrides": {
        "nvapi": "disabled",
        "nvapi64": "disabled"
      }
    }
  },
  "content": "files:\n- setup:\n    filename: Battle.net-Setup-enUS.exe\n    url: http://dist.blizzard.com/downloads/bna-installers/322d5bb9ae0318de3d4cde7641c96425/retail.1/Battle.net-Setup-enUS.exe\ngame:\n  arch: win64\n  exe: drive_c/Program Files (x86)/Battle.net/Battle.net.exe\n  prefix: $GAMEDIR\ninstaller:\n- task:\n    arch: win64\n    description: Creating 64bit Wine prefix.\n    name: create_prefix\n    prefix: $GAMEDIR\n- task:\n    app: arial\n    arch: win64\n    description: Installing Arial font\n    name: winetricks\n    prefix: $GAMEDIR\n- task:\n    arch: win64\n    description: 'Wine Staging: Enabling DXVA2'\n    key: backend\n    name: set_regedit\n    path: HKEY_CURRENT_USER\\Software\\Wine\\DXVA2\n    prefix: $GAMEDIR\n    value: va\n- task:\n    name: winekill\n    prefix: $GAMEDIR\n- write_json:\n    data:\n      Client:\n        GameLaunchWindowBehavior: '2'\n        HardwareAcceleration: 'false'\n        Sound:\n          Enabled: 'false'\n        Streaming:\n          StreamingEnabled: 'false'\n    description: Disabling Sound/Hardware Acceleration/Streaming in Blizzard App\n    file: $GAMEDIR/drive_c/users/$USER/Application Data/Battle.net/Battle.net.config\n- task:\n    arch: win64\n    description: 'Installing Blizzard App\n\n      ------------------------------\n\n      Do not try to log into Battle.net. Lutris will automatically close the login\n      window. After Lutris installer is finished, you can start Blizzard App with\n      \"Launch the game\", and install / locate your Blizzard game.'\n    exclude_processes: Battle.net.exe Agent.exe \"Battle.net Helper.exe\"\n    executable: setup\n    name: wineexec\n- task:\n    name: winekill\n    prefix: $GAMEDIR\nsystem:\n  env:\n    DXVK_HUD: compiler\n    DXVK_STATE_CACHE_PATH: $GAMEDIR\n    STAGING_SHARED_MEMORY: 1\n    __GL_SHADER_DISK_CACHE: 1\n    __GL_SHADER_DISK_CACHE_PATH: $GAMEDIR\n  exclude_processes: Agent.exe \"Battle.net Helper.exe\"\nwine:\n  dxvk: true\n  esync: true\n  overrides:\n    nvapi: disabled\n    nvapi64: disabled\n"
}