{
  "id": 12345,
  "game_id": 26094,
  "game_slug": "tom-clancys-the-division-2",
  "name": "Tom Clancy's The Division 2",
  "year": 2019,
  "user": "Venkarian",
  "runner": "wine",
  "slug": "tom-clancys-the-division-2-uplay",
  "version": "Uplay",
  "description": null,
  "notes": "",
  "created_at": "2019-03-11T19:16:43.841000Z",
  "updated_at": "2020-01-23T02:56:50.882111Z",
  "draft": false,
  "published": true,
  "published_by": 19464,
  "rating": "1",
  "steamid": null,
  "gogid": null,
  "gogslug": "",
  "humbleid": "",
  "humblestoreid": "",
  "humblestoreid_real": "",
  "script": {
    "files": [
      {
        "client": "https://ubistatic3-a.akamaihd.net/orbit/launcher_installer/UplayInstaller.exe"
      }
    ],
    "game": {
      "arch": "win64",
      "exe": "drive_c/Program Files (x86)/Ubisoft/Ubisoft Game Launcher/Uplay.exe",
      "prefix": "$GAMEDIR"
    },
    "installer": [
      {
        "task": {
          "arch": "win64",
          "description": "Creating Wine prefix",
          "name": "create_prefix",
          "prefix": "$GAMEDIR"
        }
      },
      {
        "task": {
          "app": "dotnet472",
          "arch": "win64",
          "description": "Please wait while we install .NET 4.7.2",
          "name": "winetricks",
          "prefix": "$GAMEDIR"
        }
      },
      {
        "task": {
          "app": "corefonts win7",
          "arch": "win64",
          "name": "winetricks",
          "prefix": "$GAMEDIR"
        }
      },
      {
        "task": {
          "arch": "win64",
          "args": "/S",
          "description": "Installing client",
          "executable": "client",
          "name": "wineexec",
          "prefix": "$GAMEDIR"
        }
      }
    ],
    "system": {
      "env": {
        "DXVK_HUD": "0"
      }
    },
    "wine": {
      "dxvk": true,
      "esync": true,
      "overrides": {
        "nvapi,nvapi64": "disabled"
      }
    }
  },
  "content": "files:\n- client: https://ubistatic3-a.akamaihd.net/orbit/launcher_installer/UplayInstaller.exe\ngame:\n  arch: win64\n  exe: drive_c/Program Files (x86)/Ubisoft/Ubisoft Game Launcher/Uplay.exe\n  prefix: $GAMEDIR\ninstaller:\n- task:\n    arch: win64\n    description: Creating Wine prefix\n    name: create_prefix\n    prefix: $GAMEDIR\n- task:\n    app: dotnet472\n    arch: win64\n    description: Please wait while we install .NET 4.7.2\n    name: winetricks\n    prefix: $GAMEDIR\n- task:\n    app: corefonts win7\n    arch: win64\n    name: winetricks\n    prefix: $GAMEDIR\n- task:\n    arch: win64\n    args: /S\n    description: Installing client\n    executable: client\n    name: wineexec\n    prefix: $GAMEDIR\nsystem:\n  env:\n    DXVK_HUD: '0'\nwine:\n  dxvk: true\n  esync: true\n  overrides:\n    nvapi,nvapi64: disabled\n"
}