{
  "id": 2274,
  "game_id": 3942,
  "game_slug": "revolver360-reactor",
  "name": "REVOLVER360 RE:ACTOR",
  "year": 2014,
  "user": "ssf",
  "runner": "wine",
  "slug": "revolver360-reactor-gogcom",
  "version": "GOG.com",
  "description": "",
  "notes": "",
  "created_at": "2016-07-06T15:00:11.802078Z",
  "updated_at": "2016-09-07T16:37:40.589935Z",
  "draft": false,
  "published": true,
  "published_by": null,
  "rating": "",
  "steamid": 313400,
  "gogid": 1427964976,
  "gogslug": "revolver360_reactor",
  "humbleid": "",
  "humblestoreid": "",
  "humblestoreid_real": "",
  "script": {
    "files": [
      {
        "game": "N/A:Please select the GOG.com Windows installer."
      }
    ],
    "game": {
      "arch": "win32",
      "exe": "drive_c/game/REVOLVER360REACTOR.exe",
      "prefix": "$GAMEDIR"
    },
    "gogid": "revolver360_reactor",
    "installer": [
      {
        "task": {
          "description": "Creating Wine prefix",
          "name": "create_prefix",
          "prefix": "$GAMEDIR"
        }
      },
      {
        "task": {
          "key": "winemenubuilder.exe",
          "name": "set_regedit",
          "path": "HKEY_CURRENT_USER\\Software\\Wine\\DllOverrides",
          "prefix": "$GAMEDIR",
          "type": "REG_SZ",
          "value": ""
        }
      },
      {
        "task": {
          "app": "dotnet40",
          "description": "Installing .net",
          "name": "winetricks",
          "prefix": "$GAMEDIR",
          "silent": false
        }
      },
      {
        "task": {
          "app": "xna40",
          "description": "Installing xna",
          "name": "winetricks",
          "prefix": "$GAMEDIR",
          "silent": false
        }
      },
      {
        "task": {
          "args": "/VERYSILENT /SP- /NOCANCEL /SUPPRESSMSGBOXES '/DIR=C:/game'",
          "description": "Installing...",
          "executable": "game",
          "name": "wineexec",
          "prefix": "$GAMEDIR"
        }
      },
      {
        "task": {
          "app": "sandbox",
          "description": "Disabling unused WINE features",
          "name": "winetricks",
          "prefix": "$GAMEDIR",
          "silent": true
        }
      }
    ]
  },
  "content": "files:\n- game: N/A:Please select the GOG.com Windows installer.\ngame:\n  arch: win32\n  exe: drive_c/game/REVOLVER360REACTOR.exe\n  prefix: $GAMEDIR\ngogid: revolver360_reactor\ninstaller:\n- task:\n    description: Creating Wine prefix\n    name: create_prefix\n    prefix: $GAMEDIR\n- task:\n    key: winemenubuilder.exe\n    name: set_regedit\n    path: HKEY_CURRENT_USER\\Software\\Wine\\DllOverrides\n    prefix: $GAMEDIR\n    type: REG_SZ\n    value: ''\n- task:\n    app: dotnet40\n    description: Installing .net\n    name: winetricks\n    prefix: $GAMEDIR\n    silent: false\n- task:\n    app: xna40\n    description: Installing xna\n    name: winetricks\n    prefix: $GAMEDIR\n    silent: false\n- task:\n    args: /VERYSILENT /SP- /NOCANCEL /SUPPRESSMSGBOXES '/DIR=C:/game'\n    description: Installing...\n    executable: game\n    name: wineexec\n    prefix: $GAMEDIR\n- task:\n    app: sandbox\n    description: Disabling unused WINE features\n    name: winetricks\n    prefix: $GAMEDIR\n    silent: true\n"
}