{
  "id": 14932,
  "game_id": 28750,
  "game_slug": "itunes",
  "name": "iTunes",
  "year": null,
  "user": "citrusalex",
  "runner": "wine",
  "slug": "itunes-12759",
  "version": "12.7.5.9",
  "description": null,
  "notes": "",
  "created_at": "2019-08-09T09:16:27.355000Z",
  "updated_at": "2020-01-23T02:56:51.998145Z",
  "draft": false,
  "published": true,
  "published_by": 51687,
  "rating": "",
  "steamid": null,
  "gogid": null,
  "gogslug": "",
  "humblestoreid": "",
  "script": {
    "game": {
      "exe": "$GAMEDIR/drive_c/Program Files/iTunes/iTunes.exe",
      "arch": "win64",
      "prefix": "$GAMEDIR"
    },
    "installer": [
      {
        "task": {
          "arch": "win64",
          "description": "Creating Wine Prefix...",
          "prefix": "$GAMEDIR",
          "name": "create_prefix"
        }
      },
      {
        "task": {
          "app": "gdiplus tahoma",
          "description": "Installing dependencies...",
          "prefix": "$GAMEDIR",
          "name": "winetricks"
        }
      },
      {
        "task": {
          "executable": "installer",
          "exclude_processes": "iTunesHelper.exe iPodService.exe",
          "description": "Installing iTunes...",
          "prefix": "$GAMEDIR",
          "name": "wineexec"
        }
      },
      {
        "task": {
          "prefix": "$GAMEDIR",
          "name": "winekill"
        }
      }
    ],
    "files": [
      {
        "installer": "https://secure-appldnld.apple.com/itunes12/091-81934-20180529-DAFCAAD0-5F77-11E8-99A3-4F9A897FD268/iTunes64Setup.exe"
      }
    ]
  },
  "content": "files:\n- installer: https://secure-appldnld.apple.com/itunes12/091-81934-20180529-DAFCAAD0-5F77-11E8-99A3-4F9A897FD268/iTunes64Setup.exe\ngame:\n  arch: win64\n  exe: $GAMEDIR/drive_c/Program Files/iTunes/iTunes.exe\n  prefix: $GAMEDIR\ninstaller:\n- task:\n    arch: win64\n    description: Creating Wine Prefix...\n    name: create_prefix\n    prefix: $GAMEDIR\n- task:\n    app: gdiplus tahoma\n    description: Installing dependencies...\n    name: winetricks\n    prefix: $GAMEDIR\n- task:\n    description: Installing iTunes...\n    exclude_processes: iTunesHelper.exe iPodService.exe\n    executable: installer\n    name: wineexec\n    prefix: $GAMEDIR\n- task:\n    name: winekill\n    prefix: $GAMEDIR\n"
}