{
  "id": 18404,
  "game_id": 28750,
  "game_slug": "itunes",
  "name": "iTunes",
  "year": null,
  "user": "stalanov",
  "runner": "wine",
  "slug": "itunes-change-me",
  "version": "Change Me",
  "description": null,
  "notes": "",
  "created_at": "2020-02-16T18:19:35.720721Z",
  "updated_at": "2020-02-16T18:19:35.720746Z",
  "draft": false,
  "published": false,
  "published_by": 51687,
  "rating": "",
  "steamid": null,
  "gogid": null,
  "gogslug": "",
  "humblestoreid": "",
  "script": {
    "installer": [
      {
        "task": {
          "arch": "win64",
          "description": "Creating Wine Prefix...",
          "prefix": "$GAMEDIR",
          "name": "create_prefix"
        }
      },
      {
        "task": {
          "description": "Installing dependencies...",
          "app": "gdiplus tahoma",
          "prefix": "$GAMEDIR",
          "name": "winetricks"
        }
      },
      {
        "task": {
          "exclude_processes": "iTunesHelper.exe iPodService.exe",
          "executable": "installer",
          "description": "Installing iTunes...",
          "prefix": "$GAMEDIR",
          "name": "wineexec"
        }
      },
      {
        "task": {
          "prefix": "$GAMEDIR",
          "name": "winekill"
        }
      }
    ],
    "files": [
      {
        "installer": "http://updates-http.cdn-apple.com/2019/windows/061-27904-20191004-E748B8A2-E6F7-11E9-8931-E55C44AC54BE/iTunes64Setup.exe"
      }
    ],
    "game": {
      "arch": "win64",
      "prefix": "$GAMEDIR",
      "exe": "$GAMEDIR/drive_c/Program Files/iTunes/iTunes.exe"
    }
  },
  "content": "files:\n- installer: http://updates-http.cdn-apple.com/2019/windows/061-27904-20191004-E748B8A2-E6F7-11E9-8931-E55C44AC54BE/iTunes64Setup.exe\ngame:\n  arch: win64\n  exe: $GAMEDIR/drive_c/Program Files/iTunes/iTunes.exe\n  prefix: $GAMEDIR\ninstaller:\n- task:\n    arch: win64\n    description: Creating Wine Prefix...\n    name: create_prefix\n    prefix: $GAMEDIR\n- task:\n    app: gdiplus tahoma\n    description: Installing dependencies...\n    name: winetricks\n    prefix: $GAMEDIR\n- task:\n    description: Installing iTunes...\n    exclude_processes: iTunesHelper.exe iPodService.exe\n    executable: installer\n    name: wineexec\n    prefix: $GAMEDIR\n- task:\n    name: winekill\n    prefix: $GAMEDIR\n"
}