{
  "id": 20493,
  "game_id": 28750,
  "game_slug": "itunes",
  "name": "iTunes",
  "year": null,
  "user": "bdonvr",
  "runner": "wine",
  "slug": "itunes-12933",
  "version": "12.9.3.3",
  "description": "This uses 32bit iTunes version 12.9.3.3, as later versions break the GUI, and the 64bit installers fail to launch.",
  "notes": "Do not update iTunes, disable automatic updates during install and when prompted after launch. Untick \"Launch iTunes\" when the installer is done.\r\n\r\niTunes may crash when signing in/authorizing your computer/using 2FA. Re-open iTunes and try again, it should work the second time.\r\n\r\niTunes may become unresponsive while downloading media, wait until it is finished.",
  "created_at": "2020-05-15T15:33:43.526506Z",
  "updated_at": "2020-05-15T15:33:43.526531Z",
  "draft": true,
  "published": false,
  "published_by": null,
  "rating": "",
  "steamid": null,
  "gogid": null,
  "gogslug": "",
  "humblestoreid": "",
  "script": {
    "files": [
      {
        "installer": "https://secure-appldnld.apple.com/itunes12/041-31290-20190124-BBE902D6-D788-11E8-B555-8E91F34A5CAA/iTunesSetup.exe"
      }
    ],
    "game": {
      "arch": "win32",
      "exe": "$GAMEDIR/drive_c/Program Files/iTunes/iTunes.exe",
      "prefix": "$GAMEDIR"
    },
    "installer": [
      {
        "task": {
          "arch": "win32",
          "description": "Creating Wine Prefix...",
          "name": "create_prefix",
          "prefix": "$GAMEDIR"
        }
      },
      {
        "task": {
          "app": "gdiplus tahoma",
          "description": "Installing dependencies...",
          "name": "winetricks",
          "prefix": "$GAMEDIR"
        }
      },
      {
        "task": {
          "description": "Installing iTunes...",
          "exclude_processes": "iTunesHelper.exe iPodService.exe",
          "executable": "installer",
          "name": "wineexec",
          "prefix": "$GAMEDIR"
        }
      },
      {
        "task": {
          "name": "winekill",
          "prefix": "$GAMEDIR"
        }
      }
    ]
  },
  "content": "files:\n- installer: https://secure-appldnld.apple.com/itunes12/041-31290-20190124-BBE902D6-D788-11E8-B555-8E91F34A5CAA/iTunesSetup.exe\ngame:\n  arch: win32\n  exe: $GAMEDIR/drive_c/Program Files/iTunes/iTunes.exe\n  prefix: $GAMEDIR\ninstaller:\n- task:\n    arch: win32\n    description: Creating Wine Prefix...\n    name: create_prefix\n    prefix: $GAMEDIR\n- task:\n    app: gdiplus tahoma\n    description: Installing dependencies...\n    name: winetricks\n    prefix: $GAMEDIR\n- task:\n    description: Installing iTunes...\n    exclude_processes: iTunesHelper.exe iPodService.exe\n    executable: installer\n    name: wineexec\n    prefix: $GAMEDIR\n- task:\n    name: winekill\n    prefix: $GAMEDIR\n"
}