{
  "id": 16446,
  "game_id": 28750,
  "game_slug": "itunes",
  "name": "iTunes",
  "year": null,
  "user": "Jinkusu",
  "runner": "wine",
  "slug": "itunes-12101",
  "version": "12.10.1",
  "description": null,
  "notes": "",
  "created_at": "2019-10-27T20:31:41.402000Z",
  "updated_at": "2020-01-23T02:56:51.881136Z",
  "draft": false,
  "published": true,
  "published_by": 51687,
  "rating": "",
  "steamid": null,
  "gogid": null,
  "gogslug": "",
  "humblestoreid": "",
  "script": {
    "files": [
      {
        "installer": "http://updates-http.cdn-apple.com/2019/windows/061-27904-20191004-E748B8A2-E6F7-11E9-8931-E55C44AC54BE/iTunes64Setup.exe"
      }
    ],
    "game": {
      "prefix": "$GAMEDIR",
      "exe": "$GAMEDIR/drive_c/Program Files/iTunes/iTunes.exe",
      "arch": "win64"
    },
    "installer": [
      {
        "task": {
          "prefix": "$GAMEDIR",
          "arch": "win64",
          "name": "create_prefix",
          "description": "Creating Wine Prefix..."
        }
      },
      {
        "task": {
          "prefix": "$GAMEDIR",
          "app": "gdiplus tahoma",
          "description": "Installing dependencies...",
          "name": "winetricks"
        }
      },
      {
        "task": {
          "prefix": "$GAMEDIR",
          "exclude_processes": "iTunesHelper.exe iPodService.exe",
          "executable": "installer",
          "name": "wineexec",
          "description": "Installing iTunes..."
        }
      },
      {
        "task": {
          "prefix": "$GAMEDIR",
          "name": "winekill"
        }
      }
    ]
  },
  "content": "files:\n- installer: http://updates-http.cdn-apple.com/2019/windows/061-27904-20191004-E748B8A2-E6F7-11E9-8931-E55C44AC54BE/iTunes64Setup.exe\ngame:\n  arch: win64\n  exe: $GAMEDIR/drive_c/Program Files/iTunes/iTunes.exe\n  prefix: $GAMEDIR\ninstaller:\n- task:\n    arch: win64\n    description: Creating Wine Prefix...\n    name: create_prefix\n    prefix: $GAMEDIR\n- task:\n    app: gdiplus tahoma\n    description: Installing dependencies...\n    name: winetricks\n    prefix: $GAMEDIR\n- task:\n    description: Installing iTunes...\n    exclude_processes: iTunesHelper.exe iPodService.exe\n    executable: installer\n    name: wineexec\n    prefix: $GAMEDIR\n- task:\n    name: winekill\n    prefix: $GAMEDIR\n"
}