{
  "id": 15122,
  "game_id": 21801,
  "game_slug": "empire-earth-2",
  "name": "EMPIRE EARTH 2",
  "year": 2005,
  "user": "ssetekh",
  "runner": "wine",
  "slug": "empire-earth-2-change-me",
  "version": "Change Me",
  "description": "This is the installer for the GOG Version + the unofficial 1.5 patch from ee2.eu (needed for multiplayer and more in-game functionality).\r\nThis script downloads the newest patch version automatically.",
  "notes": "You need to install Wine dependencies first, like for the blizzard app: <a href=\"https://github.com/lutris/lutris/wiki/Game:-Blizzard-App#dependencies-for-blizzard-app\">https://github.com/lutris/lutris/wiki/Game:-Blizzard-App#dependencies-for-blizzard-app</a>\r\nYou also need to install MS fonts like explained here: <a href=\"https://github.com/lutris/lutris/wiki/Game:-Blizzard-App#system-dependencies-for-fixing-font-rendering-errors\">https://github.com/lutris/lutris/wiki/Game:-Blizzard-App#system-dependencies-for-fixing-font-rendering-errors</a>\r\n\r\nSelect YES when you get the Unsupported Operating System message during installation of the patch.\r\n\r\nWhen you start the game the first time you get a message telling you to not use the compatibility mode, just click yes.\r\n\r\nIf you have missing textures try to disable DX9 in the UP1.5 Settings. \r\n\r\nSometimes the keys aren't working in the game. Just tab out and tab back in.",
  "created_at": "2019-08-24T12:50:29.606764Z",
  "updated_at": "2019-08-24T12:50:29.606802Z",
  "draft": false,
  "published": false,
  "published_by": null,
  "rating": "",
  "steamid": null,
  "gogid": 1207658844,
  "gogslug": "empire_earth_2_gold",
  "humblestoreid": "",
  "script": {
    "game": {
      "arch": "win32",
      "prefix": "$GAMEDIR",
      "exe": "drive_c/GOG Games/Empire Earth II Gold Edition/EE2.exe"
    },
    "wine": {
      "version": "staging-3.16-x86_64"
    },
    "files": [
      {
        "game": "N/A:Select the Gog Installer setup_empire_earthxxx.exe."
      },
      {
        "patch": {
          "url": "https://patch.ee2.eu/patch15/download/ee2eu-direct.php?linux=true",
          "filename": "ee2patch.exe"
        }
      }
    ],
    "installer": [
      {
        "task": {
          "arch": "win32",
          "executable": "game",
          "prefix": "$GAMEDIR",
          "description": "Installing the game. You may see an error message at the end, you can ignore that.\n------------------------------\nLet Lutris installer finish first. Launch the game afterwards.",
          "name": "wineexec"
        }
      },
      {
        "task": {
          "arch": "win32",
          "executable": "patch",
          "prefix": "$GAMEDIR",
          "description": "Installing the patch. Select YES when you get the Unsupported Operating System message.\n------------------------------\nLet Lutris installer finish first. Launch UP1.5 Settings and the Launcher later (uncheck the launch now options before you click on finish)!",
          "name": "wineexec"
        }
      },
      {
        "task": {
          "prefix": "$GAMEDIR",
          "description": "Installing d3dx9_43",
          "name": "winetricks",
          "app": "d3dx9_43"
        }
      },
      {
        "task": {
          "prefix": "$GAMEDIR",
          "description": "Installing d3dcompiler_43",
          "name": "winetricks",
          "app": "d3dcompiler_43"
        }
      },
      {
        "task": {
          "prefix": "$GAMEDIR",
          "description": "Installing corefonts",
          "name": "winetricks",
          "app": "corefonts"
        }
      },
      {
        "task": {
          "prefix": "$GAMEDIR",
          "description": "Installing msftedit",
          "name": "winetricks",
          "app": "msftedit"
        }
      },
      {
        "task": {
          "prefix": "$GAMEDIR",
          "description": "Installing riched30",
          "name": "winetricks",
          "app": "riched30"
        }
      }
    ]
  },
  "content": "files:\n- game: N/A:Select the Gog Installer setup_empire_earthxxx.exe.\n- patch:\n    filename: ee2patch.exe\n    url: https://patch.ee2.eu/patch15/download/ee2eu-direct.php?linux=true\ngame:\n  arch: win32\n  exe: drive_c/GOG Games/Empire Earth II Gold Edition/EE2.exe\n  prefix: $GAMEDIR\ninstaller:\n- task:\n    arch: win32\n    description: 'Installing the game. You may see an error message at the end, you\n      can ignore that.\n\n      ------------------------------\n\n      Let Lutris installer finish first. Launch the game afterwards.'\n    executable: game\n    name: wineexec\n    prefix: $GAMEDIR\n- task:\n    arch: win32\n    description: 'Installing the patch. Select YES when you get the Unsupported Operating\n      System message.\n\n      ------------------------------\n\n      Let Lutris installer finish first. Launch UP1.5 Settings and the Launcher later\n      (uncheck the launch now options before you click on finish)!'\n    executable: patch\n    name: wineexec\n    prefix: $GAMEDIR\n- task:\n    app: d3dx9_43\n    description: Installing d3dx9_43\n    name: winetricks\n    prefix: $GAMEDIR\n- task:\n    app: d3dcompiler_43\n    description: Installing d3dcompiler_43\n    name: winetricks\n    prefix: $GAMEDIR\n- task:\n    app: corefonts\n    description: Installing corefonts\n    name: winetricks\n    prefix: $GAMEDIR\n- task:\n    app: msftedit\n    description: Installing msftedit\n    name: winetricks\n    prefix: $GAMEDIR\n- task:\n    app: riched30\n    description: Installing riched30\n    name: winetricks\n    prefix: $GAMEDIR\nwine:\n  version: staging-3.16-x86_64\n"
}