{
  "id": 7896,
  "game_id": 543,
  "game_slug": "mass-effect-2",
  "name": "Mass Effect 2",
  "year": 2010,
  "user": "aloade",
  "runner": "wine",
  "slug": "mass-effect-2-dvd",
  "version": "DVD",
  "description": "During installation, the default installation folder may be different depending on the ISO file used, be careful to select the right folder.\r\nGame options ( screen resolution, fullscreen, ... ) MUST BE configured manually by launching an EXE inside the installer ).",
  "notes": "Because of the introduction videos (EA logo) it is necessary to launch the game with the parameter'-nomovieplayback', which is not possible with the Mass Effect 2 launcher.\r\nAfter installation and before starting the game, click on 'Run EXE inside wineprefix', search for 'drive_c\\Program Files\\Mass Effect 2\\Binaries\\MassEffect2config.exe' and configure the game.",
  "created_at": "2018-04-14T10:08:23.687000Z",
  "updated_at": "2019-05-12T03:34:05.319543Z",
  "draft": false,
  "published": true,
  "published_by": 19464,
  "rating": "",
  "steamid": 24980,
  "gogid": null,
  "gogslug": "",
  "humblestoreid": "",
  "script": {
    "game": {
      "exe": "drive_c/Program Files/Mass Effect 2/Binaries/MassEffect2.exe",
      "arch": "win32",
      "args": "-nomovieplayback",
      "prefix": "$GAMEDIR"
    },
    "installer": [
      {
        "insert-disc": {
          "requires": "setup.exe"
        }
      },
      {
        "task": {
          "arch": "win32",
          "description": "Creating 32bit Wine prefix.",
          "prefix": "$GAMEDIR",
          "name": "create_prefix"
        }
      },
      {
        "task": {
          "path": "HKEY_CURRENT_USER\\Software\\Wine",
          "description": "Setting OS as Windows 7.",
          "prefix": "$GAMEDIR",
          "name": "set_regedit",
          "value": "win7",
          "key": "Version"
        }
      },
      {
        "task": {
          "path": "HKEY_CURRENT_USER\\Software\\Wine\\X11 Driver",
          "description": "Allow DirectX apps to stop the mouse leaving their window.",
          "prefix": "$GAMEDIR",
          "name": "set_regedit",
          "value": "Y",
          "key": "GrabFullScreen"
        }
      },
      {
        "task": {
          "path": "HKEY_CURRENT_USER\\Software\\Wine\\X11 Driver",
          "description": "Deny the window manager to decorate the windows.",
          "prefix": "$GAMEDIR",
          "name": "set_regedit",
          "value": "N",
          "key": "Decorated"
        }
      },
      {
        "task": {
          "path": "HKEY_CURRENT_USER\\Software\\Wine\\X11 Driver",
          "description": "Allow the window manager to control the windows.",
          "prefix": "$GAMEDIR",
          "name": "set_regedit",
          "value": "Y",
          "key": "Managed"
        }
      },
      {
        "task": {
          "path": "HKEY_CURRENT_USER\\Software\\Wine\\DllRedirects",
          "description": "Enabling CSMT for better graphic performance.",
          "prefix": "$GAMEDIR",
          "name": "set_regedit",
          "value": "wined3d-csmt.dll",
          "key": "wined3d"
        }
      },
      {
        "task": {
          "path": "HKEY_CURRENT_USER\\Software\\Wine\\DXVA2",
          "description": "Enabling VAAPI as backend for DXVA2 GPU decoding.",
          "prefix": "$GAMEDIR",
          "name": "set_regedit",
          "value": "va",
          "key": "backend"
        }
      },
      {
        "task": {
          "app": "d3dx9",
          "description": "Installing DirectX 9.",
          "prefix": "$GAMEDIR",
          "name": "winetricks"
        }
      },
      {
        "task": {
          "app": "physx",
          "description": "Installing PhysX.",
          "prefix": "$GAMEDIR",
          "name": "winetricks"
        }
      },
      {
        "task": {
          "executable": "$DISC/Setup.exe",
          "description": "The installating folder MUST BE 'C:\\Program Files\\Mass Effect 2'\nIgnore install of DirectX, Visual C++ and PhysX.",
          "prefix": "$GAMEDIR",
          "name": "wineexec"
        }
      }
    ]
  },
  "content": "game:\n  arch: win32\n  args: -nomovieplayback\n  exe: drive_c/Program Files/Mass Effect 2/Binaries/MassEffect2.exe\n  prefix: $GAMEDIR\ninstaller:\n- insert-disc:\n    requires: setup.exe\n- task:\n    arch: win32\n    description: Creating 32bit Wine prefix.\n    name: create_prefix\n    prefix: $GAMEDIR\n- task:\n    description: Setting OS as Windows 7.\n    key: Version\n    name: set_regedit\n    path: HKEY_CURRENT_USER\\Software\\Wine\n    prefix: $GAMEDIR\n    value: win7\n- task:\n    description: Allow DirectX apps to stop the mouse leaving their window.\n    key: GrabFullScreen\n    name: set_regedit\n    path: HKEY_CURRENT_USER\\Software\\Wine\\X11 Driver\n    prefix: $GAMEDIR\n    value: Y\n- task:\n    description: Deny the window manager to decorate the windows.\n    key: Decorated\n    name: set_regedit\n    path: HKEY_CURRENT_USER\\Software\\Wine\\X11 Driver\n    prefix: $GAMEDIR\n    value: N\n- task:\n    description: Allow the window manager to control the windows.\n    key: Managed\n    name: set_regedit\n    path: HKEY_CURRENT_USER\\Software\\Wine\\X11 Driver\n    prefix: $GAMEDIR\n    value: Y\n- task:\n    description: Enabling CSMT for better graphic performance.\n    key: wined3d\n    name: set_regedit\n    path: HKEY_CURRENT_USER\\Software\\Wine\\DllRedirects\n    prefix: $GAMEDIR\n    value: wined3d-csmt.dll\n- task:\n    description: Enabling VAAPI as backend for DXVA2 GPU decoding.\n    key: backend\n    name: set_regedit\n    path: HKEY_CURRENT_USER\\Software\\Wine\\DXVA2\n    prefix: $GAMEDIR\n    value: va\n- task:\n    app: d3dx9\n    description: Installing DirectX 9.\n    name: winetricks\n    prefix: $GAMEDIR\n- task:\n    app: physx\n    description: Installing PhysX.\n    name: winetricks\n    prefix: $GAMEDIR\n- task:\n    description: 'The installating folder MUST BE ''C:\\Program Files\\Mass Effect 2''\n\n      Ignore install of DirectX, Visual C++ and PhysX.'\n    executable: $DISC/Setup.exe\n    name: wineexec\n    prefix: $GAMEDIR\n"
}