{
  "id": 2687,
  "game_id": 7610,
  "game_slug": "allegiance",
  "name": "Allegiance",
  "year": 2000,
  "user": "ssf",
  "runner": "wine",
  "slug": "allegiance-freeallegiance",
  "version": "FreeAllegiance",
  "description": "",
  "notes": "",
  "created_at": "2016-09-05T20:24:42.594560Z",
  "updated_at": "2016-09-06T16:42:52.009301Z",
  "draft": false,
  "published": true,
  "published_by": null,
  "rating": "",
  "steamid": null,
  "gogid": null,
  "gogslug": "",
  "humblestoreid": "",
  "script": {
    "game": {
      "exe": "drive_c/Program Files/Microsoft Games/Allegiance 1.2/Launcher.exe",
      "arch": "win32",
      "prefix": "$GAMEDIR"
    },
    "installer": [
      {
        "task": {
          "description": "Creating Wine prefix",
          "prefix": "$GAMEDIR",
          "name": "create_prefix"
        }
      },
      {
        "task": {
          "path": "HKEY_CURRENT_USER\\Software\\Wine\\DllOverrides",
          "prefix": "$GAMEDIR",
          "name": "set_regedit",
          "value": "",
          "key": "winemenubuilder.exe",
          "type": "REG_SZ"
        }
      },
      {
        "task": {
          "app": "vcrun2010",
          "silent": true,
          "description": "Installing...",
          "prefix": "$GAMEDIR",
          "name": "winetricks"
        }
      },
      {
        "task": {
          "app": "dotnet35",
          "silent": true,
          "description": "Installing...",
          "prefix": "$GAMEDIR",
          "name": "winetricks"
        }
      },
      {
        "task": {
          "executable": "wineboot",
          "description": "Rebooting...",
          "prefix": "$GAMEDIR",
          "name": "wineexec"
        }
      },
      {
        "task": {
          "executable": "game",
          "args": "/S",
          "description": "Installing...",
          "prefix": "$GAMEDIR",
          "name": "wineexec"
        }
      },
      {
        "task": {
          "app": "directplay",
          "silent": true,
          "description": "Installing...",
          "prefix": "$GAMEDIR",
          "name": "winetricks"
        }
      },
      {
        "task": {
          "app": "sandbox",
          "silent": true,
          "description": "Disabling unused WINE features",
          "prefix": "$GAMEDIR",
          "name": "winetricks"
        }
      }
    ],
    "files": [
      {
        "game": "http://www.german-borg.de/files/allegsetup_302.exe"
      }
    ]
  },
  "content": "files:\n- game: http://www.german-borg.de/files/allegsetup_302.exe\ngame:\n  arch: win32\n  exe: drive_c/Program Files/Microsoft Games/Allegiance 1.2/Launcher.exe\n  prefix: $GAMEDIR\ninstaller:\n- task:\n    description: Creating Wine prefix\n    name: create_prefix\n    prefix: $GAMEDIR\n- task:\n    key: winemenubuilder.exe\n    name: set_regedit\n    path: HKEY_CURRENT_USER\\Software\\Wine\\DllOverrides\n    prefix: $GAMEDIR\n    type: REG_SZ\n    value: ''\n- task:\n    app: vcrun2010\n    description: Installing...\n    name: winetricks\n    prefix: $GAMEDIR\n    silent: true\n- task:\n    app: dotnet35\n    description: Installing...\n    name: winetricks\n    prefix: $GAMEDIR\n    silent: true\n- task:\n    description: Rebooting...\n    executable: wineboot\n    name: wineexec\n    prefix: $GAMEDIR\n- task:\n    args: /S\n    description: Installing...\n    executable: game\n    name: wineexec\n    prefix: $GAMEDIR\n- task:\n    app: directplay\n    description: Installing...\n    name: winetricks\n    prefix: $GAMEDIR\n    silent: true\n- task:\n    app: sandbox\n    description: Disabling unused WINE features\n    name: winetricks\n    prefix: $GAMEDIR\n    silent: true\n"
}