{
  "id": 11438,
  "game_id": 1697,
  "game_slug": "ys-i",
  "name": "Ys I",
  "year": 2013,
  "user": "striker.sh",
  "runner": "wine",
  "slug": "ys-i-gog",
  "version": "GOG",
  "description": null,
  "notes": "",
  "created_at": "2019-01-04T22:36:32.695000Z",
  "updated_at": "2019-01-06T06:38:01.269865Z",
  "draft": false,
  "published": true,
  "published_by": 19464,
  "rating": "",
  "steamid": 223810,
  "gogid": null,
  "gogslug": "ys_i_ii_chronicles",
  "humblestoreid": "",
  "script": {
    "files": [
      {
        "game": "N/A:Select the Ys I installer provided by GOG."
      }
    ],
    "game": {
      "prefix": "$GAMEDIR",
      "exe": "drive_c/GOG Games/Ys I/ys1plus.exe"
    },
    "installer": [
      {
        "task": {
          "args": "/SILENT /SUPPRESSMSGBOXES /NOGUI",
          "name": "wineexec",
          "executable": "game",
          "prefix": "$GAMEDIR"
        }
      },
      {
        "task": {
          "description": "Setting Windows version to XP",
          "name": "winetricks",
          "app": "winxp",
          "prefix": "$GAMEDIR"
        }
      },
      {
        "task": {
          "description": "installing quartz",
          "name": "winetricks",
          "app": "quartz",
          "prefix": "$GAMEDIR"
        }
      },
      {
        "task": {
          "description": "installing amstream",
          "name": "winetricks",
          "app": "amstream",
          "prefix": "$GAMEDIR"
        }
      },
      {
        "task": {
          "prefix": "$GAMEDIR",
          "name": "winekill"
        }
      },
      {
        "task": {
          "args": "-u",
          "name": "wineexec",
          "executable": "wineboot",
          "description": "updating WINEPREFIX",
          "prefix": "$GAMEDIR"
        }
      }
    ],
    "wine": {
      "overrides": {
        "winegstreamer": "disabled"
      }
    }
  },
  "content": "files:\n- game: N/A:Select the Ys I installer provided by GOG.\ngame:\n  exe: drive_c/GOG Games/Ys I/ys1plus.exe\n  prefix: $GAMEDIR\ninstaller:\n- task:\n    args: /SILENT /SUPPRESSMSGBOXES /NOGUI\n    executable: game\n    name: wineexec\n    prefix: $GAMEDIR\n- task:\n    app: winxp\n    description: Setting Windows version to XP\n    name: winetricks\n    prefix: $GAMEDIR\n- task:\n    app: quartz\n    description: installing quartz\n    name: winetricks\n    prefix: $GAMEDIR\n- task:\n    app: amstream\n    description: installing amstream\n    name: winetricks\n    prefix: $GAMEDIR\n- task:\n    name: winekill\n    prefix: $GAMEDIR\n- task:\n    args: -u\n    description: updating WINEPREFIX\n    executable: wineboot\n    name: wineexec\n    prefix: $GAMEDIR\nwine:\n  overrides:\n    winegstreamer: disabled\n"
}