{
  "id": 14702,
  "game_id": 6164,
  "game_slug": "doom",
  "name": "DOOM",
  "year": 2016,
  "user": "Chire",
  "runner": "winesteam",
  "slug": "doom-change-me",
  "version": "Change Me",
  "description": null,
  "notes": "",
  "created_at": "2019-07-24T16:13:51.783619Z",
  "updated_at": "2019-07-24T16:13:51.783656Z",
  "draft": false,
  "published": false,
  "published_by": null,
  "rating": "",
  "steamid": 379720,
  "gogid": null,
  "gogslug": "",
  "humblestoreid": "doom",
  "script": {
    "game": {
      "arch": "win64",
      "prefix": "$GAMEDIR/prefix",
      "appid": 379720,
      "args": "+r_renderapi 1"
    },
    "files": [
      {
        "chroma": "https://github.com/Riesi/CChromaEditor/files/2277158/CChromaEditorLibrary.zip"
      }
    ],
    "system": {
      "disable_runtime": true,
      "pulse_latency": true
    },
    "installer": [
      {
        "task": {
          "arch": "win64",
          "prefix": "$GAMEDIR/prefix",
          "name": "winetricks",
          "app": "win7"
        }
      },
      {
        "task": {
          "arch": "win64",
          "prefix": "$GAMEDIR/prefix",
          "name": "winetricks",
          "app": "vcrun2015"
        }
      },
      {
        "extract": {
          "dst": "$CACHE",
          "file": "$chroma"
        }
      },
      {
        "merge": {
          "dst": "$GAMEDIR",
          "src": "$CACHE/CChromaEditorLibrary.dll"
        }
      }
    ],
    "winesteam": {
      "esync": "true",
      "version": "tkg-4.0-x86_64"
    }
  },
  "content": "files:\r\n- chroma: https://github.com/Riesi/CChromaEditor/files/2277158/CChromaEditorLibrary.zip\r\ngame:\r\n  appid: 379720\r\n  arch: win64\r\n  args: +r_renderapi 1\r\n  prefix: $GAMEDIR/prefix\r\ninstaller:\r\n- task:\r\n    app: win7\r\n    arch: win64\r\n    name: winetricks\r\n    prefix: $GAMEDIR/prefix\r\n- task:\r\n    app: vcrun2015\r\n    arch: win64\r\n    name: winetricks\r\n    prefix: $GAMEDIR/prefix\r\n- extract:\r\n    dst: $CACHE\r\n    file: $chroma\r\n- merge:\r\n    dst: $GAMEDIR\r\n    src: $CACHE/CChromaEditorLibrary.dll\r\nsystem:\r\n  disable_runtime: true\r\n  pulse_latency: true\r\nwinesteam:\r\n  esync: 'true'\r\n  version: tkg-4.0-x86_64"
}