{
  "id": 21100,
  "game_id": 59,
  "game_slug": "amnesia-the-dark-descent",
  "name": "Amnesia: The Dark Descent",
  "year": 2010,
  "user": "cheemeer",
  "runner": "wine",
  "slug": "amnesia-the-dark-descent-epic-games",
  "version": "Epic Games",
  "description": "This is the windows version of Amnesia: The Dark Descent provided by Epic Games",
  "notes": "This only installs Epic Games Launcher. The game itself must be installed manually.",
  "created_at": "2020-05-31T13:25:37.056000Z",
  "updated_at": "2020-06-27T01:36:13.903553Z",
  "draft": false,
  "published": true,
  "published_by": 20548,
  "rating": "",
  "steamid": 57300,
  "gogid": 1207659259,
  "gogslug": "amnesia_the_dark_descent",
  "humbleid": "amnesia",
  "humblestoreid": "amnesia",
  "humblestoreid_real": "",
  "script": {
    "files": [
      {
        "epic": "https://launcher-public-service-prod06.ol.epicgames.com/launcher/api/installer/download/EpicGamesLauncherInstaller.msi"
      },
      {
        "audio": "https://lutris.net/files/tools/directx-2010.tar.gz"
      },
      {
        "mfinstaller": "https://lutris.nyc3.cdn.digitaloceanspaces.com/games/epic-games-store/mf-install-master.zip"
      }
    ],
    "game": {
      "arch": "win64",
      "args": "-SkipBuildPatchPrereq -opengl",
      "exe": "drive_c/Program Files (x86)/Epic Games/Launcher/Portal/Binaries/Win32/EpicGamesLauncher.exe",
      "prefix": "$GAMEDIR"
    },
    "installer": [
      {
        "extract": {
          "dst": "$CACHE/dxsetup",
          "file": "audio"
        }
      },
      {
        "task": {
          "arch": "win64",
          "name": "create_prefix",
          "prefix": "$GAMEDIR"
        }
      },
      {
        "task": {
          "arch": "win64",
          "args": "/silent",
          "executable": "$CACHE/dxsetup/DXSETUP.exe",
          "name": "wineexec",
          "prefix": "$GAMEDIR"
        }
      },
      {
        "task": {
          "arch": "win64",
          "name": "winekill",
          "prefix": "$GAMEDIR"
        }
      },
      {
        "extract": {
          "dst": "$CACHE/mfinstaller",
          "file": "mfinstaller"
        }
      },
      {
        "execute": {
          "command": "$CACHE/mfinstaller/install-mf.sh",
          "env": {
            "WINEPREFIX": "$GAMEDIR"
          }
        }
      },
      {
        "task": {
          "arch": "win64",
          "name": "winekill",
          "prefix": "$GAMEDIR"
        }
      },
      {
        "task": {
          "app": "arial vcrun2019 cjkfonts win10",
          "arch": "win64",
          "description": "Installing dependencies",
          "name": "winetricks",
          "prefix": "$GAMEDIR"
        }
      },
      {
        "task": {
          "arch": "win64",
          "name": "winekill",
          "prefix": "$GAMEDIR"
        }
      },
      {
        "copy": {
          "dst": "$CACHE/epic/",
          "src": "epic"
        }
      },
      {
        "task": {
          "arch": "win64",
          "args": "/i \"$CACHE/epic/EpicGamesLauncherInstaller.msi\" /q",
          "exclude_processes": "EpicGamesLauncher.exe",
          "executable": "msiexec",
          "name": "wineexec",
          "prefix": "$GAMEDIR"
        }
      },
      {
        "task": {
          "arch": "win64",
          "name": "winekill",
          "prefix": "$GAMEDIR"
        }
      }
    ],
    "system": {
      "env": {
        "DXVK_HUD": "compiler",
        "__GL_SHADER_DISK_CACHE": 1,
        "__GL_SHADER_DISK_CACHE_PATH": "$GAMEDIR"
      }
    },
    "wine": {
      "dxvk": true,
      "esync": true
    }
  },
  "content": "files:\r\n- epic: https://launcher-public-service-prod06.ol.epicgames.com/launcher/api/installer/download/EpicGamesLauncherInstaller.msi\r\n- audio: https://lutris.net/files/tools/directx-2010.tar.gz\r\n- mfinstaller: https://lutris.nyc3.cdn.digitaloceanspaces.com/games/epic-games-store/mf-install-master.zip\r\ngame:\r\n  arch: win64\r\n  args: -SkipBuildPatchPrereq -opengl\r\n  exe: drive_c/Program Files (x86)/Epic Games/Launcher/Portal/Binaries/Win32/EpicGamesLauncher.exe\r\n  prefix: $GAMEDIR\r\ninstaller:\r\n- extract:\r\n    dst: $CACHE/dxsetup\r\n    file: audio\r\n- task:\r\n    arch: win64\r\n    name: create_prefix\r\n    prefix: $GAMEDIR\r\n- task:\r\n    arch: win64\r\n    args: /silent\r\n    executable: $CACHE/dxsetup/DXSETUP.exe\r\n    name: wineexec\r\n    prefix: $GAMEDIR\r\n- task:\r\n    arch: win64\r\n    name: winekill\r\n    prefix: $GAMEDIR\r\n- extract:\r\n    dst: $CACHE/mfinstaller\r\n    file: mfinstaller\r\n- execute:\r\n    command: $CACHE/mfinstaller/install-mf.sh\r\n    env:\r\n      WINEPREFIX: $GAMEDIR\r\n- task:\r\n    arch: win64\r\n    name: winekill\r\n    prefix: $GAMEDIR\r\n- task:\r\n    app: arial vcrun2019 cjkfonts win10\r\n    arch: win64\r\n    description: Installing dependencies\r\n    name: winetricks\r\n    prefix: $GAMEDIR\r\n- task:\r\n    arch: win64\r\n    name: winekill\r\n    prefix: $GAMEDIR\r\n- copy:\r\n    dst: $CACHE/epic/\r\n    src: epic\r\n- task:\r\n    arch: win64\r\n    args: /i \"$CACHE/epic/EpicGamesLauncherInstaller.msi\" /q\r\n    exclude_processes: EpicGamesLauncher.exe\r\n    executable: msiexec\r\n    name: wineexec\r\n    prefix: $GAMEDIR\r\n- task:\r\n    arch: win64\r\n    name: winekill\r\n    prefix: $GAMEDIR\r\nsystem:\r\n  env:\r\n    DXVK_HUD: compiler\r\n    __GL_SHADER_DISK_CACHE: 1\r\n    __GL_SHADER_DISK_CACHE_PATH: $GAMEDIR\r\nwine:\r\n  dxvk: true\r\n  esync: true"
}