{
  "id": 14105,
  "game_id": 27990,
  "game_slug": "pro-evolution-soccer-2010",
  "name": "Pro Evolution Soccer 2010",
  "year": 2009,
  "user": "mikescho",
  "runner": "wine",
  "slug": "pro-evolution-soccer-2010-dvd",
  "version": "DVD",
  "description": null,
  "notes": "",
  "created_at": "2019-06-15T08:57:06.126197Z",
  "updated_at": "2019-06-15T08:57:06.126227Z",
  "draft": true,
  "published": false,
  "published_by": null,
  "rating": "",
  "steamid": null,
  "gogid": null,
  "gogslug": "",
  "humblestoreid": "",
  "script": {
    "game": {
      "exe": "drive_c/Program Files/KONAMI/Pro Evolution Soccer 2010/pes2010.exe",
      "arch": "win32",
      "prefix": "$GAMEDIR"
    },
    "wine": {
      "overrides": {
        "dxgi": "disable",
        "nvcuda": "disable"
      },
      "version": "staging-3.3-i386"
    },
    "installer": [
      {
        "insert-disc": {
          "requires": "Setup.exe"
        }
      },
      {
        "task": {
          "description": "Creating 64bit Wine prefix.",
          "prefix": "$GAMEDIR",
          "arch": "win64",
          "name": "create_prefix"
        }
      },
      {
        "task": {
          "prefix": "$GAMEDIR",
          "name": "set_regedit",
          "description": "Enabling CSMT for better graphic performance.",
          "path": "HKEY_CURRENT_USER\\Software\\Wine\\DllRedirects",
          "value": "wined3d-csmt.dll",
          "key": "wined3d"
        }
      },
      {
        "task": {
          "description": "Installing PES6.\nThe installating folder MUST BE 'C:\\Program Files\\KONAMI\\Pro Evolution Soccer 2010'",
          "prefix": "$GAMEDIR",
          "executable": "$DISC/Setup.exe",
          "name": "wineexec"
        }
      },
      {
        "task": {
          "prefix": "$GAMEDIR",
          "app": "d3dx9",
          "name": "winetricks"
        }
      }
    ]
  },
  "content": "game:\n  arch: win32\n  exe: drive_c/Program Files/KONAMI/Pro Evolution Soccer 2010/pes2010.exe\n  prefix: $GAMEDIR\ninstaller:\n- insert-disc:\n    requires: Setup.exe\n- task:\n    arch: win64\n    description: Creating 64bit Wine prefix.\n    name: create_prefix\n    prefix: $GAMEDIR\n- task:\n    description: Enabling CSMT for better graphic performance.\n    key: wined3d\n    name: set_regedit\n    path: HKEY_CURRENT_USER\\Software\\Wine\\DllRedirects\n    prefix: $GAMEDIR\n    value: wined3d-csmt.dll\n- task:\n    description: 'Installing PES6.\n\n      The installating folder MUST BE ''C:\\Program Files\\KONAMI\\Pro Evolution Soccer\n      2010'''\n    executable: $DISC/Setup.exe\n    name: wineexec\n    prefix: $GAMEDIR\n- task:\n    app: d3dx9\n    name: winetricks\n    prefix: $GAMEDIR\nwine:\n  overrides:\n    dxgi: disable\n    nvcuda: disable\n  version: staging-3.3-i386\n"
}