{
  "id": 11235,
  "game_id": 17980,
  "game_slug": "battletech",
  "name": "BATTLETECH",
  "year": 2018,
  "user": "Sompom",
  "runner": "wine",
  "slug": "battletech-gog-w-dxvk",
  "version": "GOG w/ DXVK",
  "description": null,
  "notes": "",
  "created_at": "2018-12-16T03:43:06.483000Z",
  "updated_at": "2020-01-23T02:57:13.848773Z",
  "draft": false,
  "published": true,
  "published_by": 19464,
  "rating": "",
  "steamid": 637090,
  "gogid": 1482783682,
  "gogslug": "battletech_game",
  "humblestoreid": "",
  "script": {
    "files": [
      {
        "goginstaller": "N/A:Select the BATTLETECH setup file"
      },
      {
        "CCCP": "http://www.cccp-project.net/public/Combined-Community-Codec-Pack-64bit-2015-10-18.exe"
      }
    ],
    "installer": [
      {
        "task": {
          "prefix": "$GAMEDIR",
          "name": "create_prefix",
          "arch": "win64"
        }
      },
      {
        "task": {
          "description": "Installing dotnet472 with winetricks. This will take several minutes.",
          "name": "winetricks",
          "arch": "win64",
          "app": "dotnet472",
          "prefix": "$GAMEDIR"
        }
      },
      {
        "task": {
          "description": "Installing CCCP (Combined Community Codec Pack) else cutscenes can't play and the game can't launch. Please follow the installer prompts to select \"Full Installation\".",
          "name": "wineexec",
          "arch": "win64",
          "executable": "CCCP",
          "prefix": "$GAMEDIR"
        }
      },
      {
        "task": {
          "description": "Please wait while the game installs. This will take several minutes.",
          "name": "wineexec",
          "arch": "win64",
          "executable": "goginstaller",
          "args": "/LANG=en /SP- /SUPPRESSMSGBOXES",
          "prefix": "$GAMEDIR"
        }
      }
    ],
    "game": {
      "args": "-force-driver-type-warp",
      "arch": "win64",
      "exe": "drive_c/GOG Games/BATTLETECH/BattleTechLauncher.exe",
      "prefix": "$GAMEDIR"
    },
    "system": {
      "env": {
        "DXVK_HUD": 0
      }
    },
    "wine": {
      "dxvk": true
    }
  },
  "content": "files:\n- goginstaller: N/A:Select the BATTLETECH setup file\n- CCCP: http://www.cccp-project.net/public/Combined-Community-Codec-Pack-64bit-2015-10-18.exe\ngame:\n  arch: win64\n  args: -force-driver-type-warp\n  exe: drive_c/GOG Games/BATTLETECH/BattleTechLauncher.exe\n  prefix: $GAMEDIR\ninstaller:\n- task:\n    arch: win64\n    name: create_prefix\n    prefix: $GAMEDIR\n- task:\n    app: dotnet472\n    arch: win64\n    description: Installing dotnet472 with winetricks. This will take several minutes.\n    name: winetricks\n    prefix: $GAMEDIR\n- task:\n    arch: win64\n    description: Installing CCCP (Combined Community Codec Pack) else cutscenes can't\n      play and the game can't launch. Please follow the installer prompts to select\n      \"Full Installation\".\n    executable: CCCP\n    name: wineexec\n    prefix: $GAMEDIR\n- task:\n    arch: win64\n    args: /LANG=en /SP- /SUPPRESSMSGBOXES\n    description: Please wait while the game installs. This will take several minutes.\n    executable: goginstaller\n    name: wineexec\n    prefix: $GAMEDIR\nsystem:\n  env:\n    DXVK_HUD: 0\nwine:\n  dxvk: true\n"
}