{
  "id": 4046,
  "game_id": 5227,
  "game_slug": "one-piece-pirate-warriors-3",
  "name": "ONE PIECE PIRATE WARRIORS 3",
  "year": null,
  "user": "oem",
  "runner": "winesteam",
  "slug": "one-piece-pirate-warriors-3-steam",
  "version": "Steam",
  "description": null,
  "notes": "",
  "created_at": "2017-06-02T08:04:10.039000Z",
  "updated_at": "2018-08-25T14:01:04.744335Z",
  "draft": false,
  "published": true,
  "published_by": null,
  "rating": "",
  "steamid": 331600,
  "gogid": null,
  "gogslug": "",
  "humblestoreid": "",
  "script": {
    "game": {
      "prefix": "$GAMEDIR/prefix",
      "appid": 331600,
      "arch": "win32"
    },
    "system": {
      "xboxdrv": "$GAMEDIR/remap.xboxdrv"
    },
    "installer": [
      {
        "task": {
          "name": "winetricks",
          "description": "Setting Windows version to XP",
          "silent": true,
          "prefix": "$GAMEDIR/prefix",
          "app": "winxp",
          "arch": "win32"
        }
      },
      {
        "task": {
          "name": "winetricks",
          "description": "Installing devenum",
          "silent": true,
          "prefix": "$GAMEDIR/prefix",
          "app": "devenum",
          "arch": "win32"
        }
      },
      {
        "task": {
          "name": "winetricks",
          "description": "Installing quartz",
          "silent": true,
          "prefix": "$GAMEDIR/prefix",
          "app": "quartz",
          "arch": "win32"
        }
      },
      {
        "task": {
          "name": "winetricks",
          "description": "Installing Windows Media Player 10",
          "silent": true,
          "prefix": "$GAMEDIR/prefix",
          "app": "wmp10",
          "arch": "win32"
        }
      },
      {
        "task": {
          "description": "Setting Windows version to Windows 7",
          "arch": "win32",
          "prefix": "$GAMEDIR/prefix",
          "name": "winetricks",
          "app": "win7"
        }
      },
      {
        "write_file": {
          "description": "Create config for XBOX 360 controller",
          "content": "[xboxdrv]\nsilent=true\ntrigger-as-button=true\ndeadzone=4000\n[buttonmap]\nA=X\nX=A\nB=Y\nY=B\nguide=back\nback=guide\nstart=tl\ntl=tr\ntr=start\n[ui-axismap]\nx2=ABS_Z\ny2=ABS_RZ\n[xboxdrv-daemon]\ndbus=disabled\n",
          "file": "$GAMEDIR/remap.xboxdrv"
        }
      }
    ]
  },
  "content": "game:\n  appid: 331600\n  arch: win32\n  prefix: $GAMEDIR/prefix\ninstaller:\n- task:\n    app: winxp\n    arch: win32\n    description: Setting Windows version to XP\n    name: winetricks\n    prefix: $GAMEDIR/prefix\n    silent: true\n- task:\n    app: devenum\n    arch: win32\n    description: Installing devenum\n    name: winetricks\n    prefix: $GAMEDIR/prefix\n    silent: true\n- task:\n    app: quartz\n    arch: win32\n    description: Installing quartz\n    name: winetricks\n    prefix: $GAMEDIR/prefix\n    silent: true\n- task:\n    app: wmp10\n    arch: win32\n    description: Installing Windows Media Player 10\n    name: winetricks\n    prefix: $GAMEDIR/prefix\n    silent: true\n- task:\n    app: win7\n    arch: win32\n    description: Setting Windows version to Windows 7\n    name: winetricks\n    prefix: $GAMEDIR/prefix\n- write_file:\n    content: '[xboxdrv]\n\n      silent=true\n\n      trigger-as-button=true\n\n      deadzone=4000\n\n      [buttonmap]\n\n      A=X\n\n      X=A\n\n      B=Y\n\n      Y=B\n\n      guide=back\n\n      back=guide\n\n      start=tl\n\n      tl=tr\n\n      tr=start\n\n      [ui-axismap]\n\n      x2=ABS_Z\n\n      y2=ABS_RZ\n\n      [xboxdrv-daemon]\n\n      dbus=disabled\n\n      '\n    description: Create config for XBOX 360 controller\n    file: $GAMEDIR/remap.xboxdrv\nsystem:\n  xboxdrv: $GAMEDIR/remap.xboxdrv\n"
}