{
  "id": 13782,
  "game_id": 2925,
  "game_slug": "warcraft-iii-the-frozen-throne",
  "name": "Warcraft III: The Frozen Throne",
  "year": 2003,
  "user": "agre",
  "runner": "wine",
  "slug": "warcraft-iii-the-frozen-thron-digital",
  "version": "Digital",
  "description": null,
  "notes": "This should install WC3TFT for you with the installer from battle.net.\r\nIt will install the battlenet client first. When it's done with installing, log in before installing WC3. When you see the empty window where you should input your CD key, move it around until you see the field where you can type your CD key.",
  "created_at": "2019-05-29T08:48:54.243000Z",
  "updated_at": "2020-02-02T09:12:30.142733Z",
  "draft": false,
  "published": true,
  "published_by": 494,
  "rating": "",
  "steamid": null,
  "gogid": null,
  "gogslug": "",
  "humblestoreid": "",
  "script": {
    "files": [
      {
        "setup2": "N/A:Select the installer for Warcraft III: Reign of Chaos"
      }
    ],
    "installer": [
      {
        "task": {
          "arch": "win64",
          "description": "Creating 64bit Wine prefix.",
          "prefix": "$GAMEDIR",
          "name": "create_prefix"
        }
      },
      {
        "task": {
          "prefix": "$GAMEDIR",
          "name": "winetricks",
          "arch": "win64",
          "silent": true,
          "description": "Installing Arial font...",
          "app": "arial"
        }
      },
      {
        "task": {
          "prefix": "$GAMEDIR",
          "value": "win7",
          "arch": "win64",
          "key": "Version",
          "name": "set_regedit",
          "description": "Setting Windows 7 mode for Wine",
          "path": "HKEY_CURRENT_USER\\Software\\Wine"
        }
      },
      {
        "task": {
          "executable": "setup2",
          "description": "Installing Warcraft III: The Frozen Throne",
          "prefix": "$GAMEDIR",
          "name": "wineexec"
        }
      }
    ],
    "system": {
      "env": {
        "__GL_SHADER_DISK_CACHE_PATH": "$GAMEDIR",
        "STAGING_SHARED_MEMORY": 1,
        "DXVK_HUD": "compiler",
        "__GL_SHADER_DISK_CACHE": 1,
        "DXVK_STATE_CACHE_PATH": "$GAMEDIR"
      }
    },
    "wine": {
      "dxvk": true,
      "overrides": {
        "nvapi": "disabled",
        "d3d12": "disabled",
        "nvapi64": "disabled"
      },
      "esync": true
    },
    "game": {
      "arch": "win64",
      "prefix": "$GAMEDIR",
      "exe": "drive_c/Program Files/Warcraft III/x86_64/Warcraft III.exe"
    }
  },
  "content": "files:\n- setup2: 'N/A:Select the installer for Warcraft III: Reign of Chaos'\ngame:\n  arch: win64\n  exe: drive_c/Program Files/Warcraft III/x86_64/Warcraft III.exe\n  prefix: $GAMEDIR\ninstaller:\n- task:\n    arch: win64\n    description: Creating 64bit Wine prefix.\n    name: create_prefix\n    prefix: $GAMEDIR\n- task:\n    app: arial\n    arch: win64\n    description: Installing Arial font...\n    name: winetricks\n    prefix: $GAMEDIR\n    silent: true\n- task:\n    arch: win64\n    description: Setting Windows 7 mode for Wine\n    key: Version\n    name: set_regedit\n    path: HKEY_CURRENT_USER\\Software\\Wine\n    prefix: $GAMEDIR\n    value: win7\n- task:\n    description: 'Installing Warcraft III: The Frozen Throne'\n    executable: setup2\n    name: wineexec\n    prefix: $GAMEDIR\nsystem:\n  env:\n    DXVK_HUD: compiler\n    DXVK_STATE_CACHE_PATH: $GAMEDIR\n    STAGING_SHARED_MEMORY: 1\n    __GL_SHADER_DISK_CACHE: 1\n    __GL_SHADER_DISK_CACHE_PATH: $GAMEDIR\nwine:\n  dxvk: true\n  esync: true\n  overrides:\n    d3d12: disabled\n    nvapi: disabled\n    nvapi64: disabled\n"
}