{
  "id": 2985,
  "game_id": 709,
  "game_slug": "alice-madness-returns",
  "name": "Alice: Madness Returns",
  "year": 2011,
  "user": "Retro_Beatz",
  "runner": "winesteam",
  "slug": "alice-madness-returns-steam",
  "version": "Steam",
  "description": "",
  "notes": "It runs but the Wine Taskbar is in the way and it runs slow, at least on my laptop it does.",
  "created_at": "2016-11-06T19:22:13.546105Z",
  "updated_at": "2016-11-07T19:23:38.023178Z",
  "draft": false,
  "published": true,
  "published_by": null,
  "rating": "",
  "steamid": 19680,
  "gogid": null,
  "gogslug": "",
  "humblestoreid": "",
  "script": {
    "game": {
      "prefix": "$GAMEDIR/prefix",
      "appid": 19680
    },
    "installer": [
      {
        "task": {
          "description": "Installing PhsyX",
          "prefix": "$GAMEDIR/prefix",
          "app": "physx",
          "name": "winetricks"
        }
      },
      {
        "task": {
          "description": "Installing DotNet 3.5",
          "prefix": "$GAMEDIR/prefix",
          "app": "dotnet35",
          "name": "winetricks"
        }
      },
      {
        "task": {
          "description": "Installing DirectX part 1 of 9",
          "prefix": "$GAMEDIR/prefix",
          "app": "d3dx10",
          "name": "winetricks"
        }
      },
      {
        "task": {
          "description": "Installing DirectX part 2 of 9",
          "prefix": "$GAMEDIR/prefix",
          "app": "d3dx9_26",
          "name": "winetricks"
        }
      },
      {
        "task": {
          "description": "Installing DirectX part 3 of 9",
          "prefix": "$GAMEDIR/prefix",
          "app": "d3dx9_28",
          "name": "winetricks"
        }
      },
      {
        "task": {
          "description": "Installing DirectX part 4 of 9",
          "prefix": "$GAMEDIR/prefix",
          "app": "d3dx9_31",
          "name": "winetricks"
        }
      },
      {
        "task": {
          "description": "Installing DirectX part 5 of 9",
          "prefix": "$GAMEDIR/prefix",
          "app": "d3dx9_35",
          "name": "winetricks"
        }
      },
      {
        "task": {
          "description": "Installing DirectX part 6 of 9",
          "prefix": "$GAMEDIR/prefix",
          "app": "d3dx9_36",
          "name": "winetricks"
        }
      },
      {
        "task": {
          "description": "Installing DirectX part 7 of 9",
          "prefix": "$GAMEDIR/prefix",
          "app": "d3dx9_39",
          "name": "winetricks"
        }
      },
      {
        "task": {
          "description": "Installing DirectX part 8 of 9",
          "prefix": "$GAMEDIR/prefix",
          "app": "d3dx9_42",
          "name": "winetricks"
        }
      },
      {
        "task": {
          "description": "Installing DirectX part 9 of 9",
          "prefix": "$GAMEDIR/prefix",
          "app": "d3dx9_43",
          "name": "winetricks"
        }
      },
      {
        "task": {
          "description": "Installing Visual C++ 2008",
          "prefix": "$GAMEDIR/prefix",
          "app": "vcrun2008",
          "name": "winetricks"
        }
      }
    ]
  },
  "content": "game:\n  appid: 19680\n  prefix: $GAMEDIR/prefix\ninstaller:\n- task:\n    app: physx\n    description: Installing PhsyX\n    name: winetricks\n    prefix: $GAMEDIR/prefix\n- task:\n    app: dotnet35\n    description: Installing DotNet 3.5\n    name: winetricks\n    prefix: $GAMEDIR/prefix\n- task:\n    app: d3dx10\n    description: Installing DirectX part 1 of 9\n    name: winetricks\n    prefix: $GAMEDIR/prefix\n- task:\n    app: d3dx9_26\n    description: Installing DirectX part 2 of 9\n    name: winetricks\n    prefix: $GAMEDIR/prefix\n- task:\n    app: d3dx9_28\n    description: Installing DirectX part 3 of 9\n    name: winetricks\n    prefix: $GAMEDIR/prefix\n- task:\n    app: d3dx9_31\n    description: Installing DirectX part 4 of 9\n    name: winetricks\n    prefix: $GAMEDIR/prefix\n- task:\n    app: d3dx9_35\n    description: Installing DirectX part 5 of 9\n    name: winetricks\n    prefix: $GAMEDIR/prefix\n- task:\n    app: d3dx9_36\n    description: Installing DirectX part 6 of 9\n    name: winetricks\n    prefix: $GAMEDIR/prefix\n- task:\n    app: d3dx9_39\n    description: Installing DirectX part 7 of 9\n    name: winetricks\n    prefix: $GAMEDIR/prefix\n- task:\n    app: d3dx9_42\n    description: Installing DirectX part 8 of 9\n    name: winetricks\n    prefix: $GAMEDIR/prefix\n- task:\n    app: d3dx9_43\n    description: Installing DirectX part 9 of 9\n    name: winetricks\n    prefix: $GAMEDIR/prefix\n- task:\n    app: vcrun2008\n    description: Installing Visual C++ 2008\n    name: winetricks\n    prefix: $GAMEDIR/prefix\n"
}