{
  "id": 17817,
  "game_id": 4275,
  "game_slug": "elite-dangerous",
  "name": "Elite: Dangerous",
  "year": 2014,
  "user": "dageeew",
  "runner": "wine",
  "slug": "elite-dangerous-change-me-1",
  "version": "Change Me",
  "description": null,
  "notes": "Download the setup exe by signing in to your Frontier account and visiting the <a href=\"https://www.frontierstore.net/downloadable/customer/products/\">My Downloadable Products</a> page of the Frontier Store.",
  "created_at": "2020-01-08T20:29:54.974936Z",
  "updated_at": "2020-01-23T02:56:57.182972Z",
  "draft": false,
  "published": false,
  "published_by": 20548,
  "rating": "",
  "steamid": 359320,
  "gogid": null,
  "gogslug": "",
  "humblestoreid": "",
  "script": {
    "files": [
      {
        "setup": "N/A:Select setup exe for Elite Dangerous"
      }
    ],
    "installer": [
      {
        "task": {
          "arch": "win64",
          "description": "Creating Wine prefix",
          "prefix": "$GAMEDIR",
          "name": "create_prefix"
        }
      },
      {
        "task": {
          "arch": "win64",
          "description": "Installing Internet Explorer 8 (necessary!))",
          "app": "ie8",
          "prefix": "$GAMEDIR",
          "name": "winetricks"
        }
      },
      {
        "task": {
          "arch": "win64",
          "description": "Installing Dot.NET 4.7.2",
          "app": "dotnet472",
          "prefix": "$GAMEDIR",
          "name": "winetricks"
        }
      },
      {
        "task": {
          "arch": "win64",
          "description": "Installing vcrun2010 vcrun2012 vcrun2015",
          "app": "vcrun2010 vcrun2012 vcrun2015",
          "prefix": "$GAMEDIR",
          "name": "winetricks"
        }
      },
      {
        "task": {
          "description": "Installing MS Line Services",
          "app": "msls31",
          "prefix": "$GAMEDIR",
          "name": "winetricks"
        }
      },
      {
        "task": {
          "arch": "win64",
          "description": "Installing Quartz",
          "app": "quartz",
          "prefix": "$GAMEDIR",
          "name": "winetricks"
        }
      },
      {
        "task": {
          "arch": "win64",
          "description": "Installing Arial",
          "app": "arial",
          "prefix": "$GAMEDIR",
          "name": "winetricks"
        }
      },
      {
        "task": {
          "arch": "win64",
          "description": "Set Windows version to Windows 7",
          "app": "win7",
          "prefix": "$GAMEDIR",
          "name": "winetricks"
        }
      },
      {
        "task": {
          "prefix": "$GAMEDIR",
          "name": "wineexec",
          "arch": "win64",
          "args": "/silent",
          "executable": "setup",
          "description": "Installing Elite Dangerous"
        }
      },
      {
        "task": {
          "prefix": "$GAMEDIR",
          "name": "winekill"
        }
      }
    ],
    "system": {
      "env": {
        "DXVK_HUD": 0
      },
      "pulse_latency": true
    },
    "wine": {
      "dxvk": true
    },
    "game": {
      "arch": "win64",
      "prefix": "$GAMEDIR",
      "exe": "drive_c/Program Files (x86)/Frontier/EDLaunch/EDLaunch.exe"
    }
  },
  "content": "files:\n- setup: N/A:Select setup exe for Elite Dangerous\ngame:\n  arch: win64\n  exe: drive_c/Program Files (x86)/Frontier/EDLaunch/EDLaunch.exe\n  prefix: $GAMEDIR\ninstaller:\n- task:\n    arch: win64\n    description: Creating Wine prefix\n    name: create_prefix\n    prefix: $GAMEDIR\n- task:\n    app: ie8\n    arch: win64\n    description: Installing Internet Explorer 8 (necessary!))\n    name: winetricks\n    prefix: $GAMEDIR\n- task:\n    app: dotnet472\n    arch: win64\n    description: Installing Dot.NET 4.7.2\n    name: winetricks\n    prefix: $GAMEDIR\n- task:\n    app: vcrun2010 vcrun2012 vcrun2015\n    arch: win64\n    description: Installing vcrun2010 vcrun2012 vcrun2015\n    name: winetricks\n    prefix: $GAMEDIR\n- task:\n    app: msls31\n    description: Installing MS Line Services\n    name: winetricks\n    prefix: $GAMEDIR\n- task:\n    app: quartz\n    arch: win64\n    description: Installing Quartz\n    name: winetricks\n    prefix: $GAMEDIR\n- task:\n    app: arial\n    arch: win64\n    description: Installing Arial\n    name: winetricks\n    prefix: $GAMEDIR\n- task:\n    app: win7\n    arch: win64\n    description: Set Windows version to Windows 7\n    name: winetricks\n    prefix: $GAMEDIR\n- task:\n    arch: win64\n    args: /silent\n    description: Installing Elite Dangerous\n    executable: setup\n    name: wineexec\n    prefix: $GAMEDIR\n- task:\n    name: winekill\n    prefix: $GAMEDIR\nsystem:\n  env:\n    DXVK_HUD: 0\n  pulse_latency: true\nwine:\n  dxvk: true\n"
}