{
  "id": 7607,
  "game_id": 17450,
  "game_slug": "battlefield-1",
  "name": "Battlefield 1",
  "year": 2016,
  "user": "cxf",
  "runner": "wine",
  "slug": "battlefield-1-dxvk",
  "version": "DXVK",
  "description": "Only sets up Origin and DXVK you'll need to download Battlefield 1 manually.\r\n\r\n(It is recommended to install this game on an ssd if possible, this has been found to decrease stutters)",
  "notes": "Please read before installing: <a href=\"https://github.com/lutris/lutris/wiki/Game:-Origin\">https://github.com/lutris/lutris/wiki/Game:-Origin</a>",
  "created_at": "2018-03-20T02:19:15.802000Z",
  "updated_at": "2020-01-23T02:57:01.915114Z",
  "draft": false,
  "published": true,
  "published_by": 19464,
  "rating": "",
  "steamid": null,
  "gogid": null,
  "gogslug": "",
  "humblestoreid": "",
  "script": {
    "files": [
      {
        "client": "https://origin-a.akamaihd.net/Origin-Client-Download/origin/live/OriginThinSetup.exe"
      },
      {
        "updater": "https://raw.githubusercontent.com/DrDoctor13/wine-origin-updater/master/updateorigin.sh"
      }
    ],
    "installer": [
      {
        "task": {
          "description": "Creating Wine prefix",
          "name": "create_prefix",
          "arch": "win64",
          "prefix": "$GAMEDIR"
        }
      },
      {
        "input_menu": {
          "options": [
            {
              "Not needed for AMD. Ignore this.": "AMD"
            },
            {
              "dxgi.customVendorId = 10de\ndxgi.nvapiHack = False": "Nvidia"
            }
          ],
          "description": "Setting DXVK workarounds please choose your GPU:",
          "preselect": "Not needed for AMD. Ignore this.",
          "id": "GPU"
        }
      },
      {
        "write_file": {
          "content": "$INPUT_GPU",
          "file": "$GAMEDIR/dxvk.conf"
        }
      },
      {
        "task": {
          "prefix": "$GAMEDIR",
          "name": "winetricks",
          "arch": "win64",
          "app": "nocrashdialog vcrun2017 win7"
        }
      },
      {
        "task": {
          "description": "Installing Origin... Login window will pop-up and close.",
          "name": "wineexec",
          "arch": "win64",
          "executable": "client",
          "args": "/silent",
          "prefix": "$GAMEDIR",
          "exclude_processes": "Origin.exe OriginClientService.exe OriginWebHelperService.exe QtWebEngineProcess.exe"
        }
      },
      {
        "task": {
          "prefix": "$GAMEDIR",
          "name": "winekill",
          "arch": "win64"
        }
      },
      {
        "chmodx": "updater"
      },
      {
        "merge": {
          "dst": "$GAMEDIR/drive_c/Program Files (x86)/Origin",
          "src": "updater"
        }
      }
    ],
    "game": {
      "prefix": "$GAMEDIR",
      "arch": "win64",
      "exe": "drive_c/Program Files (x86)/Origin/Origin.exe"
    },
    "system": {
      "disable_runtime": false,
      "env": {
        "DXVK_CONFIG_FILE": "$GAMEDIR/dxvk.conf",
        "DXVK_HUD": 0
      }
    },
    "wine": {
      "dxvk": true,
      "esync": true,
      "overrides": {
        "nvapi,nvapi64": "disabled",
        "xaudio2_7": "native,builtin"
      }
    }
  },
  "content": "files:\n- client: https://origin-a.akamaihd.net/Origin-Client-Download/origin/live/OriginThinSetup.exe\n- updater: https://raw.githubusercontent.com/DrDoctor13/wine-origin-updater/master/updateorigin.sh\ngame:\n  arch: win64\n  exe: drive_c/Program Files (x86)/Origin/Origin.exe\n  prefix: $GAMEDIR\ninstaller:\n- task:\n    arch: win64\n    description: Creating Wine prefix\n    name: create_prefix\n    prefix: $GAMEDIR\n- input_menu:\n    description: 'Setting DXVK workarounds please choose your GPU:'\n    id: GPU\n    options:\n    - Not needed for AMD. Ignore this.: AMD\n    - ? 'dxgi.customVendorId = 10de\n\n        dxgi.nvapiHack = False'\n      : Nvidia\n    preselect: Not needed for AMD. Ignore this.\n- write_file:\n    content: $INPUT_GPU\n    file: $GAMEDIR/dxvk.conf\n- task:\n    app: nocrashdialog vcrun2017 win7\n    arch: win64\n    name: winetricks\n    prefix: $GAMEDIR\n- task:\n    arch: win64\n    args: /silent\n    description: Installing Origin... Login window will pop-up and close.\n    exclude_processes: Origin.exe OriginClientService.exe OriginWebHelperService.exe\n      QtWebEngineProcess.exe\n    executable: client\n    name: wineexec\n    prefix: $GAMEDIR\n- task:\n    arch: win64\n    name: winekill\n    prefix: $GAMEDIR\n- chmodx: updater\n- merge:\n    dst: $GAMEDIR/drive_c/Program Files (x86)/Origin\n    src: updater\nsystem:\n  disable_runtime: false\n  env:\n    DXVK_CONFIG_FILE: $GAMEDIR/dxvk.conf\n    DXVK_HUD: 0\nwine:\n  dxvk: true\n  esync: true\n  overrides:\n    nvapi,nvapi64: disabled\n    xaudio2_7: native,builtin\n"
}