{
  "id": 19486,
  "game_id": 3167,
  "game_slug": "beamngdrive",
  "name": "BeamNG.drive",
  "year": 2015,
  "user": "T0MuX",
  "runner": "wine",
  "slug": "beamngdrive-isocd",
  "version": "ISO/CD",
  "description": "Installation from provided ISO or CD/DVD.",
  "notes": "",
  "created_at": "2020-04-06T18:00:28.341000Z",
  "updated_at": "2020-04-07T10:06:55.464963Z",
  "draft": false,
  "published": true,
  "published_by": 20548,
  "rating": "",
  "steamid": 284160,
  "gogid": null,
  "gogslug": "",
  "humblestoreid": "",
  "script": {
    "files": [
      {
        "dx2010": "https://lutris.net/files/tools/directx-2010.tar.gz"
      },
      {
        "setup": "N/A:Select the game's Setup.exe file, and PLEASE, SET THE INSTALLATION PATH TO C:\\BeamNG.drive\\ IF YOU DON'T THE GAME WILL NOT WORK."
      }
    ],
    "game": {
      "prefix": "$GAMEDIR",
      "exe": "drive_c/BeamNG.drive/BeamNG.drive.exe"
    },
    "wine": {
      "dxvk": true
    },
    "system": {
      "env": {
        "DXVK_HUD": 0
      }
    },
    "installer": [
      {
        "task": {
          "prefix": "$GAMEDIR",
          "arch": "win64",
          "name": "create_prefix"
        }
      },
      {
        "task": {
          "prefix": "$GAMEDIR",
          "arch": "win64",
          "executable": "$setup",
          "name": "wineexec"
        }
      },
      {
        "extract": {
          "file": "dx2010",
          "dst": "$CACHE/dxsetup"
        }
      },
      {
        "task": {
          "prefix": "$GAMEDIR",
          "arch": "win64",
          "executable": "$CACHE/dxsetup/DXSETUP.exe",
          "name": "wineexec",
          "args": "/silent"
        }
      },
      {
        "task": {
          "prefix": "$GAMEDIR",
          "arch": "win64",
          "app": "corefonts vcrun2015 win7",
          "name": "winetricks"
        }
      }
    ]
  },
  "content": "files:\n- dx2010: https://lutris.net/files/tools/directx-2010.tar.gz\n- setup: N/A:Select the game's Setup.exe file, and PLEASE, SET THE INSTALLATION PATH\n    TO C:\\BeamNG.drive\\ IF YOU DON'T THE GAME WILL NOT WORK.\ngame:\n  exe: drive_c/BeamNG.drive/BeamNG.drive.exe\n  prefix: $GAMEDIR\ninstaller:\n- task:\n    arch: win64\n    name: create_prefix\n    prefix: $GAMEDIR\n- task:\n    arch: win64\n    executable: $setup\n    name: wineexec\n    prefix: $GAMEDIR\n- extract:\n    dst: $CACHE/dxsetup\n    file: dx2010\n- task:\n    arch: win64\n    args: /silent\n    executable: $CACHE/dxsetup/DXSETUP.exe\n    name: wineexec\n    prefix: $GAMEDIR\n- task:\n    app: corefonts vcrun2015 win7\n    arch: win64\n    name: winetricks\n    prefix: $GAMEDIR\nsystem:\n  env:\n    DXVK_HUD: 0\nwine:\n  dxvk: true\n"
}