{
  "id": 13588,
  "game_id": 19268,
  "game_slug": "itchio",
  "name": "Itch.io",
  "year": null,
  "user": "soredake",
  "runner": "wine",
  "slug": "itchio-windows",
  "version": "Windows",
  "description": null,
  "notes": "",
  "created_at": "2019-05-17T21:17:04.843000Z",
  "updated_at": "2020-01-16T20:11:09.274016Z",
  "draft": false,
  "published": true,
  "published_by": 51687,
  "rating": "",
  "steamid": null,
  "gogid": null,
  "gogslug": "",
  "humblestoreid": "",
  "script": {
    "game": {
      "exe": "drive_c/users/$USER/Desktop/itch.lnk",
      "arch": "win64",
      "prefix": "$GAMEDIR"
    },
    "custom-name": "Itch.io For Windows",
    "wine": {
      "esync": true,
      "dxvk": true
    },
    "installer": [
      {
        "task": {
          "arch": "win64",
          "prefix": "$GAMEDIR",
          "name": "create_prefix"
        }
      },
      {
        "task": {
          "app": "arial",
          "arch": "win64",
          "prefix": "$GAMEDIR",
          "name": "winetricks"
        }
      },
      {
        "task": {
          "arch": "win64",
          "prefix": "$GAMEDIR",
          "name": "set_regedit",
          "path": "HKEY_CURRENT_USER\\Software\\Wine\\X11 Driver",
          "value": "N",
          "key": "Decorated"
        }
      },
      {
        "task": {
          "executable": "installer",
          "arch": "win64",
          "description": "Installing Itch App...",
          "args": "--silent",
          "name": "wineexec",
          "prefix": "$GAMEDIR",
          "exclude_processes": "itch.exe butler.exe"
        }
      },
      {
        "task": {
          "prefix": "$GAMEDIR",
          "name": "winekill"
        }
      }
    ],
    "files": [
      {
        "installer": {
          "filename": "itch-setup.exe",
          "url": "https://nuts.itch.zone/download/windows"
        }
      }
    ]
  },
  "content": "custom-name: Itch.io For Windows\nfiles:\n- installer:\n    filename: itch-setup.exe\n    url: https://nuts.itch.zone/download/windows\ngame:\n  arch: win64\n  exe: drive_c/users/$USER/Desktop/itch.lnk\n  prefix: $GAMEDIR\ninstaller:\n- task:\n    arch: win64\n    name: create_prefix\n    prefix: $GAMEDIR\n- task:\n    app: arial\n    arch: win64\n    name: winetricks\n    prefix: $GAMEDIR\n- task:\n    arch: win64\n    key: Decorated\n    name: set_regedit\n    path: HKEY_CURRENT_USER\\Software\\Wine\\X11 Driver\n    prefix: $GAMEDIR\n    value: N\n- task:\n    arch: win64\n    args: --silent\n    description: Installing Itch App...\n    exclude_processes: itch.exe butler.exe\n    executable: installer\n    name: wineexec\n    prefix: $GAMEDIR\n- task:\n    name: winekill\n    prefix: $GAMEDIR\nwine:\n  dxvk: true\n  esync: true\n"
}