{
  "id": 18710,
  "game_id": 31904,
  "game_slug": "space-invaders-opengl",
  "name": "Space Invaders OpenGL",
  "year": null,
  "user": "vanstaveren",
  "runner": "wine",
  "slug": "space-invaders-opengl-061-vulkan",
  "version": "0.6.1-vulkan",
  "description": null,
  "notes": "",
  "created_at": "2020-03-06T00:18:03.482000Z",
  "updated_at": "2020-03-20T10:44:33.780971Z",
  "draft": false,
  "published": false,
  "published_by": 20548,
  "rating": "",
  "steamid": null,
  "gogid": null,
  "gogslug": "",
  "humbleid": "",
  "humblestoreid": "",
  "humblestoreid_real": "",
  "script": {
    "files": [
      {
        "SpaceInvaders.zip": "https://sourceforge.net/projects/spaceinvadersgl/files/latest/download/SpaceInvadersOpenGL-0.6.1.zip"
      }
    ],
    "game": {
      "arch": "win64",
      "custom-name": "Space Invaders OpenGL",
      "exe": "drive_c/Program Files/Space Invaders OpenGL/Space Invaders OpenGL.exe",
      "prefix": "$GAMEDIR/prefix"
    },
    "installer": [
      {
        "task": {
          "arch": "win64",
          "description": "Creating 64-bit prefix ...",
          "name": "create_prefix",
          "prefix": "$GAMEDIR/prefix"
        }
      },
      {
        "extract": {
          "dst": "$GAMEDIR/prefix/drive_c/Program Files/Space Invaders OpenGL/",
          "src": "SpaceInvaders.zip"
        }
      },
      {
        "task": {
          "app": "d3dcompiler_43",
          "arch": "win64",
          "description": "DirectX 11 ...",
          "name": "winetricks",
          "prefix": "$GAMEDIR/prefix"
        }
      },
      {
        "task": {
          "app": "d3dx11_43",
          "arch": "win64",
          "description": "DirectX 11 ...",
          "name": "winetricks",
          "prefix": "$GAMEDIR/prefix"
        }
      },
      {
        "task": {
          "app": "dxvk",
          "arch": "win64",
          "description": "Vulkan ...",
          "name": "winetricks",
          "prefix": "$GAMEDIR/prefix"
        }
      },
      {
        "task": {
          "app": "win8",
          "arch": "win64",
          "description": "Windows version 8 ...",
          "name": "winetricks",
          "prefix": "$GAMEDIR/prefix"
        }
      }
    ],
    "system": {
      "disable_compositor": true,
      "pulse_latency": true
    },
    "wine": {
      "dxvk": true,
      "esync": true
    }
  },
  "content": "files:\r\n- SpaceInvaders.zip: https://sourceforge.net/projects/spaceinvadersgl/files/latest/download/SpaceInvadersOpenGL-0.6.1.zip\r\ngame:\r\n  arch: win64\r\n  custom-name: Space Invaders OpenGL\r\n  exe: drive_c/Program Files/Space Invaders OpenGL/Space Invaders\r\n    OpenGL.exe\r\n  prefix: $GAMEDIR/prefix\r\ninstaller:\r\n- task:\r\n    arch: win64\r\n    description: Creating 64-bit prefix ...\r\n    name: create_prefix\r\n    prefix: $GAMEDIR/prefix\r\n- extract:\r\n    dst: $GAMEDIR/prefix/drive_c/Program Files/Space Invaders OpenGL/\r\n    src: SpaceInvaders.zip\r\n- task:\r\n    app: d3dcompiler_43\r\n    arch: win64\r\n    description: DirectX 11 ...\r\n    name: winetricks\r\n    prefix: $GAMEDIR/prefix\r\n- task:\r\n    app: d3dx11_43\r\n    arch: win64\r\n    description: DirectX 11 ...\r\n    name: winetricks\r\n    prefix: $GAMEDIR/prefix\r\n- task:\r\n    app: dxvk\r\n    arch: win64\r\n    description: Vulkan ...\r\n    name: winetricks\r\n    prefix: $GAMEDIR/prefix\r\n- task:\r\n    app: win8\r\n    arch: win64\r\n    description: Windows version 8 ...\r\n    name: winetricks\r\n    prefix: $GAMEDIR/prefix\r\nsystem:\r\n  disable_compositor: true\r\n  pulse_latency: true\r\nwine:\r\n  dxvk: true\r\n  esync: true"
}