{
  "id": 2517,
  "game_id": 3091,
  "game_slug": "crimzon-clover-world-ignition",
  "name": "Crimzon Clover  WORLD IGNITION",
  "year": 2014,
  "user": "ssf",
  "runner": "wine",
  "slug": "crimzon-clover-world-ignition-gogcom",
  "version": "GOG.com",
  "description": "",
  "notes": "",
  "created_at": "2016-08-21T13:34:36.874352Z",
  "updated_at": "2016-09-30T21:11:12.147898Z",
  "draft": false,
  "published": true,
  "published_by": null,
  "rating": "",
  "steamid": 285440,
  "gogid": 1207666643,
  "gogslug": "crimzon_clover_world_ignition",
  "humblestoreid": "",
  "script": {
    "game": {
      "exe": "drive_c/game/CrimzonClover_WI_GOG.exe",
      "arch": "win32",
      "prefix": "$GAMEDIR"
    },
    "gogid": "crimzon_clover_world_ignition",
    "installer": [
      {
        "task": {
          "description": "Creating Wine prefix",
          "prefix": "$GAMEDIR",
          "name": "create_prefix"
        }
      },
      {
        "task": {
          "path": "HKEY_CURRENT_USER\\Software\\Wine\\DllOverrides",
          "prefix": "$GAMEDIR",
          "name": "set_regedit",
          "value": "",
          "key": "winemenubuilder.exe",
          "type": "REG_SZ"
        }
      },
      {
        "task": {
          "executable": "game",
          "args": "/VERYSILENT /SP- /NOCANCEL /SUPPRESSMSGBOXES '/DIR=C:/game'",
          "description": "Installing...",
          "prefix": "$GAMEDIR",
          "name": "wineexec"
        }
      },
      {
        "task": {
          "app": "sandbox",
          "silent": true,
          "description": "Disabling unused WINE features",
          "prefix": "$GAMEDIR",
          "name": "winetricks"
        }
      }
    ],
    "files": [
      {
        "game": "N/A:Please select the GOG.com Windows installer."
      }
    ]
  },
  "content": "files:\n- game: N/A:Please select the GOG.com Windows installer.\ngame:\n  arch: win32\n  exe: drive_c/game/CrimzonClover_WI_GOG.exe\n  prefix: $GAMEDIR\ngogid: crimzon_clover_world_ignition\ninstaller:\n- task:\n    description: Creating Wine prefix\n    name: create_prefix\n    prefix: $GAMEDIR\n- task:\n    key: winemenubuilder.exe\n    name: set_regedit\n    path: HKEY_CURRENT_USER\\Software\\Wine\\DllOverrides\n    prefix: $GAMEDIR\n    type: REG_SZ\n    value: ''\n- task:\n    args: /VERYSILENT /SP- /NOCANCEL /SUPPRESSMSGBOXES '/DIR=C:/game'\n    description: Installing...\n    executable: game\n    name: wineexec\n    prefix: $GAMEDIR\n- task:\n    app: sandbox\n    description: Disabling unused WINE features\n    name: winetricks\n    prefix: $GAMEDIR\n    silent: true\n"
}