{
  "id": 12967,
  "game_id": 4753,
  "game_slug": "ancient-space",
  "name": "Ancient Space",
  "year": null,
  "user": "cxf",
  "runner": "winesteam",
  "slug": "ancient-space-steam",
  "version": "Steam",
  "description": null,
  "notes": "",
  "created_at": "2019-04-20T06:21:48.727152Z",
  "updated_at": "2019-04-20T06:21:54.457867Z",
  "draft": false,
  "published": true,
  "published_by": null,
  "rating": "",
  "steamid": 249190,
  "gogid": null,
  "gogslug": "",
  "humblestoreid": "",
  "script": {
    "system": {
      "env": {
        "DXVK_HUD": 0
      }
    },
    "winesteam": {
      "dxvk": true,
      "esync": true
    },
    "game": {
      "prefix": "$GAMEDIR/prefix",
      "appid": 249190
    },
    "files": [
      {
        "dx2010": "https://lutris.net/files/tools/directx-2010.tar.gz"
      }
    ],
    "installer": [
      {
        "task": {
          "prefix": "$GAMEDIR/prefix",
          "name": "create_prefix"
        }
      },
      {
        "extract": {
          "dst": "$CACHE/dxsetup",
          "file": "dx2010"
        }
      },
      {
        "task": {
          "prefix": "$GAMEDIR/prefix",
          "name": "winetricks",
          "app": "vcrun2010 xact"
        }
      },
      {
        "task": {
          "arch": "win64",
          "executable": "$CACHE/dxsetup/DXSETUP.exe",
          "prefix": "$GAMEDIR/prefix",
          "name": "wineexec",
          "args": "/silent"
        }
      },
      {
        "task": {
          "prefix": "$GAMEDIR/prefix",
          "name": "winetricks",
          "app": "dotnet472 win7"
        }
      }
    ]
  },
  "content": "files:\n- dx2010: https://lutris.net/files/tools/directx-2010.tar.gz\ngame:\n  appid: 249190\n  prefix: $GAMEDIR/prefix\ninstaller:\n- task:\n    name: create_prefix\n    prefix: $GAMEDIR/prefix\n- extract:\n    dst: $CACHE/dxsetup\n    file: dx2010\n- task:\n    app: vcrun2010 xact\n    name: winetricks\n    prefix: $GAMEDIR/prefix\n- task:\n    arch: win64\n    args: /silent\n    executable: $CACHE/dxsetup/DXSETUP.exe\n    name: wineexec\n    prefix: $GAMEDIR/prefix\n- task:\n    app: dotnet472 win7\n    name: winetricks\n    prefix: $GAMEDIR/prefix\nsystem:\n  env:\n    DXVK_HUD: 0\nwinesteam:\n  dxvk: true\n  esync: true\n"
}