{
  "id": 6482,
  "game_id": 14976,
  "game_slug": "medal-of-honor-allied-assault-war-chest",
  "name": "Medal of Honor: Allied Assault War Chest",
  "year": 2002,
  "user": "cxf",
  "runner": "wine",
  "slug": "medal-of-honor-allied-assault-gog",
  "version": "GOG",
  "description": "still not finished work in progress",
  "notes": "",
  "created_at": "2017-11-29T09:04:45.691000Z",
  "updated_at": "2019-09-09T01:49:34.906483Z",
  "draft": false,
  "published": true,
  "published_by": 1,
  "rating": "",
  "steamid": null,
  "gogid": 1207659126,
  "gogslug": "medal_of_honor_allied_assault_war_chest",
  "humblestoreid": "",
  "script": {
    "system": {
      "env": {
        "MESA_EXTENSION_MAX_YEAR": "2003",
        "__GL_ExtensionStringVersion": "17700"
      }
    },
    "game": {
      "arch": "win32",
      "prefix": "$GAMEDIR",
      "exe": "drive_c/GOG Games/Medal of Honor - Allied Assault War Chest/MOHAA.exe"
    },
    "wine": {
      "version": "tkg-protonified-3.21-x86_64"
    },
    "files": [
      {
        "game": "N/A:Select the game's setup file"
      },
      {
        "regeditfile": {
          "url": "http://bugs.winehq.org/attachment.cgi?id=44390",
          "filename": "mohaa_disabled_extenstions-v2.reg"
        }
      }
    ],
    "installer": [
      {
        "task": {
          "arch": "win32",
          "prefix": "$GAMEDIR",
          "description": "Creating Wine prefix",
          "name": "create_prefix"
        }
      },
      {
        "task": {
          "prefix": "$GAMEDIR",
          "name": "set_regedit_file",
          "filename": "$CACHE/regeditfile/mohaa_disabled_extenstions-v2.reg"
        }
      },
      {
        "task": {
          "arch": "win32",
          "executable": "game",
          "prefix": "$GAMEDIR",
          "description": "Installing Medal of Honor",
          "name": "wineexec"
        }
      }
    ]
  },
  "content": "files:\n- game: N/A:Select the game's setup file\n- regeditfile:\n    filename: mohaa_disabled_extenstions-v2.reg\n    url: http://bugs.winehq.org/attachment.cgi?id=44390\ngame:\n  arch: win32\n  exe: drive_c/GOG Games/Medal of Honor - Allied Assault War Chest/MOHAA.exe\n  prefix: $GAMEDIR\ninstaller:\n- task:\n    arch: win32\n    description: Creating Wine prefix\n    name: create_prefix\n    prefix: $GAMEDIR\n- task:\n    filename: $CACHE/regeditfile/mohaa_disabled_extenstions-v2.reg\n    name: set_regedit_file\n    prefix: $GAMEDIR\n- task:\n    arch: win32\n    description: Installing Medal of Honor\n    executable: game\n    name: wineexec\n    prefix: $GAMEDIR\nsystem:\n  env:\n    MESA_EXTENSION_MAX_YEAR: '2003'\n    __GL_ExtensionStringVersion: '17700'\nwine:\n  version: tkg-protonified-3.21-x86_64\n"
}