{
  "id": 12090,
  "game_id": 25914,
  "game_slug": "anthem",
  "name": "Anthem",
  "year": 2019,
  "user": "erickj",
  "runner": "wine",
  "slug": "anthem-origin-w-dxvk",
  "version": "Origin w/ DXVK",
  "description": "Only sets up Origin and DXVK you'll need to download Anthem manually.",
  "notes": "Please read before installing: <a href=\"https://github.com/lutris/lutris/wiki/Game:-Origin\">https://github.com/lutris/lutris/wiki/Game:-Origin</a>",
  "created_at": "2019-02-19T02:41:46.021000Z",
  "updated_at": "2019-03-18T02:10:01.037789Z",
  "draft": false,
  "published": true,
  "published_by": 19464,
  "rating": "",
  "steamid": null,
  "gogid": null,
  "gogslug": "",
  "humblestoreid": "",
  "script": {
    "game": {
      "exe": "drive_c/Program Files (x86)/Origin/Origin.exe",
      "arch": "win64",
      "prefix": "$GAMEDIR"
    },
    "files": [
      {
        "client": "https://origin-a.akamaihd.net/Origin-Client-Download/origin/live/OriginThinSetup.exe"
      },
      {
        "updater": "https://raw.githubusercontent.com/DrDoctor13/wine-origin-updater/master/updateorigin.sh"
      }
    ],
    "system": {
      "disable_runtime": false,
      "env": {
        "DXVK_HUD": "$INPUT_HUD",
        "DXVK_CONFIG_FILE": "$GAMEDIR/dxvk.conf",
        "__GL_SHADER_DISK_CACHE_PATH": "$GAMEDIR/anthem-nv-shaders"
      }
    },
    "installer": [
      {
        "task": {
          "description": "Creating Wine prefix",
          "prefix": "$GAMEDIR",
          "arch": "win64",
          "name": "create_prefix"
        }
      },
      {
        "execute": {
          "command": "mkdir \"$GAMEDIR/anthem-nv-shaders\""
        }
      },
      {
        "input_menu": {
          "description": "Setting DXVK workarounds please choose your GPU:",
          "id": "GPU",
          "options": [
            {
              "#Not needed for AMD. Ignore this.\n#d3d11.zeroInitWorkgroupMemory = False": "AMD"
            },
            {
              "Fixes fps issues on menus.\nd3d11.zeroInitWorkgroupMemory = True": "Nvidia"
            }
          ],
          "preselect": "#Not needed for AMD. Ignore this.\n#d3d11.zeroInitWorkgroupMemory = False"
        }
      },
      {
        "write_file": {
          "content": "$INPUT_GPU",
          "file": "$GAMEDIR/dxvk.conf"
        }
      },
      {
        "task": {
          "arch": "win64",
          "prefix": "$GAMEDIR",
          "name": "winetricks",
          "app": "nocrashdialog vcrun2012 vcrun2013 vcrun2015 win7"
        }
      },
      {
        "task": {
          "name": "wineexec",
          "args": "/silent",
          "description": "Installing Origin... Login window will pop-up and close.",
          "prefix": "$GAMEDIR",
          "executable": "client",
          "arch": "win64",
          "exclude_processes": "Origin.exe OriginClientService.exe OriginWebHelperService.exe QtWebEngineProcess.exe"
        }
      },
      {
        "task": {
          "prefix": "$GAMEDIR",
          "arch": "win64",
          "name": "winekill"
        }
      },
      {
        "chmodx": "updater"
      },
      {
        "merge": {
          "dst": "$GAMEDIR/drive_c/Program Files (x86)/Origin",
          "src": "updater"
        }
      },
      {
        "input_menu": {
          "description": "Display DXVK fps, frametimes, and allocated memory for Anthem?",
          "id": "HUD",
          "options": [
            {
              "fps,frametimes,memory": "Yes"
            },
            {
              "0": "No"
            }
          ],
          "preselect": "0"
        }
      }
    ],
    "wine": {
      "overrides": {
        "xaudio2_7": "native,builtin",
        "nvapi,nvapi64": "disabled"
      },
      "dxvk": true,
      "version": "tkg-protonified-3.21-x86_64"
    }
  },
  "content": "files:\n- client: https://origin-a.akamaihd.net/Origin-Client-Download/origin/live/OriginThinSetup.exe\n- updater: https://raw.githubusercontent.com/DrDoctor13/wine-origin-updater/master/updateorigin.sh\ngame:\n  arch: win64\n  exe: drive_c/Program Files (x86)/Origin/Origin.exe\n  prefix: $GAMEDIR\ninstaller:\n- task:\n    arch: win64\n    description: Creating Wine prefix\n    name: create_prefix\n    prefix: $GAMEDIR\n- execute:\n    command: mkdir \"$GAMEDIR/anthem-nv-shaders\"\n- input_menu:\n    description: 'Setting DXVK workarounds please choose your GPU:'\n    id: GPU\n    options:\n    - ? '#Not needed for AMD. Ignore this.\n\n        #d3d11.zeroInitWorkgroupMemory = False'\n      : AMD\n    - ? 'Fixes fps issues on menus.\n\n        d3d11.zeroInitWorkgroupMemory = True'\n      : Nvidia\n    preselect: '#Not needed for AMD. Ignore this.\n\n      #d3d11.zeroInitWorkgroupMemory = False'\n- write_file:\n    content: $INPUT_GPU\n    file: $GAMEDIR/dxvk.conf\n- task:\n    app: nocrashdialog vcrun2012 vcrun2013 vcrun2015 win7\n    arch: win64\n    name: winetricks\n    prefix: $GAMEDIR\n- task:\n    arch: win64\n    args: /silent\n    description: Installing Origin... Login window will pop-up and close.\n    exclude_processes: Origin.exe OriginClientService.exe OriginWebHelperService.exe\n      QtWebEngineProcess.exe\n    executable: client\n    name: wineexec\n    prefix: $GAMEDIR\n- task:\n    arch: win64\n    name: winekill\n    prefix: $GAMEDIR\n- chmodx: updater\n- merge:\n    dst: $GAMEDIR/drive_c/Program Files (x86)/Origin\n    src: updater\n- input_menu:\n    description: Display DXVK fps, frametimes, and allocated memory for Anthem?\n    id: HUD\n    options:\n    - fps,frametimes,memory: 'Yes'\n    - '0': 'No'\n    preselect: '0'\nsystem:\n  disable_runtime: false\n  env:\n    DXVK_CONFIG_FILE: $GAMEDIR/dxvk.conf\n    DXVK_HUD: $INPUT_HUD\n    __GL_SHADER_DISK_CACHE_PATH: $GAMEDIR/anthem-nv-shaders\nwine:\n  dxvk: true\n  overrides:\n    nvapi,nvapi64: disabled\n    xaudio2_7: native,builtin\n  version: tkg-protonified-3.21-x86_64\n"
}