{
  "id": 22854,
  "game_id": 24273,
  "game_slug": "renegade-x",
  "name": "Renegade X",
  "year": 2014,
  "user": "SpaceKiltro",
  "runner": "wine",
  "slug": "renegade-x-change-me",
  "version": "Change Me",
  "description": "Sets up dependencies and starts game installation.",
  "notes": "Close launcher after it is finished setting up game so that the installation fully finishes.",
  "created_at": "2020-08-13T18:32:46.018103Z",
  "updated_at": "2020-08-13T18:32:46.018132Z",
  "draft": false,
  "published": false,
  "published_by": 20548,
  "rating": "",
  "steamid": null,
  "gogid": null,
  "gogslug": "",
  "humbleid": "",
  "humblestoreid": "",
  "humblestoreid_real": "",
  "script": {
    "files": [
      {
        "renx": "https://renxdownloads.nyc3.cdn.digitaloceanspaces.com/Renegade_X_Installer-3f1857a.msi"
      }
    ],
    "game": {
      "arch": "win64",
      "exe": "drive_c/Program Files (x86)/Renegade X/Binaries/Win64/UDK.exe",
      "prefix": "$GAMEDIR"
    },
    "installer": [
      {
        "task": {
          "arch": "win64",
          "description": "Creating Wine prefix",
          "name": "create_prefix",
          "prefix": "$GAMEDIR"
        }
      },
      {
        "task": {
          "app": "corefonts",
          "description": "Installing corefonts",
          "name": "winetricks",
          "prefix": "$GAMEDIR"
        }
      },
      {
        "task": {
          "app": "vcrun2008",
          "description": "Installing visual code 2008",
          "name": "winetricks",
          "prefix": "$GAMEDIR"
        }
      },
      {
        "task": {
          "app": "vcrun2010",
          "description": "Installing visual code 2010",
          "name": "winetricks",
          "prefix": "$GAMEDIR"
        }
      },
      {
        "task": {
          "app": "xact",
          "description": "Installing xact",
          "name": "winetricks",
          "prefix": "$GAMEDIR"
        }
      },
      {
        "task": {
          "app": "xact_x64",
          "description": "Installing xact_64",
          "name": "winetricks",
          "prefix": "$GAMEDIR"
        }
      },
      {
        "task": {
          "app": "d3dx9",
          "description": "Installing d3dx9",
          "name": "winetricks",
          "prefix": "$GAMEDIR"
        }
      },
      {
        "task": {
          "app": "d3dx9_43",
          "description": "Installing d3dx9_43.dll",
          "name": "winetricks",
          "prefix": "$GAMEDIR"
        }
      },
      {
        "task": {
          "app": "msxml3",
          "description": "Installing msxml3",
          "name": "winetricks",
          "prefix": "$GAMEDIR"
        }
      },
      {
        "task": {
          "app": "dotnet452",
          "description": "Installing .net 4.5.2",
          "name": "winetricks",
          "prefix": "$GAMEDIR"
        }
      },
      {
        "task": {
          "app": "win7",
          "description": "Setting environment to Windows7",
          "name": "winetricks",
          "prefix": "$GAMEDIR"
        }
      },
      {
        "task": {
          "args": "/i \"$CACHE/renx/Renegade_X_Installer-3f1857a.msi\" /q",
          "executable": "msiexec",
          "name": "wineexec",
          "prefix": "$GAMEDIR"
        }
      },
      {
        "task": {
          "arch": "win64",
          "description": "Running launcher for first time.",
          "executable": "$GAMEDIR/drive_c/Program Files (x86)/Renegade X/Launcher/Renegade X Launcher.exe",
          "name": "wineexec",
          "overrides": {
            "dxvk": false
          }
        }
      }
    ],
    "system": {
      "disable_runtime": false,
      "env": {
        "DXVK_HUD": 0
      }
    },
    "wine": {
      "dxvk": true,
      "overrides": {
        "nvapi,nvapi64": "disabled"
      }
    }
  },
  "content": "files:\n- renx: https://renxdownloads.nyc3.cdn.digitaloceanspaces.com/Renegade_X_Installer-3f1857a.msi\ngame:\n  arch: win64\n  exe: drive_c/Program Files (x86)/Renegade X/Binaries/Win64/UDK.exe\n  prefix: $GAMEDIR\ninstaller:\n- task:\n    arch: win64\n    description: Creating Wine prefix\n    name: create_prefix\n    prefix: $GAMEDIR\n- task:\n    app: corefonts\n    description: Installing corefonts\n    name: winetricks\n    prefix: $GAMEDIR\n- task:\n    app: vcrun2008\n    description: Installing visual code 2008\n    name: winetricks\n    prefix: $GAMEDIR\n- task:\n    app: vcrun2010\n    description: Installing visual code 2010\n    name: winetricks\n    prefix: $GAMEDIR\n- task:\n    app: xact\n    description: Installing xact\n    name: winetricks\n    prefix: $GAMEDIR\n- task:\n    app: xact_x64\n    description: Installing xact_64\n    name: winetricks\n    prefix: $GAMEDIR\n- task:\n    app: d3dx9\n    description: Installing d3dx9\n    name: winetricks\n    prefix: $GAMEDIR\n- task:\n    app: d3dx9_43\n    description: Installing d3dx9_43.dll\n    name: winetricks\n    prefix: $GAMEDIR\n- task:\n    app: msxml3\n    description: Installing msxml3\n    name: winetricks\n    prefix: $GAMEDIR\n- task:\n    app: dotnet452\n    description: Installing .net 4.5.2\n    name: winetricks\n    prefix: $GAMEDIR\n- task:\n    app: win7\n    description: Setting environment to Windows7\n    name: winetricks\n    prefix: $GAMEDIR\n- task:\n    args: /i \"$CACHE/renx/Renegade_X_Installer-3f1857a.msi\" /q\n    executable: msiexec\n    name: wineexec\n    prefix: $GAMEDIR\n- task:\n    arch: win64\n    description: Running launcher for first time.\n    executable: $GAMEDIR/drive_c/Program Files (x86)/Renegade X/Launcher/Renegade\n      X Launcher.exe\n    name: wineexec\n    overrides:\n      dxvk: false\nsystem:\n  disable_runtime: false\n  env:\n    DXVK_HUD: 0\nwine:\n  dxvk: true\n  overrides:\n    nvapi,nvapi64: disabled\n"
}