{
  "id": 11247,
  "game_id": 24273,
  "game_slug": "renegade-x",
  "name": "Renegade X",
  "year": 2014,
  "user": "SonnyX",
  "runner": "wine",
  "slug": "renegade-x-official",
  "version": "Official",
  "description": null,
  "notes": "",
  "created_at": "2018-12-17T14:23:43.407000Z",
  "updated_at": "2019-05-18T06:17:21.902786Z",
  "draft": false,
  "published": true,
  "published_by": 19464,
  "rating": "",
  "steamid": null,
  "gogid": null,
  "gogslug": "",
  "humblestoreid": "",
  "script": {
    "system": {
      "env": {
        "DXVK_HUD": 0
      },
      "disable_runtime": false
    },
    "game": {
      "arch": "win64",
      "prefix": "$GAMEDIR",
      "exe": "drive_c/Program Files (x86)/Renegade X/Launcher/Renegade X Launcher.exe"
    },
    "wine": {
      "overrides": {
        "nvapi,nvapi64": "disabled"
      },
      "dxvk": true,
      "version": "tkg-protonified-4.6-x86_64"
    },
    "files": [
      {
        "renx": "https://renxdownloads.nyc3.cdn.digitaloceanspaces.com/Renegade_X_Installer-3e4811a.msi"
      }
    ],
    "installer": [
      {
        "task": {
          "arch": "win64",
          "prefix": "$GAMEDIR",
          "description": "Creating Wine prefix",
          "name": "create_prefix"
        }
      },
      {
        "task": {
          "prefix": "$GAMEDIR",
          "description": "Installing corefonts",
          "name": "winetricks",
          "app": "corefonts"
        }
      },
      {
        "task": {
          "prefix": "$GAMEDIR",
          "description": "Installing visual code 2008",
          "name": "winetricks",
          "app": "vcrun2008"
        }
      },
      {
        "task": {
          "prefix": "$GAMEDIR",
          "description": "Installing visual code 2010",
          "name": "winetricks",
          "app": "vcrun2010"
        }
      },
      {
        "task": {
          "prefix": "$GAMEDIR",
          "description": "Installing xact",
          "name": "winetricks",
          "app": "xact"
        }
      },
      {
        "task": {
          "prefix": "$GAMEDIR",
          "description": "Installing xact_64",
          "name": "winetricks",
          "app": "xact_x64"
        }
      },
      {
        "task": {
          "prefix": "$GAMEDIR",
          "description": "Installing d3dx9",
          "name": "winetricks",
          "app": "d3dx9"
        }
      },
      {
        "task": {
          "prefix": "$GAMEDIR",
          "description": "Installing d3dx9_43.dll",
          "name": "winetricks",
          "app": "d3dx9_43"
        }
      },
      {
        "task": {
          "prefix": "$GAMEDIR",
          "description": "Installing msxml3",
          "name": "winetricks",
          "app": "msxml3"
        }
      },
      {
        "task": {
          "prefix": "$GAMEDIR",
          "description": "Installing .net 4.7.2",
          "name": "winetricks",
          "app": "dotnet472"
        }
      },
      {
        "task": {
          "prefix": "$GAMEDIR",
          "description": "Setting environment to Windows7",
          "name": "winetricks",
          "app": "win7"
        }
      },
      {
        "task": {
          "prefix": "$GAMEDIR",
          "executable": "msiexec",
          "args": "/i \"$CACHE/renx/Renegade_X_Installer-3e4811a.msi\" /q",
          "name": "wineexec"
        }
      }
    ]
  },
  "content": "files:\n- renx: https://renxdownloads.nyc3.cdn.digitaloceanspaces.com/Renegade_X_Installer-3e4811a.msi\ngame:\n  arch: win64\n  exe: drive_c/Program Files (x86)/Renegade X/Launcher/Renegade X Launcher.exe\n  prefix: $GAMEDIR\ninstaller:\n- task:\n    arch: win64\n    description: Creating Wine prefix\n    name: create_prefix\n    prefix: $GAMEDIR\n- task:\n    app: corefonts\n    description: Installing corefonts\n    name: winetricks\n    prefix: $GAMEDIR\n- task:\n    app: vcrun2008\n    description: Installing visual code 2008\n    name: winetricks\n    prefix: $GAMEDIR\n- task:\n    app: vcrun2010\n    description: Installing visual code 2010\n    name: winetricks\n    prefix: $GAMEDIR\n- task:\n    app: xact\n    description: Installing xact\n    name: winetricks\n    prefix: $GAMEDIR\n- task:\n    app: xact_x64\n    description: Installing xact_64\n    name: winetricks\n    prefix: $GAMEDIR\n- task:\n    app: d3dx9\n    description: Installing d3dx9\n    name: winetricks\n    prefix: $GAMEDIR\n- task:\n    app: d3dx9_43\n    description: Installing d3dx9_43.dll\n    name: winetricks\n    prefix: $GAMEDIR\n- task:\n    app: msxml3\n    description: Installing msxml3\n    name: winetricks\n    prefix: $GAMEDIR\n- task:\n    app: dotnet472\n    description: Installing .net 4.7.2\n    name: winetricks\n    prefix: $GAMEDIR\n- task:\n    app: win7\n    description: Setting environment to Windows7\n    name: winetricks\n    prefix: $GAMEDIR\n- task:\n    args: /i \"$CACHE/renx/Renegade_X_Installer-3e4811a.msi\" /q\n    executable: msiexec\n    name: wineexec\n    prefix: $GAMEDIR\nsystem:\n  disable_runtime: false\n  env:\n    DXVK_HUD: 0\nwine:\n  dxvk: true\n  overrides:\n    nvapi,nvapi64: disabled\n  version: tkg-protonified-4.6-x86_64\n"
}