{
  "id": 23240,
  "game_id": 9724,
  "game_slug": "anno-2205",
  "name": "Anno 2205",
  "year": 2015,
  "user": "AlphaAngel",
  "runner": "wine",
  "slug": "anno-2205-dvd",
  "version": "DVD",
  "description": null,
  "notes": "",
  "created_at": "2020-09-07T07:24:40.416836Z",
  "updated_at": "2020-09-07T07:24:40.416862Z",
  "draft": true,
  "published": false,
  "published_by": null,
  "rating": "",
  "steamid": 375910,
  "gogid": null,
  "gogslug": "",
  "humbleid": "",
  "humblestoreid": "",
  "humblestoreid_real": "",
  "script": {
    "files": [
      {
        "file1": "N/A:Please select the Anno 2205 setup file"
      }
    ],
    "game": {
      "arch": "win32",
      "exe": "drive_c/Program Files/Anno2205.exe",
      "prefix": "$GAMEDIR"
    },
    "installer": [
      {
        "task": {
          "arch": "win32",
          "name": "create_prefix",
          "prefix": "$GAMEDIR"
        }
      },
      {
        "task": {
          "app": "dotnet20sp2",
          "description": "Installing .Net",
          "name": "winetricks",
          "prefix": "$GAMEDIR",
          "silent": true
        }
      },
      {
        "task": {
          "app": "vcrun2010",
          "name": "winetricks",
          "prefix": "$GAMEDIR",
          "silent": true
        }
      },
      {
        "task": {
          "app": "vcrun2012",
          "name": "winetricks",
          "prefix": "$GAMEDIR",
          "silent": true
        }
      },
      {
        "task": {
          "app": "vcrun2013",
          "name": "winetricks",
          "prefix": "$GAMEDIR",
          "silent": true
        }
      },
      {
        "task": {
          "executable": "file1",
          "name": "wineexec",
          "prefix": "$GAMEDIR"
        }
      }
    ]
  },
  "content": "files:\n- file1: N/A:Please select the Anno 2205 setup file\ngame:\n  arch: win32\n  exe: drive_c/Program Files/Anno2205.exe\n  prefix: $GAMEDIR\ninstaller:\n- task:\n    arch: win32\n    name: create_prefix\n    prefix: $GAMEDIR\n- task:\n    app: dotnet20sp2\n    description: Installing .Net\n    name: winetricks\n    prefix: $GAMEDIR\n    silent: true\n- task:\n    app: vcrun2010\n    name: winetricks\n    prefix: $GAMEDIR\n    silent: true\n- task:\n    app: vcrun2012\n    name: winetricks\n    prefix: $GAMEDIR\n    silent: true\n- task:\n    app: vcrun2013\n    name: winetricks\n    prefix: $GAMEDIR\n    silent: true\n- task:\n    executable: file1\n    name: wineexec\n    prefix: $GAMEDIR\n"
}