{
  "id": 8471,
  "game_id": 11406,
  "game_slug": "world-of-warships",
  "name": "World of Warships",
  "year": 2015,
  "user": "tuxnotes",
  "runner": "wine",
  "slug": "world-of-warships-ru-dxvk",
  "version": "RU DXVK",
  "description": null,
  "notes": "",
  "created_at": "2018-05-30T03:02:09.140000Z",
  "updated_at": "2019-02-16T05:08:47.577610Z",
  "draft": false,
  "published": true,
  "published_by": 19464,
  "rating": "",
  "steamid": 552990,
  "gogid": null,
  "gogslug": "",
  "humblestoreid": "",
  "script": {
    "system": {
      "pulse_latency": true,
      "env": {
        "DXVK_HUD": 0
      }
    },
    "game": {
      "arch": "win64",
      "prefix": "$GAMEDIR",
      "exe": "drive_c/Games/World_of_Warships/WoWSLauncher.exe"
    },
    "wine": {
      "WineDesktop": "1920x1080",
      "overrides": {
        "xaudio2_7": "native,builtin"
      },
      "dxvk": true,
      "Desktop": true,
      "version": "tkg-4.0-x86_64"
    },
    "files": [
      {
        "game": "http://dl-wows-gc.wargaming.net/ru/files/xIFx1MTA3O/WoWS_internet_install_ru.exe"
      }
    ],
    "installer": [
      {
        "task": {
          "arch": "win64",
          "prefix": "$GAMEDIR",
          "description": "Creating Wine prefix",
          "name": "create_prefix"
        }
      },
      {
        "task": {
          "arch": "win64",
          "prefix": "$GAMEDIR",
          "name": "winetricks",
          "app": "corefonts win10"
        }
      },
      {
        "task": {
          "prefix": "$GAMEDIR",
          "executable": "game",
          "description": "Installing World of Warships",
          "args": "/VERYSILENT /CLOSEAPPLICATIONS",
          "arch": "win64",
          "exclude_processes": "explorer.exe rpcss.exe services.exe winedevice.exe plugplay.exe WargamingGameUpdater.exe WoWSLauncher.exe",
          "name": "wineexec"
        }
      },
      {
        "task": {
          "arch": "win64",
          "prefix": "$GAMEDIR",
          "name": "winekill"
        }
      }
    ]
  },
  "content": "files:\n- game: http://dl-wows-gc.wargaming.net/ru/files/xIFx1MTA3O/WoWS_internet_install_ru.exe\ngame:\n  arch: win64\n  exe: drive_c/Games/World_of_Warships/WoWSLauncher.exe\n  prefix: $GAMEDIR\ninstaller:\n- task:\n    arch: win64\n    description: Creating Wine prefix\n    name: create_prefix\n    prefix: $GAMEDIR\n- task:\n    app: corefonts win10\n    arch: win64\n    name: winetricks\n    prefix: $GAMEDIR\n- task:\n    arch: win64\n    args: /VERYSILENT /CLOSEAPPLICATIONS\n    description: Installing World of Warships\n    exclude_processes: explorer.exe rpcss.exe services.exe winedevice.exe plugplay.exe\n      WargamingGameUpdater.exe WoWSLauncher.exe\n    executable: game\n    name: wineexec\n    prefix: $GAMEDIR\n- task:\n    arch: win64\n    name: winekill\n    prefix: $GAMEDIR\nsystem:\n  env:\n    DXVK_HUD: 0\n  pulse_latency: true\nwine:\n  Desktop: true\n  WineDesktop: 1920x1080\n  dxvk: true\n  overrides:\n    xaudio2_7: native,builtin\n  version: tkg-4.0-x86_64\n"
}