{
  "id": 3763,
  "game_id": 11406,
  "game_slug": "world-of-warships",
  "name": "World of Warships",
  "year": 2015,
  "user": "APoliTech",
  "runner": "wine",
  "slug": "world-of-warships-na-dxvk",
  "version": "NA DXVK",
  "description": null,
  "notes": "",
  "created_at": "2017-05-21T14:17:44.263000Z",
  "updated_at": "2020-03-20T10:36:07.236144Z",
  "draft": false,
  "published": true,
  "published_by": 20548,
  "rating": "",
  "steamid": 552990,
  "gogid": null,
  "gogslug": "",
  "humblestoreid": "",
  "script": {
    "files": [
      {
        "game": "http://dl-wows-gc.wargaming.net/na/files/MDcyICBcdT/WoWS_internet_install_na.exe"
      }
    ],
    "installer": [
      {
        "task": {
          "arch": "win64",
          "description": "Creating Wine prefix",
          "prefix": "$GAMEDIR",
          "name": "create_prefix"
        }
      },
      {
        "task": {
          "arch": "win64",
          "app": "corefonts win10",
          "prefix": "$GAMEDIR",
          "name": "winetricks"
        }
      },
      {
        "task": {
          "arch": "win64",
          "prefix": "$GAMEDIR",
          "name": "wineexec",
          "exclude_processes": "explorer.exe rpcss.exe services.exe winedevice.exe plugplay.exe WargamingGameUpdater.exe WoWSLauncher.exe",
          "args": "/VERYSILENT /CLOSEAPPLICATIONS",
          "executable": "game",
          "description": "Installing World of Warships"
        }
      },
      {
        "task": {
          "arch": "win64",
          "prefix": "$GAMEDIR",
          "name": "winekill"
        }
      }
    ],
    "system": {
      "env": {
        "DXVK_HUD": 0
      },
      "pulse_latency": true
    },
    "wine": {
      "overrides": {
        "xaudio2_7": "native,builtin"
      },
      "dxvk": true
    },
    "game": {
      "arch": "win64",
      "prefix": "$GAMEDIR",
      "exe": "drive_c/Games/World_of_Warships/WoWSLauncher.exe"
    }
  },
  "content": "files:\r\n- game: http://dl-wows-gc.wargaming.net/na/files/MDcyICBcdT/WoWS_internet_install_na.exe\r\ngame:\r\n  arch: win64\r\n  exe: drive_c/Games/World_of_Warships/WoWSLauncher.exe\r\n  prefix: $GAMEDIR\r\ninstaller:\r\n- task:\r\n    arch: win64\r\n    description: Creating Wine prefix\r\n    name: create_prefix\r\n    prefix: $GAMEDIR\r\n- task:\r\n    app: corefonts win10\r\n    arch: win64\r\n    name: winetricks\r\n    prefix: $GAMEDIR\r\n- task:\r\n    arch: win64\r\n    args: /VERYSILENT /CLOSEAPPLICATIONS\r\n    description: Installing World of Warships\r\n    exclude_processes: explorer.exe rpcss.exe services.exe winedevice.exe plugplay.exe\r\n      WargamingGameUpdater.exe WoWSLauncher.exe\r\n    executable: game\r\n    name: wineexec\r\n    prefix: $GAMEDIR\r\n- task:\r\n    arch: win64\r\n    name: winekill\r\n    prefix: $GAMEDIR\r\nsystem:\r\n  env:\r\n    DXVK_HUD: 0\r\n  pulse_latency: true\r\nwine:\r\n  dxvk: true\r\n  overrides:\r\n    xaudio2_7: native,builtin"
}