{
  "id": 7951,
  "game_id": 11406,
  "game_slug": "world-of-warships",
  "name": "World of Warships",
  "year": 2015,
  "user": "Echo_8",
  "runner": "wine",
  "slug": "world-of-warships-asia-dxvk",
  "version": "ASIA DXVK",
  "description": null,
  "notes": "",
  "created_at": "2018-04-21T08:40:42.579000Z",
  "updated_at": "2020-01-23T02:56:54.476379Z",
  "draft": false,
  "published": true,
  "published_by": 19464,
  "rating": "",
  "steamid": 552990,
  "gogid": null,
  "gogslug": "",
  "humblestoreid": "",
  "script": {
    "files": [
      {
        "game": "http://dl-wows-gc.wargaming.net/asia/files/Kg9cc1LM/WoWS_internet_install_asia.exe"
      }
    ],
    "game": {
      "prefix": "$GAMEDIR",
      "exe": "drive_c/Games/World_of_Warships/WoWSLauncher.exe",
      "arch": "win64"
    },
    "wine": {
      "overrides": {
        "xaudio2_7": "native,builtin"
      },
      "Desktop": true,
      "WineDesktop": "1920x1080",
      "dxvk": true
    },
    "system": {
      "env": {
        "DXVK_HUD": 0
      },
      "pulse_latency": true
    },
    "installer": [
      {
        "task": {
          "prefix": "$GAMEDIR",
          "arch": "win64",
          "name": "create_prefix",
          "description": "Creating Wine prefix"
        }
      },
      {
        "task": {
          "prefix": "$GAMEDIR",
          "arch": "win64",
          "app": "corefonts win10",
          "name": "winetricks"
        }
      },
      {
        "task": {
          "arch": "win64",
          "exclude_processes": "explorer.exe rpcss.exe services.exe winedevice.exe plugplay.exe WargamingGameUpdater.exe WoWSLauncher.exe",
          "name": "wineexec",
          "description": "Installing World of Warships",
          "args": "/VERYSILENT /CLOSEAPPLICATIONS",
          "prefix": "$GAMEDIR",
          "executable": "game"
        }
      },
      {
        "task": {
          "prefix": "$GAMEDIR",
          "arch": "win64",
          "name": "winekill"
        }
      }
    ]
  },
  "content": "files:\n- game: http://dl-wows-gc.wargaming.net/asia/files/Kg9cc1LM/WoWS_internet_install_asia.exe\ngame:\n  arch: win64\n  exe: drive_c/Games/World_of_Warships/WoWSLauncher.exe\n  prefix: $GAMEDIR\ninstaller:\n- task:\n    arch: win64\n    description: Creating Wine prefix\n    name: create_prefix\n    prefix: $GAMEDIR\n- task:\n    app: corefonts win10\n    arch: win64\n    name: winetricks\n    prefix: $GAMEDIR\n- task:\n    arch: win64\n    args: /VERYSILENT /CLOSEAPPLICATIONS\n    description: Installing World of Warships\n    exclude_processes: explorer.exe rpcss.exe services.exe winedevice.exe plugplay.exe\n      WargamingGameUpdater.exe WoWSLauncher.exe\n    executable: game\n    name: wineexec\n    prefix: $GAMEDIR\n- task:\n    arch: win64\n    name: winekill\n    prefix: $GAMEDIR\nsystem:\n  env:\n    DXVK_HUD: 0\n  pulse_latency: true\nwine:\n  Desktop: true\n  WineDesktop: 1920x1080\n  dxvk: true\n  overrides:\n    xaudio2_7: native,builtin\n"
}