{
  "id": 17481,
  "game_id": 28905,
  "game_slug": "f1-2019",
  "name": "F1 2019",
  "year": 2019,
  "user": "OsamaBinlada",
  "runner": "winesteam",
  "slug": "f1-2019-steam",
  "version": "Steam",
  "description": null,
  "notes": "",
  "created_at": "2019-12-22T11:43:28.597436Z",
  "updated_at": "2020-01-31T02:38:32.937264Z",
  "draft": false,
  "published": false,
  "published_by": null,
  "rating": "",
  "steamid": 928600,
  "gogid": null,
  "gogslug": "",
  "humblestoreid": "",
  "script": {
    "winesteam": {
      "dxvk": true,
      "overrides": {
        "d3d12": "disabled"
      },
      "esync": true
    },
    "game": {
      "arch": "win64",
      "appid": 928600,
      "prefix": "$GAMEDIR/prefix"
    },
    "system": {
      "env": {
        "DXVK_HUD": 0
      }
    },
    "installer": [
      {
        "task": {
          "arch": "win64",
          "prefix": "$GAMEDIR/prefix",
          "name": "create_prefix"
        }
      },
      {
        "task": {
          "arch": "win64",
          "app": "msxml3",
          "prefix": "$GAMEDIR/prefix",
          "name": "winetricks"
        }
      },
      {
        "task": {
          "arch": "win64",
          "app": "dotnet472",
          "prefix": "$GAMEDIR/prefix",
          "name": "winetricks"
        }
      },
      {
        "task": {
          "arch": "win64",
          "app": "vcrun2017",
          "prefix": "$GAMEDIR/prefix",
          "name": "winetricks"
        }
      },
      {
        "task": {
          "arch": "win64",
          "app": "takao",
          "prefix": "$GAMEDIR/prefix",
          "name": "winetricks"
        }
      },
      {
        "task": {
          "prefix": "$GAMEDIR/prefix",
          "value": "win7",
          "arch": "win64",
          "key": "Version",
          "name": "set_regedit",
          "description": "Setting Windows 7 mode for Wine",
          "path": "HKEY_CURRENT_USER\\Software\\Wine"
        }
      }
    ]
  },
  "content": "game:\n  appid: 928600\n  arch: win64\n  prefix: $GAMEDIR/prefix\ninstaller:\n- task:\n    arch: win64\n    name: create_prefix\n    prefix: $GAMEDIR/prefix\n- task:\n    app: msxml3\n    arch: win64\n    name: winetricks\n    prefix: $GAMEDIR/prefix\n- task:\n    app: dotnet472\n    arch: win64\n    name: winetricks\n    prefix: $GAMEDIR/prefix\n- task:\n    app: vcrun2017\n    arch: win64\n    name: winetricks\n    prefix: $GAMEDIR/prefix\n- task:\n    app: takao\n    arch: win64\n    name: winetricks\n    prefix: $GAMEDIR/prefix\n- task:\n    arch: win64\n    description: Setting Windows 7 mode for Wine\n    key: Version\n    name: set_regedit\n    path: HKEY_CURRENT_USER\\Software\\Wine\n    prefix: $GAMEDIR/prefix\n    value: win7\nsystem:\n  env:\n    DXVK_HUD: 0\nwinesteam:\n  dxvk: true\n  esync: true\n  overrides:\n    d3d12: disabled\n"
}