{
  "id": 21989,
  "game_id": 31785,
  "game_slug": "soapbox-race-world-need-for-speed-world",
  "name": "Soapbox Race World (Need for Speed World)",
  "year": 2017,
  "user": "metonator",
  "runner": "wine",
  "slug": "soapbox-race-world-need-for-s-github",
  "version": "GitHub",
  "description": "Windows Native binaries",
  "notes": "",
  "created_at": "2020-06-27T11:24:15.660301Z",
  "updated_at": "2020-06-27T11:24:15.660327Z",
  "draft": false,
  "published": false,
  "published_by": null,
  "rating": "",
  "steamid": null,
  "gogid": null,
  "gogslug": "",
  "humbleid": "",
  "humblestoreid": "",
  "humblestoreid_real": "",
  "script": {
    "files": [
      {
        "nfsw_installer": "http://l.mtntr.pl/download"
      },
      {
        "wine_mono": "https://dl.winehq.org/wine/wine-mono/5.1.0/wine-mono-5.1.0-x86.msi"
      }
    ],
    "game": {
      "arch": "win32",
      "exe": "$GAMEDIR/GameLauncher.exe",
      "prefix": "$GAMEDIR/prefix"
    },
    "installer": [
      {
        "task": {
          "arch": "win32",
          "description": "Creating 32bit Wine prefix.",
          "name": "create_prefix",
          "prefix": "$GAMEDIR/prefix"
        }
      },
      {
        "extract": {
          "description": "Extracting installer.",
          "dst": "$GAMEDIR",
          "file": "nfsw_installer",
          "format": "zip"
        }
      },
      {
        "task": {
          "description": "Installing WineMono",
          "executable": "wine_mono",
          "name": "wineexec",
          "prefix": "$GAMEDIR/prefix"
        }
      }
    ],
    "wine": {
      "overrides": {
        "dinput8": "n,b",
        "lightfx": "n,b"
      },
      "version": "lutris-nfsworld-5.4-x86_64"
    }
  },
  "content": "files:\n- nfsw_installer: http://l.mtntr.pl/download\n- wine_mono: https://dl.winehq.org/wine/wine-mono/5.1.0/wine-mono-5.1.0-x86.msi\ngame:\n  arch: win32\n  exe: $GAMEDIR/GameLauncher.exe\n  prefix: $GAMEDIR/prefix\ninstaller:\n- task:\n    arch: win32\n    description: Creating 32bit Wine prefix.\n    name: create_prefix\n    prefix: $GAMEDIR/prefix\n- extract:\n    description: Extracting installer.\n    dst: $GAMEDIR\n    file: nfsw_installer\n    format: zip\n- task:\n    description: Installing WineMono\n    executable: wine_mono\n    name: wineexec\n    prefix: $GAMEDIR/prefix\nwine:\n  overrides:\n    dinput8: n,b\n    lightfx: n,b\n  version: lutris-nfsworld-5.4-x86_64\n"
}