{
  "id": 11660,
  "game_id": 5609,
  "game_slug": "ultima-online",
  "name": "Ultima Online",
  "year": 1997,
  "user": "eisterman",
  "runner": "wine",
  "slug": "ultima-online-enhanced-client-isom",
  "version": "Enhanced Client - Isometric 3D",
  "description": "New client published in 2007 with Ultima Online: Kingdom Reborn update.",
  "notes": "",
  "created_at": "2019-01-20T12:42:19.641000Z",
  "updated_at": "2019-01-22T08:46:08.229460Z",
  "draft": false,
  "published": true,
  "published_by": 19464,
  "rating": "",
  "steamid": null,
  "gogid": null,
  "gogslug": "",
  "humblestoreid": "",
  "script": {
    "game": {
      "exe": "drive_c/Program Files/Electronic Arts/Ultima Online Enhanced/uopatch.exe",
      "arch": "win32",
      "prefix": "$GAMEDIR"
    },
    "files": [
      {
        "uo_installer": "http://web.cdn.eamythic.com/us/uo/installers/20101118/UOEnhancedSetup_4_0_10_1.exe"
      }
    ],
    "installer": [
      {
        "task": {
          "prefix": "$GAMEDIR",
          "arch": "win32",
          "name": "create_prefix"
        }
      },
      {
        "task": {
          "description": "Changing to Windows 7",
          "arch": "win32",
          "prefix": "$GAMEDIR",
          "name": "winetricks",
          "app": "win7"
        }
      },
      {
        "task": {
          "description": "Installing Mono",
          "arch": "win32",
          "prefix": "$GAMEDIR",
          "name": "winetricks",
          "app": "mono"
        }
      },
      {
        "task": {
          "description": "Installing various tricks",
          "arch": "win32",
          "prefix": "$GAMEDIR",
          "name": "winetricks",
          "app": "corefonts tahoma fontfix"
        }
      },
      {
        "task": {
          "description": "Installing Gecko",
          "arch": "win32",
          "prefix": "$GAMEDIR",
          "name": "winetricks",
          "app": "gecko"
        }
      },
      {
        "task": {
          "description": "Installing DirectX 9 & DLL override",
          "arch": "win32",
          "prefix": "$GAMEDIR",
          "name": "winetricks",
          "app": "d3dx9"
        }
      },
      {
        "task": {
          "description": "Running UO Installer.",
          "prefix": "$GAMEDIR",
          "executable": "uo_installer",
          "arch": "win32",
          "name": "wineexec"
        }
      }
    ]
  },
  "content": "files:\n- uo_installer: http://web.cdn.eamythic.com/us/uo/installers/20101118/UOEnhancedSetup_4_0_10_1.exe\ngame:\n  arch: win32\n  exe: drive_c/Program Files/Electronic Arts/Ultima Online Enhanced/uopatch.exe\n  prefix: $GAMEDIR\ninstaller:\n- task:\n    arch: win32\n    name: create_prefix\n    prefix: $GAMEDIR\n- task:\n    app: win7\n    arch: win32\n    description: Changing to Windows 7\n    name: winetricks\n    prefix: $GAMEDIR\n- task:\n    app: mono\n    arch: win32\n    description: Installing Mono\n    name: winetricks\n    prefix: $GAMEDIR\n- task:\n    app: corefonts tahoma fontfix\n    arch: win32\n    description: Installing various tricks\n    name: winetricks\n    prefix: $GAMEDIR\n- task:\n    app: gecko\n    arch: win32\n    description: Installing Gecko\n    name: winetricks\n    prefix: $GAMEDIR\n- task:\n    app: d3dx9\n    arch: win32\n    description: Installing DirectX 9 & DLL override\n    name: winetricks\n    prefix: $GAMEDIR\n- task:\n    arch: win32\n    description: Running UO Installer.\n    executable: uo_installer\n    name: wineexec\n    prefix: $GAMEDIR\n"
}