{
  "id": 14228,
  "game_id": 5609,
  "game_slug": "ultima-online",
  "name": "Ultima Online",
  "year": 1997,
  "user": "DogeNukem",
  "runner": "wine",
  "slug": "ultima-online-change-me-1",
  "version": "Change Me",
  "description": "New client published in 2007 with Ultima Online: Kingdom Reborn update.",
  "notes": "",
  "created_at": "2019-06-20T19:47:49.597440Z",
  "updated_at": "2019-06-20T19:47:49.597480Z",
  "draft": false,
  "published": false,
  "published_by": 19464,
  "rating": "",
  "steamid": null,
  "gogid": null,
  "gogslug": "",
  "humblestoreid": "",
  "script": {
    "files": [
      {
        "uo_installer": "http://web.cdn.eamythic.com/us/uo/installers/20101118/UOEnhancedSetup_4_0_10_1.exe"
      }
    ],
    "game": {
      "prefix": "$GAMEDIR",
      "arch": "win32",
      "exe": "drive_c/Program Files/Electronic Arts/Ultima Online Enhanced/uopatch.exe"
    },
    "installer": [
      {
        "task": {
          "prefix": "$GAMEDIR",
          "name": "create_prefix",
          "arch": "win32"
        }
      },
      {
        "task": {
          "description": "Changing to Windows 7",
          "name": "winetricks",
          "arch": "win32",
          "app": "win7",
          "prefix": "$GAMEDIR"
        }
      },
      {
        "task": {
          "description": "Installing Mono",
          "name": "winetricks",
          "arch": "win32",
          "app": "mono",
          "prefix": "$GAMEDIR"
        }
      },
      {
        "task": {
          "description": "Installing various tricks",
          "name": "winetricks",
          "arch": "win32",
          "app": "corefonts tahoma fontfix",
          "prefix": "$GAMEDIR"
        }
      },
      {
        "task": {
          "description": "Installing Gecko",
          "name": "winetricks",
          "arch": "win32",
          "app": "gecko",
          "prefix": "$GAMEDIR"
        }
      },
      {
        "task": {
          "description": "Installing DirectX 9 & DLL override",
          "name": "winetricks",
          "arch": "win32",
          "app": "d3dx9",
          "prefix": "$GAMEDIR"
        }
      },
      {
        "task": {
          "description": "Running UO Installer.",
          "name": "wineexec",
          "arch": "win32",
          "executable": "uo_installer",
          "prefix": "$GAMEDIR"
        }
      }
    ]
  },
  "content": "files:\n- uo_installer: http://web.cdn.eamythic.com/us/uo/installers/20101118/UOEnhancedSetup_4_0_10_1.exe\ngame:\n  arch: win32\n  exe: drive_c/Program Files/Electronic Arts/Ultima Online Enhanced/uopatch.exe\n  prefix: $GAMEDIR\ninstaller:\n- task:\n    arch: win32\n    name: create_prefix\n    prefix: $GAMEDIR\n- task:\n    app: win7\n    arch: win32\n    description: Changing to Windows 7\n    name: winetricks\n    prefix: $GAMEDIR\n- task:\n    app: mono\n    arch: win32\n    description: Installing Mono\n    name: winetricks\n    prefix: $GAMEDIR\n- task:\n    app: corefonts tahoma fontfix\n    arch: win32\n    description: Installing various tricks\n    name: winetricks\n    prefix: $GAMEDIR\n- task:\n    app: gecko\n    arch: win32\n    description: Installing Gecko\n    name: winetricks\n    prefix: $GAMEDIR\n- task:\n    app: d3dx9\n    arch: win32\n    description: Installing DirectX 9 & DLL override\n    name: winetricks\n    prefix: $GAMEDIR\n- task:\n    arch: win32\n    description: Running UO Installer.\n    executable: uo_installer\n    name: wineexec\n    prefix: $GAMEDIR\n"
}