{
  "id": 11647,
  "game_id": 20649,
  "game_slug": "escape-from-tarkov",
  "name": "Escape from Tarkov",
  "year": 2017,
  "user": "cxf",
  "runner": "wine",
  "slug": "escape-from-tarkov-beta",
  "version": "Beta",
  "description": "Download the installer from your profile: <a href=\"https://www.escapefromtarkov.com/profile\">https://www.escapefromtarkov.com/profile</a>.",
  "notes": "Please read before installing: <a href=\"https://github.com/lutris/lutris/wiki/How-to:-DXVK\">How-to:-DXVK</a>\r\n\r\nYou can en-/disable \"Reduce PulseAudio Latency\" under \"System Options\" in the \"Configure\" screen if you encounter any audio glitches/issues.\r\n\r\nTo customize the DXVK HUD you can add/remove/change environment variables under \"System Options\" in the \"Configure\" screen. Documentation can be found here: <a href=\"https://github.com/doitsujin/dxvk#hud\">https://github.com/doitsujin/dxvk#hud</a>.",
  "created_at": "2019-01-19T08:02:14.195000Z",
  "updated_at": "2019-03-17T01:12:41.354480Z",
  "draft": false,
  "published": true,
  "published_by": 19464,
  "rating": "",
  "steamid": null,
  "gogid": null,
  "gogslug": "",
  "humblestoreid": "",
  "script": {
    "game": {
      "exe": "drive_c/Battlestate Games/BsgLauncher/BsgLauncher.exe",
      "arch": "win64",
      "prefix": "$GAMEDIR"
    },
    "files": [
      {
        "eft": "N/A:Select the exe downloaded from https://www.escapefromtarkov.com/profile"
      }
    ],
    "system": {
      "env": {
        "DXVK_LOG_LEVEL": "none",
        "DXVK_HUD": 0
      },
      "pulse_latency": true
    },
    "installer": [
      {
        "task": {
          "prefix": "$GAMEDIR",
          "arch": "win64",
          "name": "create_prefix"
        }
      },
      {
        "task": {
          "description": "Installing corefonts and Visual C++ 2013 and 2017",
          "arch": "win64",
          "prefix": "$GAMEDIR",
          "name": "winetricks",
          "app": "corefonts vcrun2013 vcrun2017"
        }
      },
      {
        "task": {
          "description": "Installing .NET 4.7.2 (This takes a while, please wait)",
          "arch": "win64",
          "prefix": "$GAMEDIR",
          "name": "winetricks",
          "app": "dotnet472 win7"
        }
      },
      {
        "task": {
          "description": "Installing Launcher (UNCHECK \"launch after install\", otherwise close launcher)",
          "prefix": "$GAMEDIR",
          "executable": "eft",
          "arch": "win64",
          "name": "wineexec"
        }
      }
    ],
    "wine": {
      "esync": true,
      "dxvk": true,
      "version": "tkg-4.2-x86_64"
    }
  },
  "content": "files:\n- eft: N/A:Select the exe downloaded from https://www.escapefromtarkov.com/profile\ngame:\n  arch: win64\n  exe: drive_c/Battlestate Games/BsgLauncher/BsgLauncher.exe\n  prefix: $GAMEDIR\ninstaller:\n- task:\n    arch: win64\n    name: create_prefix\n    prefix: $GAMEDIR\n- task:\n    app: corefonts vcrun2013 vcrun2017\n    arch: win64\n    description: Installing corefonts and Visual C++ 2013 and 2017\n    name: winetricks\n    prefix: $GAMEDIR\n- task:\n    app: dotnet472 win7\n    arch: win64\n    description: Installing .NET 4.7.2 (This takes a while, please wait)\n    name: winetricks\n    prefix: $GAMEDIR\n- task:\n    arch: win64\n    description: Installing Launcher (UNCHECK \"launch after install\", otherwise close\n      launcher)\n    executable: eft\n    name: wineexec\n    prefix: $GAMEDIR\nsystem:\n  env:\n    DXVK_HUD: 0\n    DXVK_LOG_LEVEL: none\n  pulse_latency: true\nwine:\n  dxvk: true\n  esync: true\n  version: tkg-4.2-x86_64\n"
}