{
  "id": 18369,
  "game_id": 28613,
  "game_slug": "trover-saves-the-universe",
  "name": "Trover Saves the Universe",
  "year": 2019,
  "user": "vanstaveren",
  "runner": "wine",
  "slug": "trover-saves-the-universe-steam",
  "version": "Steam",
  "description": null,
  "notes": "",
  "created_at": "2020-02-14T08:59:21.664783Z",
  "updated_at": "2020-03-20T10:46:47.930385Z",
  "draft": true,
  "published": false,
  "published_by": null,
  "rating": "",
  "steamid": 1051200,
  "gogid": null,
  "gogslug": "",
  "humblestoreid": "",
  "script": {
    "files": [
      {
        "master.zip": "https://github.com/z0z0z/mf-install/archive/master.zip"
      },
      {
        "SteamSetup.exe": "https://steamcdn-a.akamaihd.net/client/installer/SteamSetup.exe"
      }
    ],
    "installer": [
      {
        "task": {
          "arch": "win64",
          "description": "Creating 64-bit prefix ...",
          "prefix": "$GAMEDIR/prefix",
          "name": "create_prefix"
        }
      },
      {
        "execute": {
          "description": "Creating Media Foundation workaround directory ...",
          "command": "mkdir \"$GAMEDIR/prefix/mediafoundation_workaround\""
        }
      },
      {
        "write_file": {
          "content": "cd $HOME/Games/trover-saves-the-universe/prefix/mediafoundation_workaround && WINEPREFIX=\"$HOME/Games/trover-saves-the-universe/prefix\" ./mf-install.sh",
          "description": "Creating install.sh with prefix ...",
          "file": "$GAMEDIR/prefix/mediafoundation_workaround/install.sh"
        }
      },
      {
        "chmodx": "$GAMEDIR/prefix/mediafoundation_workaround/install.sh"
      },
      {
        "extract": {
          "description": "Extracting Media Foundation workaround ...",
          "dst": "$GAMEDIR/prefix/mediafoundation_workaround",
          "file": "master.zip"
        }
      },
      {
        "execute": {
          "description": "Media Foundation workaround ...",
          "command": "sh $GAMEDIR/prefix/mediafoundation_workaround/install.sh"
        }
      },
      {
        "move": {
          "src": "SteamSetup.exe",
          "dst": "$GAMEDIR/prefix/drive_c/"
        }
      },
      {
        "chmodx": "$GAMEDIR/prefix/drive_c/SteamSetup.exe"
      },
      {
        "task": {
          "arch": "win64",
          "description": "DirectX ...",
          "app": "d3drm",
          "prefix": "$GAMEDIR/prefix",
          "name": "winetricks"
        }
      },
      {
        "task": {
          "arch": "win64",
          "description": "DirectX 11 ...",
          "app": "d3dcompiler_43",
          "prefix": "$GAMEDIR/prefix",
          "name": "winetricks"
        }
      },
      {
        "task": {
          "arch": "win64",
          "description": "DirectX 11 ...",
          "app": "d3dx11_43",
          "prefix": "$GAMEDIR/prefix",
          "name": "winetricks"
        }
      },
      {
        "task": {
          "arch": "win64",
          "description": "DirectX compiler ...",
          "app": "d3dcompiler_47",
          "prefix": "$GAMEDIR/prefix",
          "name": "winetricks"
        }
      },
      {
        "task": {
          "arch": "win64",
          "description": "Vulkan ...",
          "app": "dxvk",
          "prefix": "$GAMEDIR/prefix",
          "name": "winetricks"
        }
      },
      {
        "task": {
          "args": "/S",
          "executable": "$GAMEDIR/prefix/drive_c/SteamSetup.exe",
          "description": "Steam ...",
          "prefix": "$GAMEDIR/prefix",
          "name": "wineexec"
        }
      },
      {
        "task": {
          "arch": "win64",
          "description": "Windows version 8 ...",
          "app": "win8",
          "prefix": "$GAMEDIR/prefix",
          "name": "winetricks"
        }
      }
    ],
    "system": {
      "xboxdrv": "xboxdrv",
      "pulse_latency": true,
      "disable_compositor": true
    },
    "wine": {
      "Audio": "pulse",
      "dxvk": true,
      "esync": true
    },
    "game": {
      "prefix": "$GAMEDIR/prefix",
      "custom-name": "Trover Saves the Universe",
      "arch": "win64",
      "args": "-nojoy -applaunch 1051200",
      "appid": "1051200",
      "exe": "$GAMEDIR/prefix/drive_c/Program Files (x86)/Steam/Steam.exe"
    }
  },
  "content": "files:\r\n- master.zip: https://github.com/z0z0z/mf-install/archive/master.zip\r\n- SteamSetup.exe: https://steamcdn-a.akamaihd.net/client/installer/SteamSetup.exe\r\ngame:\r\n  appid: '1051200'\r\n  arch: win64\r\n  args: -nojoy -applaunch 1051200\r\n  custom-name: Trover Saves the Universe\r\n  exe: $GAMEDIR/prefix/drive_c/Program Files (x86)/Steam/Steam.exe\r\n  prefix: $GAMEDIR/prefix\r\ninstaller:\r\n- task:\r\n    arch: win64\r\n    description: Creating 64-bit prefix ...\r\n    name: create_prefix\r\n    prefix: $GAMEDIR/prefix\r\n- execute:\r\n    command: mkdir \"$GAMEDIR/prefix/mediafoundation_workaround\"\r\n    description: Creating Media Foundation workaround directory ...\r\n- write_file:\r\n    content: cd $HOME/Games/trover-saves-the-universe/prefix/mediafoundation_workaround\r\n      && WINEPREFIX=\"$HOME/Games/trover-saves-the-universe/prefix\" ./mf-install.sh\r\n    description: Creating install.sh with prefix ...\r\n    file: $GAMEDIR/prefix/mediafoundation_workaround/install.sh\r\n- chmodx: $GAMEDIR/prefix/mediafoundation_workaround/install.sh\r\n- extract:\r\n    description: Extracting Media Foundation workaround ...\r\n    dst: $GAMEDIR/prefix/mediafoundation_workaround\r\n    file: master.zip\r\n- execute:\r\n    command: sh $GAMEDIR/prefix/mediafoundation_workaround/install.sh\r\n    description: Media Foundation workaround ...\r\n- move:\r\n    dst: $GAMEDIR/prefix/drive_c/\r\n    src: SteamSetup.exe\r\n- chmodx: $GAMEDIR/prefix/drive_c/SteamSetup.exe\r\n- task:\r\n    app: d3drm\r\n    arch: win64\r\n    description: DirectX ...\r\n    name: winetricks\r\n    prefix: $GAMEDIR/prefix\r\n- task:\r\n    app: d3dcompiler_43\r\n    arch: win64\r\n    description: DirectX 11 ...\r\n    name: winetricks\r\n    prefix: $GAMEDIR/prefix\r\n- task:\r\n    app: d3dx11_43\r\n    arch: win64\r\n    description: DirectX 11 ...\r\n    name: winetricks\r\n    prefix: $GAMEDIR/prefix\r\n- task:\r\n    app: d3dcompiler_47\r\n    arch: win64\r\n    description: DirectX compiler ...\r\n    name: winetricks\r\n    prefix: $GAMEDIR/prefix\r\n- task:\r\n    app: dxvk\r\n    arch: win64\r\n    description: Vulkan ...\r\n    name: winetricks\r\n    prefix: $GAMEDIR/prefix\r\n- task:\r\n    args: /S\r\n    description: Steam ...\r\n    executable: $GAMEDIR/prefix/drive_c/SteamSetup.exe\r\n    name: wineexec\r\n    prefix: $GAMEDIR/prefix\r\n- task:\r\n    app: win8\r\n    arch: win64\r\n    description: Windows version 8 ...\r\n    name: winetricks\r\n    prefix: $GAMEDIR/prefix\r\nsystem:\r\n  disable_compositor: true\r\n  pulse_latency: true\r\n  xboxdrv: xboxdrv\r\nwine:\r\n  Audio: pulse\r\n  dxvk: true\r\n  esync: true"
}