{
  "id": 21438,
  "game_id": 15796,
  "game_slug": "phantasy-star-universe",
  "name": "Phantasy Star Universe",
  "year": 2006,
  "user": "x_l_ours",
  "runner": "wine",
  "slug": "phantasy-star-universe-cddvd",
  "version": "CD/DVD",
  "description": "Phantasy Star Universe est  un Action-RPG avec deux modes bien distincts : un mode Histoire complet qui se joue enti√®rement en solo et un mode multijoueurs en ligne, un mode relativement proche de celui de Phantasy Star Online(PSO).",
  "notes": "",
  "created_at": "2020-06-12T20:55:06.230515Z",
  "updated_at": "2020-06-12T20:55:06.230541Z",
  "draft": true,
  "published": false,
  "published_by": null,
  "rating": "",
  "steamid": null,
  "gogid": null,
  "gogslug": "",
  "humbleid": "",
  "humblestoreid": "",
  "humblestoreid_real": "",
  "script": {
    "arch": "win32",
    "exe": "prefix/drive_c/Program Files/Codemasters/Overlord/Launcher.exe",
    "game": {
      "arch": "win32",
      "prefix": "$GAMEDIR/prefix"
    },
    "installer": [
      {
        "task": {
          "app": "winxp",
          "arch": "win32",
          "description": "Setting Windows Version to XP",
          "name": "winetricks",
          "prefix": "$GAMEDIR/prefix"
        }
      },
      {
        "task": {
          "arch": "win32",
          "description": "Creating Wine Prefix",
          "name": "create_prefix",
          "prefix": "$GAMEDIR/prefix"
        }
      },
      {
        "task": {
          "app": "directmusic",
          "arch": "win32",
          "description": "Installing Direct Music",
          "name": "winetricks",
          "prefix": "$GAMEDIR/prefix"
        }
      },
      {
        "task": {
          "app": "directplay",
          "arch": "win32",
          "description": "Installing Direct Play",
          "name": "winetricks",
          "prefix": "$GAMEDIR/prefix"
        }
      },
      {
        "task": {
          "app": "d3dx9_36",
          "arch": "win32",
          "description": "Installing DirectX 9",
          "name": "winetricks",
          "prefix": "$GAMEDIR/prefix"
        }
      },
      {
        "insert-disc": {
          "requires": "autorun.exe"
        }
      },
      {
        "task": {
          "executable": "$DISC/autorun.exe",
          "name": "wineexec",
          "prefix": "$GAMEDIR/prefix"
        }
      },
      {
        "task": {
          "app": "winxp",
          "arch": "win32",
          "description": "Setting Windows Version to XP",
          "name": "winetricks",
          "prefix": "$GAMEDIR/prefix"
        }
      }
    ]
  },
  "content": "arch: win32\nexe: prefix/drive_c/Program Files/Codemasters/Overlord/Launcher.exe\ngame:\n  arch: win32\n  prefix: $GAMEDIR/prefix\ninstaller:\n- task:\n    app: winxp\n    arch: win32\n    description: Setting Windows Version to XP\n    name: winetricks\n    prefix: $GAMEDIR/prefix\n- task:\n    arch: win32\n    description: Creating Wine Prefix\n    name: create_prefix\n    prefix: $GAMEDIR/prefix\n- task:\n    app: directmusic\n    arch: win32\n    description: Installing Direct Music\n    name: winetricks\n    prefix: $GAMEDIR/prefix\n- task:\n    app: directplay\n    arch: win32\n    description: Installing Direct Play\n    name: winetricks\n    prefix: $GAMEDIR/prefix\n- task:\n    app: d3dx9_36\n    arch: win32\n    description: Installing DirectX 9\n    name: winetricks\n    prefix: $GAMEDIR/prefix\n- insert-disc:\n    requires: autorun.exe\n- task:\n    executable: $DISC/autorun.exe\n    name: wineexec\n    prefix: $GAMEDIR/prefix\n- task:\n    app: winxp\n    arch: win32\n    description: Setting Windows Version to XP\n    name: winetricks\n    prefix: $GAMEDIR/prefix\n"
}