{
  "id": 11334,
  "game_id": 17944,
  "game_slug": "ring-of-elysium",
  "name": "Ring of Elysium",
  "year": 2018,
  "user": "YouYouTheBoss",
  "runner": "winesteam",
  "slug": "ring-of-elysium-steam",
  "version": "Steam",
  "description": null,
  "notes": "",
  "created_at": "2018-12-25T09:55:23.845000Z",
  "updated_at": "2020-01-31T02:38:28.033348Z",
  "draft": false,
  "published": true,
  "published_by": 19464,
  "rating": "1",
  "steamid": 755790,
  "gogid": null,
  "gogslug": "",
  "humblestoreid": "",
  "script": {
    "files": [
      {
        "dx2010": "https://lutris.net/files/tools/directx-2010.tar.gz"
      }
    ],
    "game": {
      "appid": 755790,
      "arch": "win64",
      "prefix": "$GAMEDIR/prefix"
    },
    "installer": [
      {
        "extract": {
          "dst": "$CACHE/dxsetup",
          "file": "dx2010"
        }
      },
      {
        "task": {
          "arch": "win64",
          "name": "create_prefix",
          "prefix": "$GAMEDIR/prefix"
        }
      },
      {
        "task": {
          "arch": "win64",
          "args": "/silent",
          "executable": "$CACHE/dxsetup/DXSETUP.exe",
          "name": "wineexec",
          "prefix": "$GAMEDIR/prefix"
        }
      },
      {
        "task": {
          "arch": "win64",
          "name": "winekill",
          "prefix": "$GAMEDIR/prefix"
        }
      },
      {
        "task": {
          "app": "vcrun2010 vcrun2017 win7",
          "arch": "win64",
          "name": "winetricks",
          "prefix": "$GAMEDIR/prefix"
        }
      }
    ],
    "system": {
      "env": {
        "DXVK_HUD": 0
      }
    },
    "winesteam": {
      "dxvk": true
    }
  },
  "content": "files:\n- dx2010: https://lutris.net/files/tools/directx-2010.tar.gz\ngame:\n  appid: 755790\n  arch: win64\n  prefix: $GAMEDIR/prefix\ninstaller:\n- extract:\n    dst: $CACHE/dxsetup\n    file: dx2010\n- task:\n    arch: win64\n    name: create_prefix\n    prefix: $GAMEDIR/prefix\n- task:\n    arch: win64\n    args: /silent\n    executable: $CACHE/dxsetup/DXSETUP.exe\n    name: wineexec\n    prefix: $GAMEDIR/prefix\n- task:\n    arch: win64\n    name: winekill\n    prefix: $GAMEDIR/prefix\n- task:\n    app: vcrun2010 vcrun2017 win7\n    arch: win64\n    name: winetricks\n    prefix: $GAMEDIR/prefix\nsystem:\n  env:\n    DXVK_HUD: 0\nwinesteam:\n  dxvk: true\n"
}