{
  "id": 10183,
  "game_id": 544,
  "game_slug": "mafia-ii",
  "name": "Mafia II",
  "year": 2011,
  "user": "OsamaBinlada",
  "runner": "wine",
  "slug": "mafia-ii-gog",
  "version": "GOG",
  "description": null,
  "notes": "Attention: Do not use Wine Esync, use Wine Staging!",
  "created_at": "2018-09-14T03:01:20.426000Z",
  "updated_at": "2018-12-19T07:27:06.990863Z",
  "draft": false,
  "published": true,
  "published_by": 19464,
  "rating": "",
  "steamid": 50130,
  "gogid": null,
  "gogslug": "",
  "humblestoreid": "",
  "script": {
    "game": {
      "prefix": "$GAMEDIR",
      "exe": "$GAMEDIR/drive_c/GOG Games/Mafia II/pc/mafia2.exe"
    },
    "wine": {
      "UseGLSL": "disabled"
    },
    "files": [
      {
        "install": "N/A:Select the Windows setup file downloaded from GOG"
      }
    ],
    "installer": [
      {
        "task": {
          "prefix": "$GAMEDIR",
          "description": "Installing d3dx9",
          "name": "winetricks",
          "app": "d3dx9"
        }
      },
      {
        "task": {
          "prefix": "$GAMEDIR",
          "description": "Installing physx",
          "name": "winetricks",
          "app": "physx"
        }
      },
      {
        "task": {
          "prefix": "$GAMEDIR",
          "description": "Installing vcrun2008",
          "name": "winetricks",
          "app": "vcrun2008"
        }
      },
      {
        "task": {
          "prefix": "$GAMEDIR",
          "description": "Installing vcrun2010",
          "name": "winetricks",
          "app": "vcrun2010"
        }
      },
      {
        "task": {
          "prefix": "$GAMEDIR",
          "description": "Installing xact",
          "name": "winetricks",
          "app": "xact"
        }
      },
      {
        "task": {
          "prefix": "$GAMEDIR",
          "executable": "install",
          "description": "Installing the game",
          "name": "wineexec"
        }
      }
    ]
  },
  "content": "files:\n- install: N/A:Select the Windows setup file downloaded from GOG\ngame:\n  exe: $GAMEDIR/drive_c/GOG Games/Mafia II/pc/mafia2.exe\n  prefix: $GAMEDIR\ninstaller:\n- task:\n    app: d3dx9\n    description: Installing d3dx9\n    name: winetricks\n    prefix: $GAMEDIR\n- task:\n    app: physx\n    description: Installing physx\n    name: winetricks\n    prefix: $GAMEDIR\n- task:\n    app: vcrun2008\n    description: Installing vcrun2008\n    name: winetricks\n    prefix: $GAMEDIR\n- task:\n    app: vcrun2010\n    description: Installing vcrun2010\n    name: winetricks\n    prefix: $GAMEDIR\n- task:\n    app: xact\n    description: Installing xact\n    name: winetricks\n    prefix: $GAMEDIR\n- task:\n    description: Installing the game\n    executable: install\n    name: wineexec\n    prefix: $GAMEDIR\nwine:\n  UseGLSL: disabled\n"
}