{
  "id": 12684,
  "game_id": 544,
  "game_slug": "mafia-ii",
  "name": "Mafia II",
  "year": 2011,
  "user": "OfficialBAMM",
  "runner": "winesteam",
  "slug": "mafia-ii-steam",
  "version": "Steam",
  "description": null,
  "notes": "",
  "created_at": "2019-04-08T08:32:42.727000Z",
  "updated_at": "2019-04-26T06:55:52.946265Z",
  "draft": false,
  "published": true,
  "published_by": 19464,
  "rating": "",
  "steamid": 50130,
  "gogid": null,
  "gogslug": "",
  "humblestoreid": "",
  "script": {
    "game": {
      "prefix": "$GAMEDIR/prefix",
      "appid": 50130
    },
    "winesteam": {
      "UseGLSL": "disabled"
    },
    "installer": [
      {
        "task": {
          "prefix": "$GAMEDIR/prefix",
          "name": "create_prefix"
        }
      },
      {
        "task": {
          "description": "Installing d3dx9",
          "prefix": "$GAMEDIR/prefix",
          "app": "d3dx9",
          "name": "winetricks"
        }
      },
      {
        "task": {
          "description": "Installing physx",
          "prefix": "$GAMEDIR/prefix",
          "app": "physx",
          "name": "winetricks"
        }
      },
      {
        "task": {
          "description": "Installing vcrun2008",
          "prefix": "$GAMEDIR/prefix",
          "app": "vcrun2008",
          "name": "winetricks"
        }
      },
      {
        "task": {
          "description": "Installing vcrun2010",
          "prefix": "$GAMEDIR/prefix",
          "app": "vcrun2010",
          "name": "winetricks"
        }
      },
      {
        "task": {
          "description": "Installing xact",
          "prefix": "$GAMEDIR/prefix",
          "app": "xact",
          "name": "winetricks"
        }
      }
    ]
  },
  "content": "game:\n  appid: 50130\n  prefix: $GAMEDIR/prefix\ninstaller:\n- task:\n    name: create_prefix\n    prefix: $GAMEDIR/prefix\n- task:\n    app: d3dx9\n    description: Installing d3dx9\n    name: winetricks\n    prefix: $GAMEDIR/prefix\n- task:\n    app: physx\n    description: Installing physx\n    name: winetricks\n    prefix: $GAMEDIR/prefix\n- task:\n    app: vcrun2008\n    description: Installing vcrun2008\n    name: winetricks\n    prefix: $GAMEDIR/prefix\n- task:\n    app: vcrun2010\n    description: Installing vcrun2010\n    name: winetricks\n    prefix: $GAMEDIR/prefix\n- task:\n    app: xact\n    description: Installing xact\n    name: winetricks\n    prefix: $GAMEDIR/prefix\nwinesteam:\n  UseGLSL: disabled\n"
}