{
  "id": 4591,
  "game_id": 706,
  "game_slug": "hydrophobia-prophecy",
  "name": "Hydrophobia: Prophecy",
  "year": null,
  "user": "codythedragondude",
  "runner": "winesteam",
  "slug": "hydrophobia-prophecy-steam",
  "version": "Steam",
  "description": null,
  "notes": "Freezes for some odd reason needs tester i have no idea what is causing it to freeze",
  "created_at": "2017-06-25T06:34:31.408000Z",
  "updated_at": "2018-07-17T06:22:56.169750Z",
  "draft": false,
  "published": true,
  "published_by": null,
  "rating": "",
  "steamid": 92000,
  "gogid": null,
  "gogslug": "",
  "humblestoreid": "",
  "script": {
    "game": {
      "appid": 92000
    },
    "winesteam": {
      "version": "staging-3.12-x86_64"
    },
    "installer": [
      {
        "task": {
          "prefix": "$GAMEDIR/prefix",
          "arch": "win32",
          "name": "create_prefix"
        }
      },
      {
        "task": {
          "description": "Changing to Windows 7",
          "arch": "win32",
          "prefix": "$GAMEDIR/prefix",
          "name": "winetricks",
          "app": "win7"
        }
      },
      {
        "task": {
          "description": "Installing d3dx9",
          "arch": "win32",
          "prefix": "$GAMEDIR/prefix",
          "name": "winetricks",
          "app": "d3dx9"
        }
      },
      {
        "task": {
          "description": "Installing VisualC++ Runtime vcrun2005",
          "arch": "win32",
          "prefix": "$GAMEDIR/prefix",
          "name": "winetricks",
          "app": "vcrun2005"
        }
      },
      {
        "task": {
          "description": "Installing VisualC++ Runtime vcrun2008",
          "arch": "win32",
          "prefix": "$GAMEDIR/prefix",
          "name": "winetricks",
          "app": "vcrun2008"
        }
      },
      {
        "task": {
          "description": "Installing VisualC++ Runtime vcrun2010",
          "arch": "win32",
          "prefix": "$GAMEDIR/prefix",
          "name": "winetricks",
          "app": "vcrun2010"
        }
      },
      {
        "task": {
          "description": "Installing Corefonts",
          "arch": "win32",
          "prefix": "$GAMEDIR/prefix",
          "name": "winetricks",
          "app": "corfonts"
        }
      },
      {
        "task": {
          "description": "Installing Tahoma",
          "arch": "win32",
          "prefix": "$GAMEDIR/prefix",
          "name": "winetricks",
          "app": "tahoma"
        }
      }
    ]
  },
  "content": "game:\n  appid: 92000\ninstaller:\n- task:\n    arch: win32\n    name: create_prefix\n    prefix: $GAMEDIR/prefix\n- task:\n    app: win7\n    arch: win32\n    description: Changing to Windows 7\n    name: winetricks\n    prefix: $GAMEDIR/prefix\n- task:\n    app: d3dx9\n    arch: win32\n    description: Installing d3dx9\n    name: winetricks\n    prefix: $GAMEDIR/prefix\n- task:\n    app: vcrun2005\n    arch: win32\n    description: Installing VisualC++ Runtime vcrun2005\n    name: winetricks\n    prefix: $GAMEDIR/prefix\n- task:\n    app: vcrun2008\n    arch: win32\n    description: Installing VisualC++ Runtime vcrun2008\n    name: winetricks\n    prefix: $GAMEDIR/prefix\n- task:\n    app: vcrun2010\n    arch: win32\n    description: Installing VisualC++ Runtime vcrun2010\n    name: winetricks\n    prefix: $GAMEDIR/prefix\n- task:\n    app: corfonts\n    arch: win32\n    description: Installing Corefonts\n    name: winetricks\n    prefix: $GAMEDIR/prefix\n- task:\n    app: tahoma\n    arch: win32\n    description: Installing Tahoma\n    name: winetricks\n    prefix: $GAMEDIR/prefix\nwinesteam:\n  version: staging-3.12-x86_64\n"
}