{
  "id": 5501,
  "game_id": 4129,
  "game_slug": "starcraft-anthology",
  "name": "StarCraft Anthology",
  "year": 1999,
  "user": "mygodfewar",
  "runner": "wine",
  "slug": "starcraft-anthology-201",
  "version": "2.0.1",
  "description": null,
  "notes": "",
  "created_at": "2017-08-23T09:52:56.064000Z",
  "updated_at": "2018-05-06T07:33:15.811697Z",
  "draft": false,
  "published": true,
  "published_by": null,
  "rating": "",
  "steamid": null,
  "gogid": null,
  "gogslug": "",
  "humblestoreid": "",
  "script": {
    "game": {
      "arch": "win64",
      "prefix": "$GAMEDIR",
      "exe": "drive_c/Program Files/StarCraft/StarCraft.exe"
    },
    "wine": {
      "version": "starcraft-2.6-x86_64"
    },
    "files": [
      {
        "setup": {
          "url": "https://www.battle.net/download/getInstallerForGame?os=win&locale=enUS&version=LIVE&gameProgram=STARCRAFT",
          "filename": "StarCraft-Public-Test-Setup.exe"
        }
      }
    ],
    "installer": [
      {
        "task": {
          "arch": "win64",
          "prefix": "$GAMEDIR",
          "description": "Creating Wine prefix",
          "name": "create_prefix"
        }
      },
      {
        "task": {
          "arch": "win64",
          "prefix": "$GAMEDIR",
          "description": "Setting Windows version to XP",
          "name": "winetricks",
          "app": "winxp"
        }
      },
      {
        "task": {
          "arch": "win64",
          "executable": "$setup",
          "prefix": "$GAMEDIR",
          "description": "Installing StarCraft Anthology",
          "name": "wineexec"
        }
      }
    ]
  },
  "content": "files:\n- setup:\n    filename: StarCraft-Public-Test-Setup.exe\n    url: https://www.battle.net/download/getInstallerForGame?os=win&locale=enUS&version=LIVE&gameProgram=STARCRAFT\ngame:\n  arch: win64\n  exe: drive_c/Program Files/StarCraft/StarCraft.exe\n  prefix: $GAMEDIR\ninstaller:\n- task:\n    arch: win64\n    description: Creating Wine prefix\n    name: create_prefix\n    prefix: $GAMEDIR\n- task:\n    app: winxp\n    arch: win64\n    description: Setting Windows version to XP\n    name: winetricks\n    prefix: $GAMEDIR\n- task:\n    arch: win64\n    description: Installing StarCraft Anthology\n    executable: $setup\n    name: wineexec\n    prefix: $GAMEDIR\nwine:\n  version: starcraft-2.6-x86_64\n"
}