{
  "id": 9169,
  "game_id": 4129,
  "game_slug": "starcraft-anthology",
  "name": "StarCraft Anthology",
  "year": 1999,
  "user": "empi_pl",
  "runner": "wine",
  "slug": "starcraft-anthology-ge-protonified-nofsh",
  "version": "ge-protonified-nofshack-4.9-x86_",
  "description": null,
  "notes": "",
  "created_at": "2018-07-11T15:52:36.419000Z",
  "updated_at": "2020-01-23T02:57:04.440979Z",
  "draft": false,
  "published": true,
  "published_by": 1,
  "rating": "",
  "steamid": null,
  "gogid": null,
  "gogslug": "",
  "humblestoreid": "",
  "script": {
    "installer": [
      {
        "task": {
          "arch": "win64",
          "description": "Creating Wine prefix",
          "prefix": "$GAMEDIR",
          "name": "create_prefix"
        }
      },
      {
        "task": {
          "arch": "win64",
          "description": "Setting Windows version to Windows 7",
          "app": "win7",
          "prefix": "$GAMEDIR",
          "name": "winetricks"
        }
      },
      {
        "task": {
          "arch": "win64",
          "executable": "$setup",
          "description": "Installing StarCraft Anthology",
          "prefix": "$GAMEDIR",
          "name": "wineexec"
        }
      }
    ],
    "files": [
      {
        "setup": {
          "url": "https://www.battle.net/download/getInstallerForGame?os=win&locale=enEN&version=LIVE&gameProgram=STARCRAFT",
          "filename": "StarCraft-Setup.exe"
        }
      }
    ],
    "game": {
      "arch": "win64",
      "prefix": "$GAMEDIR",
      "exe": "drive_c/Program Files (x86)/StarCraft/StarCraft Launcher.exe"
    }
  },
  "content": "files:\n- setup:\n    filename: StarCraft-Setup.exe\n    url: https://www.battle.net/download/getInstallerForGame?os=win&locale=enEN&version=LIVE&gameProgram=STARCRAFT\ngame:\n  arch: win64\n  exe: drive_c/Program Files (x86)/StarCraft/StarCraft Launcher.exe\n  prefix: $GAMEDIR\ninstaller:\n- task:\n    arch: win64\n    description: Creating Wine prefix\n    name: create_prefix\n    prefix: $GAMEDIR\n- task:\n    app: win7\n    arch: win64\n    description: Setting Windows version to Windows 7\n    name: winetricks\n    prefix: $GAMEDIR\n- task:\n    arch: win64\n    description: Installing StarCraft Anthology\n    executable: $setup\n    name: wineexec\n    prefix: $GAMEDIR\n"
}