{
  "id": 19031,
  "game_id": 4129,
  "game_slug": "starcraft-anthology",
  "name": "StarCraft Anthology",
  "year": 1999,
  "user": "xxsl",
  "runner": "wine",
  "slug": "starcraft-anthology-change-me-1",
  "version": "Change Me",
  "description": null,
  "notes": "",
  "created_at": "2020-03-21T13:19:43.445902Z",
  "updated_at": "2020-03-21T13:19:43.445928Z",
  "draft": false,
  "published": false,
  "published_by": 1,
  "rating": "",
  "steamid": null,
  "gogid": null,
  "gogslug": "",
  "humblestoreid": "",
  "script": {
    "files": [
      {
        "setup": {
          "filename": "StarCraft-Setup.exe",
          "url": "https://www.battle.net/download/getInstallerForGame?os=win&locale=enEN&version=LIVE&gameProgram=STARCRAFT"
        }
      }
    ],
    "game": {
      "arch": "win64",
      "exe": "drive_c/Program Files (x86)/StarCraft/StarCraft Launcher.exe",
      "prefix": "$GAMEDIR"
    },
    "installer": [
      {
        "task": {
          "arch": "win64",
          "description": "Creating Wine prefix",
          "name": "create_prefix",
          "prefix": "$GAMEDIR"
        }
      },
      {
        "task": {
          "app": "win7",
          "arch": "win64",
          "description": "Setting Windows version to Windows 7",
          "name": "winetricks",
          "prefix": "$GAMEDIR"
        }
      },
      {
        "task": {
          "arch": "win64",
          "description": "Installing StarCraft Anthology",
          "executable": "$setup",
          "name": "wineexec",
          "prefix": "$GAMEDIR"
        }
      }
    ]
  },
  "content": "files:\n- setup:\n    filename: StarCraft-Setup.exe\n    url: https://www.battle.net/download/getInstallerForGame?os=win&locale=enEN&version=LIVE&gameProgram=STARCRAFT\ngame:\n  arch: win64\n  exe: drive_c/Program Files (x86)/StarCraft/StarCraft Launcher.exe\n  prefix: $GAMEDIR\ninstaller:\n- task:\n    arch: win64\n    description: Creating Wine prefix\n    name: create_prefix\n    prefix: $GAMEDIR\n- task:\n    app: win7\n    arch: win64\n    description: Setting Windows version to Windows 7\n    name: winetricks\n    prefix: $GAMEDIR\n- task:\n    arch: win64\n    description: Installing StarCraft Anthology\n    executable: $setup\n    name: wineexec\n    prefix: $GAMEDIR\n"
}