{
  "id": 18486,
  "game_id": 31784,
  "game_slug": "topaz-video-enhance-ai",
  "name": "Topaz Video Enhance AI",
  "year": 2020,
  "user": "Helg1980",
  "runner": "wine",
  "slug": "topaz-video-enhance-ai-classic",
  "version": "classic",
  "description": "Topaz Video Enhance AI",
  "notes": "",
  "created_at": "2020-02-21T17:37:44.595906Z",
  "updated_at": "2020-02-21T17:37:44.595931Z",
  "draft": true,
  "published": false,
  "published_by": null,
  "rating": "",
  "steamid": null,
  "gogid": null,
  "gogslug": "",
  "humblestoreid": "",
  "script": {
    "files": [
      {
        "installer": "N/A:Please select the setup.exe located on the installation DVD."
      }
    ],
    "game": {
      "prefix": "$GAMEDIR",
      "exe": "drive_c/Program Files/Topaz Labs LLC/Topaz Video Enhance AI/Topaz Video Enhance AI.exe",
      "arch": "win64"
    },
    "wine": {
      "esync": true,
      "dxvk": true
    },
    "installer": [
      {
        "task": {
          "prefix": "$GAMEDIR",
          "arch": "win64",
          "name": "create_prefix",
          "description": "Creating 64-bit Wine prefix."
        }
      },
      {
        "task": {
          "arch": "win64",
          "name": "set_regedit",
          "description": "Setting Windows 7 mode for Wine",
          "key": "Version",
          "prefix": "$GAMEDIR",
          "value": "win7",
          "path": "HKEY_CURRENT_USER\\Software\\Wine"
        }
      },
      {
        "task": {
          "prefix": "$GAMEDIR",
          "name": "winekill"
        }
      },
      {
        "task": {
          "prefix": "$GAMEDIR",
          "arch": "win64",
          "app": "atmlib",
          "description": "Installing atmlib",
          "name": "winetricks"
        }
      },
      {
        "task": {
          "prefix": "$GAMEDIR",
          "arch": "win64",
          "app": "msxml3",
          "description": "Installing msxml3",
          "name": "winetricks"
        }
      },
      {
        "task": {
          "prefix": "$GAMEDIR",
          "arch": "win64",
          "app": "msxml6",
          "description": "Installing msxml6",
          "name": "winetricks"
        }
      },
      {
        "task": {
          "prefix": "$GAMEDIR",
          "arch": "win64",
          "app": "vcrun2003",
          "description": "Installing vcrun2003",
          "name": "winetricks"
        }
      },
      {
        "task": {
          "prefix": "$GAMEDIR",
          "arch": "win64",
          "app": "vcrun2005",
          "description": "Installing vcrun2005",
          "name": "winetricks"
        }
      },
      {
        "task": {
          "prefix": "$GAMEDIR",
          "arch": "win64",
          "app": "vcrun2008",
          "description": "Installing vcrun2008",
          "name": "winetricks"
        }
      },
      {
        "task": {
          "prefix": "$GAMEDIR",
          "arch": "win64",
          "app": "vcrun2010",
          "description": "Installing vcrun2010",
          "name": "winetricks"
        }
      },
      {
        "task": {
          "prefix": "$GAMEDIR",
          "arch": "win64",
          "app": "vcrun2012",
          "description": "Installing vcrun2012",
          "name": "winetricks"
        }
      },
      {
        "task": {
          "prefix": "$GAMEDIR",
          "arch": "win64",
          "app": "vcrun2013",
          "description": "Installing vcrun2013",
          "name": "winetricks"
        }
      },
      {
        "task": {
          "prefix": "$GAMEDIR",
          "arch": "win64",
          "app": "vcrun2019",
          "description": "Installing vcrun2019",
          "name": "winetricks"
        }
      },
      {
        "task": {
          "prefix": "$GAMEDIR",
          "arch": "win64",
          "app": "dotnet35",
          "description": "Installing dotnet35",
          "name": "winetricks"
        }
      },
      {
        "task": {
          "prefix": "$GAMEDIR",
          "arch": "win64",
          "app": "dotnet48",
          "description": "Installing dotnet48",
          "name": "winetricks"
        }
      },
      {
        "task": {
          "prefix": "$GAMEDIR",
          "arch": "win64",
          "app": "corefonts",
          "description": "Installing corefonts",
          "name": "winetricks"
        }
      },
      {
        "task": {
          "prefix": "$GAMEDIR",
          "arch": "win64",
          "executable": "installer",
          "name": "wineexec",
          "description": "Running setup"
        }
      }
    ]
  },
  "content": "files:\n- installer: N/A:Please select the setup.exe located on the installation DVD.\ngame:\n  arch: win64\n  exe: drive_c/Program Files/Topaz Labs LLC/Topaz Video Enhance AI/Topaz Video Enhance\n    AI.exe\n  prefix: $GAMEDIR\ninstaller:\n- task:\n    arch: win64\n    description: Creating 64-bit Wine prefix.\n    name: create_prefix\n    prefix: $GAMEDIR\n- task:\n    arch: win64\n    description: Setting Windows 7 mode for Wine\n    key: Version\n    name: set_regedit\n    path: HKEY_CURRENT_USER\\Software\\Wine\n    prefix: $GAMEDIR\n    value: win7\n- task:\n    name: winekill\n    prefix: $GAMEDIR\n- task:\n    app: atmlib\n    arch: win64\n    description: Installing atmlib\n    name: winetricks\n    prefix: $GAMEDIR\n- task:\n    app: msxml3\n    arch: win64\n    description: Installing msxml3\n    name: winetricks\n    prefix: $GAMEDIR\n- task:\n    app: msxml6\n    arch: win64\n    description: Installing msxml6\n    name: winetricks\n    prefix: $GAMEDIR\n- task:\n    app: vcrun2003\n    arch: win64\n    description: Installing vcrun2003\n    name: winetricks\n    prefix: $GAMEDIR\n- task:\n    app: vcrun2005\n    arch: win64\n    description: Installing vcrun2005\n    name: winetricks\n    prefix: $GAMEDIR\n- task:\n    app: vcrun2008\n    arch: win64\n    description: Installing vcrun2008\n    name: winetricks\n    prefix: $GAMEDIR\n- task:\n    app: vcrun2010\n    arch: win64\n    description: Installing vcrun2010\n    name: winetricks\n    prefix: $GAMEDIR\n- task:\n    app: vcrun2012\n    arch: win64\n    description: Installing vcrun2012\n    name: winetricks\n    prefix: $GAMEDIR\n- task:\n    app: vcrun2013\n    arch: win64\n    description: Installing vcrun2013\n    name: winetricks\n    prefix: $GAMEDIR\n- task:\n    app: vcrun2019\n    arch: win64\n    description: Installing vcrun2019\n    name: winetricks\n    prefix: $GAMEDIR\n- task:\n    app: dotnet35\n    arch: win64\n    description: Installing dotnet35\n    name: winetricks\n    prefix: $GAMEDIR\n- task:\n    app: dotnet48\n    arch: win64\n    description: Installing dotnet48\n    name: winetricks\n    prefix: $GAMEDIR\n- task:\n    app: corefonts\n    arch: win64\n    description: Installing corefonts\n    name: winetricks\n    prefix: $GAMEDIR\n- task:\n    arch: win64\n    description: Running setup\n    executable: installer\n    name: wineexec\n    prefix: $GAMEDIR\nwine:\n  dxvk: true\n  esync: true\n"
}