{
  "id": 12674,
  "game_id": 11212,
  "game_slug": "zombi",
  "name": "ZOMBI",
  "year": null,
  "user": "Logeater",
  "runner": "winesteam",
  "slug": "zombi-dxvk",
  "version": "DXVK",
  "description": null,
  "notes": "",
  "created_at": "2019-04-08T06:03:34.056000Z",
  "updated_at": "2020-01-31T02:38:29.405759Z",
  "draft": false,
  "published": true,
  "published_by": 19464,
  "rating": "",
  "steamid": 339230,
  "gogid": null,
  "gogslug": "",
  "humblestoreid": "",
  "script": {
    "game": {
      "appid": 339230,
      "arch": "win64",
      "prefix": "$GAMEDIR/prefix"
    },
    "system": {
      "disable_runtime": false
    },
    "installer": [
      {
        "task": {
          "arch": "win64",
          "prefix": "$GAMEDIR/prefix",
          "name": "create_prefix"
        }
      },
      {
        "extract": {
          "file": "dx2010",
          "dst": "$CACHE/dxsetup"
        }
      },
      {
        "task": {
          "executable": "$CACHE/dxsetup/DXSETUP.exe",
          "arch": "win64",
          "args": "/silent",
          "prefix": "$GAMEDIR/prefix",
          "name": "wineexec"
        }
      },
      {
        "task": {
          "app": "vcrun2010 vcrun2012 corefonts win7",
          "arch": "win64",
          "prefix": "$GAMEDIR/prefix",
          "name": "winetricks"
        }
      },
      {
        "task": {
          "executable": "uplay",
          "arch": "win64",
          "args": "/S",
          "prefix": "$GAMEDIR/prefix",
          "name": "wineexec"
        }
      },
      {
        "task": {
          "arch": "win64",
          "prefix": "$GAMEDIR/prefix",
          "name": "winekill"
        }
      }
    ],
    "winesteam": {
      "esync": true
    },
    "files": [
      {
        "dx2010": "https://lutris.net/files/tools/directx-2010.tar.gz"
      },
      {
        "uplay": "https://ubistatic3-a.akamaihd.net/orbit/launcher_installer/UplayInstaller.exe"
      }
    ]
  },
  "content": "files:\n- dx2010: https://lutris.net/files/tools/directx-2010.tar.gz\n- uplay: https://ubistatic3-a.akamaihd.net/orbit/launcher_installer/UplayInstaller.exe\ngame:\n  appid: 339230\n  arch: win64\n  prefix: $GAMEDIR/prefix\ninstaller:\n- task:\n    arch: win64\n    name: create_prefix\n    prefix: $GAMEDIR/prefix\n- extract:\n    dst: $CACHE/dxsetup\n    file: dx2010\n- task:\n    arch: win64\n    args: /silent\n    executable: $CACHE/dxsetup/DXSETUP.exe\n    name: wineexec\n    prefix: $GAMEDIR/prefix\n- task:\n    app: vcrun2010 vcrun2012 corefonts win7\n    arch: win64\n    name: winetricks\n    prefix: $GAMEDIR/prefix\n- task:\n    arch: win64\n    args: /S\n    executable: uplay\n    name: wineexec\n    prefix: $GAMEDIR/prefix\n- task:\n    arch: win64\n    name: winekill\n    prefix: $GAMEDIR/prefix\nsystem:\n  disable_runtime: false\nwinesteam:\n  esync: true\n"
}