{
  "id": 13322,
  "game_id": 26900,
  "game_slug": "call-of-duty-black-ops-iiii",
  "name": "Call of Duty: Black Ops IIII",
  "year": 2018,
  "user": "ihaveanothereye",
  "runner": "wine",
  "slug": "call-of-duty-black-ops-iiii-battlenet",
  "version": "Battle.net",
  "description": null,
  "notes": "",
  "created_at": "2019-05-04T03:01:38.604000Z",
  "updated_at": "2019-06-12T04:32:39.411604Z",
  "draft": false,
  "published": true,
  "published_by": 19464,
  "rating": "1",
  "steamid": null,
  "gogid": null,
  "gogslug": "",
  "humblestoreid": "",
  "script": {
    "game": {
      "exe": "$GAMEDIR/drive_c/Program Files/Battle.net/Battle.net.exe",
      "arch": "win64",
      "prefix": "$GAMEDIR"
    },
    "files": [
      {
        "setup": {
          "filename": "Battle.net-Setup.exe",
          "url": "https://battle.net/download/getInstallerForGame?os=WIN&version=LIVE&gameProgram=STARCRAFT"
        }
      }
    ],
    "wine": {
      "version": "tkg-4.0-x86_64"
    },
    "installer": [
      {
        "task": {
          "description": "Creating 64bit Wine prefix.",
          "prefix": "$GAMEDIR",
          "arch": "win64",
          "name": "create_prefix"
        }
      },
      {
        "task": {
          "name": "winetricks",
          "description": "Installing Arial font",
          "silent": true,
          "prefix": "$GAMEDIR",
          "app": "arial",
          "arch": "win32"
        }
      },
      {
        "write_json": {
          "description": "Writing a Battle.Net config file",
          "data": {
            "Client": {
              "Sound": {
                "Enabled": "false"
              },
              "Streaming": {
                "StreamingEnabled": "false"
              },
              "HardwareAcceleration": "false",
              "GameLaunchWindowBehavior": "2",
              "GameSearch": {
                "BackgroundSearch": "true"
              }
            }
          },
          "file": "$GAMEDIR/drive_c/users/$USER/Application Data/Battle.net/Battle.net.config"
        }
      },
      {
        "task": {
          "prefix": "$GAMEDIR",
          "name": "winekill"
        }
      },
      {
        "task": {
          "description": "Installing Blizzard App (an installer will open)\n------------------------------\nLet Lutris installer finish first. Log in afterwards.",
          "executable": "setup",
          "arch": "win64",
          "exclude_processes": "Battle.net.exe Agent.exe \"Battle.net Helper.exe\"",
          "name": "wineexec"
        }
      },
      {
        "task": {
          "prefix": "$GAMEDIR",
          "name": "winekill"
        }
      }
    ]
  },
  "content": "files:\n- setup:\n    filename: Battle.net-Setup.exe\n    url: https://battle.net/download/getInstallerForGame?os=WIN&version=LIVE&gameProgram=STARCRAFT\ngame:\n  arch: win64\n  exe: $GAMEDIR/drive_c/Program Files/Battle.net/Battle.net.exe\n  prefix: $GAMEDIR\ninstaller:\n- task:\n    arch: win64\n    description: Creating 64bit Wine prefix.\n    name: create_prefix\n    prefix: $GAMEDIR\n- task:\n    app: arial\n    arch: win32\n    description: Installing Arial font\n    name: winetricks\n    prefix: $GAMEDIR\n    silent: true\n- write_json:\n    data:\n      Client:\n        GameLaunchWindowBehavior: '2'\n        GameSearch:\n          BackgroundSearch: 'true'\n        HardwareAcceleration: 'false'\n        Sound:\n          Enabled: 'false'\n        Streaming:\n          StreamingEnabled: 'false'\n    description: Writing a Battle.Net config file\n    file: $GAMEDIR/drive_c/users/$USER/Application Data/Battle.net/Battle.net.config\n- task:\n    name: winekill\n    prefix: $GAMEDIR\n- task:\n    arch: win64\n    description: 'Installing Blizzard App (an installer will open)\n\n      ------------------------------\n\n      Let Lutris installer finish first. Log in afterwards.'\n    exclude_processes: Battle.net.exe Agent.exe \"Battle.net Helper.exe\"\n    executable: setup\n    name: wineexec\n- task:\n    name: winekill\n    prefix: $GAMEDIR\nwine:\n  version: tkg-4.0-x86_64\n"
}