{
  "id": 19188,
  "game_id": 23527,
  "game_slug": "1password",
  "name": "1password",
  "year": 2016,
  "user": "bigskyhunter",
  "runner": "wine",
  "slug": "1password-change-me",
  "version": "Change Me",
  "description": null,
  "notes": "",
  "created_at": "2020-03-27T00:49:31.580340Z",
  "updated_at": "2020-03-27T00:49:31.580370Z",
  "draft": false,
  "published": false,
  "published_by": 51687,
  "rating": "",
  "steamid": null,
  "gogid": null,
  "gogslug": "",
  "humbleid": "",
  "humblestoreid": "",
  "humblestoreid_real": "",
  "script": {
    "files": [
      {
        "app": "https://c.1password.com/dist/1P/win6/1PasswordSetup-7.2.581.exe"
      }
    ],
    "game": {
      "arch": "win64",
      "exe": "drive_c/users/$USER/Local Settings/Application Data/1password/app/7/1Password.exe",
      "prefix": "$GAMEDIR"
    },
    "installer": [
      {
        "task": {
          "arch": "win64",
          "name": "create_prefix",
          "prefix": "$GAMEDIR"
        }
      },
      {
        "task": {
          "arch": "win64",
          "key": "ShowDotFiles",
          "name": "set_regedit",
          "path": "HKEY_CURRENT_USER\\Software\\Wine",
          "prefix": "$GAMEDIR",
          "value": "Y"
        }
      },
      {
        "task": {
          "app": "dotnet472",
          "arch": "win64",
          "description": "Installing .NET 4.7.2 will take a while...",
          "name": "winetricks",
          "prefix": "$GAMEDIR"
        }
      },
      {
        "task": {
          "arch": "win64",
          "executable": "app",
          "name": "wineexec",
          "prefix": "$GAMEDIR"
        }
      },
      {
        "task": {
          "name": "winekill",
          "prefix": "$GAMEDIR"
        }
      }
    ]
  },
  "content": "files:\n- app: https://c.1password.com/dist/1P/win6/1PasswordSetup-7.2.581.exe\ngame:\n  arch: win64\n  exe: drive_c/users/$USER/Local Settings/Application Data/1password/app/7/1Password.exe\n  prefix: $GAMEDIR\ninstaller:\n- task:\n    arch: win64\n    name: create_prefix\n    prefix: $GAMEDIR\n- task:\n    arch: win64\n    key: ShowDotFiles\n    name: set_regedit\n    path: HKEY_CURRENT_USER\\Software\\Wine\n    prefix: $GAMEDIR\n    value: Y\n- task:\n    app: dotnet472\n    arch: win64\n    description: Installing .NET 4.7.2 will take a while...\n    name: winetricks\n    prefix: $GAMEDIR\n- task:\n    arch: win64\n    executable: app\n    name: wineexec\n    prefix: $GAMEDIR\n- task:\n    name: winekill\n    prefix: $GAMEDIR\n"
}