{
  "id": 10985,
  "game_id": 23527,
  "game_slug": "1password",
  "name": "1password",
  "year": 2016,
  "user": "WarfaceZ",
  "runner": "wine",
  "slug": "1password-72581",
  "version": "7.2.581",
  "description": null,
  "notes": "",
  "created_at": "2018-11-25T16:20:31.946000Z",
  "updated_at": "2018-11-29T02:25:16.714094Z",
  "draft": false,
  "published": true,
  "published_by": 19464,
  "rating": "",
  "steamid": null,
  "gogid": null,
  "gogslug": "",
  "humblestoreid": "",
  "script": {
    "game": {
      "exe": "drive_c/users/$USER/Local Settings/Application Data/1password/app/7/1Password.exe",
      "arch": "win64",
      "prefix": "$GAMEDIR"
    },
    "files": [
      {
        "app": "https://c.1password.com/dist/1P/win6/1PasswordSetup-7.2.581.exe"
      }
    ],
    "wine": {
      "version": "esync-staging-pba-3.18-x86_64"
    },
    "installer": [
      {
        "task": {
          "prefix": "$GAMEDIR",
          "arch": "win64",
          "name": "create_prefix"
        }
      },
      {
        "task": {
          "prefix": "$GAMEDIR",
          "name": "set_regedit",
          "path": "HKEY_CURRENT_USER\\Software\\Wine",
          "value": "Y",
          "key": "ShowDotFiles",
          "arch": "win64"
        }
      },
      {
        "task": {
          "description": "Installing .NET 4.7.2 will take a while...",
          "arch": "win64",
          "prefix": "$GAMEDIR",
          "name": "winetricks",
          "app": "dotnet472"
        }
      },
      {
        "task": {
          "prefix": "$GAMEDIR",
          "executable": "app",
          "arch": "win64",
          "name": "wineexec"
        }
      },
      {
        "task": {
          "prefix": "$GAMEDIR",
          "name": "winekill"
        }
      }
    ]
  },
  "content": "files:\n- app: https://c.1password.com/dist/1P/win6/1PasswordSetup-7.2.581.exe\ngame:\n  arch: win64\n  exe: drive_c/users/$USER/Local Settings/Application Data/1password/app/7/1Password.exe\n  prefix: $GAMEDIR\ninstaller:\n- task:\n    arch: win64\n    name: create_prefix\n    prefix: $GAMEDIR\n- task:\n    arch: win64\n    key: ShowDotFiles\n    name: set_regedit\n    path: HKEY_CURRENT_USER\\Software\\Wine\n    prefix: $GAMEDIR\n    value: Y\n- task:\n    app: dotnet472\n    arch: win64\n    description: Installing .NET 4.7.2 will take a while...\n    name: winetricks\n    prefix: $GAMEDIR\n- task:\n    arch: win64\n    executable: app\n    name: wineexec\n    prefix: $GAMEDIR\n- task:\n    name: winekill\n    prefix: $GAMEDIR\nwine:\n  version: esync-staging-pba-3.18-x86_64\n"
}