{
  "id": 11939,
  "game_id": 5351,
  "game_slug": "her-story",
  "name": "Her Story",
  "year": null,
  "user": "SteamTuxer",
  "runner": "wine",
  "slug": "her-story-gog",
  "version": "GOG",
  "description": null,
  "notes": "",
  "created_at": "2019-02-09T15:42:46.672000Z",
  "updated_at": "2020-06-02T12:10:50.662378Z",
  "draft": false,
  "published": true,
  "published_by": 64834,
  "rating": "",
  "steamid": 368370,
  "gogid": 1435240365,
  "gogslug": "her_story",
  "humbleid": "",
  "humblestoreid": "",
  "humblestoreid_real": "",
  "script": {
    "files": [
      {
        "goginstaller": "N/A:Select gog installer"
      }
    ],
    "game": {
      "arch": "win32",
      "exe": "drive_c/GOG Games/Her Story/HerStory.exe",
      "prefix": "$GAMEDIR"
    },
    "installer": [
      {
        "task": {
          "arch": "win32",
          "description": "Setting up wine prefix",
          "name": "create_prefix",
          "prefix": "$GAMEDIR"
        }
      },
      {
        "task": {
          "app": "winxp",
          "arch": "win32",
          "description": "Setting version to Windows XP",
          "name": "winetricks",
          "prefix": "$GAMEDIR"
        }
      },
      {
        "task": {
          "app": "ffdshow",
          "arch": "win32",
          "description": "Installing required media library ffdshow",
          "name": "winetricks",
          "prefix": "$GAMEDIR"
        }
      },
      {
        "task": {
          "app": "l3codecx",
          "arch": "win32",
          "description": "Installing required media library l3codecx",
          "name": "winetricks",
          "prefix": "$GAMEDIR"
        }
      },
      {
        "task": {
          "app": "directshow",
          "arch": "win32",
          "description": "Installing required media library directshow",
          "name": "winetricks",
          "prefix": "$GAMEDIR"
        }
      },
      {
        "task": {
          "description": "Installing game, it will take a while...",
          "executable": "goginstaller",
          "name": "wineexec",
          "prefix": "$GAMEDIR"
        }
      }
    ]
  },
  "content": "files:\n- goginstaller: N/A:Select gog installer\ngame:\n  arch: win32\n  exe: drive_c/GOG Games/Her Story/HerStory.exe\n  prefix: $GAMEDIR\ninstaller:\n- task:\n    arch: win32\n    description: Setting up wine prefix\n    name: create_prefix\n    prefix: $GAMEDIR\n- task:\n    app: winxp\n    arch: win32\n    description: Setting version to Windows XP\n    name: winetricks\n    prefix: $GAMEDIR\n- task:\n    app: ffdshow\n    arch: win32\n    description: Installing required media library ffdshow\n    name: winetricks\n    prefix: $GAMEDIR\n- task:\n    app: l3codecx\n    arch: win32\n    description: Installing required media library l3codecx\n    name: winetricks\n    prefix: $GAMEDIR\n- task:\n    app: directshow\n    arch: win32\n    description: Installing required media library directshow\n    name: winetricks\n    prefix: $GAMEDIR\n- task:\n    description: Installing game, it will take a while...\n    executable: goginstaller\n    name: wineexec\n    prefix: $GAMEDIR\n"
}