{
  "id": 12935,
  "game_id": 2684,
  "game_slug": "valiant-hearts-the-great-wartm-soldats-inconnus-me",
  "name": "Valiant Hearts: The Great War™ / Soldats Inconnus : Mémoires de la Grande Guerre™",
  "year": null,
  "user": "cxf",
  "runner": "wine",
  "slug": "valiant-hearts-the-great-wart-uplay",
  "version": "Uplay",
  "description": null,
  "notes": "",
  "created_at": "2019-04-19T06:39:28.539000Z",
  "updated_at": "2019-04-19T06:41:26.850434Z",
  "draft": false,
  "published": true,
  "published_by": 19464,
  "rating": "",
  "steamid": 260230,
  "gogid": null,
  "gogslug": "",
  "humblestoreid": "",
  "script": {
    "game": {
      "exe": "drive_c/Program Files (x86)/Uplay/Ubisoft Game Launcher/Uplay.exe",
      "arch": "win64",
      "prefix": "$GAMEDIR"
    },
    "installer": [
      {
        "task": {
          "arch": "win64",
          "prefix": "$GAMEDIR",
          "name": "create_prefix"
        }
      },
      {
        "extract": {
          "file": "dx2010",
          "dst": "$CACHE/dxsetup"
        }
      },
      {
        "task": {
          "executable": "$CACHE/dxsetup/DXSETUP.exe",
          "arch": "win64",
          "args": "/silent",
          "prefix": "$GAMEDIR",
          "name": "wineexec"
        }
      },
      {
        "task": {
          "app": "vcrun2010 corefonts win7",
          "arch": "win64",
          "prefix": "$GAMEDIR",
          "name": "winetricks"
        }
      },
      {
        "task": {
          "executable": "uplay",
          "arch": "win64",
          "args": "/S",
          "prefix": "$GAMEDIR",
          "name": "wineexec"
        }
      },
      {
        "task": {
          "arch": "win64",
          "prefix": "$GAMEDIR",
          "name": "winekill"
        }
      }
    ],
    "files": [
      {
        "dx2010": "https://lutris.net/files/tools/directx-2010.tar.gz"
      },
      {
        "uplay": "https://ubistatic3-a.akamaihd.net/orbit/launcher_installer/UplayInstaller.exe"
      }
    ]
  },
  "content": "files:\n- dx2010: https://lutris.net/files/tools/directx-2010.tar.gz\n- uplay: https://ubistatic3-a.akamaihd.net/orbit/launcher_installer/UplayInstaller.exe\ngame:\n  arch: win64\n  exe: drive_c/Program Files (x86)/Uplay/Ubisoft Game Launcher/Uplay.exe\n  prefix: $GAMEDIR\ninstaller:\n- task:\n    arch: win64\n    name: create_prefix\n    prefix: $GAMEDIR\n- extract:\n    dst: $CACHE/dxsetup\n    file: dx2010\n- task:\n    arch: win64\n    args: /silent\n    executable: $CACHE/dxsetup/DXSETUP.exe\n    name: wineexec\n    prefix: $GAMEDIR\n- task:\n    app: vcrun2010 corefonts win7\n    arch: win64\n    name: winetricks\n    prefix: $GAMEDIR\n- task:\n    arch: win64\n    args: /S\n    executable: uplay\n    name: wineexec\n    prefix: $GAMEDIR\n- task:\n    arch: win64\n    name: winekill\n    prefix: $GAMEDIR\n"
}