{
  "id": 11203,
  "game_id": 5390,
  "game_slug": "gog-galaxy",
  "name": "GOG Galaxy",
  "year": 2014,
  "user": "soredake",
  "runner": "wine",
  "slug": "gog-galaxy-experimental-all-in-",
  "version": "Experimental All-in-One",
  "description": "DXVK + game fixes",
  "notes": "Now work:\r\n- Crysis\r\n- Fallout 2 (Restoration Project) \r\n- Mafia\r\n- Doom 3: BFG Edition\r\n\r\nFixed crackling sound in Metro series (xact).\r\nVA-11 Hall-A: Cyberpunk Bartender Action and Undertale crashes on wine <4.0 (<a href=\"https://bugs.winehq.org/show_bug.cgi?id=45279\">bug report</a>), use `MESA_GL_VERSION_OVERRIDE=3.0` env to make it work, if you using wine >=4.0 and these games crash after window is shown disable origin overlay for these games.",
  "created_at": "2018-12-12T12:54:51.788000Z",
  "updated_at": "2019-03-23T09:53:17.721620Z",
  "draft": false,
  "published": true,
  "published_by": 19464,
  "rating": "",
  "steamid": null,
  "gogid": null,
  "gogslug": "",
  "humblestoreid": "",
  "script": {
    "system": {
      "env": {
        "allow_glsl_builtin_variable_redeclaration": true,
        "force_glsl_extensions_warn": true
      }
    },
    "game": {
      "arch": "win64",
      "prefix": "$GAMEDIR",
      "args": "/runWithoutUpdating /deelevated",
      "exe": "drive_c/Program Files (x86)/GOG Galaxy/GalaxyClient.exe"
    },
    "wine": {
      "overrides": {
        "xaudio2_7": "native,builtin",
        "xaudio2_6": "native,builtin"
      },
      "dxvk": true,
      "version": "tkg-4.0-x86_64"
    },
    "files": [
      {
        "galaxy": "https://cdn.gog.com/open/galaxy/client/setup_galaxy_1.2.54.23.exe"
      }
    ],
    "installer": [
      {
        "task": {
          "arch": "win64",
          "prefix": "$GAMEDIR",
          "name": "create_prefix"
        }
      },
      {
        "task": {
          "arch": "win64",
          "prefix": "$GAMEDIR",
          "name": "winetricks",
          "app": "corefonts"
        }
      },
      {
        "task": {
          "arch": "win64",
          "prefix": "$GAMEDIR",
          "name": "winetricks",
          "app": "xact"
        }
      },
      {
        "task": {
          "arch": "win64",
          "prefix": "$GAMEDIR",
          "name": "winetricks",
          "app": "win7"
        }
      },
      {
        "task": {
          "arch": "win64",
          "executable": "galaxy",
          "prefix": "$GAMEDIR",
          "name": "wineexec",
          "args": "/silent"
        }
      },
      {
        "task": {
          "prefix": "$GAMEDIR",
          "description": "Setting version to xp for Crysis.exe...",
          "value": "winxp64",
          "arch": "win64",
          "path": "HKEY_CURRENT_USER\\Software\\Wine\\AppDefaults\\Crysis.exe",
          "key": "Version",
          "name": "set_regedit"
        }
      },
      {
        "task": {
          "prefix": "$GAMEDIR",
          "description": "Setting version to xp for Crysis64.exe...",
          "value": "winxp64",
          "arch": "win64",
          "path": "HKEY_CURRENT_USER\\Software\\Wine\\AppDefaults\\Crysis64.exe",
          "key": "Version",
          "name": "set_regedit"
        }
      },
      {
        "task": {
          "prefix": "$GAMEDIR",
          "description": "Setting ddraw to native for FALLOUT2.EXE",
          "value": "native",
          "arch": "win64",
          "path": "HKEY_CURRENT_USER\\Software\\Wine\\AppDefaults\\FALLOUT2.EXE\\DllOverrides",
          "key": "ddraw",
          "name": "set_regedit"
        }
      },
      {
        "task": {
          "arch": "win64",
          "prefix": "$GAMEDIR",
          "name": "winetricks",
          "app": "vcrun6"
        }
      },
      {
        "task": {
          "prefix": "$GAMEDIR",
          "path": "HKEY_CURRENT_USER\\Software\\Illusion Softworks\\Mafia",
          "value": "14 00 00 05 00 00 00 04 00 00 20 00 00 00 00 00 00 00 00 00 00 00 01 00 00 00 01 00 01 00 01 01 00 01 00 00 00 00 01 00 00 80 3f 00 00 80 3f 02 00 00 00 02 00 00 00 03 00 00 00 02 00 00 00",
          "arch": "win64",
          "type": "REG_BINARY",
          "key": "LS3D_setup",
          "name": "set_regedit"
        }
      },
      {
        "task": {
          "arch": "win64",
          "prefix": "$GAMEDIR",
          "name": "winetricks",
          "app": "d3dcompiler_43"
        }
      },
      {
        "task": {
          "prefix": "$GAMEDIR",
          "description": "Setting winegstreamer to native for Game.exe",
          "value": null,
          "arch": "win64",
          "path": "HKEY_CURRENT_USER\\Software\\Wine\\AppDefaults\\Game.exe\\DllOverrides",
          "key": "winegstreamer",
          "name": "set_regedit"
        }
      },
      {
        "task": {
          "arch": "win64",
          "prefix": "$GAMEDIR",
          "name": "winekill"
        }
      }
    ]
  },
  "content": "files:\n- galaxy: https://cdn.gog.com/open/galaxy/client/setup_galaxy_1.2.54.23.exe\ngame:\n  arch: win64\n  args: /runWithoutUpdating /deelevated\n  exe: drive_c/Program Files (x86)/GOG Galaxy/GalaxyClient.exe\n  prefix: $GAMEDIR\ninstaller:\n- task:\n    arch: win64\n    name: create_prefix\n    prefix: $GAMEDIR\n- task:\n    app: corefonts\n    arch: win64\n    name: winetricks\n    prefix: $GAMEDIR\n- task:\n    app: xact\n    arch: win64\n    name: winetricks\n    prefix: $GAMEDIR\n- task:\n    app: win7\n    arch: win64\n    name: winetricks\n    prefix: $GAMEDIR\n- task:\n    arch: win64\n    args: /silent\n    executable: galaxy\n    name: wineexec\n    prefix: $GAMEDIR\n- task:\n    arch: win64\n    description: Setting version to xp for Crysis.exe...\n    key: Version\n    name: set_regedit\n    path: HKEY_CURRENT_USER\\Software\\Wine\\AppDefaults\\Crysis.exe\n    prefix: $GAMEDIR\n    value: winxp64\n- task:\n    arch: win64\n    description: Setting version to xp for Crysis64.exe...\n    key: Version\n    name: set_regedit\n    path: HKEY_CURRENT_USER\\Software\\Wine\\AppDefaults\\Crysis64.exe\n    prefix: $GAMEDIR\n    value: winxp64\n- task:\n    arch: win64\n    description: Setting ddraw to native for FALLOUT2.EXE\n    key: ddraw\n    name: set_regedit\n    path: HKEY_CURRENT_USER\\Software\\Wine\\AppDefaults\\FALLOUT2.EXE\\DllOverrides\n    prefix: $GAMEDIR\n    value: native\n- task:\n    app: vcrun6\n    arch: win64\n    name: winetricks\n    prefix: $GAMEDIR\n- task:\n    arch: win64\n    key: LS3D_setup\n    name: set_regedit\n    path: HKEY_CURRENT_USER\\Software\\Illusion Softworks\\Mafia\n    prefix: $GAMEDIR\n    type: REG_BINARY\n    value: 14 00 00 05 00 00 00 04 00 00 20 00 00 00 00 00 00 00 00 00 00 00 01 00\n      00 00 01 00 01 00 01 01 00 01 00 00 00 00 01 00 00 80 3f 00 00 80 3f 02 00 00\n      00 02 00 00 00 03 00 00 00 02 00 00 00\n- task:\n    app: d3dcompiler_43\n    arch: win64\n    name: winetricks\n    prefix: $GAMEDIR\n- task:\n    arch: win64\n    description: Setting winegstreamer to native for Game.exe\n    key: winegstreamer\n    name: set_regedit\n    path: HKEY_CURRENT_USER\\Software\\Wine\\AppDefaults\\Game.exe\\DllOverrides\n    prefix: $GAMEDIR\n    value: null\n- task:\n    arch: win64\n    name: winekill\n    prefix: $GAMEDIR\nsystem:\n  env:\n    allow_glsl_builtin_variable_redeclaration: true\n    force_glsl_extensions_warn: true\nwine:\n  dxvk: true\n  overrides:\n    xaudio2_6: native,builtin\n    xaudio2_7: native,builtin\n  version: tkg-4.0-x86_64\n"
}