{
  "id": 11203,
  "game_id": 5390,
  "game_slug": "gog-galaxy",
  "name": "GOG Galaxy",
  "year": 2014,
  "user": "soredake",
  "runner": "wine",
  "slug": "gog-galaxy-gog-galaxy-20-all-in",
  "version": "GOG Galaxy 2.0 All-in-One",
  "description": "DXVK + esync + fsync + game fixes",
  "notes": "Now work:\r\n- Crysis 1\r\n- Vampire: The Masquerade - Bloodlines\r\n- Dragon Age: Origins\r\n\r\nVA-11 Hall-A: Cyberpunk Bartender Action and Undertale crash with overlay in-game enabled.",
  "created_at": "2018-12-12T12:54:51.788000Z",
  "updated_at": "2020-02-03T16:50:24.101156Z",
  "draft": false,
  "published": true,
  "published_by": 51687,
  "rating": "2",
  "steamid": null,
  "gogid": null,
  "gogslug": "",
  "humblestoreid": "",
  "script": {
    "files": [
      {
        "galaxy": "https://raw.githubusercontent.com/soredake/lutris-additions/master/GOG_Galaxy_2.0.exe"
      }
    ],
    "installer": [
      {
        "task": {
          "prefix": "$GAMEDIR",
          "name": "create_prefix",
          "arch": "win64"
        }
      },
      {
        "task": {
          "prefix": "$GAMEDIR",
          "name": "wineexec",
          "arch": "win64",
          "executable": "galaxy"
        }
      },
      {
        "task": {
          "description": "Setting wine version to xp for Crysis.exe",
          "name": "set_regedit",
          "arch": "win64",
          "key": "Version",
          "prefix": "$GAMEDIR",
          "path": "HKEY_CURRENT_USER\\Software\\Wine\\AppDefaults\\Crysis.exe",
          "value": "winxp64"
        }
      },
      {
        "task": {
          "description": "Setting wine version to xp for Crysis64.exe",
          "name": "set_regedit",
          "arch": "win64",
          "key": "Version",
          "prefix": "$GAMEDIR",
          "path": "HKEY_CURRENT_USER\\Software\\Wine\\AppDefaults\\Crysis64.exe",
          "value": "winxp64"
        }
      },
      {
        "task": {
          "description": "Setting ddraw to native for FALLOUT2.EXE (sfall)",
          "name": "set_regedit",
          "arch": "win64",
          "key": "ddraw",
          "prefix": "$GAMEDIR",
          "path": "HKEY_CURRENT_USER\\Software\\Wine\\AppDefaults\\FALLOUT2.EXE\\DllOverrides",
          "value": "native"
        }
      },
      {
        "task": {
          "description": "Setting ddraw to native for FALLOUTW.exe (sfall)",
          "name": "set_regedit",
          "arch": "win64",
          "key": "ddraw",
          "prefix": "$GAMEDIR",
          "path": "HKEY_CURRENT_USER\\Software\\Wine\\AppDefaults\\FALLOUTW.exe\\DllOverrides",
          "value": "native"
        }
      },
      {
        "task": {
          "description": "Setting dbghelp to native,builtin for Vampire.exe (Vampire The Masquerade - Bloodlines)",
          "name": "set_regedit",
          "arch": "win64",
          "key": "dbghelp",
          "prefix": "$GAMEDIR",
          "path": "HKEY_CURRENT_USER\\Software\\Wine\\AppDefaults\\Vampire.exe\\DllOverrides",
          "value": "native,builtin"
        }
      },
      {
        "task": {
          "description": "Setting winegstreamer to null for Game.exe (Mafia 1)",
          "name": "set_regedit",
          "arch": "win64",
          "key": "winegstreamer",
          "prefix": "$GAMEDIR",
          "path": "HKEY_CURRENT_USER\\Software\\Wine\\AppDefaults\\Game.exe\\DllOverrides",
          "value": null
        }
      },
      {
        "task": {
          "description": "Installing needed libraries",
          "name": "winetricks",
          "arch": "win64",
          "silent": true,
          "prefix": "$GAMEDIR",
          "app": "d3dcompiler_43 d3dcompiler_47 d3dx9 d3dx10 physx"
        }
      }
    ],
    "game": {
      "args": "/runWithoutUpdating /deelevated",
      "arch": "win64",
      "exe": "drive_c/Program Files (x86)/GOG Galaxy/GalaxyClient.exe",
      "prefix": "$GAMEDIR"
    },
    "system": {
      "restore_gamma": true,
      "reset_desktop": true,
      "env": {
        "STAGING_SHARED_MEMORY": "1",
        "WINEFSYNC": "1"
      }
    },
    "wine": {
      "dxvk": true,
      "esync": true
    }
  },
  "content": "files:\r\n- galaxy: https://raw.githubusercontent.com/soredake/lutris-additions/master/GOG_Galaxy_2.0.exe\r\ngame:\r\n  arch: win64\r\n  args: /runWithoutUpdating /deelevated\r\n  exe: drive_c/Program Files (x86)/GOG Galaxy/GalaxyClient.exe\r\n  prefix: $GAMEDIR\r\ninstaller:\r\n- task:\r\n    arch: win64\r\n    name: create_prefix\r\n    prefix: $GAMEDIR\r\n- task:\r\n    arch: win64\r\n    executable: galaxy\r\n    name: wineexec\r\n    prefix: $GAMEDIR\r\n- task:\r\n    arch: win64\r\n    description: Setting wine version to xp for Crysis.exe\r\n    key: Version\r\n    name: set_regedit\r\n    path: HKEY_CURRENT_USER\\Software\\Wine\\AppDefaults\\Crysis.exe\r\n    prefix: $GAMEDIR\r\n    value: winxp64\r\n- task:\r\n    arch: win64\r\n    description: Setting wine version to xp for Crysis64.exe\r\n    key: Version\r\n    name: set_regedit\r\n    path: HKEY_CURRENT_USER\\Software\\Wine\\AppDefaults\\Crysis64.exe\r\n    prefix: $GAMEDIR\r\n    value: winxp64\r\n- task:\r\n    arch: win64\r\n    description: Setting ddraw to native for FALLOUT2.EXE (sfall)\r\n    key: ddraw\r\n    name: set_regedit\r\n    path: HKEY_CURRENT_USER\\Software\\Wine\\AppDefaults\\FALLOUT2.EXE\\DllOverrides\r\n    prefix: $GAMEDIR\r\n    value: native\r\n- task:\r\n    arch: win64\r\n    description: Setting ddraw to native for FALLOUTW.exe (sfall)\r\n    key: ddraw\r\n    name: set_regedit\r\n    path: HKEY_CURRENT_USER\\Software\\Wine\\AppDefaults\\FALLOUTW.exe\\DllOverrides\r\n    prefix: $GAMEDIR\r\n    value: native\r\n- task:\r\n    arch: win64\r\n    description: Setting dbghelp to native,builtin for Vampire.exe (Vampire The Masquerade\r\n      - Bloodlines)\r\n    key: dbghelp\r\n    name: set_regedit\r\n    path: HKEY_CURRENT_USER\\Software\\Wine\\AppDefaults\\Vampire.exe\\DllOverrides\r\n    prefix: $GAMEDIR\r\n    value: native,builtin\r\n- task:\r\n    arch: win64\r\n    description: Setting winegstreamer to null for Game.exe (Mafia 1)\r\n    key: winegstreamer\r\n    name: set_regedit\r\n    path: HKEY_CURRENT_USER\\Software\\Wine\\AppDefaults\\Game.exe\\DllOverrides\r\n    prefix: $GAMEDIR\r\n    value: null\r\n- task:\r\n    app: d3dcompiler_43 d3dcompiler_47 d3dx9 d3dx10 physx\r\n    arch: win64\r\n    description: Installing needed libraries\r\n    name: winetricks\r\n    silent: true\r\n    prefix: $GAMEDIR\r\nsystem:\r\n  env:\r\n    STAGING_SHARED_MEMORY: '1'\r\n    WINEFSYNC: '1'\r\n  reset_desktop: true\r\n  restore_gamma: true\r\nwine:\r\n  dxvk: true\r\n  esync: true"
}