{
  "id": 1782,
  "game_id": 5390,
  "game_slug": "gog-galaxy",
  "name": "GOG Galaxy",
  "year": 2014,
  "user": "RobLoach",
  "runner": "wine",
  "slug": "gog-galaxy-125423",
  "version": "1.2.54.23",
  "description": null,
  "notes": "",
  "created_at": "2015-12-28T22:09:40.465000Z",
  "updated_at": "2020-01-23T02:56:48.559184Z",
  "draft": false,
  "published": false,
  "published_by": 19464,
  "rating": "4",
  "steamid": null,
  "gogid": null,
  "gogslug": "",
  "humblestoreid": "",
  "script": {
    "files": [
      {
        "galaxy": "https://cdn.gog.com/open/galaxy/client/setup_galaxy_1.2.54.23.exe"
      }
    ],
    "game": {
      "args": "/runWithoutUpdating /deelevated",
      "arch": "win64",
      "exe": "drive_c/Program Files (x86)/GOG Galaxy/GalaxyClient.exe",
      "prefix": "$GAMEDIR"
    },
    "installer": [
      {
        "task": {
          "prefix": "$GAMEDIR",
          "name": "create_prefix",
          "arch": "win64"
        }
      },
      {
        "task": {
          "prefix": "$GAMEDIR",
          "name": "winetricks",
          "arch": "win64",
          "app": "corefonts"
        }
      },
      {
        "task": {
          "prefix": "$GAMEDIR",
          "name": "winetricks",
          "arch": "win64",
          "app": "win7"
        }
      },
      {
        "task": {
          "args": "/silent",
          "name": "wineexec",
          "arch": "win64",
          "executable": "galaxy",
          "prefix": "$GAMEDIR"
        }
      },
      {
        "task": {
          "prefix": "$GAMEDIR",
          "name": "winekill",
          "arch": "win64"
        }
      }
    ]
  },
  "content": "files:\n- galaxy: https://cdn.gog.com/open/galaxy/client/setup_galaxy_1.2.54.23.exe\ngame:\n  arch: win64\n  args: /runWithoutUpdating /deelevated\n  exe: drive_c/Program Files (x86)/GOG Galaxy/GalaxyClient.exe\n  prefix: $GAMEDIR\ninstaller:\n- task:\n    arch: win64\n    name: create_prefix\n    prefix: $GAMEDIR\n- task:\n    app: corefonts\n    arch: win64\n    name: winetricks\n    prefix: $GAMEDIR\n- task:\n    app: win7\n    arch: win64\n    name: winetricks\n    prefix: $GAMEDIR\n- task:\n    arch: win64\n    args: /silent\n    executable: galaxy\n    name: wineexec\n    prefix: $GAMEDIR\n- task:\n    arch: win64\n    name: winekill\n    prefix: $GAMEDIR\n"
}