{
  "id": 14397,
  "game_id": 5390,
  "game_slug": "gog-galaxy",
  "name": "GOG Galaxy",
  "year": 2014,
  "user": "neosloth",
  "runner": "wine",
  "slug": "gog-galaxy-125774",
  "version": "1.2.57.74",
  "description": null,
  "notes": "",
  "created_at": "2019-07-03T06:50:37.920284Z",
  "updated_at": "2019-07-03T06:50:37.920313Z",
  "draft": true,
  "published": false,
  "published_by": null,
  "rating": "",
  "steamid": null,
  "gogid": null,
  "gogslug": "",
  "humblestoreid": "",
  "script": {
    "game": {
      "exe": "drive_c/Program Files (x86)/GOG Galaxy/GalaxyClient.exe",
      "arch": "win64",
      "prefix": "$GAMEDIR",
      "args": "/runWithoutUpdating /deelevated"
    },
    "files": [
      {
        "galaxy": "https://cdn.gog.com/open/galaxy/client/setup_galaxy_1.2.54.23.exe"
      }
    ],
    "wine": {
      "version": "tkg-4.4-x86_64"
    },
    "installer": [
      {
        "task": {
          "prefix": "$GAMEDIR",
          "arch": "win64",
          "name": "create_prefix"
        }
      },
      {
        "task": {
          "arch": "win64",
          "prefix": "$GAMEDIR",
          "name": "winetricks",
          "app": "corefonts"
        }
      },
      {
        "task": {
          "arch": "win64",
          "prefix": "$GAMEDIR",
          "name": "winetricks",
          "app": "win7"
        }
      },
      {
        "task": {
          "args": "/silent",
          "prefix": "$GAMEDIR",
          "executable": "galaxy",
          "name": "wineexec",
          "arch": "win64"
        }
      },
      {
        "task": {
          "prefix": "$GAMEDIR",
          "arch": "win64",
          "name": "winekill"
        }
      }
    ]
  },
  "content": "files:\n- galaxy: https://cdn.gog.com/open/galaxy/client/setup_galaxy_1.2.54.23.exe\ngame:\n  arch: win64\n  args: /runWithoutUpdating /deelevated\n  exe: drive_c/Program Files (x86)/GOG Galaxy/GalaxyClient.exe\n  prefix: $GAMEDIR\ninstaller:\n- task:\n    arch: win64\n    name: create_prefix\n    prefix: $GAMEDIR\n- task:\n    app: corefonts\n    arch: win64\n    name: winetricks\n    prefix: $GAMEDIR\n- task:\n    app: win7\n    arch: win64\n    name: winetricks\n    prefix: $GAMEDIR\n- task:\n    arch: win64\n    args: /silent\n    executable: galaxy\n    name: wineexec\n    prefix: $GAMEDIR\n- task:\n    arch: win64\n    name: winekill\n    prefix: $GAMEDIR\nwine:\n  version: tkg-4.4-x86_64\n"
}