{
  "id": 17401,
  "game_id": 5390,
  "game_slug": "gog-galaxy",
  "name": "GOG Galaxy",
  "year": 2014,
  "user": "soredake",
  "runner": "wine",
  "slug": "gog-galaxy-change-me1",
  "version": "Change Me1",
  "description": "DXVK + esync + fsync + game fixes",
  "notes": "Now work:\r\n- Crysis 1\r\n- Vampire: The Masquerade - Bloodlines\r\n\r\nVA-11 Hall-A: Cyberpunk Bartender Action and Undertale crash with overlay in-game enabled.",
  "created_at": "2019-12-17T20:16:03.948000Z",
  "updated_at": "2020-01-23T02:57:00.688281Z",
  "draft": false,
  "published": false,
  "published_by": 20548,
  "rating": "",
  "steamid": null,
  "gogid": null,
  "gogslug": "",
  "humblestoreid": "",
  "script": {
    "game": {
      "exe": "drive_c/Program Files (x86)/GOG Galaxy/GalaxyClient.exe",
      "arch": "win64",
      "args": "/runWithoutUpdating /deelevated",
      "prefix": "$GAMEDIR"
    },
    "system": {
      "restore_gamma": true,
      "env": {
        "DXVK_HUD": "compiler",
        "PROTON_FSHACK_INTEGER_SCALING": "0",
        "WINEFSYNC": "1",
        "STAGING_SHARED_MEMORY": "1",
        "WINE_LARGE_ADDRESS_AWARE": "1"
      }
    },
    "wine": {
      "esync": true,
      "dxvk": true
    },
    "installer": [
      {
        "task": {
          "arch": "win64",
          "prefix": "$GAMEDIR",
          "name": "create_prefix"
        }
      },
      {
        "task": {
          "executable": "galaxy",
          "arch": "win64",
          "prefix": "$GAMEDIR",
          "name": "wineexec"
        }
      },
      {
        "task": {
          "arch": "win64",
          "description": "Setting wine version to xp for Crysis.exe",
          "prefix": "$GAMEDIR",
          "name": "set_regedit",
          "path": "HKEY_CURRENT_USER\\Software\\Wine\\AppDefaults\\Crysis.exe",
          "value": "winxp64",
          "key": "Version"
        }
      },
      {
        "task": {
          "arch": "win64",
          "description": "Setting wine version to xp for Crysis64.exe",
          "prefix": "$GAMEDIR",
          "name": "set_regedit",
          "path": "HKEY_CURRENT_USER\\Software\\Wine\\AppDefaults\\Crysis64.exe",
          "value": "winxp64",
          "key": "Version"
        }
      },
      {
        "task": {
          "arch": "win64",
          "description": "Setting ddraw to native for FALLOUT2.EXE (sfall)",
          "prefix": "$GAMEDIR",
          "name": "set_regedit",
          "path": "HKEY_CURRENT_USER\\Software\\Wine\\AppDefaults\\FALLOUT2.EXE\\DllOverrides",
          "value": "native",
          "key": "ddraw"
        }
      },
      {
        "task": {
          "arch": "win64",
          "description": "Setting ddraw to native for FALLOUTW.exe (sfall)",
          "prefix": "$GAMEDIR",
          "name": "set_regedit",
          "path": "HKEY_CURRENT_USER\\Software\\Wine\\AppDefaults\\FALLOUTW.exe\\DllOverrides",
          "value": "native",
          "key": "ddraw"
        }
      },
      {
        "task": {
          "arch": "win64",
          "description": "Setting dbghelp to native,builtin for Vampire.exe (Vampire The Masquerade - Bloodlines)",
          "prefix": "$GAMEDIR",
          "name": "set_regedit",
          "path": "HKEY_CURRENT_USER\\Software\\Wine\\AppDefaults\\Vampire.exe\\DllOverrides",
          "value": "native,builtin",
          "key": "dbghelp"
        }
      },
      {
        "task": {
          "arch": "win64",
          "description": "Setting winegstreamer to null for Game.exe (Mafia 1)",
          "prefix": "$GAMEDIR",
          "name": "set_regedit",
          "path": "HKEY_CURRENT_USER\\Software\\Wine\\AppDefaults\\Game.exe\\DllOverrides",
          "value": null,
          "key": "winegstreamer"
        }
      },
      {
        "task": {
          "app": "corefonts vcrun6 d3dcompiler_43 d3dcompiler_47 d3dx9 d3dx10_43 win7",
          "arch": "win64",
          "description": "Installing needed libraries",
          "prefix": "$GAMEDIR",
          "name": "winetricks"
        }
      },
      {
        "task": {
          "arch": "win64",
          "prefix": "$GAMEDIR",
          "name": "winekill"
        }
      }
    ],
    "files": [
      {
        "galaxy": "N/A: Select GOG Galaxy 2.0 installer downloaded from https://www.gogalaxy.com/en/"
      }
    ]
  },
  "content": "files:\n- galaxy: 'N/A: Select GOG Galaxy 2.0 installer downloaded from https://www.gogalaxy.com/en/'\ngame:\n  arch: win64\n  args: /runWithoutUpdating /deelevated\n  exe: drive_c/Program Files (x86)/GOG Galaxy/GalaxyClient.exe\n  prefix: $GAMEDIR\ninstaller:\n- task:\n    arch: win64\n    name: create_prefix\n    prefix: $GAMEDIR\n- task:\n    arch: win64\n    executable: galaxy\n    name: wineexec\n    prefix: $GAMEDIR\n- task:\n    arch: win64\n    description: Setting wine version to xp for Crysis.exe\n    key: Version\n    name: set_regedit\n    path: HKEY_CURRENT_USER\\Software\\Wine\\AppDefaults\\Crysis.exe\n    prefix: $GAMEDIR\n    value: winxp64\n- task:\n    arch: win64\n    description: Setting wine version to xp for Crysis64.exe\n    key: Version\n    name: set_regedit\n    path: HKEY_CURRENT_USER\\Software\\Wine\\AppDefaults\\Crysis64.exe\n    prefix: $GAMEDIR\n    value: winxp64\n- task:\n    arch: win64\n    description: Setting ddraw to native for FALLOUT2.EXE (sfall)\n    key: ddraw\n    name: set_regedit\n    path: HKEY_CURRENT_USER\\Software\\Wine\\AppDefaults\\FALLOUT2.EXE\\DllOverrides\n    prefix: $GAMEDIR\n    value: native\n- task:\n    arch: win64\n    description: Setting ddraw to native for FALLOUTW.exe (sfall)\n    key: ddraw\n    name: set_regedit\n    path: HKEY_CURRENT_USER\\Software\\Wine\\AppDefaults\\FALLOUTW.exe\\DllOverrides\n    prefix: $GAMEDIR\n    value: native\n- task:\n    arch: win64\n    description: Setting dbghelp to native,builtin for Vampire.exe (Vampire The Masquerade\n      - Bloodlines)\n    key: dbghelp\n    name: set_regedit\n    path: HKEY_CURRENT_USER\\Software\\Wine\\AppDefaults\\Vampire.exe\\DllOverrides\n    prefix: $GAMEDIR\n    value: native,builtin\n- task:\n    arch: win64\n    description: Setting winegstreamer to null for Game.exe (Mafia 1)\n    key: winegstreamer\n    name: set_regedit\n    path: HKEY_CURRENT_USER\\Software\\Wine\\AppDefaults\\Game.exe\\DllOverrides\n    prefix: $GAMEDIR\n    value: null\n- task:\n    app: corefonts vcrun6 d3dcompiler_43 d3dcompiler_47 d3dx9 d3dx10_43 win7\n    arch: win64\n    description: Installing needed libraries\n    name: winetricks\n    prefix: $GAMEDIR\n- task:\n    arch: win64\n    name: winekill\n    prefix: $GAMEDIR\nsystem:\n  env:\n    DXVK_HUD: compiler\n    PROTON_FSHACK_INTEGER_SCALING: '0'\n    STAGING_SHARED_MEMORY: '1'\n    WINEFSYNC: '1'\n    WINE_LARGE_ADDRESS_AWARE: '1'\n  restore_gamma: true\nwine:\n  dxvk: true\n  esync: true\n"
}