{
  "id": 14974,
  "game_id": 24565,
  "game_slug": "little-fighter-2",
  "name": "Little Fighter 2",
  "year": 1999,
  "user": "vvv",
  "runner": "wine",
  "slug": "little-fighter-2-v20a",
  "version": "v2.0a",
  "description": null,
  "notes": "",
  "created_at": "2019-08-11T21:38:13.260000Z",
  "updated_at": "2019-08-14T01:55:26.187804Z",
  "draft": false,
  "published": true,
  "published_by": 1,
  "rating": "",
  "steamid": null,
  "gogid": null,
  "gogslug": "",
  "humblestoreid": "",
  "script": {
    "game": {
      "exe": "drive_c/Program Files/LittleFighter/lf2.exe",
      "arch": "win32",
      "prefix": "$GAMEDIR"
    },
    "installer": [
      {
        "task": {
          "install_gecko": false,
          "arch": "win32",
          "description": "Creating 32bit Wine prefix.",
          "prefix": "$GAMEDIR",
          "name": "create_prefix",
          "install_mono": false
        }
      },
      {
        "task": {
          "app": "videomemorysize=512",
          "arch": "win32",
          "description": "Setting video memory size.",
          "prefix": "$GAMEDIR",
          "name": "winetricks"
        }
      },
      {
        "task": {
          "app": "vcrun2005",
          "arch": "win32",
          "description": "Installing vcrun2005.",
          "prefix": "$GAMEDIR",
          "name": "winetricks"
        }
      },
      {
        "task": {
          "app": "wmp9",
          "arch": "win32",
          "description": "Installing wmp9.",
          "prefix": "$GAMEDIR",
          "name": "winetricks"
        }
      },
      {
        "task": {
          "executable": "setup",
          "description": "Installing Little Fighter 2.",
          "prefix": "$GAMEDIR",
          "name": "wineexec"
        }
      }
    ],
    "files": [
      {
        "setup": "http://lf2.net/LF2_v2.0a.exe"
      }
    ]
  },
  "content": "files:\n- setup: http://lf2.net/LF2_v2.0a.exe\ngame:\n  arch: win32\n  exe: drive_c/Program Files/LittleFighter/lf2.exe\n  prefix: $GAMEDIR\ninstaller:\n- task:\n    arch: win32\n    description: Creating 32bit Wine prefix.\n    install_gecko: false\n    install_mono: false\n    name: create_prefix\n    prefix: $GAMEDIR\n- task:\n    app: videomemorysize=512\n    arch: win32\n    description: Setting video memory size.\n    name: winetricks\n    prefix: $GAMEDIR\n- task:\n    app: vcrun2005\n    arch: win32\n    description: Installing vcrun2005.\n    name: winetricks\n    prefix: $GAMEDIR\n- task:\n    app: wmp9\n    arch: win32\n    description: Installing wmp9.\n    name: winetricks\n    prefix: $GAMEDIR\n- task:\n    description: Installing Little Fighter 2.\n    executable: setup\n    name: wineexec\n    prefix: $GAMEDIR\n"
}