{
  "id": 3550,
  "game_id": 1449,
  "game_slug": "medal-of-honor-airborne",
  "name": "Medal of Honor: Airborne",
  "year": 2007,
  "user": "strider",
  "runner": "wine",
  "slug": "medal-of-honor-airborne-dvd",
  "version": "DVD",
  "description": null,
  "notes": "",
  "created_at": "2017-04-23T08:42:53.234000Z",
  "updated_at": "2020-05-31T12:57:49.264194Z",
  "draft": false,
  "published": true,
  "published_by": 20548,
  "rating": "",
  "steamid": 24840,
  "gogid": null,
  "gogslug": "",
  "humbleid": "",
  "humblestoreid": "",
  "humblestoreid_real": "",
  "script": {
    "game": {
      "arch": "win32",
      "prefix": "$GAMEDIR"
    },
    "installer": [
      {
        "insert-disc": {
          "requires": "Setup.exe"
        }
      },
      {
        "task": {
          "arch": "win32",
          "name": "create_prefix",
          "prefix": "$GAMEDIR"
        }
      },
      {
        "task": {
          "app": "win7",
          "arch": "win32",
          "description": "Changing to Windows 7",
          "name": "winetricks",
          "prefix": "$GAMEDIR"
        }
      },
      {
        "task": {
          "app": "d3dx9",
          "arch": "win32",
          "description": "Installing d3dx9",
          "name": "winetricks",
          "prefix": "$GAMEDIR"
        }
      },
      {
        "task": {
          "app": "vcrun2005",
          "arch": "win32",
          "description": "Installing VisualC++ Runtime vcrun2005",
          "name": "winetricks",
          "prefix": "$GAMEDIR"
        }
      },
      {
        "task": {
          "app": "vcrun2008",
          "arch": "win32",
          "description": "Installing VisualC++ Runtime vcrun2008",
          "name": "winetricks",
          "prefix": "$GAMEDIR"
        }
      },
      {
        "task": {
          "app": "vcrun2010",
          "arch": "win32",
          "description": "Installing VisualC++ Runtime vcrun2010",
          "name": "winetricks",
          "prefix": "$GAMEDIR"
        }
      },
      {
        "task": {
          "executable": "$DISC/Autorun.exe",
          "name": "wineexec",
          "prefix": "$GAMEDIR"
        }
      },
      {
        "task": {
          "arch": "win32",
          "key": "wined3d",
          "name": "set_regedit",
          "path": "HKEY_CURRENT_USER\\Software\\Wine\\DllRedirects",
          "prefix": "$GAMEDIR",
          "value": "wined3d-csmt.dll"
        }
      }
    ]
  },
  "content": "game:\n  arch: win32\n  prefix: $GAMEDIR\ninstaller:\n- insert-disc:\n    requires: Setup.exe\n- task:\n    arch: win32\n    name: create_prefix\n    prefix: $GAMEDIR\n- task:\n    app: win7\n    arch: win32\n    description: Changing to Windows 7\n    name: winetricks\n    prefix: $GAMEDIR\n- task:\n    app: d3dx9\n    arch: win32\n    description: Installing d3dx9\n    name: winetricks\n    prefix: $GAMEDIR\n- task:\n    app: vcrun2005\n    arch: win32\n    description: Installing VisualC++ Runtime vcrun2005\n    name: winetricks\n    prefix: $GAMEDIR\n- task:\n    app: vcrun2008\n    arch: win32\n    description: Installing VisualC++ Runtime vcrun2008\n    name: winetricks\n    prefix: $GAMEDIR\n- task:\n    app: vcrun2010\n    arch: win32\n    description: Installing VisualC++ Runtime vcrun2010\n    name: winetricks\n    prefix: $GAMEDIR\n- task:\n    executable: $DISC/Autorun.exe\n    name: wineexec\n    prefix: $GAMEDIR\n- task:\n    arch: win32\n    key: wined3d\n    name: set_regedit\n    path: HKEY_CURRENT_USER\\Software\\Wine\\DllRedirects\n    prefix: $GAMEDIR\n    value: wined3d-csmt.dll\n"
}