{
  "id": 8852,
  "game_id": 14730,
  "game_slug": "nba-2k18",
  "name": "NBA 2K18",
  "year": 2017,
  "user": "tgm4883",
  "runner": "winesteam",
  "slug": "nba-2k18-steam",
  "version": "Steam",
  "description": null,
  "notes": "",
  "created_at": "2018-06-21T23:32:16.976000Z",
  "updated_at": "2020-01-31T02:38:32.505063Z",
  "draft": false,
  "published": true,
  "published_by": 19464,
  "rating": "",
  "steamid": 577800,
  "gogid": null,
  "gogslug": "",
  "humblestoreid": "",
  "script": {
    "game": {
      "appid": 577800,
      "arch": "win64",
      "prefix": "$GAMEDIR/prefix"
    },
    "system": {
      "env": {
        "DXVK_HUD": 0
      },
      "pulse_latency": true
    },
    "installer": [
      {
        "extract": {
          "file": "dx2010",
          "dst": "$CACHE/dxsetup"
        }
      },
      {
        "task": {
          "arch": "win64",
          "prefix": "$GAMEDIR/prefix",
          "name": "create_prefix"
        }
      },
      {
        "task": {
          "executable": "$CACHE/dxsetup/DXSETUP.exe",
          "arch": "win64",
          "args": "/silent",
          "prefix": "$GAMEDIR/prefix",
          "name": "wineexec"
        }
      },
      {
        "task": {
          "arch": "win64",
          "prefix": "$GAMEDIR/prefix",
          "name": "winekill"
        }
      },
      {
        "task": {
          "app": "vcrun2010 vcrun2012",
          "arch": "win64",
          "prefix": "$GAMEDIR/prefix",
          "name": "winetricks"
        }
      },
      {
        "task": {
          "app": "dsound win7",
          "arch": "win64",
          "prefix": "$GAMEDIR/prefix",
          "name": "winetricks"
        }
      }
    ],
    "winesteam": {
      "x360ce-path": "$GAMEDIR",
      "overrides": {
        "xaudio2_7": "native,builtin"
      },
      "dxvk": true,
      "x360ce-xinput9": true
    },
    "files": [
      {
        "dx2010": "https://lutris.net/files/tools/directx-2010.tar.gz"
      }
    ]
  },
  "content": "files:\n- dx2010: https://lutris.net/files/tools/directx-2010.tar.gz\ngame:\n  appid: 577800\n  arch: win64\n  prefix: $GAMEDIR/prefix\ninstaller:\n- extract:\n    dst: $CACHE/dxsetup\n    file: dx2010\n- task:\n    arch: win64\n    name: create_prefix\n    prefix: $GAMEDIR/prefix\n- task:\n    arch: win64\n    args: /silent\n    executable: $CACHE/dxsetup/DXSETUP.exe\n    name: wineexec\n    prefix: $GAMEDIR/prefix\n- task:\n    arch: win64\n    name: winekill\n    prefix: $GAMEDIR/prefix\n- task:\n    app: vcrun2010 vcrun2012\n    arch: win64\n    name: winetricks\n    prefix: $GAMEDIR/prefix\n- task:\n    app: dsound win7\n    arch: win64\n    name: winetricks\n    prefix: $GAMEDIR/prefix\nsystem:\n  env:\n    DXVK_HUD: 0\n  pulse_latency: true\nwinesteam:\n  dxvk: true\n  overrides:\n    xaudio2_7: native,builtin\n  x360ce-path: $GAMEDIR\n  x360ce-xinput9: true\n"
}