{
  "id": 19741,
  "game_id": 969,
  "game_slug": "path-of-exile",
  "name": "Path of Exile",
  "year": 2013,
  "user": "tpdns90321",
  "runner": "wine",
  "slug": "path-of-exile-change-me-3",
  "version": "Change Me",
  "description": "The game launches in DX11 mode.",
  "notes": "",
  "created_at": "2020-04-16T11:42:36.646560Z",
  "updated_at": "2020-04-16T11:42:36.646594Z",
  "draft": false,
  "published": false,
  "published_by": 1,
  "rating": "",
  "steamid": 238960,
  "gogid": null,
  "gogslug": "",
  "humbleid": "",
  "humblestoreid": "",
  "humblestoreid_real": "",
  "script": {
    "files": [
      {
        "setup": "https://www.pathofexile.com/downloads/PathOfExileInstaller.exe"
      }
    ],
    "game": {
      "arch": "win64",
      "args": "--waitforpreload --nologo --nodx9ex --gc2",
      "exe": "$GAMEDIR/drive_c/Program Files (x86)/Grinding Gear Games/Path of Exile/PathOfExile.exe",
      "prefix": "$GAMEDIR"
    },
    "installer": [
      {
        "task": {
          "arch": "win64",
          "description": "Creating Wine prefix",
          "name": "create_prefix",
          "prefix": "$GAMEDIR"
        }
      },
      {
        "task": {
          "app": "win7",
          "name": "winetricks",
          "prefix": "$GAMEDIR"
        }
      },
      {
        "merge": {
          "dst": "$GAMEDIR/drive_c/Program Files (x86)/Grinding Gear Games/Path of Exile",
          "src": "setup"
        }
      },
      {
        "task": {
          "app": "riched20",
          "description": "Installing Rich Text Editor 2.0",
          "name": "winetricks",
          "prefix": "$GAMEDIR",
          "silent": true
        }
      },
      {
        "task": {
          "app": "usp10",
          "description": "Installing Uniscribe 1.0",
          "name": "winetricks",
          "prefix": "$GAMEDIR",
          "silent": true
        }
      },
      {
        "task": {
          "description": "Installing Path Of Exile",
          "executable": "setup",
          "name": "wineexec",
          "prefix": "$GAMEDIR"
        }
      },
      {
        "task": {
          "key": "VideoMemorySize",
          "name": "set_regedit",
          "path": "HKEY_CURRENT_USER\\Software\\Wine\\Direct3D",
          "prefix": "$GAMEDIR",
          "value": 8192
        }
      }
    ],
    "system": {
      "env": {
        "DXVK_HUD": 0,
        "DXVK_USE_PIPECOMPILER": 1,
        "DXVK_USE_PLACEHOLDER_SHADERS": 1
      },
      "pulse_latency": true,
      "reset_pulse": true
    },
    "wine": {
      "dxvk": true,
      "esync": true,
      "overrides": {
        "d3dcompiler_47": "native",
        "xaudio2_7": "native,builtin"
      }
    }
  },
  "content": "files:\n- setup: https://www.pathofexile.com/downloads/PathOfExileInstaller.exe\ngame:\n  arch: win64\n  args: --waitforpreload --nologo --nodx9ex --gc2\n  exe: $GAMEDIR/drive_c/Program Files (x86)/Grinding Gear Games/Path of Exile/PathOfExile.exe\n  prefix: $GAMEDIR\ninstaller:\n- task:\n    arch: win64\n    description: Creating Wine prefix\n    name: create_prefix\n    prefix: $GAMEDIR\n- task:\n    app: win7\n    name: winetricks\n    prefix: $GAMEDIR\n- merge:\n    dst: $GAMEDIR/drive_c/Program Files (x86)/Grinding Gear Games/Path of Exile\n    src: setup\n- task:\n    app: riched20\n    description: Installing Rich Text Editor 2.0\n    name: winetricks\n    prefix: $GAMEDIR\n    silent: true\n- task:\n    app: usp10\n    description: Installing Uniscribe 1.0\n    name: winetricks\n    prefix: $GAMEDIR\n    silent: true\n- task:\n    description: Installing Path Of Exile\n    executable: setup\n    name: wineexec\n    prefix: $GAMEDIR\n- task:\n    key: VideoMemorySize\n    name: set_regedit\n    path: HKEY_CURRENT_USER\\Software\\Wine\\Direct3D\n    prefix: $GAMEDIR\n    value: 8192\nsystem:\n  env:\n    DXVK_HUD: 0\n    DXVK_USE_PIPECOMPILER: 1\n    DXVK_USE_PLACEHOLDER_SHADERS: 1\n  pulse_latency: true\n  reset_pulse: true\nwine:\n  dxvk: true\n  esync: true\n  overrides:\n    d3dcompiler_47: native\n    xaudio2_7: native,builtin\n"
}