{
  "id": 11261,
  "game_id": 24343,
  "game_slug": "vegas-pro-15-edit",
  "name": "VEGAS Pro 15 Edit",
  "year": 2018,
  "user": "secon",
  "runner": "wine",
  "slug": "vegas-pro-15-edit-standalone",
  "version": "Standalone",
  "description": null,
  "notes": "Throws an error about connection just press ignore.",
  "created_at": "2018-12-19T00:58:00.252000Z",
  "updated_at": "2019-06-13T07:14:51.540161Z",
  "draft": false,
  "published": true,
  "published_by": 19464,
  "rating": "",
  "steamid": 689790,
  "gogid": null,
  "gogslug": "",
  "humblestoreid": "",
  "script": {
    "game": {
      "exe": "drive_c/Program Files/VEGAS/VEGAS Pro 15.0/vegas150.exe",
      "arch": "win64",
      "prefix": "$GAMEDIR"
    },
    "files": [
      {
        "vegas": {
          "filename": "vegaspro15edit_dlm.exe",
          "url": "http://dl03.magix.net/vegaspro15edit_dlm.exe?dwl=1"
        }
      }
    ],
    "wine": {
      "version": "tkg-4.0-x86_64"
    },
    "installer": [
      {
        "task": {
          "description": "Creating Wine Prefix",
          "prefix": "$GAMEDIR",
          "arch": "win64",
          "name": "create_prefix"
        }
      },
      {
        "task": {
          "description": "Visual C++ 2008-2017",
          "arch": "win64",
          "prefix": "$GAMEDIR",
          "name": "winetricks",
          "app": "vcrun2008 vcrun2010 vcrun2012 vcrun2013 vcrun2017"
        }
      },
      {
        "task": {
          "description": "Installing .NET 4.7.2",
          "arch": "win64",
          "prefix": "$GAMEDIR",
          "name": "winetricks",
          "app": "dotnet472 win7"
        }
      },
      {
        "task": {
          "description": "Running Vegas Pro 15 Edit setup",
          "prefix": "$GAMEDIR",
          "executable": "vegas",
          "name": "wineexec"
        }
      }
    ]
  },
  "content": "files:\n- vegas:\n    filename: vegaspro15edit_dlm.exe\n    url: http://dl03.magix.net/vegaspro15edit_dlm.exe?dwl=1\ngame:\n  arch: win64\n  exe: drive_c/Program Files/VEGAS/VEGAS Pro 15.0/vegas150.exe\n  prefix: $GAMEDIR\ninstaller:\n- task:\n    arch: win64\n    description: Creating Wine Prefix\n    name: create_prefix\n    prefix: $GAMEDIR\n- task:\n    app: vcrun2008 vcrun2010 vcrun2012 vcrun2013 vcrun2017\n    arch: win64\n    description: Visual C++ 2008-2017\n    name: winetricks\n    prefix: $GAMEDIR\n- task:\n    app: dotnet472 win7\n    arch: win64\n    description: Installing .NET 4.7.2\n    name: winetricks\n    prefix: $GAMEDIR\n- task:\n    description: Running Vegas Pro 15 Edit setup\n    executable: vegas\n    name: wineexec\n    prefix: $GAMEDIR\nwine:\n  version: tkg-4.0-x86_64\n"
}