{
  "id": 10720,
  "game_id": 23120,
  "game_slug": "adobe-lightroom-5",
  "name": "Adobe Lightroom 5",
  "year": 2013,
  "user": "mathue",
  "runner": "wine",
  "slug": "adobe-lightroom-5-classic",
  "version": "Classic",
  "description": "Adobe Lightroom Classic",
  "notes": "",
  "created_at": "2018-11-01T22:07:28.879000Z",
  "updated_at": "2020-01-23T02:57:00.729398Z",
  "draft": false,
  "published": true,
  "published_by": 51687,
  "rating": "",
  "steamid": null,
  "gogid": null,
  "gogslug": "",
  "humbleid": "",
  "humblestoreid": "",
  "humblestoreid_real": "",
  "script": {
    "files": [
      {
        "setup": "N/A:Select the 64-bit setup file"
      }
    ],
    "game": {
      "arch": "win64",
      "exe": "drive_c/Program Files/Adobe/Adobe Photoshop Lightroom/lightroom.exe",
      "prefix": "$GAMEDIR"
    },
    "installer": [
      {
        "task": {
          "arch": "win64",
          "description": "Creating 64-bit Wine prefix.",
          "name": "create_prefix",
          "prefix": "$GAMEDIR"
        }
      },
      {
        "task": {
          "arch": "win64",
          "description": "Setting Windows 7 mode for Wine",
          "key": "Version",
          "name": "set_regedit",
          "path": "HKEY_CURRENT_USER\\Software\\Wine",
          "prefix": "$GAMEDIR",
          "value": "win7"
        }
      },
      {
        "task": {
          "name": "winekill",
          "prefix": "$GAMEDIR"
        }
      },
      {
        "task": {
          "app": "atmlib",
          "arch": "win64",
          "description": "Installing atmlib",
          "name": "winetricks",
          "prefix": "$GAMEDIR"
        }
      },
      {
        "task": {
          "app": "gdiplus",
          "arch": "win64",
          "description": "Installing gdiplus",
          "name": "winetricks",
          "prefix": "$GAMEDIR"
        }
      },
      {
        "task": {
          "app": "mfc42",
          "arch": "win64",
          "description": "Installing mfc42",
          "name": "winetricks",
          "prefix": "$GAMEDIR"
        }
      },
      {
        "task": {
          "app": "msasn1",
          "arch": "win64",
          "description": "Installing msasn1",
          "name": "winetricks",
          "prefix": "$GAMEDIR"
        }
      },
      {
        "task": {
          "app": "msxml3",
          "arch": "win64",
          "description": "Installing msxml3",
          "name": "winetricks",
          "prefix": "$GAMEDIR"
        }
      },
      {
        "task": {
          "app": "msxml6",
          "arch": "win64",
          "description": "Installing msxml6",
          "name": "winetricks",
          "prefix": "$GAMEDIR"
        }
      },
      {
        "task": {
          "app": "vcrun2008",
          "arch": "win64",
          "description": "Installing vcrun2008",
          "name": "winetricks",
          "prefix": "$GAMEDIR"
        }
      },
      {
        "task": {
          "app": "vcrun2010",
          "arch": "win64",
          "description": "Installing vcrun2010",
          "name": "winetricks",
          "prefix": "$GAMEDIR"
        }
      },
      {
        "task": {
          "app": "vcrun2012",
          "arch": "win64",
          "description": "Installing vcrun2012",
          "name": "winetricks",
          "prefix": "$GAMEDIR"
        }
      },
      {
        "task": {
          "app": "corefonts",
          "arch": "win64",
          "description": "Installing corefonts",
          "name": "winetricks",
          "prefix": "$GAMEDIR"
        }
      },
      {
        "task": {
          "arch": "win64",
          "description": "Installing Lightroom Classic 64-bit",
          "executable": "setup",
          "name": "wineexec"
        }
      }
    ]
  },
  "content": "files:\n- setup: N/A:Select the 64-bit setup file\ngame:\n  arch: win64\n  exe: drive_c/Program Files/Adobe/Adobe Photoshop Lightroom/lightroom.exe\n  prefix: $GAMEDIR\ninstaller:\n- task:\n    arch: win64\n    description: Creating 64-bit Wine prefix.\n    name: create_prefix\n    prefix: $GAMEDIR\n- task:\n    arch: win64\n    description: Setting Windows 7 mode for Wine\n    key: Version\n    name: set_regedit\n    path: HKEY_CURRENT_USER\\Software\\Wine\n    prefix: $GAMEDIR\n    value: win7\n- task:\n    name: winekill\n    prefix: $GAMEDIR\n- task:\n    app: atmlib\n    arch: win64\n    description: Installing atmlib\n    name: winetricks\n    prefix: $GAMEDIR\n- task:\n    app: gdiplus\n    arch: win64\n    description: Installing gdiplus\n    name: winetricks\n    prefix: $GAMEDIR\n- task:\n    app: mfc42\n    arch: win64\n    description: Installing mfc42\n    name: winetricks\n    prefix: $GAMEDIR\n- task:\n    app: msasn1\n    arch: win64\n    description: Installing msasn1\n    name: winetricks\n    prefix: $GAMEDIR\n- task:\n    app: msxml3\n    arch: win64\n    description: Installing msxml3\n    name: winetricks\n    prefix: $GAMEDIR\n- task:\n    app: msxml6\n    arch: win64\n    description: Installing msxml6\n    name: winetricks\n    prefix: $GAMEDIR\n- task:\n    app: vcrun2008\n    arch: win64\n    description: Installing vcrun2008\n    name: winetricks\n    prefix: $GAMEDIR\n- task:\n    app: vcrun2010\n    arch: win64\n    description: Installing vcrun2010\n    name: winetricks\n    prefix: $GAMEDIR\n- task:\n    app: vcrun2012\n    arch: win64\n    description: Installing vcrun2012\n    name: winetricks\n    prefix: $GAMEDIR\n- task:\n    app: corefonts\n    arch: win64\n    description: Installing corefonts\n    name: winetricks\n    prefix: $GAMEDIR\n- task:\n    arch: win64\n    description: Installing Lightroom Classic 64-bit\n    executable: setup\n    name: wineexec\n"
}