{
  "id": 10755,
  "game_id": 591,
  "game_slug": "mass-effect",
  "name": "Mass Effect",
  "year": 2007,
  "user": "meklahi",
  "runner": "wine",
  "slug": "mass-effect-origin",
  "version": "Origin",
  "description": "Only sets up Origin you'll need to download Mass Effect manually from the Origin Client.",
  "notes": "If you have issues installing DLC try these links  - <a href=\"https://help.ea.com/en/help/origin/origin/download-dlc-for-classic-origin-games/#masseffect\">https://help.ea.com/en/help/origin/origin/download-dlc-for-classic-origin-games/#masseffect</a>\r\n\r\nPlease read before installing: <a href=\"https://github.com/lutris/lutris/wiki/Game:-Origin\">https://github.com/lutris/lutris/wiki/Game:-Origin</a>",
  "created_at": "2018-11-03T16:16:31.560000Z",
  "updated_at": "2019-09-09T01:54:09.583483Z",
  "draft": false,
  "published": true,
  "published_by": 1,
  "rating": "",
  "steamid": 17460,
  "gogid": null,
  "gogslug": "",
  "humblestoreid": "",
  "script": {
    "system": {
      "env": {
        "PBA_ENABLE": "0"
      }
    },
    "game": {
      "arch": "win64",
      "prefix": "$GAMEDIR",
      "exe": "drive_c/Program Files (x86)/Origin/Origin.exe"
    },
    "wine": {
      "overrides": {
        "xaudio2_7": "native,builtin",
        "openal32": "builtin"
      },
      "version": "tkg-protonified-3.21-x86_64",
      "esync": true
    },
    "files": [
      {
        "client": "https://origin-a.akamaihd.net/Origin-Client-Download/origin/live/OriginThinSetup.exe"
      },
      {
        "updater": "https://raw.githubusercontent.com/DrDoctor13/wine-origin-updater/master/updateorigin.sh"
      }
    ],
    "installer": [
      {
        "task": {
          "arch": "win64",
          "prefix": "$GAMEDIR",
          "description": "Creating Wine prefix",
          "name": "create_prefix"
        }
      },
      {
        "task": {
          "arch": "win64",
          "prefix": "$GAMEDIR",
          "name": "winetricks",
          "app": "nocrashdialog win10"
        }
      },
      {
        "task": {
          "prefix": "$GAMEDIR",
          "executable": "client",
          "description": "Installing Origin... Login window will pop-up and close.",
          "args": "/silent",
          "arch": "win64",
          "exclude_processes": "Origin.exe OriginClientService.exe QtWebEngineProcess.exe",
          "name": "wineexec"
        }
      },
      {
        "task": {
          "prefix": "$GAMEDIR",
          "name": "winekill"
        }
      },
      {
        "chmodx": "updater"
      },
      {
        "merge": {
          "dst": "$GAMEDIR/drive_c/Program Files (x86)/Origin",
          "src": "updater"
        }
      }
    ]
  },
  "content": "files:\n- client: https://origin-a.akamaihd.net/Origin-Client-Download/origin/live/OriginThinSetup.exe\n- updater: https://raw.githubusercontent.com/DrDoctor13/wine-origin-updater/master/updateorigin.sh\ngame:\n  arch: win64\n  exe: drive_c/Program Files (x86)/Origin/Origin.exe\n  prefix: $GAMEDIR\ninstaller:\n- task:\n    arch: win64\n    description: Creating Wine prefix\n    name: create_prefix\n    prefix: $GAMEDIR\n- task:\n    app: nocrashdialog win10\n    arch: win64\n    name: winetricks\n    prefix: $GAMEDIR\n- task:\n    arch: win64\n    args: /silent\n    description: Installing Origin... Login window will pop-up and close.\n    exclude_processes: Origin.exe OriginClientService.exe QtWebEngineProcess.exe\n    executable: client\n    name: wineexec\n    prefix: $GAMEDIR\n- task:\n    name: winekill\n    prefix: $GAMEDIR\n- chmodx: updater\n- merge:\n    dst: $GAMEDIR/drive_c/Program Files (x86)/Origin\n    src: updater\nsystem:\n  env:\n    PBA_ENABLE: '0'\nwine:\n  esync: true\n  overrides:\n    openal32: builtin\n    xaudio2_7: native,builtin\n  version: tkg-protonified-3.21-x86_64\n"
}