{
  "id": 19490,
  "game_id": 591,
  "game_slug": "mass-effect",
  "name": "Mass Effect",
  "year": 2007,
  "user": "YakuzaGirl",
  "runner": "wine",
  "slug": "mass-effect-change-me",
  "version": "Change Me",
  "description": "During installation, the default installation folder may be different depending on the ISO file used, be careful to select the right folder.\r\n\r\nScreen resolution MUST BE configured in the launcher ( some resolutions are missing the game's options )",
  "notes": "Prefer to launch the game with \"MassEffectLauncher.exe\" than \"/Binaries/MassEffect.exe\" for avoid some screen glitch and missings resolutions for the game",
  "created_at": "2020-04-06T21:12:20.777993Z",
  "updated_at": "2020-04-06T21:12:20.778017Z",
  "draft": false,
  "published": false,
  "published_by": 51687,
  "rating": "",
  "steamid": 17460,
  "gogid": null,
  "gogslug": "",
  "humblestoreid": "",
  "script": {
    "game": {
      "arch": "win32",
      "exe": "drive_c/Program Files/Mass Effect/MassEffectLauncher.exe",
      "prefix": "$GAMEDIR"
    },
    "installer": [
      {
        "insert-disc": {
          "requires": "setup.exe"
        }
      },
      {
        "task": {
          "arch": "win32",
          "description": "Creating 32bit Wine prefix.",
          "name": "create_prefix",
          "prefix": "$GAMEDIR"
        }
      },
      {
        "task": {
          "description": "Setting OS as Windows 7.",
          "key": "Version",
          "name": "set_regedit",
          "path": "HKEY_CURRENT_USER\\Software\\Wine",
          "prefix": "$GAMEDIR",
          "value": "win7"
        }
      },
      {
        "task": {
          "description": "Allow DirectX apps to stop the mouse leaving their window.",
          "key": "GrabFullScreen",
          "name": "set_regedit",
          "path": "HKEY_CURRENT_USER\\Software\\Wine\\X11 Driver",
          "prefix": "$GAMEDIR",
          "value": "Y"
        }
      },
      {
        "task": {
          "description": "Deny the window manager to decorate the windows.",
          "key": "Decorated",
          "name": "set_regedit",
          "path": "HKEY_CURRENT_USER\\Software\\Wine\\X11 Driver",
          "prefix": "$GAMEDIR",
          "value": "N"
        }
      },
      {
        "task": {
          "description": "Allow the window manager to control the windows.",
          "key": "Managed",
          "name": "set_regedit",
          "path": "HKEY_CURRENT_USER\\Software\\Wine\\X11 Driver",
          "prefix": "$GAMEDIR",
          "value": "Y"
        }
      },
      {
        "task": {
          "description": "Enabling CSMT for better graphic performance.",
          "key": "wined3d",
          "name": "set_regedit",
          "path": "HKEY_CURRENT_USER\\Software\\Wine\\DllRedirects",
          "prefix": "$GAMEDIR",
          "value": "wined3d-csmt.dll"
        }
      },
      {
        "task": {
          "description": "Enabling VAAPI as backend for DXVA2 GPU decoding.",
          "key": "backend",
          "name": "set_regedit",
          "path": "HKEY_CURRENT_USER\\Software\\Wine\\DXVA2",
          "prefix": "$GAMEDIR",
          "value": "va"
        }
      },
      {
        "task": {
          "app": "mfc42",
          "description": "Installing mfc42.",
          "name": "winetricks",
          "prefix": "$GAMEDIR"
        }
      },
      {
        "task": {
          "app": "d3dx9",
          "description": "Installing DirectX 9.",
          "name": "winetricks",
          "prefix": "$GAMEDIR"
        }
      },
      {
        "task": {
          "app": "dsound",
          "description": "Installing DirectSound.",
          "name": "winetricks",
          "prefix": "$GAMEDIR"
        }
      },
      {
        "task": {
          "description": "The installing folder MUST BE \"C:\\Program Files\\Mass Effect\".\nIgnore the installating of DirectX.\n",
          "executable": "$DISC/setup.exe",
          "name": "wineexec",
          "prefix": "$GAMEDIR"
        }
      }
    ]
  },
  "content": "game:\n  arch: win32\n  exe: drive_c/Program Files/Mass Effect/MassEffectLauncher.exe\n  prefix: $GAMEDIR\ninstaller:\n- insert-disc:\n    requires: setup.exe\n- task:\n    arch: win32\n    description: Creating 32bit Wine prefix.\n    name: create_prefix\n    prefix: $GAMEDIR\n- task:\n    description: Setting OS as Windows 7.\n    key: Version\n    name: set_regedit\n    path: HKEY_CURRENT_USER\\Software\\Wine\n    prefix: $GAMEDIR\n    value: win7\n- task:\n    description: Allow DirectX apps to stop the mouse leaving their window.\n    key: GrabFullScreen\n    name: set_regedit\n    path: HKEY_CURRENT_USER\\Software\\Wine\\X11 Driver\n    prefix: $GAMEDIR\n    value: Y\n- task:\n    description: Deny the window manager to decorate the windows.\n    key: Decorated\n    name: set_regedit\n    path: HKEY_CURRENT_USER\\Software\\Wine\\X11 Driver\n    prefix: $GAMEDIR\n    value: N\n- task:\n    description: Allow the window manager to control the windows.\n    key: Managed\n    name: set_regedit\n    path: HKEY_CURRENT_USER\\Software\\Wine\\X11 Driver\n    prefix: $GAMEDIR\n    value: Y\n- task:\n    description: Enabling CSMT for better graphic performance.\n    key: wined3d\n    name: set_regedit\n    path: HKEY_CURRENT_USER\\Software\\Wine\\DllRedirects\n    prefix: $GAMEDIR\n    value: wined3d-csmt.dll\n- task:\n    description: Enabling VAAPI as backend for DXVA2 GPU decoding.\n    key: backend\n    name: set_regedit\n    path: HKEY_CURRENT_USER\\Software\\Wine\\DXVA2\n    prefix: $GAMEDIR\n    value: va\n- task:\n    app: mfc42\n    description: Installing mfc42.\n    name: winetricks\n    prefix: $GAMEDIR\n- task:\n    app: d3dx9\n    description: Installing DirectX 9.\n    name: winetricks\n    prefix: $GAMEDIR\n- task:\n    app: dsound\n    description: Installing DirectSound.\n    name: winetricks\n    prefix: $GAMEDIR\n- task:\n    description: 'The installing folder MUST BE \"C:\\Program Files\\Mass Effect\".\n\n      Ignore the installating of DirectX.\n\n      '\n    executable: $DISC/setup.exe\n    name: wineexec\n    prefix: $GAMEDIR\n"
}