{
  "id": 19091,
  "game_id": 2417,
  "game_slug": "oniken",
  "name": "Oniken",
  "year": null,
  "user": "DaiKaiser93",
  "runner": "wine",
  "slug": "oniken-gog",
  "version": "GOG",
  "description": null,
  "notes": "",
  "created_at": "2020-03-23T09:22:28.814458Z",
  "updated_at": "2020-03-23T09:22:28.814493Z",
  "draft": true,
  "published": false,
  "published_by": null,
  "rating": "",
  "steamid": 252010,
  "gogid": 1291537992,
  "gogslug": "oniken",
  "humblestoreid": "",
  "script": {
    "installer": [
      {
        "task": {
          "arch": "win32",
          "prefix": "$GAMEDIR",
          "name": "create_prefix"
        }
      },
      {
        "task": {
          "arch": "win32",
          "app": "vcrun2008",
          "prefix": "$GAMEDIR",
          "name": "winetricks"
        }
      },
      {
        "task": {
          "arch": "win32",
          "description": "Installing Quartz.",
          "app": "quartz",
          "prefix": "$GAMEDIR",
          "name": "winetricks"
        }
      },
      {
        "task": {
          "arch": "win32",
          "description": "Installing Amstream.",
          "app": "amstream",
          "prefix": "$GAMEDIR",
          "name": "winetricks"
        }
      },
      {
        "task": {
          "arch": "win32",
          "description": "Installing Xvid.",
          "app": "xvid win7",
          "prefix": "$GAMEDIR",
          "name": "winetricks"
        }
      },
      {
        "task": {
          "prefix": "$GAMEDIR",
          "name": "wineexec",
          "arch": "win32",
          "args": "-u",
          "executable": "wineboot",
          "description": "Simulating Windows reboot."
        }
      },
      {
        "task": {
          "prefix": "$GAMEDIR",
          "name": "wineexec",
          "arch": "win32",
          "args": "/SP- /SUPPRESSMSGBOXES /NOCANCEL",
          "executable": "setup",
          "description": "Installing Oniken Unstoppable Edition"
        }
      }
    ],
    "files": [
      {
        "setup": "N/A:Select the game's setup file"
      }
    ],
    "wine": {
      "overrides": {
        "winegstreamer": "disabled"
      }
    },
    "game": {
      "arch": "win32",
      "prefix": "$GAMEDIR",
      "exe": "drive_c/GOG Games/Oniken Unstoppable Edition/Oniken.exe"
    }
  },
  "content": "files:\n- setup: N/A:Select the game's setup file\ngame:\n  arch: win32\n  exe: drive_c/GOG Games/Oniken Unstoppable Edition/Oniken.exe\n  prefix: $GAMEDIR\ninstaller:\n- task:\n    arch: win32\n    name: create_prefix\n    prefix: $GAMEDIR\n- task:\n    app: vcrun2008\n    arch: win32\n    name: winetricks\n    prefix: $GAMEDIR\n- task:\n    app: quartz\n    arch: win32\n    description: Installing Quartz.\n    name: winetricks\n    prefix: $GAMEDIR\n- task:\n    app: amstream\n    arch: win32\n    description: Installing Amstream.\n    name: winetricks\n    prefix: $GAMEDIR\n- task:\n    app: xvid win7\n    arch: win32\n    description: Installing Xvid.\n    name: winetricks\n    prefix: $GAMEDIR\n- task:\n    arch: win32\n    args: -u\n    description: Simulating Windows reboot.\n    executable: wineboot\n    name: wineexec\n    prefix: $GAMEDIR\n- task:\n    arch: win32\n    args: /SP- /SUPPRESSMSGBOXES /NOCANCEL\n    description: Installing Oniken Unstoppable Edition\n    executable: setup\n    name: wineexec\n    prefix: $GAMEDIR\nwine:\n  overrides:\n    winegstreamer: disabled\n"
}