{
  "id": 2030,
  "game_id": 2927,
  "game_slug": "assassins-creed-iv-black-flag",
  "name": "Assassin's Creed IV Black Flag",
  "year": 2013,
  "user": "Freso",
  "runner": "winesteam",
  "slug": "assassins-creed-iv-black-flag-steam-w-dxvk",
  "version": "Steam w/ DXVK",
  "description": null,
  "notes": "",
  "created_at": "2016-03-30T15:08:45.569000Z",
  "updated_at": "2020-01-31T02:38:35.546230Z",
  "draft": false,
  "published": true,
  "published_by": 19464,
  "rating": "",
  "steamid": 242050,
  "gogid": null,
  "gogslug": "",
  "humblestoreid": "",
  "script": {
    "game": {
      "appid": 242050,
      "arch": "win64",
      "prefix": "$GAMEDIR/prefix"
    },
    "system": {
      "disable_runtime": false,
      "env": {
        "DXVK_CONFIG_FILE": "$GAMEDIR/dxvk.conf",
        "DXVK_HUD": 0
      }
    },
    "installer": [
      {
        "task": {
          "arch": "win64",
          "prefix": "$GAMEDIR/prefix",
          "name": "create_prefix"
        }
      },
      {
        "write_config": {
          "file": "$GAMEDIR/dxvk.conf",
          "value": "10_1",
          "key": "d3d11.maxFeatureLevel",
          "section": "Max feature level"
        }
      },
      {
        "extract": {
          "file": "dx2010",
          "dst": "$CACHE/dxsetup"
        }
      },
      {
        "task": {
          "executable": "$CACHE/dxsetup/DXSETUP.exe",
          "arch": "win64",
          "args": "/silent",
          "prefix": "$GAMEDIR/prefix",
          "name": "wineexec"
        }
      },
      {
        "task": {
          "app": "vcrun2008 vcrun2010 corefonts",
          "arch": "win64",
          "prefix": "$GAMEDIR/prefix",
          "name": "winetricks"
        }
      },
      {
        "task": {
          "app": "dotnet472 win7",
          "arch": "win64",
          "description": "Please be patient while we install .NET 4.7.2",
          "prefix": "$GAMEDIR/prefix",
          "name": "winetricks"
        }
      },
      {
        "task": {
          "executable": "uplay",
          "arch": "win64",
          "args": "/S",
          "prefix": "$GAMEDIR/prefix",
          "name": "wineexec"
        }
      },
      {
        "task": {
          "arch": "win64",
          "prefix": "$GAMEDIR/prefix",
          "name": "winekill"
        }
      }
    ],
    "winesteam": {
      "esync": true,
      "dxvk": true
    },
    "files": [
      {
        "dx2010": "https://lutris.net/files/tools/directx-2010.tar.gz"
      },
      {
        "uplay": "https://ubistatic3-a.akamaihd.net/orbit/launcher_installer/UplayInstaller.exe"
      }
    ]
  },
  "content": "files:\n- dx2010: https://lutris.net/files/tools/directx-2010.tar.gz\n- uplay: https://ubistatic3-a.akamaihd.net/orbit/launcher_installer/UplayInstaller.exe\ngame:\n  appid: 242050\n  arch: win64\n  prefix: $GAMEDIR/prefix\ninstaller:\n- task:\n    arch: win64\n    name: create_prefix\n    prefix: $GAMEDIR/prefix\n- write_config:\n    file: $GAMEDIR/dxvk.conf\n    key: d3d11.maxFeatureLevel\n    section: Max feature level\n    value: '10_1'\n- extract:\n    dst: $CACHE/dxsetup\n    file: dx2010\n- task:\n    arch: win64\n    args: /silent\n    executable: $CACHE/dxsetup/DXSETUP.exe\n    name: wineexec\n    prefix: $GAMEDIR/prefix\n- task:\n    app: vcrun2008 vcrun2010 corefonts\n    arch: win64\n    name: winetricks\n    prefix: $GAMEDIR/prefix\n- task:\n    app: dotnet472 win7\n    arch: win64\n    description: Please be patient while we install .NET 4.7.2\n    name: winetricks\n    prefix: $GAMEDIR/prefix\n- task:\n    arch: win64\n    args: /S\n    executable: uplay\n    name: wineexec\n    prefix: $GAMEDIR/prefix\n- task:\n    arch: win64\n    name: winekill\n    prefix: $GAMEDIR/prefix\nsystem:\n  disable_runtime: false\n  env:\n    DXVK_CONFIG_FILE: $GAMEDIR/dxvk.conf\n    DXVK_HUD: 0\nwinesteam:\n  dxvk: true\n  esync: true\n"
}