{
  "id": 12290,
  "game_id": 2927,
  "game_slug": "assassins-creed-iv-black-flag",
  "name": "Assassin's Creed IV Black Flag",
  "year": 2013,
  "user": "duerrwlu",
  "runner": "wine",
  "slug": "assassins-creed-iv-black-flag-uplay-w-dxvk",
  "version": "Uplay w/ DXVK",
  "description": null,
  "notes": "Has problems with MSAA (2x, 4x, and 8x)",
  "created_at": "2019-03-07T21:19:23.113000Z",
  "updated_at": "2020-01-23T02:57:22.025104Z",
  "draft": false,
  "published": true,
  "published_by": 19464,
  "rating": "",
  "steamid": 242050,
  "gogid": null,
  "gogslug": "",
  "humblestoreid": "",
  "script": {
    "game": {
      "exe": "drive_c/Program Files (x86)/Ubisoft/Ubisoft Game Launcher/Uplay.exe",
      "arch": "win64",
      "prefix": "$GAMEDIR"
    },
    "system": {
      "env": {
        "DXVK_CONFIG_FILE": "$GAMEDIR/dxvk.conf",
        "DXVK_HUD": 0
      }
    },
    "wine": {
      "esync": true,
      "overrides": {
        "nvapi,nvapi64": "disabled",
        "xaudio2_7": "native,builtin"
      },
      "dxvk": true
    },
    "installer": [
      {
        "task": {
          "arch": "win64",
          "prefix": "$GAMEDIR",
          "name": "create_prefix"
        }
      },
      {
        "write_config": {
          "file": "$GAMEDIR/dxvk.conf",
          "value": "10_1",
          "key": "d3d11.maxFeatureLevel",
          "section": "Max feature level"
        }
      },
      {
        "extract": {
          "file": "dx2010",
          "dst": "$CACHE/dxsetup"
        }
      },
      {
        "task": {
          "executable": "$CACHE/dxsetup/DXSETUP.exe",
          "arch": "win64",
          "args": "/silent",
          "prefix": "$GAMEDIR",
          "name": "wineexec"
        }
      },
      {
        "task": {
          "app": "vcrun2008 vcrun2010 d3dcompiler_43 corefonts",
          "arch": "win64",
          "prefix": "$GAMEDIR",
          "name": "winetricks"
        }
      },
      {
        "task": {
          "app": "dotnet472 win7",
          "arch": "win64",
          "description": "Please be patient while we install .NET 4.7.2",
          "prefix": "$GAMEDIR",
          "name": "winetricks"
        }
      },
      {
        "task": {
          "executable": "uplay",
          "arch": "win64",
          "args": "/S",
          "prefix": "$GAMEDIR",
          "name": "wineexec"
        }
      },
      {
        "task": {
          "arch": "win64",
          "prefix": "$GAMEDIR",
          "name": "winekill"
        }
      }
    ],
    "files": [
      {
        "dx2010": "https://lutris.net/files/tools/directx-2010.tar.gz"
      },
      {
        "uplay": "https://ubistatic3-a.akamaihd.net/orbit/launcher_installer/UplayInstaller.exe"
      }
    ]
  },
  "content": "files:\n- dx2010: https://lutris.net/files/tools/directx-2010.tar.gz\n- uplay: https://ubistatic3-a.akamaihd.net/orbit/launcher_installer/UplayInstaller.exe\ngame:\n  arch: win64\n  exe: drive_c/Program Files (x86)/Ubisoft/Ubisoft Game Launcher/Uplay.exe\n  prefix: $GAMEDIR\ninstaller:\n- task:\n    arch: win64\n    name: create_prefix\n    prefix: $GAMEDIR\n- write_config:\n    file: $GAMEDIR/dxvk.conf\n    key: d3d11.maxFeatureLevel\n    section: Max feature level\n    value: '10_1'\n- extract:\n    dst: $CACHE/dxsetup\n    file: dx2010\n- task:\n    arch: win64\n    args: /silent\n    executable: $CACHE/dxsetup/DXSETUP.exe\n    name: wineexec\n    prefix: $GAMEDIR\n- task:\n    app: vcrun2008 vcrun2010 d3dcompiler_43 corefonts\n    arch: win64\n    name: winetricks\n    prefix: $GAMEDIR\n- task:\n    app: dotnet472 win7\n    arch: win64\n    description: Please be patient while we install .NET 4.7.2\n    name: winetricks\n    prefix: $GAMEDIR\n- task:\n    arch: win64\n    args: /S\n    executable: uplay\n    name: wineexec\n    prefix: $GAMEDIR\n- task:\n    arch: win64\n    name: winekill\n    prefix: $GAMEDIR\nsystem:\n  env:\n    DXVK_CONFIG_FILE: $GAMEDIR/dxvk.conf\n    DXVK_HUD: 0\nwine:\n  dxvk: true\n  esync: true\n  overrides:\n    nvapi,nvapi64: disabled\n    xaudio2_7: native,builtin\n"
}