{
  "id": 13793,
  "game_id": 27572,
  "game_slug": "adobe-acrobat-reader-dc",
  "name": "Adobe Acrobat Reader DC",
  "year": 2015,
  "user": "Maxattax",
  "runner": "wine",
  "slug": "adobe-acrobat-reader-dc-installer",
  "version": "Installer",
  "description": null,
  "notes": "At the moment requires you to disable protected execution (first dialog popup).",
  "created_at": "2019-05-30T01:24:42.984938Z",
  "updated_at": "2019-05-30T01:24:42.984966Z",
  "draft": false,
  "published": false,
  "published_by": null,
  "rating": "",
  "steamid": null,
  "gogid": null,
  "gogslug": "",
  "humblestoreid": "",
  "script": {
    "files": [
      {
        "setup": "https://ardownload2.adobe.com/pub/adobe/reader/win/AcrobatDC/1901220034/AcroRdrDC1901220034_en_US.exe"
      }
    ],
    "game": {
      "prefix": "$GAMEDIR",
      "exe": "drive_c/Program Files/Adobe/Acrobat Reader DC/Reader/AcroRd32.exe",
      "arch": "win32"
    },
    "wine": {
      "wine": "4.3-x86_64",
      "sandbox": false
    },
    "installer": [
      {
        "task": {
          "prefix": "$GAMEDIR",
          "arch": "win32",
          "app": "allfonts",
          "description": "Installing allfonts",
          "name": "winetricks"
        }
      },
      {
        "task": {
          "prefix": "$GAMEDIR",
          "arch": "win32",
          "app": "richtx32",
          "description": "Installing richtx32",
          "name": "winetricks"
        }
      },
      {
        "task": {
          "prefix": "$GAMEDIR",
          "arch": "win32",
          "app": "wsh57",
          "description": "Installing wsh57",
          "name": "winetricks"
        }
      },
      {
        "task": {
          "prefix": "$GAMEDIR",
          "arch": "win32",
          "app": "atmlib",
          "description": "Installing atmlib",
          "name": "winetricks"
        }
      },
      {
        "task": {
          "prefix": "$GAMEDIR",
          "arch": "win32",
          "app": "mspatcha",
          "description": "Installing mspatcha",
          "name": "winetricks"
        }
      },
      {
        "task": {
          "prefix": "$GAMEDIR",
          "arch": "win32",
          "app": "dotnet472",
          "description": "Installing dotnet472",
          "name": "winetricks"
        }
      },
      {
        "task": {
          "arch": "win32",
          "executable": "setup",
          "name": "wineexec",
          "description": "Installing Adobe Acrobat Reader DC"
        }
      }
    ]
  },
  "content": "files:\n- setup: https://ardownload2.adobe.com/pub/adobe/reader/win/AcrobatDC/1901220034/AcroRdrDC1901220034_en_US.exe\ngame:\n  arch: win32\n  exe: drive_c/Program Files/Adobe/Acrobat Reader DC/Reader/AcroRd32.exe\n  prefix: $GAMEDIR\ninstaller:\n- task:\n    app: allfonts\n    arch: win32\n    description: Installing allfonts\n    name: winetricks\n    prefix: $GAMEDIR\n- task:\n    app: richtx32\n    arch: win32\n    description: Installing richtx32\n    name: winetricks\n    prefix: $GAMEDIR\n- task:\n    app: wsh57\n    arch: win32\n    description: Installing wsh57\n    name: winetricks\n    prefix: $GAMEDIR\n- task:\n    app: atmlib\n    arch: win32\n    description: Installing atmlib\n    name: winetricks\n    prefix: $GAMEDIR\n- task:\n    app: mspatcha\n    arch: win32\n    description: Installing mspatcha\n    name: winetricks\n    prefix: $GAMEDIR\n- task:\n    app: dotnet472\n    arch: win32\n    description: Installing dotnet472\n    name: winetricks\n    prefix: $GAMEDIR\n- task:\n    arch: win32\n    description: Installing Adobe Acrobat Reader DC\n    executable: setup\n    name: wineexec\nwine:\n  sandbox: false\n  wine: 4.3-x86_64\n"
}