{
  "id": 2241,
  "game_id": 6490,
  "game_slug": "raiden-iii-digital-edition",
  "name": "Raiden III Digital Edition",
  "year": 2014,
  "user": "ssf",
  "runner": "wine",
  "slug": "raiden-iii-digital-edition-gog",
  "version": "GOG",
  "description": "",
  "notes": "",
  "created_at": "2016-07-03T16:07:22.718555Z",
  "updated_at": "2016-09-30T16:14:10.048104Z",
  "draft": false,
  "published": true,
  "published_by": null,
  "rating": "",
  "steamid": 315670,
  "gogid": 1207666023,
  "gogslug": "raiden_3_digital_edition",
  "humblestoreid": "",
  "script": {
    "game": {
      "arch": "win32",
      "prefix": "$GAMEDIR",
      "exe": "drive_c/GOG Games/Raiden III/Raiden3.exe"
    },
    "files": [
      {
        "game": "N/A:Please select the Windows installer provided by GOG"
      }
    ],
    "gogid": "raiden_3_digital_edition",
    "installer": [
      {
        "task": {
          "prefix": "$GAMEDIR",
          "description": "Creating Wine prefix",
          "name": "create_prefix"
        }
      },
      {
        "task": {
          "prefix": "$GAMEDIR",
          "path": "HKEY_CURRENT_USER\\Software\\Wine\\DllOverrides",
          "value": "",
          "type": "REG_SZ",
          "key": "winemenubuilder.exe",
          "name": "set_regedit"
        }
      },
      {
        "task": {
          "prefix": "$GAMEDIR",
          "description": "Installing d3dx9_36 dll",
          "name": "winetricks",
          "silent": false,
          "app": "d3dx9_36"
        }
      },
      {
        "task": {
          "prefix": "$GAMEDIR",
          "executable": "game",
          "args": "/VERYSILENT /SP- /NOCANCEL /SUPPRESSMSGBOXES",
          "description": "Installing Raiden III",
          "name": "wineexec"
        }
      },
      {
        "task": {
          "prefix": "$GAMEDIR",
          "description": "Disabling unused WINE features",
          "name": "winetricks",
          "silent": true,
          "app": "sandbox"
        }
      }
    ]
  },
  "content": "files:\n- game: N/A:Please select the Windows installer provided by GOG\ngame:\n  arch: win32\n  exe: drive_c/GOG Games/Raiden III/Raiden3.exe\n  prefix: $GAMEDIR\ngogid: raiden_3_digital_edition\ninstaller:\n- task:\n    description: Creating Wine prefix\n    name: create_prefix\n    prefix: $GAMEDIR\n- task:\n    key: winemenubuilder.exe\n    name: set_regedit\n    path: HKEY_CURRENT_USER\\Software\\Wine\\DllOverrides\n    prefix: $GAMEDIR\n    type: REG_SZ\n    value: ''\n- task:\n    app: d3dx9_36\n    description: Installing d3dx9_36 dll\n    name: winetricks\n    prefix: $GAMEDIR\n    silent: false\n- task:\n    args: /VERYSILENT /SP- /NOCANCEL /SUPPRESSMSGBOXES\n    description: Installing Raiden III\n    executable: game\n    name: wineexec\n    prefix: $GAMEDIR\n- task:\n    app: sandbox\n    description: Disabling unused WINE features\n    name: winetricks\n    prefix: $GAMEDIR\n    silent: true\n"
}