{
  "id": 18570,
  "game_id": 25303,
  "game_slug": "the-lord-of-the-rings-the-battle-for-middle-earth-",
  "name": "The Lord of The Rings The Battle For Middle-Earth II",
  "year": 2006,
  "user": "TroneZ",
  "runner": "wine",
  "slug": "the-lord-of-the-rings-the-bat-official-patch-106",
  "version": "Official patch 1.06",
  "description": null,
  "notes": "",
  "created_at": "2020-02-27T15:06:58.040439Z",
  "updated_at": "2020-02-27T15:06:58.040464Z",
  "draft": false,
  "published": false,
  "published_by": null,
  "rating": "",
  "steamid": null,
  "gogid": null,
  "gogslug": "",
  "humblestoreid": "",
  "script": {
    "game": {
      "exe": "drive_c/Program Files/Electronic Arts/The Battle for Middle-earth (tm) II/lotrbfme2.exe",
      "arch": "win32",
      "prefix": "$GAMEDIR"
    },
    "installer": [
      {
        "task": {
          "arch": "win32",
          "description": "Creating 32-bit Wine Prefix",
          "prefix": "$GAMEDIR",
          "name": "create_prefix"
        }
      },
      {
        "insert-disc": {
          "requires": "AutoRun.exe"
        }
      },
      {
        "task": {
          "executable": "$DISC/AutoRun.exe",
          "arch": "win32",
          "description": "Running game installer (Select \"Quit\" after the installation has finished)",
          "prefix": "$GAMEDIR",
          "name": "wineexec"
        }
      },
      {
        "task": {
          "executable": "bfme2_patch1_06",
          "arch": "win32",
          "description": "Installing official patch 1.06",
          "prefix": "$GAMEDIR",
          "name": "wineexec"
        }
      }
    ],
    "files": [
      {
        "bfme2_patch1_06": "N/A:Please select the installer for patch 1.06 of \"The Battle for Middle-earth II\"."
      }
    ]
  },
  "content": "files:\n- bfme2_patch1_06: N/A:Please select the installer for patch 1.06 of \"The Battle for\n    Middle-earth II\".\ngame:\n  arch: win32\n  exe: drive_c/Program Files/Electronic Arts/The Battle for Middle-earth (tm) II/lotrbfme2.exe\n  prefix: $GAMEDIR\ninstaller:\n- task:\n    arch: win32\n    description: Creating 32-bit Wine Prefix\n    name: create_prefix\n    prefix: $GAMEDIR\n- insert-disc:\n    requires: AutoRun.exe\n- task:\n    arch: win32\n    description: Running game installer (Select \"Quit\" after the installation has\n      finished)\n    executable: $DISC/AutoRun.exe\n    name: wineexec\n    prefix: $GAMEDIR\n- task:\n    arch: win32\n    description: Installing official patch 1.06\n    executable: bfme2_patch1_06\n    name: wineexec\n    prefix: $GAMEDIR\n"
}