{
  "id": 20544,
  "game_id": 18262,
  "game_slug": "freelancer",
  "name": "Freelancer",
  "year": 2003,
  "user": "eagledelta1",
  "runner": "wine",
  "slug": "freelancer-discovery",
  "version": "Discovery",
  "description": "Installs the Discovery community multiplayer mod: https://discoverygc.com/",
  "notes": "",
  "created_at": "2020-05-16T21:16:23.407350Z",
  "updated_at": "2020-05-16T21:16:23.407380Z",
  "draft": false,
  "published": false,
  "published_by": null,
  "rating": "",
  "steamid": null,
  "gogid": null,
  "gogslug": "",
  "humbleid": "",
  "humblestoreid": "",
  "humblestoreid_real": "",
  "script": {
    "files": [
      {
        "discovery": "https://discoverygc.com/files/discovery_4.91.0.1.exe"
      }
    ],
    "game": {
      "arch": "win32",
      "exe": "$GAMEDIR/drive_c/users/dhollinger/Local Settings/Application Data/Discovery Freelancer 4.91.0/DSLauncher.exe",
      "prefix": "$GAMEDIR"
    },
    "installer": [
      {
        "task": {
          "arch": "win32",
          "description": "Creating Wine prefix",
          "name": "create_prefix",
          "prefix": "$GAMEDIR"
        }
      },
      {
        "task": {
          "app": "directplay",
          "description": "Installing DirectPlay",
          "name": "winetricks",
          "prefix": "$GAMEDIR"
        }
      },
      {
        "task": {
          "app": "mfc42",
          "description": "Installing Microsoft Foundation Classes",
          "name": "winetricks",
          "prefix": "$GAMEDIR"
        }
      },
      {
        "task": {
          "app": "msacm32",
          "description": "Installing Microsoft Audio Compression Manager",
          "name": "winetricks",
          "prefix": "$GAMEDIR"
        }
      },
      {
        "task": {
          "app": "dotnet40",
          "description": "Installing .NET 4.0",
          "name": "winetricks",
          "prefix": "$GAMEDIR"
        }
      },
      {
        "insert-disc": {
          "requires": "setup.exe"
        }
      },
      {
        "task": {
          "description": "Installing Freelancer. Please choose \"Express install\".",
          "executable": "$DISC/setup.exe",
          "name": "wineexec",
          "prefix": "$GAMEDIR"
        }
      },
      {
        "task": {
          "description": "Installing Discovery Mod",
          "executable": "discovery",
          "name": "wineexec",
          "prefix": "$GAMEDIR"
        }
      }
    ]
  },
  "content": "files:\n- discovery: https://discoverygc.com/files/discovery_4.91.0.1.exe\ngame:\n  arch: win32\n  exe: $GAMEDIR/drive_c/users/dhollinger/Local Settings/Application Data/Discovery\n    Freelancer 4.91.0/DSLauncher.exe\n  prefix: $GAMEDIR\ninstaller:\n- task:\n    arch: win32\n    description: Creating Wine prefix\n    name: create_prefix\n    prefix: $GAMEDIR\n- task:\n    app: directplay\n    description: Installing DirectPlay\n    name: winetricks\n    prefix: $GAMEDIR\n- task:\n    app: mfc42\n    description: Installing Microsoft Foundation Classes\n    name: winetricks\n    prefix: $GAMEDIR\n- task:\n    app: msacm32\n    description: Installing Microsoft Audio Compression Manager\n    name: winetricks\n    prefix: $GAMEDIR\n- task:\n    app: dotnet40\n    description: Installing .NET 4.0\n    name: winetricks\n    prefix: $GAMEDIR\n- insert-disc:\n    requires: setup.exe\n- task:\n    description: Installing Freelancer. Please choose \"Express install\".\n    executable: $DISC/setup.exe\n    name: wineexec\n    prefix: $GAMEDIR\n- task:\n    description: Installing Discovery Mod\n    executable: discovery\n    name: wineexec\n    prefix: $GAMEDIR\n"
}