{
  "id": 18092,
  "game_id": 27543,
  "game_slug": "gzdoom-builder-bugfix",
  "name": "Ultimate Doom Builder",
  "year": 2019,
  "user": "doctor-nick",
  "runner": "wine",
  "slug": "ultimate-doom-builder-r3352-x86",
  "version": "r3352-x86",
  "description": "Installs the git build from DRD Team",
  "notes": "This may take a while; the dotnet472 installer is buggy and stalls a lot.\r\n\r\nIf you are having video issues, try setting the environmental variable `__GL_MaxFramesAllowed` to 0 instead of 1. (Configure->System options->Show Advanced->Environment variables)",
  "created_at": "2020-01-26T21:24:09.632140Z",
  "updated_at": "2020-01-31T02:38:29.743272Z",
  "draft": true,
  "published": false,
  "published_by": null,
  "rating": "",
  "steamid": null,
  "gogid": null,
  "gogslug": "",
  "humblestoreid": "",
  "script": {
    "files": [
      {
        "udb_installer": "https://devbuilds.drdteam.org/ultimatedoombuilder/UltimateDoomBuilder-r3352-x86.7z"
      }
    ],
    "installer": [
      {
        "task": {
          "arch": "win32",
          "description": "Creating Wine prefix",
          "prefix": "$GAMEDIR",
          "name": "create_prefix"
        }
      },
      {
        "extract": {
          "src": "udb_installer",
          "dst": "$GAMEDIR/drive_c/ultimate_doom_builder"
        }
      },
      {
        "task": {
          "silent": true,
          "description": "Installing Core Fonts",
          "app": "corefonts",
          "prefix": "$GAMEDIR",
          "name": "winetricks"
        }
      },
      {
        "task": {
          "silent": true,
          "description": "Installing .NET framework 4.7.2",
          "app": "dotnet472",
          "prefix": "$GAMEDIR",
          "name": "winetricks"
        }
      },
      {
        "task": {
          "silent": true,
          "description": "Setting WINE version to WinXP",
          "app": "winxp",
          "prefix": "$GAMEDIR",
          "name": "winetricks"
        }
      }
    ],
    "system": {
      "env": {
        "__GL_MaxFramesAllowed": 1
      }
    },
    "wine": {
      "dxvk": false,
      "esync": false
    },
    "game": {
      "arch": "win32",
      "prefix": "$GAMEDIR",
      "exe": "$GAMEDIR/drive_c/ultimate_doom_builder/Builder.exe"
    }
  },
  "content": "files:\n- udb_installer: https://devbuilds.drdteam.org/ultimatedoombuilder/UltimateDoomBuilder-r3352-x86.7z\ngame:\n  arch: win32\n  exe: $GAMEDIR/drive_c/ultimate_doom_builder/Builder.exe\n  prefix: $GAMEDIR\ninstaller:\n- task:\n    arch: win32\n    description: Creating Wine prefix\n    name: create_prefix\n    prefix: $GAMEDIR\n- extract:\n    dst: $GAMEDIR/drive_c/ultimate_doom_builder\n    src: udb_installer\n- task:\n    app: corefonts\n    description: Installing Core Fonts\n    name: winetricks\n    prefix: $GAMEDIR\n    silent: true\n- task:\n    app: dotnet472\n    description: Installing .NET framework 4.7.2\n    name: winetricks\n    prefix: $GAMEDIR\n    silent: true\n- task:\n    app: winxp\n    description: Setting WINE version to WinXP\n    name: winetricks\n    prefix: $GAMEDIR\n    silent: true\nsystem:\n  env:\n    __GL_MaxFramesAllowed: 1\nwine:\n  dxvk: false\n  esync: false\n"
}