{
  "id": 9959,
  "game_id": 4368,
  "game_slug": "resident-evil-revelations-2-biohazard-revelations-",
  "name": "Resident Evil Revelations 2 / Biohazard Revelations 2",
  "year": 2015,
  "user": "therealliberavia",
  "runner": "winesteam",
  "slug": "resident-evil-revelations-2-b-steam",
  "version": "Steam",
  "description": "Resident Evil Revelations 2 is the sequel to Resident Evil Revelations, a classic survival horror game, set up in a movie-like-style and delivered in challenging and thrilling episodes",
  "notes": "",
  "created_at": "2018-08-29T16:32:27.580000Z",
  "updated_at": "2019-04-20T06:55:08.159660Z",
  "draft": false,
  "published": true,
  "published_by": 19464,
  "rating": "",
  "steamid": 287290,
  "gogid": null,
  "gogslug": "",
  "humblestoreid": "",
  "script": {
    "system": {
      "pulse_latency": true,
      "reset_pulse": true
    },
    "winesteam": {
      "overrides": {
        "xaudio2_7": "native",
        "xaudio2_6": "native"
      }
    },
    "game": {
      "arch": "win32",
      "prefix": "$GAMEDIR/prefix",
      "appid": 287290
    },
    "files": [
      {
        "codecs": "https://lutris.net/files/tools/windowsmedia-kb942423-x86-intl.exe"
      }
    ],
    "installer": [
      {
        "task": {
          "arch": "win32",
          "prefix": "$GAMEDIR/prefix",
          "name": "create_prefix"
        }
      },
      {
        "task": {
          "prefix": "$GAMEDIR/prefix",
          "description": "Corefonts",
          "name": "winetricks",
          "app": "corefonts"
        }
      },
      {
        "task": {
          "prefix": "$GAMEDIR/prefix",
          "description": "vcrun",
          "name": "winetricks",
          "app": "vcrun2008"
        }
      },
      {
        "task": {
          "prefix": "$GAMEDIR/prefix",
          "description": "Installing Windows Media Player 10",
          "name": "winetricks",
          "app": "wmp10"
        }
      },
      {
        "task": {
          "prefix": "$GAMEDIR/prefix",
          "description": "Installing DirectX components",
          "name": "winetricks",
          "app": "d3dcompiler_43"
        }
      },
      {
        "task": {
          "prefix": "$GAMEDIR/prefix",
          "description": "Installing DirectX components",
          "name": "winetricks",
          "app": "d3dx9"
        }
      },
      {
        "task": {
          "prefix": "$GAMEDIR/prefix",
          "description": "Installing Xact",
          "name": "winetricks",
          "app": "xact_jun2010"
        }
      },
      {
        "task": {
          "prefix": "$GAMEDIR/prefix",
          "executable": "codecs",
          "args": "/q",
          "description": "Installing video codecs",
          "name": "wineexec"
        }
      }
    ]
  },
  "content": "files:\n- codecs: https://lutris.net/files/tools/windowsmedia-kb942423-x86-intl.exe\ngame:\n  appid: 287290\n  arch: win32\n  prefix: $GAMEDIR/prefix\ninstaller:\n- task:\n    arch: win32\n    name: create_prefix\n    prefix: $GAMEDIR/prefix\n- task:\n    app: corefonts\n    description: Corefonts\n    name: winetricks\n    prefix: $GAMEDIR/prefix\n- task:\n    app: vcrun2008\n    description: vcrun\n    name: winetricks\n    prefix: $GAMEDIR/prefix\n- task:\n    app: wmp10\n    description: Installing Windows Media Player 10\n    name: winetricks\n    prefix: $GAMEDIR/prefix\n- task:\n    app: d3dcompiler_43\n    description: Installing DirectX components\n    name: winetricks\n    prefix: $GAMEDIR/prefix\n- task:\n    app: d3dx9\n    description: Installing DirectX components\n    name: winetricks\n    prefix: $GAMEDIR/prefix\n- task:\n    app: xact_jun2010\n    description: Installing Xact\n    name: winetricks\n    prefix: $GAMEDIR/prefix\n- task:\n    args: /q\n    description: Installing video codecs\n    executable: codecs\n    name: wineexec\n    prefix: $GAMEDIR/prefix\nsystem:\n  pulse_latency: true\n  reset_pulse: true\nwinesteam:\n  overrides:\n    xaudio2_6: native\n    xaudio2_7: native\n"
}