{
  "id": 20846,
  "game_id": 1929,
  "game_slug": "3dmark-11",
  "name": "3DMark 11",
  "year": null,
  "user": "vanstaveren",
  "runner": "winesteam",
  "slug": "3dmark-11-education",
  "version": "Education",
  "description": "WineHQ: The first DirectX11 benchmark from the company. Currently unusable in Wine due to Microsoft .Net issues.",
  "notes": "Demonstrating the problem ...",
  "created_at": "2020-05-28T05:54:22.392030Z",
  "updated_at": "2020-05-28T05:54:22.392084Z",
  "draft": true,
  "published": false,
  "published_by": null,
  "rating": "",
  "steamid": 205270,
  "gogid": null,
  "gogslug": "",
  "humbleid": "",
  "humblestoreid": "",
  "humblestoreid_real": "",
  "script": {
    "game": {
      "appid": 205270,
      "prefix": "$GAMEDIR/prefix"
    },
    "installer": [
      {
        "task": {
          "arch": "win64",
          "description": "Creating 64-bit prefix ...",
          "name": "create_prefix",
          "prefix": "$GAMEDIR/prefix"
        }
      },
      {
        "task": {
          "app": "vcrun2010",
          "arch": "win64",
          "description": "Visual C++ 2010 libraries ...",
          "name": "winetricks",
          "prefix": "$GAMEDIR/prefix"
        }
      },
      {
        "task": {
          "app": "win7",
          "arch": "win64",
          "description": "Windows 7 ...",
          "name": "winetricks",
          "prefix": "$GAMEDIR/prefix"
        }
      },
      {
        "task": {
          "app": "d3dx10_43 d3dx11_43",
          "arch": "win64",
          "description": "DirectX ...",
          "name": "winetricks",
          "prefix": "$GAMEDIR/prefix"
        }
      },
      {
        "task": {
          "app": "dxvk",
          "arch": "win64",
          "description": "Vulkan ...",
          "name": "winetricks",
          "prefix": "$GAMEDIR/prefix"
        }
      },
      {
        "task": {
          "arch": "win64",
          "description": "Register KeyCode ...",
          "key": "KeyCode",
          "name": "set_regedit",
          "path": "HKEY_LOCAL_MACHINE\\Software\\Wow6432Node\\Futuremark\\3DMark11",
          "type": "REG_SZ",
          "value": "3D11-ADV-DJ72-S63F-PNHK-LCUM-SSSX"
        }
      },
      {
        "task": {
          "arch": "win64",
          "description": "Register KeyCode ...",
          "key": "KeyCode",
          "name": "set_regedit",
          "path": "HKEY_USERS\\S-1-5-21-0-0-0-1000\\Software\\Futuremark\\3DMark11",
          "type": "REG_SZ",
          "value": "3D11-ADV-DJ72-S63F-PNHK-LCUM-SSSX"
        }
      }
    ],
    "system": {
      "disable_compositor": true
    },
    "winesteam": {
      "dxvk": true
    }
  },
  "content": "game:\n  appid: 205270\n  prefix: $GAMEDIR/prefix\ninstaller:\n- task:\n    arch: win64\n    description: Creating 64-bit prefix ...\n    name: create_prefix\n    prefix: $GAMEDIR/prefix\n- task:\n    app: vcrun2010\n    arch: win64\n    description: Visual C++ 2010 libraries ...\n    name: winetricks\n    prefix: $GAMEDIR/prefix\n- task:\n    app: win7\n    arch: win64\n    description: Windows 7 ...\n    name: winetricks\n    prefix: $GAMEDIR/prefix\n- task:\n    app: d3dx10_43 d3dx11_43\n    arch: win64\n    description: DirectX ...\n    name: winetricks\n    prefix: $GAMEDIR/prefix\n- task:\n    app: dxvk\n    arch: win64\n    description: Vulkan ...\n    name: winetricks\n    prefix: $GAMEDIR/prefix\n- task:\n    arch: win64\n    description: Register KeyCode ...\n    key: KeyCode\n    name: set_regedit\n    path: HKEY_LOCAL_MACHINE\\Software\\Wow6432Node\\Futuremark\\3DMark11\n    type: REG_SZ\n    value: 3D11-ADV-DJ72-S63F-PNHK-LCUM-SSSX\n- task:\n    arch: win64\n    description: Register KeyCode ...\n    key: KeyCode\n    name: set_regedit\n    path: HKEY_USERS\\S-1-5-21-0-0-0-1000\\Software\\Futuremark\\3DMark11\n    type: REG_SZ\n    value: 3D11-ADV-DJ72-S63F-PNHK-LCUM-SSSX\nsystem:\n  disable_compositor: true\nwinesteam:\n  dxvk: true\n"
}