{
  "id": 8286,
  "game_id": 2835,
  "game_slug": "assetto-corsa",
  "name": "Assetto Corsa",
  "year": 2014,
  "user": "Laegnur",
  "runner": "winesteam",
  "slug": "assetto-corsa-dxvk",
  "version": "DXVK",
  "description": null,
  "notes": "IF the game don't run in Windows 7 mode, try to change it to Windows Vista or Windows 8 in Wine Configuration",
  "created_at": "2018-05-14T11:38:05.034000Z",
  "updated_at": "2020-01-31T02:38:29.435896Z",
  "draft": false,
  "published": true,
  "published_by": 19464,
  "rating": "",
  "steamid": 244210,
  "gogid": null,
  "gogslug": "",
  "humbleid": "",
  "humblestoreid": "",
  "humblestoreid_real": "",
  "script": {
    "game": {
      "appid": 244210,
      "arch": "win64",
      "prefix": "$GAMEDIR/prefix"
    },
    "installer": [
      {
        "task": {
          "arch": "win64",
          "description": "Creating prefix",
          "name": "create_prefix",
          "prefix": "$GAMEDIR/prefix"
        }
      },
      {
        "task": {
          "app": "corefonts",
          "arch": "win64",
          "description": "Installing corefonts",
          "name": "winetricks",
          "prefix": "$GAMEDIR/prefix"
        }
      },
      {
        "task": {
          "app": "vcrun2008",
          "arch": "win64",
          "name": "winetricks",
          "prefix": "$GAMEDIR/prefix"
        }
      },
      {
        "task": {
          "app": "vcrun2010",
          "arch": "win64",
          "name": "winetricks",
          "prefix": "$GAMEDIR/prefix"
        }
      },
      {
        "task": {
          "app": "vcrun2012",
          "arch": "win64",
          "name": "winetricks",
          "prefix": "$GAMEDIR/prefix"
        }
      },
      {
        "task": {
          "app": "vcrun2013",
          "arch": "win64",
          "name": "winetricks",
          "prefix": "$GAMEDIR/prefix"
        }
      },
      {
        "task": {
          "app": "d3dx11_43",
          "arch": "win64",
          "name": "winetricks",
          "prefix": "$GAMEDIR/prefix"
        }
      },
      {
        "task": {
          "app": "d3dcompiler_43",
          "arch": "win64",
          "name": "winetricks",
          "prefix": "$GAMEDIR/prefix"
        }
      },
      {
        "task": {
          "app": "dotnet472 win7",
          "arch": "win64",
          "description": "Installing .NET 4.7.2 (it may take a while)",
          "name": "winetricks",
          "prefix": "$GAMEDIR/prefix"
        }
      }
    ],
    "system": {
      "env": {
        "DXVK_HUD": 0
      },
      "pulse_latency": true
    },
    "winesteam": {
      "dxvk": true,
      "overrides": {
        "xaudio2_7": "native,builtin"
      }
    }
  },
  "content": "game:\n  appid: 244210\n  arch: win64\n  prefix: $GAMEDIR/prefix\ninstaller:\n- task:\n    arch: win64\n    description: Creating prefix\n    name: create_prefix\n    prefix: $GAMEDIR/prefix\n- task:\n    app: corefonts\n    arch: win64\n    description: Installing corefonts\n    name: winetricks\n    prefix: $GAMEDIR/prefix\n- task:\n    app: vcrun2008\n    arch: win64\n    name: winetricks\n    prefix: $GAMEDIR/prefix\n- task:\n    app: vcrun2010\n    arch: win64\n    name: winetricks\n    prefix: $GAMEDIR/prefix\n- task:\n    app: vcrun2012\n    arch: win64\n    name: winetricks\n    prefix: $GAMEDIR/prefix\n- task:\n    app: vcrun2013\n    arch: win64\n    name: winetricks\n    prefix: $GAMEDIR/prefix\n- task:\n    app: d3dx11_43\n    arch: win64\n    name: winetricks\n    prefix: $GAMEDIR/prefix\n- task:\n    app: d3dcompiler_43\n    arch: win64\n    name: winetricks\n    prefix: $GAMEDIR/prefix\n- task:\n    app: dotnet472 win7\n    arch: win64\n    description: Installing .NET 4.7.2 (it may take a while)\n    name: winetricks\n    prefix: $GAMEDIR/prefix\nsystem:\n  env:\n    DXVK_HUD: 0\n  pulse_latency: true\nwinesteam:\n  dxvk: true\n  overrides:\n    xaudio2_7: native,builtin\n"
}