{
  "id": 11886,
  "game_id": 451,
  "game_slug": "tropico-4",
  "name": "Tropico 4",
  "year": 2011,
  "user": "cxf",
  "runner": "wine",
  "slug": "tropico-4-gog",
  "version": "GOG",
  "description": null,
  "notes": "Might give some errors towards the end just press ok and close the setup.",
  "created_at": "2019-02-06T23:18:54.349000Z",
  "updated_at": "2019-02-06T23:32:48.076142Z",
  "draft": false,
  "published": true,
  "published_by": 19464,
  "rating": "",
  "steamid": 57690,
  "gogid": 1435068351,
  "gogslug": "tropico_4",
  "humblestoreid": "tropico-4",
  "script": {
    "files": [
      {
        "goginstaller": "N/A:Please select the GOG.com Windows installer"
      },
      {
        "dx2010": "https://lutris.net/files/tools/directx-2010.tar.gz"
      }
    ],
    "game": {
      "prefix": "$GAMEDIR",
      "arch": "win64",
      "exe": "drive_c/GOG Games/Tropico 4/Tropico4.exe"
    },
    "installer": [
      {
        "extract": {
          "dst": "$CACHE/dxsetup",
          "file": "dx2010"
        }
      },
      {
        "task": {
          "prefix": "$GAMEDIR",
          "name": "create_prefix",
          "arch": "win64"
        }
      },
      {
        "task": {
          "args": "/silent",
          "name": "wineexec",
          "arch": "win64",
          "executable": "$CACHE/dxsetup/DXSETUP.exe",
          "prefix": "$GAMEDIR"
        }
      },
      {
        "task": {
          "prefix": "$GAMEDIR",
          "name": "winekill",
          "arch": "win64"
        }
      },
      {
        "task": {
          "prefix": "$GAMEDIR",
          "name": "winetricks",
          "arch": "win64",
          "app": "vcrun2010 xact"
        }
      },
      {
        "task": {
          "description": "Installing .NET 4.7.2",
          "name": "winetricks",
          "arch": "win64",
          "app": "dotnet472 win7",
          "prefix": "$GAMEDIR"
        }
      },
      {
        "task": {
          "args": "/LANG=English /SP- /SUPPRESSMSGBOXES",
          "name": "wineexec",
          "arch": "win64",
          "executable": "goginstaller",
          "prefix": "$GAMEDIR"
        }
      }
    ]
  },
  "content": "files:\n- goginstaller: N/A:Please select the GOG.com Windows installer\n- dx2010: https://lutris.net/files/tools/directx-2010.tar.gz\ngame:\n  arch: win64\n  exe: drive_c/GOG Games/Tropico 4/Tropico4.exe\n  prefix: $GAMEDIR\ninstaller:\n- extract:\n    dst: $CACHE/dxsetup\n    file: dx2010\n- task:\n    arch: win64\n    name: create_prefix\n    prefix: $GAMEDIR\n- task:\n    arch: win64\n    args: /silent\n    executable: $CACHE/dxsetup/DXSETUP.exe\n    name: wineexec\n    prefix: $GAMEDIR\n- task:\n    arch: win64\n    name: winekill\n    prefix: $GAMEDIR\n- task:\n    app: vcrun2010 xact\n    arch: win64\n    name: winetricks\n    prefix: $GAMEDIR\n- task:\n    app: dotnet472 win7\n    arch: win64\n    description: Installing .NET 4.7.2\n    name: winetricks\n    prefix: $GAMEDIR\n- task:\n    arch: win64\n    args: /LANG=English /SP- /SUPPRESSMSGBOXES\n    executable: goginstaller\n    name: wineexec\n    prefix: $GAMEDIR\n"
}