{
  "id": 7666,
  "game_id": 4369,
  "game_slug": "tera",
  "name": "TERA",
  "year": 2015,
  "user": "jdwininger",
  "runner": "wine",
  "slug": "tera-current-live",
  "version": "Current Live",
  "description": null,
  "notes": "During initial installation you will receive an error about installing Visual C++ runtime 2010 for x64. It is safe to click YES to continue the installation.",
  "created_at": "2018-03-26T10:57:39.987000Z",
  "updated_at": "2020-01-23T02:57:00.807911Z",
  "draft": false,
  "published": true,
  "published_by": 19464,
  "rating": "",
  "steamid": 323370,
  "gogid": null,
  "gogslug": "",
  "humblestoreid": "",
  "script": {
    "files": [
      {
        "tera_installer": "http://patch.tera.enmasse-game.com/temp/TERA-Minimal-Setup.exe"
      },
      {
        "glyph_installer": "http://download.dyn.triongames.com/GlyphInstall.exe"
      }
    ],
    "game": {
      "prefix": "$GAMEDIR",
      "arch": "win64",
      "exe": "$GAMEDIR/drive_c/users/Public/Games/En Masse Entertainment/TERA/TERA-Launcher.exe"
    },
    "installer": [
      {
        "merge": {
          "dst": "$GAMEDIR/drive_c",
          "src": "glyph_installer"
        }
      },
      {
        "task": {
          "prefix": "$GAMEDIR",
          "name": "create_prefix",
          "arch": "win64"
        }
      },
      {
        "task": {
          "description": "Setting Windows 7 mode for Wine",
          "name": "winetricks",
          "arch": "win64",
          "app": "win7",
          "prefix": "$GAMEDIR"
        }
      },
      {
        "task": {
          "description": "Microsoft TrueType Fonts",
          "name": "winetricks",
          "app": "corefonts",
          "prefix": "$GAMEDIR"
        }
      },
      {
        "task": {
          "description": "Flash Player",
          "name": "winetricks",
          "app": "flash",
          "prefix": "$GAMEDIR"
        }
      },
      {
        "task": {
          "description": "Installing D3D9 Dlls",
          "name": "winetricks",
          "app": "d3dx9",
          "prefix": "$GAMEDIR"
        }
      },
      {
        "task": {
          "description": "Visual C++ Runtime 2008",
          "name": "winetricks",
          "app": "vcrun2008",
          "prefix": "$GAMEDIR"
        }
      },
      {
        "task": {
          "description": "Visual C++ Runtime 2010",
          "name": "winetricks",
          "app": "vcrun2010",
          "prefix": "$GAMEDIR"
        }
      },
      {
        "task": {
          "description": "Visual C++ Runtime 2013",
          "name": "winetricks",
          "app": "vcrun2013",
          "prefix": "$GAMEDIR"
        }
      },
      {
        "task": {
          "description": "Setting minimum required video memory size to 2048",
          "name": "set_regedit",
          "key": "VideoMemorySize",
          "prefix": "$GAMEDIR",
          "path": "HKEY_CURRENT_USER\\Software\\Wine\\Direct3D",
          "value": 2048
        }
      },
      {
        "task": {
          "description": "Installing game. You will receive an error about installing Visual C++ runtime 2010 for x64. It is safe to click YES to continue the installation.",
          "name": "wineexec",
          "executable": "tera_installer",
          "prefix": "$GAMEDIR"
        }
      }
    ],
    "system": {
      "env": {
        "__GL_THREADED_OPTIMIZATIONS": "1",
        "__GL_SHADER_DISK_CACHE_PATH": "$GAMEDIR",
        "PBA_ENABLE": 1,
        "mesa_glthread": true,
        "__GL_SHADER_DISK_CACHE": "1"
      },
      "pulse_latency": true
    }
  },
  "content": "files:\n- tera_installer: http://patch.tera.enmasse-game.com/temp/TERA-Minimal-Setup.exe\n- glyph_installer: http://download.dyn.triongames.com/GlyphInstall.exe\ngame:\n  arch: win64\n  exe: $GAMEDIR/drive_c/users/Public/Games/En Masse Entertainment/TERA/TERA-Launcher.exe\n  prefix: $GAMEDIR\ninstaller:\n- merge:\n    dst: $GAMEDIR/drive_c\n    src: glyph_installer\n- task:\n    arch: win64\n    name: create_prefix\n    prefix: $GAMEDIR\n- task:\n    app: win7\n    arch: win64\n    description: Setting Windows 7 mode for Wine\n    name: winetricks\n    prefix: $GAMEDIR\n- task:\n    app: corefonts\n    description: Microsoft TrueType Fonts\n    name: winetricks\n    prefix: $GAMEDIR\n- task:\n    app: flash\n    description: Flash Player\n    name: winetricks\n    prefix: $GAMEDIR\n- task:\n    app: d3dx9\n    description: Installing D3D9 Dlls\n    name: winetricks\n    prefix: $GAMEDIR\n- task:\n    app: vcrun2008\n    description: Visual C++ Runtime 2008\n    name: winetricks\n    prefix: $GAMEDIR\n- task:\n    app: vcrun2010\n    description: Visual C++ Runtime 2010\n    name: winetricks\n    prefix: $GAMEDIR\n- task:\n    app: vcrun2013\n    description: Visual C++ Runtime 2013\n    name: winetricks\n    prefix: $GAMEDIR\n- task:\n    description: Setting minimum required video memory size to 2048\n    key: VideoMemorySize\n    name: set_regedit\n    path: HKEY_CURRENT_USER\\Software\\Wine\\Direct3D\n    prefix: $GAMEDIR\n    value: 2048\n- task:\n    description: Installing game. You will receive an error about installing Visual\n      C++ runtime 2010 for x64. It is safe to click YES to continue the installation.\n    executable: tera_installer\n    name: wineexec\n    prefix: $GAMEDIR\nsystem:\n  env:\n    PBA_ENABLE: 1\n    __GL_SHADER_DISK_CACHE: '1'\n    __GL_SHADER_DISK_CACHE_PATH: $GAMEDIR\n    __GL_THREADED_OPTIMIZATIONS: '1'\n    mesa_glthread: true\n  pulse_latency: true\n"
}