{
  "id": 22005,
  "game_id": 4369,
  "game_slug": "tera",
  "name": "TERA",
  "year": 2015,
  "user": "Actery",
  "runner": "wine",
  "slug": "tera-change-me-2",
  "version": "Change Me",
  "description": null,
  "notes": "During the initial installation you will receive an error about installing Visual C++ runtime 2010 for x64. It is safe to click YES to continue the installation.",
  "created_at": "2020-06-28T02:41:08.463269Z",
  "updated_at": "2020-06-28T02:41:08.463299Z",
  "draft": false,
  "published": false,
  "published_by": 19464,
  "rating": "",
  "steamid": 323370,
  "gogid": null,
  "gogslug": "",
  "humbleid": "",
  "humblestoreid": "",
  "humblestoreid_real": "",
  "script": {
    "files": [
      {
        "tera_installer": "http://dl.tera.gameforge.com/tera/installer/2018-11-27_TERA_Setup.exe"
      },
      {
        "glyph_installer": "http://download.dyn.triongames.com/GlyphInstall.exe"
      }
    ],
    "game": {
      "arch": "win64",
      "exe": "$GAMEDIR/drive_c/Program Files (x86)/TERA/TERA-launcher.exe",
      "prefix": "$GAMEDIR"
    },
    "installer": [
      {
        "merge": {
          "dst": "$GAMEDIR/drive_c",
          "src": "glyph_installer"
        }
      },
      {
        "task": {
          "arch": "win64",
          "name": "create_prefix",
          "prefix": "$GAMEDIR"
        }
      },
      {
        "task": {
          "app": "win7",
          "arch": "win64",
          "description": "Setting Windows 7 mode for Wine",
          "name": "winetricks",
          "prefix": "$GAMEDIR"
        }
      },
      {
        "task": {
          "app": "corefonts",
          "description": "Microsoft TrueType Fonts",
          "name": "winetricks",
          "prefix": "$GAMEDIR",
          "silent": true
        }
      },
      {
        "task": {
          "app": "flash",
          "description": "Flash Player",
          "name": "winetricks",
          "prefix": "$GAMEDIR",
          "silent": true
        }
      },
      {
        "task": {
          "app": "d3dx9",
          "description": "Installing D3D9 Dlls",
          "name": "winetricks",
          "prefix": "$GAMEDIR",
          "silent": true
        }
      },
      {
        "task": {
          "app": "vcrun2008",
          "description": "Visual C++ Runtime 2008",
          "name": "winetricks",
          "prefix": "$GAMEDIR",
          "silent": true
        }
      },
      {
        "task": {
          "app": "vcrun2010",
          "description": "Visual C++ Runtime 2010",
          "name": "winetricks",
          "prefix": "$GAMEDIR",
          "silent": true
        }
      },
      {
        "task": {
          "app": "vcrun2013",
          "description": "Visual C++ Runtime 2013",
          "name": "winetricks",
          "prefix": "$GAMEDIR",
          "silent": true
        }
      },
      {
        "task": {
          "description": "Installing game. You will receive an error about installing Visual C++ runtime 2010 for x64. It is safe to click YES to continue the installation.",
          "executable": "tera_installer",
          "name": "wineexec",
          "prefix": "$GAMEDIR"
        }
      }
    ],
    "system": {
      "disable_runtime": true
    }
  },
  "content": "files:\n- tera_installer: http://dl.tera.gameforge.com/tera/installer/2018-11-27_TERA_Setup.exe\n- glyph_installer: http://download.dyn.triongames.com/GlyphInstall.exe\ngame:\n  arch: win64\n  exe: $GAMEDIR/drive_c/Program Files (x86)/TERA/TERA-launcher.exe\n  prefix: $GAMEDIR\ninstaller:\n- merge:\n    dst: $GAMEDIR/drive_c\n    src: glyph_installer\n- task:\n    arch: win64\n    name: create_prefix\n    prefix: $GAMEDIR\n- task:\n    app: win7\n    arch: win64\n    description: Setting Windows 7 mode for Wine\n    name: winetricks\n    prefix: $GAMEDIR\n- task:\n    app: corefonts\n    description: Microsoft TrueType Fonts\n    name: winetricks\n    prefix: $GAMEDIR\n    silent: true\n- task:\n    app: flash\n    description: Flash Player\n    name: winetricks\n    prefix: $GAMEDIR\n    silent: true\n- task:\n    app: d3dx9\n    description: Installing D3D9 Dlls\n    name: winetricks\n    prefix: $GAMEDIR\n    silent: true\n- task:\n    app: vcrun2008\n    description: Visual C++ Runtime 2008\n    name: winetricks\n    prefix: $GAMEDIR\n    silent: true\n- task:\n    app: vcrun2010\n    description: Visual C++ Runtime 2010\n    name: winetricks\n    prefix: $GAMEDIR\n    silent: true\n- task:\n    app: vcrun2013\n    description: Visual C++ Runtime 2013\n    name: winetricks\n    prefix: $GAMEDIR\n    silent: true\n- task:\n    description: Installing game. You will receive an error about installing Visual\n      C++ runtime 2010 for x64. It is safe to click YES to continue the installation.\n    executable: tera_installer\n    name: wineexec\n    prefix: $GAMEDIR\nsystem:\n  disable_runtime: true\n"
}