{
  "id": 17974,
  "game_id": 3100,
  "game_slug": "3dmark-vantage",
  "name": "3DMark Vantage",
  "year": null,
  "user": "vanstaveren",
  "runner": "wine",
  "slug": "3dmark-vantage-steam",
  "version": "Steam",
  "description": "testing",
  "notes": "",
  "created_at": "2020-01-20T19:52:42.303920Z",
  "updated_at": "2020-01-23T02:59:36.500523Z",
  "draft": true,
  "published": false,
  "published_by": null,
  "rating": "",
  "steamid": 205250,
  "gogid": null,
  "gogslug": "",
  "humblestoreid": "",
  "script": {
    "game": {
      "exe": "$GAMEDIR/drive_c/Program Files (x86)/Futuremark/3DMark Vantage/3DMarkVantage.exe",
      "arch": "win64",
      "prefix": "$GAMEDIR"
    },
    "system": {
      "disable_compositor": true
    },
    "wine": {
      "Desktop": true,
      "dxvk": true
    },
    "installer": [
      {
        "task": {
          "arch": "win64",
          "description": "Creating 64-bit prefix ...",
          "prefix": "$GAMEDIR",
          "name": "create_prefix"
        }
      },
      {
        "task": {
          "app": "l3codecx",
          "arch": "win64",
          "description": "MP3codec DirectShow ...",
          "prefix": "$GAMEDIR",
          "name": "winetricks"
        }
      },
      {
        "task": {
          "app": "vcrun2010",
          "arch": "win64",
          "description": "Visual C++ 2010 libraries ...",
          "prefix": "$GAMEDIR",
          "name": "winetricks"
        }
      },
      {
        "task": {
          "app": "win81",
          "arch": "win64",
          "description": "Windows version 8.1 ...",
          "prefix": "$GAMEDIR",
          "name": "winetricks"
        }
      },
      {
        "task": {
          "app": "dxvk",
          "arch": "win64",
          "description": "Vulkan ...",
          "prefix": "$GAMEDIR",
          "name": "winetricks"
        }
      },
      {
        "task": {
          "app": "d9vk_master",
          "arch": "win64",
          "description": "Vulkan ...",
          "prefix": "$GAMEDIR",
          "name": "winetricks"
        }
      },
      {
        "merge": {
          "src": "$GAMEDIR/../3dmark_2006/drive_c/Program Files (x86)/Futuremark/Futuremark SystemInfo/",
          "dst": "$GAMEDIR/drive_c/Program Files (x86)/Futuremark/Futuremark SystemInfo/",
          "description": "Copying SystemInfo 4.15.0 from 3dmark_2006 ..."
        }
      },
      {
        "move": {
          "dst": "$GAMEDIR",
          "src": "setup"
        }
      },
      {
        "chmodx": "$GAMEDIR/3dmark-vantage.exe"
      },
      {
        "task": {
          "executable": "$GAMEDIR/3dmark-vantage.exe",
          "description": "3DMark Vantage ...",
          "prefix": "$GAMEDIR",
          "name": "wineexec"
        }
      },
      {
        "execute": {
          "description": "Register SystemInfo 4.15.0 ...",
          "command": "cd $HOME/Games/3dmark-vantage/drive_c/Program\\ Files\\ \\(x86\\)/Futuremark/Futuremark\\ SystemInfo && WINEPREFIX=\"$HOME/Games/3dmark_vantage/\" wine start register_fmsi.bat"
        }
      },
      {
        "task": {
          "arch": "win64",
          "description": "Register KeyCode ...",
          "name": "set_regedit",
          "path": "HKEY_LOCAL_MACHINE\\Software\\Wow6432Node\\Futuremark\\3DMarkVantage",
          "value": "3DMVA-S1R5T-HXXPD-PWFPT-LF3HV-TQ5AZ-K5T5J-W1UEC",
          "key": "KeyCode",
          "type": "REG_SZ"
        }
      },
      {
        "task": {
          "arch": "win64",
          "description": "Register KeyCode ...",
          "name": "set_regedit",
          "path": "HKEY_USERS\\S-1-5-21-0-0-0-1000\\Software\\Futuremark\\3DMarkVantage",
          "value": "3DMVA-S1R5T-HXXPD-PWFPT-LF3HV-TQ5AZ-K5T5J-W1UEC",
          "key": "KeyCode",
          "type": "REG_SZ"
        }
      }
    ],
    "files": [
      {
        "setup": "https://benchmarks.ul.com/downloads/3dmark-vantage.exe"
      }
    ]
  },
  "content": "files:\n- setup: https://benchmarks.ul.com/downloads/3dmark-vantage.exe\ngame:\n  arch: win64\n  exe: $GAMEDIR/drive_c/Program Files (x86)/Futuremark/3DMark Vantage/3DMarkVantage.exe\n  prefix: $GAMEDIR\ninstaller:\n- task:\n    arch: win64\n    description: Creating 64-bit prefix ...\n    name: create_prefix\n    prefix: $GAMEDIR\n- task:\n    app: l3codecx\n    arch: win64\n    description: MP3codec DirectShow ...\n    name: winetricks\n    prefix: $GAMEDIR\n- task:\n    app: vcrun2010\n    arch: win64\n    description: Visual C++ 2010 libraries ...\n    name: winetricks\n    prefix: $GAMEDIR\n- task:\n    app: win81\n    arch: win64\n    description: Windows version 8.1 ...\n    name: winetricks\n    prefix: $GAMEDIR\n- task:\n    app: dxvk\n    arch: win64\n    description: Vulkan ...\n    name: winetricks\n    prefix: $GAMEDIR\n- task:\n    app: d9vk_master\n    arch: win64\n    description: Vulkan ...\n    name: winetricks\n    prefix: $GAMEDIR\n- merge:\n    description: Copying SystemInfo 4.15.0 from 3dmark_2006 ...\n    dst: $GAMEDIR/drive_c/Program Files (x86)/Futuremark/Futuremark SystemInfo/\n    src: $GAMEDIR/../3dmark_2006/drive_c/Program Files (x86)/Futuremark/Futuremark\n      SystemInfo/\n- move:\n    dst: $GAMEDIR\n    src: setup\n- chmodx: $GAMEDIR/3dmark-vantage.exe\n- task:\n    description: 3DMark Vantage ...\n    executable: $GAMEDIR/3dmark-vantage.exe\n    name: wineexec\n    prefix: $GAMEDIR\n- execute:\n    command: cd $HOME/Games/3dmark-vantage/drive_c/Program\\ Files\\ \\(x86\\)/Futuremark/Futuremark\\\n      SystemInfo && WINEPREFIX=\"$HOME/Games/3dmark_vantage/\" wine start register_fmsi.bat\n    description: Register SystemInfo 4.15.0 ...\n- task:\n    arch: win64\n    description: Register KeyCode ...\n    key: KeyCode\n    name: set_regedit\n    path: HKEY_LOCAL_MACHINE\\Software\\Wow6432Node\\Futuremark\\3DMarkVantage\n    type: REG_SZ\n    value: 3DMVA-S1R5T-HXXPD-PWFPT-LF3HV-TQ5AZ-K5T5J-W1UEC\n- task:\n    arch: win64\n    description: Register KeyCode ...\n    key: KeyCode\n    name: set_regedit\n    path: HKEY_USERS\\S-1-5-21-0-0-0-1000\\Software\\Futuremark\\3DMarkVantage\n    type: REG_SZ\n    value: 3DMVA-S1R5T-HXXPD-PWFPT-LF3HV-TQ5AZ-K5T5J-W1UEC\nsystem:\n  disable_compositor: true\nwine:\n  Desktop: true\n  dxvk: true\n"
}