{
  "id": 20080,
  "game_id": 32794,
  "game_slug": "neverputt",
  "name": "Neverputt",
  "year": null,
  "user": "vanstaveren",
  "runner": "wine",
  "slug": "neverputt-160-vulkan",
  "version": "1.6.0-vulkan",
  "description": null,
  "notes": "VR support!",
  "created_at": "2020-04-28T16:10:15.983991Z",
  "updated_at": "2020-04-28T16:10:15.984021Z",
  "draft": true,
  "published": false,
  "published_by": null,
  "rating": "",
  "steamid": null,
  "gogid": null,
  "gogslug": "",
  "humblestoreid": "",
  "script": {
    "files": [
      {
        "neverball.zip": "https://neverball.org/neverball-1.6.0.zip"
      }
    ],
    "game": {
      "custom-name": "Neverputt",
      "exe": "$GAMEDIR/prefix/drive_c/Program Files/neverball/neverputt.exe",
      "arch": "win64"
    },
    "wine": {
      "Audio": "pulse",
      "version": "ge-protonified-nofshack-4.9-x86_64",
      "esync": true,
      "dxvk": true,
      "overrides": {
        "winedbg.exe": "d"
      }
    },
    "system": {
      "xboxdrv": "xboxdrv",
      "disable_compositor": true,
      "pulse_latency": true
    },
    "installer": [
      {
        "task": {
          "prefix": "$GAMEDIR/prefix",
          "arch": "win64",
          "name": "create_prefix",
          "description": "Creating 64-bit prefix ..."
        }
      },
      {
        "extract": {
          "src": "neverball.zip",
          "dst": "$GAMEDIR/prefix/drive_c/Program Files/neverball/"
        }
      },
      {
        "task": {
          "prefix": "$GAMEDIR/prefix",
          "arch": "win64",
          "app": "d3dcompiler_43",
          "description": "DirectX 11 ...",
          "name": "winetricks"
        }
      },
      {
        "task": {
          "prefix": "$GAMEDIR/prefix",
          "arch": "win64",
          "app": "d3dx11_43",
          "description": "DirectX 11 ...",
          "name": "winetricks"
        }
      },
      {
        "task": {
          "prefix": "$GAMEDIR/prefix",
          "arch": "win64",
          "app": "dxvk",
          "description": "Vulkan ...",
          "name": "winetricks"
        }
      },
      {
        "task": {
          "prefix": "$GAMEDIR/prefix",
          "arch": "win64",
          "app": "win8",
          "description": "Windows version 8 ...",
          "name": "winetricks"
        }
      }
    ]
  },
  "content": "files:\n- neverball.zip: https://neverball.org/neverball-1.6.0.zip\ngame:\n  arch: win64\n  custom-name: Neverputt\n  exe: $GAMEDIR/prefix/drive_c/Program Files/neverball/neverputt.exe\ninstaller:\n- task:\n    arch: win64\n    description: Creating 64-bit prefix ...\n    name: create_prefix\n    prefix: $GAMEDIR/prefix\n- extract:\n    dst: $GAMEDIR/prefix/drive_c/Program Files/neverball/\n    src: neverball.zip\n- task:\n    app: d3dcompiler_43\n    arch: win64\n    description: DirectX 11 ...\n    name: winetricks\n    prefix: $GAMEDIR/prefix\n- task:\n    app: d3dx11_43\n    arch: win64\n    description: DirectX 11 ...\n    name: winetricks\n    prefix: $GAMEDIR/prefix\n- task:\n    app: dxvk\n    arch: win64\n    description: Vulkan ...\n    name: winetricks\n    prefix: $GAMEDIR/prefix\n- task:\n    app: win8\n    arch: win64\n    description: Windows version 8 ...\n    name: winetricks\n    prefix: $GAMEDIR/prefix\nsystem:\n  disable_compositor: true\n  pulse_latency: true\n  xboxdrv: xboxdrv\nwine:\n  Audio: pulse\n  dxvk: true\n  esync: true\n  overrides:\n    winedbg.exe: d\n  version: ge-protonified-nofshack-4.9-x86_64\n"
}