{
  "id": 12636,
  "game_id": 617,
  "game_slug": "battlefield-bad-company-2",
  "name": "Battlefield: Bad Company 2",
  "year": 2010,
  "user": "Linuxiarz",
  "runner": "wine",
  "slug": "battlefield-bad-company-2-origin",
  "version": "Origin",
  "description": null,
  "notes": "",
  "created_at": "2019-04-05T23:36:27.446000Z",
  "updated_at": "2020-01-23T02:57:18.142486Z",
  "draft": false,
  "published": true,
  "published_by": 1,
  "rating": "",
  "steamid": 24960,
  "gogid": null,
  "gogslug": "",
  "humblestoreid": "",
  "script": {
    "files": [
      {
        "client": "https://origin-a.akamaihd.net/Origin-Client-Download/origin/live/OriginThinSetup.exe"
      },
      {
        "updater": "https://raw.githubusercontent.com/DrDoctor13/wine-origin-updater/master/updateorigin.sh"
      }
    ],
    "installer": [
      {
        "task": {
          "prefix": "$GAMEDIR",
          "name": "create_prefix",
          "arch": "win64"
        }
      },
      {
        "task": {
          "prefix": "$GAMEDIR",
          "name": "winetricks",
          "arch": "win64",
          "app": "nocrashdialog vcrun2005 vcrun2008 vcrun2010 win7"
        }
      },
      {
        "task": {
          "description": "Installing Origin... Login window will pop-up and close.",
          "name": "wineexec",
          "arch": "win64",
          "executable": "client",
          "args": "/silent",
          "prefix": "$GAMEDIR",
          "exclude_processes": "Origin.exe OriginClientService.exe OriginWebHelperService.exe QtWebEngineProcess.exe"
        }
      },
      {
        "task": {
          "prefix": "$GAMEDIR",
          "name": "winekill",
          "arch": "win64"
        }
      },
      {
        "chmodx": "updater"
      },
      {
        "merge": {
          "dst": "$GAMEDIR/drive_c/Program Files (x86)/Origin",
          "src": "updater"
        }
      }
    ],
    "game": {
      "prefix": "$GAMEDIR",
      "arch": "win64",
      "exe": "drive_c/Program Files (x86)/Origin/Origin.exe"
    },
    "system": {
      "env": {
        "DXVK_HUD": "fps,compiler"
      }
    },
    "wine": {
      "dxvk": true
    }
  },
  "content": "files:\n- client: https://origin-a.akamaihd.net/Origin-Client-Download/origin/live/OriginThinSetup.exe\n- updater: https://raw.githubusercontent.com/DrDoctor13/wine-origin-updater/master/updateorigin.sh\ngame:\n  arch: win64\n  exe: drive_c/Program Files (x86)/Origin/Origin.exe\n  prefix: $GAMEDIR\ninstaller:\n- task:\n    arch: win64\n    name: create_prefix\n    prefix: $GAMEDIR\n- task:\n    app: nocrashdialog vcrun2005 vcrun2008 vcrun2010 win7\n    arch: win64\n    name: winetricks\n    prefix: $GAMEDIR\n- task:\n    arch: win64\n    args: /silent\n    description: Installing Origin... Login window will pop-up and close.\n    exclude_processes: Origin.exe OriginClientService.exe OriginWebHelperService.exe\n      QtWebEngineProcess.exe\n    executable: client\n    name: wineexec\n    prefix: $GAMEDIR\n- task:\n    arch: win64\n    name: winekill\n    prefix: $GAMEDIR\n- chmodx: updater\n- merge:\n    dst: $GAMEDIR/drive_c/Program Files (x86)/Origin\n    src: updater\nsystem:\n  env:\n    DXVK_HUD: fps,compiler\nwine:\n  dxvk: true\n"
}