{
  "id": 3652,
  "game_id": 617,
  "game_slug": "battlefield-bad-company-2",
  "name": "Battlefield: Bad Company 2",
  "year": 2010,
  "user": "codythedragondude",
  "runner": "winesteam",
  "slug": "battlefield-bad-company-2-steam",
  "version": "Steam",
  "description": null,
  "notes": "",
  "created_at": "2017-05-08T18:04:33.393000Z",
  "updated_at": "2018-01-14T07:41:39.392983Z",
  "draft": false,
  "published": true,
  "published_by": null,
  "rating": "",
  "steamid": 24960,
  "gogid": null,
  "gogslug": "",
  "humblestoreid": "",
  "script": {
    "game": {
      "prefix": "$GAMEDIR/prefix",
      "appid": 24960
    },
    "winesteam": {
      "version": "staging-2.21-x86_64"
    },
    "installer": [
      {
        "task": {
          "prefix": "$GAMEDIR/prefix",
          "arch": "win32",
          "name": "create_prefix"
        }
      },
      {
        "task": {
          "description": "Changing to Windows 7",
          "arch": "win32",
          "prefix": "$GAMEDIR/prefix",
          "name": "winetricks",
          "app": "win7"
        }
      },
      {
        "task": {
          "description": "Installing d3dx9",
          "arch": "win32",
          "prefix": "$GAMEDIR/prefix",
          "name": "winetricks",
          "app": "d3dx9"
        }
      },
      {
        "task": {
          "description": "Installing VisualC++ Runtime vcrun2005",
          "arch": "win32",
          "prefix": "$GAMEDIR/prefix",
          "name": "winetricks",
          "app": "vcrun2005"
        }
      },
      {
        "task": {
          "description": "Installing VisualC++ Runtime vcrun2008",
          "arch": "win32",
          "prefix": "$GAMEDIR/prefix",
          "name": "winetricks",
          "app": "vcrun2008"
        }
      },
      {
        "task": {
          "description": "Installing VisualC++ Runtime vcrun2010",
          "arch": "win32",
          "prefix": "$GAMEDIR/prefix",
          "name": "winetricks",
          "app": "vcrun2010"
        }
      },
      {
        "task": {
          "prefix": "$GAMEDIR/prefix",
          "name": "set_regedit",
          "path": "HKEY_CURRENT_USER\\Software\\Wine\\DllRedirects",
          "value": "wined3d-csmt.dll",
          "key": "wined3d",
          "arch": "win32"
        }
      },
      {
        "write_config": {
          "section": "Controls",
          "value": "1",
          "key": "bBackgroundMouse",
          "file": "$GAMEDIR/prefix/drive_c/users/$USER/My Documents/BFBC2/settings.ini"
        }
      },
      {
        "write_config": {
          "section": "Graphics",
          "value": 9,
          "key": "DxVersion",
          "file": "$GAMEDIR/prefix/drive_c/users/$USER/My Documents/BFBC2/settings.ini"
        }
      }
    ]
  },
  "content": "game:\n  appid: 24960\n  prefix: $GAMEDIR/prefix\ninstaller:\n- task:\n    arch: win32\n    name: create_prefix\n    prefix: $GAMEDIR/prefix\n- task:\n    app: win7\n    arch: win32\n    description: Changing to Windows 7\n    name: winetricks\n    prefix: $GAMEDIR/prefix\n- task:\n    app: d3dx9\n    arch: win32\n    description: Installing d3dx9\n    name: winetricks\n    prefix: $GAMEDIR/prefix\n- task:\n    app: vcrun2005\n    arch: win32\n    description: Installing VisualC++ Runtime vcrun2005\n    name: winetricks\n    prefix: $GAMEDIR/prefix\n- task:\n    app: vcrun2008\n    arch: win32\n    description: Installing VisualC++ Runtime vcrun2008\n    name: winetricks\n    prefix: $GAMEDIR/prefix\n- task:\n    app: vcrun2010\n    arch: win32\n    description: Installing VisualC++ Runtime vcrun2010\n    name: winetricks\n    prefix: $GAMEDIR/prefix\n- task:\n    arch: win32\n    key: wined3d\n    name: set_regedit\n    path: HKEY_CURRENT_USER\\Software\\Wine\\DllRedirects\n    prefix: $GAMEDIR/prefix\n    value: wined3d-csmt.dll\n- write_config:\n    file: $GAMEDIR/prefix/drive_c/users/$USER/My Documents/BFBC2/settings.ini\n    key: bBackgroundMouse\n    section: Controls\n    value: '1'\n- write_config:\n    file: $GAMEDIR/prefix/drive_c/users/$USER/My Documents/BFBC2/settings.ini\n    key: DxVersion\n    section: Graphics\n    value: 9\nwinesteam:\n  version: staging-2.21-x86_64\n"
}