{
  "id": 10817,
  "game_id": 617,
  "game_slug": "battlefield-bad-company-2",
  "name": "Battlefield: Bad Company 2",
  "year": 2010,
  "user": "sbor",
  "runner": "wine",
  "slug": "battlefield-bad-company-2-dvd-w-dxvk",
  "version": "DVD w/ DXVK",
  "description": null,
  "notes": "",
  "created_at": "2018-11-09T15:05:41.551000Z",
  "updated_at": "2020-01-23T02:57:01.321340Z",
  "draft": false,
  "published": true,
  "published_by": 19464,
  "rating": "",
  "steamid": 24960,
  "gogid": null,
  "gogslug": "",
  "humblestoreid": "",
  "script": {
    "game": {
      "arch": "win32",
      "prefix": "$GAMEDIR",
      "exe": "drive_c/Program Files/Electronic Arts/Battlefield Bad Company 2/BFBC2Updater.exe"
    },
    "system": {
      "env": {
        "DXVK_HUD": 0
      }
    },
    "wine": {
      "dxvk": true
    },
    "installer": [
      {
        "insert-disc": {
          "requires": "Setup.exe"
        }
      },
      {
        "task": {
          "arch": "win32",
          "prefix": "$GAMEDIR",
          "name": "create_prefix"
        }
      },
      {
        "task": {
          "arch": "win32",
          "description": "Changing to Windows 7",
          "app": "win7",
          "prefix": "$GAMEDIR",
          "name": "winetricks"
        }
      },
      {
        "task": {
          "arch": "win32",
          "description": "Installing VisualC++ Runtime vcrun2005",
          "app": "vcrun2005",
          "prefix": "$GAMEDIR",
          "name": "winetricks"
        }
      },
      {
        "task": {
          "arch": "win32",
          "description": "Installing VisualC++ Runtime vcrun2008",
          "app": "vcrun2008",
          "prefix": "$GAMEDIR",
          "name": "winetricks"
        }
      },
      {
        "task": {
          "arch": "win32",
          "description": "Installing VisualC++ Runtime vcrun2010",
          "app": "vcrun2010 win7",
          "prefix": "$GAMEDIR",
          "name": "winetricks"
        }
      },
      {
        "task": {
          "executable": "$DISC/Autorun.exe",
          "prefix": "$GAMEDIR",
          "name": "wineexec"
        }
      },
      {
        "write_config": {
          "section": "Controls",
          "key": "bBackgroundMouse",
          "file": "$GAMEDIR/drive_c/users/$USER/My Documents/BFBC2/settings.ini",
          "value": "1"
        }
      },
      {
        "write_config": {
          "section": "Graphics",
          "key": "DxVersion",
          "file": "$GAMEDIR/drive_c/users/$USER/My Documents/BFBC2/settings.ini",
          "value": 11
        }
      }
    ]
  },
  "content": "game:\n  arch: win32\n  exe: drive_c/Program Files/Electronic Arts/Battlefield Bad Company 2/BFBC2Updater.exe\n  prefix: $GAMEDIR\ninstaller:\n- insert-disc:\n    requires: Setup.exe\n- task:\n    arch: win32\n    name: create_prefix\n    prefix: $GAMEDIR\n- task:\n    app: win7\n    arch: win32\n    description: Changing to Windows 7\n    name: winetricks\n    prefix: $GAMEDIR\n- task:\n    app: vcrun2005\n    arch: win32\n    description: Installing VisualC++ Runtime vcrun2005\n    name: winetricks\n    prefix: $GAMEDIR\n- task:\n    app: vcrun2008\n    arch: win32\n    description: Installing VisualC++ Runtime vcrun2008\n    name: winetricks\n    prefix: $GAMEDIR\n- task:\n    app: vcrun2010 win7\n    arch: win32\n    description: Installing VisualC++ Runtime vcrun2010\n    name: winetricks\n    prefix: $GAMEDIR\n- task:\n    executable: $DISC/Autorun.exe\n    name: wineexec\n    prefix: $GAMEDIR\n- write_config:\n    file: $GAMEDIR/drive_c/users/$USER/My Documents/BFBC2/settings.ini\n    key: bBackgroundMouse\n    section: Controls\n    value: '1'\n- write_config:\n    file: $GAMEDIR/drive_c/users/$USER/My Documents/BFBC2/settings.ini\n    key: DxVersion\n    section: Graphics\n    value: 11\nsystem:\n  env:\n    DXVK_HUD: 0\nwine:\n  dxvk: true\n"
}