{
  "id": 15969,
  "game_id": 25254,
  "game_slug": "e-sword",
  "name": "e-Sword",
  "year": 1998,
  "user": "Sellies",
  "runner": "wine",
  "slug": "e-sword-esword-121",
  "version": "eSword 12.1",
  "description": "eSword",
  "notes": "",
  "created_at": "2019-10-04T09:12:18.176000Z",
  "updated_at": "2019-11-01T22:58:05.478777Z",
  "draft": false,
  "published": true,
  "published_by": 19464,
  "rating": "",
  "steamid": null,
  "gogid": null,
  "gogslug": "",
  "humblestoreid": "",
  "script": {
    "files": [
      {
        "filename": "https://www.e-sword.net/files/e-sword_1201_setup.exe"
      }
    ],
    "game": {
      "prefix": "$GAMEDIR",
      "arch": "win32",
      "exe": "$GAMEDIR/drive_c/Program Files/e-Sword/e-Sword.exe"
    },
    "installer": [
      {
        "task": {
          "description": "Creating 64bit Wine prefix.",
          "name": "create_prefix",
          "arch": "win32",
          "prefix": "$GAMEDIR"
        }
      },
      {
        "task": {
          "prefix": "$GAMEDIR",
          "name": "winetricks",
          "app": "corefonts"
        }
      },
      {
        "task": {
          "description": "Installing winetricks verbs",
          "name": "winetricks",
          "arch": "win32",
          "app": "mfc42 vcrun6 msls31 msxml3 msxml6 vb6run wsh57",
          "prefix": "$GAMEDIR"
        }
      },
      {
        "task": {
          "prefix": "$GAMEDIR",
          "name": "winekill"
        }
      },
      {
        "task": {
          "description": "Installing eSword...",
          "name": "wineexec",
          "executable": "filename",
          "prefix": "$GAMEDIR"
        }
      }
    ]
  },
  "content": "files:\n- filename: https://www.e-sword.net/files/e-sword_1201_setup.exe\ngame:\n  arch: win32\n  exe: $GAMEDIR/drive_c/Program Files/e-Sword/e-Sword.exe\n  prefix: $GAMEDIR\ninstaller:\n- task:\n    arch: win32\n    description: Creating 64bit Wine prefix.\n    name: create_prefix\n    prefix: $GAMEDIR\n- task:\n    app: corefonts\n    name: winetricks\n    prefix: $GAMEDIR\n- task:\n    app: mfc42 vcrun6 msls31 msxml3 msxml6 vb6run wsh57\n    arch: win32\n    description: Installing winetricks verbs\n    name: winetricks\n    prefix: $GAMEDIR\n- task:\n    name: winekill\n    prefix: $GAMEDIR\n- task:\n    description: Installing eSword...\n    executable: filename\n    name: wineexec\n    prefix: $GAMEDIR\n"
}