{
  "id": 2486,
  "game_id": 807,
  "game_slug": "children-of-the-nile",
  "name": "Children of the Nile",
  "year": null,
  "user": "ssf",
  "runner": "wine",
  "slug": "children-of-the-nile-complete-gogcom",
  "version": "Complete - GOG.com",
  "description": "",
  "notes": "",
  "created_at": "2016-08-17T20:15:24.106173Z",
  "updated_at": "2016-09-30T20:53:38.192597Z",
  "draft": false,
  "published": true,
  "published_by": null,
  "rating": "",
  "steamid": 17100,
  "gogid": null,
  "gogslug": "",
  "humbleid": "",
  "humblestoreid": "",
  "humblestoreid_real": "",
  "script": {
    "files": [
      {
        "game": "N/A:Please select the GOG.com Windows installer."
      }
    ],
    "game": {
      "arch": "win32",
      "exe": "drive_c/GOG Games/Children of the Nile Complete/CotN.exe",
      "prefix": "$GAMEDIR"
    },
    "gogid": "children_of_the_nile_complete",
    "installer": [
      {
        "task": {
          "description": "Creating Wine prefix",
          "name": "create_prefix",
          "prefix": "$GAMEDIR"
        }
      },
      {
        "task": {
          "key": "winemenubuilder.exe",
          "name": "set_regedit",
          "path": "HKEY_CURRENT_USER\\Software\\Wine\\DllOverrides",
          "prefix": "$GAMEDIR",
          "type": "REG_SZ",
          "value": ""
        }
      },
      {
        "task": {
          "args": "/VERYSILENT /SP- /NOCANCEL /SUPPRESSMSGBOXES",
          "description": "Installing...",
          "executable": "game",
          "name": "wineexec",
          "prefix": "$GAMEDIR"
        }
      },
      {
        "task": {
          "app": "sandbox",
          "description": "Disabling unused WINE features",
          "name": "winetricks",
          "prefix": "$GAMEDIR",
          "silent": true
        }
      }
    ]
  },
  "content": "files:\n- game: N/A:Please select the GOG.com Windows installer.\ngame:\n  arch: win32\n  exe: drive_c/GOG Games/Children of the Nile Complete/CotN.exe\n  prefix: $GAMEDIR\ngogid: children_of_the_nile_complete\ninstaller:\n- task:\n    description: Creating Wine prefix\n    name: create_prefix\n    prefix: $GAMEDIR\n- task:\n    key: winemenubuilder.exe\n    name: set_regedit\n    path: HKEY_CURRENT_USER\\Software\\Wine\\DllOverrides\n    prefix: $GAMEDIR\n    type: REG_SZ\n    value: ''\n- task:\n    args: /VERYSILENT /SP- /NOCANCEL /SUPPRESSMSGBOXES\n    description: Installing...\n    executable: game\n    name: wineexec\n    prefix: $GAMEDIR\n- task:\n    app: sandbox\n    description: Disabling unused WINE features\n    name: winetricks\n    prefix: $GAMEDIR\n    silent: true\n"
}