{
  "id": 16957,
  "game_id": 7313,
  "game_slug": "gabriel-knight-2-the-beast-within",
  "name": "Gabriel Knight 2: The Beast Within",
  "year": 1995,
  "user": "legluondunet",
  "runner": "scummvm",
  "slug": "gabriel-knight-2-the-beast-wi-cd",
  "version": "CD",
  "description": "This script will install \"Gabriel Knight 2: The Beast Within\" CD edition for ScummVM.\r\nDuring install please let all options by default.\r\nBig thanks to people who gave their time to permit us playing this game in the best conditions.",
  "notes": "- You will need the 6 CD only during install.\r\n- Please report issue concerning this script on my Github page:\r\nhttps://github.com/legluondunet/MyLittleLutrisScripts/",
  "created_at": "2019-11-22T22:28:15.338000Z",
  "updated_at": "2019-12-13T05:40:11.135886Z",
  "draft": false,
  "published": true,
  "published_by": 494,
  "rating": "",
  "steamid": 496760,
  "gogid": 1207658837,
  "gogslug": "gabriel_knight_2_the_beast_within",
  "humblestoreid": "",
  "script": {
    "installer": [
      {
        "insert-disc": {
          "description": "Please insert disc 1",
          "requires": "gk2r1.001"
        }
      },
      {
        "merge": {
          "src": "$DISC",
          "dst": "$GAMEDIR/CD1"
        }
      },
      {
        "insert-disc": {
          "description": "Please insert disc 2",
          "requires": "gk2r1.002"
        }
      },
      {
        "merge": {
          "src": "$DISC",
          "dst": "$GAMEDIR/CD2"
        }
      },
      {
        "insert-disc": {
          "description": "Please insert disc 3",
          "requires": "gk2r1.003"
        }
      },
      {
        "merge": {
          "src": "$DISC",
          "dst": "$GAMEDIR/CD3"
        }
      },
      {
        "insert-disc": {
          "description": "Please insert disc 4",
          "requires": "gk2r1.004"
        }
      },
      {
        "merge": {
          "src": "$DISC",
          "dst": "$GAMEDIR/CD4"
        }
      },
      {
        "insert-disc": {
          "description": "Please insert disc 5",
          "requires": "gk2r1.005"
        }
      },
      {
        "merge": {
          "src": "$DISC",
          "dst": "$GAMEDIR/CD5"
        }
      },
      {
        "insert-disc": {
          "description": "Please insert disc 6",
          "requires": "gk2r1.006"
        }
      },
      {
        "merge": {
          "src": "$DISC",
          "dst": "$GAMEDIR/CD6"
        }
      },
      {
        "chmodx": "script"
      },
      {
        "execute": {
          "file": "script"
        }
      }
    ],
    "files": [
      {
        "script": "https://github.com/legluondunet/MyLittleLutrisScripts/raw/master/Gabriel%20Knight%202%20-%20The%20Beast%20Within/clean.sh"
      }
    ],
    "custom-name": "Gabriel Knight 2 - The Beast Within - CD - ScummVM",
    "game": {
      "game_id": "gk2",
      "subtitles": true,
      "path": "$GAMEDIR"
    }
  },
  "content": "custom-name: Gabriel Knight 2 - The Beast Within - CD - ScummVM\nfiles:\n- script: https://github.com/legluondunet/MyLittleLutrisScripts/raw/master/Gabriel%20Knight%202%20-%20The%20Beast%20Within/clean.sh\ngame:\n  game_id: gk2\n  path: $GAMEDIR\n  subtitles: true\ninstaller:\n- insert-disc:\n    description: Please insert disc 1\n    requires: gk2r1.001\n- merge:\n    dst: $GAMEDIR/CD1\n    src: $DISC\n- insert-disc:\n    description: Please insert disc 2\n    requires: gk2r1.002\n- merge:\n    dst: $GAMEDIR/CD2\n    src: $DISC\n- insert-disc:\n    description: Please insert disc 3\n    requires: gk2r1.003\n- merge:\n    dst: $GAMEDIR/CD3\n    src: $DISC\n- insert-disc:\n    description: Please insert disc 4\n    requires: gk2r1.004\n- merge:\n    dst: $GAMEDIR/CD4\n    src: $DISC\n- insert-disc:\n    description: Please insert disc 5\n    requires: gk2r1.005\n- merge:\n    dst: $GAMEDIR/CD5\n    src: $DISC\n- insert-disc:\n    description: Please insert disc 6\n    requires: gk2r1.006\n- merge:\n    dst: $GAMEDIR/CD6\n    src: $DISC\n- chmodx: script\n- execute:\n    file: script\n"
}