{
  "id": 12544,
  "game_id": 26387,
  "game_slug": "kartridge",
  "name": "Kartridge",
  "year": 2018,
  "user": "cxf",
  "runner": "wine",
  "slug": "kartridge-client",
  "version": "Client",
  "description": null,
  "notes": "",
  "created_at": "2019-03-28T01:44:18.957000Z",
  "updated_at": "2019-06-10T07:16:33.200884Z",
  "draft": false,
  "published": true,
  "published_by": 19464,
  "rating": "",
  "steamid": null,
  "gogid": null,
  "gogslug": "",
  "humblestoreid": "",
  "script": {
    "installer": [
      {
        "task": {
          "prefix": "$GAMEDIR",
          "name": "create_prefix"
        }
      },
      {
        "task": {
          "executable": "flash",
          "description": "Follow the prompts and install Flash. Ignore file not found error.",
          "prefix": "$GAMEDIR",
          "name": "wineexec"
        }
      },
      {
        "task": {
          "app": "dotnet472 win10",
          "prefix": "$GAMEDIR",
          "name": "winetricks"
        }
      },
      {
        "task": {
          "executable": "setup",
          "description": "Kartridge will complain about not installing and Updater might crash.\nClose both to finish installing.",
          "prefix": "$GAMEDIR",
          "name": "wineexec"
        }
      }
    ],
    "files": [
      {
        "setup": {
          "url": "https://www.kongregate.com/klient/klient_releases/win32_installer",
          "filename": "Kartridge.exe"
        }
      },
      {
        "flash": "https://fpdownload.adobe.com/get/flashplayer/pdc/32.0.0.156/install_flash_player_ppapi.exe"
      }
    ],
    "game": {
      "prefix": "$GAMEDIR",
      "exe": "drive_c/users/$USER/Local Settings/Application Data/Kartridge/app-0.3.55/Kartridge.exe"
    }
  },
  "content": "files:\n- setup:\n    filename: Kartridge.exe\n    url: https://www.kongregate.com/klient/klient_releases/win32_installer\n- flash: https://fpdownload.adobe.com/get/flashplayer/pdc/32.0.0.156/install_flash_player_ppapi.exe\ngame:\n  exe: drive_c/users/$USER/Local Settings/Application Data/Kartridge/app-0.3.55/Kartridge.exe\n  prefix: $GAMEDIR\ninstaller:\n- task:\n    name: create_prefix\n    prefix: $GAMEDIR\n- task:\n    description: Follow the prompts and install Flash. Ignore file not found error.\n    executable: flash\n    name: wineexec\n    prefix: $GAMEDIR\n- task:\n    app: dotnet472 win10\n    name: winetricks\n    prefix: $GAMEDIR\n- task:\n    description: 'Kartridge will complain about not installing and Updater might crash.\n\n      Close both to finish installing.'\n    executable: setup\n    name: wineexec\n    prefix: $GAMEDIR\n"
}