{
  "id": 6033,
  "game_id": 811,
  "game_slug": "stalker-shadow-of-chernobyl",
  "name": "S.T.A.L.K.E.R.: Shadow of Chernobyl",
  "year": null,
  "user": "bacera",
  "runner": "wine",
  "slug": "stalker-shadow-of-chernobyl-gog",
  "version": "GOG",
  "description": null,
  "notes": "",
  "created_at": "2017-10-21T02:12:15.775000Z",
  "updated_at": "2019-04-07T01:12:27.241610Z",
  "draft": false,
  "published": true,
  "published_by": 19464,
  "rating": "",
  "steamid": 4500,
  "gogid": 1207660573,
  "gogslug": "stalker_shadow_of_chernobyl",
  "humblestoreid": "",
  "script": {
    "game": {
      "arch": "win32",
      "prefix": "$GAMEDIR",
      "args": "-nointro",
      "exe": "drive_c/GOG Games/S.T.A.L.K.E.R. Shadow of Chernobyl/bin/XR_3DA.exe"
    },
    "files": [
      {
        "dx2010": "https://lutris.net/files/tools/directx-2010.tar.gz"
      },
      {
        "setup": "N/A:Select the GOG setup exe"
      }
    ],
    "installer": [
      {
        "task": {
          "arch": "win32",
          "prefix": "$GAMEDIR",
          "name": "create_prefix"
        }
      },
      {
        "extract": {
          "dst": "$CACHE/dxsetup",
          "file": "dx2010"
        }
      },
      {
        "task": {
          "arch": "win32",
          "executable": "$CACHE/dxsetup/DXSETUP.exe",
          "prefix": "$GAMEDIR",
          "name": "wineexec",
          "args": "/silent"
        }
      },
      {
        "task": {
          "arch": "win32",
          "prefix": "$GAMEDIR",
          "name": "winetricks",
          "app": "vcrun2003 vcrun2005"
        }
      },
      {
        "task": {
          "arch": "win32",
          "executable": "setup",
          "prefix": "$GAMEDIR",
          "name": "wineexec",
          "args": "/LANG=en /SP- /SUPPRESSMSGBOXES"
        }
      }
    ]
  },
  "content": "files:\n- dx2010: https://lutris.net/files/tools/directx-2010.tar.gz\n- setup: N/A:Select the GOG setup exe\ngame:\n  arch: win32\n  args: -nointro\n  exe: drive_c/GOG Games/S.T.A.L.K.E.R. Shadow of Chernobyl/bin/XR_3DA.exe\n  prefix: $GAMEDIR\ninstaller:\n- task:\n    arch: win32\n    name: create_prefix\n    prefix: $GAMEDIR\n- extract:\n    dst: $CACHE/dxsetup\n    file: dx2010\n- task:\n    arch: win32\n    args: /silent\n    executable: $CACHE/dxsetup/DXSETUP.exe\n    name: wineexec\n    prefix: $GAMEDIR\n- task:\n    app: vcrun2003 vcrun2005\n    arch: win32\n    name: winetricks\n    prefix: $GAMEDIR\n- task:\n    arch: win32\n    args: /LANG=en /SP- /SUPPRESSMSGBOXES\n    executable: setup\n    name: wineexec\n    prefix: $GAMEDIR\n"
}