{
  "id": 12091,
  "game_id": 25912,
  "game_slug": "far-cry-new-dawn",
  "name": "Far Cry New Dawn",
  "year": 2019,
  "user": "cxf",
  "runner": "winesteam",
  "slug": "far-cry-new-dawn-steam-w-dxvk",
  "version": "Steam w/ DXVK",
  "description": "Might work might not.",
  "notes": "",
  "created_at": "2019-02-19T03:13:54.845000Z",
  "updated_at": "2020-01-31T02:38:35.717918Z",
  "draft": false,
  "published": true,
  "published_by": 19464,
  "rating": "",
  "steamid": 939960,
  "gogid": null,
  "gogslug": "",
  "humblestoreid": "",
  "script": {
    "game": {
      "appid": 939960,
      "arch": "win64",
      "prefix": "$GAMEDIR/prefix"
    },
    "system": {
      "disable_runtime": false,
      "env": {
        "DXVK_CONFIG_FILE": "$GAMEDIR/dxvk.conf",
        "DXVK_HUD": 0
      }
    },
    "installer": [
      {
        "task": {
          "arch": "win64",
          "prefix": "$GAMEDIR/prefix",
          "name": "create_prefix"
        }
      },
      {
        "input_menu": {
          "options": [
            {
              "#dxgi.nvapiHack = False": "AMD"
            },
            {
              "dxgi.nvapiHack = False": "Nvidia"
            }
          ],
          "id": "GPU",
          "preselect": "#dxgi.nvapiHack = False",
          "description": "Choose your GPU:"
        }
      },
      {
        "write_file": {
          "content": "$INPUT_GPU",
          "file": "$GAMEDIR/dxvk.conf"
        }
      },
      {
        "extract": {
          "file": "dx2010",
          "dst": "$CACHE/dxsetup"
        }
      },
      {
        "task": {
          "executable": "$CACHE/dxsetup/DXSETUP.exe",
          "arch": "win64",
          "args": "/silent",
          "prefix": "$GAMEDIR/prefix",
          "name": "wineexec"
        }
      },
      {
        "task": {
          "app": "vcrun2010 vcrun2015 corefonts",
          "arch": "win64",
          "prefix": "$GAMEDIR/prefix",
          "name": "winetricks"
        }
      },
      {
        "task": {
          "app": "dotnet35sp1",
          "arch": "win64",
          "description": "Installing .NET 3.5",
          "prefix": "$GAMEDIR/prefix",
          "name": "winetricks"
        }
      },
      {
        "task": {
          "app": "dotnet472 win7",
          "arch": "win64",
          "description": "Installing .NET 4.7.2 please be patient",
          "prefix": "$GAMEDIR/prefix",
          "name": "winetricks"
        }
      },
      {
        "task": {
          "executable": "uplay",
          "arch": "win64",
          "args": "/S",
          "prefix": "$GAMEDIR/prefix",
          "name": "wineexec"
        }
      },
      {
        "task": {
          "arch": "win64",
          "prefix": "$GAMEDIR/prefix",
          "name": "winekill"
        }
      }
    ],
    "winesteam": {
      "esync": true,
      "dxvk": true
    },
    "files": [
      {
        "dx2010": "https://lutris.net/files/tools/directx-2010.tar.gz"
      },
      {
        "uplay": "https://ubistatic3-a.akamaihd.net/orbit/launcher_installer/UplayInstaller.exe"
      }
    ]
  },
  "content": "files:\n- dx2010: https://lutris.net/files/tools/directx-2010.tar.gz\n- uplay: https://ubistatic3-a.akamaihd.net/orbit/launcher_installer/UplayInstaller.exe\ngame:\n  appid: 939960\n  arch: win64\n  prefix: $GAMEDIR/prefix\ninstaller:\n- task:\n    arch: win64\n    name: create_prefix\n    prefix: $GAMEDIR/prefix\n- input_menu:\n    description: 'Choose your GPU:'\n    id: GPU\n    options:\n    - '#dxgi.nvapiHack = False': AMD\n    - dxgi.nvapiHack = False: Nvidia\n    preselect: '#dxgi.nvapiHack = False'\n- write_file:\n    content: $INPUT_GPU\n    file: $GAMEDIR/dxvk.conf\n- extract:\n    dst: $CACHE/dxsetup\n    file: dx2010\n- task:\n    arch: win64\n    args: /silent\n    executable: $CACHE/dxsetup/DXSETUP.exe\n    name: wineexec\n    prefix: $GAMEDIR/prefix\n- task:\n    app: vcrun2010 vcrun2015 corefonts\n    arch: win64\n    name: winetricks\n    prefix: $GAMEDIR/prefix\n- task:\n    app: dotnet35sp1\n    arch: win64\n    description: Installing .NET 3.5\n    name: winetricks\n    prefix: $GAMEDIR/prefix\n- task:\n    app: dotnet472 win7\n    arch: win64\n    description: Installing .NET 4.7.2 please be patient\n    name: winetricks\n    prefix: $GAMEDIR/prefix\n- task:\n    arch: win64\n    args: /S\n    executable: uplay\n    name: wineexec\n    prefix: $GAMEDIR/prefix\n- task:\n    arch: win64\n    name: winekill\n    prefix: $GAMEDIR/prefix\nsystem:\n  disable_runtime: false\n  env:\n    DXVK_CONFIG_FILE: $GAMEDIR/dxvk.conf\n    DXVK_HUD: 0\nwinesteam:\n  dxvk: true\n  esync: true\n"
}