{
  "id": 15292,
  "game_id": 20173,
  "game_slug": "echo",
  "name": "ECHO",
  "year": null,
  "user": "paperbenni",
  "runner": "wine",
  "slug": "echo-change-me",
  "version": "Change Me",
  "description": null,
  "notes": "",
  "created_at": "2019-09-04T19:02:33.288670Z",
  "updated_at": "2019-09-04T19:02:33.288703Z",
  "draft": false,
  "published": false,
  "published_by": null,
  "rating": "",
  "steamid": 551770,
  "gogid": 2145436309,
  "gogslug": "echo",
  "humblestoreid": "",
  "script": {
    "game": {
      "prefix": "$GAMEDIR",
      "exe": "drive_c/GOG Games/Echo/Echo.exe"
    },
    "files": [
      {
        "goginstaller": "N/A:Select gog setup exe"
      },
      {
        "dx2010": "https://lutris.net/files/tools/directx-2010.tar.gz"
      }
    ],
    "installer": [
      {
        "task": {
          "prefix": "$GAMEDIR",
          "name": "create_prefix"
        }
      },
      {
        "extract": {
          "dst": "$CACHE/dxsetup",
          "file": "dx2010"
        }
      },
      {
        "task": {
          "arch": "win64",
          "executable": "$CACHE/dxsetup/DXSETUP.exe",
          "prefix": "$GAMEDIR",
          "name": "wineexec",
          "args": "/silent"
        }
      },
      {
        "task": {
          "prefix": "$GAMEDIR",
          "name": "winetricks",
          "app": "vcrun2015 xact win7"
        }
      },
      {
        "task": {
          "prefix": "$GAMEDIR",
          "executable": "goginstaller",
          "args": "/SP- /SUPPRESSMSGBOXES",
          "name": "wineexec"
        }
      }
    ]
  },
  "content": "files:\n- goginstaller: N/A:Select gog setup exe\n- dx2010: https://lutris.net/files/tools/directx-2010.tar.gz\ngame:\n  exe: drive_c/GOG Games/Echo/Echo.exe\n  prefix: $GAMEDIR\ninstaller:\n- task:\n    name: create_prefix\n    prefix: $GAMEDIR\n- extract:\n    dst: $CACHE/dxsetup\n    file: dx2010\n- task:\n    arch: win64\n    args: /silent\n    executable: $CACHE/dxsetup/DXSETUP.exe\n    name: wineexec\n    prefix: $GAMEDIR\n- task:\n    app: vcrun2015 xact win7\n    name: winetricks\n    prefix: $GAMEDIR\n- task:\n    args: /SP- /SUPPRESSMSGBOXES\n    executable: goginstaller\n    name: wineexec\n    prefix: $GAMEDIR\n"
}