{
  "id": 12489,
  "game_id": 20173,
  "game_slug": "echo",
  "name": "ECHO",
  "year": null,
  "user": "cxf",
  "runner": "wine",
  "slug": "echo-gog",
  "version": "GOG",
  "description": null,
  "notes": "",
  "created_at": "2019-03-24T00:23:08.738487Z",
  "updated_at": "2020-01-09T09:27:52.269271Z",
  "draft": false,
  "published": true,
  "published_by": null,
  "rating": "",
  "steamid": 551770,
  "gogid": 2145436309,
  "gogslug": "echo",
  "humblestoreid": "",
  "script": {
    "game": {
      "exe": "drive_c/GOG Games/Echo/Echo.exe",
      "prefix": "$GAMEDIR"
    },
    "installer": [
      {
        "task": {
          "prefix": "$GAMEDIR",
          "name": "create_prefix"
        }
      },
      {
        "extract": {
          "file": "dx2010",
          "dst": "$CACHE/dxsetup"
        }
      },
      {
        "task": {
          "executable": "$CACHE/dxsetup/DXSETUP.exe",
          "arch": "win64",
          "args": "/silent",
          "prefix": "$GAMEDIR",
          "name": "wineexec"
        }
      },
      {
        "task": {
          "app": "vcrun2015 win7",
          "prefix": "$GAMEDIR",
          "name": "winetricks"
        }
      },
      {
        "task": {
          "executable": "goginstaller",
          "args": "/SP- /SUPPRESSMSGBOXES",
          "prefix": "$GAMEDIR",
          "name": "wineexec"
        }
      }
    ],
    "files": [
      {
        "goginstaller": "N/A:Select gog setup exe"
      },
      {
        "dx2010": "https://lutris.net/files/tools/directx-2010.tar.gz"
      }
    ]
  },
  "content": "files:\r\n- goginstaller: N/A:Select gog setup exe\r\n- dx2010: https://lutris.net/files/tools/directx-2010.tar.gz\r\ngame:\r\n  exe: drive_c/GOG Games/Echo/Echo.exe\r\n  prefix: $GAMEDIR\r\ninstaller:\r\n- task:\r\n    name: create_prefix\r\n    prefix: $GAMEDIR\r\n- extract:\r\n    dst: $CACHE/dxsetup\r\n    file: dx2010\r\n- task:\r\n    arch: win64\r\n    args: /silent\r\n    executable: $CACHE/dxsetup/DXSETUP.exe\r\n    name: wineexec\r\n    prefix: $GAMEDIR\r\n- task:\r\n    app: vcrun2015 win7\r\n    name: winetricks\r\n    prefix: $GAMEDIR\r\n- task:\r\n    args: /SP- /SUPPRESSMSGBOXES\r\n    executable: goginstaller\r\n    name: wineexec\r\n    prefix: $GAMEDIR"
}