{
  "id": 2882,
  "game_id": 1415,
  "game_slug": "the-chronicles-of-riddick-assault-on-dark-athena",
  "name": "The Chronicles of Riddick: Assault on Dark Athena",
  "year": null,
  "user": "ssf",
  "runner": "wine",
  "slug": "the-chronicles-of-riddick-ass-gogcom",
  "version": "GOG.com",
  "description": "The GOG version of Chronicles of Riddick: Assault on Dark Athena includes a graphically enhanced remake The Chronicles of Riddick: Escape from Butcher Bay and the sequel, Assault on Dark Athena.",
  "notes": "",
  "created_at": "2016-10-11T16:40:16.905626Z",
  "updated_at": "2019-03-23T16:39:38.661207Z",
  "draft": false,
  "published": true,
  "published_by": null,
  "rating": "1",
  "steamid": 9860,
  "gogid": null,
  "gogslug": "",
  "humblestoreid": "",
  "script": {
    "installer": [
      {
        "task": {
          "description": "Creating Wine prefix",
          "prefix": "$GAMEDIR",
          "name": "create_prefix"
        }
      },
      {
        "task": {
          "args": "/VERYSILENT /SP- /NOCANCEL /SUPPRESSMSGBOXES '/DIR=C:/game'",
          "executable": "game",
          "description": "Installing...",
          "prefix": "$GAMEDIR",
          "name": "wineexec"
        }
      },
      {
        "task": {
          "silent": true,
          "description": "Disabling unused WINE features",
          "app": "sandbox",
          "prefix": "$GAMEDIR",
          "name": "winetricks"
        }
      },
      {
        "task": {
          "silent": true,
          "app": "windowmanagermanaged=n",
          "prefix": "$GAMEDIR",
          "name": "winetricks"
        }
      }
    ],
    "files": [
      {
        "game": "N/A:Please select the GOG.com Windows installer."
      }
    ],
    "gogid": "the_chronicles_of_riddick_assault_on_dark_athena",
    "game": {
      "arch": "win32",
      "prefix": "$GAMEDIR",
      "exe": "drive_c/game/DarkAthena_Launcher.exe"
    }
  },
  "content": "files:\r\n- game: N/A:Please select the GOG.com Windows installer.\r\ngame:\r\n  arch: win32\r\n  exe: drive_c/game/DarkAthena_Launcher.exe\r\n  prefix: $GAMEDIR\r\ngogid: the_chronicles_of_riddick_assault_on_dark_athena\r\ninstaller:\r\n- task:\r\n    description: Creating Wine prefix\r\n    name: create_prefix\r\n    prefix: $GAMEDIR\r\n- task:\r\n    args: /VERYSILENT /SP- /NOCANCEL /SUPPRESSMSGBOXES '/DIR=C:/game'\r\n    description: Installing...\r\n    executable: game\r\n    name: wineexec\r\n    prefix: $GAMEDIR\r\n- task:\r\n    app: sandbox\r\n    description: Disabling unused WINE features\r\n    name: winetricks\r\n    prefix: $GAMEDIR\r\n    silent: true\r\n- task:\r\n    app: windowmanagermanaged=n\r\n    name: winetricks\r\n    prefix: $GAMEDIR\r\n    silent: true"
}