{
  "id": 10641,
  "game_id": 22995,
  "game_slug": "the-lord-of-the-rings-the-battle-for-middle-earth",
  "name": "The Lord of The Rings The Battle For Middle-Earth",
  "year": 2004,
  "user": "static-dragon",
  "runner": "wine",
  "slug": "the-lord-of-the-rings-the-bat-cd",
  "version": "CD",
  "description": "Please be sure to install the game in English when prompted. After the initial installer finishes do not run the game, the patches and HD Edition need the game closed to run install properly.",
  "notes": "The resolution in: $GAMEDIR/drive_c/users/$USER/Application Data/My Battle for Middle-earth Files/Options.ini needs to be set manually. For example the Resolution line should be set as follows:\r\nResolution = 1920 1080",
  "created_at": "2018-10-26T04:15:06.667000Z",
  "updated_at": "2020-05-22T14:32:14.207020Z",
  "draft": false,
  "published": true,
  "published_by": 20548,
  "rating": "",
  "steamid": null,
  "gogid": null,
  "gogslug": "",
  "humbleid": "",
  "humblestoreid": "",
  "humblestoreid_real": "",
  "script": {
    "files": [
      {
        "patch103": {
          "filename": "patch103.exe",
          "url": "https://www.moddb.com/downloads/mirror/35515/122/51b95e2af37f9bb6681dfe591246f2ee"
        }
      },
      {
        "patch108": {
          "filename": "patch108.exe",
          "url": "https://www.moddb.com/downloads/mirror/175315/122/b01906e3993b7fa8ac62d0c0e523cc74/"
        }
      }
    ],
    "installer": [
      {
        "task": {
          "arch": "win32",
          "name": "create_prefix",
          "prefix": "$GAMEDIR"
        }
      },
      {
        "insert-disc": {
          "requires": "AutoRun.exe"
        }
      },
      {
        "task": {
          "arch": "win32",
          "description": "Running game installer (Select \"Quit\" after the installation has finished)",
          "executable": "$DISC/AutoRun.exe",
          "name": "wineexec",
          "prefix": "$GAMEDIR"
        }
      },
      {
        "task": {
          "arch": "win32",
          "description": "Installing official patch version 1.03 (Exit the patch after it shows 100% overall progress)",
          "executable": "patch103",
          "name": "wineexec",
          "prefix": "$GAMEDIR"
        }
      },
      {
        "task": {
          "arch": "win32",
          "description": "Installing patch 1.08",
          "executable": "patch108",
          "name": "wineexec",
          "prefix": "$GAMEDIR"
        }
      },
      {
        "task": {
          "description": "Setting OS as Windows XP.",
          "key": "Version",
          "name": "set_regedit",
          "path": "HKEY_CURRENT_USER\\Software\\Wine",
          "prefix": "$GAMEDIR",
          "value": "winxp"
        }
      }
    ]
  },
  "content": "files:\n- patch103:\n    filename: patch103.exe\n    url: https://www.moddb.com/downloads/mirror/35515/122/51b95e2af37f9bb6681dfe591246f2ee\n- patch108:\n    filename: patch108.exe\n    url: https://www.moddb.com/downloads/mirror/175315/122/b01906e3993b7fa8ac62d0c0e523cc74/\ninstaller:\n- task:\n    arch: win32\n    name: create_prefix\n    prefix: $GAMEDIR\n- insert-disc:\n    requires: AutoRun.exe\n- task:\n    arch: win32\n    description: Running game installer (Select \"Quit\" after the installation has\n      finished)\n    executable: $DISC/AutoRun.exe\n    name: wineexec\n    prefix: $GAMEDIR\n- task:\n    arch: win32\n    description: Installing official patch version 1.03 (Exit the patch after it shows\n      100% overall progress)\n    executable: patch103\n    name: wineexec\n    prefix: $GAMEDIR\n- task:\n    arch: win32\n    description: Installing patch 1.08\n    executable: patch108\n    name: wineexec\n    prefix: $GAMEDIR\n- task:\n    description: Setting OS as Windows XP.\n    key: Version\n    name: set_regedit\n    path: HKEY_CURRENT_USER\\Software\\Wine\n    prefix: $GAMEDIR\n    value: winxp\n"
}