{
  "id": 11316,
  "game_id": 10257,
  "game_slug": "deadlight-directors-cut",
  "name": "Deadlight Directorâ€™s Cut",
  "year": null,
  "user": "HyrumGraff",
  "runner": "wine",
  "slug": "deadlight-directors-cut-gog",
  "version": "GOG",
  "description": null,
  "notes": "",
  "created_at": "2018-12-23T19:53:38.513000Z",
  "updated_at": "2019-02-07T00:14:35.857413Z",
  "draft": false,
  "published": true,
  "published_by": 19464,
  "rating": "",
  "steamid": 423950,
  "gogid": 1230412827,
  "gogslug": "deadlight_directors_cut",
  "humbleid": "",
  "humblestoreid": "",
  "humblestoreid_real": "",
  "script": {
    "files": [
      {
        "goginstaller": "N/A:Please select the GOG.com Windows installer"
      },
      {
        "dx2010": "https://lutris.net/files/tools/directx-2010.tar.gz"
      }
    ],
    "game": {
      "arch": "win64",
      "exe": "drive_c/GOG Games/Deadlight - Director's Cut/Binaries/Win64/LOTDGame.exe",
      "prefix": "$GAMEDIR"
    },
    "installer": [
      {
        "extract": {
          "dst": "$CACHE/dxsetup",
          "file": "dx2010"
        }
      },
      {
        "task": {
          "arch": "win64",
          "name": "create_prefix",
          "prefix": "$GAMEDIR"
        }
      },
      {
        "task": {
          "arch": "win64",
          "args": "/silent",
          "executable": "$CACHE/dxsetup/DXSETUP.exe",
          "name": "wineexec",
          "prefix": "$GAMEDIR"
        }
      },
      {
        "task": {
          "arch": "win64",
          "name": "winekill",
          "prefix": "$GAMEDIR"
        }
      },
      {
        "task": {
          "app": "vcrun2010 win7",
          "arch": "win64",
          "name": "winetricks",
          "prefix": "$GAMEDIR"
        }
      },
      {
        "task": {
          "arch": "win64",
          "args": "/LANG=English /SP- /SUPPRESSMSGBOXES",
          "executable": "goginstaller",
          "name": "wineexec",
          "prefix": "$GAMEDIR"
        }
      }
    ]
  },
  "content": "files:\n- goginstaller: N/A:Please select the GOG.com Windows installer\n- dx2010: https://lutris.net/files/tools/directx-2010.tar.gz\ngame:\n  arch: win64\n  exe: drive_c/GOG Games/Deadlight - Director's Cut/Binaries/Win64/LOTDGame.exe\n  prefix: $GAMEDIR\ninstaller:\n- extract:\n    dst: $CACHE/dxsetup\n    file: dx2010\n- task:\n    arch: win64\n    name: create_prefix\n    prefix: $GAMEDIR\n- task:\n    arch: win64\n    args: /silent\n    executable: $CACHE/dxsetup/DXSETUP.exe\n    name: wineexec\n    prefix: $GAMEDIR\n- task:\n    arch: win64\n    name: winekill\n    prefix: $GAMEDIR\n- task:\n    app: vcrun2010 win7\n    arch: win64\n    name: winetricks\n    prefix: $GAMEDIR\n- task:\n    arch: win64\n    args: /LANG=English /SP- /SUPPRESSMSGBOXES\n    executable: goginstaller\n    name: wineexec\n    prefix: $GAMEDIR\n"
}