{
  "id": 21899,
  "game_id": 36965,
  "game_slug": "star-control",
  "name": "Star Control",
  "year": null,
  "user": "ComodoDragon",
  "runner": "dosbox",
  "slug": "star-control-gog",
  "version": "GOG",
  "description": null,
  "notes": "",
  "created_at": "2020-06-23T21:56:49.250124Z",
  "updated_at": "2020-06-23T21:56:49.250149Z",
  "draft": true,
  "published": false,
  "published_by": null,
  "rating": "",
  "steamid": null,
  "gogid": 1207661663,
  "gogslug": "star_control",
  "humbleid": "",
  "humblestoreid": "",
  "humblestoreid_real": "",
  "script": {
    "files": [
      {
        "game": "N/A:Select GOG installer"
      },
      {
        "inno": "https://lutris.nyc3.digitaloceanspaces.com/tools/innoextract/innoextract-1.8-dev-2019-01-13-linux.tar.xz"
      }
    ],
    "game": {
      "main_file": "$GAMEDIR/starcontrol.conf"
    },
    "installer": [
      {
        "write_file": {
          "content": "#!/bin/bash\nsrc=$1\ndst=$2\nfind \"$src\" -maxdepth 1  -type f \\( -iname \"*.exe\" -o -iname \"scenario.*\" -o -iname \"*.PKG\" -o -iname \"*.ovl\"  \\) -exec cp {} \"$dst\" \\;",
          "file": "$CACHE/selectcopy.sh"
        }
      },
      {
        "chmodx": "$CACHE/selectcopy.sh"
      },
      {
        "extract": {
          "dst": "$CACHE",
          "file": "$inno"
        }
      },
      {
        "execute": {
          "args": "-d \"$CACHE\" \"$game\"",
          "file": "$CACHE/innoextract"
        }
      },
      {
        "execute": {
          "args": "$GAMEDIR/star",
          "file": "mkdir"
        }
      },
      {
        "copy": {
          "dst": "$GAMEDIR",
          "src": "$CACHE/app/manual.pdf"
        }
      },
      {
        "execute": {
          "args": "$CACHE/app  $GAMEDIR/star",
          "file": "$CACHE/selectcopy.sh"
        }
      },
      {
        "write_file": {
          "content": "[cpu]\ncore=dynamic\ncoretype=auto\ncycles=max\n[sdl]\nsensitivity=30\nfullresolution=desktop\nwindowresolution=original\nfullscreen=true\noutput=opengl\ncapture_mouse = onstart middlerelease\n[render]\naspect=true\nscaler=normal2x\n[autoexec]\nmount C \"$GAMEDIR\" -t dir\nc:\ncd star\ncls\nECHO OFF\ngoto launcher\n:launcher\ncls\nECHO  -------------------------------------------\nECHO                Star Control 1\nECHO  -------------------------------------------\nECHO   1) Played Game\nECHO   2) Setup\nECHO  -------------------------------------------\nECHO   3) Exit Program\nECHO  -------------------------------------------\n\nchoice /c123 /s Which program do you want to run? [1-3]: /n\nif errorlevel 3 goto exit\nif errorlevel 2 goto setup\nif errorlevel 1 goto game\n\n:game\ncls\nSTARCON\ngoto exit\n\n:setup\ncls\nkeys\ngoto launcher\n\n:exit\nexit\nexit",
          "file": "$GAMEDIR/starcontrol.conf"
        }
      }
    ]
  },
  "content": "files:\n- game: N/A:Select GOG installer\n- inno: https://lutris.nyc3.digitaloceanspaces.com/tools/innoextract/innoextract-1.8-dev-2019-01-13-linux.tar.xz\ngame:\n  main_file: $GAMEDIR/starcontrol.conf\ninstaller:\n- write_file:\n    content: '#!/bin/bash\n\n      src=$1\n\n      dst=$2\n\n      find \"$src\" -maxdepth 1  -type f \\( -iname \"*.exe\" -o -iname \"scenario.*\" -o\n      -iname \"*.PKG\" -o -iname \"*.ovl\"  \\) -exec cp {} \"$dst\" \\;'\n    file: $CACHE/selectcopy.sh\n- chmodx: $CACHE/selectcopy.sh\n- extract:\n    dst: $CACHE\n    file: $inno\n- execute:\n    args: -d \"$CACHE\" \"$game\"\n    file: $CACHE/innoextract\n- execute:\n    args: $GAMEDIR/star\n    file: mkdir\n- copy:\n    dst: $GAMEDIR\n    src: $CACHE/app/manual.pdf\n- execute:\n    args: $CACHE/app  $GAMEDIR/star\n    file: $CACHE/selectcopy.sh\n- write_file:\n    content: '[cpu]\n\n      core=dynamic\n\n      coretype=auto\n\n      cycles=max\n\n      [sdl]\n\n      sensitivity=30\n\n      fullresolution=desktop\n\n      windowresolution=original\n\n      fullscreen=true\n\n      output=opengl\n\n      capture_mouse = onstart middlerelease\n\n      [render]\n\n      aspect=true\n\n      scaler=normal2x\n\n      [autoexec]\n\n      mount C \"$GAMEDIR\" -t dir\n\n      c:\n\n      cd star\n\n      cls\n\n      ECHO OFF\n\n      goto launcher\n\n      :launcher\n\n      cls\n\n      ECHO  -------------------------------------------\n\n      ECHO                Star Control 1\n\n      ECHO  -------------------------------------------\n\n      ECHO   1) Played Game\n\n      ECHO   2) Setup\n\n      ECHO  -------------------------------------------\n\n      ECHO   3) Exit Program\n\n      ECHO  -------------------------------------------\n\n\n      choice /c123 /s Which program do you want to run? [1-3]: /n\n\n      if errorlevel 3 goto exit\n\n      if errorlevel 2 goto setup\n\n      if errorlevel 1 goto game\n\n\n      :game\n\n      cls\n\n      STARCON\n\n      goto exit\n\n\n      :setup\n\n      cls\n\n      keys\n\n      goto launcher\n\n\n      :exit\n\n      exit\n\n      exit'\n    file: $GAMEDIR/starcontrol.conf\n"
}