{
  "id": 14573,
  "game_id": 65,
  "game_slug": "darksiders",
  "name": "Darksiders",
  "year": 2010,
  "user": "edjaa84",
  "runner": "wine",
  "slug": "darksiders-change-me",
  "version": "Change Me",
  "description": "GOG versi√≥n para intel\r\n\r\nNivel: Gold",
  "notes": "",
  "created_at": "2019-07-15T01:58:12.394335Z",
  "updated_at": "2019-07-15T01:58:12.394366Z",
  "draft": false,
  "published": false,
  "published_by": null,
  "rating": "",
  "steamid": 50620,
  "gogid": null,
  "gogslug": "",
  "humblestoreid": "",
  "script": {
    "wines": {
      "xinput": true,
      "overrides": {
        "xinput1_3": "builtin",
        "dinput8": "native,builtin"
      }
    },
    "game": {
      "prefix": "$GAMEDIR/prefix"
    },
    "files": [
      {
        "game": "N/A:Select the Windows setup file downloaded from GOG"
      },
      {
        "x360ce_dinput8": "https://lutris.net/files/tools/x360ce-dinput8.tar.gz"
      },
      {
        "d3dcompiler_42": "http://download.game155.com/zip/d3dcompiler_42.dll.zip"
      }
    ],
    "installer": [
      {
        "extract": {
          "dst": "$GAMEDIR",
          "file": "x360ce_dinput8"
        }
      },
      {
        "extract": {
          "dst": "drive_c/windows/system32/",
          "file": "d3dcompiler_42"
        }
      },
      {
        "task": {
          "description": "Installing Quartz",
          "silent": true,
          "prefix": "$GAMEDIR/prefix",
          "app": "quartz",
          "name": "winetricks"
        }
      },
      {
        "task": {
          "description": "Installing devenum",
          "silent": true,
          "prefix": "$GAMEDIR/prefix",
          "app": "devenum",
          "name": "winetricks"
        }
      },
      {
        "task": {
          "description": "Installing Windows Media Player 9",
          "silent": true,
          "prefix": "$GAMEDIR/prefix",
          "app": "wmp9",
          "name": "winetricks"
        }
      },
      {
        "task": {
          "description": "Installing DirectX 9",
          "silent": true,
          "prefix": "$GAMEDIR/prefix",
          "app": "d3dx9",
          "name": "winetricks"
        }
      },
      {
        "task": {
          "description": "Installing amstream",
          "silent": true,
          "prefix": "$GAMEDIR/prefix",
          "app": "amstream",
          "name": "winetricks"
        }
      }
    ]
  },
  "content": "files:\n- game: N/A:Select the Windows setup file downloaded from GOG\n- x360ce_dinput8: https://lutris.net/files/tools/x360ce-dinput8.tar.gz\n- d3dcompiler_42: http://download.game155.com/zip/d3dcompiler_42.dll.zip\ngame:\n  prefix: $GAMEDIR/prefix\ninstaller:\n- extract:\n    dst: $GAMEDIR\n    file: x360ce_dinput8\n- extract:\n    dst: drive_c/windows/system32/\n    file: d3dcompiler_42\n- task:\n    app: quartz\n    description: Installing Quartz\n    name: winetricks\n    prefix: $GAMEDIR/prefix\n    silent: true\n- task:\n    app: devenum\n    description: Installing devenum\n    name: winetricks\n    prefix: $GAMEDIR/prefix\n    silent: true\n- task:\n    app: wmp9\n    description: Installing Windows Media Player 9\n    name: winetricks\n    prefix: $GAMEDIR/prefix\n    silent: true\n- task:\n    app: d3dx9\n    description: Installing DirectX 9\n    name: winetricks\n    prefix: $GAMEDIR/prefix\n    silent: true\n- task:\n    app: amstream\n    description: Installing amstream\n    name: winetricks\n    prefix: $GAMEDIR/prefix\n    silent: true\nwines:\n  overrides:\n    dinput8: native,builtin\n    xinput1_3: builtin\n  xinput: true\n"
}