{
  "id": 18893,
  "game_id": 65,
  "game_slug": "darksiders",
  "name": "Darksiders",
  "year": 2010,
  "user": "legluondunet",
  "runner": "wine",
  "slug": "darksiders-gog",
  "version": "GOG",
  "description": "This script will install \"Darksiders\" GOG edition with support for modern computer configuration.During install please let all options by default.Thanks to the people who helped us play this game in the best conditions.",
  "notes": "- Please report issue concerning this script on my Github page:\r\nhttps://github.com/legluondunet/MyLittleLutrisScripts/",
  "created_at": "2020-03-15T21:54:27.055000Z",
  "updated_at": "2020-03-16T09:42:43.304469Z",
  "draft": false,
  "published": false,
  "published_by": 20548,
  "rating": "",
  "steamid": 50620,
  "gogid": null,
  "gogslug": "",
  "humbleid": "",
  "humblestoreid": "",
  "humblestoreid_real": "",
  "script": {
    "custom-name": "Darksiders - GOG - Wine",
    "files": [
      {
        "inno": "http://constexpr.org/innoextract/files/snapshots/innoextract-1.8-dev-2019-01-13/innoextract-1.8-dev-2019-01-13-linux.tar.xz"
      },
      {
        "gog": "N/A:Select the installer downloaded from GOG"
      }
    ],
    "game": {
      "arch": "win64",
      "exe": "drive_c/Diablo Tchernobog/Tchernobog.exe",
      "name": "create_prefix",
      "prefix": "$GAMEDIR"
    },
    "installer": [
      {
        "task": {
          "arch": "win64",
          "description": "Creating WINE prefix",
          "install_gecko": false,
          "install_mono": false,
          "name": "create_prefix",
          "prefix": "$GAMEDIR"
        }
      },
      {
        "extract": {
          "dst": "$CACHE/innoextract",
          "file": "inno"
        }
      },
      {
        "execute": {
          "args": "--extract $gog --output-dir \"$GAMEDIR/drive_c/test\"",
          "file": "$CACHE/innoextract/innoextract"
        }
      },
      {
        "task": {
          "arch": "win64",
          "key": "background",
          "name": "set_regedit",
          "path": "HKEY_CURRENT_USER\\Control Panel\\Colors\\",
          "prefix": "$GAMEDIR",
          "type": "REG_SZ",
          "value": "0 0 0"
        }
      }
    ],
    "wine": {
      "Desktop": true
    }
  },
  "content": "custom-name: Darksiders - GOG - Wine\r\nfiles:\r\n- inno: http://constexpr.org/innoextract/files/snapshots/innoextract-1.8-dev-2019-01-13/innoextract-1.8-dev-2019-01-13-linux.tar.xz\r\n- gog: N/A:Select the installer downloaded from GOG\r\ngame:\r\n  arch: win64\r\n  exe: drive_c/Diablo Tchernobog/Tchernobog.exe\r\n  name: create_prefix\r\n  prefix: $GAMEDIR\r\ninstaller:\r\n- task:\r\n    arch: win64\r\n    description: Creating WINE prefix\r\n    install_gecko: false\r\n    install_mono: false\r\n    name: create_prefix\r\n    prefix: $GAMEDIR\r\n- extract:\r\n    dst: $CACHE/innoextract\r\n    file: inno\r\n- execute:\r\n    args: --extract $gog --output-dir \"$GAMEDIR/drive_c/test\"\r\n    file: $CACHE/innoextract/innoextract\r\n- task:\r\n    arch: win64\r\n    key: background\r\n    name: set_regedit\r\n    path: HKEY_CURRENT_USER\\Control Panel\\Colors\\\r\n    prefix: $GAMEDIR\r\n    type: REG_SZ\r\n    value: 0 0 0\r\nwine:\r\n  Desktop: true"
}