{
  "id": 1989,
  "game_id": 65,
  "game_slug": "darksiders",
  "name": "Darksiders",
  "year": 2010,
  "user": "strider",
  "runner": "winesteam",
  "slug": "darksiders-steam-xinput",
  "version": "Steam (xinput)",
  "description": "Uses koku-xinput-wine for full joypad support (including force feedback)",
  "notes": "",
  "created_at": "2016-02-25T10:32:12.617032Z",
  "updated_at": "2016-04-06T07:06:58.286184Z",
  "draft": false,
  "published": true,
  "published_by": null,
  "rating": "",
  "steamid": 50620,
  "gogid": null,
  "gogslug": "",
  "humblestoreid": "",
  "script": {
    "files": [
      {
        "x360ce_dinput8": "https://lutris.net/files/tools/x360ce-dinput8.tar.gz"
      }
    ],
    "game": {
      "appid": 50620,
      "prefix": "$GAMEDIR/prefix"
    },
    "winesteam": {
      "xinput": true,
      "overrides": {
        "dinput8": "native,builtin",
        "xinput1_3": "builtin"
      }
    },
    "installer": [
      {
        "extract": {
          "dst": "$GAMEDIR",
          "file": "x360ce_dinput8"
        }
      },
      {
        "task": {
          "silent": true,
          "description": "Installing Quartz",
          "name": "winetricks",
          "app": "quartz",
          "prefix": "$GAMEDIR/prefix"
        }
      },
      {
        "task": {
          "silent": true,
          "description": "Installing devenum",
          "name": "winetricks",
          "app": "devenum",
          "prefix": "$GAMEDIR/prefix"
        }
      },
      {
        "task": {
          "silent": true,
          "description": "Installing Windows Media Player 9",
          "name": "winetricks",
          "app": "wmp9",
          "prefix": "$GAMEDIR/prefix"
        }
      },
      {
        "task": {
          "silent": true,
          "description": "Installing DirectX 9",
          "name": "winetricks",
          "app": "directx9",
          "prefix": "$GAMEDIR/prefix"
        }
      }
    ]
  },
  "content": "files:\n- x360ce_dinput8: https://lutris.net/files/tools/x360ce-dinput8.tar.gz\ngame:\n  appid: 50620\n  prefix: $GAMEDIR/prefix\ninstaller:\n- extract:\n    dst: $GAMEDIR\n    file: x360ce_dinput8\n- task:\n    app: quartz\n    description: Installing Quartz\n    name: winetricks\n    prefix: $GAMEDIR/prefix\n    silent: true\n- task:\n    app: devenum\n    description: Installing devenum\n    name: winetricks\n    prefix: $GAMEDIR/prefix\n    silent: true\n- task:\n    app: wmp9\n    description: Installing Windows Media Player 9\n    name: winetricks\n    prefix: $GAMEDIR/prefix\n    silent: true\n- task:\n    app: directx9\n    description: Installing DirectX 9\n    name: winetricks\n    prefix: $GAMEDIR/prefix\n    silent: true\nwinesteam:\n  overrides:\n    dinput8: native,builtin\n    xinput1_3: builtin\n  xinput: true\n"
}