{
  "id": 9009,
  "game_id": 16262,
  "game_slug": "twitch-app",
  "name": "Twitch App",
  "year": 2017,
  "user": "cxf",
  "runner": "wine",
  "slug": "twitch-app-dotnet-48",
  "version": "Dotnet 4.8",
  "description": "This script should facilitate \"Twitch App\" install on Linux OS.\r\nDuring install, please let all options by default.",
  "notes": "- This script will automatically download the latest official Twitch App version.\r\n- This script will install Dotnet 4.8 necessary to activate some extra Twich App features.\r\n- Known issue: if Dotnet 4.8 never ending install, open a terminal and execute this command:\r\nkillall -9 explorer.exe services.exe plugplay.exe mscorsvw.exe winedevice.exe regedit.exe\r\nthen execute this another command:\r\nps aux |grep .exe\r\nto see if some wine processes are still active and kill them too.\r\nYou can still reinstall Dotnet 4.8 later using Winetricks inside Lutris (right click menu on Twitch icon).",
  "created_at": "2018-07-03T23:31:38.030000Z",
  "updated_at": "2020-06-11T21:02:19.178712Z",
  "draft": false,
  "published": true,
  "published_by": 494,
  "rating": "",
  "steamid": null,
  "gogid": null,
  "gogslug": "",
  "humbleid": "",
  "humblestoreid": "",
  "humblestoreid_real": "",
  "script": {
    "custom-name": "Twitch App - Wine",
    "files": [
      {
        "app": "https://desktop.twitchsvc.net/installer/windows/TwitchSetup.exe"
      }
    ],
    "game": {
      "arch": "win64",
      "exe": "drive_c/users/$USER/Start Menu/Programs/Twitch.lnk",
      "prefix": "$GAMEDIR"
    },
    "installer": [
      {
        "task": {
          "arch": "win64",
          "name": "create_prefix",
          "prefix": "$GAMEDIR"
        }
      },
      {
        "task": {
          "arch": "win64",
          "key": "background",
          "name": "set_regedit",
          "path": "HKEY_CURRENT_USER\\Control Panel\\Colors\\",
          "prefix": "$GAMEDIR",
          "type": "REG_SZ",
          "value": "0 0 0"
        }
      },
      {
        "task": {
          "args": "/desktop=TwitchApp,1024x780 \"$app\"",
          "description": "Installing Twitch App...",
          "executable": "$GAMEDIR/drive_c/windows/explorer.exe",
          "include_processes": "explorer.exe",
          "name": "wineexec",
          "prefix": "$GAMEDIR"
        }
      },
      {
        "task": {
          "app": "dotnet48",
          "description": "Installing Dotnet 4.8, could take a long time, 10-20 mn...",
          "name": "winetricks",
          "prefix": "$GAMEDIR"
        }
      },
      {
        "task": {
          "arch": "win64",
          "name": "winekill",
          "prefix": "$GAMEDIR"
        }
      }
    ],
    "wine": {
      "Desktop": true
    }
  },
  "content": "custom-name: Twitch App - Wine\nfiles:\n- app: https://desktop.twitchsvc.net/installer/windows/TwitchSetup.exe\ngame:\n  arch: win64\n  exe: drive_c/users/$USER/Start Menu/Programs/Twitch.lnk\n  prefix: $GAMEDIR\ninstaller:\n- task:\n    arch: win64\n    name: create_prefix\n    prefix: $GAMEDIR\n- task:\n    arch: win64\n    key: background\n    name: set_regedit\n    path: HKEY_CURRENT_USER\\Control Panel\\Colors\\\n    prefix: $GAMEDIR\n    type: REG_SZ\n    value: 0 0 0\n- task:\n    args: /desktop=TwitchApp,1024x780 \"$app\"\n    description: Installing Twitch App...\n    executable: $GAMEDIR/drive_c/windows/explorer.exe\n    include_processes: explorer.exe\n    name: wineexec\n    prefix: $GAMEDIR\n- task:\n    app: dotnet48\n    description: Installing Dotnet 4.8, could take a long time, 10-20 mn...\n    name: winetricks\n    prefix: $GAMEDIR\n- task:\n    arch: win64\n    name: winekill\n    prefix: $GAMEDIR\nwine:\n  Desktop: true\n"
}