{
  "id": 16359,
  "game_id": 16262,
  "game_slug": "twitch-app",
  "name": "Twitch App",
  "year": 2017,
  "user": "user11681",
  "runner": "wine",
  "slug": "twitch-app-change-me",
  "version": "Change Me",
  "description": null,
  "notes": "",
  "created_at": "2019-10-23T08:31:29.197766Z",
  "updated_at": "2019-10-23T08:31:29.197802Z",
  "draft": false,
  "published": false,
  "published_by": 19464,
  "rating": "",
  "steamid": null,
  "gogid": null,
  "gogslug": "",
  "humblestoreid": "",
  "script": {
    "system": {
      "terminal": true
    },
    "game": {
      "arch": "win64",
      "prefix": "$GAMEDIR",
      "exe": "drive_c/users/$USER/Application Data/Twitch/Bin/Twitch.exe"
    },
    "wine": {
      "version": "lutris-4.16-x86_64"
    },
    "files": [
      {
        "app": "https://desktop.twitchsvc.net/installer/windows/TwitchSetup.exe"
      }
    ],
    "installer": [
      {
        "task": {
          "arch": "win64",
          "prefix": "$GAMEDIR",
          "name": "create_prefix"
        }
      },
      {
        "task": {
          "prefix": "$GAMEDIR",
          "value": "Y",
          "arch": "win64",
          "path": "HKEY_CURRENT_USER\\Software\\Wine",
          "key": "ShowDotFiles",
          "name": "set_regedit"
        }
      },
      {
        "task": {
          "arch": "win64",
          "prefix": "$GAMEDIR",
          "description": "Installing .NET 4.8 will take a while...",
          "name": "winetricks",
          "app": "dotnet48"
        }
      },
      {
        "task": {
          "arch": "win64",
          "prefix": "$GAMEDIR",
          "description": "Setting Windows to Win10",
          "name": "winetricks",
          "app": "win10"
        }
      },
      {
        "task": {
          "prefix": "$GAMEDIR",
          "executable": "app",
          "args": "/silent",
          "arch": "win64",
          "exclude_processes": "mscorsvw.exe Twitch.exe TwitchUI.exe",
          "name": "wineexec"
        }
      },
      {
        "task": {
          "prefix": "$GAMEDIR",
          "name": "winekill"
        }
      },
      {
        "write_file": {
          "content": "{\"closeOption\": \"close\"}",
          "file": "$GAMEDIR/drive_c/users/$USER/Application Data/Twitch/ElectronSettings.json"
        }
      }
    ]
  },
  "content": "files:\n- app: https://desktop.twitchsvc.net/installer/windows/TwitchSetup.exe\ngame:\n  arch: win64\n  exe: drive_c/users/$USER/Application Data/Twitch/Bin/Twitch.exe\n  prefix: $GAMEDIR\ninstaller:\n- task:\n    arch: win64\n    name: create_prefix\n    prefix: $GAMEDIR\n- task:\n    arch: win64\n    key: ShowDotFiles\n    name: set_regedit\n    path: HKEY_CURRENT_USER\\Software\\Wine\n    prefix: $GAMEDIR\n    value: Y\n- task:\n    app: dotnet48\n    arch: win64\n    description: Installing .NET 4.8 will take a while...\n    name: winetricks\n    prefix: $GAMEDIR\n- task:\n    app: win10\n    arch: win64\n    description: Setting Windows to Win10\n    name: winetricks\n    prefix: $GAMEDIR\n- task:\n    arch: win64\n    args: /silent\n    exclude_processes: mscorsvw.exe Twitch.exe TwitchUI.exe\n    executable: app\n    name: wineexec\n    prefix: $GAMEDIR\n- task:\n    name: winekill\n    prefix: $GAMEDIR\n- write_file:\n    content: '{\"closeOption\": \"close\"}'\n    file: $GAMEDIR/drive_c/users/$USER/Application Data/Twitch/ElectronSettings.json\nsystem:\n  terminal: true\nwine:\n  version: lutris-4.16-x86_64\n"
}