{
  "id": 9009,
  "game_id": 16262,
  "game_slug": "twitch-app",
  "name": "Twitch App",
  "year": 2017,
  "user": "cxf",
  "runner": "wine",
  "slug": "twitch-app-latest",
  "version": "Latest",
  "description": null,
  "notes": "",
  "created_at": "2018-07-03T23:31:38.030000Z",
  "updated_at": "2020-01-23T02:57:15.692865Z",
  "draft": false,
  "published": true,
  "published_by": 20548,
  "rating": "",
  "steamid": null,
  "gogid": null,
  "gogslug": "",
  "humblestoreid": "",
  "script": {
    "game": {
      "exe": "drive_c/users/$USER/Application Data/Twitch/Bin/Twitch.exe",
      "arch": "win32",
      "prefix": "$GAMEDIR"
    },
    "system": {
      "terminal": true
    },
    "installer": [
      {
        "task": {
          "arch": "win32",
          "prefix": "$GAMEDIR",
          "name": "create_prefix"
        }
      },
      {
        "task": {
          "arch": "win32",
          "prefix": "$GAMEDIR",
          "name": "set_regedit",
          "path": "HKEY_CURRENT_USER\\Software\\Wine",
          "value": "Y",
          "key": "ShowDotFiles"
        }
      },
      {
        "task": {
          "app": "dotnet48",
          "arch": "win32",
          "description": "Installing .NET 4.8 will take a while...",
          "prefix": "$GAMEDIR",
          "name": "winetricks"
        }
      },
      {
        "task": {
          "app": "win10",
          "arch": "win32",
          "description": "Setting Windows to Win10",
          "prefix": "$GAMEDIR",
          "name": "winetricks"
        }
      },
      {
        "task": {
          "executable": "app",
          "arch": "win32",
          "prefix": "$GAMEDIR",
          "args": "/silent",
          "name": "wineexec",
          "exclude_processes": "mscorsvw.exe Twitch.exe TwitchUI.exe"
        }
      },
      {
        "task": {
          "prefix": "$GAMEDIR",
          "name": "winekill"
        }
      },
      {
        "write_file": {
          "content": "{\"closeOption\": \"close\"}",
          "file": "$GAMEDIR/drive_c/users/$USER/Application Data/Twitch/ElectronSettings.json"
        }
      }
    ],
    "files": [
      {
        "app": "https://desktop.twitchsvc.net/installer/windows/TwitchSetup.exe"
      }
    ]
  },
  "content": "files:\n- app: https://desktop.twitchsvc.net/installer/windows/TwitchSetup.exe\ngame:\n  arch: win32\n  exe: drive_c/users/$USER/Application Data/Twitch/Bin/Twitch.exe\n  prefix: $GAMEDIR\ninstaller:\n- task:\n    arch: win32\n    name: create_prefix\n    prefix: $GAMEDIR\n- task:\n    arch: win32\n    key: ShowDotFiles\n    name: set_regedit\n    path: HKEY_CURRENT_USER\\Software\\Wine\n    prefix: $GAMEDIR\n    value: Y\n- task:\n    app: dotnet48\n    arch: win32\n    description: Installing .NET 4.8 will take a while...\n    name: winetricks\n    prefix: $GAMEDIR\n- task:\n    app: win10\n    arch: win32\n    description: Setting Windows to Win10\n    name: winetricks\n    prefix: $GAMEDIR\n- task:\n    arch: win32\n    args: /silent\n    exclude_processes: mscorsvw.exe Twitch.exe TwitchUI.exe\n    executable: app\n    name: wineexec\n    prefix: $GAMEDIR\n- task:\n    name: winekill\n    prefix: $GAMEDIR\n- write_file:\n    content: '{\"closeOption\": \"close\"}'\n    file: $GAMEDIR/drive_c/users/$USER/Application Data/Twitch/ElectronSettings.json\nsystem:\n  terminal: true\n"
}