{
  "id": 9009,
  "game_id": 16262,
  "game_slug": "twitch-app",
  "name": "Twitch App",
  "year": 2017,
  "user": "cxf",
  "runner": "wine",
  "slug": "twitch-app-lgdn",
  "version": "LGDN",
  "description": "This script will facilitate \"Twitch App\" install on Linux OS.\r\nDuring install, please let all options by default.",
  "notes": "- This script will automatically download the latest official Twitch App version.\r\n- Known issue: if Dotnet 4.8 never ending install, open a terminal and execute this command:\r\nkillall -9 explorer.exe services.exe plugplay.exe mscorsvw.exe winedevice.exe regedit.exe\r\nThen you can still reinstall it later using Winetricks.",
  "created_at": "2018-07-03T23:31:38.030000Z",
  "updated_at": "2020-04-25T14:30:23.414030Z",
  "draft": false,
  "published": true,
  "published_by": 494,
  "rating": "",
  "steamid": null,
  "gogid": null,
  "gogslug": "",
  "humblestoreid": "",
  "script": {
    "custom-name": "Twitch App - Wine",
    "files": [
      {
        "app": "https://desktop.twitchsvc.net/installer/windows/TwitchSetup.exe"
      }
    ],
    "game": {
      "prefix": "$GAMEDIR",
      "exe": "drive_c/users/$USER/Start Menu/Programs/Twitch.lnk",
      "arch": "win64"
    },
    "wine": {
      "Desktop": true
    },
    "installer": [
      {
        "task": {
          "prefix": "$GAMEDIR",
          "arch": "win64",
          "name": "create_prefix"
        }
      },
      {
        "task": {
          "arch": "win64",
          "name": "set_regedit",
          "key": "background",
          "prefix": "$GAMEDIR",
          "value": "0 0 0",
          "path": "HKEY_CURRENT_USER\\Control Panel\\Colors\\",
          "type": "REG_SZ"
        }
      },
      {
        "task": {
          "name": "wineexec",
          "description": "Installing Twitch App...",
          "args": "/desktop=TwitchApp,1024x780 \"$app\"",
          "prefix": "$GAMEDIR",
          "include_processes": "explorer.exe",
          "executable": "$GAMEDIR/drive_c/windows/explorer.exe"
        }
      },
      {
        "task": {
          "prefix": "$GAMEDIR",
          "app": "dotnet48",
          "description": "Installing Dotnet 4.8, could take a long time, 10-20 mn...",
          "name": "winetricks"
        }
      },
      {
        "task": {
          "prefix": "$GAMEDIR",
          "arch": "win64",
          "name": "winekill"
        }
      }
    ]
  },
  "content": "custom-name: Twitch App - Wine\nfiles:\n- app: https://desktop.twitchsvc.net/installer/windows/TwitchSetup.exe\ngame:\n  arch: win64\n  exe: drive_c/users/$USER/Start Menu/Programs/Twitch.lnk\n  prefix: $GAMEDIR\ninstaller:\n- task:\n    arch: win64\n    name: create_prefix\n    prefix: $GAMEDIR\n- task:\n    arch: win64\n    key: background\n    name: set_regedit\n    path: HKEY_CURRENT_USER\\Control Panel\\Colors\\\n    prefix: $GAMEDIR\n    type: REG_SZ\n    value: 0 0 0\n- task:\n    args: /desktop=TwitchApp,1024x780 \"$app\"\n    description: Installing Twitch App...\n    executable: $GAMEDIR/drive_c/windows/explorer.exe\n    include_processes: explorer.exe\n    name: wineexec\n    prefix: $GAMEDIR\n- task:\n    app: dotnet48\n    description: Installing Dotnet 4.8, could take a long time, 10-20 mn...\n    name: winetricks\n    prefix: $GAMEDIR\n- task:\n    arch: win64\n    name: winekill\n    prefix: $GAMEDIR\nwine:\n  Desktop: true\n"
}