{
  "id": 12205,
  "game_id": 7156,
  "game_slug": "far-cry-primal",
  "name": "Far Cry Primal",
  "year": 2016,
  "user": "ThunderBoyU",
  "runner": "wine",
  "slug": "far-cry-primal-uplay",
  "version": "Uplay",
  "description": "Only installs Uplay you must install Far Cry Primal manually.",
  "notes": "",
  "created_at": "2019-02-28T13:01:33.656000Z",
  "updated_at": "2020-01-31T02:38:35.971579Z",
  "draft": false,
  "published": true,
  "published_by": 1,
  "rating": "",
  "steamid": 371660,
  "gogid": null,
  "gogslug": "",
  "humblestoreid": "",
  "script": {
    "files": [
      {
        "dx2010": "https://lutris.net/files/tools/directx-2010.tar.gz"
      },
      {
        "uplay": "https://ubistatic3-a.akamaihd.net/orbit/launcher_installer/UplayInstaller.exe"
      }
    ],
    "game": {
      "args": "-skipintro",
      "arch": "win64",
      "exe": "drive_c/Program Files (x86)/Ubisoft/Ubisoft Game Launcher/Uplay.exe",
      "prefix": "$GAMEDIR"
    },
    "winesteam": {
      "dxvk": true,
      "esync": true
    },
    "installer": [
      {
        "task": {
          "prefix": "$GAMEDIR",
          "name": "create_prefix",
          "arch": "win64"
        }
      },
      {
        "input_menu": {
          "options": [
            {
              "#dxgi.nvapiHack = False": "AMD"
            },
            {
              "dxgi.nvapiHack = False": "Nvidia"
            }
          ],
          "description": "Choose your GPU:",
          "preselect": "#dxgi.nvapiHack = False",
          "id": "GPU"
        }
      },
      {
        "write_file": {
          "content": "$INPUT_GPU",
          "file": "$GAMEDIR/dxvk.conf"
        }
      },
      {
        "extract": {
          "dst": "$CACHE/dxsetup",
          "file": "dx2010"
        }
      },
      {
        "task": {
          "args": "/silent",
          "name": "wineexec",
          "arch": "win64",
          "executable": "$CACHE/dxsetup/DXSETUP.exe",
          "prefix": "$GAMEDIR"
        }
      },
      {
        "task": {
          "prefix": "$GAMEDIR",
          "name": "winetricks",
          "arch": "win64",
          "app": "vcrun2010 vcrun2012 corefonts"
        }
      },
      {
        "task": {
          "description": "Please be patient while we install .NET 4.7.2",
          "name": "winetricks",
          "arch": "win64",
          "app": "dotnet472 win7",
          "prefix": "$GAMEDIR"
        }
      },
      {
        "task": {
          "args": "/S",
          "name": "wineexec",
          "arch": "win64",
          "executable": "uplay",
          "prefix": "$GAMEDIR"
        }
      },
      {
        "task": {
          "prefix": "$GAMEDIR",
          "name": "winekill",
          "arch": "win64"
        }
      }
    ],
    "system": {
      "disable_runtime": false,
      "env": {
        "DXVK_CONFIG_FILE": "$GAMEDIR/dxvk.conf",
        "DXVK_HUD": 0
      }
    }
  },
  "content": "files:\n- dx2010: https://lutris.net/files/tools/directx-2010.tar.gz\n- uplay: https://ubistatic3-a.akamaihd.net/orbit/launcher_installer/UplayInstaller.exe\ngame:\n  arch: win64\n  args: -skipintro\n  exe: drive_c/Program Files (x86)/Ubisoft/Ubisoft Game Launcher/Uplay.exe\n  prefix: $GAMEDIR\ninstaller:\n- task:\n    arch: win64\n    name: create_prefix\n    prefix: $GAMEDIR\n- input_menu:\n    description: 'Choose your GPU:'\n    id: GPU\n    options:\n    - '#dxgi.nvapiHack = False': AMD\n    - dxgi.nvapiHack = False: Nvidia\n    preselect: '#dxgi.nvapiHack = False'\n- write_file:\n    content: $INPUT_GPU\n    file: $GAMEDIR/dxvk.conf\n- extract:\n    dst: $CACHE/dxsetup\n    file: dx2010\n- task:\n    arch: win64\n    args: /silent\n    executable: $CACHE/dxsetup/DXSETUP.exe\n    name: wineexec\n    prefix: $GAMEDIR\n- task:\n    app: vcrun2010 vcrun2012 corefonts\n    arch: win64\n    name: winetricks\n    prefix: $GAMEDIR\n- task:\n    app: dotnet472 win7\n    arch: win64\n    description: Please be patient while we install .NET 4.7.2\n    name: winetricks\n    prefix: $GAMEDIR\n- task:\n    arch: win64\n    args: /S\n    executable: uplay\n    name: wineexec\n    prefix: $GAMEDIR\n- task:\n    arch: win64\n    name: winekill\n    prefix: $GAMEDIR\nsystem:\n  disable_runtime: false\n  env:\n    DXVK_CONFIG_FILE: $GAMEDIR/dxvk.conf\n    DXVK_HUD: 0\nwinesteam:\n  dxvk: true\n  esync: true\n"
}