{
  "id": 11889,
  "game_id": 274,
  "game_slug": "limbo",
  "name": "LIMBO",
  "year": 2011,
  "user": "cxf",
  "runner": "wine",
  "slug": "limbo-gog",
  "version": "GOG",
  "description": null,
  "notes": "",
  "created_at": "2019-02-07T00:21:26.070000Z",
  "updated_at": "2019-10-23T21:00:57.140581Z",
  "draft": false,
  "published": true,
  "published_by": 1465,
  "rating": "",
  "steamid": 48000,
  "gogid": 1724299977,
  "gogslug": "limbo",
  "humblestoreid": "",
  "script": {
    "files": [
      {
        "goginstaller": "N/A:Please select the GOG.com Windows installer"
      },
      {
        "dx2010": "https://lutris.net/files/tools/directx-2010.tar.gz"
      }
    ],
    "game": {
      "prefix": "$GAMEDIR",
      "exe": "drive_c/GOG Games/LIMBO/limbo.exe",
      "arch": "win64"
    },
    "installer": [
      {
        "extract": {
          "file": "dx2010",
          "dst": "$CACHE/dxsetup"
        }
      },
      {
        "task": {
          "prefix": "$GAMEDIR",
          "arch": "win64",
          "name": "create_prefix"
        }
      },
      {
        "task": {
          "prefix": "$GAMEDIR",
          "arch": "win64",
          "executable": "$CACHE/dxsetup/DXSETUP.exe",
          "name": "wineexec",
          "args": "/silent"
        }
      },
      {
        "task": {
          "prefix": "$GAMEDIR",
          "arch": "win64",
          "name": "winekill"
        }
      },
      {
        "task": {
          "prefix": "$GAMEDIR",
          "arch": "win64",
          "executable": "goginstaller",
          "name": "wineexec",
          "args": "/LANG=English /SP- /SUPPRESSMSGBOXES"
        }
      }
    ]
  },
  "content": "files:\n- goginstaller: N/A:Please select the GOG.com Windows installer\n- dx2010: https://lutris.net/files/tools/directx-2010.tar.gz\ngame:\n  arch: win64\n  exe: drive_c/GOG Games/LIMBO/limbo.exe\n  prefix: $GAMEDIR\ninstaller:\n- extract:\n    dst: $CACHE/dxsetup\n    file: dx2010\n- task:\n    arch: win64\n    name: create_prefix\n    prefix: $GAMEDIR\n- task:\n    arch: win64\n    args: /silent\n    executable: $CACHE/dxsetup/DXSETUP.exe\n    name: wineexec\n    prefix: $GAMEDIR\n- task:\n    arch: win64\n    name: winekill\n    prefix: $GAMEDIR\n- task:\n    arch: win64\n    args: /LANG=English /SP- /SUPPRESSMSGBOXES\n    executable: goginstaller\n    name: wineexec\n    prefix: $GAMEDIR\n"
}