{
  "id": 10178,
  "game_id": 21730,
  "game_slug": "perfect-world-level-up",
  "name": "Perfect World - Level Up!",
  "year": 2005,
  "user": "vinikira",
  "runner": "wine",
  "slug": "perfect-world-level-up-dx9toopengl",
  "version": "DX9ToOpenGL",
  "description": "Perfect World Level Up Games!\r\nBefore run the script, get the file installer in this page (web or torrent version): http://perfectworld.uol.com.br/download and then select when installer ask for him.\r\nAfter installation finish, make sure that the checkbox \"Launch game now\" is unchecked, an only run the game when lutris scripts finish.",
  "notes": "",
  "created_at": "2018-09-13T20:19:04.800000Z",
  "updated_at": "2018-09-17T07:57:35.339768Z",
  "draft": false,
  "published": true,
  "published_by": null,
  "rating": "",
  "steamid": null,
  "gogid": null,
  "gogslug": "",
  "humblestoreid": "",
  "script": {
    "system": {
      "env": {
        "MESA_GLTHREAD": "true",
        "__GL_THREADED_OPTIMIZATIONS": "1"
      }
    },
    "game": {
      "arch": "win32",
      "prefix": "$GAMEDIR",
      "working_dir": "$GAMEDIR",
      "exe": "$GAMEDIR/Level Up/Perfect World/launcher/Launcher.exe"
    },
    "wine": {
      "version": "esync-3.15-x86_64"
    },
    "files": [
      {
        "pw_installer": "N/A:Select the game's setup file"
      }
    ],
    "installer": [
      {
        "task": {
          "arch": "win32",
          "prefix": "$GAMEDIR",
          "name": "create_prefix"
        }
      },
      {
        "task": {
          "prefix": "$GAMEDIR",
          "executable": "pw_installer",
          "description": "Running Perfect World Installer.",
          "args": "--mode unattended",
          "arch": "win32",
          "name": "wineexec"
        }
      },
      {
        "task": {
          "prefix": "$GAMEDIR",
          "description": "Installing Internet Explorer 8",
          "app": "ie8",
          "arch": "win32",
          "name": "winetricks",
          "silent": true
        }
      },
      {
        "task": {
          "prefix": "$GAMEDIR",
          "description": "Installing DirectX 9",
          "app": "d3dx9",
          "arch": "win32",
          "name": "winetricks",
          "silent": true
        }
      },
      {
        "task": {
          "prefix": "$GAMEDIR",
          "description": "Installing tahoma font",
          "app": "tahoma",
          "arch": "win32",
          "name": "winetricks",
          "silent": true
        }
      },
      {
        "task": {
          "prefix": "$GAMEDIR",
          "description": "Installing corefonts",
          "app": "corefonts",
          "arch": "win32",
          "name": "winetricks",
          "silent": true
        }
      },
      {
        "task": {
          "prefix": "$GAMEDIR",
          "description": "Installing vb6run",
          "app": "vb6run",
          "arch": "win32",
          "name": "winetricks",
          "silent": true
        }
      },
      {
        "task": {
          "prefix": "$GAMEDIR",
          "description": "Installing VCRUN2005",
          "app": "vcrun2005",
          "arch": "win32",
          "name": "winetricks",
          "silent": true
        }
      },
      {
        "task": {
          "prefix": "$GAMEDIR",
          "description": "Installing VCRUN2008",
          "app": "vcrun2008",
          "arch": "win32",
          "name": "winetricks",
          "silent": true
        }
      },
      {
        "task": {
          "arch": "win32",
          "prefix": "$GAMEDIR",
          "description": "Installing xact",
          "name": "winetricks",
          "app": "xact"
        }
      },
      {
        "task": {
          "arch": "win32",
          "prefix": "$GAMEDIR",
          "description": "Installing dinput",
          "name": "winetricks",
          "app": "dinput"
        }
      },
      {
        "task": {
          "arch": "win32",
          "prefix": "$GAMEDIR",
          "description": "Installing vcrun6",
          "name": "winetricks",
          "app": "vcrun6"
        }
      },
      {
        "task": {
          "prefix": "$GAMEDIR",
          "description": "OpenGL Renderer",
          "value": "opengl",
          "arch": "win32",
          "path": "HKEY_CURRENT_USER\\Software\\Wine\\Direct3D",
          "key": "DirectDrawRenderer",
          "name": "set_regedit"
        }
      },
      {
        "task": {
          "description": "Adding DLL Overrides",
          "value": "native,builtin",
          "arch": "win32",
          "path": "HKEY_CURRENT_USER\\Software\\Wine\\DllOverrides",
          "key": "*atl80",
          "name": "set_regedit"
        }
      },
      {
        "task": {
          "description": "Adding DLL Overrides",
          "value": "native,builtin",
          "arch": "win32",
          "path": "HKEY_CURRENT_USER\\Software\\Wine\\DllOverrides",
          "key": "*atl90",
          "name": "set_regedit"
        }
      },
      {
        "task": {
          "description": "Adding DLL Overrides",
          "value": "native",
          "arch": "win32",
          "path": "HKEY_CURRENT_USER\\Software\\Wine\\DllOverrides",
          "key": "*d3dx9_24",
          "name": "set_regedit"
        }
      },
      {
        "task": {
          "description": "Adding DLL Overrides",
          "value": "native",
          "arch": "win32",
          "path": "HKEY_CURRENT_USER\\Software\\Wine\\DllOverrides",
          "key": "*d3dx9_25",
          "name": "set_regedit"
        }
      },
      {
        "task": {
          "description": "Adding DLL Overrides",
          "value": "native",
          "arch": "win32",
          "path": "HKEY_CURRENT_USER\\Software\\Wine\\DllOverrides",
          "key": "*d3dx9_26",
          "name": "set_regedit"
        }
      },
      {
        "task": {
          "description": "Adding DLL Overrides",
          "value": "native",
          "arch": "win32",
          "path": "HKEY_CURRENT_USER\\Software\\Wine\\DllOverrides",
          "key": "*d3dx9_27",
          "name": "set_regedit"
        }
      },
      {
        "task": {
          "description": "Adding DLL Overrides",
          "value": "native",
          "arch": "win32",
          "path": "HKEY_CURRENT_USER\\Software\\Wine\\DllOverrides",
          "key": "*d3dx9_28",
          "name": "set_regedit"
        }
      },
      {
        "task": {
          "description": "Adding DLL Overrides",
          "value": "native",
          "arch": "win32",
          "path": "HKEY_CURRENT_USER\\Software\\Wine\\DllOverrides",
          "key": "*d3dx9_29",
          "name": "set_regedit"
        }
      },
      {
        "task": {
          "description": "Adding DLL Overrides",
          "value": "native",
          "arch": "win32",
          "path": "HKEY_CURRENT_USER\\Software\\Wine\\DllOverrides",
          "key": "*d3dx9_30",
          "name": "set_regedit"
        }
      },
      {
        "task": {
          "description": "Adding DLL Overrides",
          "value": "native",
          "arch": "win32",
          "path": "HKEY_CURRENT_USER\\Software\\Wine\\DllOverrides",
          "key": "*d3dx9_31",
          "name": "set_regedit"
        }
      },
      {
        "task": {
          "description": "Adding DLL Overrides",
          "value": "native",
          "arch": "win32",
          "path": "HKEY_CURRENT_USER\\Software\\Wine\\DllOverrides",
          "key": "*d3dx9_32",
          "name": "set_regedit"
        }
      },
      {
        "task": {
          "description": "Adding DLL Overrides",
          "value": "native",
          "arch": "win32",
          "path": "HKEY_CURRENT_USER\\Software\\Wine\\DllOverrides",
          "key": "*d3dx9_33",
          "name": "set_regedit"
        }
      },
      {
        "task": {
          "description": "Adding DLL Overrides",
          "value": "native",
          "arch": "win32",
          "path": "HKEY_CURRENT_USER\\Software\\Wine\\DllOverrides",
          "key": "*d3dx9_34",
          "name": "set_regedit"
        }
      },
      {
        "task": {
          "description": "Adding DLL Overrides",
          "value": "native",
          "arch": "win32",
          "path": "HKEY_CURRENT_USER\\Software\\Wine\\DllOverrides",
          "key": "*d3dx9_35",
          "name": "set_regedit"
        }
      },
      {
        "task": {
          "description": "Adding DLL Overrides",
          "value": "native",
          "arch": "win32",
          "path": "HKEY_CURRENT_USER\\Software\\Wine\\DllOverrides",
          "key": "*d3dx9_36",
          "name": "set_regedit"
        }
      },
      {
        "task": {
          "description": "Adding DLL Overrides",
          "value": "native",
          "arch": "win32",
          "path": "HKEY_CURRENT_USER\\Software\\Wine\\DllOverrides",
          "key": "*d3dx9_37",
          "name": "set_regedit"
        }
      },
      {
        "task": {
          "description": "Adding DLL Overrides",
          "value": "native",
          "arch": "win32",
          "path": "HKEY_CURRENT_USER\\Software\\Wine\\DllOverrides",
          "key": "*d3dx9_38",
          "name": "set_regedit"
        }
      },
      {
        "task": {
          "description": "Adding DLL Overrides",
          "value": "native",
          "arch": "win32",
          "path": "HKEY_CURRENT_USER\\Software\\Wine\\DllOverrides",
          "key": "*d3dx9_39",
          "name": "set_regedit"
        }
      },
      {
        "task": {
          "description": "Adding DLL Overrides",
          "value": "native",
          "arch": "win32",
          "path": "HKEY_CURRENT_USER\\Software\\Wine\\DllOverrides",
          "key": "*d3dx9_40",
          "name": "set_regedit"
        }
      },
      {
        "task": {
          "description": "Adding DLL Overrides",
          "value": "native",
          "arch": "win32",
          "path": "HKEY_CURRENT_USER\\Software\\Wine\\DllOverrides",
          "key": "*d3dx9_41",
          "name": "set_regedit"
        }
      },
      {
        "task": {
          "description": "Adding DLL Overrides",
          "value": "native",
          "arch": "win32",
          "path": "HKEY_CURRENT_USER\\Software\\Wine\\DllOverrides",
          "key": "*d3dx9_42",
          "name": "set_regedit"
        }
      },
      {
        "task": {
          "description": "Adding DLL Overrides",
          "value": "native",
          "arch": "win32",
          "path": "HKEY_CURRENT_USER\\Software\\Wine\\DllOverrides",
          "key": "*d3dx9_43",
          "name": "set_regedit"
        }
      },
      {
        "task": {
          "description": "Adding DLL Overrides",
          "value": "native",
          "arch": "win32",
          "path": "HKEY_CURRENT_USER\\Software\\Wine\\DllOverrides",
          "key": "*dinput",
          "name": "set_regedit"
        }
      },
      {
        "task": {
          "description": "Adding DLL Overrides",
          "value": "native",
          "arch": "win32",
          "path": "HKEY_CURRENT_USER\\Software\\Wine\\DllOverrides",
          "key": "*d3dx9_43",
          "name": "set_regedit"
        }
      },
      {
        "task": {
          "description": "Adding DLL Overrides",
          "value": "native",
          "arch": "win32",
          "path": "HKEY_CURRENT_USER\\Software\\Wine\\DllOverrides",
          "key": "*iexplorer.exe",
          "name": "set_regedit"
        }
      },
      {
        "task": {
          "description": "Adding DLL Overrides",
          "value": "native,builtin",
          "arch": "win32",
          "path": "HKEY_CURRENT_USER\\Software\\Wine\\DllOverrides",
          "key": "*itircl",
          "name": "set_regedit"
        }
      },
      {
        "task": {
          "description": "Adding DLL Overrides",
          "value": "native,builtin",
          "arch": "win32",
          "path": "HKEY_CURRENT_USER\\Software\\Wine\\DllOverrides",
          "key": "*itss",
          "name": "set_regedit"
        }
      },
      {
        "task": {
          "description": "Adding DLL Overrides",
          "value": "native,builtin",
          "arch": "win32",
          "path": "HKEY_CURRENT_USER\\Software\\Wine\\DllOverrides",
          "key": "*jscript",
          "name": "set_regedit"
        }
      },
      {
        "task": {
          "description": "Adding DLL Overrides",
          "value": "native,builtin",
          "arch": "win32",
          "path": "HKEY_CURRENT_USER\\Software\\Wine\\DllOverrides",
          "key": "*msctf",
          "name": "set_regedit"
        }
      },
      {
        "task": {
          "description": "Adding DLL Overrides",
          "value": "native,builtin",
          "arch": "win32",
          "path": "HKEY_CURRENT_USER\\Software\\Wine\\DllOverrides",
          "key": "*mshtml",
          "name": "set_regedit"
        }
      },
      {
        "task": {
          "description": "Adding DLL Overrides",
          "value": "native,builtin",
          "arch": "win32",
          "path": "HKEY_CURRENT_USER\\Software\\Wine\\DllOverrides",
          "key": "*msvcm80",
          "name": "set_regedit"
        }
      },
      {
        "task": {
          "description": "Adding DLL Overrides",
          "value": "native,builtin",
          "arch": "win32",
          "path": "HKEY_CURRENT_USER\\Software\\Wine\\DllOverrides",
          "key": "*msvcm90",
          "name": "set_regedit"
        }
      },
      {
        "task": {
          "description": "Adding DLL Overrides",
          "value": "native,builtin",
          "arch": "win32",
          "path": "HKEY_CURRENT_USER\\Software\\Wine\\DllOverrides",
          "key": "*msvcp80",
          "name": "set_regedit"
        }
      },
      {
        "task": {
          "description": "Adding DLL Overrides",
          "value": "native,builtin",
          "arch": "win32",
          "path": "HKEY_CURRENT_USER\\Software\\Wine\\DllOverrides",
          "key": "*msvcp90",
          "name": "set_regedit"
        }
      },
      {
        "task": {
          "description": "Adding DLL Overrides",
          "value": "native,builtin",
          "arch": "win32",
          "path": "HKEY_CURRENT_USER\\Software\\Wine\\DllOverrides",
          "key": "*msvcr80",
          "name": "set_regedit"
        }
      },
      {
        "task": {
          "description": "Adding DLL Overrides",
          "value": "native,builtin",
          "arch": "win32",
          "path": "HKEY_CURRENT_USER\\Software\\Wine\\DllOverrides",
          "key": "*msvcr90",
          "name": "set_regedit"
        }
      },
      {
        "task": {
          "description": "Adding DLL Overrides",
          "value": "native,builtin",
          "arch": "win32",
          "path": "HKEY_CURRENT_USER\\Software\\Wine\\DllOverrides",
          "key": "*shdoclc",
          "name": "set_regedit"
        }
      },
      {
        "task": {
          "description": "Adding DLL Overrides",
          "value": "native,builtin",
          "arch": "win32",
          "path": "HKEY_CURRENT_USER\\Software\\Wine\\DllOverrides",
          "key": "*shdocvw",
          "name": "set_regedit"
        }
      },
      {
        "task": {
          "description": "Adding DLL Overrides",
          "value": "native,builtin",
          "arch": "win32",
          "path": "HKEY_CURRENT_USER\\Software\\Wine\\DllOverrides",
          "key": "*shlwapi",
          "name": "set_regedit"
        }
      },
      {
        "task": {
          "description": "Adding DLL Overrides",
          "value": "builtin",
          "arch": "win32",
          "path": "HKEY_CURRENT_USER\\Software\\Wine\\DllOverrides",
          "key": "*updspapi",
          "name": "set_regedit"
        }
      },
      {
        "task": {
          "description": "Adding DLL Overrides",
          "value": "native,builtin",
          "arch": "win32",
          "path": "HKEY_CURRENT_USER\\Software\\Wine\\DllOverrides",
          "key": "*urlmon",
          "name": "set_regedit"
        }
      },
      {
        "task": {
          "description": "Adding DLL Overrides",
          "value": "native,builtin",
          "arch": "win32",
          "path": "HKEY_CURRENT_USER\\Software\\Wine\\DllOverrides",
          "key": "*vcomp",
          "name": "set_regedit"
        }
      },
      {
        "task": {
          "description": "Adding DLL Overrides",
          "value": "native,builtin",
          "arch": "win32",
          "path": "HKEY_CURRENT_USER\\Software\\Wine\\DllOverrides",
          "key": "*vcomp90",
          "name": "set_regedit"
        }
      },
      {
        "task": {
          "description": "Adding DLL Overrides",
          "value": "native,builtin",
          "arch": "win32",
          "path": "HKEY_CURRENT_USER\\Software\\Wine\\DllOverrides",
          "key": "*wininet",
          "name": "set_regedit"
        }
      },
      {
        "task": {
          "description": "Adding DLL Overrides",
          "value": "native,builtin",
          "arch": "win32",
          "path": "HKEY_CURRENT_USER\\Software\\Wine\\DllOverrides",
          "key": "*x3daudio1_0",
          "name": "set_regedit"
        }
      },
      {
        "task": {
          "description": "Adding DLL Overrides",
          "value": "native,builtin",
          "arch": "win32",
          "path": "HKEY_CURRENT_USER\\Software\\Wine\\DllOverrides",
          "key": "*x3daudio1_1",
          "name": "set_regedit"
        }
      },
      {
        "task": {
          "description": "Adding DLL Overrides",
          "value": "native,builtin",
          "arch": "win32",
          "path": "HKEY_CURRENT_USER\\Software\\Wine\\DllOverrides",
          "key": "*x3daudio1_2",
          "name": "set_regedit"
        }
      },
      {
        "task": {
          "description": "Adding DLL Overrides",
          "value": "native,builtin",
          "arch": "win32",
          "path": "HKEY_CURRENT_USER\\Software\\Wine\\DllOverrides",
          "key": "*x3daudio1_3",
          "name": "set_regedit"
        }
      },
      {
        "task": {
          "description": "Adding DLL Overrides",
          "value": "native,builtin",
          "arch": "win32",
          "path": "HKEY_CURRENT_USER\\Software\\Wine\\DllOverrides",
          "key": "*x3daudio1_4",
          "name": "set_regedit"
        }
      },
      {
        "task": {
          "description": "Adding DLL Overrides",
          "value": "native,builtin",
          "arch": "win32",
          "path": "HKEY_CURRENT_USER\\Software\\Wine\\DllOverrides",
          "key": "*x3daudio1_5",
          "name": "set_regedit"
        }
      },
      {
        "task": {
          "description": "Adding DLL Overrides",
          "value": "native,builtin",
          "arch": "win32",
          "path": "HKEY_CURRENT_USER\\Software\\Wine\\DllOverrides",
          "key": "*x3daudio1_6",
          "name": "set_regedit"
        }
      },
      {
        "task": {
          "description": "Adding DLL Overrides",
          "value": "native,builtin",
          "arch": "win32",
          "path": "HKEY_CURRENT_USER\\Software\\Wine\\DllOverrides",
          "key": "*x3daudio1_7",
          "name": "set_regedit"
        }
      },
      {
        "task": {
          "description": "Adding DLL Overrides",
          "value": "native,builtin",
          "arch": "win32",
          "path": "HKEY_CURRENT_USER\\Software\\Wine\\DllOverrides",
          "key": "*xapofx1_1",
          "name": "set_regedit"
        }
      },
      {
        "task": {
          "description": "Adding DLL Overrides",
          "value": "native,builtin",
          "arch": "win32",
          "path": "HKEY_CURRENT_USER\\Software\\Wine\\DllOverrides",
          "key": "*xapofx1_2",
          "name": "set_regedit"
        }
      },
      {
        "task": {
          "description": "Adding DLL Overrides",
          "value": "native,builtin",
          "arch": "win32",
          "path": "HKEY_CURRENT_USER\\Software\\Wine\\DllOverrides",
          "key": "*xapofx1_3",
          "name": "set_regedit"
        }
      },
      {
        "task": {
          "description": "Adding DLL Overrides",
          "value": "native,builtin",
          "arch": "win32",
          "path": "HKEY_CURRENT_USER\\Software\\Wine\\DllOverrides",
          "key": "*xapofx1_4",
          "name": "set_regedit"
        }
      },
      {
        "task": {
          "description": "Adding DLL Overrides",
          "value": "native,builtin",
          "arch": "win32",
          "path": "HKEY_CURRENT_USER\\Software\\Wine\\DllOverrides",
          "key": "*xapofx1_5",
          "name": "set_regedit"
        }
      },
      {
        "task": {
          "description": "Adding DLL Overrides",
          "value": "native,builtin",
          "arch": "win32",
          "path": "HKEY_CURRENT_USER\\Software\\Wine\\DllOverrides",
          "key": "*xaudio2_0",
          "name": "set_regedit"
        }
      },
      {
        "task": {
          "description": "Adding DLL Overrides",
          "value": "native,builtin",
          "arch": "win32",
          "path": "HKEY_CURRENT_USER\\Software\\Wine\\DllOverrides",
          "key": "*xaudio2_2",
          "name": "set_regedit"
        }
      },
      {
        "task": {
          "description": "Adding DLL Overrides",
          "value": "native,builtin",
          "arch": "win32",
          "path": "HKEY_CURRENT_USER\\Software\\Wine\\DllOverrides",
          "key": "*xaudio2_3",
          "name": "set_regedit"
        }
      },
      {
        "task": {
          "description": "Adding DLL Overrides",
          "value": "native,builtin",
          "arch": "win32",
          "path": "HKEY_CURRENT_USER\\Software\\Wine\\DllOverrides",
          "key": "*xaudio2_4",
          "name": "set_regedit"
        }
      },
      {
        "task": {
          "description": "Adding DLL Overrides",
          "value": "native,builtin",
          "arch": "win32",
          "path": "HKEY_CURRENT_USER\\Software\\Wine\\DllOverrides",
          "key": "*xaudio2_5",
          "name": "set_regedit"
        }
      },
      {
        "task": {
          "description": "Adding DLL Overrides",
          "value": "native,builtin",
          "arch": "win32",
          "path": "HKEY_CURRENT_USER\\Software\\Wine\\DllOverrides",
          "key": "*xaudio2_6",
          "name": "set_regedit"
        }
      },
      {
        "task": {
          "description": "Adding DLL Overrides",
          "value": "native,builtin",
          "arch": "win32",
          "path": "HKEY_CURRENT_USER\\Software\\Wine\\DllOverrides",
          "key": "*xaudio2_7",
          "name": "set_regedit"
        }
      },
      {
        "task": {
          "description": "Adding DLL Overrides",
          "value": "native,builtin",
          "arch": "win32",
          "path": "HKEY_CURRENT_USER\\Software\\Wine\\DllOverrides",
          "key": "*xmllite",
          "name": "set_regedit"
        }
      },
      {
        "task": {
          "prefix": "$GAMEDIR",
          "description": "Setting Windows version to Windows 7",
          "app": "win7",
          "arch": "win32",
          "name": "winetricks",
          "silent": true
        }
      }
    ]
  },
  "content": "files:\n- pw_installer: N/A:Select the game's setup file\ngame:\n  arch: win32\n  exe: $GAMEDIR/Level Up/Perfect World/launcher/Launcher.exe\n  prefix: $GAMEDIR\n  working_dir: $GAMEDIR\ninstaller:\n- task:\n    arch: win32\n    name: create_prefix\n    prefix: $GAMEDIR\n- task:\n    arch: win32\n    args: --mode unattended\n    description: Running Perfect World Installer.\n    executable: pw_installer\n    name: wineexec\n    prefix: $GAMEDIR\n- task:\n    app: ie8\n    arch: win32\n    description: Installing Internet Explorer 8\n    name: winetricks\n    prefix: $GAMEDIR\n    silent: true\n- task:\n    app: d3dx9\n    arch: win32\n    description: Installing DirectX 9\n    name: winetricks\n    prefix: $GAMEDIR\n    silent: true\n- task:\n    app: tahoma\n    arch: win32\n    description: Installing tahoma font\n    name: winetricks\n    prefix: $GAMEDIR\n    silent: true\n- task:\n    app: corefonts\n    arch: win32\n    description: Installing corefonts\n    name: winetricks\n    prefix: $GAMEDIR\n    silent: true\n- task:\n    app: vb6run\n    arch: win32\n    description: Installing vb6run\n    name: winetricks\n    prefix: $GAMEDIR\n    silent: true\n- task:\n    app: vcrun2005\n    arch: win32\n    description: Installing VCRUN2005\n    name: winetricks\n    prefix: $GAMEDIR\n    silent: true\n- task:\n    app: vcrun2008\n    arch: win32\n    description: Installing VCRUN2008\n    name: winetricks\n    prefix: $GAMEDIR\n    silent: true\n- task:\n    app: xact\n    arch: win32\n    description: Installing xact\n    name: winetricks\n    prefix: $GAMEDIR\n- task:\n    app: dinput\n    arch: win32\n    description: Installing dinput\n    name: winetricks\n    prefix: $GAMEDIR\n- task:\n    app: vcrun6\n    arch: win32\n    description: Installing vcrun6\n    name: winetricks\n    prefix: $GAMEDIR\n- task:\n    arch: win32\n    description: OpenGL Renderer\n    key: DirectDrawRenderer\n    name: set_regedit\n    path: HKEY_CURRENT_USER\\Software\\Wine\\Direct3D\n    prefix: $GAMEDIR\n    value: opengl\n- task:\n    arch: win32\n    description: Adding DLL Overrides\n    key: '*atl80'\n    name: set_regedit\n    path: HKEY_CURRENT_USER\\Software\\Wine\\DllOverrides\n    value: native,builtin\n- task:\n    arch: win32\n    description: Adding DLL Overrides\n    key: '*atl90'\n    name: set_regedit\n    path: HKEY_CURRENT_USER\\Software\\Wine\\DllOverrides\n    value: native,builtin\n- task:\n    arch: win32\n    description: Adding DLL Overrides\n    key: '*d3dx9_24'\n    name: set_regedit\n    path: HKEY_CURRENT_USER\\Software\\Wine\\DllOverrides\n    value: native\n- task:\n    arch: win32\n    description: Adding DLL Overrides\n    key: '*d3dx9_25'\n    name: set_regedit\n    path: HKEY_CURRENT_USER\\Software\\Wine\\DllOverrides\n    value: native\n- task:\n    arch: win32\n    description: Adding DLL Overrides\n    key: '*d3dx9_26'\n    name: set_regedit\n    path: HKEY_CURRENT_USER\\Software\\Wine\\DllOverrides\n    value: native\n- task:\n    arch: win32\n    description: Adding DLL Overrides\n    key: '*d3dx9_27'\n    name: set_regedit\n    path: HKEY_CURRENT_USER\\Software\\Wine\\DllOverrides\n    value: native\n- task:\n    arch: win32\n    description: Adding DLL Overrides\n    key: '*d3dx9_28'\n    name: set_regedit\n    path: HKEY_CURRENT_USER\\Software\\Wine\\DllOverrides\n    value: native\n- task:\n    arch: win32\n    description: Adding DLL Overrides\n    key: '*d3dx9_29'\n    name: set_regedit\n    path: HKEY_CURRENT_USER\\Software\\Wine\\DllOverrides\n    value: native\n- task:\n    arch: win32\n    description: Adding DLL Overrides\n    key: '*d3dx9_30'\n    name: set_regedit\n    path: HKEY_CURRENT_USER\\Software\\Wine\\DllOverrides\n    value: native\n- task:\n    arch: win32\n    description: Adding DLL Overrides\n    key: '*d3dx9_31'\n    name: set_regedit\n    path: HKEY_CURRENT_USER\\Software\\Wine\\DllOverrides\n    value: native\n- task:\n    arch: win32\n    description: Adding DLL Overrides\n    key: '*d3dx9_32'\n    name: set_regedit\n    path: HKEY_CURRENT_USER\\Software\\Wine\\DllOverrides\n    value: native\n- task:\n    arch: win32\n    description: Adding DLL Overrides\n    key: '*d3dx9_33'\n    name: set_regedit\n    path: HKEY_CURRENT_USER\\Software\\Wine\\DllOverrides\n    value: native\n- task:\n    arch: win32\n    description: Adding DLL Overrides\n    key: '*d3dx9_34'\n    name: set_regedit\n    path: HKEY_CURRENT_USER\\Software\\Wine\\DllOverrides\n    value: native\n- task:\n    arch: win32\n    description: Adding DLL Overrides\n    key: '*d3dx9_35'\n    name: set_regedit\n    path: HKEY_CURRENT_USER\\Software\\Wine\\DllOverrides\n    value: native\n- task:\n    arch: win32\n    description: Adding DLL Overrides\n    key: '*d3dx9_36'\n    name: set_regedit\n    path: HKEY_CURRENT_USER\\Software\\Wine\\DllOverrides\n    value: native\n- task:\n    arch: win32\n    description: Adding DLL Overrides\n    key: '*d3dx9_37'\n    name: set_regedit\n    path: HKEY_CURRENT_USER\\Software\\Wine\\DllOverrides\n    value: native\n- task:\n    arch: win32\n    description: Adding DLL Overrides\n    key: '*d3dx9_38'\n    name: set_regedit\n    path: HKEY_CURRENT_USER\\Software\\Wine\\DllOverrides\n    value: native\n- task:\n    arch: win32\n    description: Adding DLL Overrides\n    key: '*d3dx9_39'\n    name: set_regedit\n    path: HKEY_CURRENT_USER\\Software\\Wine\\DllOverrides\n    value: native\n- task:\n    arch: win32\n    description: Adding DLL Overrides\n    key: '*d3dx9_40'\n    name: set_regedit\n    path: HKEY_CURRENT_USER\\Software\\Wine\\DllOverrides\n    value: native\n- task:\n    arch: win32\n    description: Adding DLL Overrides\n    key: '*d3dx9_41'\n    name: set_regedit\n    path: HKEY_CURRENT_USER\\Software\\Wine\\DllOverrides\n    value: native\n- task:\n    arch: win32\n    description: Adding DLL Overrides\n    key: '*d3dx9_42'\n    name: set_regedit\n    path: HKEY_CURRENT_USER\\Software\\Wine\\DllOverrides\n    value: native\n- task:\n    arch: win32\n    description: Adding DLL Overrides\n    key: '*d3dx9_43'\n    name: set_regedit\n    path: HKEY_CURRENT_USER\\Software\\Wine\\DllOverrides\n    value: native\n- task:\n    arch: win32\n    description: Adding DLL Overrides\n    key: '*dinput'\n    name: set_regedit\n    path: HKEY_CURRENT_USER\\Software\\Wine\\DllOverrides\n    value: native\n- task:\n    arch: win32\n    description: Adding DLL Overrides\n    key: '*d3dx9_43'\n    name: set_regedit\n    path: HKEY_CURRENT_USER\\Software\\Wine\\DllOverrides\n    value: native\n- task:\n    arch: win32\n    description: Adding DLL Overrides\n    key: '*iexplorer.exe'\n    name: set_regedit\n    path: HKEY_CURRENT_USER\\Software\\Wine\\DllOverrides\n    value: native\n- task:\n    arch: win32\n    description: Adding DLL Overrides\n    key: '*itircl'\n    name: set_regedit\n    path: HKEY_CURRENT_USER\\Software\\Wine\\DllOverrides\n    value: native,builtin\n- task:\n    arch: win32\n    description: Adding DLL Overrides\n    key: '*itss'\n    name: set_regedit\n    path: HKEY_CURRENT_USER\\Software\\Wine\\DllOverrides\n    value: native,builtin\n- task:\n    arch: win32\n    description: Adding DLL Overrides\n    key: '*jscript'\n    name: set_regedit\n    path: HKEY_CURRENT_USER\\Software\\Wine\\DllOverrides\n    value: native,builtin\n- task:\n    arch: win32\n    description: Adding DLL Overrides\n    key: '*msctf'\n    name: set_regedit\n    path: HKEY_CURRENT_USER\\Software\\Wine\\DllOverrides\n    value: native,builtin\n- task:\n    arch: win32\n    description: Adding DLL Overrides\n    key: '*mshtml'\n    name: set_regedit\n    path: HKEY_CURRENT_USER\\Software\\Wine\\DllOverrides\n    value: native,builtin\n- task:\n    arch: win32\n    description: Adding DLL Overrides\n    key: '*msvcm80'\n    name: set_regedit\n    path: HKEY_CURRENT_USER\\Software\\Wine\\DllOverrides\n    value: native,builtin\n- task:\n    arch: win32\n    description: Adding DLL Overrides\n    key: '*msvcm90'\n    name: set_regedit\n    path: HKEY_CURRENT_USER\\Software\\Wine\\DllOverrides\n    value: native,builtin\n- task:\n    arch: win32\n    description: Adding DLL Overrides\n    key: '*msvcp80'\n    name: set_regedit\n    path: HKEY_CURRENT_USER\\Software\\Wine\\DllOverrides\n    value: native,builtin\n- task:\n    arch: win32\n    description: Adding DLL Overrides\n    key: '*msvcp90'\n    name: set_regedit\n    path: HKEY_CURRENT_USER\\Software\\Wine\\DllOverrides\n    value: native,builtin\n- task:\n    arch: win32\n    description: Adding DLL Overrides\n    key: '*msvcr80'\n    name: set_regedit\n    path: HKEY_CURRENT_USER\\Software\\Wine\\DllOverrides\n    value: native,builtin\n- task:\n    arch: win32\n    description: Adding DLL Overrides\n    key: '*msvcr90'\n    name: set_regedit\n    path: HKEY_CURRENT_USER\\Software\\Wine\\DllOverrides\n    value: native,builtin\n- task:\n    arch: win32\n    description: Adding DLL Overrides\n    key: '*shdoclc'\n    name: set_regedit\n    path: HKEY_CURRENT_USER\\Software\\Wine\\DllOverrides\n    value: native,builtin\n- task:\n    arch: win32\n    description: Adding DLL Overrides\n    key: '*shdocvw'\n    name: set_regedit\n    path: HKEY_CURRENT_USER\\Software\\Wine\\DllOverrides\n    value: native,builtin\n- task:\n    arch: win32\n    description: Adding DLL Overrides\n    key: '*shlwapi'\n    name: set_regedit\n    path: HKEY_CURRENT_USER\\Software\\Wine\\DllOverrides\n    value: native,builtin\n- task:\n    arch: win32\n    description: Adding DLL Overrides\n    key: '*updspapi'\n    name: set_regedit\n    path: HKEY_CURRENT_USER\\Software\\Wine\\DllOverrides\n    value: builtin\n- task:\n    arch: win32\n    description: Adding DLL Overrides\n    key: '*urlmon'\n    name: set_regedit\n    path: HKEY_CURRENT_USER\\Software\\Wine\\DllOverrides\n    value: native,builtin\n- task:\n    arch: win32\n    description: Adding DLL Overrides\n    key: '*vcomp'\n    name: set_regedit\n    path: HKEY_CURRENT_USER\\Software\\Wine\\DllOverrides\n    value: native,builtin\n- task:\n    arch: win32\n    description: Adding DLL Overrides\n    key: '*vcomp90'\n    name: set_regedit\n    path: HKEY_CURRENT_USER\\Software\\Wine\\DllOverrides\n    value: native,builtin\n- task:\n    arch: win32\n    description: Adding DLL Overrides\n    key: '*wininet'\n    name: set_regedit\n    path: HKEY_CURRENT_USER\\Software\\Wine\\DllOverrides\n    value: native,builtin\n- task:\n    arch: win32\n    description: Adding DLL Overrides\n    key: '*x3daudio1_0'\n    name: set_regedit\n    path: HKEY_CURRENT_USER\\Software\\Wine\\DllOverrides\n    value: native,builtin\n- task:\n    arch: win32\n    description: Adding DLL Overrides\n    key: '*x3daudio1_1'\n    name: set_regedit\n    path: HKEY_CURRENT_USER\\Software\\Wine\\DllOverrides\n    value: native,builtin\n- task:\n    arch: win32\n    description: Adding DLL Overrides\n    key: '*x3daudio1_2'\n    name: set_regedit\n    path: HKEY_CURRENT_USER\\Software\\Wine\\DllOverrides\n    value: native,builtin\n- task:\n    arch: win32\n    description: Adding DLL Overrides\n    key: '*x3daudio1_3'\n    name: set_regedit\n    path: HKEY_CURRENT_USER\\Software\\Wine\\DllOverrides\n    value: native,builtin\n- task:\n    arch: win32\n    description: Adding DLL Overrides\n    key: '*x3daudio1_4'\n    name: set_regedit\n    path: HKEY_CURRENT_USER\\Software\\Wine\\DllOverrides\n    value: native,builtin\n- task:\n    arch: win32\n    description: Adding DLL Overrides\n    key: '*x3daudio1_5'\n    name: set_regedit\n    path: HKEY_CURRENT_USER\\Software\\Wine\\DllOverrides\n    value: native,builtin\n- task:\n    arch: win32\n    description: Adding DLL Overrides\n    key: '*x3daudio1_6'\n    name: set_regedit\n    path: HKEY_CURRENT_USER\\Software\\Wine\\DllOverrides\n    value: native,builtin\n- task:\n    arch: win32\n    description: Adding DLL Overrides\n    key: '*x3daudio1_7'\n    name: set_regedit\n    path: HKEY_CURRENT_USER\\Software\\Wine\\DllOverrides\n    value: native,builtin\n- task:\n    arch: win32\n    description: Adding DLL Overrides\n    key: '*xapofx1_1'\n    name: set_regedit\n    path: HKEY_CURRENT_USER\\Software\\Wine\\DllOverrides\n    value: native,builtin\n- task:\n    arch: win32\n    description: Adding DLL Overrides\n    key: '*xapofx1_2'\n    name: set_regedit\n    path: HKEY_CURRENT_USER\\Software\\Wine\\DllOverrides\n    value: native,builtin\n- task:\n    arch: win32\n    description: Adding DLL Overrides\n    key: '*xapofx1_3'\n    name: set_regedit\n    path: HKEY_CURRENT_USER\\Software\\Wine\\DllOverrides\n    value: native,builtin\n- task:\n    arch: win32\n    description: Adding DLL Overrides\n    key: '*xapofx1_4'\n    name: set_regedit\n    path: HKEY_CURRENT_USER\\Software\\Wine\\DllOverrides\n    value: native,builtin\n- task:\n    arch: win32\n    description: Adding DLL Overrides\n    key: '*xapofx1_5'\n    name: set_regedit\n    path: HKEY_CURRENT_USER\\Software\\Wine\\DllOverrides\n    value: native,builtin\n- task:\n    arch: win32\n    description: Adding DLL Overrides\n    key: '*xaudio2_0'\n    name: set_regedit\n    path: HKEY_CURRENT_USER\\Software\\Wine\\DllOverrides\n    value: native,builtin\n- task:\n    arch: win32\n    description: Adding DLL Overrides\n    key: '*xaudio2_2'\n    name: set_regedit\n    path: HKEY_CURRENT_USER\\Software\\Wine\\DllOverrides\n    value: native,builtin\n- task:\n    arch: win32\n    description: Adding DLL Overrides\n    key: '*xaudio2_3'\n    name: set_regedit\n    path: HKEY_CURRENT_USER\\Software\\Wine\\DllOverrides\n    value: native,builtin\n- task:\n    arch: win32\n    description: Adding DLL Overrides\n    key: '*xaudio2_4'\n    name: set_regedit\n    path: HKEY_CURRENT_USER\\Software\\Wine\\DllOverrides\n    value: native,builtin\n- task:\n    arch: win32\n    description: Adding DLL Overrides\n    key: '*xaudio2_5'\n    name: set_regedit\n    path: HKEY_CURRENT_USER\\Software\\Wine\\DllOverrides\n    value: native,builtin\n- task:\n    arch: win32\n    description: Adding DLL Overrides\n    key: '*xaudio2_6'\n    name: set_regedit\n    path: HKEY_CURRENT_USER\\Software\\Wine\\DllOverrides\n    value: native,builtin\n- task:\n    arch: win32\n    description: Adding DLL Overrides\n    key: '*xaudio2_7'\n    name: set_regedit\n    path: HKEY_CURRENT_USER\\Software\\Wine\\DllOverrides\n    value: native,builtin\n- task:\n    arch: win32\n    description: Adding DLL Overrides\n    key: '*xmllite'\n    name: set_regedit\n    path: HKEY_CURRENT_USER\\Software\\Wine\\DllOverrides\n    value: native,builtin\n- task:\n    app: win7\n    arch: win32\n    description: Setting Windows version to Windows 7\n    name: winetricks\n    prefix: $GAMEDIR\n    silent: true\nsystem:\n  env:\n    MESA_GLTHREAD: 'true'\n    __GL_THREADED_OPTIMIZATIONS: '1'\nwine:\n  version: esync-3.15-x86_64\n"
}