{
  "id": 9225,
  "game_id": 1509,
  "game_slug": "sins-of-a-solar-empire-rebellion",
  "name": "Sins of a Solar Empire: Rebellion",
  "year": 2012,
  "user": "VortexAcherontic",
  "runner": "winesteam",
  "slug": "sins-of-a-solar-empire-rebell-steam",
  "version": "Steam",
  "description": null,
  "notes": "!ATTENTION! After installation:\r\n1) Set option: \"Do not launch game, only open Steam\"\r\n2) Run the prefix\r\n3) Right click your prefix and select \"Run EXE inside prefix\"\r\n4) Select \"Sins of a Solar Empire Rebellion.exe\"\r\n\r\nCurrently I'm searching a way to bypass the StardockLauncher\r\nYou can fiddle around with the Steam Launch Option: \"/nolauncher\" did not worked for me yet.\r\n\r\nIf any First Time Setups fail on your system configuration you can skip them by killing the install task. All dependencies are installed by this installer.",
  "created_at": "2018-07-15T17:52:20.629000Z",
  "updated_at": "2018-11-18T17:12:42.393364Z",
  "draft": false,
  "published": true,
  "published_by": 1,
  "rating": "",
  "steamid": 204880,
  "gogid": null,
  "gogslug": "",
  "humblestoreid": "",
  "script": {
    "game": {
      "prefix": "$GAMEDIR/prefix",
      "appid": 204880,
      "arch": "win32"
    },
    "winesteam": {
      "version": "staging-2.0-i386"
    },
    "installer": [
      {
        "task": {
          "description": "Creating Wine Prefix",
          "prefix": "$GAMEDIR/prefix",
          "arch": "win32",
          "name": "create_prefix"
        }
      },
      {
        "task": {
          "description": "Changeing to Windows XP",
          "arch": "win32",
          "prefix": "$GAMEDIR/prefix",
          "name": "winetricks",
          "app": "winxp"
        }
      },
      {
        "task": {
          "description": "Installing Direct X 9",
          "arch": "win32",
          "prefix": "$GAMEDIR/prefix",
          "name": "winetricks",
          "app": "d3dx9_43"
        }
      },
      {
        "task": {
          "description": "Installing Visual C++ 2012",
          "arch": "win32",
          "prefix": "$GAMEDIR/prefix",
          "name": "winetricks",
          "app": "vcrun2012"
        }
      },
      {
        "task": {
          "description": "Installing Dot.NET 4.0",
          "arch": "win32",
          "prefix": "$GAMEDIR/prefix",
          "name": "winetricks",
          "app": "dotnet40"
        }
      }
    ]
  },
  "content": "game:\n  appid: 204880\n  arch: win32\n  prefix: $GAMEDIR/prefix\ninstaller:\n- task:\n    arch: win32\n    description: Creating Wine Prefix\n    name: create_prefix\n    prefix: $GAMEDIR/prefix\n- task:\n    app: winxp\n    arch: win32\n    description: Changeing to Windows XP\n    name: winetricks\n    prefix: $GAMEDIR/prefix\n- task:\n    app: d3dx9_43\n    arch: win32\n    description: Installing Direct X 9\n    name: winetricks\n    prefix: $GAMEDIR/prefix\n- task:\n    app: vcrun2012\n    arch: win32\n    description: Installing Visual C++ 2012\n    name: winetricks\n    prefix: $GAMEDIR/prefix\n- task:\n    app: dotnet40\n    arch: win32\n    description: Installing Dot.NET 4.0\n    name: winetricks\n    prefix: $GAMEDIR/prefix\nwinesteam:\n  version: staging-2.0-i386\n"
}