{
  "id": 18032,
  "game_id": 29770,
  "game_slug": "legends-of-runeterra",
  "name": "Legends of Runeterra",
  "year": 2020,
  "user": "jeffw387",
  "runner": "wine",
  "slug": "legends-of-runeterra-current",
  "version": "Current",
  "description": "# Authors: @ptkdev, @Wereii, @Graff",
  "notes": "Run: sudo sh -c 'echo 0 > /proc/sys/abi/vsyscall32'",
  "created_at": "2020-01-24T04:20:55.108867Z",
  "updated_at": "2020-01-24T04:20:55.108894Z",
  "draft": true,
  "published": false,
  "published_by": null,
  "rating": "",
  "steamid": null,
  "gogid": null,
  "gogslug": "",
  "humblestoreid": "",
  "script": {
    "script": {
      "files": [
        {
          "lor_installer": "https://bacon.secure.dyn.riotcdn.net/channels/public/x/installer/current/live.exe"
        }
      ],
      "installer": [
        {
          "task": {
            "arch": "win64",
            "description": "Creating Wine prefix",
            "prefix": "$GAMEDIR",
            "name": "create_prefix"
          }
        },
        {
          "task": {
            "arch": "win64",
            "executable": "lor_installer",
            "description": "Installing Legends of Runeterra",
            "prefix": "$GAMEDIR",
            "name": "wineexec"
          }
        }
      ],
      "system": {
        "disable_compositor": true
      },
      "wine": {
        "MouseWarpOverride": "disable",
        "dxvk": true,
        "version": "lutris-lol-5.0-x86_64"
      },
      "game": {
        "args": "--launch-product=bacon --launch-patchline=live",
        "prefix": "$GAMEDIR",
        "exe": "$GAMEDIR/drive_c/Riot Games/Riot Client/RiotClientServices.exe"
      }
    }
  },
  "content": "script:\n  files:\n  - lor_installer: https://bacon.secure.dyn.riotcdn.net/channels/public/x/installer/current/live.exe\n  game:\n    args: --launch-product=bacon --launch-patchline=live\n    exe: $GAMEDIR/drive_c/Riot Games/Riot Client/RiotClientServices.exe\n    prefix: $GAMEDIR\n  installer:\n  - task:\n      arch: win64\n      description: Creating Wine prefix\n      name: create_prefix\n      prefix: $GAMEDIR\n  - task:\n      arch: win64\n      description: Installing Legends of Runeterra\n      executable: lor_installer\n      name: wineexec\n      prefix: $GAMEDIR\n  system:\n    disable_compositor: true\n  wine:\n    MouseWarpOverride: disable\n    dxvk: true\n    version: lutris-lol-5.0-x86_64\n"
}