{
  "id": 11439,
  "game_id": 1698,
  "game_slug": "ys-ii",
  "name": "Ys II",
  "year": 2013,
  "user": "striker.sh",
  "runner": "wine",
  "slug": "ys-ii-gog",
  "version": "GOG",
  "description": null,
  "notes": "run  wineboot -u in the WINEPREFIX if not you won't have video support",
  "created_at": "2019-01-04T22:56:03.714000Z",
  "updated_at": "2019-01-05T06:56:56.677200Z",
  "draft": false,
  "published": true,
  "published_by": 19464,
  "rating": "",
  "steamid": 223870,
  "gogid": null,
  "gogslug": "",
  "humblestoreid": "",
  "script": {
    "game": {
      "exe": "drive_c/GOG Games/Ys II/ys2plus.exe",
      "prefix": "$GAMEDIR"
    },
    "files": [
      {
        "game": "N/A:Select the Ys II installer provided by GOG."
      }
    ],
    "wine": {
      "overrides": {
        "winegstreamer": "disabled"
      }
    },
    "installer": [
      {
        "task": {
          "prefix": "$GAMEDIR",
          "executable": "game",
          "name": "wineexec",
          "args": "/SILENT /SUPPRESSMSGBOXES /NOGUI"
        }
      },
      {
        "task": {
          "description": "Setting Windows version to XP",
          "prefix": "$GAMEDIR",
          "app": "winxp",
          "name": "winetricks"
        }
      },
      {
        "task": {
          "description": "installing quartz",
          "prefix": "$GAMEDIR",
          "app": "quartz",
          "name": "winetricks"
        }
      },
      {
        "task": {
          "description": "installing amstream",
          "prefix": "$GAMEDIR",
          "app": "amstream",
          "name": "winetricks"
        }
      },
      {
        "task": {
          "prefix": "$GAMEDIR",
          "name": "winekill"
        }
      }
    ]
  },
  "content": "files:\n- game: N/A:Select the Ys II installer provided by GOG.\ngame:\n  exe: drive_c/GOG Games/Ys II/ys2plus.exe\n  prefix: $GAMEDIR\ninstaller:\n- task:\n    args: /SILENT /SUPPRESSMSGBOXES /NOGUI\n    executable: game\n    name: wineexec\n    prefix: $GAMEDIR\n- task:\n    app: winxp\n    description: Setting Windows version to XP\n    name: winetricks\n    prefix: $GAMEDIR\n- task:\n    app: quartz\n    description: installing quartz\n    name: winetricks\n    prefix: $GAMEDIR\n- task:\n    app: amstream\n    description: installing amstream\n    name: winetricks\n    prefix: $GAMEDIR\n- task:\n    name: winekill\n    prefix: $GAMEDIR\nwine:\n  overrides:\n    winegstreamer: disabled\n"
}