{
  "id": 2485,
  "game_id": 7200,
  "game_slug": "gangsters-organized-crime",
  "name": "Gangsters: Organized Crime",
  "year": 1998,
  "user": "ssf",
  "runner": "wine",
  "slug": "gangsters-organized-crime-gogcom",
  "version": "GOG.com",
  "description": "",
  "notes": "The game menu has some display issues however its fully working",
  "created_at": "2016-08-17T19:48:39.440761Z",
  "updated_at": "2016-08-22T23:04:33.266140Z",
  "draft": false,
  "published": true,
  "published_by": null,
  "rating": "",
  "steamid": null,
  "gogid": 1207659108,
  "gogslug": "gangsters_organized_crime",
  "humblestoreid": "",
  "script": {
    "game": {
      "arch": "win32",
      "prefix": "$GAMEDIR",
      "exe": "drive_c/GOG Games/Gangsters/gangsters.exe"
    },
    "files": [
      {
        "game": "N/A:Please select the GOG.com Windows installer."
      }
    ],
    "gogid": "gangsters_organized_crime",
    "installer": [
      {
        "task": {
          "prefix": "$GAMEDIR",
          "description": "Creating Wine prefix",
          "name": "create_prefix"
        }
      },
      {
        "task": {
          "prefix": "$GAMEDIR",
          "path": "HKEY_CURRENT_USER\\Software\\Wine\\DllOverrides",
          "value": "",
          "type": "REG_SZ",
          "key": "winemenubuilder.exe",
          "name": "set_regedit"
        }
      },
      {
        "task": {
          "prefix": "$GAMEDIR",
          "name": "winetricks",
          "silent": true,
          "app": "ddr=gdi"
        }
      },
      {
        "task": {
          "prefix": "$GAMEDIR",
          "name": "winetricks",
          "silent": true,
          "app": "glsl=disabled"
        }
      },
      {
        "task": {
          "prefix": "$GAMEDIR",
          "name": "winetricks",
          "silent": true,
          "app": "multisampling=disabled"
        }
      },
      {
        "task": {
          "prefix": "$GAMEDIR",
          "executable": "game",
          "args": "/VERYSILENT /SP- /NOCANCEL /SUPPRESSMSGBOXES",
          "description": "Installing...",
          "name": "wineexec"
        }
      },
      {
        "task": {
          "prefix": "$GAMEDIR",
          "description": "Disabling unused WINE features",
          "name": "winetricks",
          "silent": true,
          "app": "sandbox"
        }
      }
    ]
  },
  "content": "files:\n- game: N/A:Please select the GOG.com Windows installer.\ngame:\n  arch: win32\n  exe: drive_c/GOG Games/Gangsters/gangsters.exe\n  prefix: $GAMEDIR\ngogid: gangsters_organized_crime\ninstaller:\n- task:\n    description: Creating Wine prefix\n    name: create_prefix\n    prefix: $GAMEDIR\n- task:\n    key: winemenubuilder.exe\n    name: set_regedit\n    path: HKEY_CURRENT_USER\\Software\\Wine\\DllOverrides\n    prefix: $GAMEDIR\n    type: REG_SZ\n    value: ''\n- task:\n    app: ddr=gdi\n    name: winetricks\n    prefix: $GAMEDIR\n    silent: true\n- task:\n    app: glsl=disabled\n    name: winetricks\n    prefix: $GAMEDIR\n    silent: true\n- task:\n    app: multisampling=disabled\n    name: winetricks\n    prefix: $GAMEDIR\n    silent: true\n- task:\n    args: /VERYSILENT /SP- /NOCANCEL /SUPPRESSMSGBOXES\n    description: Installing...\n    executable: game\n    name: wineexec\n    prefix: $GAMEDIR\n- task:\n    app: sandbox\n    description: Disabling unused WINE features\n    name: winetricks\n    prefix: $GAMEDIR\n    silent: true\n"
}