{
  "id": 14433,
  "game_id": 28346,
  "game_slug": "subtitle-edit",
  "name": "Subtitle Edit",
  "year": 2019,
  "user": "doctor-nick",
  "runner": "wine",
  "slug": "subtitle-edit-se359",
  "version": "SE3.5.9",
  "description": "Subtitle Edit 3.5.9 installer",
  "notes": "Note: After you install this, go to Options->Settings->Video Player->Download mpv lib, download it and set the video to direct3d, then choose mpv as your Video engine.",
  "created_at": "2019-07-06T06:58:47.519000Z",
  "updated_at": "2020-01-23T02:57:19.692556Z",
  "draft": false,
  "published": true,
  "published_by": 1,
  "rating": "",
  "steamid": null,
  "gogid": null,
  "gogslug": "",
  "humblestoreid": "",
  "script": {
    "installer": [
      {
        "extract": {
          "src": "subeditzip",
          "dst": "$GAMEDIR/drive_c/subtitleedit",
          "description": "Unzipping subtitle edit"
        }
      },
      {
        "task": {
          "args": "/S",
          "executable": "vlc",
          "description": "Installing VLC",
          "prefix": "$GAMEDIR",
          "name": "wineexec"
        }
      },
      {
        "task": {
          "description": "Installing Direct3D 9",
          "app": "d3dx9",
          "prefix": "$GAMEDIR",
          "name": "winetricks"
        }
      },
      {
        "task": {
          "description": "Installing .NET 4.6.1 runtime",
          "app": "dotnet461",
          "prefix": "$GAMEDIR",
          "name": "winetricks"
        }
      }
    ],
    "files": [
      {
        "subeditzip": "https://github.com/SubtitleEdit/subtitleedit/releases/download/3.5.9/SE359.zip"
      },
      {
        "vlc": "https://get.videolan.org/vlc/3.0.7.1/win32/vlc-3.0.7.1-win32.exe"
      }
    ],
    "wine": {
      "dxvk": true,
      "esync": true
    },
    "game": {
      "arch": "win32",
      "prefix": "$GAMEDIR",
      "exe": "$GAMEDIR/drive_c/subtitleedit/SubtitleEdit.exe"
    }
  },
  "content": "files:\n- subeditzip: https://github.com/SubtitleEdit/subtitleedit/releases/download/3.5.9/SE359.zip\n- vlc: https://get.videolan.org/vlc/3.0.7.1/win32/vlc-3.0.7.1-win32.exe\ngame:\n  arch: win32\n  exe: $GAMEDIR/drive_c/subtitleedit/SubtitleEdit.exe\n  prefix: $GAMEDIR\ninstaller:\n- extract:\n    description: Unzipping subtitle edit\n    dst: $GAMEDIR/drive_c/subtitleedit\n    src: subeditzip\n- task:\n    args: /S\n    description: Installing VLC\n    executable: vlc\n    name: wineexec\n    prefix: $GAMEDIR\n- task:\n    app: d3dx9\n    description: Installing Direct3D 9\n    name: winetricks\n    prefix: $GAMEDIR\n- task:\n    app: dotnet461\n    description: Installing .NET 4.6.1 runtime\n    name: winetricks\n    prefix: $GAMEDIR\nwine:\n  dxvk: true\n  esync: true\n"
}