{
  "id": 23343,
  "game_id": 5399,
  "game_slug": "hedgewars",
  "name": "Hedgewars",
  "year": 2019,
  "user": "vanstaveren",
  "runner": "wine",
  "slug": "hedgewars-100-vulkan",
  "version": "1.0.0-vulkan",
  "description": null,
  "notes": "",
  "created_at": "2020-09-13T11:05:43.517310Z",
  "updated_at": "2020-09-13T11:05:43.517335Z",
  "draft": true,
  "published": false,
  "published_by": null,
  "rating": "",
  "steamid": null,
  "gogid": null,
  "gogslug": "",
  "humbleid": "",
  "humblestoreid": "",
  "humblestoreid_real": "",
  "script": {
    "files": [
      {
        "hedgewars.exe": "https://hedgewars.org/download/releases/Hedgewars-1.0.0.exe"
      }
    ],
    "game": {
      "arch": "win64",
      "custom-name": "Hedgewars",
      "exe": "$GAMEDIR/prefix/drive_c/Program Files (x86)/Hedgewars 1.0.0/hedgewars.exe"
    },
    "installer": [
      {
        "task": {
          "arch": "win64",
          "description": "Creating 64-bit prefix ...",
          "name": "create_prefix",
          "prefix": "$GAMEDIR/prefix"
        }
      },
      {
        "move": {
          "dst": "$GAMEDIR/prefix/drive_c/",
          "src": "hedgewars.exe"
        }
      },
      {
        "chmodx": "$GAMEDIR/prefix/drive_c/Hedgewars-1.0.0.exe"
      },
      {
        "task": {
          "description": "Hedgewars ...",
          "executable": "$GAMEDIR/prefix/drive_c/Hedgewars-1.0.0.exe",
          "name": "wineexec",
          "prefix": "$GAMEDIR/prefix"
        }
      },
      {
        "task": {
          "app": "d3dcompiler_43",
          "arch": "win64",
          "description": "DirectX 11 ...",
          "name": "winetricks",
          "prefix": "$GAMEDIR/prefix"
        }
      },
      {
        "task": {
          "app": "d3dx11_43",
          "arch": "win64",
          "description": "DirectX 11 ...",
          "name": "winetricks",
          "prefix": "$GAMEDIR/prefix"
        }
      },
      {
        "task": {
          "app": "dxvk",
          "arch": "win64",
          "description": "Vulkan ...",
          "name": "winetricks",
          "prefix": "$GAMEDIR/prefix"
        }
      },
      {
        "task": {
          "app": "win8",
          "arch": "win64",
          "description": "Windows version 8 ...",
          "name": "winetricks",
          "prefix": "$GAMEDIR/prefix"
        }
      }
    ],
    "wine": {
      "dxvk": true,
      "esync": true
    }
  },
  "content": "files:\n- hedgewars.exe: https://hedgewars.org/download/releases/Hedgewars-1.0.0.exe\ngame:\n  arch: win64\n  custom-name: Hedgewars\n  exe: $GAMEDIR/prefix/drive_c/Program Files (x86)/Hedgewars 1.0.0/hedgewars.exe\ninstaller:\n- task:\n    arch: win64\n    description: Creating 64-bit prefix ...\n    name: create_prefix\n    prefix: $GAMEDIR/prefix\n- move:\n    dst: $GAMEDIR/prefix/drive_c/\n    src: hedgewars.exe\n- chmodx: $GAMEDIR/prefix/drive_c/Hedgewars-1.0.0.exe\n- task:\n    description: Hedgewars ...\n    executable: $GAMEDIR/prefix/drive_c/Hedgewars-1.0.0.exe\n    name: wineexec\n    prefix: $GAMEDIR/prefix\n- task:\n    app: d3dcompiler_43\n    arch: win64\n    description: DirectX 11 ...\n    name: winetricks\n    prefix: $GAMEDIR/prefix\n- task:\n    app: d3dx11_43\n    arch: win64\n    description: DirectX 11 ...\n    name: winetricks\n    prefix: $GAMEDIR/prefix\n- task:\n    app: dxvk\n    arch: win64\n    description: Vulkan ...\n    name: winetricks\n    prefix: $GAMEDIR/prefix\n- task:\n    app: win8\n    arch: win64\n    description: Windows version 8 ...\n    name: winetricks\n    prefix: $GAMEDIR/prefix\nwine:\n  dxvk: true\n  esync: true\n"
}