{
  "id": 7711,
  "game_id": 17693,
  "game_slug": "battlefield-4",
  "name": "Battlefield 4",
  "year": 2013,
  "user": "Will",
  "runner": "wine",
  "slug": "battlefield-4-dxvk",
  "version": "DXVK",
  "description": "Only sets up Origin and DXVK you'll need to download Battlefield 4 manually.",
  "notes": "Please read before installing: <a href=\"https://github.com/lutris/lutris/wiki/Game:-Origin\">https://github.com/lutris/lutris/wiki/Game:-Origin</a>\r\n\r\nRun the <tt>~/Games/battlefield-4/pbsetup.exe</tt> <b>after</b> downloading Battlefield 4 from Origin <a href=\"https://forums.lutris.net/t/battlefield-4-punk-buster-kicks-me/4759/6\">to make multiplayer work.</a>",
  "created_at": "2018-03-31T22:19:29.480000Z",
  "updated_at": "2019-05-04T02:12:58.008133Z",
  "draft": false,
  "published": true,
  "published_by": 19464,
  "rating": "",
  "steamid": null,
  "gogid": null,
  "gogslug": "",
  "humblestoreid": "",
  "script": {
    "game": {
      "exe": "drive_c/Program Files (x86)/Origin/Origin.exe",
      "arch": "win64",
      "prefix": "$GAMEDIR"
    },
    "files": [
      {
        "client": "https://origin-a.akamaihd.net/Origin-Client-Download/origin/live/OriginThinSetup.exe"
      },
      {
        "updater": "https://raw.githubusercontent.com/DrDoctor13/wine-origin-updater/master/updateorigin.sh"
      },
      {
        "pbuster": "http://websec.evenbalance.com/downloads/W/gui/pbsetup.zip"
      }
    ],
    "system": {
      "disable_runtime": false,
      "env": {
        "DXVK_CONFIG_FILE": "$GAMEDIR/dxvk.conf",
        "DXVK_HUD": 0
      }
    },
    "installer": [
      {
        "task": {
          "description": "Creating Wine prefix",
          "prefix": "$GAMEDIR",
          "arch": "win64",
          "name": "create_prefix"
        }
      },
      {
        "input_menu": {
          "description": "Setting DXVK workarounds please choose your GPU:",
          "id": "GPU",
          "options": [
            {
              "Not needed for AMD. Ignore this.": "AMD"
            },
            {
              "dxgi.customVendorId = 10de\ndxgi.nvapiHack = False": "Nvidia"
            }
          ],
          "preselect": "Not needed for AMD. Ignore this."
        }
      },
      {
        "write_file": {
          "content": "$INPUT_GPU",
          "file": "$GAMEDIR/dxvk.conf"
        }
      },
      {
        "task": {
          "arch": "win64",
          "prefix": "$GAMEDIR",
          "name": "winetricks",
          "app": "nocrashdialog win81"
        }
      },
      {
        "task": {
          "name": "wineexec",
          "args": "/silent",
          "description": "Installing Origin... Login window might pop-up and close.",
          "prefix": "$GAMEDIR",
          "executable": "client",
          "arch": "win64",
          "exclude_processes": "Origin.exe OriginClientService.exe OriginWebHelperService.exe QtWebEngineProcess.exe"
        }
      },
      {
        "task": {
          "prefix": "$GAMEDIR",
          "arch": "win64",
          "name": "winekill"
        }
      },
      {
        "chmodx": "updater"
      },
      {
        "merge": {
          "dst": "$GAMEDIR/drive_c/Program Files (x86)/Origin",
          "src": "updater"
        }
      },
      {
        "extract": {
          "dst": "$GAMEDIR",
          "file": "pbuster"
        }
      }
    ],
    "wine": {
      "esync": true,
      "overrides": {
        "xaudio2_7": "native,builtin",
        "nvapi,nvapi64": "disabled"
      },
      "dxvk": true,
      "version": "tkg-protonified-3.21-x86_64"
    }
  },
  "content": "files:\n- client: https://origin-a.akamaihd.net/Origin-Client-Download/origin/live/OriginThinSetup.exe\n- updater: https://raw.githubusercontent.com/DrDoctor13/wine-origin-updater/master/updateorigin.sh\n- pbuster: http://websec.evenbalance.com/downloads/W/gui/pbsetup.zip\ngame:\n  arch: win64\n  exe: drive_c/Program Files (x86)/Origin/Origin.exe\n  prefix: $GAMEDIR\ninstaller:\n- task:\n    arch: win64\n    description: Creating Wine prefix\n    name: create_prefix\n    prefix: $GAMEDIR\n- input_menu:\n    description: 'Setting DXVK workarounds please choose your GPU:'\n    id: GPU\n    options:\n    - Not needed for AMD. Ignore this.: AMD\n    - ? 'dxgi.customVendorId = 10de\n\n        dxgi.nvapiHack = False'\n      : Nvidia\n    preselect: Not needed for AMD. Ignore this.\n- write_file:\n    content: $INPUT_GPU\n    file: $GAMEDIR/dxvk.conf\n- task:\n    app: nocrashdialog win81\n    arch: win64\n    name: winetricks\n    prefix: $GAMEDIR\n- task:\n    arch: win64\n    args: /silent\n    description: Installing Origin... Login window might pop-up and close.\n    exclude_processes: Origin.exe OriginClientService.exe OriginWebHelperService.exe\n      QtWebEngineProcess.exe\n    executable: client\n    name: wineexec\n    prefix: $GAMEDIR\n- task:\n    arch: win64\n    name: winekill\n    prefix: $GAMEDIR\n- chmodx: updater\n- merge:\n    dst: $GAMEDIR/drive_c/Program Files (x86)/Origin\n    src: updater\n- extract:\n    dst: $GAMEDIR\n    file: pbuster\nsystem:\n  disable_runtime: false\n  env:\n    DXVK_CONFIG_FILE: $GAMEDIR/dxvk.conf\n    DXVK_HUD: 0\nwine:\n  dxvk: true\n  esync: true\n  overrides:\n    nvapi,nvapi64: disabled\n    xaudio2_7: native,builtin\n  version: tkg-protonified-3.21-x86_64\n"
}