{
  "id": 18779,
  "game_id": 31939,
  "game_slug": "castlevania-the-lecarde-chronicles-2",
  "name": "Castlevania The Lecarde Chronicles 2",
  "year": 2017,
  "user": "welblade",
  "runner": "wine",
  "slug": "castlevania-the-lecarde-chron-latest",
  "version": "Latest",
  "description": null,
  "notes": "",
  "created_at": "2020-03-11T06:57:57.295000Z",
  "updated_at": "2020-04-18T07:18:16.434600Z",
  "draft": false,
  "published": true,
  "published_by": 20548,
  "rating": "",
  "steamid": null,
  "gogid": null,
  "gogslug": "",
  "humblestoreid": "",
  "script": {
    "custom-name": "Castlevania - The Lecarde Chronicles 2",
    "files": [
      {
        "file": {
          "referer": "https://lutris.net",
          "filename": "Castlevania-The-Lecarde-Chronicles-2.zip",
          "url": "https://dl.myabandonware.com/t/t0UNxb6gY3m19Vt487m9Ms72MNGvHpbMDs34IJF44u9255i6jg/Castlevania-The-Lecarde-Chronicles-2_Win_EN-FR-ES-DE-IT-JA.zip"
        }
      }
    ],
    "game": {
      "prefix": "$GAMEDIR",
      "exe": "drive_c/Program Files (x86)/CastlevaniaTLC/Castlevania The Lecarde Chronicles 2 upc.exe",
      "arch": "win64"
    },
    "installer": [
      {
        "task": {
          "prefix": "$GAMEDIR",
          "arch": "win64",
          "name": "create_prefix"
        }
      },
      {
        "task": {
          "prefix": "$GAMEDIR",
          "name": "winekill"
        }
      },
      {
        "extract": {
          "file": "file",
          "format": "zip",
          "dst": "$GAMEDIR/drive_c/Program Files (x86)/CastlevaniaTLC/"
        }
      }
    ]
  },
  "content": "custom-name: Castlevania - The Lecarde Chronicles 2\nfiles:\n- file:\n    filename: Castlevania-The-Lecarde-Chronicles-2.zip\n    referer: https://lutris.net\n    url: https://dl.myabandonware.com/t/t0UNxb6gY3m19Vt487m9Ms72MNGvHpbMDs34IJF44u9255i6jg/Castlevania-The-Lecarde-Chronicles-2_Win_EN-FR-ES-DE-IT-JA.zip\ngame:\n  arch: win64\n  exe: drive_c/Program Files (x86)/CastlevaniaTLC/Castlevania The Lecarde Chronicles\n    2 upc.exe\n  prefix: $GAMEDIR\ninstaller:\n- task:\n    arch: win64\n    name: create_prefix\n    prefix: $GAMEDIR\n- task:\n    name: winekill\n    prefix: $GAMEDIR\n- extract:\n    dst: $GAMEDIR/drive_c/Program Files (x86)/CastlevaniaTLC/\n    file: file\n    format: zip\n"
}