{
  "id": 14578,
  "game_id": 28320,
  "game_slug": "darksiders-wrath-of-war",
  "name": "DARKSIDERS: Wrath of War",
  "year": 2010,
  "user": "edjaa84",
  "runner": "wine",
  "slug": "darksiders-wrath-of-war-gog-final",
  "version": "GOG FINAL",
  "description": "GOG versión para Intel HD o superior \r\nWine 32bit\r\nNivel: Gold (Deshabilita los subtitulos para que corra el juego mas fluido y a veces se cierra después de varias horas de juego)\r\n\r\nDebido a que La versión 2010 de este juego ya no existe en Steam o GOG e optado por prestar la versión antigua (2.0.0.6) de GOG gracias al DRM FREE y a un amigo.",
  "notes": "Una vez instalado Wine (4 o superior) y sus componentes instale el  juego manualmente desde el menú conceptual > Run EXE inside wine prefix.",
  "created_at": "2019-07-15T05:10:12.963691Z",
  "updated_at": "2019-07-15T05:10:12.963717Z",
  "draft": false,
  "published": false,
  "published_by": null,
  "rating": "",
  "steamid": null,
  "gogid": null,
  "gogslug": "",
  "humblestoreid": "",
  "script": {
    "game": {
      "exe": "$GAMEDIR/drive_c/GOG Games/Darksiders/DarksidersPC.exe",
      "arch": "win32",
      "prefix": "$GAMEDIR",
      "working_dir": "$GAMEDIR/drive_c/GOG Games/Darksiders/"
    },
    "files": [
      {
        "dark": "N/A:Señala el instalador, solo para iniciar"
      }
    ],
    "wine": {
      "MouseWarpOverride": "disable"
    },
    "installer": [
      {
        "task": {
          "description": "Installing DirectX 9",
          "silent": true,
          "prefix": "$GAMEDIR/",
          "app": "d3dx9",
          "name": "winetricks"
        }
      },
      {
        "task": {
          "description": "Installing Quartz",
          "silent": true,
          "prefix": "$GAMEDIR/",
          "app": "quartz",
          "name": "winetricks"
        }
      },
      {
        "task": {
          "description": "Installing devenum",
          "silent": true,
          "prefix": "$GAMEDIR/",
          "app": "devenum",
          "name": "winetricks"
        }
      },
      {
        "task": {
          "description": "Installing Windows Media Player 9",
          "silent": true,
          "prefix": "$GAMEDIR/",
          "app": "wmp9",
          "name": "winetricks"
        }
      },
      {
        "task": {
          "description": "Installing amstream",
          "silent": true,
          "prefix": "$GAMEDIR/",
          "app": "amstream",
          "name": "winetricks"
        }
      },
      {
        "task": {
          "description": "Installing d3dcompiler42",
          "silent": true,
          "prefix": "$GAMEDIR/",
          "app": "d3dcompiler_42",
          "name": "winetricks"
        }
      },
      {
        "task": {
          "description": "Prevenir control visuales de Windows",
          "silent": true,
          "prefix": "$GAMEDIR/",
          "app": "windowmanagermanaged=n",
          "name": "winetricks"
        }
      },
      {
        "task": {
          "description": "Prevenir efectos visuales de Windows",
          "silent": true,
          "prefix": "$GAMEDIR/",
          "app": "windowmanagerdecorated=n",
          "name": "winetricks"
        }
      },
      {
        "task": {
          "description": "Cambiando a Windows 7",
          "silent": true,
          "prefix": "$GAMEDIR/",
          "app": "win7",
          "name": "winetricks"
        }
      }
    ]
  },
  "content": "files:\n- dark: \"N/A:Se\\xF1ala el instalador, solo para iniciar\"\ngame:\n  arch: win32\n  exe: $GAMEDIR/drive_c/GOG Games/Darksiders/DarksidersPC.exe\n  prefix: $GAMEDIR\n  working_dir: $GAMEDIR/drive_c/GOG Games/Darksiders/\ninstaller:\n- task:\n    app: d3dx9\n    description: Installing DirectX 9\n    name: winetricks\n    prefix: $GAMEDIR/\n    silent: true\n- task:\n    app: quartz\n    description: Installing Quartz\n    name: winetricks\n    prefix: $GAMEDIR/\n    silent: true\n- task:\n    app: devenum\n    description: Installing devenum\n    name: winetricks\n    prefix: $GAMEDIR/\n    silent: true\n- task:\n    app: wmp9\n    description: Installing Windows Media Player 9\n    name: winetricks\n    prefix: $GAMEDIR/\n    silent: true\n- task:\n    app: amstream\n    description: Installing amstream\n    name: winetricks\n    prefix: $GAMEDIR/\n    silent: true\n- task:\n    app: d3dcompiler_42\n    description: Installing d3dcompiler42\n    name: winetricks\n    prefix: $GAMEDIR/\n    silent: true\n- task:\n    app: windowmanagermanaged=n\n    description: Prevenir control visuales de Windows\n    name: winetricks\n    prefix: $GAMEDIR/\n    silent: true\n- task:\n    app: windowmanagerdecorated=n\n    description: Prevenir efectos visuales de Windows\n    name: winetricks\n    prefix: $GAMEDIR/\n    silent: true\n- task:\n    app: win7\n    description: Cambiando a Windows 7\n    name: winetricks\n    prefix: $GAMEDIR/\n    silent: true\nwine:\n  MouseWarpOverride: disable\n"
}