{
  "id": 14440,
  "game_id": 28320,
  "game_slug": "darksiders-wrath-of-war",
  "name": "DARKSIDERS: Wrath of War",
  "year": 2010,
  "user": "edjaa84",
  "runner": "wine",
  "slug": "darksiders-wrath-of-war-gogcom",
  "version": "GOG.com",
  "description": "GOG versión para Intel HD o superior \r\nWine 32bit\r\nNivel: Gold (Deshabilita los subtitulos para que corra el juego mas fluido y a veces se cierra después de varias horas de juego)\r\n\r\nDebido a que La versión 2010 de este juego ya no existe en Steam o GOG e optado por prestar la versión antigua (2.0.0.6) de GOG gracias al DRM FREE y a un amigo.",
  "notes": "Una vez instalado Wine (4 o superior) y sus componentes instale el  juego manualmente desde el menú conceptual > Run EXE inside wine prefix.\r\n\r\nComo se muestra en la imagen.\r\nhttps://1.bp.blogspot.com/-BgHGOLtM4Ak/XSCeQXpl7DI/AAAAAAAAPl0/LbmzbSig2bkuOECC7uqOi9cpHrSHhGiZACLcBGAs/s1600/Captura%2Bde%2Bpanta",
  "created_at": "2019-07-06T14:00:05.662000Z",
  "updated_at": "2019-09-09T01:00:33.247200Z",
  "draft": false,
  "published": true,
  "published_by": 1,
  "rating": "",
  "steamid": null,
  "gogid": null,
  "gogslug": "",
  "humblestoreid": "",
  "script": {
    "installer": [
      {
        "extract": {
          "dst": "$GAMEDIR/drive_c/windows/system32/",
          "file": "d3dcompiler_42"
        }
      },
      {
        "task": {
          "silent": true,
          "description": "Installing DirectX 9",
          "app": "d3dx9",
          "prefix": "$GAMEDIR/",
          "name": "winetricks"
        }
      },
      {
        "task": {
          "silent": true,
          "description": "Installing Quartz",
          "app": "quartz",
          "prefix": "$GAMEDIR/",
          "name": "winetricks"
        }
      },
      {
        "task": {
          "silent": true,
          "description": "Installing devenum",
          "app": "devenum",
          "prefix": "$GAMEDIR/",
          "name": "winetricks"
        }
      },
      {
        "task": {
          "silent": true,
          "description": "Installing Windows Media Player 9",
          "app": "wmp9",
          "prefix": "$GAMEDIR/",
          "name": "winetricks"
        }
      },
      {
        "task": {
          "silent": true,
          "description": "Installing amstream",
          "app": "amstream",
          "prefix": "$GAMEDIR/",
          "name": "winetricks"
        }
      },
      {
        "task": {
          "silent": true,
          "description": "MouseWarpOverride disable",
          "app": "mwo=disable",
          "prefix": "$GAMEDIR/",
          "name": "winetricks"
        }
      },
      {
        "task": {
          "silent": true,
          "description": "Cambiando a Windows 7",
          "app": "win7",
          "prefix": "$GAMEDIR/",
          "name": "winetricks"
        }
      }
    ],
    "files": [
      {
        "d3dcompiler_42": "http://download.game155.com/zip/d3dcompiler_42.dll.zip"
      }
    ],
    "system": {
      "resolution": "640x480",
      "reset_desktop": true
    },
    "game": {
      "arch": "win32",
      "working_dir": "$GAMEDIR/drive_c/GOG Games/Darksiders/",
      "prefix": "$GAMEDIR",
      "exe": "$GAMEDIR/drive_c/GOG Games/Darksiders/DarksidersPC.exe"
    }
  },
  "content": "files:\n- d3dcompiler_42: http://download.game155.com/zip/d3dcompiler_42.dll.zip\ngame:\n  arch: win32\n  exe: $GAMEDIR/drive_c/GOG Games/Darksiders/DarksidersPC.exe\n  prefix: $GAMEDIR\n  working_dir: $GAMEDIR/drive_c/GOG Games/Darksiders/\ninstaller:\n- extract:\n    dst: $GAMEDIR/drive_c/windows/system32/\n    file: d3dcompiler_42\n- task:\n    app: d3dx9\n    description: Installing DirectX 9\n    name: winetricks\n    prefix: $GAMEDIR/\n    silent: true\n- task:\n    app: quartz\n    description: Installing Quartz\n    name: winetricks\n    prefix: $GAMEDIR/\n    silent: true\n- task:\n    app: devenum\n    description: Installing devenum\n    name: winetricks\n    prefix: $GAMEDIR/\n    silent: true\n- task:\n    app: wmp9\n    description: Installing Windows Media Player 9\n    name: winetricks\n    prefix: $GAMEDIR/\n    silent: true\n- task:\n    app: amstream\n    description: Installing amstream\n    name: winetricks\n    prefix: $GAMEDIR/\n    silent: true\n- task:\n    app: mwo=disable\n    description: MouseWarpOverride disable\n    name: winetricks\n    prefix: $GAMEDIR/\n    silent: true\n- task:\n    app: win7\n    description: Cambiando a Windows 7\n    name: winetricks\n    prefix: $GAMEDIR/\n    silent: true\nsystem:\n  reset_desktop: true\n  resolution: 640x480\n"
}