{
  "id": 2952,
  "game_id": 3651,
  "game_slug": "resident-evil-4-biohazard-4",
  "name": "Resident Evil 4 / Biohazard 4",
  "year": 2005,
  "user": "strider",
  "runner": "winesteam",
  "slug": "resident-evil-4-biohazard-4-steam",
  "version": "Steam",
  "description": null,
  "notes": "",
  "created_at": "2016-10-29T02:03:28.223000Z",
  "updated_at": "2019-05-12T03:37:20.421093Z",
  "draft": false,
  "published": true,
  "published_by": 19464,
  "rating": "",
  "steamid": 254700,
  "gogid": null,
  "gogslug": "",
  "humblestoreid": "",
  "script": {
    "winesteam": {
      "version": "tkg-re4-4.5-x86_64",
      "esync": true
    },
    "game": {
      "arch": "win32",
      "prefix": "$GAMEDIR/prefix",
      "appid": 254700
    },
    "installer": [
      {
        "task": {
          "arch": "win32",
          "prefix": "$GAMEDIR/prefix",
          "description": "Creating 32bit Wine prefix.",
          "name": "create_prefix"
        }
      },
      {
        "task": {
          "arch": "win32",
          "prefix": "$GAMEDIR/prefix",
          "description": "Changing to Windows xp",
          "name": "winetricks",
          "app": "winxp"
        }
      },
      {
        "task": {
          "arch": "win32",
          "prefix": "$GAMEDIR/prefix",
          "description": "Installing d3dx9",
          "name": "winetricks",
          "app": "d3dx9"
        }
      },
      {
        "task": {
          "arch": "win32",
          "prefix": "$GAMEDIR/prefix",
          "description": "Installing d3dcompiler_47, xact and ffdshow...",
          "name": "winetricks",
          "app": "d3dcompiler_47 xact ffdshow"
        }
      }
    ]
  },
  "content": "game:\n  appid: 254700\n  arch: win32\n  prefix: $GAMEDIR/prefix\ninstaller:\n- task:\n    arch: win32\n    description: Creating 32bit Wine prefix.\n    name: create_prefix\n    prefix: $GAMEDIR/prefix\n- task:\n    app: winxp\n    arch: win32\n    description: Changing to Windows xp\n    name: winetricks\n    prefix: $GAMEDIR/prefix\n- task:\n    app: d3dx9\n    arch: win32\n    description: Installing d3dx9\n    name: winetricks\n    prefix: $GAMEDIR/prefix\n- task:\n    app: d3dcompiler_47 xact ffdshow\n    arch: win32\n    description: Installing d3dcompiler_47, xact and ffdshow...\n    name: winetricks\n    prefix: $GAMEDIR/prefix\nwinesteam:\n  esync: true\n  version: tkg-re4-4.5-x86_64\n"
}