{
  "id": 7623,
  "game_id": 17459,
  "game_slug": "mass-effect-andromeda",
  "name": "Mass Effect: Andromeda",
  "year": 2017,
  "user": "cxf",
  "runner": "wine",
  "slug": "mass-effect-andromeda-dxvk",
  "version": "DXVK",
  "description": "Only sets up Origin and DXVK you'll need to download Mass Effect: Andromeda manually.",
  "notes": "Please read before installing: <a href=\"https://github.com/lutris/lutris/wiki/Game:-Origin\">https://github.com/lutris/lutris/wiki/Game:-Origin</a>",
  "created_at": "2018-03-21T22:13:44.213000Z",
  "updated_at": "2019-04-12T00:23:18.487884Z",
  "draft": false,
  "published": true,
  "published_by": 19464,
  "rating": "",
  "steamid": null,
  "gogid": null,
  "gogslug": "",
  "humblestoreid": "",
  "script": {
    "system": {
      "env": {
        "DXVK_CONFIG_FILE": "$GAMEDIR/dxvk.conf",
        "DXVK_HUD": 0
      },
      "disable_runtime": false
    },
    "game": {
      "arch": "win64",
      "prefix": "$GAMEDIR",
      "exe": "drive_c/Program Files (x86)/Origin/Origin.exe"
    },
    "wine": {
      "overrides": {
        "xaudio2_7": "native,builtin",
        "nvapi,nvapi64": "disabled"
      },
      "dxvk": true,
      "version": "tkg-protonified-3.21-x86_64"
    },
    "files": [
      {
        "client": "https://origin-a.akamaihd.net/Origin-Client-Download/origin/live/OriginThinSetup.exe"
      },
      {
        "updater": "https://raw.githubusercontent.com/DrDoctor13/wine-origin-updater/master/updateorigin.sh"
      }
    ],
    "installer": [
      {
        "task": {
          "arch": "win64",
          "prefix": "$GAMEDIR",
          "description": "Creating Wine prefix",
          "name": "create_prefix"
        }
      },
      {
        "input_menu": {
          "preselect": "Not needed for AMD. Ignore this.",
          "id": "GPU",
          "description": "Setting DXVK workarounds please choose your GPU:",
          "options": [
            {
              "Not needed for AMD. Ignore this.": "AMD"
            },
            {
              "dxgi.customVendorId = 10de\ndxgi.nvapiHack = False": "Nvidia"
            }
          ]
        }
      },
      {
        "write_file": {
          "content": "$INPUT_GPU",
          "file": "$GAMEDIR/dxvk.conf"
        }
      },
      {
        "task": {
          "arch": "win64",
          "prefix": "$GAMEDIR",
          "name": "winetricks",
          "app": "nocrashdialog win7"
        }
      },
      {
        "task": {
          "prefix": "$GAMEDIR",
          "executable": "client",
          "description": "Installing Origin... Login window will pop-up and close.",
          "args": "/silent",
          "arch": "win64",
          "exclude_processes": "Origin.exe OriginClientService.exe OriginWebHelperService.exe QtWebEngineProcess.exe",
          "name": "wineexec"
        }
      },
      {
        "task": {
          "arch": "win64",
          "prefix": "$GAMEDIR",
          "name": "winekill"
        }
      },
      {
        "chmodx": "updater"
      },
      {
        "merge": {
          "dst": "$GAMEDIR/drive_c/Program Files (x86)/Origin",
          "src": "updater"
        }
      }
    ]
  },
  "content": "files:\n- client: https://origin-a.akamaihd.net/Origin-Client-Download/origin/live/OriginThinSetup.exe\n- updater: https://raw.githubusercontent.com/DrDoctor13/wine-origin-updater/master/updateorigin.sh\ngame:\n  arch: win64\n  exe: drive_c/Program Files (x86)/Origin/Origin.exe\n  prefix: $GAMEDIR\ninstaller:\n- task:\n    arch: win64\n    description: Creating Wine prefix\n    name: create_prefix\n    prefix: $GAMEDIR\n- input_menu:\n    description: 'Setting DXVK workarounds please choose your GPU:'\n    id: GPU\n    options:\n    - Not needed for AMD. Ignore this.: AMD\n    - ? 'dxgi.customVendorId = 10de\n\n        dxgi.nvapiHack = False'\n      : Nvidia\n    preselect: Not needed for AMD. Ignore this.\n- write_file:\n    content: $INPUT_GPU\n    file: $GAMEDIR/dxvk.conf\n- task:\n    app: nocrashdialog win7\n    arch: win64\n    name: winetricks\n    prefix: $GAMEDIR\n- task:\n    arch: win64\n    args: /silent\n    description: Installing Origin... Login window will pop-up and close.\n    exclude_processes: Origin.exe OriginClientService.exe OriginWebHelperService.exe\n      QtWebEngineProcess.exe\n    executable: client\n    name: wineexec\n    prefix: $GAMEDIR\n- task:\n    arch: win64\n    name: winekill\n    prefix: $GAMEDIR\n- chmodx: updater\n- merge:\n    dst: $GAMEDIR/drive_c/Program Files (x86)/Origin\n    src: updater\nsystem:\n  disable_runtime: false\n  env:\n    DXVK_CONFIG_FILE: $GAMEDIR/dxvk.conf\n    DXVK_HUD: 0\nwine:\n  dxvk: true\n  overrides:\n    nvapi,nvapi64: disabled\n    xaudio2_7: native,builtin\n  version: tkg-protonified-3.21-x86_64\n"
}