{
  "id": 3554,
  "game_id": 1414,
  "game_slug": "grim-dawn",
  "name": "Grim Dawn",
  "year": 2016,
  "user": "GloriousEggroll",
  "runner": "winesteam",
  "slug": "grim-dawn-steam",
  "version": "Steam",
  "description": null,
  "notes": "",
  "created_at": "2017-04-24T03:41:10.176000Z",
  "updated_at": "2019-05-19T07:15:36.422898Z",
  "draft": false,
  "published": true,
  "published_by": 19464,
  "rating": "",
  "steamid": 219990,
  "gogid": 1449651388,
  "gogslug": "grim_dawn",
  "humblestoreid": "",
  "script": {
    "winesteam": {
      "dxvk": true,
      "version": "tkg-4.0-x86_64"
    },
    "game": {
      "arch": "win64",
      "prefix": "$GAMEDIR/prefix",
      "appid": 219990
    },
    "files": [
      {
        "dx2010": "https://lutris.net/files/tools/directx-2010.tar.gz"
      }
    ],
    "installer": [
      {
        "extract": {
          "dst": "$CACHE/dxsetup",
          "file": "dx2010"
        }
      },
      {
        "task": {
          "arch": "win64",
          "prefix": "$GAMEDIR/prefix",
          "name": "create_prefix"
        }
      },
      {
        "task": {
          "arch": "win64",
          "executable": "$CACHE/dxsetup/DXSETUP.exe",
          "prefix": "$GAMEDIR/prefix",
          "name": "wineexec",
          "args": "/silent"
        }
      },
      {
        "task": {
          "arch": "win64",
          "prefix": "$GAMEDIR/prefix",
          "name": "winekill"
        }
      },
      {
        "task": {
          "arch": "win64",
          "prefix": "$GAMEDIR/prefix",
          "name": "winetricks",
          "app": "vcrun2010 vcrun2012 vcrun2015"
        }
      },
      {
        "task": {
          "arch": "win64",
          "prefix": "$GAMEDIR/prefix",
          "description": "Installing .NET 4.7.2 please be patient",
          "name": "winetricks",
          "app": "dotnet472 win7"
        }
      }
    ]
  },
  "content": "files:\n- dx2010: https://lutris.net/files/tools/directx-2010.tar.gz\ngame:\n  appid: 219990\n  arch: win64\n  prefix: $GAMEDIR/prefix\ninstaller:\n- extract:\n    dst: $CACHE/dxsetup\n    file: dx2010\n- task:\n    arch: win64\n    name: create_prefix\n    prefix: $GAMEDIR/prefix\n- task:\n    arch: win64\n    args: /silent\n    executable: $CACHE/dxsetup/DXSETUP.exe\n    name: wineexec\n    prefix: $GAMEDIR/prefix\n- task:\n    arch: win64\n    name: winekill\n    prefix: $GAMEDIR/prefix\n- task:\n    app: vcrun2010 vcrun2012 vcrun2015\n    arch: win64\n    name: winetricks\n    prefix: $GAMEDIR/prefix\n- task:\n    app: dotnet472 win7\n    arch: win64\n    description: Installing .NET 4.7.2 please be patient\n    name: winetricks\n    prefix: $GAMEDIR/prefix\nwinesteam:\n  dxvk: true\n  version: tkg-4.0-x86_64\n"
}