{
  "id": 14476,
  "game_id": 96,
  "game_slug": "darksiders-ii",
  "name": "Darksiders II",
  "year": 2012,
  "user": "edjaa84",
  "runner": "wine",
  "slug": "darksiders-ii-dvd",
  "version": "DVD",
  "description": "DVD versión para Intel HD o superior \r\nWine 32bit\r\nNivel: Platinum\r\n\r\nDebido a que La versión 2010 de este juego ya no existe en Steam o GOG e optado por prestar la versión antigua DVD el cual trae todos sus DLCs.",
  "notes": "Una vez instalado Wine (4 o superior) y sus componentes instale el  juego manualmente desde el menú conceptual > Run EXE inside wine prefix.",
  "created_at": "2019-07-08T04:28:34.634366Z",
  "updated_at": "2019-07-08T04:28:34.634393Z",
  "draft": true,
  "published": false,
  "published_by": null,
  "rating": "",
  "steamid": 50650,
  "gogid": null,
  "gogslug": "",
  "humblestoreid": "",
  "script": {
    "game": {
      "exe": "$GAMEDIR/drive_c/Program Files/My Program/Darksiders2.exe",
      "arch": "win32",
      "prefix": "$GAMEDIR/",
      "working_dir": "$GAMEDIR/drive_c/Program Files/My Program"
    },
    "files": [
      {
        "DVD": "N/A:Busca el instalador dentro del DVD si da error intentelo manualmente"
      }
    ],
    "system": {
      "resolution": "640x480",
      "reset_desktop": true
    },
    "installer": [
      {
        "task": {
          "description": "Installing DirectX 9",
          "silent": true,
          "prefix": "$GAMEDIR/",
          "app": "d3dx9",
          "name": "winetricks"
        }
      },
      {
        "task": {
          "description": "Installing d3dcompiler43",
          "silent": true,
          "prefix": "$GAMEDIR/",
          "app": "d3dcompiler_43",
          "name": "winetricks"
        }
      },
      {
        "task": {
          "description": "Installing vcrun2010",
          "silent": true,
          "prefix": "$GAMEDIR/",
          "app": "vcrun2010",
          "name": "winetricks"
        }
      },
      {
        "task": {
          "description": "Cambiando a Windows 7",
          "silent": true,
          "prefix": "$GAMEDIR/",
          "app": "win7",
          "name": "winetricks"
        }
      }
    ]
  },
  "content": "files:\n- DVD: N/A:Busca el instalador dentro del DVD si da error intentelo manualmente\ngame:\n  arch: win32\n  exe: $GAMEDIR/drive_c/Program Files/My Program/Darksiders2.exe\n  prefix: $GAMEDIR/\n  working_dir: $GAMEDIR/drive_c/Program Files/My Program\ninstaller:\n- task:\n    app: d3dx9\n    description: Installing DirectX 9\n    name: winetricks\n    prefix: $GAMEDIR/\n    silent: true\n- task:\n    app: d3dcompiler_43\n    description: Installing d3dcompiler43\n    name: winetricks\n    prefix: $GAMEDIR/\n    silent: true\n- task:\n    app: vcrun2010\n    description: Installing vcrun2010\n    name: winetricks\n    prefix: $GAMEDIR/\n    silent: true\n- task:\n    app: win7\n    description: Cambiando a Windows 7\n    name: winetricks\n    prefix: $GAMEDIR/\n    silent: true\nsystem:\n  reset_desktop: true\n  resolution: 640x480\n"
}