{
  "id": 10300,
  "game_id": 21868,
  "game_slug": "need-for-speed-most-wanted-2012",
  "name": "Need for Speed: Most Wanted (2012)",
  "year": 2012,
  "user": "alvarlagerlof",
  "runner": "wine",
  "slug": "need-for-speed-most-wanted-20-origin",
  "version": "Origin",
  "description": "Only sets up Origin and DXVK you'll need to download Need for Speed: Most Wanted manually.",
  "notes": "Please read before installing: <a href=\"https://github.com/lutris/lutris/wiki/Game:-Origin\">https://github.com/lutris/lutris/wiki/Game:-Origin</a>\r\n\r\n- If Origin gets stuck on \\\"Finalizing\\\", restart the app through Lutris.\r\n\r\n- If there is no sound when launched try clicking the mouse once.",
  "created_at": "2018-09-22T23:31:23.104000Z",
  "updated_at": "2020-01-23T02:57:18.286831Z",
  "draft": false,
  "published": true,
  "published_by": 19464,
  "rating": "",
  "steamid": null,
  "gogid": null,
  "gogslug": "",
  "humblestoreid": "",
  "script": {
    "files": [
      {
        "setup": "https://origin-a.akamaihd.net/Origin-Client-Download/origin/live/OriginThinSetup.exe"
      },
      {
        "updater": "https://raw.githubusercontent.com/DrDoctor13/wine-origin-updater/master/updateorigin.sh"
      }
    ],
    "game": {
      "prefix": "$GAMEDIR",
      "exe": "drive_c/Program Files (x86)/Origin/Origin.exe",
      "arch": "win64"
    },
    "wine": {
      "overrides": {
        "xaudio2_7": "native,builtin",
        "nvapi,nvapi64": "disabled"
      },
      "esync": true,
      "dxvk": true
    },
    "system": {
      "env": {
        "DXVK_HUD": 0
      },
      "pulse_latency": true
    },
    "installer": [
      {
        "task": {
          "prefix": "$GAMEDIR",
          "arch": "win64",
          "name": "create_prefix"
        }
      },
      {
        "task": {
          "prefix": "$GAMEDIR",
          "arch": "win64",
          "app": "nocrashdialog",
          "name": "winetricks"
        }
      },
      {
        "task": {
          "arch": "win64",
          "exclude_processes": "Origin.exe OriginClientService.exe QtWebEngineProcess.exe",
          "name": "wineexec",
          "description": "Installing Origin... Login window will pop-up and close.",
          "args": "/silent",
          "prefix": "$GAMEDIR",
          "executable": "setup"
        }
      },
      {
        "task": {
          "prefix": "$GAMEDIR",
          "name": "winekill"
        }
      },
      {
        "chmodx": "updater"
      },
      {
        "merge": {
          "src": "updater",
          "dst": "$GAMEDIR/drive_c/Program Files (x86)/Origin"
        }
      }
    ]
  },
  "content": "files:\n- setup: https://origin-a.akamaihd.net/Origin-Client-Download/origin/live/OriginThinSetup.exe\n- updater: https://raw.githubusercontent.com/DrDoctor13/wine-origin-updater/master/updateorigin.sh\ngame:\n  arch: win64\n  exe: drive_c/Program Files (x86)/Origin/Origin.exe\n  prefix: $GAMEDIR\ninstaller:\n- task:\n    arch: win64\n    name: create_prefix\n    prefix: $GAMEDIR\n- task:\n    app: nocrashdialog\n    arch: win64\n    name: winetricks\n    prefix: $GAMEDIR\n- task:\n    arch: win64\n    args: /silent\n    description: Installing Origin... Login window will pop-up and close.\n    exclude_processes: Origin.exe OriginClientService.exe QtWebEngineProcess.exe\n    executable: setup\n    name: wineexec\n    prefix: $GAMEDIR\n- task:\n    name: winekill\n    prefix: $GAMEDIR\n- chmodx: updater\n- merge:\n    dst: $GAMEDIR/drive_c/Program Files (x86)/Origin\n    src: updater\nsystem:\n  env:\n    DXVK_HUD: 0\n  pulse_latency: true\nwine:\n  dxvk: true\n  esync: true\n  overrides:\n    nvapi,nvapi64: disabled\n    xaudio2_7: native,builtin\n"
}