{
  "id": 7387,
  "game_id": 9142,
  "game_slug": "the-walking-dead-michonne",
  "name": "The Walking Dead: Michonne",
  "year": null,
  "user": "soredake",
  "runner": "wine",
  "slug": "the-walking-dead-michonne-gog",
  "version": "GOG",
  "description": null,
  "notes": "",
  "created_at": "2018-02-24T19:38:30.208065Z",
  "updated_at": "2018-05-14T03:51:39.840416Z",
  "draft": false,
  "published": true,
  "published_by": null,
  "rating": "",
  "steamid": 429570,
  "gogid": null,
  "gogslug": "",
  "humbleid": "",
  "humblestoreid": "",
  "humblestoreid_real": "",
  "script": {
    "files": [
      {
        "installer": "N/A:Select the game's setup file"
      }
    ],
    "game": {
      "exe": "$GAMEDIR/prefix/drive_c/game/WalkingDeadMichonne.exe",
      "prefix": "$GAMEDIR/prefix"
    },
    "installer": [
      {
        "execute": {
          "args": "--gog -d \"$CACHE\" \"$installer\"",
          "description": "Extracting game data",
          "file": "innoextract"
        }
      },
      {
        "move": {
          "description": "Extracting game data",
          "dst": "$GAMEDIR/prefix/drive_c/game",
          "src": "$CACHE/app"
        }
      },
      {
        "task": {
          "description": "Creating Wine prefix",
          "name": "create_prefix",
          "prefix": "$GAMEDIR/prefix"
        }
      },
      {
        "task": {
          "app": "win10",
          "description": "Setting Wine to Windows 10",
          "name": "winetricks",
          "prefix": "$GAMEDIR/prefix"
        }
      }
    ]
  },
  "content": "files:\r\n- installer: N/A:Select the game's setup file\r\ngame:\r\n  exe: $GAMEDIR/prefix/drive_c/game/WalkingDeadMichonne.exe\r\n  prefix: $GAMEDIR/prefix\r\ninstaller:\r\n- execute:\r\n    args: --gog -d \"$CACHE\" \"$installer\"\r\n    description: Extracting game data\r\n    file: innoextract\r\n- move:\r\n    description: Extracting game data\r\n    dst: $GAMEDIR/prefix/drive_c/game\r\n    src: $CACHE/app\r\n- task:\r\n    description: Creating Wine prefix\r\n    name: create_prefix\r\n    prefix: $GAMEDIR/prefix\r\n- task:\r\n    app: win10\r\n    description: Setting Wine to Windows 10\r\n    name: winetricks\r\n    prefix: $GAMEDIR/prefix"
}