{
  "id": 3298,
  "game_id": 9991,
  "game_slug": "no-one-lives-forever",
  "name": "No One Lives Forever",
  "year": 2000,
  "user": "professorkaos64",
  "runner": "wine",
  "slug": "no-one-lives-forever-current",
  "version": "current",
  "description": null,
  "notes": "",
  "created_at": "2017-02-26T23:43:11.032000Z",
  "updated_at": "2018-07-10T04:16:27.818625Z",
  "draft": false,
  "published": true,
  "published_by": null,
  "rating": "",
  "steamid": null,
  "gogid": null,
  "gogslug": "",
  "humblestoreid": "",
  "script": {
    "game": {
      "exe": "drive_c/Games/NOLF/NOLF.exe",
      "prefix": "$GAMEDIR"
    },
    "installer": [
      {
        "task": {
          "description": "Creating Wine prefix",
          "prefix": "$GAMEDIR",
          "arch": "win32",
          "name": "create_prefix"
        }
      },
      {
        "insert-disc": {
          "requires": "data1.hdr"
        }
      },
      {
        "task": {
          "description": "Installing dsound",
          "silent": true,
          "prefix": "$GAMEDIR",
          "app": "dsound",
          "name": "winetricks"
        }
      },
      {
        "task": {
          "description": "Installing dmusic",
          "silent": true,
          "prefix": "$GAMEDIR",
          "app": "dmusic",
          "name": "winetricks"
        }
      },
      {
        "task": {
          "description": "Installing DirectX 9",
          "silent": true,
          "prefix": "$GAMEDIR",
          "app": "directx9",
          "name": "winetricks"
        }
      },
      {
        "task": {
          "prefix": "$GAMEDIR",
          "executable": "$DISC/Setup.exe",
          "name": "wineexec"
        }
      }
    ]
  },
  "content": "game:\n  exe: drive_c/Games/NOLF/NOLF.exe\n  prefix: $GAMEDIR\ninstaller:\n- task:\n    arch: win32\n    description: Creating Wine prefix\n    name: create_prefix\n    prefix: $GAMEDIR\n- insert-disc:\n    requires: data1.hdr\n- task:\n    app: dsound\n    description: Installing dsound\n    name: winetricks\n    prefix: $GAMEDIR\n    silent: true\n- task:\n    app: dmusic\n    description: Installing dmusic\n    name: winetricks\n    prefix: $GAMEDIR\n    silent: true\n- task:\n    app: directx9\n    description: Installing DirectX 9\n    name: winetricks\n    prefix: $GAMEDIR\n    silent: true\n- task:\n    executable: $DISC/Setup.exe\n    name: wineexec\n    prefix: $GAMEDIR\n"
}