{
  "id": 14569,
  "game_id": 8990,
  "game_slug": "wolcen-lords-of-mayhem",
  "name": "Wolcen: Lords of Mayhem",
  "year": 2016,
  "user": "aronax",
  "runner": "winesteam",
  "slug": "wolcen-lords-of-mayhem-11_140719",
  "version": "1.1_14.07.19",
  "description": "wine version change",
  "notes": "from:  staging-3.5-x86_64\r\n           to:  version: ge-protonified-4.10-x86_64\r\n-set in wine dpi to 160 for 4k displays\r\n-set in wine win 10\r\n-set in Systemoption: Restore resolution on game exit\r\n-set in Systemoption: Restore gamma\r\n-set in Systemoption: Disable desktop effects\r\n-set in Systemoption: Reset Pulseaudio",
  "created_at": "2019-07-14T21:55:36.579000Z",
  "updated_at": "2020-01-31T02:38:28.209858Z",
  "draft": false,
  "published": true,
  "published_by": 1,
  "rating": "",
  "steamid": 424370,
  "gogid": 1458655673,
  "gogslug": "wolcen_lords_of_mayhem",
  "humblestoreid": "",
  "script": {
    "winesteam": {
      "game": null,
      "prefix": "$GAMEDIR",
      "WineDesktop": "2560x1440",
      "arch": "win64",
      "dxvk": true,
      "args": "--exec=\"launch Pro\"",
      "overrides": {
        "xaudio2_7": "native,builtin",
        "nvapi,nvapi64": "disabled"
      },
      "esync": true,
      "Desktop": false
    },
    "game": {
      "prefix": "$GAMEDIR/prefix",
      "arch": "win64",
      "appid": 424370
    },
    "installer": [
      {
        "task": {
          "prefix": "$GAMEDIR",
          "arch": "win64",
          "name": "create_prefix",
          "description": "Creating 64bit Wine prefix."
        }
      },
      {
        "task": {
          "silent": true,
          "arch": "win64",
          "name": "winetricks",
          "description": "Installing Arial font...",
          "prefix": "$GAMEDIR",
          "app": "arial"
        }
      },
      {
        "task": {
          "arch": "win64",
          "name": "set_regedit",
          "description": "Setting Windows 10 mode for Wine",
          "key": "Version",
          "prefix": "$GAMEDIR",
          "value": "win10",
          "path": "HKEY_CURRENT_USER\\Software\\Wine"
        }
      },
      {
        "task": {
          "prefix": "$GAMEDIR",
          "name": "winekill"
        }
      }
    ]
  },
  "content": "game:\n  appid: 424370\n  arch: win64\n  prefix: $GAMEDIR/prefix\ninstaller:\n- task:\n    arch: win64\n    description: Creating 64bit Wine prefix.\n    name: create_prefix\n    prefix: $GAMEDIR\n- task:\n    app: arial\n    arch: win64\n    description: Installing Arial font...\n    name: winetricks\n    prefix: $GAMEDIR\n    silent: true\n- task:\n    arch: win64\n    description: Setting Windows 10 mode for Wine\n    key: Version\n    name: set_regedit\n    path: HKEY_CURRENT_USER\\Software\\Wine\n    prefix: $GAMEDIR\n    value: win10\n- task:\n    name: winekill\n    prefix: $GAMEDIR\nwinesteam:\n  Desktop: false\n  WineDesktop: 2560x1440\n  arch: win64\n  args: --exec=\"launch Pro\"\n  dxvk: true\n  esync: true\n  game: null\n  overrides:\n    nvapi,nvapi64: disabled\n    xaudio2_7: native,builtin\n  prefix: $GAMEDIR\n"
}