{
  "id": 10244,
  "game_id": 21790,
  "game_slug": "where-in-the-usa-is-carmen-sandiego-deluxe-edition",
  "name": "Where in the U.S.A. Is Carmen Sandiego? (Deluxe Edition)",
  "year": 1993,
  "user": "Mr_Alert",
  "runner": "dosbox",
  "slug": "where-in-the-usa-is-carmen-sa-10-144mb-floppy",
  "version": "1.0 - 1.44MB Floppy",
  "description": null,
  "notes": "",
  "created_at": "2018-09-19T02:33:39.757046Z",
  "updated_at": "2018-09-20T00:09:22.129050Z",
  "draft": false,
  "published": true,
  "published_by": null,
  "rating": "",
  "steamid": null,
  "gogid": null,
  "gogslug": "",
  "humblestoreid": "",
  "script": {
    "game": {
      "main_file": "$GAMEDIR/play.conf"
    },
    "installer": [
      {
        "mkdir": "$GAMEDIR/c"
      },
      {
        "insert-disc": {
          "requires": "FILE1"
        }
      },
      {
        "merge": {
          "dst": "$GAMEDIR/a",
          "src": "$DISC"
        }
      },
      {
        "insert-disc": {
          "requires": "FILE2"
        }
      },
      {
        "merge": {
          "dst": "$GAMEDIR/a",
          "src": "$DISC"
        }
      },
      {
        "insert-disc": {
          "requires": "FILE3"
        }
      },
      {
        "merge": {
          "dst": "$GAMEDIR/a",
          "src": "$DISC"
        }
      },
      {
        "insert-disc": {
          "requires": "FILE4"
        }
      },
      {
        "merge": {
          "dst": "$GAMEDIR/a",
          "src": "$DISC"
        }
      },
      {
        "insert-disc": {
          "requires": "FILE5"
        }
      },
      {
        "merge": {
          "dst": "$GAMEDIR/a",
          "src": "$DISC"
        }
      },
      {
        "task": {
          "commands": [
            "C:",
            "CD USAD",
            "CARMEN.EXE",
            "exit"
          ],
          "drives": {
            "c": "$GAMEDIR/c"
          },
          "path": "$GAMEDIR/play.conf",
          "name": "makeconfig"
        }
      },
      {
        "task": {
          "commands": [
            "A:",
            "INSTALL.COM",
            "exit"
          ],
          "drives": {
            "c": "$GAMEDIR/c",
            "a": "$GAMEDIR/a"
          },
          "path": "$GAMEDIR/install.conf",
          "name": "makeconfig"
        }
      },
      {
        "task": {
          "working_dir": "$GAMEDIR",
          "config_file": "$GAMEDIR/install.conf",
          "name": "dosexec"
        }
      }
    ]
  },
  "content": "game:\n  main_file: $GAMEDIR/play.conf\ninstaller:\n- mkdir: $GAMEDIR/c\n- insert-disc:\n    requires: FILE1\n- merge:\n    dst: $GAMEDIR/a\n    src: $DISC\n- insert-disc:\n    requires: FILE2\n- merge:\n    dst: $GAMEDIR/a\n    src: $DISC\n- insert-disc:\n    requires: FILE3\n- merge:\n    dst: $GAMEDIR/a\n    src: $DISC\n- insert-disc:\n    requires: FILE4\n- merge:\n    dst: $GAMEDIR/a\n    src: $DISC\n- insert-disc:\n    requires: FILE5\n- merge:\n    dst: $GAMEDIR/a\n    src: $DISC\n- task:\n    commands:\n    - 'C:'\n    - CD USAD\n    - CARMEN.EXE\n    - exit\n    drives:\n      c: $GAMEDIR/c\n    name: makeconfig\n    path: $GAMEDIR/play.conf\n- task:\n    commands:\n    - 'A:'\n    - INSTALL.COM\n    - exit\n    drives:\n      a: $GAMEDIR/a\n      c: $GAMEDIR/c\n    name: makeconfig\n    path: $GAMEDIR/install.conf\n- task:\n    config_file: $GAMEDIR/install.conf\n    name: dosexec\n    working_dir: $GAMEDIR\n"
}