{
  "id": 8965,
  "game_id": 16129,
  "game_slug": "tony-hawks-underground-2",
  "name": "Tony Hawk's Underground 2",
  "year": 2004,
  "user": "cxf",
  "runner": "wine",
  "slug": "tony-hawks-underground-2-thug-pro-mod",
  "version": "THUG Pro Mod",
  "description": "Requires Tony Hawk's Underground 2 PC game files.",
  "notes": "",
  "created_at": "2018-06-30T23:54:30.621000Z",
  "updated_at": "2019-12-22T11:27:10.919050Z",
  "draft": false,
  "published": true,
  "published_by": 20548,
  "rating": "",
  "steamid": null,
  "gogid": null,
  "gogslug": "",
  "humblestoreid": "",
  "script": {
    "files": [
      {
        "mod": "http://dl.thugpro.com/THUGProSetup.exe"
      },
      {
        "dx2010": "https://lutris.net/files/tools/directx-2010.tar.gz"
      },
      {
        "thug2": "N/A:Please select THUG2 setup.exe"
      }
    ],
    "installer": [
      {
        "task": {
          "arch": "win32",
          "description": "Creating Wine prefix",
          "name": "create_prefix",
          "install_mono": false,
          "prefix": "$GAMEDIR"
        }
      },
      {
        "task": {
          "name": "set_regedit",
          "arch": "win32",
          "key": "GrabFullscreen",
          "prefix": "$GAMEDIR",
          "path": "HKEY_CURRENT_USER\\Software\\Wine\\X11 Driver",
          "value": "Y"
        }
      },
      {
        "task": {
          "name": "set_regedit",
          "arch": "win32",
          "key": "UseTakeFocus",
          "prefix": "$GAMEDIR",
          "path": "HKEY_CURRENT_USER\\Software\\Wine\\X11 Driver",
          "value": "N"
        }
      },
      {
        "task": {
          "description": "Installing .NET 4.7.2. This will take a while...",
          "name": "winetricks",
          "arch": "win32",
          "app": "dotnet472",
          "prefix": "$GAMEDIR"
        }
      },
      {
        "task": {
          "prefix": "$GAMEDIR",
          "name": "winetricks",
          "arch": "win32",
          "app": "powershell arial d3dcompiler_47 win7"
        }
      },
      {
        "task": {
          "prefix": "$GAMEDIR",
          "name": "winekill",
          "arch": "win32"
        }
      },
      {
        "task": {
          "prefix": "$GAMEDIR",
          "name": "wineexec",
          "arch": "win32",
          "executable": "thug2"
        }
      },
      {
        "task": {
          "prefix": "$GAMEDIR",
          "name": "winekill",
          "arch": "win32"
        }
      },
      {
        "task": {
          "description": "Please select the game folder:\n\"C:\\Program Files\\foldername\\Tony Hawk's Underground 2\\Game\"\nIt might be located somewhere else depending on which setup you used.",
          "name": "wineexec",
          "arch": "win32",
          "executable": "mod",
          "prefix": "$GAMEDIR"
        }
      },
      {
        "task": {
          "prefix": "$GAMEDIR",
          "name": "winekill",
          "arch": "win32"
        }
      }
    ],
    "game": {
      "prefix": "$GAMEDIR",
      "exe": "drive_c/users/$USER/Local Settings/Application Data/THUG Pro/THUGProLauncher.exe"
    },
    "system": {
      "pulse_latency": true
    },
    "wine": {
      "version": "lutris-mtga-4.21-x86_64",
      "Desktop": false,
      "esync": true
    }
  },
  "content": "files:\n- mod: http://dl.thugpro.com/THUGProSetup.exe\n- dx2010: https://lutris.net/files/tools/directx-2010.tar.gz\n- thug2: N/A:Please select THUG2 setup.exe\ngame:\n  exe: drive_c/users/$USER/Local Settings/Application Data/THUG Pro/THUGProLauncher.exe\n  prefix: $GAMEDIR\ninstaller:\n- task:\n    arch: win32\n    description: Creating Wine prefix\n    install_mono: false\n    name: create_prefix\n    prefix: $GAMEDIR\n- task:\n    arch: win32\n    key: GrabFullscreen\n    name: set_regedit\n    path: HKEY_CURRENT_USER\\Software\\Wine\\X11 Driver\n    prefix: $GAMEDIR\n    value: Y\n- task:\n    arch: win32\n    key: UseTakeFocus\n    name: set_regedit\n    path: HKEY_CURRENT_USER\\Software\\Wine\\X11 Driver\n    prefix: $GAMEDIR\n    value: N\n- task:\n    app: dotnet472\n    arch: win32\n    description: Installing .NET 4.7.2. This will take a while...\n    name: winetricks\n    prefix: $GAMEDIR\n- task:\n    app: powershell arial d3dcompiler_47 win7\n    arch: win32\n    name: winetricks\n    prefix: $GAMEDIR\n- task:\n    arch: win32\n    name: winekill\n    prefix: $GAMEDIR\n- task:\n    arch: win32\n    executable: thug2\n    name: wineexec\n    prefix: $GAMEDIR\n- task:\n    arch: win32\n    name: winekill\n    prefix: $GAMEDIR\n- task:\n    arch: win32\n    description: 'Please select the game folder:\n\n      \"C:\\Program Files\\foldername\\Tony Hawk''s Underground 2\\Game\"\n\n      It might be located somewhere else depending on which setup you used.'\n    executable: mod\n    name: wineexec\n    prefix: $GAMEDIR\n- task:\n    arch: win32\n    name: winekill\n    prefix: $GAMEDIR\nsystem:\n  pulse_latency: true\nwine:\n  Desktop: false\n  esync: true\n  version: lutris-mtga-4.21-x86_64\n"
}