{
  "id": 9307,
  "game_id": 13498,
  "game_slug": "hellblade-senuas-sacrifice",
  "name": "Hellblade: Senua's Sacrifice",
  "year": 2017,
  "user": "Redante",
  "runner": "wine",
  "slug": "hellblade-senuas-sacrifice-gog",
  "version": "GOG",
  "description": null,
  "notes": "Progress bar may not appear on installer. The game will install in the background",
  "created_at": "2018-07-20T23:50:01.841000Z",
  "updated_at": "2020-01-23T02:57:09.321308Z",
  "draft": false,
  "published": true,
  "published_by": 1,
  "rating": "",
  "steamid": 414340,
  "gogid": 1573355755,
  "gogslug": "hellblade_senuas_sacrifice",
  "humblestoreid": "",
  "script": {
    "files": [
      {
        "setup": "N/A:Select the installation executable downloaded from GOG"
      },
      {
        "directx": "https://lutris.net/files/tools/directx-2010.tar.gz"
      }
    ],
    "game": {
      "prefix": "$GAMEDIR",
      "arch": "win64",
      "exe": "drive_c/GOG Games/HellbladeSenuasSacrifice/HellbladeGame.exe"
    },
    "installer": [
      {
        "task": {
          "prefix": "$GAMEDIR",
          "name": "create_prefix",
          "arch": "win64"
        }
      },
      {
        "extract": {
          "dst": "$CACHE/dxsetup",
          "file": "directx"
        }
      },
      {
        "task": {
          "args": "/silent",
          "name": "wineexec",
          "arch": "win64",
          "executable": "$CACHE/dxsetup/DXSETUP.exe",
          "prefix": "$GAMEDIR"
        }
      },
      {
        "task": {
          "prefix": "$GAMEDIR",
          "name": "winekill"
        }
      },
      {
        "task": {
          "name": "set_regedit",
          "arch": "win64",
          "key": "HideWineExports",
          "prefix": "$GAMEDIR",
          "path": "HKEY_CURRENT_USER\\Software\\Wine",
          "value": "Y"
        }
      },
      {
        "task": {
          "prefix": "$GAMEDIR",
          "name": "winetricks",
          "arch": "win64",
          "app": "vcrun2012 vcrun2013 vcrun2015 win7"
        }
      },
      {
        "task": {
          "prefix": "$GAMEDIR",
          "name": "wineexec",
          "executable": "setup"
        }
      }
    ],
    "wine": {
      "dxvk": true
    }
  },
  "content": "files:\n- setup: N/A:Select the installation executable downloaded from GOG\n- directx: https://lutris.net/files/tools/directx-2010.tar.gz\ngame:\n  arch: win64\n  exe: drive_c/GOG Games/HellbladeSenuasSacrifice/HellbladeGame.exe\n  prefix: $GAMEDIR\ninstaller:\n- task:\n    arch: win64\n    name: create_prefix\n    prefix: $GAMEDIR\n- extract:\n    dst: $CACHE/dxsetup\n    file: directx\n- task:\n    arch: win64\n    args: /silent\n    executable: $CACHE/dxsetup/DXSETUP.exe\n    name: wineexec\n    prefix: $GAMEDIR\n- task:\n    name: winekill\n    prefix: $GAMEDIR\n- task:\n    arch: win64\n    key: HideWineExports\n    name: set_regedit\n    path: HKEY_CURRENT_USER\\Software\\Wine\n    prefix: $GAMEDIR\n    value: Y\n- task:\n    app: vcrun2012 vcrun2013 vcrun2015 win7\n    arch: win64\n    name: winetricks\n    prefix: $GAMEDIR\n- task:\n    executable: setup\n    name: wineexec\n    prefix: $GAMEDIR\nwine:\n  dxvk: true\n"
}