{
  "id": 4571,
  "game_id": 11855,
  "game_slug": "yumina-the-ethereal",
  "name": "Yumina the Ethereal",
  "year": 2008,
  "user": "FakeShemp",
  "runner": "wine",
  "slug": "yumina-the-ethereal-jast-usa",
  "version": "JAST USA",
  "description": "",
  "notes": "",
  "created_at": "2017-06-24T17:43:05.807000Z",
  "updated_at": "2017-07-01T19:23:10.472687Z",
  "draft": false,
  "published": true,
  "published_by": null,
  "rating": "",
  "steamid": null,
  "gogid": null,
  "gogslug": "",
  "humblestoreid": "",
  "script": {
    "game": {
      "exe": "drive_c/Games/Jast Densetsu/Yumina/Yumina.exe",
      "prefix": "$GAMEDIR"
    },
    "files": [
      {
        "file1": "N/A:Please select the JAST USA setup archive"
      },
      {
        "file2": "N/A:Please select the fist data archive"
      },
      {
        "file3": "N/A:Please select the second data archive"
      },
      {
        "file4": "N/A:Please select the third data archive"
      }
    ],
    "installer": [
      {
        "extract": {
          "dst": "$CACHE",
          "file": "$file1"
        }
      },
      {
        "merge": {
          "dst": "$CACHE",
          "src": "$file2"
        }
      },
      {
        "merge": {
          "dst": "$CACHE",
          "src": "$file3"
        }
      },
      {
        "merge": {
          "dst": "$CACHE",
          "src": "$file4"
        }
      },
      {
        "task": {
          "prefix": "$GAMEDIR",
          "executable": "$CACHE/Setup.exe",
          "name": "wineexec"
        }
      },
      {
        "task": {
          "prefix": "$GAMEDIR",
          "app": "corefonts",
          "name": "winetricks"
        }
      }
    ]
  },
  "content": "files:\n- file1: N/A:Please select the JAST USA setup archive\n- file2: N/A:Please select the fist data archive\n- file3: N/A:Please select the second data archive\n- file4: N/A:Please select the third data archive\ngame:\n  exe: drive_c/Games/Jast Densetsu/Yumina/Yumina.exe\n  prefix: $GAMEDIR\ninstaller:\n- extract:\n    dst: $CACHE\n    file: $file1\n- merge:\n    dst: $CACHE\n    src: $file2\n- merge:\n    dst: $CACHE\n    src: $file3\n- merge:\n    dst: $CACHE\n    src: $file4\n- task:\n    executable: $CACHE/Setup.exe\n    name: wineexec\n    prefix: $GAMEDIR\n- task:\n    app: corefonts\n    name: winetricks\n    prefix: $GAMEDIR\n"
}