{
  "id": 5071,
  "game_id": 6747,
  "game_slug": "blazblue-chronophantasma-extend",
  "name": "BlazBlue: Chronophantasma Extend",
  "year": null,
  "user": "goolord",
  "runner": "winesteam",
  "slug": "blazblue-chronophantasma-exte-steam",
  "version": "Steam",
  "description": null,
  "notes": "",
  "created_at": "2017-07-17T06:20:23.935000Z",
  "updated_at": "2018-09-28T06:34:53.739580Z",
  "draft": false,
  "published": true,
  "published_by": null,
  "rating": "",
  "steamid": 388750,
  "gogid": null,
  "gogslug": "",
  "humblestoreid": "",
  "script": {
    "game": {
      "prefix": "$GAMEDIR/prefix",
      "appid": 388750,
      "arch": "win32"
    },
    "winesteam": {
      "overrides": {
        "xaudio2_7": "native,builtin"
      },
      "version": "staging-3.16-i386"
    },
    "installer": [
      {
        "task": {
          "prefix": "$GAMEDIR/prefix",
          "arch": "win32",
          "name": "create_prefix"
        }
      },
      {
        "task": {
          "description": "Installing Quartz",
          "arch": "win32",
          "prefix": "$GAMEDIR/prefix",
          "name": "winetricks",
          "app": "quartz"
        }
      },
      {
        "task": {
          "description": "Installing devenum",
          "arch": "win32",
          "prefix": "$GAMEDIR/prefix",
          "name": "winetricks",
          "app": "devenum"
        }
      },
      {
        "task": {
          "description": "Installing Windows Media Player 9",
          "arch": "win32",
          "prefix": "$GAMEDIR/prefix",
          "name": "winetricks",
          "app": "wmp9"
        }
      },
      {
        "task": {
          "description": "Installing xact",
          "arch": "win32",
          "prefix": "$GAMEDIR/prefix",
          "name": "winetricks",
          "app": "xact"
        }
      },
      {
        "task": {
          "arch": "win32",
          "prefix": "$GAMEDIR/prefix",
          "name": "winetricks",
          "app": "winxp"
        }
      },
      {
        "task": {
          "prefix": "$GAMEDIR/prefix",
          "name": "set_regedit",
          "path": "HKEY_CURRENT_USER\\Software\\Wine\\AppDefaults\\Steam.exe",
          "value": "win7",
          "key": "Version",
          "arch": "win32"
        }
      }
    ]
  },
  "content": "game:\n  appid: 388750\n  arch: win32\n  prefix: $GAMEDIR/prefix\ninstaller:\n- task:\n    arch: win32\n    name: create_prefix\n    prefix: $GAMEDIR/prefix\n- task:\n    app: quartz\n    arch: win32\n    description: Installing Quartz\n    name: winetricks\n    prefix: $GAMEDIR/prefix\n- task:\n    app: devenum\n    arch: win32\n    description: Installing devenum\n    name: winetricks\n    prefix: $GAMEDIR/prefix\n- task:\n    app: wmp9\n    arch: win32\n    description: Installing Windows Media Player 9\n    name: winetricks\n    prefix: $GAMEDIR/prefix\n- task:\n    app: xact\n    arch: win32\n    description: Installing xact\n    name: winetricks\n    prefix: $GAMEDIR/prefix\n- task:\n    app: winxp\n    arch: win32\n    name: winetricks\n    prefix: $GAMEDIR/prefix\n- task:\n    arch: win32\n    key: Version\n    name: set_regedit\n    path: HKEY_CURRENT_USER\\Software\\Wine\\AppDefaults\\Steam.exe\n    prefix: $GAMEDIR/prefix\n    value: win7\nwinesteam:\n  overrides:\n    xaudio2_7: native,builtin\n  version: staging-3.16-i386\n"
}