{
  "id": 8543,
  "game_id": 14669,
  "game_slug": "neverwinter-nights-2-complete",
  "name": "Neverwinter Nights 2: Complete",
  "year": 2006,
  "user": "libgradev",
  "runner": "wine",
  "slug": "neverwinter-nights-2-complete-gog",
  "version": "GOG",
  "description": "12 gigabytes of disk space are required for installation. If you change the destination folder in the GOG installer, you will need to manually identify nwn2main.exe as the game's executable.",
  "notes": "",
  "created_at": "2018-06-05T12:31:22.476000Z",
  "updated_at": "2018-06-05T19:14:56.422851Z",
  "draft": false,
  "published": true,
  "published_by": null,
  "rating": "",
  "steamid": null,
  "gogid": 1207659162,
  "gogslug": "neverwinter_nights_2_complete",
  "humblestoreid": "",
  "script": {
    "game": {
      "arch": "win32",
      "prefix": "$GAMEDIR",
      "exe": "drive_c/GOG Games/Neverwinter Nights 2 Complete/nwn2main.exe"
    },
    "wine": {
      "version": "staging-3.9-x86_64"
    },
    "files": [
      {
        "game": "N/A:Please select the GOG.com Windows installer"
      }
    ],
    "installer": [
      {
        "task": {
          "prefix": "$GAMEDIR",
          "description": "Creating Wine prefix",
          "name": "create_prefix"
        }
      },
      {
        "task": {
          "prefix": "$GAMEDIR",
          "executable": "game",
          "args": "/VERYSILENT /SP- /NOCANCEL /SUPPRESSMSGBOXES '/DIR=C:/game'",
          "description": "Installing Game...",
          "name": "wineexec"
        }
      },
      {
        "task": {
          "prefix": "$GAMEDIR",
          "name": "winetricks",
          "silent": true,
          "app": "devenum"
        }
      },
      {
        "task": {
          "prefix": "$GAMEDIR",
          "name": "winetricks",
          "silent": true,
          "app": "dxdiagn"
        }
      },
      {
        "task": {
          "prefix": "$GAMEDIR",
          "name": "winetricks",
          "silent": true,
          "app": "directx9"
        }
      },
      {
        "task": {
          "prefix": "$GAMEDIR",
          "name": "winetricks",
          "silent": true,
          "app": "vcrun2005"
        }
      }
    ]
  },
  "content": "files:\n- game: N/A:Please select the GOG.com Windows installer\ngame:\n  arch: win32\n  exe: drive_c/GOG Games/Neverwinter Nights 2 Complete/nwn2main.exe\n  prefix: $GAMEDIR\ninstaller:\n- task:\n    description: Creating Wine prefix\n    name: create_prefix\n    prefix: $GAMEDIR\n- task:\n    args: /VERYSILENT /SP- /NOCANCEL /SUPPRESSMSGBOXES '/DIR=C:/game'\n    description: Installing Game...\n    executable: game\n    name: wineexec\n    prefix: $GAMEDIR\n- task:\n    app: devenum\n    name: winetricks\n    prefix: $GAMEDIR\n    silent: true\n- task:\n    app: dxdiagn\n    name: winetricks\n    prefix: $GAMEDIR\n    silent: true\n- task:\n    app: directx9\n    name: winetricks\n    prefix: $GAMEDIR\n    silent: true\n- task:\n    app: vcrun2005\n    name: winetricks\n    prefix: $GAMEDIR\n    silent: true\nwine:\n  version: staging-3.9-x86_64\n"
}