{
  "id": 15760,
  "game_id": 1529,
  "game_slug": "trackmania2-stadium",
  "name": "TrackManiaÂ² Stadium",
  "year": 2013,
  "user": "BenTGNU",
  "runner": "wine",
  "slug": "trackmania2-stadium-mania-planet",
  "version": "Mania Planet",
  "description": null,
  "notes": "",
  "created_at": "2019-09-23T05:47:23.310190Z",
  "updated_at": "2019-09-23T05:47:23.310217Z",
  "draft": true,
  "published": false,
  "published_by": null,
  "rating": "",
  "steamid": 232910,
  "gogid": null,
  "gogslug": "",
  "humblestoreid": "",
  "script": {
    "game": {
      "arch": "win32",
      "prefix": "$GAMEDIR",
      "exe": "drive_c/Program Files/ManiaPlanet/TmStadium/TmStadiumLauncher.exe"
    },
    "files": [
      {
        "setup": "Maniaplanet_Setup_TMStadium.exe"
      }
    ],
    "installer": [
      {
        "task": {
          "prefix": "$GAMEDIR",
          "description": "Creating Wine prefix",
          "name": "create_prefix"
        }
      },
      {
        "task": {
          "prefix": "$GAMEDIR",
          "path": "HKEY_CURRENT_USER\\Software\\Wine\\DllOverrides",
          "value": "",
          "type": "REG_SZ",
          "key": "winemenubuilder.exe",
          "name": "set_regedit"
        }
      },
      {
        "task": {
          "prefix": "$GAMEDIR",
          "description": "DirectX",
          "name": "winetricks",
          "silent": true,
          "app": "d3dx9"
        }
      },
      {
        "task": {
          "prefix": "$GAMEDIR",
          "executable": "game",
          "args": "/silent",
          "description": "Installing...",
          "name": "wineexec"
        }
      },
      {
        "task": {
          "prefix": "$GAMEDIR",
          "description": "Disabling unused WINE features",
          "name": "winetricks",
          "silent": true,
          "app": "sandbox"
        }
      }
    ]
  },
  "content": "files:\n- setup: Maniaplanet_Setup_TMStadium.exe\ngame:\n  arch: win32\n  exe: drive_c/Program Files/ManiaPlanet/TmStadium/TmStadiumLauncher.exe\n  prefix: $GAMEDIR\ninstaller:\n- task:\n    description: Creating Wine prefix\n    name: create_prefix\n    prefix: $GAMEDIR\n- task:\n    key: winemenubuilder.exe\n    name: set_regedit\n    path: HKEY_CURRENT_USER\\Software\\Wine\\DllOverrides\n    prefix: $GAMEDIR\n    type: REG_SZ\n    value: ''\n- task:\n    app: d3dx9\n    description: DirectX\n    name: winetricks\n    prefix: $GAMEDIR\n    silent: true\n- task:\n    args: /silent\n    description: Installing...\n    executable: game\n    name: wineexec\n    prefix: $GAMEDIR\n- task:\n    app: sandbox\n    description: Disabling unused WINE features\n    name: winetricks\n    prefix: $GAMEDIR\n    silent: true\n"
}