{
  "id": 16491,
  "game_id": 6374,
  "game_slug": "cabal-online",
  "name": "CABAL Online",
  "year": null,
  "user": "lukica9",
  "runner": "wine",
  "slug": "cabal-online-standard",
  "version": "Standard",
  "description": "For NA SERVERS",
  "notes": "",
  "created_at": "2019-10-30T12:38:16.063179Z",
  "updated_at": "2020-01-23T02:57:20.409833Z",
  "draft": true,
  "published": false,
  "published_by": null,
  "rating": "",
  "steamid": 253490,
  "gogid": null,
  "gogslug": "",
  "humblestoreid": "",
  "script": {
    "overrides": {
      "msvcrt.dll": "n"
    },
    "installer": [
      {
        "task": {
          "arch": "win32",
          "description": "Creating 32-bit Wine prefix.",
          "prefix": "$GAMEDIR",
          "name": "create_prefix"
        }
      },
      {
        "task": {
          "app": "winxp",
          "prefix": "$GAMEDIR",
          "name": "winetricks"
        }
      },
      {
        "task": {
          "arch": "win32",
          "executable": "vcredist",
          "description": "Install vcredist 2012",
          "prefix": "$GAMEDIR",
          "name": "wineexec"
        }
      },
      {
        "task": {
          "arch": "win32",
          "executable": "directx",
          "description": "Install directx 9.0c",
          "prefix": "$GAMEDIR",
          "name": "wineexec"
        }
      },
      {
        "task": {
          "arch": "win32",
          "executable": "game_setup",
          "description": "Installing Cabal Online NA",
          "prefix": "$GAMEDIR",
          "name": "wineexec"
        }
      }
    ],
    "files": [
      {
        "game_setup": {
          "url": "http://cdn2.playthisgame.com/Setup/11132014_US_Setup.exe",
          "filename": "11132014_US_Setup.exe"
        }
      },
      {
        "vcredist": {
          "url": "https://download.microsoft.com/download/C/6/D/C6D0FD4E-9E53-4897-9B91-836EBA2AACD3/vcredist_x86.exe",
          "filename": "vcredist_x86.exe"
        }
      },
      {
        "directx": {
          "url": "https://download.microsoft.com/download/8/0/d/80d7e79d-c0e4-415a-bcca-e229eafe2679/dxwebsetup.exe",
          "filename": "dxwebsetup.exe"
        }
      }
    ],
    "game": {
      "arch": "win32",
      "prefix": "$GAMEDIR",
      "exe": "drive_c/Program Files/CABAL Online (NA)/CabalMain.exe"
    }
  },
  "content": "files:\n- game_setup:\n    filename: 11132014_US_Setup.exe\n    url: http://cdn2.playthisgame.com/Setup/11132014_US_Setup.exe\n- vcredist:\n    filename: vcredist_x86.exe\n    url: https://download.microsoft.com/download/C/6/D/C6D0FD4E-9E53-4897-9B91-836EBA2AACD3/vcredist_x86.exe\n- directx:\n    filename: dxwebsetup.exe\n    url: https://download.microsoft.com/download/8/0/d/80d7e79d-c0e4-415a-bcca-e229eafe2679/dxwebsetup.exe\ngame:\n  arch: win32\n  exe: drive_c/Program Files/CABAL Online (NA)/CabalMain.exe\n  prefix: $GAMEDIR\ninstaller:\n- task:\n    arch: win32\n    description: Creating 32-bit Wine prefix.\n    name: create_prefix\n    prefix: $GAMEDIR\n- task:\n    app: winxp\n    name: winetricks\n    prefix: $GAMEDIR\n- task:\n    arch: win32\n    description: Install vcredist 2012\n    executable: vcredist\n    name: wineexec\n    prefix: $GAMEDIR\n- task:\n    arch: win32\n    description: Install directx 9.0c\n    executable: directx\n    name: wineexec\n    prefix: $GAMEDIR\n- task:\n    arch: win32\n    description: Installing Cabal Online NA\n    executable: game_setup\n    name: wineexec\n    prefix: $GAMEDIR\noverrides:\n  msvcrt.dll: n\n"
}