{
  "id": 2235,
  "game_id": 6383,
  "game_slug": "gog-downloader",
  "name": "GOG Downloader",
  "year": 2014,
  "user": "RobLoach",
  "runner": "wine",
  "slug": "gog-downloader-wine",
  "version": "Wine",
  "description": "",
  "notes": "https://appdb.winehq.org/objectManager.php?sClass=application&iId=14013",
  "created_at": "2016-07-02T17:58:37.636616Z",
  "updated_at": "2016-07-03T05:56:36.883605Z",
  "draft": false,
  "published": true,
  "published_by": null,
  "rating": "1",
  "steamid": null,
  "gogid": null,
  "gogslug": "",
  "humblestoreid": "",
  "script": {
    "files": [
      {
        "netframework": "https://lutris.net/files/runners/netframework3.exe"
      },
      {
        "downloader": "http://static.gog.com/download/d3/stable/Setup_Downloader_3.6.0_stable.exe"
      }
    ],
    "game": {
      "prefix": "$GAMEDIR",
      "arch": "win32",
      "exe": "drive_c/Program Files/GOG.com/GOG.com Downloader.exe",
      "version": "1.9.13-i368"
    },
    "installer": [
      {
        "task": {
          "description": "Creating Wine prefix",
          "name": "create_prefix",
          "prefix": "$GAMEDIR"
        }
      },
      {
        "mkdir": "$HOME/.cache/winetricks/dotnet30"
      },
      {
        "move": {
          "dst": "$HOME/.cache/winetricks/dotnet30",
          "src": "netframework"
        }
      },
      {
        "task": {
          "description": "Installing .NET 3.5",
          "name": "winetricks",
          "app": "dotnet35",
          "prefix": "$GAMEDIR"
        }
      },
      {
        "task": {
          "description": "Installing .NET 3.5 SP1",
          "name": "winetricks",
          "app": "dotnet35sp1",
          "prefix": "$GAMEDIR"
        }
      },
      {
        "task": {
          "description": "Installing Windows codecs",
          "name": "winetricks",
          "app": "windowscodecs",
          "prefix": "$GAMEDIR"
        }
      },
      {
        "task": {
          "prefix": "$GAMEDIR",
          "name": "wineexec",
          "executable": "downloader"
        }
      }
    ]
  },
  "content": "files:\r\n- netframework: https://lutris.net/files/runners/netframework3.exe\r\n- downloader: http://static.gog.com/download/d3/stable/Setup_Downloader_3.6.0_stable.exe\r\ngame:\r\n  arch: win32\r\n  exe: drive_c/Program Files/GOG.com/GOG.com Downloader.exe\r\n  prefix: $GAMEDIR\r\n  version: 1.9.13-i368\r\ninstaller:\r\n- task:\r\n    description: Creating Wine prefix\r\n    name: create_prefix\r\n    prefix: $GAMEDIR\r\n- mkdir: $HOME/.cache/winetricks/dotnet30\r\n- move:\r\n    dst: $HOME/.cache/winetricks/dotnet30\r\n    src: netframework\r\n- task:\r\n    app: dotnet35\r\n    description: Installing .NET 3.5\r\n    name: winetricks\r\n    prefix: $GAMEDIR\r\n- task:\r\n    app: dotnet35sp1\r\n    description: Installing .NET 3.5 SP1\r\n    name: winetricks\r\n    prefix: $GAMEDIR\r\n- task:\r\n    app: windowscodecs\r\n    description: Installing Windows codecs\r\n    name: winetricks\r\n    prefix: $GAMEDIR\r\n- task:\r\n    executable: downloader\r\n    name: wineexec\r\n    prefix: $GAMEDIR"
}