{
  "id": 11782,
  "game_id": 9056,
  "game_slug": "trackmania-united-forever",
  "name": "TrackMania United Forever",
  "year": 2006,
  "user": "r6RNjMKgw",
  "runner": "wine",
  "slug": "trackmania-united-forever-retail-dvd",
  "version": "Retail, DVD",
  "description": "Requires a valid serial number.",
  "notes": "",
  "created_at": "2019-01-30T18:29:18.050240Z",
  "updated_at": "2019-02-15T01:02:46.081055Z",
  "draft": false,
  "published": true,
  "published_by": 19464,
  "rating": "",
  "steamid": null,
  "gogid": null,
  "gogslug": "",
  "humblestoreid": "",
  "script": {
    "game": {
      "arch": "win32",
      "prefix": "$GAMEDIR",
      "exe": "drive_c/Program Files/TmUnitedForever/TmForeverLauncher.exe"
    },
    "files": [
      {
        "update": "http://files2.trackmaniaforever.com/TmUnitedForever_Update_2010-03-15_Setup.exe"
      }
    ],
    "installer": [
      {
        "insert-disc": {
          "requires": "TmUnitedForeverSetup.exe"
        }
      },
      {
        "task": {
          "install_mono": false,
          "prefix": "$GAMEDIR",
          "description": "Creating Wine prefix",
          "name": "create_prefix"
        }
      },
      {
        "task": {
          "prefix": "$GAMEDIR",
          "path": "HKEY_CURRENT_USER\\Software\\Wine\\DllOverrides",
          "value": "",
          "type": "REG_SZ",
          "key": "winemenubuilder.exe",
          "name": "set_regedit"
        }
      },
      {
        "task": {
          "prefix": "$GAMEDIR",
          "executable": "$DISC/TmUnitedForeverSetup.exe",
          "args": "/silent",
          "description": "Installing...",
          "name": "wineexec"
        }
      },
      {
        "task": {
          "prefix": "$GAMEDIR",
          "executable": "update",
          "args": "/silent",
          "description": "Updating...",
          "name": "wineexec"
        }
      },
      {
        "task": {
          "prefix": "$GAMEDIR",
          "description": "Disabling unused WINE features",
          "name": "winetricks",
          "silent": true,
          "app": "sandbox"
        }
      }
    ]
  },
  "content": "files:\n- update: http://files2.trackmaniaforever.com/TmUnitedForever_Update_2010-03-15_Setup.exe\ngame:\n  arch: win32\n  exe: drive_c/Program Files/TmUnitedForever/TmForeverLauncher.exe\n  prefix: $GAMEDIR\ninstaller:\n- insert-disc:\n    requires: TmUnitedForeverSetup.exe\n- task:\n    description: Creating Wine prefix\n    install_mono: false\n    name: create_prefix\n    prefix: $GAMEDIR\n- task:\n    key: winemenubuilder.exe\n    name: set_regedit\n    path: HKEY_CURRENT_USER\\Software\\Wine\\DllOverrides\n    prefix: $GAMEDIR\n    type: REG_SZ\n    value: ''\n- task:\n    args: /silent\n    description: Installing...\n    executable: $DISC/TmUnitedForeverSetup.exe\n    name: wineexec\n    prefix: $GAMEDIR\n- task:\n    args: /silent\n    description: Updating...\n    executable: update\n    name: wineexec\n    prefix: $GAMEDIR\n- task:\n    app: sandbox\n    description: Disabling unused WINE features\n    name: winetricks\n    prefix: $GAMEDIR\n    silent: true\n"
}