{
  "id": 12394,
  "game_id": 9056,
  "game_slug": "trackmania-united-forever",
  "name": "TrackMania United Forever",
  "year": 2006,
  "user": "Danacus",
  "runner": "wine",
  "slug": "trackmania-united-forever-retail-without-cd",
  "version": "Retail (without CD)",
  "description": "Requires a valid serial number and the installer downloaded from player.trackmania.com.",
  "notes": "",
  "created_at": "2019-03-15T17:47:02.156000Z",
  "updated_at": "2019-03-17T01:33:36.073244Z",
  "draft": false,
  "published": true,
  "published_by": 19464,
  "rating": "",
  "steamid": null,
  "gogid": null,
  "gogslug": "",
  "humblestoreid": "",
  "script": {
    "files": [
      {
        "installer": "N/A:Select the game's setup file"
      }
    ],
    "game": {
      "prefix": "$GAMEDIR",
      "arch": "win32",
      "exe": "drive_c/Program Files/TmUnitedForever/TmForeverLauncher.exe"
    },
    "installer": [
      {
        "task": {
          "description": "Creating Wine prefix",
          "name": "create_prefix",
          "install_mono": false,
          "prefix": "$GAMEDIR"
        }
      },
      {
        "task": {
          "name": "set_regedit",
          "key": "winemenubuilder.exe",
          "prefix": "$GAMEDIR",
          "path": "HKEY_CURRENT_USER\\Software\\Wine\\DllOverrides",
          "value": "",
          "type": "REG_SZ"
        }
      },
      {
        "task": {
          "args": "/silent",
          "name": "wineexec",
          "executable": "installer",
          "description": "Installing...",
          "prefix": "$GAMEDIR"
        }
      },
      {
        "task": {
          "silent": true,
          "description": "Disabling unused WINE features",
          "name": "winetricks",
          "app": "sandbox",
          "prefix": "$GAMEDIR"
        }
      }
    ]
  },
  "content": "files:\n- installer: N/A:Select the game's setup file\ngame:\n  arch: win32\n  exe: drive_c/Program Files/TmUnitedForever/TmForeverLauncher.exe\n  prefix: $GAMEDIR\ninstaller:\n- task:\n    description: Creating Wine prefix\n    install_mono: false\n    name: create_prefix\n    prefix: $GAMEDIR\n- task:\n    key: winemenubuilder.exe\n    name: set_regedit\n    path: HKEY_CURRENT_USER\\Software\\Wine\\DllOverrides\n    prefix: $GAMEDIR\n    type: REG_SZ\n    value: ''\n- task:\n    args: /silent\n    description: Installing...\n    executable: installer\n    name: wineexec\n    prefix: $GAMEDIR\n- task:\n    app: sandbox\n    description: Disabling unused WINE features\n    name: winetricks\n    prefix: $GAMEDIR\n    silent: true\n"
}