{
  "id": 18789,
  "game_id": 77,
  "game_slug": "red-eclipse",
  "name": "Red Eclipse",
  "year": 2011,
  "user": "vanstaveren",
  "runner": "wine",
  "slug": "red-eclipse-200-vulkan",
  "version": "2.0.0-vulkan",
  "description": null,
  "notes": "",
  "created_at": "2020-03-11T20:46:41.282517Z",
  "updated_at": "2020-03-20T10:48:06.394121Z",
  "draft": true,
  "published": false,
  "published_by": null,
  "rating": "",
  "steamid": null,
  "gogid": null,
  "gogslug": "",
  "humbleid": "",
  "humblestoreid": "",
  "humblestoreid_real": "",
  "script": {
    "files": [
      {
        "RedEclipse.exe": "https://github.com/redeclipse/base/releases/download/v2.0.0/redeclipse_2.0.0_win.exe"
      }
    ],
    "game": {
      "arch": "win64",
      "custom-name": "Red Eclipse",
      "exe": "$GAMEDIR/prefix/drive_c/Program Files (x86)/Red Eclipse/bin/amd64/redeclipse.exe",
      "prefix": "$GAMEDIR/prefix"
    },
    "installer": [
      {
        "task": {
          "arch": "win64",
          "description": "Creating 64-bit prefix ...",
          "name": "create_prefix",
          "prefix": "$GAMEDIR/prefix"
        }
      },
      {
        "move": {
          "description": "Moving Red Eclipse ...",
          "dst": "$GAMEDIR/prefix/drive_c/",
          "src": "RedEclipse.exe"
        }
      },
      {
        "task": {
          "app": "d3drm",
          "arch": "win64",
          "description": "DirectX ...",
          "name": "winetricks",
          "prefix": "$GAMEDIR/prefix"
        }
      },
      {
        "task": {
          "app": "d3dcompiler_43",
          "arch": "win64",
          "description": "DirectX 11 ...",
          "name": "winetricks",
          "prefix": "$GAMEDIR/prefix"
        }
      },
      {
        "task": {
          "app": "d3dx11_43",
          "arch": "win64",
          "description": "DirectX 11 ...",
          "name": "winetricks",
          "prefix": "$GAMEDIR/prefix"
        }
      },
      {
        "task": {
          "app": "dxvk",
          "arch": "win64",
          "description": "Vulkan ...",
          "name": "winetricks",
          "prefix": "$GAMEDIR/prefix"
        }
      },
      {
        "task": {
          "description": "Red Eclipse 2.0.0 ...",
          "executable": "$GAMEDIR/prefix/drive_c/redeclipse_2.0.0_win.exe",
          "name": "wineexec",
          "prefix": "$GAMEDIR/prefix"
        }
      },
      {
        "task": {
          "app": "win8",
          "arch": "win64",
          "description": "Windows version 8 ...",
          "name": "winetricks",
          "prefix": "$GAMEDIR/prefix"
        }
      }
    ],
    "system": {
      "disable_compositor": true,
      "pulse_latency": true
    },
    "wine": {
      "dxvk": true,
      "esync": true
    }
  },
  "content": "files:\r\n- RedEclipse.exe: https://github.com/redeclipse/base/releases/download/v2.0.0/redeclipse_2.0.0_win.exe\r\ngame:\r\n  arch: win64\r\n  custom-name: Red Eclipse\r\n  exe: $GAMEDIR/prefix/drive_c/Program Files (x86)/Red Eclipse/bin/amd64/redeclipse.exe\r\n  prefix: $GAMEDIR/prefix\r\ninstaller:\r\n- task:\r\n    arch: win64\r\n    description: Creating 64-bit prefix ...\r\n    name: create_prefix\r\n    prefix: $GAMEDIR/prefix\r\n- move:\r\n    description: Moving Red Eclipse ...\r\n    dst: $GAMEDIR/prefix/drive_c/\r\n    src: RedEclipse.exe\r\n- task:\r\n    app: d3drm\r\n    arch: win64\r\n    description: DirectX ...\r\n    name: winetricks\r\n    prefix: $GAMEDIR/prefix\r\n- task:\r\n    app: d3dcompiler_43\r\n    arch: win64\r\n    description: DirectX 11 ...\r\n    name: winetricks\r\n    prefix: $GAMEDIR/prefix\r\n- task:\r\n    app: d3dx11_43\r\n    arch: win64\r\n    description: DirectX 11 ...\r\n    name: winetricks\r\n    prefix: $GAMEDIR/prefix\r\n- task:\r\n    app: dxvk\r\n    arch: win64\r\n    description: Vulkan ...\r\n    name: winetricks\r\n    prefix: $GAMEDIR/prefix\r\n- task:\r\n    description: Red Eclipse 2.0.0 ...\r\n    executable: $GAMEDIR/prefix/drive_c/redeclipse_2.0.0_win.exe\r\n    name: wineexec\r\n    prefix: $GAMEDIR/prefix\r\n- task:\r\n    app: win8\r\n    arch: win64\r\n    description: Windows version 8 ...\r\n    name: winetricks\r\n    prefix: $GAMEDIR/prefix\r\nsystem:\r\n  disable_compositor: true\r\n  pulse_latency: true\r\nwine:\r\n  dxvk: true\r\n  esync: true"
}