{
  "id": 13808,
  "game_id": 21766,
  "game_slug": "world-of-warplanes",
  "name": "World of Warplanes",
  "year": null,
  "user": "salmonit",
  "runner": "wine",
  "slug": "world-of-warplanes-eu-dxvk",
  "version": "EU DXVK",
  "description": null,
  "notes": "",
  "created_at": "2019-05-30T18:37:42.681081Z",
  "updated_at": "2019-05-30T18:37:42.681109Z",
  "draft": true,
  "published": false,
  "published_by": null,
  "rating": "",
  "steamid": 790710,
  "gogid": null,
  "gogslug": "",
  "humblestoreid": "",
  "script": {
    "system": {
      "pulse_latency": true,
      "env": {
        "DXVK_HUD": 0
      }
    },
    "game": {
      "arch": "win64",
      "prefix": "$GAMEDIR",
      "exe": "drive_c/Games/World_of_Warplanes/WoWPLauncher.exe"
    },
    "wine": {
      "WineDesktop": "1920x1080",
      "overrides": {
        "xaudio2_7": "native,builtin"
      },
      "dxvk": true,
      "Desktop": true,
      "version": "tkg-4.0-x86_64"
    },
    "files": [
      {
        "game": "http://redirect.wargaming.net/WGC/Wargaming_Game_Center_Install_WoWP_EU.exe"
      }
    ],
    "installer": [
      {
        "task": {
          "arch": "win64",
          "prefix": "$GAMEDIR",
          "description": "Creating Wine prefix",
          "name": "create_prefix"
        }
      },
      {
        "task": {
          "arch": "win64",
          "prefix": "$GAMEDIR",
          "name": "winetricks",
          "app": "corefonts win10"
        }
      },
      {
        "task": {
          "prefix": "$GAMEDIR",
          "executable": "game",
          "description": "Installing World of Warplanes",
          "args": "/VERYSILENT /CLOSEAPPLICATIONS",
          "arch": "win64",
          "exclude_processes": "explorer.exe rpcss.exe services.exe winedevice.exe plugplay.exe WargamingGameUpdater.exe WoWPLauncher.exe",
          "name": "wineexec"
        }
      },
      {
        "task": {
          "arch": "win64",
          "prefix": "$GAMEDIR",
          "name": "winekill"
        }
      }
    ]
  },
  "content": "files:\n- game: http://redirect.wargaming.net/WGC/Wargaming_Game_Center_Install_WoWP_EU.exe\ngame:\n  arch: win64\n  exe: drive_c/Games/World_of_Warplanes/WoWPLauncher.exe\n  prefix: $GAMEDIR\ninstaller:\n- task:\n    arch: win64\n    description: Creating Wine prefix\n    name: create_prefix\n    prefix: $GAMEDIR\n- task:\n    app: corefonts win10\n    arch: win64\n    name: winetricks\n    prefix: $GAMEDIR\n- task:\n    arch: win64\n    args: /VERYSILENT /CLOSEAPPLICATIONS\n    description: Installing World of Warplanes\n    exclude_processes: explorer.exe rpcss.exe services.exe winedevice.exe plugplay.exe\n      WargamingGameUpdater.exe WoWPLauncher.exe\n    executable: game\n    name: wineexec\n    prefix: $GAMEDIR\n- task:\n    arch: win64\n    name: winekill\n    prefix: $GAMEDIR\nsystem:\n  env:\n    DXVK_HUD: 0\n  pulse_latency: true\nwine:\n  Desktop: true\n  WineDesktop: 1920x1080\n  dxvk: true\n  overrides:\n    xaudio2_7: native,builtin\n  version: tkg-4.0-x86_64\n"
}