{
  "id": 16189,
  "game_id": 9478,
  "game_slug": "allods-online-mycom",
  "name": "Allods Online",
  "year": 2010,
  "user": "Gremgoll",
  "runner": "wine",
  "slug": "allods-online-d9vk-mycom-german",
  "version": "D9VK (My.com German)",
  "description": "This is the german installer of Allods [My.com Game Center].\r\nThis Setup makes use of DirectX 9 Vulkan Layer [D9VK] and runs with high fps.",
  "notes": "- Switched to legacy setup from 2019/08 (Otherwise Setup fails with OS not supported)\r\n- You can switch Language after Setup in Gamecenter\r\n- Everything works so far (even display of numbers / text in chat window)",
  "created_at": "2019-10-14T09:54:43.030000Z",
  "updated_at": "2019-10-16T04:06:39.092795Z",
  "draft": false,
  "published": true,
  "published_by": 19464,
  "rating": "",
  "steamid": 459160,
  "gogid": null,
  "gogslug": "",
  "humblestoreid": "",
  "script": {
    "system": {
      "exclude_processes": "GameCenter.exe Launcher.exe",
      "env": {
        "DXVK_HUD": "gpuload"
      }
    },
    "game": {
      "arch": "win32",
      "prefix": "$GAMEDIR",
      "exe": "drive_c/users/$USER/Local Settings/Application Data/GameCenter/GameCenter.exe"
    },
    "wine": {
      "d9vk": true,
      "version": "3.21-x86_64"
    },
    "files": [
      {
        "setup": "https://gremgoll.de/files/AllodsdeLoader_de.exe"
      }
    ],
    "installer": [
      {
        "task": {
          "arch": "win32",
          "prefix": "$GAMEDIR",
          "description": "Creating 32bit Wine prefix.",
          "name": "create_prefix"
        }
      },
      {
        "task": {
          "arch": "win32",
          "prefix": "$GAMEDIR",
          "description": "Install MS Core-Fonts with winetricks",
          "name": "winetricks",
          "app": "corefonts"
        }
      },
      {
        "task": {
          "arch": "win32",
          "prefix": "$GAMEDIR",
          "description": "Setting Wine to Windows 7 32-Bit",
          "name": "winetricks",
          "app": "win7"
        }
      },
      {
        "task": {
          "arch": "win32",
          "executable": "setup",
          "description": "Installing Allods My.Com\n------------------------------\nLet Lutris installer finish first. Log in afterwards.",
          "name": "wineexec",
          "exclude_processes": "GameCenter.exe Launcher.exe"
        }
      }
    ]
  },
  "content": "files:\n- setup: https://gremgoll.de/files/AllodsdeLoader_de.exe\ngame:\n  arch: win32\n  exe: drive_c/users/$USER/Local Settings/Application Data/GameCenter/GameCenter.exe\n  prefix: $GAMEDIR\ninstaller:\n- task:\n    arch: win32\n    description: Creating 32bit Wine prefix.\n    name: create_prefix\n    prefix: $GAMEDIR\n- task:\n    app: corefonts\n    arch: win32\n    description: Install MS Core-Fonts with winetricks\n    name: winetricks\n    prefix: $GAMEDIR\n- task:\n    app: win7\n    arch: win32\n    description: Setting Wine to Windows 7 32-Bit\n    name: winetricks\n    prefix: $GAMEDIR\n- task:\n    arch: win32\n    description: 'Installing Allods My.Com\n\n      ------------------------------\n\n      Let Lutris installer finish first. Log in afterwards.'\n    exclude_processes: GameCenter.exe Launcher.exe\n    executable: setup\n    name: wineexec\nsystem:\n  env:\n    DXVK_HUD: gpuload\n  exclude_processes: GameCenter.exe Launcher.exe\nwine:\n  d9vk: true\n  version: 3.21-x86_64\n"
}