{
  "id": 16189,
  "game_id": 9478,
  "game_slug": "allods-online-mycom",
  "name": "Allods Online",
  "year": 2010,
  "user": "Gremgoll",
  "runner": "wine",
  "slug": "allods-online-dxvk-mycom-german",
  "version": "DXVK (My.com German)",
  "description": "This is the german installer of Allods [My.com Game Center].This Setup makes use of DirectX 9 Vulkan Layer [D9VK] and runs with high fps.",
  "notes": "- Switched to legacy setup from 2019/08 (Otherwise Setup fails with OS not supported)\r\n- You can switch Language after Setup in Gamecenter\r\n- Everything works so far (even display of numbers / text in chat window)",
  "created_at": "2019-10-14T09:54:43.030000Z",
  "updated_at": "2019-12-23T19:22:36.289124Z",
  "draft": false,
  "published": true,
  "published_by": 51687,
  "rating": "",
  "steamid": 459160,
  "gogid": null,
  "gogslug": "",
  "humblestoreid": "",
  "script": {
    "game": {
      "exe": "drive_c/users/$USER/Local Settings/Application Data/GameCenter/GameCenter.exe",
      "arch": "win32",
      "prefix": "$GAMEDIR"
    },
    "system": {
      "exclude_processes": "GameCenter.exe Launcher.exe",
      "env": {
        "DXVK_HUD": "gpuload"
      }
    },
    "wine": {
      "dxvk": true
    },
    "installer": [
      {
        "task": {
          "arch": "win32",
          "description": "Creating 32bit Wine prefix.",
          "prefix": "$GAMEDIR",
          "name": "create_prefix"
        }
      },
      {
        "task": {
          "app": "corefonts",
          "arch": "win32",
          "description": "Install MS Core-Fonts with winetricks",
          "prefix": "$GAMEDIR",
          "name": "winetricks"
        }
      },
      {
        "task": {
          "app": "win7",
          "arch": "win32",
          "description": "Setting Wine to Windows 7 32-Bit",
          "prefix": "$GAMEDIR",
          "name": "winetricks"
        }
      },
      {
        "task": {
          "executable": "setup",
          "exclude_processes": "GameCenter.exe Launcher.exe",
          "arch": "win32",
          "description": "Installing Allods My.Com\n------------------------------\nLet Lutris installer finish first. Log in afterwards.",
          "name": "wineexec"
        }
      }
    ],
    "files": [
      {
        "setup": "https://gremgoll.de/files/AllodsdeLoader_de.exe"
      }
    ]
  },
  "content": "files:\r\n- setup: https://gremgoll.de/files/AllodsdeLoader_de.exe\r\ngame:\r\n  arch: win32\r\n  exe: drive_c/users/$USER/Local Settings/Application Data/GameCenter/GameCenter.exe\r\n  prefix: $GAMEDIR\r\ninstaller:\r\n- task:\r\n    arch: win32\r\n    description: Creating 32bit Wine prefix.\r\n    name: create_prefix\r\n    prefix: $GAMEDIR\r\n- task:\r\n    app: corefonts\r\n    arch: win32\r\n    description: Install MS Core-Fonts with winetricks\r\n    name: winetricks\r\n    prefix: $GAMEDIR\r\n- task:\r\n    app: win7\r\n    arch: win32\r\n    description: Setting Wine to Windows 7 32-Bit\r\n    name: winetricks\r\n    prefix: $GAMEDIR\r\n- task:\r\n    arch: win32\r\n    description: 'Installing Allods My.Com\r\n\r\n      ------------------------------\r\n\r\n      Let Lutris installer finish first. Log in afterwards.'\r\n    exclude_processes: GameCenter.exe Launcher.exe\r\n    executable: setup\r\n    name: wineexec\r\nsystem:\r\n  env:\r\n    DXVK_HUD: gpuload\r\n  exclude_processes: GameCenter.exe Launcher.exe\r\nwine:\r\n  dxvk: true"
}