{
  "id": 10617,
  "game_id": 22177,
  "game_slug": "streamlabs-chatbot",
  "name": "Streamlabs Chatbot",
  "year": null,
  "user": "WarfaceZ",
  "runner": "wine",
  "slug": "streamlabs-chatbot-testing-manual",
  "version": "Testing-Manual",
  "description": null,
  "notes": "",
  "created_at": "2018-10-24T09:11:49.502000Z",
  "updated_at": "2018-10-26T05:54:52.101337Z",
  "draft": false,
  "published": true,
  "published_by": null,
  "rating": "",
  "steamid": null,
  "gogid": null,
  "gogslug": "",
  "humblestoreid": "",
  "script": {
    "game": {
      "exec": "$HOME/Application Data/Streamlabs/Streamlabs Chatbot/Streamlabs Chatbot.exe",
      "arch": "win64",
      "prefix": "$GAMEDIR"
    },
    "installer": [
      {
        "task": {
          "arch": "win64",
          "description": "Creating 64bit Wine prefix",
          "prefix": "$GAMEDIR",
          "name": "create_prefix"
        }
      },
      {
        "task": {
          "app": "arial",
          "arch": "win64",
          "description": "Installing Arial font",
          "prefix": "$GAMEDIR",
          "name": "winetricks"
        }
      },
      {
        "task": {
          "app": "fontsmooth-rgb",
          "arch": "win64",
          "description": "Setting fontsmooth=rgb",
          "prefix": "$GAMEDIR",
          "name": "winetricks"
        }
      },
      {
        "task": {
          "arch": "win64",
          "description": "Setting Windows 10 mode for Wine",
          "prefix": "$GAMEDIR",
          "name": "set_regedit",
          "path": "HKEY_CURRENT_USER\\Software\\Wine",
          "value": "win10",
          "key": "Version"
        }
      },
      {
        "task": {
          "prefix": "$GAMEDIR",
          "name": "winekill"
        }
      },
      {
        "task": {
          "app": "vcrun2013",
          "arch": "win64",
          "description": "Installing Visual C++ 2013",
          "prefix": "$GAMEDIR",
          "name": "winetricks"
        }
      },
      {
        "task": {
          "prefix": "$GAMEDIR",
          "name": "winekill"
        }
      },
      {
        "task": {
          "app": "dotnet46",
          "arch": "win64",
          "description": "Installing .NET 4.6.0 will take a while...",
          "prefix": "$GAMEDIR",
          "name": "winetricks"
        }
      },
      {
        "task": {
          "prefix": "$GAMEDIR",
          "name": "winekill"
        }
      },
      {
        "task": {
          "arch": "win64",
          "description": "Setting Windows 10 mode for Wine",
          "prefix": "$GAMEDIR",
          "name": "set_regedit",
          "path": "HKEY_CURRENT_USER\\Software\\Wine",
          "value": "win10",
          "key": "Version"
        }
      },
      {
        "task": {
          "prefix": "$GAMEDIR",
          "name": "winekill"
        }
      },
      {
        "task": {
          "executable": "setup",
          "arch": "win64",
          "description": "Installing Streamlabs Chatbot",
          "name": "wineexec"
        }
      }
    ],
    "files": [
      {
        "setup": {
          "filename": "streamlabs_chatbot.exe",
          "url": "N/A:Select the game's setup file"
        }
      }
    ]
  },
  "content": "files:\n- setup:\n    filename: streamlabs_chatbot.exe\n    url: N/A:Select the game's setup file\ngame:\n  arch: win64\n  exec: $HOME/Application Data/Streamlabs/Streamlabs Chatbot/Streamlabs Chatbot.exe\n  prefix: $GAMEDIR\ninstaller:\n- task:\n    arch: win64\n    description: Creating 64bit Wine prefix\n    name: create_prefix\n    prefix: $GAMEDIR\n- task:\n    app: arial\n    arch: win64\n    description: Installing Arial font\n    name: winetricks\n    prefix: $GAMEDIR\n- task:\n    app: fontsmooth-rgb\n    arch: win64\n    description: Setting fontsmooth=rgb\n    name: winetricks\n    prefix: $GAMEDIR\n- task:\n    arch: win64\n    description: Setting Windows 10 mode for Wine\n    key: Version\n    name: set_regedit\n    path: HKEY_CURRENT_USER\\Software\\Wine\n    prefix: $GAMEDIR\n    value: win10\n- task:\n    name: winekill\n    prefix: $GAMEDIR\n- task:\n    app: vcrun2013\n    arch: win64\n    description: Installing Visual C++ 2013\n    name: winetricks\n    prefix: $GAMEDIR\n- task:\n    name: winekill\n    prefix: $GAMEDIR\n- task:\n    app: dotnet46\n    arch: win64\n    description: Installing .NET 4.6.0 will take a while...\n    name: winetricks\n    prefix: $GAMEDIR\n- task:\n    name: winekill\n    prefix: $GAMEDIR\n- task:\n    arch: win64\n    description: Setting Windows 10 mode for Wine\n    key: Version\n    name: set_regedit\n    path: HKEY_CURRENT_USER\\Software\\Wine\n    prefix: $GAMEDIR\n    value: win10\n- task:\n    name: winekill\n    prefix: $GAMEDIR\n- task:\n    arch: win64\n    description: Installing Streamlabs Chatbot\n    executable: setup\n    name: wineexec\n"
}