{
  "id": 19873,
  "game_id": 17307,
  "game_slug": "chuchel",
  "name": "CHUCHEL",
  "year": 2018,
  "user": "schmarky",
  "runner": "wine",
  "slug": "chuchel-gog",
  "version": "GOG",
  "description": null,
  "notes": "",
  "created_at": "2020-04-21T18:51:37.423182Z",
  "updated_at": "2020-04-23T07:58:58.472412Z",
  "draft": true,
  "published": true,
  "published_by": null,
  "rating": "",
  "steamid": 711660,
  "gogid": 1825910123,
  "gogslug": "chuchel",
  "humbleid": "",
  "humblestoreid": "",
  "humblestoreid_real": "",
  "script": {
    "files": [
      {
        "goginstaller": "N/A:Please select the GOG.com Windows installer"
      },
      {
        "dx2010": "https://lutris.net/files/tools/directx-2010.tar.gz"
      }
    ],
    "game": {
      "arch": "win64",
      "exe": "drive_c/GOG Games/CHUCHEL/Chuchel.exe",
      "prefix": "$GAMEDIR"
    },
    "installer": [
      {
        "extract": {
          "dst": "$CACHE/dxsetup",
          "file": "dx2010"
        }
      },
      {
        "task": {
          "arch": "win64",
          "name": "create_prefix",
          "prefix": "$GAMEDIR"
        }
      },
      {
        "task": {
          "arch": "win64",
          "args": "/silent",
          "executable": "$CACHE/dxsetup/DXSETUP.exe",
          "name": "wineexec",
          "prefix": "$GAMEDIR"
        }
      },
      {
        "task": {
          "arch": "win64",
          "name": "winekill",
          "prefix": "$GAMEDIR"
        }
      },
      {
        "task": {
          "arch": "win64",
          "args": "/LANG=English /SP- /SUPPRESSMSGBOXES",
          "executable": "goginstaller",
          "name": "wineexec",
          "prefix": "$GAMEDIR"
        }
      }
    ]
  },
  "content": "files:\n- goginstaller: N/A:Please select the GOG.com Windows installer\n- dx2010: https://lutris.net/files/tools/directx-2010.tar.gz\ngame:\n  arch: win64\n  exe: drive_c/GOG Games/CHUCHEL/Chuchel.exe\n  prefix: $GAMEDIR\ninstaller:\n- extract:\n    dst: $CACHE/dxsetup\n    file: dx2010\n- task:\n    arch: win64\n    name: create_prefix\n    prefix: $GAMEDIR\n- task:\n    arch: win64\n    args: /silent\n    executable: $CACHE/dxsetup/DXSETUP.exe\n    name: wineexec\n    prefix: $GAMEDIR\n- task:\n    arch: win64\n    name: winekill\n    prefix: $GAMEDIR\n- task:\n    arch: win64\n    args: /LANG=English /SP- /SUPPRESSMSGBOXES\n    executable: goginstaller\n    name: wineexec\n    prefix: $GAMEDIR\n"
}