{
  "id": 15832,
  "game_id": 1824,
  "game_slug": "halo-2",
  "name": "Halo 2",
  "year": 2004,
  "user": "Sentry",
  "runner": "wine",
  "slug": "halo-2-project-cartographer-1",
  "version": "Project Cartographer",
  "description": "Installs Project Cartographer from a given archive\r\nYou need to download the \"Full Game Installer + Mod\" zip from the Project Cartographer website",
  "notes": "every time you launch the game a prompt comes up\r\ncompletly ignore it and just press \"Run\"",
  "created_at": "2019-09-27T20:34:13.583000Z",
  "updated_at": "2020-01-23T02:57:19.094852Z",
  "draft": false,
  "published": true,
  "published_by": 19464,
  "rating": "",
  "steamid": null,
  "gogid": null,
  "gogslug": "",
  "humblestoreid": "",
  "script": {
    "files": [
      {
        "H2install": "N/A:Please select the zip archive for the Project Cartographer installer"
      }
    ],
    "installer": [
      {
        "extract": {
          "dst": "$CACHE/H2/",
          "file": "H2install"
        }
      },
      {
        "task": {
          "arch": "win32",
          "prefix": "$GAMEDIR",
          "name": "create_prefix"
        }
      },
      {
        "task": {
          "arch": "win32",
          "executable": "$CACHE/H2/h2pc_setup_1.8.1.exe",
          "description": "Installing Halo 2 just click through with the default settings. Do not run the game at the end.",
          "prefix": "$GAMEDIR",
          "name": "wineexec"
        }
      },
      {
        "task": {
          "arch": "win32",
          "description": "Installing wmp9",
          "app": "wmp9",
          "prefix": "$GAMEDIR",
          "name": "winetricks"
        }
      },
      {
        "task": {
          "arch": "win32",
          "description": "Setting video memory size",
          "app": "videomemorysize=1024",
          "prefix": "$GAMEDIR",
          "name": "winetricks"
        }
      },
      {
        "task": {
          "arch": "win32",
          "description": "Setting Windows 7 mode for Wine",
          "app": "win7",
          "prefix": "$GAMEDIR",
          "name": "winetricks"
        }
      }
    ],
    "system": {
      "disable_compositor": "true"
    },
    "wine": {
      "esync": true,
      "d9vk": false
    },
    "game": {
      "arch": "win32",
      "args": "-hiresfix",
      "prefix": "$GAMEDIR",
      "exe": "drive_c/Games/Halo 2 Project Cartographer/halo2.exe"
    }
  },
  "content": "files:\n- H2install: N/A:Please select the zip archive for the Project Cartographer installer\ngame:\n  arch: win32\n  args: -hiresfix\n  exe: drive_c/Games/Halo 2 Project Cartographer/halo2.exe\n  prefix: $GAMEDIR\ninstaller:\n- extract:\n    dst: $CACHE/H2/\n    file: H2install\n- task:\n    arch: win32\n    name: create_prefix\n    prefix: $GAMEDIR\n- task:\n    arch: win32\n    description: Installing Halo 2 just click through with the default settings. Do\n      not run the game at the end.\n    executable: $CACHE/H2/h2pc_setup_1.8.1.exe\n    name: wineexec\n    prefix: $GAMEDIR\n- task:\n    app: wmp9\n    arch: win32\n    description: Installing wmp9\n    name: winetricks\n    prefix: $GAMEDIR\n- task:\n    app: videomemorysize=1024\n    arch: win32\n    description: Setting video memory size\n    name: winetricks\n    prefix: $GAMEDIR\n- task:\n    app: win7\n    arch: win32\n    description: Setting Windows 7 mode for Wine\n    name: winetricks\n    prefix: $GAMEDIR\nsystem:\n  disable_compositor: 'true'\nwine:\n  d9vk: false\n  esync: true\n"
}