{
  "id": 18529,
  "game_id": 58,
  "game_slug": "urban-terror",
  "name": "Urban Terror",
  "year": 2007,
  "user": "vanstaveren",
  "runner": "wine",
  "slug": "urban-terror-43-vulkan",
  "version": "4.3-vulkan",
  "description": null,
  "notes": "",
  "created_at": "2020-02-23T14:09:13.647000Z",
  "updated_at": "2020-02-25T14:28:44.343168Z",
  "draft": false,
  "published": true,
  "published_by": 20548,
  "rating": "",
  "steamid": null,
  "gogid": null,
  "gogslug": "",
  "humblestoreid": "",
  "script": {
    "files": [
      {
        "UrbanTerror.zip": "http://cdn.urbanterror.info/urt/43/releases/zips/UrbanTerror434_full.zip"
      }
    ],
    "installer": [
      {
        "task": {
          "arch": "win64",
          "description": "Creating 64-bit prefix ...",
          "prefix": "$GAMEDIR/prefix",
          "name": "create_prefix"
        }
      },
      {
        "extract": {
          "description": "Extracting Urban Terror ...",
          "dst": "$GAMEDIR/prefix/drive_c/Program Files/Urban Terror/",
          "file": "UrbanTerror.zip"
        }
      },
      {
        "task": {
          "arch": "win64",
          "description": "DirectX ...",
          "app": "d3drm",
          "prefix": "$GAMEDIR/prefix",
          "name": "winetricks"
        }
      },
      {
        "task": {
          "arch": "win64",
          "description": "DirectX 11 ...",
          "app": "d3dcompiler_43",
          "prefix": "$GAMEDIR/prefix",
          "name": "winetricks"
        }
      },
      {
        "task": {
          "arch": "win64",
          "description": "DirectX 11 ...",
          "app": "d3dx11_43",
          "prefix": "$GAMEDIR/prefix",
          "name": "winetricks"
        }
      },
      {
        "task": {
          "args": "/S",
          "executable": "$GAMEDIR/prefix/drive_c/UrbanTerror43/UrTUpdater.exe",
          "description": "Urban Terror ...",
          "prefix": "$GAMEDIR/prefix",
          "name": "wineexec"
        }
      }
    ],
    "system": {
      "disable_compositor": true,
      "pulse_latency": true
    },
    "wine": {
      "Audio": "pulse",
      "dxvk": true,
      "esync": true
    },
    "game": {
      "arch": "win64",
      "custom-name": "Urban Terror",
      "prefix": "$GAMEDIR/prefix",
      "exe": "$GAMEDIR/prefix/drive_c/Program Files/Urban Terror/Quake3-UrT.exe"
    }
  },
  "content": "files:\r\n- UrbanTerror.zip: http://cdn.urbanterror.info/urt/43/releases/zips/UrbanTerror434_full.zip\r\ngame:\r\n  arch: win64\r\n  custom-name: Urban Terror\r\n  exe: $GAMEDIR/prefix/drive_c/Program Files/Urban Terror/Quake3-UrT.exe\r\n  prefix: $GAMEDIR/prefix\r\ninstaller:\r\n- task:\r\n    arch: win64\r\n    description: Creating 64-bit prefix ...\r\n    name: create_prefix\r\n    prefix: $GAMEDIR/prefix\r\n- extract:\r\n    description: Extracting Urban Terror ...\r\n    dst: $GAMEDIR/prefix/drive_c/Program Files/Urban Terror/\r\n    file: UrbanTerror.zip\r\n- task:\r\n    app: d3drm\r\n    arch: win64\r\n    description: DirectX ...\r\n    name: winetricks\r\n    prefix: $GAMEDIR/prefix\r\n- task:\r\n    app: d3dcompiler_43\r\n    arch: win64\r\n    description: DirectX 11 ...\r\n    name: winetricks\r\n    prefix: $GAMEDIR/prefix\r\n- task:\r\n    app: d3dx11_43\r\n    arch: win64\r\n    description: DirectX 11 ...\r\n    name: winetricks\r\n    prefix: $GAMEDIR/prefix\r\n- task:\r\n    args: /S\r\n    description: Urban Terror ...\r\n    executable: $GAMEDIR/prefix/drive_c/UrbanTerror43/UrTUpdater.exe\r\n    name: wineexec\r\n    prefix: $GAMEDIR/prefix\r\nsystem:\r\n  disable_compositor: true\r\n  pulse_latency: true\r\nwine:\r\n  Audio: pulse\r\n  dxvk: true\r\n  esync: true"
}