{
  "id": 14237,
  "game_id": 16754,
  "game_slug": "worms-4-mayhem",
  "name": "Worms 4: Mayhem",
  "year": 2005,
  "user": "Coles",
  "runner": "wine",
  "slug": "worms-4-mayhem-dvd",
  "version": "DVD",
  "description": "Install Worms 4 Mayhem for PC",
  "notes": "Internet games are impossible because GameSpy is closed ).\r\nThe game uses a DRM workaround.",
  "created_at": "2019-06-21T11:35:52.762000Z",
  "updated_at": "2020-04-21T08:06:59.656559Z",
  "draft": false,
  "published": true,
  "published_by": 20548,
  "rating": "",
  "steamid": null,
  "gogid": null,
  "gogslug": "",
  "humbleid": "",
  "humblestoreid": "",
  "humblestoreid_real": "",
  "script": {
    "files": [
      {
        "patch_1_01": "N/A:Please download: ftp://ftp.team17.com/pub/t17/patches/pc/WormsMayhemPATCHv1.01.exe"
      },
      {
        "patch_starforce": "N/A:Please download: https://www.gamecopyworld.com/games/pc_worms_mayhem.shtml#Worms 4 v1.01 [ENGLISH] No-DVD/Fixed EXE"
      }
    ],
    "game": {
      "exe": "drive_c/Program Files (x86)/Codemasters/Worms 4 Mayhem/WORMS 4 MAYHEM.EXE",
      "prefix": "$GAMEDIR"
    },
    "installer": [
      {
        "insert-disc": {
          "requires": "launcher.exe"
        }
      },
      {
        "write_config": {
          "data": {
            "File Transfer": {
              "OverwrittenReadOnly": "NoToAll"
            },
            "InstallShield Silent": {
              "File": "Response File",
              "Version": "v7.00"
            },
            "{45E7C481-3EF4-4FCB-AF0B-19F70D618F0C}-AskYesNo-0": {
              "Result": 0
            },
            "{45E7C481-3EF4-4FCB-AF0B-19F70D618F0C}-AskYesNo-1": {
              "Result": 0
            },
            "{45E7C481-3EF4-4FCB-AF0B-19F70D618F0C}-DlgOrder": {
              "Count": 7,
              "Dlg0": "{45E7C481-3EF4-4FCB-AF0B-19F70D618F0C}-SdWelcome-0",
              "Dlg1": "{45E7C481-3EF4-4FCB-AF0B-19F70D618F0C}-SdLicense2-0",
              "Dlg2": "{45E7C481-3EF4-4FCB-AF0B-19F70D618F0C}-SdAskDestPath2-0",
              "Dlg3": "{45E7C481-3EF4-4FCB-AF0B-19F70D618F0C}-SdStartCopy2-0",
              "Dlg4": "{45E7C481-3EF4-4FCB-AF0B-19F70D618F0C}-AskYesNo-0",
              "Dlg5": "{45E7C481-3EF4-4FCB-AF0B-19F70D618F0C}-AskYesNo-1",
              "Dlg6": "{45E7C481-3EF4-4FCB-AF0B-19F70D618F0C}-SdFinish-0"
            },
            "{45E7C481-3EF4-4FCB-AF0B-19F70D618F0C}-SdAskDestPath2-0": {
              "Result": 1,
              "szDir": "C:\\Program Files (x86)\\Codemasters\\Worms 4 Mayhem"
            },
            "{45E7C481-3EF4-4FCB-AF0B-19F70D618F0C}-SdFinish-0": {
              "Result": 1,
              "bOpt1": 0,
              "bOpt2": 0
            },
            "{45E7C481-3EF4-4FCB-AF0B-19F70D618F0C}-SdLicense2-0": {
              "Result": 1
            },
            "{45E7C481-3EF4-4FCB-AF0B-19F70D618F0C}-SdStartCopy2-0": {
              "Result": 1
            },
            "{45E7C481-3EF4-4FCB-AF0B-19F70D618F0C}-SdWelcome-0": {
              "Result": 1
            }
          },
          "file": "$GAMEDIR/drive_c/silent1_00.iss"
        }
      },
      {
        "task": {
          "args": "/s /f1'C:\\silent1_00.iss'",
          "blocking": true,
          "executable": "$DISC/setup.exe",
          "name": "wineexec",
          "prefix": "$GAMEDIR"
        }
      },
      {
        "write_config": {
          "data": {
            "File Transfer": {
              "OverwrittenReadOnly": "NoToAll"
            },
            "InstallShield Silent": {
              "File": "Response File",
              "Version": "v7.00"
            },
            "{45E7C481-3EF4-4FCB-AF0B-19F70D618F0C}-DlgOrder": {
              "Count": 2,
              "Dlg0": "{45E7C481-3EF4-4FCB-AF0B-19F70D618F0C}-SdWelcome-0",
              "Dlg1": "{45E7C481-3EF4-4FCB-AF0B-19F70D618F0C}-SdFinish-0"
            },
            "{45E7C481-3EF4-4FCB-AF0B-19F70D618F0C}-SdFinish-0": {
              "Result": 1,
              "bOpt1": 0,
              "bOpt2": 0
            },
            "{45E7C481-3EF4-4FCB-AF0B-19F70D618F0C}-SdWelcome-0": {
              "Result": 1
            }
          },
          "file": "$GAMEDIR/drive_c/silent1_01.iss"
        }
      },
      {
        "task": {
          "args": "/s /f1'C:\\silent1_01.iss'",
          "executable": "patch_1_01",
          "name": "wineexec",
          "prefix": "$GAMEDIR"
        }
      },
      {
        "extract": {
          "dst": "$GAMEDIR/drive_c/Program Files (x86)/Codemasters/Worms 4 Mayhem/",
          "file": "patch_starforce"
        }
      }
    ],
    "wine": {
      "Desktop": true
    }
  },
  "content": "files:\n- patch_1_01: 'N/A:Please download: ftp://ftp.team17.com/pub/t17/patches/pc/WormsMayhemPATCHv1.01.exe'\n- patch_starforce: 'N/A:Please download: https://www.gamecopyworld.com/games/pc_worms_mayhem.shtml#Worms\n    4 v1.01 [ENGLISH] No-DVD/Fixed EXE'\ngame:\n  exe: drive_c/Program Files (x86)/Codemasters/Worms 4 Mayhem/WORMS 4 MAYHEM.EXE\n  prefix: $GAMEDIR\ninstaller:\n- insert-disc:\n    requires: launcher.exe\n- write_config:\n    data:\n      File Transfer:\n        OverwrittenReadOnly: NoToAll\n      InstallShield Silent:\n        File: Response File\n        Version: v7.00\n      '{45E7C481-3EF4-4FCB-AF0B-19F70D618F0C}-AskYesNo-0':\n        Result: 0\n      '{45E7C481-3EF4-4FCB-AF0B-19F70D618F0C}-AskYesNo-1':\n        Result: 0\n      '{45E7C481-3EF4-4FCB-AF0B-19F70D618F0C}-DlgOrder':\n        Count: 7\n        Dlg0: '{45E7C481-3EF4-4FCB-AF0B-19F70D618F0C}-SdWelcome-0'\n        Dlg1: '{45E7C481-3EF4-4FCB-AF0B-19F70D618F0C}-SdLicense2-0'\n        Dlg2: '{45E7C481-3EF4-4FCB-AF0B-19F70D618F0C}-SdAskDestPath2-0'\n        Dlg3: '{45E7C481-3EF4-4FCB-AF0B-19F70D618F0C}-SdStartCopy2-0'\n        Dlg4: '{45E7C481-3EF4-4FCB-AF0B-19F70D618F0C}-AskYesNo-0'\n        Dlg5: '{45E7C481-3EF4-4FCB-AF0B-19F70D618F0C}-AskYesNo-1'\n        Dlg6: '{45E7C481-3EF4-4FCB-AF0B-19F70D618F0C}-SdFinish-0'\n      '{45E7C481-3EF4-4FCB-AF0B-19F70D618F0C}-SdAskDestPath2-0':\n        Result: 1\n        szDir: C:\\Program Files (x86)\\Codemasters\\Worms 4 Mayhem\n      '{45E7C481-3EF4-4FCB-AF0B-19F70D618F0C}-SdFinish-0':\n        Result: 1\n        bOpt1: 0\n        bOpt2: 0\n      '{45E7C481-3EF4-4FCB-AF0B-19F70D618F0C}-SdLicense2-0':\n        Result: 1\n      '{45E7C481-3EF4-4FCB-AF0B-19F70D618F0C}-SdStartCopy2-0':\n        Result: 1\n      '{45E7C481-3EF4-4FCB-AF0B-19F70D618F0C}-SdWelcome-0':\n        Result: 1\n    file: $GAMEDIR/drive_c/silent1_00.iss\n- task:\n    args: /s /f1'C:\\silent1_00.iss'\n    blocking: true\n    executable: $DISC/setup.exe\n    name: wineexec\n    prefix: $GAMEDIR\n- write_config:\n    data:\n      File Transfer:\n        OverwrittenReadOnly: NoToAll\n      InstallShield Silent:\n        File: Response File\n        Version: v7.00\n      '{45E7C481-3EF4-4FCB-AF0B-19F70D618F0C}-DlgOrder':\n        Count: 2\n        Dlg0: '{45E7C481-3EF4-4FCB-AF0B-19F70D618F0C}-SdWelcome-0'\n        Dlg1: '{45E7C481-3EF4-4FCB-AF0B-19F70D618F0C}-SdFinish-0'\n      '{45E7C481-3EF4-4FCB-AF0B-19F70D618F0C}-SdFinish-0':\n        Result: 1\n        bOpt1: 0\n        bOpt2: 0\n      '{45E7C481-3EF4-4FCB-AF0B-19F70D618F0C}-SdWelcome-0':\n        Result: 1\n    file: $GAMEDIR/drive_c/silent1_01.iss\n- task:\n    args: /s /f1'C:\\silent1_01.iss'\n    executable: patch_1_01\n    name: wineexec\n    prefix: $GAMEDIR\n- extract:\n    dst: $GAMEDIR/drive_c/Program Files (x86)/Codemasters/Worms 4 Mayhem/\n    file: patch_starforce\nwine:\n  Desktop: true\n"
}