{
  "id": 2700,
  "game_id": 7623,
  "game_slug": "friking-shark",
  "name": "Friking Shark",
  "year": null,
  "user": "ssf",
  "runner": "wine",
  "slug": "friking-shark-101beta",
  "version": "1.01Beta",
  "description": "",
  "notes": "",
  "created_at": "2016-09-07T18:56:37.669356Z",
  "updated_at": "2016-09-08T16:02:41.193851Z",
  "draft": false,
  "published": true,
  "published_by": null,
  "rating": "",
  "steamid": null,
  "gogid": null,
  "gogslug": "",
  "humblestoreid": "",
  "script": {
    "game": {
      "exe": "drive_c/Program Files/Friking Shark 3D/Bin/Release/GameEngine.exe",
      "arch": "win32",
      "prefix": "$GAMEDIR"
    },
    "files": [
      {
        "game": "https://storage.googleapis.com/google-code-archive-downloads/v2/code.google.com/friking-shark/FrikingSharkSetup-v1.01-Beta.exe"
      }
    ],
    "installer": [
      {
        "task": {
          "description": "Creating Wine prefix",
          "prefix": "$GAMEDIR",
          "name": "create_prefix"
        }
      },
      {
        "task": {
          "prefix": "$GAMEDIR",
          "name": "set_regedit",
          "path": "HKEY_CURRENT_USER\\Software\\Wine\\DllOverrides",
          "value": "",
          "key": "winemenubuilder.exe",
          "type": "REG_SZ"
        }
      },
      {
        "task": {
          "silent": true,
          "prefix": "$GAMEDIR",
          "app": "corefonts",
          "name": "winetricks"
        }
      },
      {
        "task": {
          "description": "Installing...",
          "prefix": "$GAMEDIR",
          "executable": "game",
          "name": "wineexec",
          "args": "/silent"
        }
      },
      {
        "task": {
          "description": "Disabling unused WINE features",
          "silent": true,
          "prefix": "$GAMEDIR",
          "app": "sandbox",
          "name": "winetricks"
        }
      }
    ]
  },
  "content": "files:\n- game: https://storage.googleapis.com/google-code-archive-downloads/v2/code.google.com/friking-shark/FrikingSharkSetup-v1.01-Beta.exe\ngame:\n  arch: win32\n  exe: drive_c/Program Files/Friking Shark 3D/Bin/Release/GameEngine.exe\n  prefix: $GAMEDIR\ninstaller:\n- task:\n    description: Creating Wine prefix\n    name: create_prefix\n    prefix: $GAMEDIR\n- task:\n    key: winemenubuilder.exe\n    name: set_regedit\n    path: HKEY_CURRENT_USER\\Software\\Wine\\DllOverrides\n    prefix: $GAMEDIR\n    type: REG_SZ\n    value: ''\n- task:\n    app: corefonts\n    name: winetricks\n    prefix: $GAMEDIR\n    silent: true\n- task:\n    args: /silent\n    description: Installing...\n    executable: game\n    name: wineexec\n    prefix: $GAMEDIR\n- task:\n    app: sandbox\n    description: Disabling unused WINE features\n    name: winetricks\n    prefix: $GAMEDIR\n    silent: true\n"
}