{
  "id": 15912,
  "game_id": 2033,
  "game_slug": "world-of-warcraft",
  "name": "World of Warcraft",
  "year": 2004,
  "user": "Azamorn",
  "runner": "linux",
  "slug": "world-of-warcraft-10",
  "version": "1.0",
  "description": "test",
  "notes": "test",
  "created_at": "2019-10-02T14:21:39.653401Z",
  "updated_at": "2019-10-02T14:21:39.653424Z",
  "draft": true,
  "published": false,
  "published_by": null,
  "rating": "",
  "steamid": null,
  "gogid": null,
  "gogslug": "",
  "humblestoreid": "",
  "script": {
    "system": {
      "exclude_processes": "Agent.exe \"Battle.net Helper.exe\"",
      "env": {
        "__GL_SHADER_DISK_CACHE": 1,
        "STAGING_SHARED_MEMORY": 1,
        "__GL_SHADER_DISK_CACHE_PATH": "$GAMEDIR",
        "DXVK_HUD": "compiler",
        "DXVK_STATE_CACHE_PATH": "$GAMEDIR"
      }
    },
    "game": {
      "arch": "win64",
      "prefix": "$GAMEDIR",
      "exe": "drive_c/Program Files (x86)/Battle.net/Battle.net.exe"
    },
    "wine": {
      "overrides": {
        "nvapi64": "disabled",
        "nvapi": "disabled",
        "d3d12": "disabled"
      },
      "dxvk": true,
      "esync": true,
      "version": "ge-protonified-nofshack-4.9-x86_64"
    },
    "files": [
      {
        "setup": {
          "url": "http://dist.blizzard.com/downloads/bna-installers/322d5bb9ae0318de3d4cde7641c96425/retail.1/Battle.net-Setup-enGB.exe",
          "filename": "Battle.net-Setup-enGB.exe"
        }
      }
    ],
    "installer": [
      {
        "task": {
          "arch": "win64",
          "prefix": "$GAMEDIR",
          "description": "Creating 64bit Wine prefix.",
          "name": "create_prefix"
        }
      },
      {
        "task": {
          "arch": "win64",
          "prefix": "$GAMEDIR",
          "description": "Installing Arial font",
          "name": "winetricks",
          "app": "arial"
        }
      },
      {
        "task": {
          "prefix": "$GAMEDIR",
          "description": "Setting Windows 10 mode for Wine",
          "value": "win10",
          "arch": "win64",
          "path": "HKEY_CURRENT_USER\\Software\\Wine",
          "key": "Version",
          "name": "set_regedit"
        }
      },
      {
        "task": {
          "prefix": "$GAMEDIR",
          "description": "Wine Staging: Enabling DXVA2",
          "value": "va",
          "arch": "win64",
          "path": "HKEY_CURRENT_USER\\Software\\Wine\\DXVA2",
          "key": "backend",
          "name": "set_regedit"
        }
      },
      {
        "task": {
          "prefix": "$GAMEDIR",
          "name": "winekill"
        }
      },
      {
        "write_json": {
          "description": "Disabling Sound/Hardware Acceleration/Streaming in Blizzard App",
          "data": {
            "Client": {
              "Sound": {
                "Enabled": "false"
              },
              "HardwareAcceleration": "false",
              "GameLaunchWindowBehavior": "2",
              "Streaming": {
                "StreamingEnabled": "false"
              }
            }
          },
          "file": "$GAMEDIR/drive_c/users/$USER/Application Data/Battle.net/Battle.net.config"
        }
      },
      {
        "task": {
          "arch": "win64",
          "executable": "setup",
          "description": "Installing Blizzard App\n------------------------------\nDo not try to log into Battle.net. Lutris will automatically close the login window. After Lutris installer is finished, you can start Blizzard App with \"Launch the game\", and install / locate your Blizzard game.",
          "name": "wineexec",
          "exclude_processes": "Battle.net.exe Agent.exe \"Battle.net Helper.exe\""
        }
      },
      {
        "task": {
          "prefix": "$GAMEDIR",
          "name": "winekill"
        }
      }
    ]
  },
  "content": "files:\n- setup:\n    filename: Battle.net-Setup-enGB.exe\n    url: http://dist.blizzard.com/downloads/bna-installers/322d5bb9ae0318de3d4cde7641c96425/retail.1/Battle.net-Setup-enGB.exe\ngame:\n  arch: win64\n  exe: drive_c/Program Files (x86)/Battle.net/Battle.net.exe\n  prefix: $GAMEDIR\ninstaller:\n- task:\n    arch: win64\n    description: Creating 64bit Wine prefix.\n    name: create_prefix\n    prefix: $GAMEDIR\n- task:\n    app: arial\n    arch: win64\n    description: Installing Arial font\n    name: winetricks\n    prefix: $GAMEDIR\n- task:\n    arch: win64\n    description: Setting Windows 10 mode for Wine\n    key: Version\n    name: set_regedit\n    path: HKEY_CURRENT_USER\\Software\\Wine\n    prefix: $GAMEDIR\n    value: win10\n- task:\n    arch: win64\n    description: 'Wine Staging: Enabling DXVA2'\n    key: backend\n    name: set_regedit\n    path: HKEY_CURRENT_USER\\Software\\Wine\\DXVA2\n    prefix: $GAMEDIR\n    value: va\n- task:\n    name: winekill\n    prefix: $GAMEDIR\n- write_json:\n    data:\n      Client:\n        GameLaunchWindowBehavior: '2'\n        HardwareAcceleration: 'false'\n        Sound:\n          Enabled: 'false'\n        Streaming:\n          StreamingEnabled: 'false'\n    description: Disabling Sound/Hardware Acceleration/Streaming in Blizzard App\n    file: $GAMEDIR/drive_c/users/$USER/Application Data/Battle.net/Battle.net.config\n- task:\n    arch: win64\n    description: 'Installing Blizzard App\n\n      ------------------------------\n\n      Do not try to log into Battle.net. Lutris will automatically close the login\n      window. After Lutris installer is finished, you can start Blizzard App with\n      \"Launch the game\", and install / locate your Blizzard game.'\n    exclude_processes: Battle.net.exe Agent.exe \"Battle.net Helper.exe\"\n    executable: setup\n    name: wineexec\n- task:\n    name: winekill\n    prefix: $GAMEDIR\nsystem:\n  env:\n    DXVK_HUD: compiler\n    DXVK_STATE_CACHE_PATH: $GAMEDIR\n    STAGING_SHARED_MEMORY: 1\n    __GL_SHADER_DISK_CACHE: 1\n    __GL_SHADER_DISK_CACHE_PATH: $GAMEDIR\n  exclude_processes: Agent.exe \"Battle.net Helper.exe\"\nwine:\n  dxvk: true\n  esync: true\n  overrides:\n    d3d12: disabled\n    nvapi: disabled\n    nvapi64: disabled\n  version: ge-protonified-nofshack-4.9-x86_64\n"
}