{
  "id": 14430,
  "game_id": 2033,
  "game_slug": "world-of-warcraft",
  "name": "World of Warcraft",
  "year": 2004,
  "user": "Siysrril",
  "runner": "wine",
  "slug": "world-of-warcraft-434",
  "version": "4.3.4",
  "description": null,
  "notes": "",
  "created_at": "2019-07-06T01:53:40.780951Z",
  "updated_at": "2019-07-06T01:53:40.780976Z",
  "draft": true,
  "published": false,
  "published_by": null,
  "rating": "",
  "steamid": null,
  "gogid": null,
  "gogslug": "",
  "humblestoreid": "",
  "script": {
    "wine": {
      "overrides": {
        "nvapi64": "disabled",
        "nvapi": "disabled",
        "d3d12": "disabled"
      },
      "dxvk": true,
      "esync": true,
      "version": "ge-protonified-nofshack-4.9-x86_64"
    },
    "game": {
      "arch": "win64",
      "prefix": "$GAMEDIR",
      "exe": "drive_c/Program Files (x86)/LauncherWarSages/Launcher WarSages.exe"
    },
    "installer": [
      {
        "task": {
          "arch": "win64",
          "prefix": "$GAMEDIR",
          "description": "Creating 64bit Wine prefix.",
          "name": "create_prefix"
        }
      },
      {
        "task": {
          "arch": "win64",
          "prefix": "$GAMEDIR",
          "description": "Installing Arial font",
          "name": "winetricks",
          "app": "arial"
        }
      },
      {
        "task": {
          "prefix": "$GAMEDIR",
          "description": "Setting Windows 10 mode for Wine",
          "value": "win10",
          "arch": "win64",
          "path": "HKEY_CURRENT_USER\\Software\\Wine",
          "key": "Version",
          "name": "set_regedit"
        }
      },
      {
        "task": {
          "prefix": "$GAMEDIR",
          "description": "Wine Staging: Enabling DXVA2",
          "value": "va",
          "arch": "win64",
          "path": "HKEY_CURRENT_USER\\Software\\Wine\\DXVA2",
          "key": "backend",
          "name": "set_regedit"
        }
      },
      {
        "task": {
          "prefix": "$GAMEDIR",
          "name": "winekill"
        }
      },
      {
        "task": {
          "arch": "win64",
          "executable": "Launcher WarSages.exe",
          "description": "Installing Warsages Lancher",
          "name": "wineexec"
        }
      },
      {
        "task": {
          "prefix": "$GAMEDIR",
          "name": "winekill"
        }
      }
    ],
    "system": {
      "env": {
        "__GL_SHADER_DISK_CACHE": 1,
        "STAGING_SHARED_MEMORY": 1,
        "__GL_SHADER_DISK_CACHE_PATH": "$GAMEDIR",
        "DXVK_HUD": "compiler",
        "DXVK_STATE_CACHE_PATH": "$GAMEDIR"
      }
    },
    "script": null,
    "files": [
      {
        "setup": {
          "url": "https://1drv.ms/u/s!AmwFOkxMfn6WgYZhgL7hhsXpH6xMpA?e=ztfiD1&download=1",
          "filename": "Launcher WarSages Installer.exe"
        }
      }
    ]
  },
  "content": "files:\n- setup:\n    filename: Launcher WarSages Installer.exe\n    url: https://1drv.ms/u/s!AmwFOkxMfn6WgYZhgL7hhsXpH6xMpA?e=ztfiD1&download=1\ngame:\n  arch: win64\n  exe: drive_c/Program Files (x86)/LauncherWarSages/Launcher WarSages.exe\n  prefix: $GAMEDIR\ninstaller:\n- task:\n    arch: win64\n    description: Creating 64bit Wine prefix.\n    name: create_prefix\n    prefix: $GAMEDIR\n- task:\n    app: arial\n    arch: win64\n    description: Installing Arial font\n    name: winetricks\n    prefix: $GAMEDIR\n- task:\n    arch: win64\n    description: Setting Windows 10 mode for Wine\n    key: Version\n    name: set_regedit\n    path: HKEY_CURRENT_USER\\Software\\Wine\n    prefix: $GAMEDIR\n    value: win10\n- task:\n    arch: win64\n    description: 'Wine Staging: Enabling DXVA2'\n    key: backend\n    name: set_regedit\n    path: HKEY_CURRENT_USER\\Software\\Wine\\DXVA2\n    prefix: $GAMEDIR\n    value: va\n- task:\n    name: winekill\n    prefix: $GAMEDIR\n- task:\n    arch: win64\n    description: Installing Warsages Lancher\n    executable: Launcher WarSages.exe\n    name: wineexec\n- task:\n    name: winekill\n    prefix: $GAMEDIR\nscript: null\nsystem:\n  env:\n    DXVK_HUD: compiler\n    DXVK_STATE_CACHE_PATH: $GAMEDIR\n    STAGING_SHARED_MEMORY: 1\n    __GL_SHADER_DISK_CACHE: 1\n    __GL_SHADER_DISK_CACHE_PATH: $GAMEDIR\nwine:\n  dxvk: true\n  esync: true\n  overrides:\n    d3d12: disabled\n    nvapi: disabled\n    nvapi64: disabled\n  version: ge-protonified-nofshack-4.9-x86_64\n"
}