{
  "id": 8505,
  "game_id": 2033,
  "game_slug": "world-of-warcraft",
  "name": "World of Warcraft",
  "year": 2004,
  "user": "Dox",
  "runner": "wine",
  "slug": "world-of-warcraft-battlenet",
  "version": "Battle.net",
  "description": null,
  "notes": "**IMPORTANT: INSTALL THE DEPENDENCIES FIRST**\r\nRead: <a href=\"https://github.com/lutris/lutris/wiki/Game:-World-of-Warcraft\">Game: World-of-Warcraft</a> before trying to install World of Warcraft. And install the needed dependencies for Wine into your system. Also, make sure you have Vulkan set up correctly.",
  "created_at": "2018-06-02T16:31:22.806000Z",
  "updated_at": "2019-10-18T20:58:13.338021Z",
  "draft": false,
  "published": true,
  "published_by": 42279,
  "rating": "5",
  "steamid": null,
  "gogid": null,
  "gogslug": "",
  "humblestoreid": "",
  "script": {
    "system": {
      "exclude_processes": "Agent.exe \"Battle.net Helper.exe\"",
      "env": {
        "__GL_SHADER_DISK_CACHE": 1,
        "STAGING_SHARED_MEMORY": 1,
        "__GL_SHADER_DISK_CACHE_PATH": "$GAMEDIR",
        "DXVK_HUD": "compiler",
        "DXVK_STATE_CACHE_PATH": "$GAMEDIR"
      }
    },
    "game": {
      "arch": "win64",
      "prefix": "$GAMEDIR",
      "exe": "drive_c/Program Files (x86)/Battle.net/Battle.net.exe"
    },
    "wine": {
      "overrides": {
        "nvapi64": "disabled",
        "ucrtbase": "n,b",
        "d3d12": "disabled",
        "nvapi": "disabled",
        "api-ms-win-crt-private-l1-1-0": "n,b"
      },
      "dxvk": true,
      "esync": true,
      "version": "lutris-4.16-x86_64"
    },
    "files": [
      {
        "setup": {
          "url": "https://www.battle.net/download/getInstallerForGame?os=win&locale=enUS&version=LIVE&gameProgram=BATTLENET_APP",
          "filename": "Battle.net-Setup.exe"
        }
      }
    ],
    "installer": [
      {
        "task": {
          "arch": "win64",
          "prefix": "$GAMEDIR",
          "description": "Creating 64bit Wine prefix.",
          "name": "create_prefix"
        }
      },
      {
        "task": {
          "arch": "win64",
          "prefix": "$GAMEDIR",
          "description": "Installing Arial font",
          "name": "winetricks",
          "app": "arial"
        }
      },
      {
        "task": {
          "prefix": "$GAMEDIR",
          "description": "Setting Windows 10 mode for Wine",
          "value": "win10",
          "arch": "win64",
          "path": "HKEY_CURRENT_USER\\Software\\Wine",
          "key": "Version",
          "name": "set_regedit"
        }
      },
      {
        "task": {
          "prefix": "$GAMEDIR",
          "description": "Wine Staging: Enabling DXVA2",
          "value": "va",
          "arch": "win64",
          "path": "HKEY_CURRENT_USER\\Software\\Wine\\DXVA2",
          "key": "backend",
          "name": "set_regedit"
        }
      },
      {
        "task": {
          "prefix": "$GAMEDIR",
          "name": "winekill"
        }
      },
      {
        "write_json": {
          "description": "Disabling Sound/Hardware Acceleration/Streaming in Blizzard App",
          "data": {
            "Client": {
              "Sound": {
                "Enabled": "false"
              },
              "HardwareAcceleration": "false",
              "GameLaunchWindowBehavior": "2"
            }
          },
          "file": "$GAMEDIR/drive_c/users/$USER/Application Data/Battle.net/Battle.net.config"
        }
      },
      {
        "task": {
          "arch": "win64",
          "executable": "setup",
          "description": "Installing Blizzard App\n------------------------------\nDo not try to log into Battle.net. Lutris will automatically close the login window. After Lutris installer is finished, you can start Blizzard App with \"Launch the game\", and install / locate your Blizzard game.",
          "name": "wineexec",
          "exclude_processes": "Battle.net.exe Agent.exe \"Battle.net Helper.exe\""
        }
      },
      {
        "task": {
          "prefix": "$GAMEDIR",
          "name": "winekill"
        }
      }
    ]
  },
  "content": "files:\n- setup:\n    filename: Battle.net-Setup.exe\n    url: https://www.battle.net/download/getInstallerForGame?os=win&locale=enUS&version=LIVE&gameProgram=BATTLENET_APP\ngame:\n  arch: win64\n  exe: drive_c/Program Files (x86)/Battle.net/Battle.net.exe\n  prefix: $GAMEDIR\ninstaller:\n- task:\n    arch: win64\n    description: Creating 64bit Wine prefix.\n    name: create_prefix\n    prefix: $GAMEDIR\n- task:\n    app: arial\n    arch: win64\n    description: Installing Arial font\n    name: winetricks\n    prefix: $GAMEDIR\n- task:\n    arch: win64\n    description: Setting Windows 10 mode for Wine\n    key: Version\n    name: set_regedit\n    path: HKEY_CURRENT_USER\\Software\\Wine\n    prefix: $GAMEDIR\n    value: win10\n- task:\n    arch: win64\n    description: 'Wine Staging: Enabling DXVA2'\n    key: backend\n    name: set_regedit\n    path: HKEY_CURRENT_USER\\Software\\Wine\\DXVA2\n    prefix: $GAMEDIR\n    value: va\n- task:\n    name: winekill\n    prefix: $GAMEDIR\n- write_json:\n    data:\n      Client:\n        GameLaunchWindowBehavior: '2'\n        HardwareAcceleration: 'false'\n        Sound:\n          Enabled: 'false'\n    description: Disabling Sound/Hardware Acceleration/Streaming in Blizzard App\n    file: $GAMEDIR/drive_c/users/$USER/Application Data/Battle.net/Battle.net.config\n- task:\n    arch: win64\n    description: 'Installing Blizzard App\n\n      ------------------------------\n\n      Do not try to log into Battle.net. Lutris will automatically close the login\n      window. After Lutris installer is finished, you can start Blizzard App with\n      \"Launch the game\", and install / locate your Blizzard game.'\n    exclude_processes: Battle.net.exe Agent.exe \"Battle.net Helper.exe\"\n    executable: setup\n    name: wineexec\n- task:\n    name: winekill\n    prefix: $GAMEDIR\nsystem:\n  env:\n    DXVK_HUD: compiler\n    DXVK_STATE_CACHE_PATH: $GAMEDIR\n    STAGING_SHARED_MEMORY: 1\n    __GL_SHADER_DISK_CACHE: 1\n    __GL_SHADER_DISK_CACHE_PATH: $GAMEDIR\n  exclude_processes: Agent.exe \"Battle.net Helper.exe\"\nwine:\n  dxvk: true\n  esync: true\n  overrides:\n    api-ms-win-crt-private-l1-1-0: n,b\n    d3d12: disabled\n    nvapi: disabled\n    nvapi64: disabled\n    ucrtbase: n,b\n  version: lutris-4.16-x86_64\n"
}