{
  "id": 12783,
  "game_id": 7250,
  "game_slug": "lego-loco",
  "name": "Lego Loco",
  "year": 1998,
  "user": "Nithanim",
  "runner": "wine",
  "slug": "lego-loco-10-retail-cd",
  "version": "1.0 (Retail CD)",
  "description": "Installs the version from the original CD. Install the game to the default path in the installer.",
  "notes": "",
  "created_at": "2019-04-14T07:29:30.479351Z",
  "updated_at": "2019-05-18T07:40:21.629429Z",
  "draft": false,
  "published": true,
  "published_by": null,
  "rating": "",
  "steamid": null,
  "gogid": null,
  "gogslug": "",
  "humbleid": "",
  "humblestoreid": "",
  "humblestoreid_real": "",
  "script": {
    "game": {
      "arch": "win32",
      "exe": "$GAMEDIR/drive_c/Program Files/LEGO Media/Constructive/LEGO LOCO/Exe/Loco.exe",
      "prefix": "$GAMEDIR"
    },
    "installer": [
      {
        "insert-disc": {
          "requires": "art-res"
        }
      },
      {
        "task": {
          "arch": "win32",
          "description": "Creating Wine prefix",
          "name": "create_prefix",
          "prefix": "$GAMEDIR"
        }
      },
      {
        "task": {
          "app": "directplay",
          "description": "Installing networking capabilities",
          "name": "winetricks",
          "prefix": "$GAMEDIR"
        }
      },
      {
        "task": {
          "description": "Run installer",
          "executable": "$DISC/SETUP.EXE",
          "name": "wineexec",
          "prefix": "$GAMEDIR"
        }
      }
    ],
    "system": {
      "xephyr": "16bpp",
      "xephyr_fullscreen": false,
      "xephyr_resolution": "1024x768"
    },
    "wine": {
      "Desktop": false
    }
  },
  "content": "game:\n  arch: win32\n  exe: $GAMEDIR/drive_c/Program Files/LEGO Media/Constructive/LEGO LOCO/Exe/Loco.exe\n  prefix: $GAMEDIR\ninstaller:\n- insert-disc:\n    requires: art-res\n- task:\n    arch: win32\n    description: Creating Wine prefix\n    name: create_prefix\n    prefix: $GAMEDIR\n- task:\n    app: directplay\n    description: Installing networking capabilities\n    name: winetricks\n    prefix: $GAMEDIR\n- task:\n    description: Run installer\n    executable: $DISC/SETUP.EXE\n    name: wineexec\n    prefix: $GAMEDIR\nsystem:\n  xephyr: 16bpp\n  xephyr_fullscreen: false\n  xephyr_resolution: 1024x768\nwine:\n  Desktop: false\n"
}