{
  "id": 14393,
  "game_id": 28323,
  "game_slug": "xiv-hunt",
  "name": "XIV-Hunt β",
  "year": 2017,
  "user": "MoonlightSeraph",
  "runner": "wine",
  "slug": "xiv-hunt-508",
  "version": "5.0.8",
  "description": "XIV-Hunt client (add-on) for Final Fantasy XIV for tracking hunts and FATEs. Also has the ability to macro performance.",
  "notes": "You MUST install this program into the same prefix as \"FINAL FANTASY XIV - A Realm Reborn\"\r\nThis Program does not function when installed to its own prefix, and must share the same prefix as the game (default \"/home/$USER/Games/final-fantasy-xiv-a-realm-reborn/\")",
  "created_at": "2019-07-02T23:43:42.889000Z",
  "updated_at": "2019-08-14T01:34:31.839634Z",
  "draft": false,
  "published": true,
  "published_by": 1,
  "rating": "",
  "steamid": null,
  "gogid": null,
  "gogslug": "",
  "humblestoreid": "",
  "script": {
    "game": {
      "exe": "drive_c/users/$USER/AppData/Local/XIVHunt/XIV-Hunt.exe",
      "arch": "win64",
      "prefix": "$GAMEDIR"
    },
    "files": [
      {
        "Setup": "https://www.dropbox.com/s/19nbb1ev7tna9p4/XIVHunt.zip?dl=1"
      }
    ],
    "wine": {
      "esync": true,
      "dxvk": true,
      "version": "ge-protonified-4.10-x86_64"
    },
    "installer": [
      {
        "task": {
          "description": "Installing Libraries...",
          "prefix": "$GAMEDIR",
          "app": "mscoree",
          "name": "winetricks"
        }
      },
      {
        "task": {
          "description": "Installing Libraries...",
          "prefix": "$GAMEDIR",
          "app": "d3dcompiler_47",
          "name": "winetricks"
        }
      },
      {
        "task": {
          "description": "Installing .NET 4.6.2",
          "prefix": "$GAMEDIR",
          "app": "dotnet462",
          "name": "winetricks"
        }
      },
      {
        "task": {
          "description": "Changing to Windows 7",
          "arch": "win64",
          "prefix": "$GAMEDIR",
          "name": "winetricks",
          "app": "win7"
        }
      },
      {
        "extract": {
          "description": "Installing XIV-Hunt β",
          "dst": "$GAMEDIR/drive_c/users/$USER/AppData/Local/XIVHunt/",
          "file": "Setup"
        }
      }
    ]
  },
  "content": "files:\n- Setup: https://www.dropbox.com/s/19nbb1ev7tna9p4/XIVHunt.zip?dl=1\ngame:\n  arch: win64\n  exe: drive_c/users/$USER/AppData/Local/XIVHunt/XIV-Hunt.exe\n  prefix: $GAMEDIR\ninstaller:\n- task:\n    app: mscoree\n    description: Installing Libraries...\n    name: winetricks\n    prefix: $GAMEDIR\n- task:\n    app: d3dcompiler_47\n    description: Installing Libraries...\n    name: winetricks\n    prefix: $GAMEDIR\n- task:\n    app: dotnet462\n    description: Installing .NET 4.6.2\n    name: winetricks\n    prefix: $GAMEDIR\n- task:\n    app: win7\n    arch: win64\n    description: Changing to Windows 7\n    name: winetricks\n    prefix: $GAMEDIR\n- extract:\n    description: \"Installing XIV-Hunt \\u03B2\"\n    dst: $GAMEDIR/drive_c/users/$USER/AppData/Local/XIVHunt/\n    file: Setup\nwine:\n  dxvk: true\n  esync: true\n  version: ge-protonified-4.10-x86_64\n"
}