{
  "id": 20455,
  "game_id": 2041,
  "game_slug": "myst-iv-revelation",
  "name": "Myst IV: Revelation",
  "year": 2004,
  "user": "tiberianpun",
  "runner": "wine",
  "slug": "myst-iv-revelation-gog",
  "version": "GOG",
  "description": null,
  "notes": "",
  "created_at": "2020-05-14T14:22:06.473000Z",
  "updated_at": "2020-05-17T11:28:00.095295Z",
  "draft": false,
  "published": true,
  "published_by": 20548,
  "rating": "",
  "steamid": 925940,
  "gogid": 1956555724,
  "gogslug": "myst_4",
  "humbleid": "",
  "humblestoreid": "",
  "humblestoreid_real": "",
  "script": {
    "files": [
      {
        "setup": "N/A:Select the EXE file downloaded from GOG"
      }
    ],
    "game": {
      "exe": "drive_c/GOG Games/Myst 4/Launch Myst 4 - Revelation.lnk",
      "prefix": "$GAMEDIR"
    },
    "installer": [
      {
        "task": {
          "arch": "win64",
          "description": "Creating WINE prefix",
          "install_gecko": false,
          "install_mono": false,
          "name": "create_prefix",
          "prefix": "$GAMEDIR"
        }
      },
      {
        "task": {
          "app": "d3dx9",
          "arch": "win64",
          "name": "winetricks",
          "prefix": "$GAMEDIR"
        }
      },
      {
        "task": {
          "app": "d3dcompiler_47",
          "arch": "win64",
          "name": "winetricks",
          "prefix": "$GAMEDIR"
        }
      },
      {
        "task": {
          "executable": "setup",
          "name": "wineexec",
          "prefix": "$GAMEDIR"
        }
      },
      {
        "task": {
          "arch": "win64",
          "key": "background",
          "name": "set_regedit",
          "path": "HKEY_CURRENT_USER\\Control Panel\\Colors\\",
          "prefix": "$GAMEDIR",
          "type": "REG_SZ",
          "value": "0 0 0"
        }
      },
      {
        "write_config": {
          "data": {
            "Detection.GameOptions": {
              "GraphicsQuality": 2,
              "MaximumResX": 1024,
              "MaximumResY": 768,
              "SuggestedResX": 1024,
              "SuggestedResY": 768
            }
          },
          "file": "$GAMEDIR/drive_c/GOG Games/Myst 4/bin/detect_config.ini"
        }
      }
    ],
    "system": {
      "reset_desktop": true,
      "resolution": "1024x768"
    },
    "wine": {
      "Desktop": true,
      "WineDesktop": "1024x768",
      "dxvk": true
    }
  },
  "content": "files:\n- setup: N/A:Select the EXE file downloaded from GOG\ngame:\n  exe: drive_c/GOG Games/Myst 4/Launch Myst 4 - Revelation.lnk\n  prefix: $GAMEDIR\ninstaller:\n- task:\n    arch: win64\n    description: Creating WINE prefix\n    install_gecko: false\n    install_mono: false\n    name: create_prefix\n    prefix: $GAMEDIR\n- task:\n    app: d3dx9\n    arch: win64\n    name: winetricks\n    prefix: $GAMEDIR\n- task:\n    app: d3dcompiler_47\n    arch: win64\n    name: winetricks\n    prefix: $GAMEDIR\n- task:\n    executable: setup\n    name: wineexec\n    prefix: $GAMEDIR\n- task:\n    arch: win64\n    key: background\n    name: set_regedit\n    path: HKEY_CURRENT_USER\\Control Panel\\Colors\\\n    prefix: $GAMEDIR\n    type: REG_SZ\n    value: 0 0 0\n- write_config:\n    data:\n      Detection.GameOptions:\n        GraphicsQuality: 2\n        MaximumResX: 1024\n        MaximumResY: 768\n        SuggestedResX: 1024\n        SuggestedResY: 768\n    file: $GAMEDIR/drive_c/GOG Games/Myst 4/bin/detect_config.ini\nsystem:\n  reset_desktop: true\n  resolution: 1024x768\nwine:\n  Desktop: true\n  WineDesktop: 1024x768\n  dxvk: true\n"
}