{
  "id": 18671,
  "game_id": 31885,
  "game_slug": "amoeba",
  "name": "Amoeba",
  "year": 2002,
  "user": "vanstaveren",
  "runner": "wine",
  "slug": "amoeba-final-vulkan",
  "version": "final-vulkan",
  "description": "Demo",
  "notes": "",
  "created_at": "2020-03-03T11:48:42.920843Z",
  "updated_at": "2020-03-20T10:39:31.201385Z",
  "draft": false,
  "published": false,
  "published_by": null,
  "rating": "",
  "steamid": null,
  "gogid": null,
  "gogslug": "",
  "humblestoreid": "",
  "script": {
    "files": [
      {
        "Amoeba.zip": "https://files.scene.org/get:nl-http/parties/2002/underscore02/demo/e_amoeba-final.zip"
      }
    ],
    "installer": [
      {
        "task": {
          "arch": "win64",
          "description": "Creating 64-bit prefix ...",
          "prefix": "$GAMEDIR/prefix",
          "name": "create_prefix"
        }
      },
      {
        "extract": {
          "src": "Amoeba.zip",
          "dst": "$GAMEDIR/prefix/drive_c/Program Files/"
        }
      },
      {
        "task": {
          "arch": "win64",
          "description": "DirectX 11 ...",
          "app": "d3dcompiler_43",
          "prefix": "$GAMEDIR/prefix",
          "name": "winetricks"
        }
      },
      {
        "task": {
          "arch": "win64",
          "description": "DirectX 11 ...",
          "app": "d3dx11_43",
          "prefix": "$GAMEDIR/prefix",
          "name": "winetricks"
        }
      },
      {
        "task": {
          "arch": "win64",
          "description": "Vulkan ...",
          "app": "dxvk",
          "prefix": "$GAMEDIR/prefix",
          "name": "winetricks"
        }
      },
      {
        "task": {
          "arch": "win64",
          "description": "Windows version 8 ...",
          "app": "win8",
          "prefix": "$GAMEDIR/prefix",
          "name": "winetricks"
        }
      }
    ],
    "system": {
      "disable_compositor": true,
      "pulse_latency": true
    },
    "wine": {
      "esync": true
    },
    "game": {
      "arch": "win64",
      "custom-name": "Amoeba",
      "prefix": "$GAMEDIR/prefix",
      "exe": "$GAMEDIR/prefix/drive_c/Program Files/e_amoeba-final/demo-win32.exe"
    }
  },
  "content": "files:\r\n- Amoeba.zip: https://files.scene.org/get:nl-http/parties/2002/underscore02/demo/e_amoeba-final.zip\r\ngame:\r\n  arch: win64\r\n  custom-name: Amoeba\r\n  exe: $GAMEDIR/prefix/drive_c/Program Files/e_amoeba-final/demo-win32.exe\r\n  prefix: $GAMEDIR/prefix\r\ninstaller:\r\n- task:\r\n    arch: win64\r\n    description: Creating 64-bit prefix ...\r\n    name: create_prefix\r\n    prefix: $GAMEDIR/prefix\r\n- extract:\r\n    dst: $GAMEDIR/prefix/drive_c/Program Files/\r\n    src: Amoeba.zip\r\n- task:\r\n    app: d3dcompiler_43\r\n    arch: win64\r\n    description: DirectX 11 ...\r\n    name: winetricks\r\n    prefix: $GAMEDIR/prefix\r\n- task:\r\n    app: d3dx11_43\r\n    arch: win64\r\n    description: DirectX 11 ...\r\n    name: winetricks\r\n    prefix: $GAMEDIR/prefix\r\n- task:\r\n    app: dxvk\r\n    arch: win64\r\n    description: Vulkan ...\r\n    name: winetricks\r\n    prefix: $GAMEDIR/prefix\r\n- task:\r\n    app: win8\r\n    arch: win64\r\n    description: Windows version 8 ...\r\n    name: winetricks\r\n    prefix: $GAMEDIR/prefix\r\nsystem:\r\n  disable_compositor: true\r\n  pulse_latency: true\r\nwine:\r\n  esync: true"
}