{
  "id": 13338,
  "game_id": 27181,
  "game_slug": "livesplit",
  "name": "LiveSplit",
  "year": null,
  "user": "RobLoach",
  "runner": "wine",
  "slug": "livesplit-176",
  "version": "1.7.6",
  "description": null,
  "notes": "Hotkeys are not discovered when LiveSplit is not in focus.",
  "created_at": "2019-05-05T05:14:49.465034Z",
  "updated_at": "2019-05-05T05:51:10.791050Z",
  "draft": false,
  "published": true,
  "published_by": null,
  "rating": "2",
  "steamid": null,
  "gogid": null,
  "gogslug": "",
  "humbleid": "",
  "humblestoreid": "",
  "humblestoreid_real": "",
  "script": {
    "files": [
      {
        "livesplitzip": "https://github.com/LiveSplit/LiveSplit/releases/download/1.7.6/LiveSplit_1.7.6.zip"
      }
    ],
    "game": {
      "arch": "win32",
      "exe": "LiveSplit.exe",
      "prefix": "$GAMEDIR"
    },
    "installer": [
      {
        "task": {
          "description": "Creating Wine prefix",
          "arch": "win32",
          "name": "create_prefix",
          "prefix": "$GAMEDIR"
        }
      },
      {
        "task": {
          "app": "dotnet45",
          "arch": "win32",
          "description": "Installing .NET 4.5. This will take a while...",
          "name": "winetricks",
          "prefix": "$GAMEDIR"
        }
      },
      {
        "task": {
          "app": "win10",
          "arch": "win32",
          "description": "Changing to 10 version...",
          "name": "winetricks",
          "prefix": "$GAMEDIR"
        }
      },
      {
        "task": {
          "name": "winekill",
          "prefix": "$GAMEDIR"
        }
      },
      {
        "extract": {
          "file": "livesplitzip"
        }
      },
      {
        "chmodx": "$GAMEDIR/LiveSplit.exe"
      }
    ]
  },
  "content": "files:\r\n- livesplitzip: https://github.com/LiveSplit/LiveSplit/releases/download/1.7.6/LiveSplit_1.7.6.zip\r\ngame:\r\n  arch: win32\r\n  exe: LiveSplit.exe\r\n  prefix: $GAMEDIR\r\ninstaller:\r\n- task:\r\n    description: Creating Wine prefix\r\n    arch: win32\r\n    name: create_prefix\r\n    prefix: $GAMEDIR\r\n- task:\r\n    app: dotnet45\r\n    arch: win32\r\n    description: Installing .NET 4.5. This will take a while...\r\n    name: winetricks\r\n    prefix: $GAMEDIR\r\n- task:\r\n    app: win10\r\n    arch: win32\r\n    description: Changing to 10 version...\r\n    name: winetricks\r\n    prefix: $GAMEDIR\r\n- task:\r\n    name: winekill\r\n    prefix: $GAMEDIR\r\n- extract:\r\n    file: livesplitzip\r\n- chmodx: $GAMEDIR/LiveSplit.exe"
}