{
  "id": 22270,
  "game_id": 32460,
  "game_slug": "minecraft-dungeons",
  "name": "Minecraft Dungeons",
  "year": 2020,
  "user": "KryspinLi",
  "runner": "wine",
  "slug": "minecraft-dungeons-change-me",
  "version": "Change Me",
  "description": "DO NOT buy the game on the Microsoft Store. Buy it from https://www.minecraftdungeons.netAll videos don't work right now. Meaning you don't see the startup videos or the story intro.",
  "notes": "This installs the launcher for the game. \r\n\r\nKeep the installation directory as is.\r\n\r\nCurrently the launcher always fails \"to check for game dependencies\". Ignore the message and just start the game, as it works anyway.",
  "created_at": "2020-07-10T17:39:45.705020Z",
  "updated_at": "2020-07-10T17:39:45.705046Z",
  "draft": false,
  "published": false,
  "published_by": 20548,
  "rating": "",
  "steamid": null,
  "gogid": null,
  "gogslug": "",
  "humbleid": "",
  "humblestoreid": "",
  "humblestoreid_real": "",
  "script": {
    "files": [
      {
        "installer": "https://launcher.mojang.com/download/MinecraftDungeonsInstaller.msi"
      },
      {
        "audio": "https://lutris.net/files/tools/directx-2010.tar.gz"
      }
    ],
    "game": {
      "exe": "$GAMEDIR/prefix/drive_c/Program Files (x86)/Minecraft Dungeons Launcher/MinecraftDungeonsLauncher.exe",
      "prefix": "$GAMEDIR/prefix",
      "working_dir": "$GAMEDIR/prefix"
    },
    "installer": [
      {
        "extract": {
          "dst": "$CACHE/dxsetup",
          "file": "audio"
        }
      },
      {
        "task": {
          "arch": "win64",
          "name": "create_prefix",
          "prefix": "$GAMEDIR"
        }
      },
      {
        "task": {
          "arch": "win64",
          "args": "/silent",
          "executable": "$CACHE/dxsetup/DXSETUP.exe",
          "name": "wineexec",
          "prefix": "$GAMEDIR"
        }
      },
      {
        "task": {
          "arch": "win64",
          "name": "winekill",
          "prefix": "$GAMEDIR"
        }
      },
      {
        "task": {
          "app": "vcrun2015",
          "arch": "win64",
          "name": "winetricks",
          "prefix": "$GAMEDIR"
        }
      },
      {
        "task": {
          "app": "xact",
          "arch": "win64",
          "name": "winetricks",
          "prefix": "$GAMEDIR"
        }
      },
      {
        "task": {
          "app": "faudio",
          "arch": "win64",
          "name": "winetricks",
          "prefix": "$GAMEDIR"
        }
      },
      {
        "task": {
          "app": "dotnet40",
          "arch": "win64",
          "name": "winetricks",
          "prefix": "$GAMEDIR"
        }
      },
      {
        "task": {
          "arch": "win64",
          "name": "winekill",
          "prefix": "$GAMEDIR"
        }
      },
      {
        "task": {
          "executable": "installer",
          "name": "wineexec",
          "prefix": "$GAMEDIR/prefix"
        }
      }
    ],
    "wine": {
      "dxvk": true,
      "esync": true
    }
  },
  "content": "files:\r\n- installer: https://launcher.mojang.com/download/MinecraftDungeonsInstaller.msi\r\n- audio: https://lutris.net/files/tools/directx-2010.tar.gz\r\ngame:\r\n  exe: $GAMEDIR/prefix/drive_c/Program Files (x86)/Minecraft Dungeons Launcher/MinecraftDungeonsLauncher.exe\r\n  prefix: $GAMEDIR/prefix\r\n  working_dir: $GAMEDIR/prefix\r\ninstaller:\r\n- extract:\r\n    dst: $CACHE/dxsetup\r\n    file: audio\r\n- task:\r\n    arch: win64\r\n    name: create_prefix\r\n    prefix: $GAMEDIR\r\n- task:\r\n    arch: win64\r\n    args: /silent\r\n    executable: $CACHE/dxsetup/DXSETUP.exe\r\n    name: wineexec\r\n    prefix: $GAMEDIR\r\n- task:\r\n    arch: win64\r\n    name: winekill\r\n    prefix: $GAMEDIR\r\n- task:\r\n    app: vcrun2015\r\n    arch: win64\r\n    name: winetricks\r\n    prefix: $GAMEDIR\r\n- task:\r\n    app: xact\r\n    arch: win64\r\n    name: winetricks\r\n    prefix: $GAMEDIR\r\n- task:\r\n    app: faudio\r\n    arch: win64\r\n    name: winetricks\r\n    prefix: $GAMEDIR\r\n- task:\r\n    app: dotnet40\r\n    arch: win64\r\n    name: winetricks\r\n    prefix: $GAMEDIR\r\n- task:\r\n    arch: win64\r\n    name: winekill\r\n    prefix: $GAMEDIR\r\n- task:\r\n    executable: installer\r\n    name: wineexec\r\n    prefix: $GAMEDIR/prefix\r\nwine:\r\n  dxvk: true\r\n  esync: true"
}