{
  "id": 9908,
  "game_id": 15315,
  "game_slug": "the-sims",
  "name": "The Sims",
  "year": 2000,
  "user": "citrusalex",
  "runner": "wine",
  "slug": "the-sims-vulkan",
  "version": "Vulkan",
  "description": "REQUIRES a NoCD executable. Please download it before continuing. Uses dgvoodoo Graphics Api Wrapper by Dege.\r\nOfficial website <a href=\"http://dege.fw.hu\">http://dege.fw.hu</a>",
  "notes": "- Please set up Vulkan first. <a href=\"https://github.com/lutris/lutris/wiki/How-to:-DXVK\">Click here for a how-to guide</a>\r\n- Ignore the message about lacking memory, just press Yes and continue.\r\n- Don't press \"Play\" after the setup of the game has finished. Just wait for the installer to finish.\r\n- This installer has only been tested with Complete Collection and Deluxe Edition, but other versions should work too.\r\n- NoCD executable for Deluxe Edition (<b>you need unrar to get it extracted</b>): <a href=\"http://www.gameburnworld.com/gp/gamefixes/simsdeluxeedition.shtml\">http://www.gameburnworld.com/gp/gamefixes/simsdeluxeedition.shtml</a>\r\n- NoCD executable for Complete Collection (<b>you need unrar get it extracted</b>): \r\n<a href=\"http://www.gameburnworld.com/gp/gamefixes/simscompletecollection.shtml\">http://www.gameburnworld.com/gp/gamefixes/simscompletecollection.shtml</a>",
  "created_at": "2018-08-27T05:56:10.272000Z",
  "updated_at": "2019-08-03T13:21:37.764334Z",
  "draft": false,
  "published": true,
  "published_by": 51687,
  "rating": "4",
  "steamid": null,
  "gogid": null,
  "gogslug": "",
  "humblestoreid": "",
  "script": {
    "game": {
      "exe": "$GAMEDIR/drive_c/Program Files/Maxis/The Sims/Sims.exe",
      "arch": "win32",
      "prefix": "$GAMEDIR",
      "args": "-r1024x768 -skip_intro -skip_verify"
    },
    "files": [
      {
        "dgvoodoo": "https://lutris.net/files/tools/dgvoodoo_2.55.4_dx1-7.tar.xz"
      },
      {
        "nocd": "N/A:Select the NoCD executable (Sims.exe):"
      },
      {
        "installer": "N/A:Select the Setup executable (Setup.exe in Setup folder, NOT start.exe):"
      }
    ],
    "wine": {
      "overrides": {
        "ddraw": "native",
        "winegstreamer": "disabled"
      },
      "dxvk": true,
      "version": "tkg-protonified-3.21-x86_64"
    },
    "installer": [
      {
        "task": {
          "description": "Creating prefix",
          "prefix": "$GAMEDIR",
          "install_mono": false,
          "arch": "win32",
          "name": "create_prefix"
        }
      },
      {
        "move": {
          "dst": "$GAMEDIR/Sims.exe",
          "src": "nocd"
        }
      },
      {
        "execute": {
          "description": "Changing permissions...",
          "command": "chmod 770 \"$GAMEDIR/Sims.exe\""
        }
      },
      {
        "task": {
          "prefix": "$GAMEDIR",
          "name": "winekill"
        }
      },
      {
        "task": {
          "description": "Installing d3dcompiler_43 and d3dcompiler_47...",
          "arch": "win32",
          "prefix": "$GAMEDIR",
          "name": "winetricks",
          "app": "d3dcompiler_43 d3dcompiler_47 quartz"
        }
      },
      {
        "task": {
          "name": "wineexec",
          "description": "Installing The Sims...",
          "prefix": "$GAMEDIR",
          "executable": "installer",
          "arch": "win32",
          "exclude_processes": "Start.exe start.exe"
        }
      },
      {
        "task": {
          "prefix": "$GAMEDIR",
          "name": "winekill"
        }
      },
      {
        "merge": {
          "dst": "$GAMEDIR/drive_c/Program Files/Maxis/The Sims/",
          "src": "$GAMEDIR/Sims.exe"
        }
      },
      {
        "extract": {
          "dst": "$GAMEDIR/drive_c/Program Files/Maxis/The Sims/",
          "file": "dgvoodoo"
        }
      },
      {
        "write_config": {
          "section": "DirectX",
          "value": false,
          "key": "dgVoodooWatermark",
          "file": "$GAMEDIR/drive_c/Program Files/Maxis/The Sims/dgVoodoo.conf"
        }
      }
    ]
  },
  "content": "files:\n- dgvoodoo: https://lutris.net/files/tools/dgvoodoo_2.55.4_dx1-7.tar.xz\n- nocd: 'N/A:Select the NoCD executable (Sims.exe):'\n- installer: 'N/A:Select the Setup executable (Setup.exe in Setup folder, NOT start.exe):'\ngame:\n  arch: win32\n  args: -r1024x768 -skip_intro -skip_verify\n  exe: $GAMEDIR/drive_c/Program Files/Maxis/The Sims/Sims.exe\n  prefix: $GAMEDIR\ninstaller:\n- task:\n    arch: win32\n    description: Creating prefix\n    install_mono: false\n    name: create_prefix\n    prefix: $GAMEDIR\n- move:\n    dst: $GAMEDIR/Sims.exe\n    src: nocd\n- execute:\n    command: chmod 770 \"$GAMEDIR/Sims.exe\"\n    description: Changing permissions...\n- task:\n    name: winekill\n    prefix: $GAMEDIR\n- task:\n    app: d3dcompiler_43 d3dcompiler_47 quartz\n    arch: win32\n    description: Installing d3dcompiler_43 and d3dcompiler_47...\n    name: winetricks\n    prefix: $GAMEDIR\n- task:\n    arch: win32\n    description: Installing The Sims...\n    exclude_processes: Start.exe start.exe\n    executable: installer\n    name: wineexec\n    prefix: $GAMEDIR\n- task:\n    name: winekill\n    prefix: $GAMEDIR\n- merge:\n    dst: $GAMEDIR/drive_c/Program Files/Maxis/The Sims/\n    src: $GAMEDIR/Sims.exe\n- extract:\n    dst: $GAMEDIR/drive_c/Program Files/Maxis/The Sims/\n    file: dgvoodoo\n- write_config:\n    file: $GAMEDIR/drive_c/Program Files/Maxis/The Sims/dgVoodoo.conf\n    key: dgVoodooWatermark\n    section: DirectX\n    value: false\nwine:\n  dxvk: true\n  overrides:\n    ddraw: native\n    winegstreamer: disabled\n  version: tkg-protonified-3.21-x86_64\n"
}