{
  "id": 12805,
  "game_id": 15315,
  "game_slug": "the-sims",
  "name": "The Sims",
  "year": 2000,
  "user": "citrusalex",
  "runner": "wine",
  "slug": "the-sims-opengl",
  "version": "OpenGL",
  "description": "REQUIRES a NoCD executable. Please download it before continuing.",
  "notes": "- Ignore the message about lacking memory, just press Yes and continue.\r\n- Don't press \"Play\" after the setup of the game has finished. Just wait for the installer to finish.\r\n- This installer has only been tested with Complete Collection and Deluxe Edition, but other versions should work too.\r\n- NoCD executable for Deluxe Edition (<b>you need unrar to get it extracted</b>): <a href=\"http://www.gameburnworld.com/gp/gamefixes/simsdeluxeedition.shtml\">http://www.gameburnworld.com/gp/gamefixes/simsdeluxeedition.shtml</a>\r\n- NoCD executable for Complete Collection (<b>you need unrar get it extracted</b>): \r\n<a href=\"http://www.gameburnworld.com/gp/gamefixes/simscompletecollection.shtml\">http://www.gameburnworld.com/gp/gamefixes/simscompletecollection.shtml</a>",
  "created_at": "2019-04-15T05:15:57.189000Z",
  "updated_at": "2020-01-23T02:56:48.752519Z",
  "draft": false,
  "published": true,
  "published_by": 51687,
  "rating": "4",
  "steamid": null,
  "gogid": null,
  "gogslug": "",
  "humblestoreid": "",
  "script": {
    "installer": [
      {
        "task": {
          "arch": "win32",
          "description": "Creating prefix",
          "install_mono": false,
          "prefix": "$GAMEDIR",
          "name": "create_prefix"
        }
      },
      {
        "move": {
          "src": "nocd",
          "dst": "$GAMEDIR/Sims.exe"
        }
      },
      {
        "execute": {
          "description": "Changing permissions...",
          "command": "chmod 770 \"$GAMEDIR/Sims.exe\""
        }
      },
      {
        "task": {
          "prefix": "$GAMEDIR",
          "name": "winekill"
        }
      },
      {
        "task": {
          "app": "quartz",
          "prefix": "$GAMEDIR",
          "name": "winetricks"
        }
      },
      {
        "task": {
          "arch": "win32",
          "prefix": "$GAMEDIR",
          "name": "wineexec",
          "exclude_processes": "Start.exe start.exe",
          "executable": "installer",
          "description": "Installing The Sims..."
        }
      },
      {
        "task": {
          "prefix": "$GAMEDIR",
          "name": "winekill"
        }
      },
      {
        "merge": {
          "src": "$GAMEDIR/Sims.exe",
          "dst": "$GAMEDIR/drive_c/Program Files/Maxis/The Sims/"
        }
      }
    ],
    "files": [
      {
        "nocd": "N/A:Select the NoCD executable (Sims.exe):"
      },
      {
        "installer": "N/A:Select the Setup executable (Setup.exe in Setup folder, NOT start.exe):"
      }
    ],
    "wine": {
      "overrides": {
        "winegstreamer": "disabled"
      }
    },
    "game": {
      "arch": "win32",
      "args": "-r1024x768 -skip_intro -skip_verify",
      "working_dir": "$GAMEDIR/drive_c/Program Files/Maxis/The Sims/",
      "prefix": "$GAMEDIR",
      "exe": "$GAMEDIR/drive_c/Program Files/Maxis/The Sims/Sims.exe"
    }
  },
  "content": "files:\n- nocd: 'N/A:Select the NoCD executable (Sims.exe):'\n- installer: 'N/A:Select the Setup executable (Setup.exe in Setup folder, NOT start.exe):'\ngame:\n  arch: win32\n  args: -r1024x768 -skip_intro -skip_verify\n  exe: $GAMEDIR/drive_c/Program Files/Maxis/The Sims/Sims.exe\n  prefix: $GAMEDIR\n  working_dir: $GAMEDIR/drive_c/Program Files/Maxis/The Sims/\ninstaller:\n- task:\n    arch: win32\n    description: Creating prefix\n    install_mono: false\n    name: create_prefix\n    prefix: $GAMEDIR\n- move:\n    dst: $GAMEDIR/Sims.exe\n    src: nocd\n- execute:\n    command: chmod 770 \"$GAMEDIR/Sims.exe\"\n    description: Changing permissions...\n- task:\n    name: winekill\n    prefix: $GAMEDIR\n- task:\n    app: quartz\n    name: winetricks\n    prefix: $GAMEDIR\n- task:\n    arch: win32\n    description: Installing The Sims...\n    exclude_processes: Start.exe start.exe\n    executable: installer\n    name: wineexec\n    prefix: $GAMEDIR\n- task:\n    name: winekill\n    prefix: $GAMEDIR\n- merge:\n    dst: $GAMEDIR/drive_c/Program Files/Maxis/The Sims/\n    src: $GAMEDIR/Sims.exe\nwine:\n  overrides:\n    winegstreamer: disabled\n"
}