{
  "id": 13081,
  "game_id": 6513,
  "game_slug": "ys-vi-the-ark-of-napishtim",
  "name": "Ys VI: The Ark of Napishtim",
  "year": null,
  "user": "fate",
  "runner": "wine",
  "slug": "ys-vi-the-ark-of-napishtim-gog",
  "version": "GOG",
  "description": null,
  "notes": "",
  "created_at": "2019-04-24T20:36:43.816000Z",
  "updated_at": "2019-04-25T03:35:38.768573Z",
  "draft": false,
  "published": true,
  "published_by": 19464,
  "rating": "",
  "steamid": 312540,
  "gogid": 1429178878,
  "gogslug": "ys_vi_the_ark_of_napishtim",
  "humblestoreid": "",
  "script": {
    "game": {
      "exe": "drive_c/GOG Games/Ys VI - The Ark of Napishtim/ys6_win.exe",
      "arch": "win32",
      "prefix": "$GAMEDIR"
    },
    "files": [
      {
        "lavf": "https://github.com/Nevcairiel/LAVFilters/releases/download/0.74.1/LAVFilters-0.74.1-Installer.exe"
      },
      {
        "game": "N/A:Select the Ys VI installer provided by GOG."
      }
    ],
    "wine": {
      "overrides": {
        "winegstreamer": "disabled"
      }
    },
    "installer": [
      {
        "task": {
          "prefix": "$GAMEDIR",
          "arch": "win32",
          "name": "create_prefix"
        }
      },
      {
        "task": {
          "arch": "win32",
          "prefix": "$GAMEDIR",
          "name": "winetricks",
          "app": "vcrun2008"
        }
      },
      {
        "task": {
          "description": "Installing quartz",
          "arch": "win32",
          "prefix": "$GAMEDIR",
          "name": "winetricks",
          "app": "quartz"
        }
      },
      {
        "task": {
          "description": "Installing amstream",
          "arch": "win32",
          "prefix": "$GAMEDIR",
          "name": "winetricks",
          "app": "amstream"
        }
      },
      {
        "task": {
          "prefix": "$GAMEDIR",
          "executable": "game",
          "arch": "win32",
          "name": "wineexec"
        }
      },
      {
        "task": {
          "description": "Install LavFilter to have movies",
          "prefix": "$GAMEDIR",
          "executable": "lavf",
          "arch": "win32",
          "name": "wineexec"
        }
      },
      {
        "task": {
          "description": "Running config tool for first time launch...",
          "prefix": "$GAMEDIR",
          "executable": "$GAMEDIR/drive_c/GOG Games/Ys VI - The Ark of Napishtim/config.exe",
          "arch": "win32",
          "name": "wineexec"
        }
      }
    ]
  },
  "content": "files:\n- lavf: https://github.com/Nevcairiel/LAVFilters/releases/download/0.74.1/LAVFilters-0.74.1-Installer.exe\n- game: N/A:Select the Ys VI installer provided by GOG.\ngame:\n  arch: win32\n  exe: drive_c/GOG Games/Ys VI - The Ark of Napishtim/ys6_win.exe\n  prefix: $GAMEDIR\ninstaller:\n- task:\n    arch: win32\n    name: create_prefix\n    prefix: $GAMEDIR\n- task:\n    app: vcrun2008\n    arch: win32\n    name: winetricks\n    prefix: $GAMEDIR\n- task:\n    app: quartz\n    arch: win32\n    description: Installing quartz\n    name: winetricks\n    prefix: $GAMEDIR\n- task:\n    app: amstream\n    arch: win32\n    description: Installing amstream\n    name: winetricks\n    prefix: $GAMEDIR\n- task:\n    arch: win32\n    executable: game\n    name: wineexec\n    prefix: $GAMEDIR\n- task:\n    arch: win32\n    description: Install LavFilter to have movies\n    executable: lavf\n    name: wineexec\n    prefix: $GAMEDIR\n- task:\n    arch: win32\n    description: Running config tool for first time launch...\n    executable: $GAMEDIR/drive_c/GOG Games/Ys VI - The Ark of Napishtim/config.exe\n    name: wineexec\n    prefix: $GAMEDIR\nwine:\n  overrides:\n    winegstreamer: disabled\n"
}