{
  "id": 18476,
  "game_id": 76,
  "game_slug": "minetest",
  "name": "Minetest",
  "year": 2013,
  "user": "vanstaveren",
  "runner": "wine",
  "slug": "minetest-600-vulkan",
  "version": "6.0.0-vulkan",
  "description": null,
  "notes": "",
  "created_at": "2020-02-20T19:37:54.028401Z",
  "updated_at": "2020-03-20T10:40:45.914795Z",
  "draft": true,
  "published": false,
  "published_by": null,
  "rating": "",
  "steamid": null,
  "gogid": null,
  "gogslug": "",
  "humblestoreid": "",
  "script": {
    "files": [
      {
        "minetest.zip": "https://downloads.minetest.org/minetest-win64.zip"
      }
    ],
    "installer": [
      {
        "task": {
          "arch": "win64",
          "description": "Creating 64-bit prefix ...",
          "prefix": "$GAMEDIR/prefix",
          "name": "create_prefix"
        }
      },
      {
        "extract": {
          "src": "minetest.zip",
          "dst": "$GAMEDIR/prefix/drive_c/Program Files/Minetest"
        }
      },
      {
        "task": {
          "arch": "win64",
          "description": "DirectX 11 ...",
          "app": "d3dcompiler_43",
          "prefix": "$GAMEDIR/prefix",
          "name": "winetricks"
        }
      },
      {
        "task": {
          "arch": "win64",
          "description": "DirectX 11 ...",
          "app": "d3dx11_43",
          "prefix": "$GAMEDIR/prefix",
          "name": "winetricks"
        }
      },
      {
        "task": {
          "arch": "win64",
          "description": "Vulkan ...",
          "app": "dxvk",
          "prefix": "$GAMEDIR/prefix",
          "name": "winetricks"
        }
      },
      {
        "task": {
          "arch": "win64",
          "description": "Windows version 8 ...",
          "app": "win8",
          "prefix": "$GAMEDIR/prefix",
          "name": "winetricks"
        }
      }
    ],
    "system": {
      "disable_compositor": true,
      "pulse_latency": true
    },
    "wine": {
      "dxvk": true,
      "esync": true
    },
    "game": {
      "arch": "win64",
      "custom-name": "Minetest",
      "exe": "$GAMEDIR/prefix/drive_c/Program Files/Minetest/bin/minetest.exe"
    }
  },
  "content": "files:\r\n- minetest.zip: https://downloads.minetest.org/minetest-win64.zip\r\ngame:\r\n  arch: win64\r\n  custom-name: Minetest\r\n  exe: $GAMEDIR/prefix/drive_c/Program Files/Minetest/bin/minetest.exe\r\ninstaller:\r\n- task:\r\n    arch: win64\r\n    description: Creating 64-bit prefix ...\r\n    name: create_prefix\r\n    prefix: $GAMEDIR/prefix\r\n- extract:\r\n    dst: $GAMEDIR/prefix/drive_c/Program Files/Minetest\r\n    src: minetest.zip\r\n- task:\r\n    app: d3dcompiler_43\r\n    arch: win64\r\n    description: DirectX 11 ...\r\n    name: winetricks\r\n    prefix: $GAMEDIR/prefix\r\n- task:\r\n    app: d3dx11_43\r\n    arch: win64\r\n    description: DirectX 11 ...\r\n    name: winetricks\r\n    prefix: $GAMEDIR/prefix\r\n- task:\r\n    app: dxvk\r\n    arch: win64\r\n    description: Vulkan ...\r\n    name: winetricks\r\n    prefix: $GAMEDIR/prefix\r\n- task:\r\n    app: win8\r\n    arch: win64\r\n    description: Windows version 8 ...\r\n    name: winetricks\r\n    prefix: $GAMEDIR/prefix\r\nsystem:\r\n  disable_compositor: true\r\n  pulse_latency: true\r\nwine:\r\n  dxvk: true\r\n  esync: true"
}