{
  "id": 18621,
  "game_id": 38,
  "game_slug": "alien-arena",
  "name": "Alien Arena",
  "year": 2013,
  "user": "vanstaveren",
  "runner": "wine",
  "slug": "alien-arena-765-vulkan",
  "version": "7.65-vulkan",
  "description": null,
  "notes": "",
  "created_at": "2020-03-01T02:56:37.580402Z",
  "updated_at": "2020-03-20T10:39:17.801012Z",
  "draft": false,
  "published": false,
  "published_by": null,
  "rating": "",
  "steamid": null,
  "gogid": null,
  "gogslug": "",
  "humbleid": "",
  "humblestoreid": "",
  "humblestoreid_real": "",
  "script": {
    "files": [
      {
        "AlienArena.zip": "http://red.planetarena.org/files/AlienArena.zip"
      }
    ],
    "game": {
      "arch": "win64",
      "custom-name": "Alien Arena",
      "exe": "$GAMEDIR/prefix/drive_c/Program Files/alienarena.exe",
      "prefix": "$GAMEDIR/prefix"
    },
    "installer": [
      {
        "task": {
          "arch": "win64",
          "description": "Creating 64-bit prefix ...",
          "name": "create_prefix",
          "prefix": "$GAMEDIR/prefix"
        }
      },
      {
        "extract": {
          "dst": "$GAMEDIR/prefix/drive_c/Program Files/",
          "src": "AlienArena.zip"
        }
      },
      {
        "task": {
          "app": "d3dcompiler_43",
          "arch": "win64",
          "description": "DirectX 11 ...",
          "name": "winetricks",
          "prefix": "$GAMEDIR/prefix"
        }
      },
      {
        "task": {
          "app": "d3dx11_43",
          "arch": "win64",
          "description": "DirectX 11 ...",
          "name": "winetricks",
          "prefix": "$GAMEDIR/prefix"
        }
      },
      {
        "task": {
          "app": "dxvk",
          "arch": "win64",
          "description": "Vulkan ...",
          "name": "winetricks",
          "prefix": "$GAMEDIR/prefix"
        }
      },
      {
        "task": {
          "app": "win8",
          "arch": "win64",
          "description": "Windows version 8 ...",
          "name": "winetricks",
          "prefix": "$GAMEDIR/prefix"
        }
      }
    ],
    "system": {
      "disable_compositor": true,
      "pulse_latency": true
    },
    "wine": {
      "dxvk": true,
      "esync": true
    }
  },
  "content": "files:\r\n- AlienArena.zip: http://red.planetarena.org/files/AlienArena.zip\r\ngame:\r\n  arch: win64\r\n  custom-name: Alien Arena\r\n  exe: $GAMEDIR/prefix/drive_c/Program Files/alienarena.exe\r\n  prefix: $GAMEDIR/prefix\r\ninstaller:\r\n- task:\r\n    arch: win64\r\n    description: Creating 64-bit prefix ...\r\n    name: create_prefix\r\n    prefix: $GAMEDIR/prefix\r\n- extract:\r\n    dst: $GAMEDIR/prefix/drive_c/Program Files/\r\n    src: AlienArena.zip\r\n- task:\r\n    app: d3dcompiler_43\r\n    arch: win64\r\n    description: DirectX 11 ...\r\n    name: winetricks\r\n    prefix: $GAMEDIR/prefix\r\n- task:\r\n    app: d3dx11_43\r\n    arch: win64\r\n    description: DirectX 11 ...\r\n    name: winetricks\r\n    prefix: $GAMEDIR/prefix\r\n- task:\r\n    app: dxvk\r\n    arch: win64\r\n    description: Vulkan ...\r\n    name: winetricks\r\n    prefix: $GAMEDIR/prefix\r\n- task:\r\n    app: win8\r\n    arch: win64\r\n    description: Windows version 8 ...\r\n    name: winetricks\r\n    prefix: $GAMEDIR/prefix\r\nsystem:\r\n  disable_compositor: true\r\n  pulse_latency: true\r\nwine:\r\n  dxvk: true\r\n  esync: true"
}