{
  "id": 5894,
  "game_id": 692,
  "game_slug": "star-wars-battlefront-ii",
  "name": "Star Wars: Battlefront II (2005)",
  "year": 2005,
  "user": "Trollwut",
  "runner": "wine",
  "slug": "star-wars-battlefront-ii-2005-gog",
  "version": "GOG",
  "description": null,
  "notes": "",
  "created_at": "2017-10-04T02:19:12.612000Z",
  "updated_at": "2020-03-08T11:49:57.942214Z",
  "draft": false,
  "published": true,
  "published_by": 20548,
  "rating": "",
  "steamid": 6060,
  "gogid": 1421404701,
  "gogslug": "star_wars_battlefront_ii",
  "humblestoreid": "",
  "script": {
    "files": [
      {
        "goginstaller": "N/A:Please select the GOG.com Windows installer"
      },
      {
        "dx2010": "https://lutris.net/files/tools/directx-2010.tar.gz"
      }
    ],
    "game": {
      "prefix": "$GAMEDIR",
      "exe": "drive_c/GOG Games/Star Wars - Battlefront 2/GameData/BattlefrontII.exe",
      "arch": "win32"
    },
    "wine": {
      "dxvk": true,
      "Desktop": true
    },
    "system": {
      "env": {
        "DXVK_HUD": "fps"
      }
    },
    "installer": [
      {
        "extract": {
          "file": "dx2010",
          "dst": "$CACHE/dxsetup"
        }
      },
      {
        "task": {
          "prefix": "$GAMEDIR",
          "arch": "win32",
          "name": "create_prefix"
        }
      },
      {
        "task": {
          "prefix": "$GAMEDIR",
          "arch": "win32",
          "executable": "$CACHE/dxsetup/DXSETUP.exe",
          "name": "wineexec",
          "args": "/silent"
        }
      },
      {
        "task": {
          "prefix": "$GAMEDIR",
          "arch": "win32",
          "name": "winekill"
        }
      },
      {
        "task": {
          "prefix": "$GAMEDIR",
          "arch": "win32",
          "app": "vcrun2013 win7",
          "name": "winetricks"
        }
      },
      {
        "task": {
          "prefix": "$GAMEDIR",
          "executable": "goginstaller",
          "name": "wineexec",
          "description": "Installing...",
          "args": "/LANG=English /SP- /SUPPRESSMSGBOXES"
        }
      }
    ]
  },
  "content": "files:\n- goginstaller: N/A:Please select the GOG.com Windows installer\n- dx2010: https://lutris.net/files/tools/directx-2010.tar.gz\ngame:\n  arch: win32\n  exe: drive_c/GOG Games/Star Wars - Battlefront 2/GameData/BattlefrontII.exe\n  prefix: $GAMEDIR\ninstaller:\n- extract:\n    dst: $CACHE/dxsetup\n    file: dx2010\n- task:\n    arch: win32\n    name: create_prefix\n    prefix: $GAMEDIR\n- task:\n    arch: win32\n    args: /silent\n    executable: $CACHE/dxsetup/DXSETUP.exe\n    name: wineexec\n    prefix: $GAMEDIR\n- task:\n    arch: win32\n    name: winekill\n    prefix: $GAMEDIR\n- task:\n    app: vcrun2013 win7\n    arch: win32\n    name: winetricks\n    prefix: $GAMEDIR\n- task:\n    args: /LANG=English /SP- /SUPPRESSMSGBOXES\n    description: Installing...\n    executable: goginstaller\n    name: wineexec\n    prefix: $GAMEDIR\nsystem:\n  env:\n    DXVK_HUD: fps\nwine:\n  Desktop: true\n  dxvk: true\n"
}