{
  "id": 15012,
  "game_id": 1599,
  "game_slug": "spore",
  "name": "Spore",
  "year": 2008,
  "user": "ThePixelMouse",
  "runner": "wine",
  "slug": "spore-mod-spore-modapi",
  "version": "[Mod] Spore ModAPI",
  "description": null,
  "notes": "",
  "created_at": "2019-08-14T18:59:27.751000Z",
  "updated_at": "2020-01-14T19:04:38.588954Z",
  "draft": false,
  "published": true,
  "published_by": 20548,
  "rating": "",
  "steamid": 17390,
  "gogid": 1948823323,
  "gogslug": "spore_collection",
  "humblestoreid": "",
  "script": {
    "custom-name": "Spore ModAPI",
    "game": {
      "exe": "drive_c/ProgramData/SPORE ModAPI Launcher Kit/Spore ModAPI Launcher.exe"
    },
    "files": [
      {
        "modApiInstaller": {
          "filename": "SporeModApi.exe",
          "url": "https://drive.google.com/uc?export=download&id=1enaNUryG7ElSbYFLDLBI-XHaeie8ZPwR"
        }
      }
    ],
    "requires": "spore-origin | spore-origin-w-d9vk | spore-gog | spore-gog-w-d9vk | spore-steam | spore-steam-w-d9vk",
    "installer": [
      {
        "task": {
          "prefix": "$GAMEDIR",
          "arch": "win32",
          "app": "dotnet452",
          "name": "winetricks"
        }
      },
      {
        "task": {
          "arch": "win32",
          "name": "set_regedit",
          "description": "Setting version to 7...",
          "key": "Version",
          "prefix": "$GAMEDIR",
          "value": "win7",
          "path": "HKEY_CURRENT_USER\\Software\\Wine"
        }
      },
      {
        "task": {
          "prefix": "$GAMEDIR",
          "name": "winekill"
        }
      },
      {
        "task": {
          "prefix": "$GAMEDIR",
          "arch": "win32",
          "executable": "modApiInstaller",
          "name": "wineexec",
          "description": "Installing the ModAPI"
        }
      }
    ]
  },
  "content": "custom-name: Spore ModAPI\nfiles:\n- modApiInstaller:\n    filename: SporeModApi.exe\n    url: https://drive.google.com/uc?export=download&id=1enaNUryG7ElSbYFLDLBI-XHaeie8ZPwR\ngame:\n  exe: drive_c/ProgramData/SPORE ModAPI Launcher Kit/Spore ModAPI Launcher.exe\ninstaller:\n- task:\n    app: dotnet452\n    arch: win32\n    name: winetricks\n    prefix: $GAMEDIR\n- task:\n    arch: win32\n    description: Setting version to 7...\n    key: Version\n    name: set_regedit\n    path: HKEY_CURRENT_USER\\Software\\Wine\n    prefix: $GAMEDIR\n    value: win7\n- task:\n    name: winekill\n    prefix: $GAMEDIR\n- task:\n    arch: win32\n    description: Installing the ModAPI\n    executable: modApiInstaller\n    name: wineexec\n    prefix: $GAMEDIR\nrequires: spore-origin | spore-origin-w-d9vk | spore-gog | spore-gog-w-d9vk | spore-steam\n  | spore-steam-w-d9vk\n"
}