{
  "id": 13203,
  "game_id": 1599,
  "game_slug": "spore",
  "name": "Spore",
  "year": 2008,
  "user": "citrusalex",
  "runner": "wine",
  "slug": "spore-origin",
  "version": "Origin",
  "description": "Runs much faster and fixes terrain issues.",
  "notes": "**CONFIGURE AND INSTALL THE DEPENDENCIES FIRST**\r\nInstructions for D9VK support: <a href=\"https://github.com/lutris/lutris/wiki/Installing-drivers\">https://github.com/lutris/lutris/wiki/Installing-drivers</a>",
  "created_at": "2019-04-29T01:29:48.768000Z",
  "updated_at": "2020-01-23T15:53:44.112796Z",
  "draft": false,
  "published": true,
  "published_by": 51687,
  "rating": "",
  "steamid": 17390,
  "gogid": 1948823323,
  "gogslug": "spore_collection",
  "humblestoreid": "",
  "script": {
    "files": [
      {
        "origin": "https://origin-a.akamaihd.net/Origin-Client-Download/origin/legacy/OriginThinSetup.exe"
      }
    ],
    "installer": [
      {
        "task": {
          "arch": "win32",
          "description": "Creating Wine Prefix...",
          "prefix": "$GAMEDIR",
          "name": "create_prefix"
        }
      },
      {
        "task": {
          "arch": "win32",
          "app": "nocrashdialog",
          "prefix": "$GAMEDIR",
          "name": "winetricks"
        }
      },
      {
        "task": {
          "app": "d3dcompiler_43 d3dx9",
          "prefix": "$GAMEDIR",
          "name": "winetricks"
        }
      },
      {
        "task": {
          "prefix": "$GAMEDIR",
          "value": "winxp",
          "arch": "win32",
          "key": "Version",
          "name": "set_regedit",
          "description": "Setting version to xp...",
          "path": "HKEY_CURRENT_USER\\Software\\Wine"
        }
      },
      {
        "task": {
          "prefix": "$GAMEDIR",
          "name": "winekill"
        }
      },
      {
        "task": {
          "arch": "win32",
          "prefix": "$GAMEDIR",
          "name": "wineexec",
          "exclude_processes": "Origin.exe OriginClientService.exe",
          "executable": "origin",
          "description": "Installing Origin..."
        }
      },
      {
        "task": {
          "prefix": "$GAMEDIR",
          "name": "winekill"
        }
      }
    ],
    "system": {
      "env": {
        "__GL_SHADER_DISK_CACHE_PATH": "$GAMEDIR",
        "DXVK_LOG_LEVEL": "none",
        "DXVK_STATE_CACHE_PATH": "$GAMEDIR",
        "__GL_SHADER_DISK_CACHE": 1
      }
    },
    "wine": {
      "dxvk": true,
      "esync": true
    },
    "game": {
      "arch": "win32",
      "prefix": "$GAMEDIR",
      "exe": "drive_c/Program Files/Origin/Origin.exe"
    }
  },
  "content": "files:\n- origin: https://origin-a.akamaihd.net/Origin-Client-Download/origin/legacy/OriginThinSetup.exe\ngame:\n  arch: win32\n  exe: drive_c/Program Files/Origin/Origin.exe\n  prefix: $GAMEDIR\ninstaller:\n- task:\n    arch: win32\n    description: Creating Wine Prefix...\n    name: create_prefix\n    prefix: $GAMEDIR\n- task:\n    app: nocrashdialog\n    arch: win32\n    name: winetricks\n    prefix: $GAMEDIR\n- task:\n    app: d3dcompiler_43 d3dx9\n    name: winetricks\n    prefix: $GAMEDIR\n- task:\n    arch: win32\n    description: Setting version to xp...\n    key: Version\n    name: set_regedit\n    path: HKEY_CURRENT_USER\\Software\\Wine\n    prefix: $GAMEDIR\n    value: winxp\n- task:\n    name: winekill\n    prefix: $GAMEDIR\n- task:\n    arch: win32\n    description: Installing Origin...\n    exclude_processes: Origin.exe OriginClientService.exe\n    executable: origin\n    name: wineexec\n    prefix: $GAMEDIR\n- task:\n    name: winekill\n    prefix: $GAMEDIR\nsystem:\n  env:\n    DXVK_LOG_LEVEL: none\n    DXVK_STATE_CACHE_PATH: $GAMEDIR\n    __GL_SHADER_DISK_CACHE: 1\n    __GL_SHADER_DISK_CACHE_PATH: $GAMEDIR\nwine:\n  dxvk: true\n  esync: true\n"
}