{
  "id": 14152,
  "game_id": 27750,
  "game_slug": "thandor-the-invasion",
  "name": "Thandor: The Invasion",
  "year": 2000,
  "user": "ArchPCK",
  "runner": "wine",
  "slug": "thandor-the-invasion-105-en-jowood",
  "version": "1.05 EN (JoWood)",
  "description": "This installer also requires the patch, see installer for download link. Patch MD5 is 4133020e5a7c9f74a633f586d231dc6b.\r\n\r\nVirustotal link: https://www.virustotal.com/gui/file/a6cd7445cd2ab6d36e00664b9b02d99d912704ad3fdfb98233b2705599437cf3/details",
  "notes": "WARN: Make sure to either activate virtual desktop with the selected thandor resolution (in winecfg - Tab Graphics) or\r\n      run thandor in full screen with the native display resolution (for some resolutions thandor.dat must be edited manually, see LinuxReadme after install and check the provided config files in customConfigs_Tools))!\r\n      > Issue: Ignoring this will lead to a mouse cursor that jumps to the top left edge while playing",
  "created_at": "2019-06-17T15:04:21.617000Z",
  "updated_at": "2019-10-28T20:51:48.661157Z",
  "draft": false,
  "published": true,
  "published_by": 51687,
  "rating": "",
  "steamid": null,
  "gogid": null,
  "gogslug": "",
  "humblestoreid": "",
  "script": {
    "files": [
      {
        "patch105": "N/A:Download patch 1.05 from http://s000.tinyupload.com/index.php?file_id=09051709526305652937 (md5 4133020e5a7c9f74a633f586d231dc6b)"
      },
      {
        "directx61": "https://archive.org/download/dx61sdkimage/dx61sdkimage.exe"
      }
    ],
    "require-binaries": "7z",
    "installer": [
      {
        "insert-disc": {
          "description": "WARN: Make sure to either activate virtual desktop with the selected thandor resolution (in winecfg - Tab Graphics) or run thandor in full screen with the native display resolution (for some resolutions thandor.dat must be edited manually)!\n > Issue: Ignoring this will lead to a mouse cursor that jumps to the top left edge while playing\n Also see LinuxReadme in the game directory for additional informations",
          "requires": "Thandor/thandor.dat"
        }
      },
      {
        "task": {
          "description": "Creating WINE prefix",
          "name": "create_prefix",
          "arch": "win64",
          "prefix": "$GAMEDIR"
        }
      },
      {
        "task": {
          "description": "Using Windows 95 for setup",
          "name": "winetricks",
          "app": "win95",
          "prefix": "$GAMEDIR"
        }
      },
      {
        "task": {
          "prefix": "$GAMEDIR",
          "name": "wineexec",
          "arch": "win95",
          "executable": "$DISC/Setup.exe"
        }
      },
      {
        "execute": {
          "args": "e $directx61 -o$CACHE/tmp/dx6",
          "file": "7z"
        }
      },
      {
        "move": {
          "dst": "$GAMEDIR/drive_c/Program Files (x86)/JoWood/Thandor/",
          "src": "$CACHE/tmp/dx6/dinput.dll"
        }
      },
      {
        "extract": {
          "dst": "$GAMEDIR/drive_c/Program Files (x86)/JoWood/Thandor/",
          "file": "patch105"
        }
      },
      {
        "task": {
          "prefix": "$GAMEDIR",
          "name": "winetricks",
          "arch": "win64",
          "app": "winxp"
        }
      },
      {
        "task": {
          "name": "set_regedit",
          "arch": "win64",
          "key": "GrabFullscreen",
          "prefix": "$GAMEDIR",
          "path": "HKEY_CURRENT_USER\\Software\\Wine\\X11 Driver",
          "value": "N"
        }
      }
    ],
    "system": {
      "env": {
        "LUTRIS_RUNTIME": "0"
      }
    },
    "game": {
      "prefix": "$GAMEDIR",
      "arch": "win64",
      "exe": "drive_c/Program Files (x86)/JoWood/Thandor/thandor.exe"
    },
    "wine": {
      "dxvk": false,
      "overrides": {
        "dinput.dll": "native"
      }
    }
  },
  "content": "files:\n- patch105: N/A:Download patch 1.05 from http://s000.tinyupload.com/index.php?file_id=09051709526305652937\n    (md5 4133020e5a7c9f74a633f586d231dc6b)\n- directx61: https://archive.org/download/dx61sdkimage/dx61sdkimage.exe\ngame:\n  arch: win64\n  exe: drive_c/Program Files (x86)/JoWood/Thandor/thandor.exe\n  prefix: $GAMEDIR\ninstaller:\n- insert-disc:\n    description: \"WARN: Make sure to either activate virtual desktop with the selected\\\n      \\ thandor resolution (in winecfg - Tab Graphics) or run thandor in full screen\\\n      \\ with the native display resolution (for some resolutions thandor.dat must\\\n      \\ be edited manually)!\\n > Issue: Ignoring this will lead to a mouse cursor\\\n      \\ that jumps to the top left edge while playing\\n Also see LinuxReadme in the\\\n      \\ game directory for additional informations\"\n    requires: Thandor/thandor.dat\n- task:\n    arch: win64\n    description: Creating WINE prefix\n    name: create_prefix\n    prefix: $GAMEDIR\n- task:\n    app: win95\n    description: Using Windows 95 for setup\n    name: winetricks\n    prefix: $GAMEDIR\n- task:\n    arch: win95\n    executable: $DISC/Setup.exe\n    name: wineexec\n    prefix: $GAMEDIR\n- execute:\n    args: e $directx61 -o$CACHE/tmp/dx6\n    file: 7z\n- move:\n    dst: $GAMEDIR/drive_c/Program Files (x86)/JoWood/Thandor/\n    src: $CACHE/tmp/dx6/dinput.dll\n- extract:\n    dst: $GAMEDIR/drive_c/Program Files (x86)/JoWood/Thandor/\n    file: patch105\n- task:\n    app: winxp\n    arch: win64\n    name: winetricks\n    prefix: $GAMEDIR\n- task:\n    arch: win64\n    key: GrabFullscreen\n    name: set_regedit\n    path: HKEY_CURRENT_USER\\Software\\Wine\\X11 Driver\n    prefix: $GAMEDIR\n    value: N\nrequire-binaries: 7z\nsystem:\n  env:\n    LUTRIS_RUNTIME: '0'\nwine:\n  dxvk: false\n  overrides:\n    dinput.dll: native\n"
}