{
  "id": 15754,
  "game_id": 270,
  "game_slug": "batman-arkham-city-goty",
  "name": "Batman: Arkham City GOTY",
  "year": 2012,
  "user": "751203f8735e628528b32f1f3c8e3da1",
  "runner": "wine",
  "slug": "batman-arkham-city-goty-epic-store",
  "version": "Epic Store",
  "description": "This installer will install the software necessary for the Epic Game store.Once install is finished you'll have to download Batman: Arkham City GOTY manually through the Epic Games Launcher.",
  "notes": "For a better performance, is recommendable disable DirectX 11 options and PhysX in game parameters.\r\n\r\nIf show you see an error message for DXSETUP.exe, simply you click \"No\".\r\n\r\nIf you see a DirectX installation assistant and Microsoft Visual C++ 2008 when launching the game cancel those installations.",
  "created_at": "2019-09-22T16:51:11.113000Z",
  "updated_at": "2020-01-23T02:57:03.416062Z",
  "draft": false,
  "published": true,
  "published_by": 19464,
  "rating": "",
  "steamid": 200260,
  "gogid": null,
  "gogslug": "",
  "humblestoreid": "batman-arkham-city-goty-edition",
  "script": {
    "game": {
      "exe": "drive_c/Program Files (x86)/Epic Games/Launcher/Portal/Binaries/Win32/EpicGamesLauncher.exe",
      "arch": "win64",
      "args": "-opengl",
      "prefix": "$GAMEDIR"
    },
    "system": {
      "disable_compositor": true,
      "env": {
        "__GL_SHADER_DISK_CACHE_PATH": "$GAMEDIR/GLcacheShaders/",
        "__GL_SHADER_DISK_CACHE": "1",
        "mesa_glthread": "true",
        "__GL_THREADED_OPTIMIZATIONS": "1",
        "DXVK_STATE_CACHE": "1",
        "DXVK_STATE_CACHE_PATH": "$GAMEDIR/StateCache/"
      }
    },
    "wine": {
      "esync": true,
      "dxvk": true
    },
    "installer": [
      {
        "extract": {
          "file": "dx10",
          "dst": "$CACHE/directx-2010"
        }
      },
      {
        "task": {
          "arch": "win64",
          "description": "Creating the Wine prefix (64bits).",
          "prefix": "$GAMEDIR",
          "name": "create_prefix"
        }
      },
      {
        "task": {
          "app": "vcrun2008",
          "arch": "win64",
          "description": "Installing libraries.",
          "prefix": "$GAMEDIR",
          "name": "winetricks"
        }
      },
      {
        "task": {
          "app": "arial mdx d3dcompiler_43 d3dx9_43",
          "arch": "win64",
          "description": "Adding the software necessary.",
          "prefix": "$GAMEDIR",
          "name": "winetricks"
        }
      },
      {
        "task": {
          "app": "dotnet35sp1",
          "arch": "win64",
          "description": "Installing .NET Framework. (3.5)",
          "prefix": "$GAMEDIR",
          "name": "winetricks"
        }
      },
      {
        "task": {
          "app": "dotnet20sp1",
          "arch": "win64",
          "description": "Installing .NET Framework. (2.0)",
          "prefix": "$GAMEDIR",
          "name": "winetricks"
        }
      },
      {
        "task": {
          "app": "win7",
          "arch": "win64",
          "description": "Changing Windows version to (Win7).",
          "prefix": "$GAMEDIR",
          "name": "winetricks"
        }
      },
      {
        "task": {
          "arch": "win64",
          "prefix": "$GAMEDIR",
          "name": "winekill"
        }
      },
      {
        "task": {
          "executable": "$CACHE/directx-2010/DXSETUP.exe",
          "arch": "win64",
          "description": "(Microsoft`s software) Installing directx-2010.",
          "prefix": "$GAMEDIR",
          "name": "wineexec"
        }
      },
      {
        "task": {
          "executable": "epicstore",
          "arch": "win64",
          "description": "Running the Epic Games`s Installer.",
          "prefix": "$GAMEDIR",
          "name": "wineexec",
          "exclude_processes": "EpicGamesLauncher.exe"
        }
      },
      {
        "task": {
          "arch": "win64",
          "prefix": "$GAMEDIR",
          "name": "winekill"
        }
      }
    ],
    "files": [
      {
        "epicstore": "https://launcher-public-service-prod06.ol.epicgames.com/launcher/api/installer/download/EpicGamesLauncherInstaller.msi"
      },
      {
        "dx10": "https://lutris.net/files/tools/directx-2010.tar.gz"
      }
    ]
  },
  "content": "files:\n- epicstore: https://launcher-public-service-prod06.ol.epicgames.com/launcher/api/installer/download/EpicGamesLauncherInstaller.msi\n- dx10: https://lutris.net/files/tools/directx-2010.tar.gz\ngame:\n  arch: win64\n  args: -opengl\n  exe: drive_c/Program Files (x86)/Epic Games/Launcher/Portal/Binaries/Win32/EpicGamesLauncher.exe\n  prefix: $GAMEDIR\ninstaller:\n- extract:\n    dst: $CACHE/directx-2010\n    file: dx10\n- task:\n    arch: win64\n    description: Creating the Wine prefix (64bits).\n    name: create_prefix\n    prefix: $GAMEDIR\n- task:\n    app: vcrun2008\n    arch: win64\n    description: Installing libraries.\n    name: winetricks\n    prefix: $GAMEDIR\n- task:\n    app: arial mdx d3dcompiler_43 d3dx9_43\n    arch: win64\n    description: Adding the software necessary.\n    name: winetricks\n    prefix: $GAMEDIR\n- task:\n    app: dotnet35sp1\n    arch: win64\n    description: Installing .NET Framework. (3.5)\n    name: winetricks\n    prefix: $GAMEDIR\n- task:\n    app: dotnet20sp1\n    arch: win64\n    description: Installing .NET Framework. (2.0)\n    name: winetricks\n    prefix: $GAMEDIR\n- task:\n    app: win7\n    arch: win64\n    description: Changing Windows version to (Win7).\n    name: winetricks\n    prefix: $GAMEDIR\n- task:\n    arch: win64\n    name: winekill\n    prefix: $GAMEDIR\n- task:\n    arch: win64\n    description: (Microsoft`s software) Installing directx-2010.\n    executable: $CACHE/directx-2010/DXSETUP.exe\n    name: wineexec\n    prefix: $GAMEDIR\n- task:\n    arch: win64\n    description: Running the Epic Games`s Installer.\n    exclude_processes: EpicGamesLauncher.exe\n    executable: epicstore\n    name: wineexec\n    prefix: $GAMEDIR\n- task:\n    arch: win64\n    name: winekill\n    prefix: $GAMEDIR\nsystem:\n  disable_compositor: true\n  env:\n    DXVK_STATE_CACHE: '1'\n    DXVK_STATE_CACHE_PATH: $GAMEDIR/StateCache/\n    __GL_SHADER_DISK_CACHE: '1'\n    __GL_SHADER_DISK_CACHE_PATH: $GAMEDIR/GLcacheShaders/\n    __GL_THREADED_OPTIMIZATIONS: '1'\n    mesa_glthread: 'true'\nwine:\n  dxvk: true\n  esync: true\n"
}