{
  "id": 17256,
  "game_id": 6133,
  "game_slug": "collapse",
  "name": "Collapse",
  "year": null,
  "user": "soredake",
  "runner": "winesteam",
  "slug": "collapse-steamdxvk",
  "version": "Steam/DXVK",
  "description": null,
  "notes": "",
  "created_at": "2019-12-10T10:31:04.420000Z",
  "updated_at": "2020-01-25T23:09:17.222746Z",
  "draft": false,
  "published": true,
  "published_by": 20548,
  "rating": "",
  "steamid": 289620,
  "gogid": null,
  "gogslug": "",
  "humblestoreid": "",
  "script": {
    "game": {
      "appid": 289620,
      "arch": "win32",
      "prefix": "$GAMEDIR/prefix"
    },
    "installer": [
      {
        "task": {
          "arch": "win32",
          "description": "Creating Wine prefix",
          "prefix": "$GAMEDIR/prefix",
          "name": "create_prefix"
        }
      },
      {
        "task": {
          "arch": "win32",
          "description": "Setting version to 98 for collapse.exe...",
          "prefix": "$GAMEDIR/prefix",
          "name": "set_regedit",
          "path": "HKEY_CURRENT_USER\\Software\\Wine\\AppDefaults\\collapse.exe",
          "value": "win98",
          "key": "Version"
        }
      },
      {
        "task": {
          "app": "d3dcompiler_43 d3dcompiler_47 d3dx9 wmp10",
          "arch": "win32",
          "prefix": "$GAMEDIR/prefix",
          "name": "winetricks"
        }
      }
    ],
    "winesteam": {
      "esync": true,
      "dxvk": true
    }
  },
  "content": "game:\r\n  appid: 289620\r\n  arch: win32\r\n  prefix: $GAMEDIR/prefix\r\ninstaller:\r\n- task:\r\n    arch: win32\r\n    description: Creating Wine prefix\r\n    name: create_prefix\r\n    prefix: $GAMEDIR/prefix\r\n- task:\r\n    arch: win32\r\n    description: Setting version to 98 for collapse.exe...\r\n    key: Version\r\n    name: set_regedit\r\n    path: HKEY_CURRENT_USER\\Software\\Wine\\AppDefaults\\collapse.exe\r\n    prefix: $GAMEDIR/prefix\r\n    value: win98\r\n- task:\r\n    app: d3dcompiler_43 d3dcompiler_47 d3dx9 wmp10\r\n    arch: win32\r\n    name: winetricks\r\n    prefix: $GAMEDIR/prefix\r\nwinesteam:\r\n  dxvk: true\r\n  esync: true"
}