{
  "id": 7140,
  "game_id": 15858,
  "game_slug": "club-penguin-island",
  "name": "Club Penguin Island",
  "year": 2017,
  "user": "QuillzToxic",
  "runner": "wine",
  "slug": "club-penguin-island-19",
  "version": "1.9",
  "description": "Only Lightly Tested",
  "notes": "It will appear the Club Penguin Island installer is doing nothing at some point, if you drag the installer away underneath you will find another installer.\r\n\r\nSeems to show up dim when full screen on an AMD GPU, 1440p Screen on Ubuntu 16.04",
  "created_at": "2018-01-19T20:41:28.650000Z",
  "updated_at": "2018-03-23T14:44:50.280165Z",
  "draft": false,
  "published": true,
  "published_by": null,
  "rating": "",
  "steamid": null,
  "gogid": null,
  "gogslug": "",
  "humblestoreid": "",
  "script": {
    "game": {
      "arch": "win64",
      "prefix": "$GAMEDIR",
      "exe": "drive_c/Program Files (x86)/Club Penguin Island/ClubPenguinIslandLauncher.exe"
    },
    "wine": {
      "version": "staging-2.21-x86_64"
    },
    "files": [
      {
        "file1": "https://1263cf72.content.disney.io/1518121153/installers/windows32/Club_Penguin_Island_Launcher-1.0.1.exe"
      }
    ],
    "installer": [
      {
        "task": {
          "arch": "win64",
          "prefix": "$GAMEDIR",
          "description": "Creating Wine Prefix",
          "name": "create_prefix"
        }
      },
      {
        "task": {
          "arch": "win64",
          "prefix": "$GAMEDIR",
          "description": "Setting Wine to Windows 7",
          "name": "winetricks",
          "app": "win7"
        }
      },
      {
        "task": {
          "prefix": "$GAMEDIR",
          "executable": "file1",
          "description": "Installing Club Penguin Island. Do tick \"Launch Game\" after installation!",
          "name": "wineexec"
        }
      }
    ]
  },
  "content": "files:\n- file1: https://1263cf72.content.disney.io/1518121153/installers/windows32/Club_Penguin_Island_Launcher-1.0.1.exe\ngame:\n  arch: win64\n  exe: drive_c/Program Files (x86)/Club Penguin Island/ClubPenguinIslandLauncher.exe\n  prefix: $GAMEDIR\ninstaller:\n- task:\n    arch: win64\n    description: Creating Wine Prefix\n    name: create_prefix\n    prefix: $GAMEDIR\n- task:\n    app: win7\n    arch: win64\n    description: Setting Wine to Windows 7\n    name: winetricks\n    prefix: $GAMEDIR\n- task:\n    description: Installing Club Penguin Island. Do tick \"Launch Game\" after installation!\n    executable: file1\n    name: wineexec\n    prefix: $GAMEDIR\nwine:\n  version: staging-2.21-x86_64\n"
}