{
  "id": 9820,
  "game_id": 1402,
  "game_slug": "aion",
  "name": "Aion",
  "year": 2009,
  "user": "aakos",
  "runner": "wine",
  "slug": "aion-aion-eu",
  "version": "Aion EU",
  "description": null,
  "notes": "",
  "created_at": "2018-08-20T12:41:32.313000Z",
  "updated_at": "2020-01-23T02:56:54.129849Z",
  "draft": false,
  "published": true,
  "published_by": 19464,
  "rating": "",
  "steamid": 29640,
  "gogid": null,
  "gogslug": "",
  "humblestoreid": "",
  "script": {
    "files": [
      {
        "aion": "http://dl.aion.gameforge.com/aion/client/20180104/20180103_AION_Setup.exe"
      },
      {
        "dx2010": "https://lutris.net/files/tools/directx-2010.tar.gz"
      }
    ],
    "game": {
      "prefix": "$GAMEDIR",
      "exe": "drive_c/Program Files/Gameforge/NCLauncher/NCLauncher.exe",
      "arch": "win32",
      "args": "/LauncherID:\"GameForge\" /CompanyID:\"11\" /GameID:\"AION-LIVE\" /LUpdateAddr:\"update.aion.gfsrv.net\""
    },
    "wine": {
      "UseGLSL": "disabled",
      "esync": true
    },
    "system": {
      "env": {
        "PBA_ENABLE": 1
      }
    },
    "installer": [
      {
        "extract": {
          "file": "dx2010",
          "dst": "$CACHE/dxsetup"
        }
      },
      {
        "task": {
          "prefix": "$GAMEDIR",
          "arch": "win32",
          "name": "create_prefix"
        }
      },
      {
        "task": {
          "prefix": "$GAMEDIR",
          "arch": "win32",
          "executable": "$CACHE/dxsetup/DXSETUP.exe",
          "name": "wineexec",
          "args": "/silent"
        }
      },
      {
        "task": {
          "prefix": "$GAMEDIR",
          "arch": "win32",
          "name": "winekill"
        }
      },
      {
        "task": {
          "prefix": "$GAMEDIR",
          "arch": "win32",
          "app": "vcrun2008 vcrun2013 physx corefonts",
          "name": "winetricks"
        }
      },
      {
        "task": {
          "prefix": "$GAMEDIR",
          "arch": "win32",
          "app": "dotnet472 win7",
          "description": "Installing .NET 4.7.2",
          "name": "winetricks"
        }
      },
      {
        "task": {
          "prefix": "$GAMEDIR",
          "arch": "win32",
          "executable": "aion",
          "name": "wineexec"
        }
      }
    ]
  },
  "content": "files:\n- aion: http://dl.aion.gameforge.com/aion/client/20180104/20180103_AION_Setup.exe\n- dx2010: https://lutris.net/files/tools/directx-2010.tar.gz\ngame:\n  arch: win32\n  args: /LauncherID:\"GameForge\" /CompanyID:\"11\" /GameID:\"AION-LIVE\" /LUpdateAddr:\"update.aion.gfsrv.net\"\n  exe: drive_c/Program Files/Gameforge/NCLauncher/NCLauncher.exe\n  prefix: $GAMEDIR\ninstaller:\n- extract:\n    dst: $CACHE/dxsetup\n    file: dx2010\n- task:\n    arch: win32\n    name: create_prefix\n    prefix: $GAMEDIR\n- task:\n    arch: win32\n    args: /silent\n    executable: $CACHE/dxsetup/DXSETUP.exe\n    name: wineexec\n    prefix: $GAMEDIR\n- task:\n    arch: win32\n    name: winekill\n    prefix: $GAMEDIR\n- task:\n    app: vcrun2008 vcrun2013 physx corefonts\n    arch: win32\n    name: winetricks\n    prefix: $GAMEDIR\n- task:\n    app: dotnet472 win7\n    arch: win32\n    description: Installing .NET 4.7.2\n    name: winetricks\n    prefix: $GAMEDIR\n- task:\n    arch: win32\n    executable: aion\n    name: wineexec\n    prefix: $GAMEDIR\nsystem:\n  env:\n    PBA_ENABLE: 1\nwine:\n  UseGLSL: disabled\n  esync: true\n"
}