{
  "id": 5624,
  "game_id": 13855,
  "game_slug": "my-little-pony-the-cursed-gem",
  "name": "My Little Pony: The Cursed Gem",
  "year": 2014,
  "user": "maxlefou",
  "runner": "wine",
  "slug": "my-little-pony-the-cursed-gem-1x",
  "version": "1.x",
  "description": "Windows installer of the game required",
  "notes": "",
  "created_at": "2017-09-08T08:23:47.169000Z",
  "updated_at": "2019-04-10T05:08:47.829299Z",
  "draft": false,
  "published": true,
  "published_by": 19464,
  "rating": "",
  "steamid": null,
  "gogid": null,
  "gogslug": "",
  "humblestoreid": "",
  "script": {
    "game": {
      "prefix": "$GAMEDIR",
      "arch": "win32"
    },
    "exe": "drive_c/Program Files/MLP The Cursed Gem/Game.exe",
    "files": [
      {
        "installfile": "N/A:Select the Windows installer of the game (mlpcgsetup.exe)"
      }
    ],
    "installer": [
      {
        "task": {
          "prefix": "$GAMEDIR",
          "arch": "win32",
          "name": "create_prefix"
        }
      },
      {
        "task": {
          "prefix": "$GAMEDIR",
          "app": "d3dx9",
          "name": "winetricks"
        }
      },
      {
        "task": {
          "prefix": "$GAMEDIR",
          "app": "d3dx9_35",
          "name": "winetricks"
        }
      },
      {
        "task": {
          "prefix": "$GAMEDIR",
          "app": "d3dx9_36",
          "name": "winetricks"
        }
      },
      {
        "task": {
          "prefix": "$GAMEDIR",
          "app": "d3dx9_42",
          "name": "winetricks"
        }
      },
      {
        "task": {
          "prefix": "$GAMEDIR",
          "app": "d3dx9_43",
          "name": "winetricks"
        }
      },
      {
        "task": {
          "prefix": "$GAMEDIR",
          "app": "d3dx10",
          "name": "winetricks"
        }
      },
      {
        "task": {
          "prefix": "$GAMEDIR",
          "app": "d3dx11",
          "name": "winetricks"
        }
      },
      {
        "task": {
          "prefix": "$GAMEDIR",
          "app": "devenum",
          "name": "winetricks"
        }
      },
      {
        "task": {
          "prefix": "$GAMEDIR",
          "app": "dinput",
          "name": "winetricks"
        }
      },
      {
        "task": {
          "prefix": "$GAMEDIR",
          "app": "dinput8",
          "name": "winetricks"
        }
      },
      {
        "task": {
          "prefix": "$GAMEDIR",
          "app": "directmusic",
          "name": "winetricks"
        }
      },
      {
        "task": {
          "prefix": "$GAMEDIR",
          "app": "directplay",
          "name": "winetricks"
        }
      },
      {
        "task": {
          "prefix": "$GAMEDIR",
          "app": "directx9",
          "name": "winetricks"
        }
      },
      {
        "task": {
          "prefix": "$GAMEDIR",
          "app": "dsound",
          "name": "winetricks"
        }
      },
      {
        "task": {
          "prefix": "$GAMEDIR",
          "app": "dxdiag",
          "name": "winetricks"
        }
      },
      {
        "task": {
          "prefix": "$GAMEDIR",
          "app": "quartz",
          "name": "winetricks"
        }
      },
      {
        "task": {
          "prefix": "$GAMEDIR",
          "app": "dotnet20",
          "name": "winetricks"
        }
      },
      {
        "task": {
          "prefix": "$GAMEDIR",
          "app": "gdiplus",
          "name": "winetricks"
        }
      },
      {
        "task": {
          "description": "Installing game. Leave everything by default and click 'next, next, next finish'...",
          "prefix": "$GAMEDIR",
          "executable": "$installfile",
          "name": "wineexec"
        }
      }
    ]
  },
  "content": "exe: drive_c/Program Files/MLP The Cursed Gem/Game.exe\nfiles:\n- installfile: N/A:Select the Windows installer of the game (mlpcgsetup.exe)\ngame:\n  arch: win32\n  prefix: $GAMEDIR\ninstaller:\n- task:\n    arch: win32\n    name: create_prefix\n    prefix: $GAMEDIR\n- task:\n    app: d3dx9\n    name: winetricks\n    prefix: $GAMEDIR\n- task:\n    app: d3dx9_35\n    name: winetricks\n    prefix: $GAMEDIR\n- task:\n    app: d3dx9_36\n    name: winetricks\n    prefix: $GAMEDIR\n- task:\n    app: d3dx9_42\n    name: winetricks\n    prefix: $GAMEDIR\n- task:\n    app: d3dx9_43\n    name: winetricks\n    prefix: $GAMEDIR\n- task:\n    app: d3dx10\n    name: winetricks\n    prefix: $GAMEDIR\n- task:\n    app: d3dx11\n    name: winetricks\n    prefix: $GAMEDIR\n- task:\n    app: devenum\n    name: winetricks\n    prefix: $GAMEDIR\n- task:\n    app: dinput\n    name: winetricks\n    prefix: $GAMEDIR\n- task:\n    app: dinput8\n    name: winetricks\n    prefix: $GAMEDIR\n- task:\n    app: directmusic\n    name: winetricks\n    prefix: $GAMEDIR\n- task:\n    app: directplay\n    name: winetricks\n    prefix: $GAMEDIR\n- task:\n    app: directx9\n    name: winetricks\n    prefix: $GAMEDIR\n- task:\n    app: dsound\n    name: winetricks\n    prefix: $GAMEDIR\n- task:\n    app: dxdiag\n    name: winetricks\n    prefix: $GAMEDIR\n- task:\n    app: quartz\n    name: winetricks\n    prefix: $GAMEDIR\n- task:\n    app: dotnet20\n    name: winetricks\n    prefix: $GAMEDIR\n- task:\n    app: gdiplus\n    name: winetricks\n    prefix: $GAMEDIR\n- task:\n    description: Installing game. Leave everything by default and click 'next, next,\n      next finish'...\n    executable: $installfile\n    name: wineexec\n    prefix: $GAMEDIR\n"
}