{
  "id": 6833,
  "game_id": 15263,
  "game_slug": "contra-2028",
  "name": "Contra 2028",
  "year": null,
  "user": "cxf",
  "runner": "wine",
  "slug": "contra-2028-demo-w-dxvk",
  "version": "Demo w/ DXVK",
  "description": null,
  "notes": "Please download Contra from itch.io before proceeding:\r\n\r\n<a href=\"https://contragon.itch.io/contra-2028\">https://contragon.itch.io/contra-2028</a>",
  "created_at": "2017-12-24T00:28:15.306000Z",
  "updated_at": "2019-02-14T05:31:31.472021Z",
  "draft": false,
  "published": true,
  "published_by": 19464,
  "rating": "",
  "steamid": null,
  "gogid": null,
  "gogslug": "",
  "humblestoreid": "",
  "script": {
    "system": {
      "env": {
        "DXVK_HUD": 0
      }
    },
    "game": {
      "arch": "win64",
      "prefix": "$GAMEDIR",
      "exe": "drive_c/Program Files (x86)/Contra 2028/ContraReboot.exe"
    },
    "wine": {
      "overrides": {
        "xaudio2_7": "native,builtin"
      },
      "dxvk": true,
      "version": "tkg-4.0-x86_64"
    },
    "files": [
      {
        "contra": "N/A:Please select the itch.io archive"
      }
    ],
    "installer": [
      {
        "task": {
          "arch": "win64",
          "prefix": "$GAMEDIR",
          "name": "create_prefix"
        }
      },
      {
        "task": {
          "prefix": "$GAMEDIR",
          "name": "winetricks",
          "app": "xact"
        }
      },
      {
        "extract": {
          "dst": "$GAMEDIR/drive_c/Program Files (x86)/Contra 2028",
          "file": "contra"
        }
      },
      {
        "task": {
          "prefix": "$GAMEDIR",
          "value": "Y",
          "arch": "win64",
          "path": "HKEY_CURRENT_USER\\Software\\Wine",
          "key": "HideWineExports",
          "name": "set_regedit"
        }
      }
    ]
  },
  "content": "files:\n- contra: N/A:Please select the itch.io archive\ngame:\n  arch: win64\n  exe: drive_c/Program Files (x86)/Contra 2028/ContraReboot.exe\n  prefix: $GAMEDIR\ninstaller:\n- task:\n    arch: win64\n    name: create_prefix\n    prefix: $GAMEDIR\n- task:\n    app: xact\n    name: winetricks\n    prefix: $GAMEDIR\n- extract:\n    dst: $GAMEDIR/drive_c/Program Files (x86)/Contra 2028\n    file: contra\n- task:\n    arch: win64\n    key: HideWineExports\n    name: set_regedit\n    path: HKEY_CURRENT_USER\\Software\\Wine\n    prefix: $GAMEDIR\n    value: Y\nsystem:\n  env:\n    DXVK_HUD: 0\nwine:\n  dxvk: true\n  overrides:\n    xaudio2_7: native,builtin\n  version: tkg-4.0-x86_64\n"
}