{
  "id": 18699,
  "game_id": 8323,
  "game_slug": "chromium-bsu",
  "name": "Chromium B.S.U.",
  "year": 2000,
  "user": "vanstaveren",
  "runner": "wine",
  "slug": "chromium-bsu-9132-vulkan",
  "version": "9.13.2-vulkan",
  "description": null,
  "notes": "",
  "created_at": "2020-03-05T11:18:13.805000Z",
  "updated_at": "2020-03-20T10:45:56.858421Z",
  "draft": false,
  "published": true,
  "published_by": 20548,
  "rating": "",
  "steamid": null,
  "gogid": null,
  "gogslug": "",
  "humblestoreid": "",
  "script": {
    "files": [
      {
        "chromium.exe": "https://sourceforge.net/projects/chromium-bsu/files/Chromium B.S.U. Win32 binary/chromium-0.9.13.2.exe"
      }
    ],
    "installer": [
      {
        "task": {
          "arch": "win64",
          "description": "Creating 64-bit prefix ...",
          "prefix": "$GAMEDIR/prefix",
          "name": "create_prefix"
        }
      },
      {
        "move": {
          "src": "chromium.exe",
          "dst": "$GAMEDIR/prefix/drive_c/"
        }
      },
      {
        "chmodx": "$GAMEDIR/prefix/drive_c/chromium-0.9.13.2.exe"
      },
      {
        "task": {
          "executable": "$GAMEDIR/prefix/drive_c/chromium-0.9.13.2.exe",
          "description": "Chromium B.S.U. ...",
          "prefix": "$GAMEDIR/prefix",
          "name": "wineexec"
        }
      },
      {
        "task": {
          "arch": "win64",
          "description": "DirectX 11 ...",
          "app": "d3dcompiler_43",
          "prefix": "$GAMEDIR/prefix",
          "name": "winetricks"
        }
      },
      {
        "task": {
          "arch": "win64",
          "description": "DirectX 11 ...",
          "app": "d3dx11_43",
          "prefix": "$GAMEDIR/prefix",
          "name": "winetricks"
        }
      },
      {
        "task": {
          "arch": "win64",
          "description": "Vulkan ...",
          "app": "dxvk",
          "prefix": "$GAMEDIR/prefix",
          "name": "winetricks"
        }
      },
      {
        "task": {
          "arch": "win64",
          "description": "Windows version 8 ...",
          "app": "win8",
          "prefix": "$GAMEDIR/prefix",
          "name": "winetricks"
        }
      }
    ],
    "system": {
      "xboxdrv": "xboxdrv",
      "pulse_latency": true,
      "disable_compositor": true
    },
    "wine": {
      "Audio": "pulse",
      "dxvk": true,
      "esync": true
    },
    "game": {
      "arch": "win64",
      "custom-name": "Chromium B.S.U.",
      "prefix": "$GAMEDIR/prefix",
      "exe": "$GAMEDIR/prefix/drive_c/Program Files (x86)/chromium/bin/chromium.exe"
    }
  },
  "content": "files:\r\n- chromium.exe: https://sourceforge.net/projects/chromium-bsu/files/Chromium B.S.U.\r\n    Win32 binary/chromium-0.9.13.2.exe\r\ngame:\r\n  arch: win64\r\n  custom-name: Chromium B.S.U.\r\n  exe: $GAMEDIR/prefix/drive_c/Program Files (x86)/chromium/bin/chromium.exe\r\n  prefix: $GAMEDIR/prefix\r\ninstaller:\r\n- task:\r\n    arch: win64\r\n    description: Creating 64-bit prefix ...\r\n    name: create_prefix\r\n    prefix: $GAMEDIR/prefix\r\n- move:\r\n    dst: $GAMEDIR/prefix/drive_c/\r\n    src: chromium.exe\r\n- chmodx: $GAMEDIR/prefix/drive_c/chromium-0.9.13.2.exe\r\n- task:\r\n    description: Chromium B.S.U. ...\r\n    executable: $GAMEDIR/prefix/drive_c/chromium-0.9.13.2.exe\r\n    name: wineexec\r\n    prefix: $GAMEDIR/prefix\r\n- task:\r\n    app: d3dcompiler_43\r\n    arch: win64\r\n    description: DirectX 11 ...\r\n    name: winetricks\r\n    prefix: $GAMEDIR/prefix\r\n- task:\r\n    app: d3dx11_43\r\n    arch: win64\r\n    description: DirectX 11 ...\r\n    name: winetricks\r\n    prefix: $GAMEDIR/prefix\r\n- task:\r\n    app: dxvk\r\n    arch: win64\r\n    description: Vulkan ...\r\n    name: winetricks\r\n    prefix: $GAMEDIR/prefix\r\n- task:\r\n    app: win8\r\n    arch: win64\r\n    description: Windows version 8 ...\r\n    name: winetricks\r\n    prefix: $GAMEDIR/prefix\r\nsystem:\r\n  disable_compositor: true\r\n  pulse_latency: true\r\n  xboxdrv: xboxdrv\r\nwine:\r\n  Audio: pulse\r\n  dxvk: true\r\n  esync: true"
}