{
  "id": 4547,
  "game_id": 2919,
  "game_slug": "starcraft",
  "name": "StarCraft",
  "year": 1998,
  "user": "RobLoach",
  "runner": "wine",
  "slug": "starcraft-battlenet",
  "version": "Battle.net",
  "description": "Close Battle.net after launch for better performance.",
  "notes": "",
  "created_at": "2017-06-23T16:23:19.531000Z",
  "updated_at": "2020-01-23T02:56:54.772973Z",
  "draft": false,
  "published": true,
  "published_by": 51687,
  "rating": "",
  "steamid": null,
  "gogid": null,
  "gogslug": "",
  "humblestoreid": "",
  "script": {
    "game": {
      "exe": "$GAMEDIR/drive_c/Program Files/Battle.net/Battle.net.exe",
      "arch": "win32",
      "prefix": "$GAMEDIR"
    },
    "installer": [
      {
        "task": {
          "arch": "win32",
          "description": "Creating 32bit Wine prefix.",
          "prefix": "$GAMEDIR",
          "name": "create_prefix"
        }
      },
      {
        "task": {
          "app": "arial",
          "arch": "win32",
          "description": "Installing Arial font",
          "prefix": "$GAMEDIR",
          "name": "winetricks",
          "silent": true
        }
      },
      {
        "write_json": {
          "file": "$GAMEDIR/drive_c/users/$USER/Application Data/Battle.net/Battle.net.config",
          "data": {
            "Client": {
              "GameSearch": {
                "BackgroundSearch": "true"
              },
              "HardwareAcceleration": "false",
              "Streaming": {
                "StreamingEnabled": "false"
              },
              "Sound": {
                "Enabled": "false"
              },
              "GameLaunchWindowBehavior": "2"
            }
          },
          "description": "Writing a Battle.Net config file"
        }
      },
      {
        "task": {
          "prefix": "$GAMEDIR",
          "name": "winekill"
        }
      },
      {
        "task": {
          "executable": "setup",
          "exclude_processes": "Battle.net.exe Agent.exe \"Battle.net Helper.exe\"",
          "arch": "win32",
          "description": "Installing Blizzard App (an installer will open)\n------------------------------\nLet Lutris installer finish first. Log in afterwards.",
          "name": "wineexec"
        }
      },
      {
        "task": {
          "prefix": "$GAMEDIR",
          "name": "winekill"
        }
      }
    ],
    "files": [
      {
        "setup": {
          "filename": "Battle.net-Setup.exe",
          "url": "https://battle.net/download/getInstallerForGame?os=WIN&version=LIVE&gameProgram=STARCRAFT"
        }
      }
    ]
  },
  "content": "files:\n- setup:\n    filename: Battle.net-Setup.exe\n    url: https://battle.net/download/getInstallerForGame?os=WIN&version=LIVE&gameProgram=STARCRAFT\ngame:\n  arch: win32\n  exe: $GAMEDIR/drive_c/Program Files/Battle.net/Battle.net.exe\n  prefix: $GAMEDIR\ninstaller:\n- task:\n    arch: win32\n    description: Creating 32bit Wine prefix.\n    name: create_prefix\n    prefix: $GAMEDIR\n- task:\n    app: arial\n    arch: win32\n    description: Installing Arial font\n    name: winetricks\n    prefix: $GAMEDIR\n    silent: true\n- write_json:\n    data:\n      Client:\n        GameLaunchWindowBehavior: '2'\n        GameSearch:\n          BackgroundSearch: 'true'\n        HardwareAcceleration: 'false'\n        Sound:\n          Enabled: 'false'\n        Streaming:\n          StreamingEnabled: 'false'\n    description: Writing a Battle.Net config file\n    file: $GAMEDIR/drive_c/users/$USER/Application Data/Battle.net/Battle.net.config\n- task:\n    name: winekill\n    prefix: $GAMEDIR\n- task:\n    arch: win32\n    description: 'Installing Blizzard App (an installer will open)\n\n      ------------------------------\n\n      Let Lutris installer finish first. Log in afterwards.'\n    exclude_processes: Battle.net.exe Agent.exe \"Battle.net Helper.exe\"\n    executable: setup\n    name: wineexec\n- task:\n    name: winekill\n    prefix: $GAMEDIR\n"
}