{
  "id": 14636,
  "game_id": 28513,
  "game_slug": "combat-wings",
  "name": "Combat Wings",
  "year": 2005,
  "user": "VortexAcherontic",
  "runner": "wine",
  "slug": "combat-wings-retail",
  "version": "Retail",
  "description": null,
  "notes": "",
  "created_at": "2019-07-20T09:26:24.996000Z",
  "updated_at": "2019-09-09T00:08:11.143156Z",
  "draft": false,
  "published": true,
  "published_by": 1,
  "rating": "",
  "steamid": null,
  "gogid": null,
  "gogslug": "",
  "humblestoreid": "",
  "script": {
    "wine": {
      "version": "4.3-x86_64",
      "Desktop": true
    },
    "game": {
      "arch": "win32",
      "prefix": "$GAMEDIR",
      "exe": "$GAMEDIR/drive_c/Program Files/City Interactive/Combat Wings/game.exe"
    },
    "installer": [
      {
        "task": {
          "arch": "win32",
          "prefix": "$GAMEDIR",
          "description": "Creating Wine Bottle, please wait...",
          "name": "create_prefix"
        }
      },
      {
        "insert-disc": {
          "requires": "setup.exe",
          "description": "Insert disc"
        }
      },
      {
        "task": {
          "prefix": "$GAMEDIR",
          "executable": "$DISC/setup.exe",
          "name": "wineexec"
        }
      },
      {
        "task": {
          "arch": "win32",
          "prefix": "$GAMEDIR",
          "description": "Installing Arial Font",
          "name": "winetricks",
          "app": "arial"
        }
      },
      {
        "task": {
          "arch": "win32",
          "prefix": "$GAMEDIR",
          "description": "Installing Windows Media Player for codec reasons",
          "name": "winetricks",
          "app": "wmp9"
        }
      }
    ]
  },
  "content": "game:\n  arch: win32\n  exe: $GAMEDIR/drive_c/Program Files/City Interactive/Combat Wings/game.exe\n  prefix: $GAMEDIR\ninstaller:\n- task:\n    arch: win32\n    description: Creating Wine Bottle, please wait...\n    name: create_prefix\n    prefix: $GAMEDIR\n- insert-disc:\n    description: Insert disc\n    requires: setup.exe\n- task:\n    executable: $DISC/setup.exe\n    name: wineexec\n    prefix: $GAMEDIR\n- task:\n    app: arial\n    arch: win32\n    description: Installing Arial Font\n    name: winetricks\n    prefix: $GAMEDIR\n- task:\n    app: wmp9\n    arch: win32\n    description: Installing Windows Media Player for codec reasons\n    name: winetricks\n    prefix: $GAMEDIR\nwine:\n  Desktop: true\n  version: 4.3-x86_64\n"
}