{
  "id": 20471,
  "game_id": 4168,
  "game_slug": "grand-theft-auto-v",
  "name": "Grand Theft Auto V",
  "year": 2013,
  "user": "szczagi",
  "runner": "wine",
  "slug": "grand-theft-auto-v-epic-games-store",
  "version": "Epic Games store",
  "description": "Everything should work fine",
  "notes": "On first launch, resolution in Grand Theft Auto may be a bit borked. Switch game to borderless windowed mode in settings to workaround that.",
  "created_at": "2020-05-14T19:04:43.282379Z",
  "updated_at": "2020-05-14T19:04:43.282402Z",
  "draft": false,
  "published": false,
  "published_by": null,
  "rating": "",
  "steamid": 271590,
  "gogid": null,
  "gogslug": "",
  "humbleid": "",
  "humblestoreid": "",
  "humblestoreid_real": "grand-theft-auto-v",
  "script": {
    "files": [
      {
        "epic": "https://launcher-public-service-prod06.ol.epicgames.com/launcher/api/installer/download/EpicGamesLauncherInstaller.msi"
      },
      {
        "audio": "https://lutris.net/files/tools/directx-2010.tar.gz"
      }
    ],
    "game": {
      "arch": "win64",
      "args": "-SkipBuildPatchPrereq -opengl",
      "exe": "drive_c/Program Files (x86)/Epic Games/Launcher/Portal/Binaries/Win32/EpicGamesLauncher.exe",
      "prefix": "$GAMEDIR"
    },
    "installer": [
      {
        "extract": {
          "dst": "$CACHE/dxsetup",
          "file": "audio"
        }
      },
      {
        "task": {
          "arch": "win64",
          "name": "create_prefix",
          "prefix": "$GAMEDIR"
        }
      },
      {
        "task": {
          "arch": "win64",
          "args": "/silent",
          "executable": "$CACHE/dxsetup/DXSETUP.exe",
          "name": "wineexec",
          "prefix": "$GAMEDIR"
        }
      },
      {
        "task": {
          "arch": "win64",
          "name": "winekill",
          "prefix": "$GAMEDIR"
        }
      },
      {
        "task": {
          "app": "arial",
          "arch": "win64",
          "name": "winetricks",
          "prefix": "$GAMEDIR"
        }
      },
      {
        "task": {
          "app": "faudio",
          "arch": "win64",
          "name": "winetricks",
          "prefix": "$GAMEDIR"
        }
      },
      {
        "task": {
          "arch": "win64",
          "name": "winekill",
          "prefix": "$GAMEDIR"
        }
      },
      {
        "task": {
          "arch": "win64",
          "args": "/q",
          "exclude_processes": "EpicGamesLauncher.exe",
          "executable": "epic",
          "name": "wineexec",
          "prefix": "$GAMEDIR"
        }
      },
      {
        "task": {
          "arch": "win64",
          "name": "winekill",
          "prefix": "$GAMEDIR"
        }
      }
    ],
    "system": {
      "env": {
        "DXVK_HUD": "compiler",
        "__GL_SHADER_DISK_CACHE": 1,
        "__GL_SHADER_DISK_CACHE_PATH": "$GAMEDIR"
      }
    },
    "wine": {
      "dxvk": true,
      "esync": true,
      "overrides": {
        "winedbg.exe": "d"
      }
    }
  },
  "content": "files:\n- epic: https://launcher-public-service-prod06.ol.epicgames.com/launcher/api/installer/download/EpicGamesLauncherInstaller.msi\n- audio: https://lutris.net/files/tools/directx-2010.tar.gz\ngame:\n  arch: win64\n  args: -SkipBuildPatchPrereq -opengl\n  exe: drive_c/Program Files (x86)/Epic Games/Launcher/Portal/Binaries/Win32/EpicGamesLauncher.exe\n  prefix: $GAMEDIR\ninstaller:\n- extract:\n    dst: $CACHE/dxsetup\n    file: audio\n- task:\n    arch: win64\n    name: create_prefix\n    prefix: $GAMEDIR\n- task:\n    arch: win64\n    args: /silent\n    executable: $CACHE/dxsetup/DXSETUP.exe\n    name: wineexec\n    prefix: $GAMEDIR\n- task:\n    arch: win64\n    name: winekill\n    prefix: $GAMEDIR\n- task:\n    app: arial\n    arch: win64\n    name: winetricks\n    prefix: $GAMEDIR\n- task:\n    app: faudio\n    arch: win64\n    name: winetricks\n    prefix: $GAMEDIR\n- task:\n    arch: win64\n    name: winekill\n    prefix: $GAMEDIR\n- task:\n    arch: win64\n    args: /q\n    exclude_processes: EpicGamesLauncher.exe\n    executable: epic\n    name: wineexec\n    prefix: $GAMEDIR\n- task:\n    arch: win64\n    name: winekill\n    prefix: $GAMEDIR\nsystem:\n  env:\n    DXVK_HUD: compiler\n    __GL_SHADER_DISK_CACHE: 1\n    __GL_SHADER_DISK_CACHE_PATH: $GAMEDIR\nwine:\n  dxvk: true\n  esync: true\n  overrides:\n    winedbg.exe: d\n"
}