{
  "id": 14815,
  "game_id": 4168,
  "game_slug": "grand-theft-auto-v",
  "name": "Grand Theft Auto V",
  "year": 2013,
  "user": "remysartxxx456",
  "runner": "wine",
  "slug": "grand-theft-auto-v-change-me",
  "version": "Change Me",
  "description": "Rockstar Social Club version <a href=\"https://socialclub.rockstargames.com/activate\">https://socialclub.rockstargames.com/activate</a>",
  "notes": "If the download doesn't work after the installation change the executable (right-click -> configure -> Game options) to \r\nGAMEDIR/drive_c/Program Files/Rockstar Games/Grand Theft Auto V/PlayGTAV.exe (and click on retry if you get an error at the first try).\r\nWhen the download is complete change it back to \r\nGAMEDIR/drive_c/Program Files/Rockstar Games/Grand Theft Auto V/GTAVLauncher.exe\r\n\r\nIf what happens <a href=\"https://www.youtube.com/watch?v=1vYpCmX72yo\">in this video</a> is happening to you try deleting any <b>.part</b> files that you find in your GTAV directory and relaunch.\r\n\r\nIf you receive <b>\"Failed: zlib call\"</b> verify your game files.",
  "created_at": "2019-08-01T14:49:20.159203Z",
  "updated_at": "2019-08-01T14:49:20.159231Z",
  "draft": false,
  "published": false,
  "published_by": 19464,
  "rating": "",
  "steamid": 271590,
  "gogid": null,
  "gogslug": "",
  "humblestoreid": "",
  "script": {
    "game": {
      "exe": "drive_c/Program Files/Rockstar Games/Grand Theft Auto V/PlayGTAV.exe",
      "arch": "win64",
      "prefix": "$GAMEDIR",
      "args": "-noChunkedDownload -DX11"
    },
    "files": [
      {
        "setup": {
          "filename": "GTAV_Setup_tool.exe",
          "url": "N/A:Select the installer for the game. You can download it from here https://socialclub.rockstargames.com/activate"
        }
      }
    ],
    "system": {
      "env": {
        "DXVK_HUD": 0,
        "__GL_SHADER_DISK_CACHE": 1,
        "__GL_SHADER_DISK_CACHE_PATH": "$GAMEDIR",
        "DXVK_STATE_CACHE_PATH": "$GAMEDIR"
      }
    },
    "installer": [
      {
        "task": {
          "description": "Creating win64 prefix",
          "prefix": "$GAMEDIR",
          "arch": "win64",
          "name": "create_prefix"
        }
      },
      {
        "task": {
          "description": "Installing corefonts",
          "arch": "win64",
          "prefix": "$GAMEDIR",
          "name": "winetricks",
          "app": "arial"
        }
      },
      {
        "task": {
          "description": "Changing windows version to Win7",
          "arch": "win64",
          "prefix": "$GAMEDIR",
          "name": "winetricks",
          "app": "win7"
        }
      },
      {
        "task": {
          "description": "Installing faudio",
          "arch": "win64",
          "prefix": "$GAMEDIR",
          "name": "winetricks",
          "app": "faudio"
        }
      },
      {
        "task": {
          "description": "Installing the game. You might get an error at the end of the installation, just close the installer window and don't click on retry",
          "prefix": "$GAMEDIR",
          "executable": "setup",
          "arch": "win64",
          "name": "wineexec"
        }
      }
    ],
    "wine": {
      "esync": true,
      "overrides": {
        "winedbg.exe": "disabled"
      },
      "dxvk": true,
      "version": "tkg-protonified-4.6-x86_64"
    }
  },
  "content": "files:\n- setup:\n    filename: GTAV_Setup_tool.exe\n    url: N/A:Select the installer for the game. You can download it from here https://socialclub.rockstargames.com/activate\ngame:\n  arch: win64\n  args: -noChunkedDownload -DX11\n  exe: drive_c/Program Files/Rockstar Games/Grand Theft Auto V/PlayGTAV.exe\n  prefix: $GAMEDIR\ninstaller:\n- task:\n    arch: win64\n    description: Creating win64 prefix\n    name: create_prefix\n    prefix: $GAMEDIR\n- task:\n    app: arial\n    arch: win64\n    description: Installing corefonts\n    name: winetricks\n    prefix: $GAMEDIR\n- task:\n    app: win7\n    arch: win64\n    description: Changing windows version to Win7\n    name: winetricks\n    prefix: $GAMEDIR\n- task:\n    app: faudio\n    arch: win64\n    description: Installing faudio\n    name: winetricks\n    prefix: $GAMEDIR\n- task:\n    arch: win64\n    description: Installing the game. You might get an error at the end of the installation,\n      just close the installer window and don't click on retry\n    executable: setup\n    name: wineexec\n    prefix: $GAMEDIR\nsystem:\n  env:\n    DXVK_HUD: 0\n    DXVK_STATE_CACHE_PATH: $GAMEDIR\n    __GL_SHADER_DISK_CACHE: 1\n    __GL_SHADER_DISK_CACHE_PATH: $GAMEDIR\nwine:\n  dxvk: true\n  esync: true\n  overrides:\n    winedbg.exe: disabled\n  version: tkg-protonified-4.6-x86_64\n"
}