{
  "id": 15786,
  "game_id": 22169,
  "game_slug": "pro-pilkki-2",
  "name": "Pro Pilkki 2",
  "year": 2013,
  "user": "ramram",
  "runner": "wine",
  "slug": "pro-pilkki-2-change-me",
  "version": "Change Me",
  "description": null,
  "notes": "",
  "created_at": "2019-09-25T10:40:06.274408Z",
  "updated_at": "2019-09-25T10:40:06.274449Z",
  "draft": false,
  "published": false,
  "published_by": 19464,
  "rating": "",
  "steamid": null,
  "gogid": null,
  "gogslug": "",
  "humblestoreid": "",
  "script": {
    "system": {
      "env": {
        "DXVK_HUD": 0
      }
    },
    "game": {
      "arch": "win64",
      "prefix": "$GAMEDIR",
      "exe": "drive_c/Program Files (x86)/ProPilkki2/ProPilkki2.exe"
    },
    "wine": {
      "overrides": {
        "mscoree,mshtml": "disabled"
      },
      "dxvk": true,
      "version": "tkg-4.0-x86_64"
    },
    "files": [
      {
        "pilkki_installer": {
          "url": "http://propilkki.ddns.net/propilkki2/download/PP2_download.php?id=0",
          "filename": "P2Installer_v1.3.exe"
        }
      }
    ],
    "installer": [
      {
        "task": {
          "arch": "win64",
          "prefix": "$GAMEDIR",
          "description": "Creating Wine Prefix...",
          "name": "create_prefix"
        }
      },
      {
        "task": {
          "prefix": "$GAMEDIR",
          "description": "Setting Windows 7 mode for Wine",
          "value": "win7",
          "arch": "win64",
          "path": "HKEY_CURRENT_USER\\Software\\Wine",
          "key": "Version",
          "name": "set_regedit"
        }
      },
      {
        "task": {
          "prefix": "$GAMEDIR",
          "executable": "pilkki_installer",
          "description": "Installing Pro Pilkki 2...",
          "name": "wineexec",
          "exclude_processes": "ProPilkki2.exe"
        }
      },
      {
        "task": {
          "prefix": "$GAMEDIR",
          "name": "winekill"
        }
      }
    ]
  },
  "content": "files:\n- pilkki_installer:\n    filename: P2Installer_v1.3.exe\n    url: http://propilkki.ddns.net/propilkki2/download/PP2_download.php?id=0\ngame:\n  arch: win64\n  exe: drive_c/Program Files (x86)/ProPilkki2/ProPilkki2.exe\n  prefix: $GAMEDIR\ninstaller:\n- task:\n    arch: win64\n    description: Creating Wine Prefix...\n    name: create_prefix\n    prefix: $GAMEDIR\n- task:\n    arch: win64\n    description: Setting Windows 7 mode for Wine\n    key: Version\n    name: set_regedit\n    path: HKEY_CURRENT_USER\\Software\\Wine\n    prefix: $GAMEDIR\n    value: win7\n- task:\n    description: Installing Pro Pilkki 2...\n    exclude_processes: ProPilkki2.exe\n    executable: pilkki_installer\n    name: wineexec\n    prefix: $GAMEDIR\n- task:\n    name: winekill\n    prefix: $GAMEDIR\nsystem:\n  env:\n    DXVK_HUD: 0\nwine:\n  dxvk: true\n  overrides:\n    mscoree,mshtml: disabled\n  version: tkg-4.0-x86_64\n"
}