{
  "id": 10506,
  "game_id": 22169,
  "game_slug": "pro-pilkki-2",
  "name": "Pro Pilkki 2",
  "year": 2013,
  "user": "ramram",
  "runner": "wine",
  "slug": "pro-pilkki-2-142",
  "version": "1.4.2",
  "description": "Does not use Vulkan.",
  "notes": "",
  "created_at": "2018-10-14T22:44:36.559000Z",
  "updated_at": "2020-01-23T02:56:52.239773Z",
  "draft": false,
  "published": true,
  "published_by": 19464,
  "rating": "",
  "steamid": null,
  "gogid": null,
  "gogslug": "",
  "humblestoreid": "",
  "script": {
    "files": [
      {
        "pilkki_installer": {
          "filename": "P2Installer_v1.4.2.exe",
          "url": "http://propilkki.ddns.net/propilkki2/download/PP2_download.php?id=0"
        }
      }
    ],
    "game": {
      "prefix": "$GAMEDIR",
      "exe": "drive_c/Program Files (x86)/ProPilkki2/ProPilkki2.exe",
      "arch": "win64"
    },
    "wine": {
      "overrides": {
        "mscoree,mshtml": "disabled"
      }
    },
    "installer": [
      {
        "task": {
          "prefix": "$GAMEDIR",
          "arch": "win64",
          "name": "create_prefix",
          "description": "Creating Wine Prefix..."
        }
      },
      {
        "task": {
          "prefix": "$GAMEDIR",
          "exclude_processes": "ProPilkki2.exe",
          "executable": "pilkki_installer",
          "name": "wineexec",
          "description": "Installing Pro Pilkki 2..."
        }
      },
      {
        "task": {
          "prefix": "$GAMEDIR",
          "name": "winekill"
        }
      }
    ]
  },
  "content": "files:\n- pilkki_installer:\n    filename: P2Installer_v1.4.2.exe\n    url: http://propilkki.ddns.net/propilkki2/download/PP2_download.php?id=0\ngame:\n  arch: win64\n  exe: drive_c/Program Files (x86)/ProPilkki2/ProPilkki2.exe\n  prefix: $GAMEDIR\ninstaller:\n- task:\n    arch: win64\n    description: Creating Wine Prefix...\n    name: create_prefix\n    prefix: $GAMEDIR\n- task:\n    description: Installing Pro Pilkki 2...\n    exclude_processes: ProPilkki2.exe\n    executable: pilkki_installer\n    name: wineexec\n    prefix: $GAMEDIR\n- task:\n    name: winekill\n    prefix: $GAMEDIR\nwine:\n  overrides:\n    mscoree,mshtml: disabled\n"
}