{
  "id": 13524,
  "game_id": 441,
  "game_slug": "plants-vs-zombies-game-of-the-year",
  "name": "Plants vs. Zombies: Game of the Year Edition",
  "year": 2009,
  "user": "dragonandy",
  "runner": "wine",
  "slug": "plants-vs-zombies-game-of-the-origin",
  "version": "Origin",
  "description": "You have to install Plant vs. Zombies game in origin game library manually, the script only setup the enviroment for you to download and install the game. It only have minimum configuration, so no promise to run any game other than PvZ from origin store.",
  "notes": "nocrashdialog d3dcompiler_43 d3dx9 in winetricks\r\nbasicly a rip-off from the-sims-4-origin-d9vk script without d9vk stuff",
  "created_at": "2019-05-14T13:51:51.893000Z",
  "updated_at": "2020-01-23T02:57:18.091233Z",
  "draft": false,
  "published": true,
  "published_by": 19464,
  "rating": "",
  "steamid": 3590,
  "gogid": null,
  "gogslug": "",
  "humblestoreid": "",
  "script": {
    "files": [
      {
        "updater": "https://raw.githubusercontent.com/DrDoctor13/wine-origin-updater/master/updateorigin.sh"
      },
      {
        "origin": "https://origin-a.akamaihd.net/Origin-Client-Download/origin/live/OriginThinSetup.exe"
      }
    ],
    "game": {
      "prefix": "$GAMEDIR",
      "arch": "win64",
      "exe": "drive_c/Program Files (x86)/Origin/Origin.exe"
    },
    "installer": [
      {
        "task": {
          "description": "Creating Wine Prefix...",
          "name": "create_prefix",
          "arch": "win64",
          "prefix": "$GAMEDIR"
        }
      },
      {
        "task": {
          "prefix": "$GAMEDIR",
          "name": "winetricks",
          "arch": "win64",
          "app": "nocrashdialog d3dcompiler_43 d3dx9"
        }
      },
      {
        "task": {
          "description": "Installing Origin... Login window will pop-up and close.",
          "name": "wineexec",
          "arch": "win64",
          "executable": "origin",
          "args": "/silent",
          "prefix": "$GAMEDIR",
          "exclude_processes": "Origin.exe OriginClientService.exe OriginWebHelperService.exe QtWebEngineProcess.exe"
        }
      },
      {
        "task": {
          "prefix": "$GAMEDIR",
          "name": "winekill"
        }
      },
      {
        "task": {
          "description": "Spoofing AMD RX 550...",
          "path": "HKEY_CURRENT_USER\\Software\\Wine\\Direct3D",
          "key": "VideoPciVendorID",
          "prefix": "$GAMEDIR",
          "name": "set_regedit",
          "arch": "win64",
          "type": "REG_DWORD",
          "value": 1002
        }
      },
      {
        "task": {
          "description": "Spoofing AMD RX 550...",
          "path": "HKEY_CURRENT_USER\\Software\\Wine\\Direct3D",
          "key": "VideoPciDeviceID",
          "prefix": "$GAMEDIR",
          "name": "set_regedit",
          "arch": "win64",
          "type": "REG_DWORD",
          "value": "699f"
        }
      },
      {
        "task": {
          "prefix": "$GAMEDIR",
          "name": "winekill"
        }
      },
      {
        "chmodx": "updater"
      },
      {
        "merge": {
          "dst": "$GAMEDIR/drive_c/Program Files (x86)/Origin",
          "src": "updater"
        }
      }
    ]
  },
  "content": "files:\n- updater: https://raw.githubusercontent.com/DrDoctor13/wine-origin-updater/master/updateorigin.sh\n- origin: https://origin-a.akamaihd.net/Origin-Client-Download/origin/live/OriginThinSetup.exe\ngame:\n  arch: win64\n  exe: drive_c/Program Files (x86)/Origin/Origin.exe\n  prefix: $GAMEDIR\ninstaller:\n- task:\n    arch: win64\n    description: Creating Wine Prefix...\n    name: create_prefix\n    prefix: $GAMEDIR\n- task:\n    app: nocrashdialog d3dcompiler_43 d3dx9\n    arch: win64\n    name: winetricks\n    prefix: $GAMEDIR\n- task:\n    arch: win64\n    args: /silent\n    description: Installing Origin... Login window will pop-up and close.\n    exclude_processes: Origin.exe OriginClientService.exe OriginWebHelperService.exe\n      QtWebEngineProcess.exe\n    executable: origin\n    name: wineexec\n    prefix: $GAMEDIR\n- task:\n    name: winekill\n    prefix: $GAMEDIR\n- task:\n    arch: win64\n    description: Spoofing AMD RX 550...\n    key: VideoPciVendorID\n    name: set_regedit\n    path: HKEY_CURRENT_USER\\Software\\Wine\\Direct3D\n    prefix: $GAMEDIR\n    type: REG_DWORD\n    value: 1002\n- task:\n    arch: win64\n    description: Spoofing AMD RX 550...\n    key: VideoPciDeviceID\n    name: set_regedit\n    path: HKEY_CURRENT_USER\\Software\\Wine\\Direct3D\n    prefix: $GAMEDIR\n    type: REG_DWORD\n    value: 699f\n- task:\n    name: winekill\n    prefix: $GAMEDIR\n- chmodx: updater\n- merge:\n    dst: $GAMEDIR/drive_c/Program Files (x86)/Origin\n    src: updater\n"
}