{
  "id": 17818,
  "game_id": 3465,
  "game_slug": "the-secret-of-monkey-island",
  "name": "The Secret of Monkey Island",
  "year": 1990,
  "user": "legluondunet",
  "runner": "scummvm",
  "slug": "the-secret-of-monkey-island-enhanced-cd-scummvm",
  "version": "enhanced  CD + ScummVM",
  "description": "This script will install \"The Secret of Monkey Island\" enhanced  CD edition for ScummVM.\r\nBig thanks to people who gave their time to permit us playing this game in the best conditions.",
  "notes": "- This script installer is only compatible with enhanced CD version from 1992.\r\n- Please report issue concerning this script on my Github page:\r\nhttps://github.com/legluondunet/MyLittleLutrisScripts/",
  "created_at": "2020-01-08T21:02:17.238000Z",
  "updated_at": "2020-01-09T05:35:44.242656Z",
  "draft": false,
  "published": true,
  "published_by": 494,
  "rating": "",
  "steamid": null,
  "gogid": null,
  "gogslug": "",
  "humbleid": "",
  "humblestoreid": "",
  "humblestoreid_real": "",
  "script": {
    "custom-name": "The Secret of Monkey Island - enhanced  CD - ScummVM",
    "files": [
      {
        "rip": "https://github.com/legluondunet/mlls-tools/raw/master/audiotools/audiotools.tar.xz"
      },
      {
        "script": "https://github.com/legluondunet/mlls-tools/raw/master/scripts/audiotracks2flac.sh"
      }
    ],
    "game": {
      "game_id": "monkey",
      "path": "$GAMEDIR",
      "subtitles": true
    },
    "installer": [
      {
        "insert-disc": {
          "description": "Please insert The Secret of Monkey Island disc",
          "requires": "english/monkey.exe"
        }
      },
      {
        "input_menu": {
          "description": "Choose the game's language:",
          "id": "LANG",
          "options": [
            {
              "english": "English"
            },
            {
              "french": "French"
            },
            {
              "german": "German"
            },
            {
              "italian": "Italian"
            },
            {
              "spanish": "Spanish"
            }
          ],
          "preselect": "english"
        }
      },
      {
        "merge": {
          "dst": "$GAMEDIR/",
          "src": "$DISC/$INPUT_LANG"
        }
      },
      {
        "extract": {
          "dst": "$GAMEDIR",
          "src": "rip"
        }
      },
      {
        "chmodx": "script"
      },
      {
        "move": {
          "dst": "$GAMEDIR",
          "src": "script"
        }
      },
      {
        "execute": {
          "args": "1992-",
          "file": "script"
        }
      }
    ],
    "scummvm": {
      "fullscreen": true
    }
  },
  "content": "custom-name: The Secret of Monkey Island - enhanced  CD - ScummVM\nfiles:\n- rip: https://github.com/legluondunet/mlls-tools/raw/master/audiotools/audiotools.tar.xz\n- script: https://github.com/legluondunet/mlls-tools/raw/master/scripts/audiotracks2flac.sh\ngame:\n  game_id: monkey\n  path: $GAMEDIR\n  subtitles: true\ninstaller:\n- insert-disc:\n    description: Please insert The Secret of Monkey Island disc\n    requires: english/monkey.exe\n- input_menu:\n    description: 'Choose the game''s language:'\n    id: LANG\n    options:\n    - english: English\n    - french: French\n    - german: German\n    - italian: Italian\n    - spanish: Spanish\n    preselect: english\n- merge:\n    dst: $GAMEDIR/\n    src: $DISC/$INPUT_LANG\n- extract:\n    dst: $GAMEDIR\n    src: rip\n- chmodx: script\n- move:\n    dst: $GAMEDIR\n    src: script\n- execute:\n    args: 1992-\n    file: script\nscummvm:\n  fullscreen: true\n"
}