{
  "id": 9961,
  "game_id": 16472,
  "game_slug": "crysis-3",
  "name": "Crysis 3",
  "year": 2013,
  "user": "bocadillodeatun",
  "runner": "wine",
  "slug": "crysis-3-origin-w-dxvk",
  "version": "Origin w/ DXVK",
  "description": "Only sets up Origin and DXVK you'll need to download Crysis 3 manually.",
  "notes": "Please read before installing: <a href=\"https://github.com/lutris/lutris/wiki/Game:-Origin\">https://github.com/lutris/lutris/wiki/Game:-Origin</a>\r\n\r\n1. Inside the game menus, go to settings and select \"full screen\" (also change any other option you might want).\r\n\r\n2. Try to play the game. If the mouse movement is not restricted (ie. you can rotate the view 360 deg) you are good to go (skip the rest of steps). Otherwise keep reading.\r\n\r\n3. Exit the game and Lutris.\r\n\r\n4. In the Lutris menus, right click on \"Crysis 3\" and select \"Configure --> Runner options --> Mouse Warp Override = Force\"\r\n\r\n5. Run the game. This time you will need to use the KEYBOARD to navigate the menus, but once inside the game, everything will work as expected (this is a wine issue, explained here in case you are curious: https://bugs.winehq.org/show_bug.cgi?id=43918 )\r\n\r\n---\r\nYou may encounter some stuttering when first running game but after a few minutes the DXVK cache builds and the stuttering disappears.",
  "created_at": "2018-08-29T18:11:20.725000Z",
  "updated_at": "2020-01-23T02:56:50.567643Z",
  "draft": false,
  "published": true,
  "published_by": 19464,
  "rating": "1",
  "steamid": 1282690,
  "gogid": null,
  "gogslug": "",
  "humbleid": "",
  "humblestoreid": "",
  "humblestoreid_real": "",
  "script": {
    "files": [
      {
        "client": "https://origin-a.akamaihd.net/Origin-Client-Download/origin/live/OriginThinSetup.exe"
      },
      {
        "updater": "https://raw.githubusercontent.com/DrDoctor13/wine-origin-updater/master/updateorigin.sh"
      }
    ],
    "game": {
      "arch": "win64",
      "exe": "drive_c/Program Files (x86)/Origin/Origin.exe",
      "prefix": "$GAMEDIR"
    },
    "installer": [
      {
        "task": {
          "arch": "win64",
          "description": "Creating Wine prefix",
          "name": "create_prefix",
          "prefix": "$GAMEDIR"
        }
      },
      {
        "task": {
          "app": "nocrashdialog win7",
          "arch": "win64",
          "name": "winetricks",
          "prefix": "$GAMEDIR"
        }
      },
      {
        "task": {
          "arch": "win64",
          "args": "/silent",
          "description": "Installing Origin... Login window will pop-up and close.",
          "exclude_processes": "Origin.exe OriginClientService.exe OriginWebHelperService.exe QtWebEngineProcess.exe",
          "executable": "client",
          "name": "wineexec",
          "prefix": "$GAMEDIR"
        }
      },
      {
        "task": {
          "arch": "win64",
          "name": "winekill",
          "prefix": "$GAMEDIR"
        }
      },
      {
        "chmodx": "updater"
      },
      {
        "merge": {
          "dst": "$GAMEDIR/drive_c/Program Files (x86)/Origin",
          "src": "updater"
        }
      }
    ],
    "system": {
      "disable_runtime": false,
      "env": {
        "DXVK_HUD": 0,
        "__GL_SHADER_DISK_CACHE": 1,
        "__GL_SHADER_DISK_CACHE_PATH": "$GAMEDIR"
      }
    },
    "wine": {
      "dxvk": true,
      "overrides": {
        "nvapi,nvapi64": "disabled",
        "xaudio2_7": "native,builtin"
      }
    }
  },
  "content": "files:\n- client: https://origin-a.akamaihd.net/Origin-Client-Download/origin/live/OriginThinSetup.exe\n- updater: https://raw.githubusercontent.com/DrDoctor13/wine-origin-updater/master/updateorigin.sh\ngame:\n  arch: win64\n  exe: drive_c/Program Files (x86)/Origin/Origin.exe\n  prefix: $GAMEDIR\ninstaller:\n- task:\n    arch: win64\n    description: Creating Wine prefix\n    name: create_prefix\n    prefix: $GAMEDIR\n- task:\n    app: nocrashdialog win7\n    arch: win64\n    name: winetricks\n    prefix: $GAMEDIR\n- task:\n    arch: win64\n    args: /silent\n    description: Installing Origin... Login window will pop-up and close.\n    exclude_processes: Origin.exe OriginClientService.exe OriginWebHelperService.exe\n      QtWebEngineProcess.exe\n    executable: client\n    name: wineexec\n    prefix: $GAMEDIR\n- task:\n    arch: win64\n    name: winekill\n    prefix: $GAMEDIR\n- chmodx: updater\n- merge:\n    dst: $GAMEDIR/drive_c/Program Files (x86)/Origin\n    src: updater\nsystem:\n  disable_runtime: false\n  env:\n    DXVK_HUD: 0\n    __GL_SHADER_DISK_CACHE: 1\n    __GL_SHADER_DISK_CACHE_PATH: $GAMEDIR\nwine:\n  dxvk: true\n  overrides:\n    nvapi,nvapi64: disabled\n    xaudio2_7: native,builtin\n"
}