{
  "id": 7699,
  "game_id": 17308,
  "game_slug": "warhammer-vermintide-2",
  "name": "Warhammer: Vermintide 2",
  "year": 2018,
  "user": "crusty",
  "runner": "winesteam",
  "slug": "warhammer-vermintide-2-steamdxvk",
  "version": "Steam/DXVK",
  "description": null,
  "notes": "Only singleplayer works.",
  "created_at": "2018-03-30T09:29:22.168000Z",
  "updated_at": "2020-01-31T02:38:27.702346Z",
  "draft": false,
  "published": true,
  "published_by": 19464,
  "rating": "2",
  "steamid": 552500,
  "gogid": null,
  "gogslug": "",
  "humblestoreid": "",
  "script": {
    "game": {
      "appid": 552500,
      "prefix": "$GAMEDIR/prefix",
      "arch": "win64"
    },
    "winesteam": {
      "dxvk": true,
      "overrides": {
        "xaudio2_7": "native,builtin"
      }
    },
    "installer": [
      {
        "task": {
          "description": "Creating Wine Prefix",
          "name": "create_prefix",
          "arch": "win64",
          "prefix": "$GAMEDIR/prefix"
        }
      },
      {
        "task": {
          "description": "Installing Internet Explorer 8",
          "name": "winetricks",
          "arch": "win64",
          "app": "ie8",
          "prefix": "$GAMEDIR/prefix"
        }
      },
      {
        "task": {
          "description": "Installing Visual C++ 2012",
          "name": "winetricks",
          "arch": "win64",
          "app": "vcrun2012",
          "prefix": "$GAMEDIR/prefix"
        }
      },
      {
        "task": {
          "description": "Installing Visual C++ 2015",
          "name": "winetricks",
          "arch": "win64",
          "app": "vcrun2015",
          "prefix": "$GAMEDIR/prefix"
        }
      },
      {
        "task": {
          "description": "Installing Dot.NET 4.7.2",
          "name": "winetricks",
          "arch": "win64",
          "app": "dotnet472",
          "prefix": "$GAMEDIR/prefix"
        }
      },
      {
        "task": {
          "description": "Switching to Windows 7",
          "name": "winetricks",
          "arch": "win64",
          "app": "win7",
          "prefix": "$GAMEDIR/prefix"
        }
      }
    ],
    "system": {
      "env": {
        "DXVK_HUD": 0
      }
    }
  },
  "content": "game:\n  appid: 552500\n  arch: win64\n  prefix: $GAMEDIR/prefix\ninstaller:\n- task:\n    arch: win64\n    description: Creating Wine Prefix\n    name: create_prefix\n    prefix: $GAMEDIR/prefix\n- task:\n    app: ie8\n    arch: win64\n    description: Installing Internet Explorer 8\n    name: winetricks\n    prefix: $GAMEDIR/prefix\n- task:\n    app: vcrun2012\n    arch: win64\n    description: Installing Visual C++ 2012\n    name: winetricks\n    prefix: $GAMEDIR/prefix\n- task:\n    app: vcrun2015\n    arch: win64\n    description: Installing Visual C++ 2015\n    name: winetricks\n    prefix: $GAMEDIR/prefix\n- task:\n    app: dotnet472\n    arch: win64\n    description: Installing Dot.NET 4.7.2\n    name: winetricks\n    prefix: $GAMEDIR/prefix\n- task:\n    app: win7\n    arch: win64\n    description: Switching to Windows 7\n    name: winetricks\n    prefix: $GAMEDIR/prefix\nsystem:\n  env:\n    DXVK_HUD: 0\nwinesteam:\n  dxvk: true\n  overrides:\n    xaudio2_7: native,builtin\n"
}