{
  "id": 19771,
  "game_id": 10095,
  "game_slug": "homeworld",
  "name": "Homeworld",
  "year": 1999,
  "user": "PugOfStardoc",
  "runner": "wine",
  "slug": "homeworld-retail-cd",
  "version": "Retail CD",
  "description": null,
  "notes": "",
  "created_at": "2020-04-17T09:45:16.520000Z",
  "updated_at": "2020-04-18T07:19:57.705298Z",
  "draft": false,
  "published": true,
  "published_by": 20548,
  "rating": "",
  "steamid": null,
  "gogid": null,
  "gogslug": "",
  "humblestoreid": "",
  "script": {
    "game": {
      "prefix": "$GAMEDIR",
      "exe": "drive_c/Sierra/Homeworld/homeworld.exe",
      "arch": "win32"
    },
    "installer": [
      {
        "insert-disc": {
          "requires": "HWSetup.EXE"
        }
      },
      {
        "task": {
          "prefix": "$GAMEDIR",
          "executable": "$DISC/HWSetup.EXE",
          "name": "wineexec"
        }
      },
      {
        "task": {
          "arch": "win32",
          "name": "set_regedit",
          "key": "screenDepth",
          "prefix": "$GAMEDIR",
          "value": "00000020",
          "path": "HKEY_LOCAL_MACHINE\\Software\\Sierra On-Line\\Homeworld",
          "type": "REG_DWORD"
        }
      },
      {
        "task": {
          "arch": "win32",
          "name": "set_regedit",
          "key": "screenWidth",
          "prefix": "$GAMEDIR",
          "value": "00000500",
          "path": "HKEY_LOCAL_MACHINE\\Software\\Sierra On-Line\\Homeworld",
          "type": "REG_DWORD"
        }
      },
      {
        "task": {
          "arch": "win32",
          "name": "set_regedit",
          "key": "screenHeight",
          "prefix": "$GAMEDIR",
          "value": "00000400",
          "path": "HKEY_LOCAL_MACHINE\\Software\\Sierra On-Line\\Homeworld",
          "type": "REG_DWORD"
        }
      },
      {
        "task": {
          "arch": "win32",
          "name": "set_regedit",
          "key": "deviceToSelect",
          "prefix": "$GAMEDIR",
          "value": "d3d",
          "path": "HKEY_LOCAL_MACHINE\\Software\\Sierra On-Line\\Homeworld",
          "type": "REG_SZ"
        }
      },
      {
        "task": {
          "prefix": "$GAMEDIR",
          "arch": "win32",
          "executable": "regedit",
          "name": "wineexec",
          "description": "The game has been set to its highest supported resolution, 1280x1024. If you wish to use an unsupported resolution, please navigate to HKEY_LOCAL_MACHINE\\Software\\Sierra On-Line\\Homeworld and set screenHeight and screenWidth to height and width of the desired resolution (switch from hexadecimal to decimal before entering the values). Either way, exit regedit afterwards."
        }
      }
    ]
  },
  "content": "game:\n  arch: win32\n  exe: drive_c/Sierra/Homeworld/homeworld.exe\n  prefix: $GAMEDIR\ninstaller:\n- insert-disc:\n    requires: HWSetup.EXE\n- task:\n    executable: $DISC/HWSetup.EXE\n    name: wineexec\n    prefix: $GAMEDIR\n- task:\n    arch: win32\n    key: screenDepth\n    name: set_regedit\n    path: HKEY_LOCAL_MACHINE\\Software\\Sierra On-Line\\Homeworld\n    prefix: $GAMEDIR\n    type: REG_DWORD\n    value: '00000020'\n- task:\n    arch: win32\n    key: screenWidth\n    name: set_regedit\n    path: HKEY_LOCAL_MACHINE\\Software\\Sierra On-Line\\Homeworld\n    prefix: $GAMEDIR\n    type: REG_DWORD\n    value: '00000500'\n- task:\n    arch: win32\n    key: screenHeight\n    name: set_regedit\n    path: HKEY_LOCAL_MACHINE\\Software\\Sierra On-Line\\Homeworld\n    prefix: $GAMEDIR\n    type: REG_DWORD\n    value: '00000400'\n- task:\n    arch: win32\n    key: deviceToSelect\n    name: set_regedit\n    path: HKEY_LOCAL_MACHINE\\Software\\Sierra On-Line\\Homeworld\n    prefix: $GAMEDIR\n    type: REG_SZ\n    value: d3d\n- task:\n    arch: win32\n    description: The game has been set to its highest supported resolution, 1280x1024.\n      If you wish to use an unsupported resolution, please navigate to HKEY_LOCAL_MACHINE\\Software\\Sierra\n      On-Line\\Homeworld and set screenHeight and screenWidth to height and width of\n      the desired resolution (switch from hexadecimal to decimal before entering the\n      values). Either way, exit regedit afterwards.\n    executable: regedit\n    name: wineexec\n    prefix: $GAMEDIR\n"
}