{
  "id": 14867,
  "game_id": 28695,
  "game_slug": "rayman",
  "name": "Rayman",
  "year": 1995,
  "user": "legluondunet",
  "runner": "dosbox",
  "slug": "rayman-cd-dos",
  "version": "CD DOS",
  "description": "This script will install \"Rayman\" DOS CD edition for Dosbox.\r\nDuring install please let all options by default.\r\nBig thanks to people who gave their time to permit us playing this game in the best conditions.",
  "notes": "- Please report issue concerning this script on my github page:\r\nhttps://github.com/legluondunet/MyLittleLutrisScripts/",
  "created_at": "2019-08-04T20:57:33.374379Z",
  "updated_at": "2019-08-04T20:57:33.374408Z",
  "draft": true,
  "published": false,
  "published_by": null,
  "rating": "",
  "steamid": null,
  "gogid": null,
  "gogslug": "",
  "humblestoreid": "",
  "script": {
    "game": {
      "main_file": "$GAMEDIR/rayman.conf"
    },
    "custom-name": "Rayman - CD DOS - DOSBOX",
    "installer": [
      {
        "insert-disc": {
          "description": "Please insert disc 1",
          "requires": "rayman/rayman.exe"
        }
      },
      {
        "task": {
          "commands": [
            "d:",
            "call D:\\install.bat",
            "exit"
          ],
          "drives": {
            "d": "$GAMEDIR/CD",
            "c": "$GAMEDIR"
          },
          "name": "makeconfig",
          "path": "$GAMEDIR/rayman_install.conf"
        }
      },
      {
        "task": {
          "commands": [
            "c:",
            "cd c:\\ACCLAIM\\D",
            "LAURA.EXE",
            "exit"
          ],
          "drives": {
            "d": "$GAMEDIR/CD",
            "c": "$GAMEDIR"
          },
          "name": "makeconfig",
          "path": "$GAMEDIR/D.conf"
        }
      },
      {
        "task": {
          "name": "dosexec",
          "config_file": "$GAMEDIR/D_install.conf",
          "working_dir": "$GAMEDIR"
        }
      }
    ]
  },
  "content": "custom-name: Rayman - CD DOS - DOSBOX\ngame:\n  main_file: $GAMEDIR/rayman.conf\ninstaller:\n- insert-disc:\n    description: Please insert disc 1\n    requires: rayman/rayman.exe\n- task:\n    commands:\n    - 'd:'\n    - call D:\\install.bat\n    - exit\n    drives:\n      c: $GAMEDIR\n      d: $GAMEDIR/CD\n    name: makeconfig\n    path: $GAMEDIR/rayman_install.conf\n- task:\n    commands:\n    - 'c:'\n    - cd c:\\ACCLAIM\\D\n    - LAURA.EXE\n    - exit\n    drives:\n      c: $GAMEDIR\n      d: $GAMEDIR/CD\n    name: makeconfig\n    path: $GAMEDIR/D.conf\n- task:\n    config_file: $GAMEDIR/D_install.conf\n    name: dosexec\n    working_dir: $GAMEDIR\n"
}