{
  "id": 13573,
  "game_id": 16163,
  "game_slug": "himawari-the-sunflower-",
  "name": "Himawari - The Sunflower -",
  "year": 2016,
  "user": "kimchitea",
  "runner": "wine",
  "slug": "himawari-the-sunflower-mangagamer",
  "version": "MangaGamer",
  "description": null,
  "notes": "Click the bottom left button on the installer.\r\nVideos may not work; press Enter to skip.",
  "created_at": "2019-05-16T23:16:51.693000Z",
  "updated_at": "2019-10-16T23:35:28.220135Z",
  "draft": false,
  "published": true,
  "published_by": 19464,
  "rating": "",
  "steamid": 554290,
  "gogid": null,
  "gogslug": "",
  "humblestoreid": "",
  "script": {
    "files": [
      {
        "file1": "N/A:Please select the MangaGamer archive 1/4."
      },
      {
        "file2": "N/A:Please select the MangaGamer archive 2/4."
      },
      {
        "file3": "N/A:Please select the MangaGamer archive 3/4."
      },
      {
        "file4": "N/A:Please select the MangaGamer archive 4/4."
      }
    ],
    "game": {
      "prefix": "$GAMEDIR",
      "exe": "$GAMEDIR/Himawari/Himawari.exe",
      "arch": "win32"
    },
    "installer": [
      {
        "extract": {
          "file": "file1",
          "dst": "$GAMEDIR"
        }
      },
      {
        "extract": {
          "file": "file2",
          "dst": "$GAMEDIR"
        }
      },
      {
        "task": {
          "prefix": "$GAMEDIR",
          "arch": "win32",
          "executable": "$GAMEDIR/Himawari.part1.exe",
          "name": "wineexec"
        }
      },
      {
        "extract": {
          "file": "file3",
          "dst": "$GAMEDIR/Himawari"
        }
      },
      {
        "extract": {
          "file": "file4",
          "dst": "$GAMEDIR/Himawari"
        }
      },
      {
        "move": {
          "src": "$GAMEDIR/Himawari.part1.exe",
          "dst": "$CACHE"
        }
      },
      {
        "move": {
          "src": "$GAMEDIR/Himawari.part2.rar",
          "dst": "$CACHE"
        }
      }
    ]
  },
  "content": "files:\n- file1: N/A:Please select the MangaGamer archive 1/4.\n- file2: N/A:Please select the MangaGamer archive 2/4.\n- file3: N/A:Please select the MangaGamer archive 3/4.\n- file4: N/A:Please select the MangaGamer archive 4/4.\ngame:\n  arch: win32\n  exe: $GAMEDIR/Himawari/Himawari.exe\n  prefix: $GAMEDIR\ninstaller:\n- extract:\n    dst: $GAMEDIR\n    file: file1\n- extract:\n    dst: $GAMEDIR\n    file: file2\n- task:\n    arch: win32\n    executable: $GAMEDIR/Himawari.part1.exe\n    name: wineexec\n    prefix: $GAMEDIR\n- extract:\n    dst: $GAMEDIR/Himawari\n    file: file3\n- extract:\n    dst: $GAMEDIR/Himawari\n    file: file4\n- move:\n    dst: $CACHE\n    src: $GAMEDIR/Himawari.part1.exe\n- move:\n    dst: $CACHE\n    src: $GAMEDIR/Himawari.part2.rar\n"
}