{
  "id": 5289,
  "game_id": 745,
  "game_slug": "resident-evil-5",
  "name": "Resident Evil 5",
  "year": 2009,
  "user": "codythedragondude",
  "runner": "winesteam",
  "slug": "resident-evil-5-steam",
  "version": "Steam",
  "description": null,
  "notes": "",
  "created_at": "2017-08-07T00:50:57.097000Z",
  "updated_at": "2019-04-24T02:23:39.437729Z",
  "draft": false,
  "published": true,
  "published_by": 19464,
  "rating": "",
  "steamid": 21690,
  "gogid": null,
  "gogslug": "",
  "humblestoreid": "",
  "script": {
    "game": {
      "prefix": "$GAMEDIR/prefix",
      "appid": 21690,
      "arch": "win32"
    },
    "files": [
      {
        "codecs": "https://lutris.net/files/tools/windowsmedia-kb942423-x86-intl.exe"
      }
    ],
    "installer": [
      {
        "task": {
          "prefix": "$GAMEDIR/prefix",
          "arch": "win32",
          "name": "create_prefix"
        }
      },
      {
        "task": {
          "description": "Changing to Windows xp",
          "arch": "win32",
          "prefix": "$GAMEDIR/prefix",
          "name": "winetricks",
          "app": "winxp"
        }
      },
      {
        "task": {
          "description": "Installing d3dx9",
          "arch": "win32",
          "prefix": "$GAMEDIR/prefix",
          "name": "winetricks",
          "app": "d3dx9"
        }
      },
      {
        "task": {
          "description": "Installing wmp10",
          "arch": "win32",
          "prefix": "$GAMEDIR/prefix",
          "name": "winetricks",
          "app": "wmp10"
        }
      },
      {
        "task": {
          "description": "Installing d3dcompiler_43",
          "arch": "win32",
          "prefix": "$GAMEDIR/prefix",
          "name": "winetricks",
          "app": "d3dcompiler_43"
        }
      },
      {
        "task": {
          "description": "Installing xact_jun2010",
          "arch": "win32",
          "prefix": "$GAMEDIR/prefix",
          "name": "winetricks",
          "app": "xact_jun2010"
        }
      },
      {
        "task": {
          "description": "Installing video codecs",
          "prefix": "$GAMEDIR/prefix",
          "executable": "codecs",
          "name": "wineexec",
          "args": "/q"
        }
      }
    ]
  },
  "content": "files:\n- codecs: https://lutris.net/files/tools/windowsmedia-kb942423-x86-intl.exe\ngame:\n  appid: 21690\n  arch: win32\n  prefix: $GAMEDIR/prefix\ninstaller:\n- task:\n    arch: win32\n    name: create_prefix\n    prefix: $GAMEDIR/prefix\n- task:\n    app: winxp\n    arch: win32\n    description: Changing to Windows xp\n    name: winetricks\n    prefix: $GAMEDIR/prefix\n- task:\n    app: d3dx9\n    arch: win32\n    description: Installing d3dx9\n    name: winetricks\n    prefix: $GAMEDIR/prefix\n- task:\n    app: wmp10\n    arch: win32\n    description: Installing wmp10\n    name: winetricks\n    prefix: $GAMEDIR/prefix\n- task:\n    app: d3dcompiler_43\n    arch: win32\n    description: Installing d3dcompiler_43\n    name: winetricks\n    prefix: $GAMEDIR/prefix\n- task:\n    app: xact_jun2010\n    arch: win32\n    description: Installing xact_jun2010\n    name: winetricks\n    prefix: $GAMEDIR/prefix\n- task:\n    args: /q\n    description: Installing video codecs\n    executable: codecs\n    name: wineexec\n    prefix: $GAMEDIR/prefix\n"
}