{
  "id": 8538,
  "game_id": 1397,
  "game_slug": "eve-online",
  "name": "EVE Online",
  "year": 2003,
  "user": "e7a05979dd5994e4572ab90daa17c762",
  "runner": "wine",
  "slug": "eve-online-lutris-4121-with-dxv",
  "version": "lutris-4.12.1 with DXVK + ESYNC",
  "description": "- Sets DXVK and ESYNC\r\n- Installs the EveLauncher-version 1548102",
  "notes": "",
  "created_at": "2018-06-04T18:18:44.218000Z",
  "updated_at": "2020-01-23T02:57:16.307909Z",
  "draft": false,
  "published": true,
  "published_by": 1,
  "rating": "",
  "steamid": 8500,
  "gogid": null,
  "gogslug": "",
  "humblestoreid": "",
  "script": {
    "game": {
      "exe": "$GAMEDIR/drive_c/EVE/eve.exe",
      "prefix": "$GAMEDIR"
    },
    "wine": {
      "esync": true,
      "dxvk": true
    },
    "installer": [
      {
        "task": {
          "arch": "win64",
          "description": "Creating 64bit Wine prefix.",
          "prefix": "$GAMEDIR",
          "name": "create_prefix"
        }
      },
      {
        "task": {
          "arch": "win64",
          "description": "Setting Windows 10 mode for Wine",
          "prefix": "$GAMEDIR",
          "name": "set_regedit",
          "path": "HKEY_CURRENT_USER\\Software\\Wine",
          "value": "win10",
          "key": "Version"
        }
      },
      {
        "task": {
          "app": "arial",
          "prefix": "$GAMEDIR",
          "name": "winetricks"
        }
      },
      {
        "task": {
          "executable": "setup",
          "description": "Running EVE Online Installer. Please do not run the game until this script finishes installing.",
          "prefix": "$GAMEDIR",
          "name": "wineexec"
        }
      }
    ],
    "files": [
      {
        "setup": {
          "filename": "EveLauncher-1548102.exe",
          "url": "https://binaries.eveonline.com/EveLauncher-1548102.exe"
        }
      }
    ]
  },
  "content": "files:\n- setup:\n    filename: EveLauncher-1548102.exe\n    url: https://binaries.eveonline.com/EveLauncher-1548102.exe\ngame:\n  exe: $GAMEDIR/drive_c/EVE/eve.exe\n  prefix: $GAMEDIR\ninstaller:\n- task:\n    arch: win64\n    description: Creating 64bit Wine prefix.\n    name: create_prefix\n    prefix: $GAMEDIR\n- task:\n    arch: win64\n    description: Setting Windows 10 mode for Wine\n    key: Version\n    name: set_regedit\n    path: HKEY_CURRENT_USER\\Software\\Wine\n    prefix: $GAMEDIR\n    value: win10\n- task:\n    app: arial\n    name: winetricks\n    prefix: $GAMEDIR\n- task:\n    description: Running EVE Online Installer. Please do not run the game until this\n      script finishes installing.\n    executable: setup\n    name: wineexec\n    prefix: $GAMEDIR\nwine:\n  dxvk: true\n  esync: true\n"
}