{
  "id": 20348,
  "game_id": 1397,
  "game_slug": "eve-online",
  "name": "EVE Online",
  "year": 2003,
  "user": "pigmanrocker",
  "runner": "wine",
  "slug": "eve-online-change-me-1",
  "version": "Change Me",
  "description": "- Sets DXVK and ESYNC\r\n- Installs the EveLauncher-version 1694436",
  "notes": "",
  "created_at": "2020-05-09T00:26:22.499754Z",
  "updated_at": "2020-05-09T00:26:22.499786Z",
  "draft": false,
  "published": false,
  "published_by": 20548,
  "rating": "",
  "steamid": 8500,
  "gogid": null,
  "gogslug": "",
  "humblestoreid": "",
  "script": {
    "files": [
      {
        "setup": {
          "filename": "EveLauncher-1694436.exe",
          "url": "https://binaries.eveonline.com/EveLauncher-1694436.exe"
        }
      }
    ],
    "game": {
      "exe": "$GAMEDIR/drive_c/EVE/eve.exe",
      "prefix": "$GAMEDIR"
    },
    "installer": [
      {
        "task": {
          "arch": "win64",
          "description": "Creating 64bit Wine prefix.",
          "name": "create_prefix",
          "prefix": "$GAMEDIR"
        }
      },
      {
        "task": {
          "arch": "win64",
          "description": "Setting Windows 10 mode for Wine",
          "key": "Version",
          "name": "set_regedit",
          "path": "HKEY_CURRENT_USER\\Software\\Wine",
          "prefix": "$GAMEDIR",
          "value": "win10"
        }
      },
      {
        "task": {
          "app": "arial",
          "name": "winetricks",
          "prefix": "$GAMEDIR"
        }
      },
      {
        "task": {
          "description": "Running EVE Online Installer. Please do not run the game until this script finishes installing.",
          "executable": "setup",
          "name": "wineexec",
          "prefix": "$GAMEDIR"
        }
      }
    ],
    "wine": {
      "dxvk": true,
      "esync": true
    }
  },
  "content": "files:\n- setup:\n    filename: EveLauncher-1694436.exe\n    url: https://binaries.eveonline.com/EveLauncher-1694436.exe\ngame:\n  exe: $GAMEDIR/drive_c/EVE/eve.exe\n  prefix: $GAMEDIR\ninstaller:\n- task:\n    arch: win64\n    description: Creating 64bit Wine prefix.\n    name: create_prefix\n    prefix: $GAMEDIR\n- task:\n    arch: win64\n    description: Setting Windows 10 mode for Wine\n    key: Version\n    name: set_regedit\n    path: HKEY_CURRENT_USER\\Software\\Wine\n    prefix: $GAMEDIR\n    value: win10\n- task:\n    app: arial\n    name: winetricks\n    prefix: $GAMEDIR\n- task:\n    description: Running EVE Online Installer. Please do not run the game until this\n      script finishes installing.\n    executable: setup\n    name: wineexec\n    prefix: $GAMEDIR\nwine:\n  dxvk: true\n  esync: true\n"
}