{
  "id": 18890,
  "game_id": 30524,
  "game_slug": "lord-of-the-rings-battle-for-middle-earth-ii-rise-",
  "name": "Lord of the Rings - Battle for Middle Earth II - Rise of the Witch King",
  "year": null,
  "user": "TroneZ",
  "runner": "wine",
  "slug": "lord-of-the-rings-battle-for-fan-patch-202-v820",
  "version": "Fan patch 2.02 v8.2.0",
  "description": "Install \"Official patch 1.06 version\" of BFME2 beforehand. It is required for this version of ROTWK.",
  "notes": "",
  "created_at": "2020-03-15T20:49:57.914000Z",
  "updated_at": "2020-03-18T12:27:47.607074Z",
  "draft": false,
  "published": true,
  "published_by": 20548,
  "rating": "",
  "steamid": null,
  "gogid": null,
  "gogslug": "",
  "humblestoreid": "",
  "script": {
    "game": {
      "prefix": "$GAMEDIR",
      "exe": "drive_c/Program Files/Electronic Arts/The Lord of the Rings, The Rise of the Witch-king/lotrbfme2ep1.exe",
      "arch": "win32"
    },
    "files": [
      {
        "rotwk_patch2_01": "N/A:Please select the installer for patch 2.01 of \"The Rise of the Witch-king\"."
      },
      {
        "rotwk_patch2_02v8_0_0": "N/A:Please select the installer for the fan patch 2.02 v8.0.0 of \"The Rise of the Witch-king\"."
      },
      {
        "rotwk_patch2_02v8_2_0": "N/A:Please select the installer for the fan patch 2.02 v8.2.0 of \"The Rise of the Witch-king\"."
      }
    ],
    "requires": "the-lord-of-the-rings-the-bat-official-patch-106",
    "installer": [
      {
        "task": {
          "prefix": "$GAMEDIR",
          "arch": "win32",
          "name": "create_prefix",
          "description": "Creating 32-bit Wine Prefix"
        }
      },
      {
        "insert-disc": {
          "requires": "AutoRun.exe"
        }
      },
      {
        "task": {
          "prefix": "$GAMEDIR",
          "arch": "win32",
          "executable": "$DISC/AutoRun.exe",
          "name": "wineexec",
          "description": "Run game installer (Select \"Quit\" after installation has finished)"
        }
      },
      {
        "task": {
          "prefix": "$GAMEDIR",
          "arch": "win32",
          "executable": "rotwk_patch2_01",
          "name": "wineexec",
          "description": "Installing official patch 2.01"
        }
      },
      {
        "task": {
          "prefix": "$GAMEDIR",
          "arch": "win32",
          "executable": "rotwk_patch2_02v8_0_0",
          "name": "wineexec",
          "description": "Installing fan patch 2.02 v8.0.0"
        }
      },
      {
        "task": {
          "prefix": "$GAMEDIR",
          "arch": "win32",
          "executable": "rotwk_patch2_02v8_2_0",
          "name": "wineexec",
          "description": "Installing fan patch 2.02 v8.2.0"
        }
      },
      {
        "task": {
          "prefix": "$GAMEDIR",
          "arch": "win32",
          "executable": "$GAMEDIR/drive_c/Program Files/Electronic Arts/The Lord of the Rings, The Rise of the Witch-king/202_launcher.exe",
          "name": "wineexec",
          "description": "Running 2.02 setup launcher (Set resolution under \"Tools\"->\"Resolution fixer\")"
        }
      }
    ]
  },
  "content": "files:\n- rotwk_patch2_01: N/A:Please select the installer for patch 2.01 of \"The Rise of\n    the Witch-king\".\n- rotwk_patch2_02v8_0_0: N/A:Please select the installer for the fan patch 2.02 v8.0.0\n    of \"The Rise of the Witch-king\".\n- rotwk_patch2_02v8_2_0: N/A:Please select the installer for the fan patch 2.02 v8.2.0\n    of \"The Rise of the Witch-king\".\ngame:\n  arch: win32\n  exe: drive_c/Program Files/Electronic Arts/The Lord of the Rings, The Rise of the\n    Witch-king/lotrbfme2ep1.exe\n  prefix: $GAMEDIR\ninstaller:\n- task:\n    arch: win32\n    description: Creating 32-bit Wine Prefix\n    name: create_prefix\n    prefix: $GAMEDIR\n- insert-disc:\n    requires: AutoRun.exe\n- task:\n    arch: win32\n    description: Run game installer (Select \"Quit\" after installation has finished)\n    executable: $DISC/AutoRun.exe\n    name: wineexec\n    prefix: $GAMEDIR\n- task:\n    arch: win32\n    description: Installing official patch 2.01\n    executable: rotwk_patch2_01\n    name: wineexec\n    prefix: $GAMEDIR\n- task:\n    arch: win32\n    description: Installing fan patch 2.02 v8.0.0\n    executable: rotwk_patch2_02v8_0_0\n    name: wineexec\n    prefix: $GAMEDIR\n- task:\n    arch: win32\n    description: Installing fan patch 2.02 v8.2.0\n    executable: rotwk_patch2_02v8_2_0\n    name: wineexec\n    prefix: $GAMEDIR\n- task:\n    arch: win32\n    description: Running 2.02 setup launcher (Set resolution under \"Tools\"->\"Resolution\n      fixer\")\n    executable: $GAMEDIR/drive_c/Program Files/Electronic Arts/The Lord of the Rings,\n      The Rise of the Witch-king/202_launcher.exe\n    name: wineexec\n    prefix: $GAMEDIR\nrequires: the-lord-of-the-rings-the-bat-official-patch-106\n"
}