{
  "id": 18171,
  "game_id": 23383,
  "game_slug": "warcraft-iii-reforged",
  "name": "Warcraft III: Reforged",
  "year": 2020,
  "user": "jkoehler",
  "runner": "wine",
  "slug": "warcraft-iii-reforged-release-vulkan-wo-dx",
  "version": "Release - Vulkan w/o DXGI",
  "description": "This installs DXVK without DXGI to work around an issue with crashing on startup.",
  "notes": "This installs DXVK without DXGI to work around an issue with crashing on startup.\r\n\r\n**CONFIGURE AND INSTALL THE DEPENDENCIES FIRST**\r\nInstructions for Vulkan support: <a href=\"https://github.com/lutris/lutris/wiki/Installing-drivers\">https://github.com/lutris/lutris/wiki/Installing-drivers</a>\r\n\r\nInstructions for proper functionality of Battle.Net (+ common problems) <a href=\"https://github.com/lutris/lutris/wiki/Game:-Blizzard-App\">https://github.com/lutris/lutris/wiki/Game:-Blizzard-App</a>\r\n\r\nIf the game is laggy you can switch between different windowmodes from the command line. This script defaults to fullscreen.\r\n-windowmode fullscreen\r\n-windowmode windowed\r\n\r\nMore info on command line options can be found here:\r\n<a href=\"https://us.forums.blizzard.com/en/warcraft3/t/1-31-0-patch-notes/5721\">https://us.forums.blizzard.com/en/warcraft3/t/1-31-0-patch-notes/5721</a>",
  "created_at": "2020-02-01T17:32:11.208000Z",
  "updated_at": "2020-02-03T12:59:40.764071Z",
  "draft": false,
  "published": true,
  "published_by": 20548,
  "rating": "",
  "steamid": null,
  "gogid": null,
  "gogslug": "",
  "humblestoreid": "",
  "script": {
    "game": {
      "exe": "drive_c/Program Files (x86)/Battle.net/Battle.net.exe",
      "arch": "win64",
      "args": "--exec=\"launch W3\"",
      "prefix": "$GAMEDIR"
    },
    "system": {
      "exclude_processes": "Agent.exe \"Battle.net Helper.exe\"",
      "env": {
        "DXVK_CONFIG_FILE": "$GAMEDIR/dxvk.conf",
        "__GL_SHADER_DISK_CACHE": 1,
        "DXVK_STATE_CACHE_PATH": "$GAMEDIR",
        "__GL_SHADER_DISK_CACHE_PATH": "$GAMEDIR",
        "STAGING_SHARED_MEMORY": 1
      }
    },
    "wine": {
      "esync": true,
      "dxvk_version": "Manual",
      "version": "lutris-5.0-x86_64",
      "overrides": {
        "ucrtbase": "n,b",
        "nvapi64": "disabled",
        "d3d12": "disabled",
        "api-ms-win-crt-private-l1-1-0": "n,b",
        "nvapi": "disabled"
      },
      "dxvk": true
    },
    "installer": [
      {
        "task": {
          "arch": "win64",
          "description": "Creating 64bit Wine prefix.",
          "prefix": "$GAMEDIR",
          "name": "create_prefix"
        }
      },
      {
        "task": {
          "app": "arial",
          "arch": "win64",
          "description": "Installing Arial font...",
          "prefix": "$GAMEDIR",
          "name": "winetricks",
          "silent": true
        }
      },
      {
        "task": {
          "arch": "win64",
          "description": "Setting Windows 10 mode for Wine",
          "prefix": "$GAMEDIR",
          "name": "set_regedit",
          "path": "HKEY_CURRENT_USER\\Software\\Wine",
          "value": "win10",
          "key": "Version"
        }
      },
      {
        "task": {
          "prefix": "$GAMEDIR",
          "name": "winekill"
        }
      },
      {
        "write_json": {
          "file": "$GAMEDIR/drive_c/users/$USER/Application Data/Battle.net/Battle.net.config",
          "data": {
            "w3": {
              "AdditionalLaunchArguments": "-windowmode fullscreen"
            },
            "Client": {
              "GameSearch": {
                "BackgroundSearch": "true"
              },
              "HardwareAcceleration": "false",
              "Streaming": {
                "StreamingEnabled": "false"
              },
              "Sound": {
                "Enabled": "false"
              },
              "GameLaunchWindowBehavior": "2"
            }
          },
          "description": "Writing a Battle.Net config file"
        }
      },
      {
        "task": {
          "arch": "win64",
          "description": "Wine Staging: Enabling DXVA2",
          "prefix": "$GAMEDIR",
          "name": "set_regedit",
          "path": "HKEY_CURRENT_USER\\Software\\Wine\\DXVA2",
          "value": "va",
          "key": "backend"
        }
      },
      {
        "task": {
          "prefix": "$GAMEDIR",
          "name": "winekill"
        }
      },
      {
        "task": {
          "executable": "setup",
          "exclude_processes": "Battle.net.exe Agent.exe \"Battle.net Helper.exe\"",
          "arch": "win64",
          "description": "Installing Blizzard App. An installer will open.\n------------------------------\nTo progress, manually continue installation in that window.",
          "name": "wineexec"
        }
      },
      {
        "task": {
          "prefix": "$GAMEDIR",
          "name": "winekill"
        }
      },
      {
        "merge": {
          "dst": "$GAMEDIR/drive_c/tmp/",
          "src": "dxvk_script"
        }
      },
      {
        "extract": {
          "file": "dxvk_script",
          "dst": "$GAMEDIR/drive_c/tmp/"
        }
      },
      {
        "chmodx": "$GAMEDIR/drive_c/tmp/setup_dxvk.sh"
      },
      {
        "execute": {
          "prefix": "$GAMEDIR",
          "command": "WINEPREFIX=$PWD bash $GAMEDIR/drive_c/tmp/setup_dxvk.sh install --without-dxgi"
        }
      }
    ],
    "files": [
      {
        "dxvk_script": "https://github.com/doitsujin/dxvk/releases/download/v1.5.3/dxvk-1.5.3.tar.gz"
      },
      {
        "setup": "http://dist.blizzard.com/downloads/bna-installers/322d5bb9ae0318de3d4cde7641c96425/retail.1/Battle.net-Setup-enUS.exe"
      }
    ]
  },
  "content": "files:\n- dxvk_script: https://github.com/doitsujin/dxvk/releases/download/v1.5.3/dxvk-1.5.3.tar.gz\n- setup: http://dist.blizzard.com/downloads/bna-installers/322d5bb9ae0318de3d4cde7641c96425/retail.1/Battle.net-Setup-enUS.exe\ngame:\n  arch: win64\n  args: --exec=\"launch W3\"\n  exe: drive_c/Program Files (x86)/Battle.net/Battle.net.exe\n  prefix: $GAMEDIR\ninstaller:\n- task:\n    arch: win64\n    description: Creating 64bit Wine prefix.\n    name: create_prefix\n    prefix: $GAMEDIR\n- task:\n    app: arial\n    arch: win64\n    description: Installing Arial font...\n    name: winetricks\n    prefix: $GAMEDIR\n    silent: true\n- task:\n    arch: win64\n    description: Setting Windows 10 mode for Wine\n    key: Version\n    name: set_regedit\n    path: HKEY_CURRENT_USER\\Software\\Wine\n    prefix: $GAMEDIR\n    value: win10\n- task:\n    name: winekill\n    prefix: $GAMEDIR\n- write_json:\n    data:\n      Client:\n        GameLaunchWindowBehavior: '2'\n        GameSearch:\n          BackgroundSearch: 'true'\n        HardwareAcceleration: 'false'\n        Sound:\n          Enabled: 'false'\n        Streaming:\n          StreamingEnabled: 'false'\n      w3:\n        AdditionalLaunchArguments: -windowmode fullscreen\n    description: Writing a Battle.Net config file\n    file: $GAMEDIR/drive_c/users/$USER/Application Data/Battle.net/Battle.net.config\n- task:\n    arch: win64\n    description: 'Wine Staging: Enabling DXVA2'\n    key: backend\n    name: set_regedit\n    path: HKEY_CURRENT_USER\\Software\\Wine\\DXVA2\n    prefix: $GAMEDIR\n    value: va\n- task:\n    name: winekill\n    prefix: $GAMEDIR\n- task:\n    arch: win64\n    description: 'Installing Blizzard App. An installer will open.\n\n      ------------------------------\n\n      To progress, manually continue installation in that window.'\n    exclude_processes: Battle.net.exe Agent.exe \"Battle.net Helper.exe\"\n    executable: setup\n    name: wineexec\n- task:\n    name: winekill\n    prefix: $GAMEDIR\n- merge:\n    dst: $GAMEDIR/drive_c/tmp/\n    src: dxvk_script\n- extract:\n    dst: $GAMEDIR/drive_c/tmp/\n    file: dxvk_script\n- chmodx: $GAMEDIR/drive_c/tmp/setup_dxvk.sh\n- execute:\n    command: WINEPREFIX=$PWD bash $GAMEDIR/drive_c/tmp/setup_dxvk.sh install --without-dxgi\n    prefix: $GAMEDIR\nsystem:\n  env:\n    DXVK_CONFIG_FILE: $GAMEDIR/dxvk.conf\n    DXVK_STATE_CACHE_PATH: $GAMEDIR\n    STAGING_SHARED_MEMORY: 1\n    __GL_SHADER_DISK_CACHE: 1\n    __GL_SHADER_DISK_CACHE_PATH: $GAMEDIR\n  exclude_processes: Agent.exe \"Battle.net Helper.exe\"\nwine:\n  dxvk: true\n  dxvk_version: Manual\n  esync: true\n  overrides:\n    api-ms-win-crt-private-l1-1-0: n,b\n    d3d12: disabled\n    nvapi: disabled\n    nvapi64: disabled\n    ucrtbase: n,b\n  version: lutris-5.0-x86_64\n"
}