{
  "id": 8054,
  "game_id": 18077,
  "game_slug": "blade-soul",
  "name": "Blade & Soul",
  "year": 2012,
  "user": "zeioth",
  "runner": "wine",
  "slug": "blade-soul-wine",
  "version": "Wine",
  "description": "UPDATE: Since 2018 this game uses gameguard, so it is unlikely to work with wine ever again.",
  "notes": "",
  "created_at": "2018-05-04T19:23:40.899000Z",
  "updated_at": "2019-04-05T05:47:57.497893Z",
  "draft": false,
  "published": true,
  "published_by": 19464,
  "rating": "1",
  "steamid": null,
  "gogid": null,
  "gogslug": "",
  "humblestoreid": "",
  "script": {
    "system": {
      "env": {
        "PBA_ENABLE": 1
      }
    },
    "game": {
      "arch": "win32",
      "args": "/LauncherID:\"GameForge\" /CompanyID:\"12\" /GameID:\"BnS\" /LUpdateAddr:\"updater.nclauncher.ncsoft.com \"",
      "exe": "drive_c/Program Files/NCWest/NCLauncher/NCLauncher.exe"
    },
    "wine": {
      "UseGLSL": "disabled",
      "esync": true
    },
    "files": [
      {
        "blade & soul": "http://download.bladeandsoul.com/BnS_Launcher_Setup.exe"
      },
      {
        "dx2010": "https://lutris.net/files/tools/directx-2010.tar.gz"
      }
    ],
    "installer": [
      {
        "extract": {
          "dst": "$CACHE/dxsetup",
          "file": "dx2010"
        }
      },
      {
        "task": {
          "arch": "win32",
          "prefix": "$GAMEDIR",
          "name": "create_prefix"
        }
      },
      {
        "task": {
          "arch": "win32",
          "executable": "$CACHE/dxsetup/DXSETUP.exe",
          "prefix": "$GAMEDIR",
          "name": "wineexec",
          "args": "/silent"
        }
      },
      {
        "task": {
          "arch": "win32",
          "prefix": "$GAMEDIR",
          "name": "winekill"
        }
      },
      {
        "task": {
          "arch": "win32",
          "prefix": "$GAMEDIR",
          "name": "winetricks",
          "app": "vcrun2008 vcrun2013 physx corefonts"
        }
      },
      {
        "task": {
          "arch": "win32",
          "prefix": "$GAMEDIR",
          "description": "Installing .NET 4.7.2",
          "name": "winetricks",
          "app": "dotnet472 win7"
        }
      },
      {
        "task": {
          "arch": "win32",
          "executable": "BnS",
          "prefix": "$GAMEDIR",
          "name": "wineexec"
        }
      }
    ]
  },
  "content": "files:\n- blade & soul: http://download.bladeandsoul.com/BnS_Launcher_Setup.exe\n- dx2010: https://lutris.net/files/tools/directx-2010.tar.gz\ngame:\n  arch: win32\n  args: /LauncherID:\"GameForge\" /CompanyID:\"12\" /GameID:\"BnS\" /LUpdateAddr:\"updater.nclauncher.ncsoft.com\n    \"\n  exe: drive_c/Program Files/NCWest/NCLauncher/NCLauncher.exe\ninstaller:\n- extract:\n    dst: $CACHE/dxsetup\n    file: dx2010\n- task:\n    arch: win32\n    name: create_prefix\n    prefix: $GAMEDIR\n- task:\n    arch: win32\n    args: /silent\n    executable: $CACHE/dxsetup/DXSETUP.exe\n    name: wineexec\n    prefix: $GAMEDIR\n- task:\n    arch: win32\n    name: winekill\n    prefix: $GAMEDIR\n- task:\n    app: vcrun2008 vcrun2013 physx corefonts\n    arch: win32\n    name: winetricks\n    prefix: $GAMEDIR\n- task:\n    app: dotnet472 win7\n    arch: win32\n    description: Installing .NET 4.7.2\n    name: winetricks\n    prefix: $GAMEDIR\n- task:\n    arch: win32\n    executable: BnS\n    name: wineexec\n    prefix: $GAMEDIR\nsystem:\n  env:\n    PBA_ENABLE: 1\nwine:\n  UseGLSL: disabled\n  esync: true\n"
}