{
  "id": 2247,
  "game_id": 6500,
  "game_slug": "hydorah",
  "name": "Hydorah",
  "year": 2010,
  "user": "ssf",
  "runner": "wine",
  "slug": "hydorah-11",
  "version": "1.1",
  "description": "",
  "notes": "",
  "created_at": "2016-07-04T18:26:29.429946Z",
  "updated_at": "2016-10-03T17:57:23.022539Z",
  "draft": false,
  "published": true,
  "published_by": null,
  "rating": "5",
  "steamid": null,
  "gogid": null,
  "gogslug": "",
  "humblestoreid": "",
  "script": {
    "files": [
      {
        "game": "https://locomalito.com/juegos/Hydorah_1_1.zip"
      }
    ],
    "game": {
      "prefix": "$GAMEDIR",
      "exe": "Hydorah.exe",
      "arch": "win32"
    },
    "system": {
      "single_cpu": true,
      "use_us_layout": true
    },
    "installer": [
      {
        "task": {
          "prefix": "$GAMEDIR",
          "name": "create_prefix",
          "description": "Creating Wine prefix"
        }
      },
      {
        "extract": {
          "file": "game",
          "dst": "$GAMEDIR"
        }
      },
      {
        "task": {
          "prefix": "$GAMEDIR",
          "app": "l3codecx",
          "silent": true,
          "name": "winetricks"
        }
      },
      {
        "task": {
          "prefix": "$GAMEDIR",
          "app": "sound=alsa",
          "silent": true,
          "name": "winetricks"
        }
      },
      {
        "task": {
          "prefix": "$GAMEDIR",
          "app": "windowmanagermanaged=n",
          "silent": true,
          "name": "winetricks"
        }
      }
    ]
  },
  "content": "files:\r\n- game: https://locomalito.com/juegos/Hydorah_1_1.zip\r\ngame:\r\n  arch: win32\r\n  exe: Hydorah.exe\r\n  prefix: $GAMEDIR\r\ninstaller:\r\n- task:\r\n    description: Creating Wine prefix\r\n    name: create_prefix\r\n    prefix: $GAMEDIR\r\n- extract:\r\n    dst: $GAMEDIR\r\n    file: game\r\n- task:\r\n    app: l3codecx\r\n    name: winetricks\r\n    prefix: $GAMEDIR\r\n    silent: true\r\n- task:\r\n    app: sound=alsa\r\n    name: winetricks\r\n    prefix: $GAMEDIR\r\n    silent: true\r\n- task:\r\n    app: windowmanagermanaged=n\r\n    name: winetricks\r\n    prefix: $GAMEDIR\r\n    silent: true\r\nsystem:\r\n  single_cpu: true\r\n  use_us_layout: true"
}