{
  "id": 16205,
  "game_id": 313,
  "game_slug": "warhammer-40000-dawn-of-war",
  "name": "Warhammer 40,000: Dawn of War",
  "year": 2004,
  "user": "DerHenning",
  "runner": "wine",
  "slug": "warhammer-40000-dawn-of-war-cd",
  "version": "CD",
  "description": null,
  "notes": "",
  "created_at": "2019-10-15T20:00:17.515813Z",
  "updated_at": "2019-10-15T20:00:17.515845Z",
  "draft": true,
  "published": false,
  "published_by": null,
  "rating": "",
  "steamid": 4570,
  "gogid": null,
  "gogslug": "",
  "humblestoreid": "",
  "script": {
    "exe": "drive_c/Program Files/THQ/Dawn of War/W40k.exe",
    "installer": [
      {
        "task": {
          "executable": "ccinstaller",
          "requires": "setup.exe",
          "prefix": "$GAMEDIR",
          "name": "wineexec"
        }
      },
      {
        "merge": {
          "src": "$DISC",
          "dst": "$CACHE/cdrom",
          "description": "Copying disc 1 to cache"
        }
      },
      {
        "insert-disc": {
          "message": "Insert disc 2",
          "requires": "Data2.cab"
        }
      },
      {
        "merge": {
          "src": "$DISC/Data2.cab",
          "dst": "$CACHE/cdrom",
          "description": "Copying disc 2 to cache"
        }
      },
      {
        "insert-disc": {
          "message": "Insert disc 3",
          "requires": "Data3.cab"
        }
      },
      {
        "merge": {
          "src": "$DISC/Data3.cab",
          "dst": "$CACHE/cdrom",
          "description": "Copying disc 3 to cache"
        }
      },
      {
        "task": {
          "executable": "$CACHE/cdrom/setup.exe",
          "prefix": "$GAMEDIR",
          "name": "wineexec"
        }
      }
    ],
    "game": {
      "arch": "win32",
      "prefix": "$GAMEDIR"
    }
  },
  "content": "exe: drive_c/Program Files/THQ/Dawn of War/W40k.exe\ngame:\n  arch: win32\n  prefix: $GAMEDIR\ninstaller:\n- task:\n    executable: ccinstaller\n    name: wineexec\n    prefix: $GAMEDIR\n    requires: setup.exe\n- merge:\n    description: Copying disc 1 to cache\n    dst: $CACHE/cdrom\n    src: $DISC\n- insert-disc:\n    message: Insert disc 2\n    requires: Data2.cab\n- merge:\n    description: Copying disc 2 to cache\n    dst: $CACHE/cdrom\n    src: $DISC/Data2.cab\n- insert-disc:\n    message: Insert disc 3\n    requires: Data3.cab\n- merge:\n    description: Copying disc 3 to cache\n    dst: $CACHE/cdrom\n    src: $DISC/Data3.cab\n- task:\n    executable: $CACHE/cdrom/setup.exe\n    name: wineexec\n    prefix: $GAMEDIR\n"
}