{
  "id": 8961,
  "game_id": 12416,
  "game_slug": "just-causetm-3-multiplayer-mod",
  "name": "Just Causeâ„¢ 3: Multiplayer Mod",
  "year": null,
  "user": "Leo_Verto",
  "runner": "winesteam",
  "slug": "just-causetm-3-multiplayer-mo-steam",
  "version": "Steam",
  "description": null,
  "notes": "You may still experience performance issues depending on your hardware",
  "created_at": "2018-06-30T22:32:02.684000Z",
  "updated_at": "2019-02-16T03:18:35.054239Z",
  "draft": false,
  "published": true,
  "published_by": 19464,
  "rating": "",
  "steamid": 619910,
  "gogid": null,
  "gogslug": "",
  "humblestoreid": "",
  "script": {
    "requires": "just-cause-3-steam-w-dxvk",
    "system": {
      "pulse_latency": true,
      "env": {
        "DXVK_HUD": 0
      }
    },
    "winesteam": {
      "overrides": {
        "xaudio2_7": "native,builtin"
      },
      "dxvk": true,
      "version": "tkg-4.0-x86_64"
    },
    "game": {
      "arch": "win64",
      "prefix": "$GAMEDIR/prefix",
      "appid": 619910
    },
    "installer": [
      {
        "task": {
          "arch": "win64",
          "prefix": "$GAMEDIR/prefix",
          "name": "create_prefix"
        }
      },
      {
        "task": {
          "arch": "win64",
          "prefix": "$GAMEDIR/prefix",
          "name": "winetricks",
          "app": "xact"
        }
      },
      {
        "task": {
          "prefix": "$GAMEDIR/prefix",
          "value": "Y",
          "arch": "win64",
          "path": "HKEY_CURRENT_USER\\Software\\Wine\\X11 Driver",
          "key": "GrabFullscreen",
          "name": "set_regedit"
        }
      },
      {
        "task": {
          "arch": "win64",
          "prefix": "$GAMEDIR/prefix",
          "name": "winetricks",
          "app": "win7"
        }
      }
    ]
  },
  "content": "game:\n  appid: 619910\n  arch: win64\n  prefix: $GAMEDIR/prefix\ninstaller:\n- task:\n    arch: win64\n    name: create_prefix\n    prefix: $GAMEDIR/prefix\n- task:\n    app: xact\n    arch: win64\n    name: winetricks\n    prefix: $GAMEDIR/prefix\n- task:\n    arch: win64\n    key: GrabFullscreen\n    name: set_regedit\n    path: HKEY_CURRENT_USER\\Software\\Wine\\X11 Driver\n    prefix: $GAMEDIR/prefix\n    value: Y\n- task:\n    app: win7\n    arch: win64\n    name: winetricks\n    prefix: $GAMEDIR/prefix\nrequires: just-cause-3-steam-w-dxvk\nsystem:\n  env:\n    DXVK_HUD: 0\n  pulse_latency: true\nwinesteam:\n  dxvk: true\n  overrides:\n    xaudio2_7: native,builtin\n  version: tkg-4.0-x86_64\n"
}