{
  "id": 21494,
  "game_id": 37290,
  "game_slug": "trackmania-sunrise-extreme",
  "name": "TrackMania Sunrise eXtreme",
  "year": 2005,
  "user": "KitanTm",
  "runner": "wine",
  "slug": "trackmania-sunrise-extreme-cd",
  "version": "CD",
  "description": "With Starforce removing patch",
  "notes": "",
  "created_at": "2020-06-14T09:48:43.239000Z",
  "updated_at": "2020-07-31T17:02:05.308206Z",
  "draft": false,
  "published": true,
  "published_by": 20548,
  "rating": "",
  "steamid": null,
  "gogid": null,
  "gogslug": "",
  "humbleid": "",
  "humblestoreid": "",
  "humblestoreid_real": "",
  "script": {
    "files": [
      {
        "setup": "N/A:Select the TrackMania Sunrise setup file"
      },
      {
        "extreme": {
          "filename": "extreme.exe",
          "url": "https://www.4players.de/4players.php/download_start/Downloads/Download/44877.html"
        }
      },
      {
        "update": {
          "filename": "update.exe",
          "url": "https://www.4players.de/4players.php/download_start/Downloads/Download/46500.html"
        }
      },
      {
        "patch": "N/A:Download and attach the Windows 10 patch zip from https://bit.ly/3d2FZCt"
      }
    ],
    "game": {
      "arch": "win32",
      "exe": "drive_c/Program Files/TrackMania Sunrise/TmSunriseLauncher.exe",
      "prefix": "$GAMEDIR"
    },
    "installer": [
      {
        "insert-disc": {
          "requires": "TmSunriseSetup.exe"
        }
      },
      {
        "task": {
          "arch": "win32",
          "description": "Creating Wine prefix",
          "install_mono": false,
          "name": "create_prefix",
          "prefix": "$GAMEDIR"
        }
      },
      {
        "task": {
          "description": "Installing base game, don't launch game",
          "executable": "setup",
          "name": "wineexec",
          "prefix": "$GAMEDIR"
        }
      },
      {
        "task": {
          "description": "Installing eXtreme update, don't launch game",
          "executable": "extreme",
          "name": "wineexec",
          "prefix": "$GAMEDIR"
        }
      },
      {
        "task": {
          "description": "Installing 1.5.1 update, dont't launch game",
          "executable": "update",
          "name": "wineexec",
          "prefix": "$GAMEDIR"
        }
      },
      {
        "extract": {
          "dst": "$GAMEDIR/patch",
          "file": "patch"
        }
      },
      {
        "move": {
          "dst": "$GAMEDIR/patch/TmSunrise.exe",
          "src": "$GAMEDIR/patch/TMSUNRISE.EXE"
        }
      },
      {
        "merge": {
          "dst": "$GAMEDIR/drive_c/Program Files/TrackMania Sunrise/",
          "src": "$GAMEDIR/patch/*"
        }
      }
    ]
  },
  "content": "files:\n- setup: N/A:Select the TrackMania Sunrise setup file\n- extreme:\n    filename: extreme.exe\n    url: https://www.4players.de/4players.php/download_start/Downloads/Download/44877.html\n- update:\n    filename: update.exe\n    url: https://www.4players.de/4players.php/download_start/Downloads/Download/46500.html\n- patch: N/A:Download and attach the Windows 10 patch zip from https://bit.ly/3d2FZCt\ngame:\n  arch: win32\n  exe: drive_c/Program Files/TrackMania Sunrise/TmSunriseLauncher.exe\n  prefix: $GAMEDIR\ninstaller:\n- insert-disc:\n    requires: TmSunriseSetup.exe\n- task:\n    arch: win32\n    description: Creating Wine prefix\n    install_mono: false\n    name: create_prefix\n    prefix: $GAMEDIR\n- task:\n    description: Installing base game, don't launch game\n    executable: setup\n    name: wineexec\n    prefix: $GAMEDIR\n- task:\n    description: Installing eXtreme update, don't launch game\n    executable: extreme\n    name: wineexec\n    prefix: $GAMEDIR\n- task:\n    description: Installing 1.5.1 update, dont't launch game\n    executable: update\n    name: wineexec\n    prefix: $GAMEDIR\n- extract:\n    dst: $GAMEDIR/patch\n    file: patch\n- move:\n    dst: $GAMEDIR/patch/TmSunrise.exe\n    src: $GAMEDIR/patch/TMSUNRISE.EXE\n- merge:\n    dst: $GAMEDIR/drive_c/Program Files/TrackMania Sunrise/\n    src: $GAMEDIR/patch/*\n"
}