{
  "id": 15599,
  "game_id": 29407,
  "game_slug": "pcsx2",
  "name": "PCSX2",
  "year": 2002,
  "user": "edjaa84",
  "runner": "wine",
  "slug": "pcsx2-140",
  "version": "1.4.0",
  "description": null,
  "notes": "",
  "created_at": "2019-09-16T01:19:55.699000Z",
  "updated_at": "2019-11-01T00:35:41.030424Z",
  "draft": false,
  "published": true,
  "published_by": 19464,
  "rating": "",
  "steamid": null,
  "gogid": null,
  "gogslug": "",
  "humblestoreid": "",
  "script": {
    "files": [
      {
        "dark": "N/A:Select setup exe"
      }
    ],
    "game": {
      "arch": "win32",
      "exe": "drive_c/Program Files/PCSX2 1.4.0/pcsx2.exe",
      "prefix": "$GAMEDIR"
    },
    "installer": [
      {
        "task": {
          "name": "create_prefix",
          "prefix": "$GAMEDIR"
        }
      },
      {
        "task": {
          "app": "vcrun2015",
          "name": "winetricks",
          "prefix": "$GAMEDIR"
        }
      },
      {
        "task": {
          "app": "win7",
          "name": "winetricks",
          "prefix": "$GAMEDIR"
        }
      },
      {
        "task": {
          "app": "d3dx9",
          "description": "Installing DirectX 9",
          "name": "winetricks",
          "prefix": "$GAMEDIR"
        }
      },
      {
        "task": {
          "app": "d3dx11_42",
          "description": "Installing DirectX 11",
          "name": "winetricks",
          "prefix": "$GAMEDIR"
        }
      },
      {
        "task": {
          "app": "d3dx11_43",
          "description": "Installing DirectX 11",
          "name": "winetricks",
          "prefix": "$GAMEDIR"
        }
      },
      {
        "task": {
          "app": "d3dcompiler_42",
          "description": "Installing d3dcompiler42",
          "name": "winetricks",
          "prefix": "$GAMEDIR"
        }
      },
      {
        "task": {
          "app": "d3dcompiler_43",
          "description": "Installing d3dcompiler43",
          "name": "winetricks",
          "prefix": "$GAMEDIR"
        }
      },
      {
        "task": {
          "app": "d3dcompiler_47",
          "description": "Installing d3dcompiler47",
          "name": "winetricks",
          "prefix": "$GAMEDIR"
        }
      }
    ]
  },
  "content": "files:\n- dark: N/A:Select setup exe\ngame:\n  arch: win32\n  exe: drive_c/Program Files/PCSX2 1.4.0/pcsx2.exe\n  prefix: $GAMEDIR\ninstaller:\n- task:\n    name: create_prefix\n    prefix: $GAMEDIR\n- task:\n    app: vcrun2015\n    name: winetricks\n    prefix: $GAMEDIR\n- task:\n    app: win7\n    name: winetricks\n    prefix: $GAMEDIR\n- task:\n    app: d3dx9\n    description: Installing DirectX 9\n    name: winetricks\n    prefix: $GAMEDIR\n- task:\n    app: d3dx11_42\n    description: Installing DirectX 11\n    name: winetricks\n    prefix: $GAMEDIR\n- task:\n    app: d3dx11_43\n    description: Installing DirectX 11\n    name: winetricks\n    prefix: $GAMEDIR\n- task:\n    app: d3dcompiler_42\n    description: Installing d3dcompiler42\n    name: winetricks\n    prefix: $GAMEDIR\n- task:\n    app: d3dcompiler_43\n    description: Installing d3dcompiler43\n    name: winetricks\n    prefix: $GAMEDIR\n- task:\n    app: d3dcompiler_47\n    description: Installing d3dcompiler47\n    name: winetricks\n    prefix: $GAMEDIR\n"
}