{
  "id": 16571,
  "game_id": 3367,
  "game_slug": "starcraft-ii",
  "name": "StarCraft II",
  "year": 2010,
  "user": "f00z",
  "runner": "wine",
  "slug": "starcraft-ii-battlenet",
  "version": "Battle.Net",
  "description": null,
  "notes": "",
  "created_at": "2019-11-02T18:31:00.718708Z",
  "updated_at": "2020-01-23T02:56:54.866503Z",
  "draft": true,
  "published": false,
  "published_by": null,
  "rating": "",
  "steamid": null,
  "gogid": null,
  "gogslug": "",
  "humblestoreid": "",
  "script": {
    "files": [
      {
        "setup": {
          "url": "https://www.battle.net/download/getInstallerForGame?os=win&locale=enUS&version=LIVE&gameProgram=BATTLENET_APP",
          "filename": "Battle.net-Setup.exe"
        }
      },
      {
        "d3dcompiler47": "https://lutris.net/files/tools/dll/d3dcompiler_47.dll"
      }
    ],
    "installer": [
      {
        "task": {
          "arch": "win64",
          "description": "Creating 64bit Wine prefix.",
          "prefix": "$GAMEDIR",
          "name": "create_prefix"
        }
      },
      {
        "task": {
          "arch": "win64",
          "description": "Installing Arial font",
          "app": "arial",
          "prefix": "$GAMEDIR",
          "name": "winetricks"
        }
      },
      {
        "task": {
          "arch": "win64",
          "description": "Install d3dcompiler_43 with winetricks",
          "app": "d3dcompiler_43",
          "prefix": "$GAMEDIR",
          "name": "winetricks"
        }
      },
      {
        "move": {
          "src": "$GAMEDIR/drive_c/windows/system32/d3dcompiler_47.dll",
          "dst": "$GAMEDIR/drive_c/windows/system32/d3dcompiler_47.dll.ORIG"
        }
      },
      {
        "merge": {
          "src": "d3dcompiler47",
          "dst": "$GAMEDIR/drive_c/windows/system32"
        }
      },
      {
        "task": {
          "prefix": "$GAMEDIR",
          "value": "win10",
          "arch": "win64",
          "key": "Version",
          "name": "set_regedit",
          "description": "Setting Windows 10 mode for Wine",
          "path": "HKEY_CURRENT_USER\\Software\\Wine"
        }
      },
      {
        "write_json": {
          "description": "Disabling Sound/Hardware Acceleration/Streaming in Blizzard App",
          "file": "$GAMEDIR/drive_c/users/$USER/Application Data/Battle.net/Battle.net.config",
          "data": {
            "Games": {
              "s2": {
                "AdditionalLaunchArguments": "-Displaymode 1"
              }
            },
            "Client": {
              "Sound": {
                "Enabled": "false"
              },
              "GameLaunchWindowBehavior": "2",
              "Streaming": {
                "StreamingEnabled": "false"
              },
              "HardwareAcceleration": "false"
            }
          }
        }
      },
      {
        "task": {
          "arch": "win64",
          "exclude_processes": "Battle.net.exe Agent.exe \"Battle.net Helper.exe\"",
          "executable": "setup",
          "description": "Installing Blizzard App\n------------------------------\nDo not try to log into Battle.net. Lutris will automatically close the login window. After Lutris installer is finished, you can start Blizzard App with \"Launch the game\", and install / locate your Blizzard game.",
          "name": "wineexec"
        }
      },
      {
        "task": {
          "prefix": "$GAMEDIR",
          "name": "winekill"
        }
      },
      {
        "task": {
          "prefix": "$GAMEDIR",
          "value": "va",
          "arch": "win64",
          "key": "backend",
          "name": "set_regedit",
          "description": "Wine Staging: Enabling DXVA2",
          "path": "HKEY_CURRENT_USER\\Software\\Wine\\DXVA2"
        }
      }
    ],
    "system": {
      "exclude_processes": "Agent.exe \"Battle.net Helper.exe\"",
      "env": {
        "__GL_SHADER_DISK_CACHE_PATH": "$GAMEDIR",
        "__GL_SHADER_DISK_CACHE": 1
      }
    },
    "wine": {
      "esync": true
    },
    "game": {
      "arch": "win64",
      "prefix": "$GAMEDIR",
      "exe": "drive_c/Program Files (x86)/Battle.net/Battle.net Launcher.exe"
    }
  },
  "content": "files:\n- setup:\n    filename: Battle.net-Setup.exe\n    url: https://www.battle.net/download/getInstallerForGame?os=win&locale=enUS&version=LIVE&gameProgram=BATTLENET_APP\n- d3dcompiler47: https://lutris.net/files/tools/dll/d3dcompiler_47.dll\ngame:\n  arch: win64\n  exe: drive_c/Program Files (x86)/Battle.net/Battle.net Launcher.exe\n  prefix: $GAMEDIR\ninstaller:\n- task:\n    arch: win64\n    description: Creating 64bit Wine prefix.\n    name: create_prefix\n    prefix: $GAMEDIR\n- task:\n    app: arial\n    arch: win64\n    description: Installing Arial font\n    name: winetricks\n    prefix: $GAMEDIR\n- task:\n    app: d3dcompiler_43\n    arch: win64\n    description: Install d3dcompiler_43 with winetricks\n    name: winetricks\n    prefix: $GAMEDIR\n- move:\n    dst: $GAMEDIR/drive_c/windows/system32/d3dcompiler_47.dll.ORIG\n    src: $GAMEDIR/drive_c/windows/system32/d3dcompiler_47.dll\n- merge:\n    dst: $GAMEDIR/drive_c/windows/system32\n    src: d3dcompiler47\n- task:\n    arch: win64\n    description: Setting Windows 10 mode for Wine\n    key: Version\n    name: set_regedit\n    path: HKEY_CURRENT_USER\\Software\\Wine\n    prefix: $GAMEDIR\n    value: win10\n- write_json:\n    data:\n      Client:\n        GameLaunchWindowBehavior: '2'\n        HardwareAcceleration: 'false'\n        Sound:\n          Enabled: 'false'\n        Streaming:\n          StreamingEnabled: 'false'\n      Games:\n        s2:\n          AdditionalLaunchArguments: -Displaymode 1\n    description: Disabling Sound/Hardware Acceleration/Streaming in Blizzard App\n    file: $GAMEDIR/drive_c/users/$USER/Application Data/Battle.net/Battle.net.config\n- task:\n    arch: win64\n    description: 'Installing Blizzard App\n\n      ------------------------------\n\n      Do not try to log into Battle.net. Lutris will automatically close the login\n      window. After Lutris installer is finished, you can start Blizzard App with\n      \"Launch the game\", and install / locate your Blizzard game.'\n    exclude_processes: Battle.net.exe Agent.exe \"Battle.net Helper.exe\"\n    executable: setup\n    name: wineexec\n- task:\n    name: winekill\n    prefix: $GAMEDIR\n- task:\n    arch: win64\n    description: 'Wine Staging: Enabling DXVA2'\n    key: backend\n    name: set_regedit\n    path: HKEY_CURRENT_USER\\Software\\Wine\\DXVA2\n    prefix: $GAMEDIR\n    value: va\nsystem:\n  env:\n    __GL_SHADER_DISK_CACHE: 1\n    __GL_SHADER_DISK_CACHE_PATH: $GAMEDIR\n  exclude_processes: Agent.exe \"Battle.net Helper.exe\"\nwine:\n  esync: true\n"
}