{
  "id": 16596,
  "game_id": 3367,
  "game_slug": "starcraft-ii",
  "name": "StarCraft II",
  "year": 2010,
  "user": "zenzou",
  "runner": "wine",
  "slug": "starcraft-ii-nvidia-d9vk",
  "version": "Nvidia D9VK",
  "description": "Starcraft II install script using the new D9VK option baked in as well as latest Lutris Wine (nofshack).",
  "notes": "**CONFIGURE AND INSTALL THE DEPENDENCIES FIRST**\r\nNote: This is meant for Nvidia GPU systems. For AMD, go to 'system options' then 'Environmental Variables' and remove \"__GL_SHADER_DISK_CACHE\" and  \"__GL_SHADER_DISK_CACHE_PATH\"\r\n\r\nInstructions for DXVK support: https://github.com/lutris/lutris/wiki/How-to:-DXVK\r\nInstructions for proper functionality of Battle.Net (+ common problems) https://github.com/lutris/lutris/wiki/Game:-Blizzard-App",
  "created_at": "2019-11-03T19:51:37.227934Z",
  "updated_at": "2020-01-23T02:59:36.117795Z",
  "draft": true,
  "published": false,
  "published_by": null,
  "rating": "",
  "steamid": null,
  "gogid": null,
  "gogslug": "",
  "humblestoreid": "",
  "script": {
    "game": {
      "exe": "drive_c/Program Files (x86)/Battle.net/Battle.net.exe",
      "arch": "win64",
      "prefix": "$GAMEDIR"
    },
    "system": {
      "exclude_processes": "Agent.exe \"Battle.net Helper.exe\"",
      "env": {
        "__GL_SHADER_DISK_CACHE_PATH": "$GAMEDIR",
        "__GL_SHADER_DISK_CACHE": 1,
        "DXVK_HUD": "compiler",
        "PULSE_LATENCY_MSEC": 60,
        "DXVK_STATE_CACHE_PATH": "$GAMEDIR"
      }
    },
    "wine": {
      "esync": true,
      "overrides": {
        "ucrtbase": "n,b",
        "nvapi64": "disabled",
        "d3d12": "disabled",
        "api-ms-win-crt-private-l1-1-0": "n,b",
        "nvapi": "disabled"
      },
      "dxvk": true
    },
    "installer": [
      {
        "task": {
          "arch": "win64",
          "description": "Creating 64bit Wine prefix.",
          "prefix": "$GAMEDIR",
          "name": "create_prefix"
        }
      },
      {
        "task": {
          "app": "arial faudio",
          "arch": "win64",
          "description": "Installing Arial, FAudio...",
          "prefix": "$GAMEDIR",
          "name": "winetricks",
          "silent": true
        }
      },
      {
        "task": {
          "arch": "win64",
          "description": "Setting Windows 10 mode for Wine",
          "prefix": "$GAMEDIR",
          "name": "set_regedit",
          "path": "HKEY_CURRENT_USER\\Software\\Wine",
          "value": "win10",
          "key": "Version"
        }
      },
      {
        "task": {
          "prefix": "$GAMEDIR",
          "name": "winekill"
        }
      },
      {
        "write_json": {
          "file": "$GAMEDIR/drive_c/users/$USER/Application Data/Battle.net/Battle.net.config",
          "data": {
            "Client": {
              "GameSearch": {
                "BackgroundSearch": "true"
              },
              "HardwareAcceleration": "false",
              "Streaming": {
                "StreamingEnabled": "false"
              },
              "Sound": {
                "Enabled": "false"
              },
              "GameLaunchWindowBehavior": "2"
            }
          },
          "description": "Writing a Battle.Net config file"
        }
      },
      {
        "task": {
          "arch": "win64",
          "description": "Wine Staging: Enabling DXVA2",
          "prefix": "$GAMEDIR",
          "name": "set_regedit",
          "path": "HKEY_CURRENT_USER\\Software\\Wine\\DXVA2",
          "value": "va",
          "key": "backend"
        }
      },
      {
        "task": {
          "prefix": "$GAMEDIR",
          "name": "winekill"
        }
      },
      {
        "task": {
          "executable": "setup",
          "exclude_processes": "Battle.net.exe Agent.exe \"Battle.net Helper.exe\"",
          "arch": "win64",
          "description": "Installing Blizzard App. An installer will open.\n------------------------------\nTo progress, manually continue installation in that window.",
          "name": "wineexec"
        }
      },
      {
        "task": {
          "prefix": "$GAMEDIR",
          "name": "winekill"
        }
      }
    ],
    "files": [
      {
        "setup": {
          "filename": "Battle.net-Setup-enUS.exe",
          "url": "http://dist.blizzard.com/downloads/bna-installers/322d5bb9ae0318de3d4cde7641c96425/retail.1/Battle.net-Setup-enUS.exe"
        }
      }
    ]
  },
  "content": "files:\n- setup:\n    filename: Battle.net-Setup-enUS.exe\n    url: http://dist.blizzard.com/downloads/bna-installers/322d5bb9ae0318de3d4cde7641c96425/retail.1/Battle.net-Setup-enUS.exe\ngame:\n  arch: win64\n  exe: drive_c/Program Files (x86)/Battle.net/Battle.net.exe\n  prefix: $GAMEDIR\ninstaller:\n- task:\n    arch: win64\n    description: Creating 64bit Wine prefix.\n    name: create_prefix\n    prefix: $GAMEDIR\n- task:\n    app: arial faudio\n    arch: win64\n    description: Installing Arial, FAudio...\n    name: winetricks\n    prefix: $GAMEDIR\n    silent: true\n- task:\n    arch: win64\n    description: Setting Windows 10 mode for Wine\n    key: Version\n    name: set_regedit\n    path: HKEY_CURRENT_USER\\Software\\Wine\n    prefix: $GAMEDIR\n    value: win10\n- task:\n    name: winekill\n    prefix: $GAMEDIR\n- write_json:\n    data:\n      Client:\n        GameLaunchWindowBehavior: '2'\n        GameSearch:\n          BackgroundSearch: 'true'\n        HardwareAcceleration: 'false'\n        Sound:\n          Enabled: 'false'\n        Streaming:\n          StreamingEnabled: 'false'\n    description: Writing a Battle.Net config file\n    file: $GAMEDIR/drive_c/users/$USER/Application Data/Battle.net/Battle.net.config\n- task:\n    arch: win64\n    description: 'Wine Staging: Enabling DXVA2'\n    key: backend\n    name: set_regedit\n    path: HKEY_CURRENT_USER\\Software\\Wine\\DXVA2\n    prefix: $GAMEDIR\n    value: va\n- task:\n    name: winekill\n    prefix: $GAMEDIR\n- task:\n    arch: win64\n    description: 'Installing Blizzard App. An installer will open.\n\n      ------------------------------\n\n      To progress, manually continue installation in that window.'\n    exclude_processes: Battle.net.exe Agent.exe \"Battle.net Helper.exe\"\n    executable: setup\n    name: wineexec\n- task:\n    name: winekill\n    prefix: $GAMEDIR\nsystem:\n  env:\n    DXVK_HUD: compiler\n    DXVK_STATE_CACHE_PATH: $GAMEDIR\n    PULSE_LATENCY_MSEC: 60\n    __GL_SHADER_DISK_CACHE: 1\n    __GL_SHADER_DISK_CACHE_PATH: $GAMEDIR\n  exclude_processes: Agent.exe \"Battle.net Helper.exe\"\nwine:\n  dxvk: true\n  esync: true\n  overrides:\n    api-ms-win-crt-private-l1-1-0: n,b\n    d3d12: disabled\n    nvapi: disabled\n    nvapi64: disabled\n    ucrtbase: n,b\n"
}