{
  "id": 21239,
  "game_id": 37187,
  "game_slug": "zw-cad",
  "name": "ZW CAD",
  "year": 2020,
  "user": "Helg1980",
  "runner": "wine",
  "slug": "zw-cad-58",
  "version": "5.8",
  "description": "ZWCAD 2020 SP2",
  "notes": "",
  "created_at": "2020-06-05T16:14:00.365323Z",
  "updated_at": "2020-06-05T16:14:00.365349Z",
  "draft": true,
  "published": false,
  "published_by": null,
  "rating": "",
  "steamid": null,
  "gogid": null,
  "gogslug": "",
  "humbleid": "",
  "humblestoreid": "",
  "humblestoreid_real": "",
  "script": {
    "files": [
      {
        "installer": "N/A:Please select the setup.exe located on the installation DVD."
      }
    ],
    "game": {
      "arch": "win64",
      "exe": "drive_c/Program Files/ZWSOFT/ZWCAD 2020/ZWCAD.exe",
      "prefix": "$GAMEDIR"
    },
    "installer": [
      {
        "task": {
          "arch": "win64",
          "description": "Creating 64-bit Wine prefix.",
          "name": "create_prefix",
          "prefix": "$GAMEDIR"
        }
      },
      {
        "task": {
          "arch": "win64",
          "description": "Setting Windows 7 mode for Wine",
          "key": "Version",
          "name": "set_regedit",
          "path": "HKEY_CURRENT_USER\\Software\\Wine",
          "prefix": "$GAMEDIR",
          "value": "win7"
        }
      },
      {
        "task": {
          "name": "winekill",
          "prefix": "$GAMEDIR"
        }
      },
      {
        "task": {
          "app": "dotnet48",
          "arch": "win64",
          "description": "Installing dotnet48",
          "name": "winetricks",
          "prefix": "$GAMEDIR"
        }
      },
      {
        "task": {
          "app": "d3dcompiler_47",
          "arch": "win64",
          "description": "Installing d3dcompiler_47",
          "name": "winetricks",
          "prefix": "$GAMEDIR"
        }
      },
      {
        "task": {
          "app": "corefonts",
          "arch": "win64",
          "description": "Installing corefonts",
          "name": "winetricks",
          "prefix": "$GAMEDIR"
        }
      },
      {
        "task": {
          "arch": "win64",
          "description": "Running setup",
          "executable": "installer",
          "name": "wineexec",
          "prefix": "$GAMEDIR"
        }
      }
    ],
    "wine": {
      "dxvk": true,
      "esync": true
    }
  },
  "content": "files:\n- installer: N/A:Please select the setup.exe located on the installation DVD.\ngame:\n  arch: win64\n  exe: drive_c/Program Files/ZWSOFT/ZWCAD 2020/ZWCAD.exe\n  prefix: $GAMEDIR\ninstaller:\n- task:\n    arch: win64\n    description: Creating 64-bit Wine prefix.\n    name: create_prefix\n    prefix: $GAMEDIR\n- task:\n    arch: win64\n    description: Setting Windows 7 mode for Wine\n    key: Version\n    name: set_regedit\n    path: HKEY_CURRENT_USER\\Software\\Wine\n    prefix: $GAMEDIR\n    value: win7\n- task:\n    name: winekill\n    prefix: $GAMEDIR\n- task:\n    app: dotnet48\n    arch: win64\n    description: Installing dotnet48\n    name: winetricks\n    prefix: $GAMEDIR\n- task:\n    app: d3dcompiler_47\n    arch: win64\n    description: Installing d3dcompiler_47\n    name: winetricks\n    prefix: $GAMEDIR\n- task:\n    app: corefonts\n    arch: win64\n    description: Installing corefonts\n    name: winetricks\n    prefix: $GAMEDIR\n- task:\n    arch: win64\n    description: Running setup\n    executable: installer\n    name: wineexec\n    prefix: $GAMEDIR\nwine:\n  dxvk: true\n  esync: true\n"
}