{
  "id": 21146,
  "game_id": 37072,
  "game_slug": "amazon-games-app",
  "name": "Amazon Games App",
  "year": 2015,
  "user": "WarfaceZ",
  "runner": "wine",
  "slug": "amazon-games-app-change-me",
  "version": "Change Me",
  "description": "Borked. You can sign in but it will prompt you cannot connect to the internet.",
  "notes": "Requires \"connection\" and doesn't work.",
  "created_at": "2020-06-02T10:54:29.188509Z",
  "updated_at": "2020-06-02T10:54:29.188538Z",
  "draft": false,
  "published": false,
  "published_by": 20548,
  "rating": "",
  "steamid": null,
  "gogid": null,
  "gogslug": "",
  "humbleid": "",
  "humblestoreid": "",
  "humblestoreid_real": "",
  "script": {
    "files": [
      {
        "app": "https://download.amazongames.com/AmazonGamesSetup.exe"
      }
    ],
    "game": {
      "arch": "win64",
      "exe": "drive_c/users/$USER/Desktop/",
      "prefix": "$GAMEDIR"
    },
    "installer": [
      {
        "task": {
          "arch": "win64",
          "name": "create_prefix",
          "prefix": "$GAMEDIR"
        }
      },
      {
        "task": {
          "arch": "win64",
          "key": "ShowDotFiles",
          "name": "set_regedit",
          "path": "HKEY_CURRENT_USER\\Software\\Wine",
          "prefix": "$GAMEDIR",
          "value": "Y"
        }
      },
      {
        "task": {
          "app": "dotnet40 d9vk dinput8 d3dx9 d3dx9_43 d3dx11_43 d3dcompiler_47 msxml3 msxml4",
          "arch": "win64",
          "description": "Installing dependencies. This will take a while...",
          "name": "winetricks",
          "prefix": "$GAMEDIR"
        }
      },
      {
        "task": {
          "arch": "win64",
          "exclude_processes": "Amazon Games.exe explorer.exe",
          "executable": "app",
          "name": "wineexec",
          "prefix": "$GAMEDIR"
        }
      },
      {
        "task": {
          "arch": "win64",
          "name": "winekill",
          "prefix": "$GAMEDIR"
        }
      },
      {
        "task": {
          "app": "win81",
          "arch": "win64",
          "description": "Setting Windows to Win8.1",
          "name": "winetricks",
          "prefix": "$GAMEDIR"
        }
      },
      {
        "write_file": {
          "content": "{\"closeOption\": \"close\"}",
          "file": "$GAMEDIR/drive_c/users/$USER/Local Settings/Application Data/Amazon Games/ElectronSettings.json"
        }
      }
    ],
    "system": {
      "terminal": false
    }
  },
  "content": "files:\n- app: https://download.amazongames.com/AmazonGamesSetup.exe\ngame:\n  arch: win64\n  exe: drive_c/users/$USER/Desktop/\n  prefix: $GAMEDIR\ninstaller:\n- task:\n    arch: win64\n    name: create_prefix\n    prefix: $GAMEDIR\n- task:\n    arch: win64\n    key: ShowDotFiles\n    name: set_regedit\n    path: HKEY_CURRENT_USER\\Software\\Wine\n    prefix: $GAMEDIR\n    value: Y\n- task:\n    app: dotnet40 d9vk dinput8 d3dx9 d3dx9_43 d3dx11_43 d3dcompiler_47 msxml3 msxml4\n    arch: win64\n    description: Installing dependencies. This will take a while...\n    name: winetricks\n    prefix: $GAMEDIR\n- task:\n    arch: win64\n    exclude_processes: Amazon Games.exe explorer.exe\n    executable: app\n    name: wineexec\n    prefix: $GAMEDIR\n- task:\n    arch: win64\n    name: winekill\n    prefix: $GAMEDIR\n- task:\n    app: win81\n    arch: win64\n    description: Setting Windows to Win8.1\n    name: winetricks\n    prefix: $GAMEDIR\n- write_file:\n    content: '{\"closeOption\": \"close\"}'\n    file: $GAMEDIR/drive_c/users/$USER/Local Settings/Application Data/Amazon Games/ElectronSettings.json\nsystem:\n  terminal: false\n"
}