{
  "id": 13593,
  "game_id": 27299,
  "game_slug": "return-of-reckoning",
  "name": "Return of Reckoning",
  "year": 2019,
  "user": "Leylan",
  "runner": "wine",
  "slug": "return-of-reckoning-01",
  "version": "0.1",
  "description": "Draft",
  "notes": "",
  "created_at": "2019-05-17T23:53:04.049539Z",
  "updated_at": "2020-01-23T02:56:51.105174Z",
  "draft": true,
  "published": false,
  "published_by": null,
  "rating": "",
  "steamid": null,
  "gogid": null,
  "gogslug": "",
  "humblestoreid": "",
  "script": {
    "files": [
      {
        "launcher": "https://launcher.returnofreckoning.com/RoRLauncher.exe"
      }
    ],
    "game": {
      "prefix": "$GAMEDIR",
      "exe": "drive_c/Program Files (x86)/Return of Reckoning/RoRLauncher.exe",
      "arch": "win64",
      "args": "-maploadinfo"
    },
    "wine": {
      "esync": true,
      "dxvk": true
    },
    "system": {
      "env": {
        "DXVK_STATE_CACHE_PATH": "$GAMEDIR",
        "__GL_SHADER_DISK_CACHE": 1,
        "DXVK_STATE_CACHE": 1,
        "DXVK_LOG_LEVEL": "none",
        "DXVK_HUD": 0,
        "mesa_glthread": "true",
        "__GL_SHADER_DISK_CACHE_PATH": "$GAMEDIR"
      }
    },
    "installer": [
      {
        "task": {
          "prefix": "$GAMEDIR",
          "name": "create_prefix",
          "description": "Creating Wine prefix"
        }
      },
      {
        "task": {
          "prefix": "$GAMEDIR",
          "app": "corefonts",
          "description": "Installing fonts",
          "name": "winetricks"
        }
      },
      {
        "task": {
          "prefix": "$GAMEDIR",
          "app": "vcrun2017",
          "description": "Installing Visual C++ 2017",
          "name": "winetricks"
        }
      },
      {
        "task": {
          "prefix": "$GAMEDIR",
          "app": "dotnet40",
          "description": "Installing DotNet 4.0",
          "name": "winetricks"
        }
      },
      {
        "task": {
          "prefix": "$GAMEDIR",
          "app": "d3dx9",
          "description": "Installing Directx3D 9.0c",
          "name": "winetricks"
        }
      },
      {
        "task": {
          "prefix": "$GAMEDIR",
          "app": "win10",
          "description": "Setting Windows version to Windows 10",
          "name": "winetricks"
        }
      },
      {
        "execute": {
          "command": "mkdir -p \"$GAMEDIR/drive_c/Program Files (x86)/Return of Reckoning/\""
        }
      },
      {
        "move": {
          "src": "launcher",
          "dst": "$GAMEDIR/drive_c/Program Files (x86)/Return of Reckoning/RoRLauncher.exe"
        }
      },
      {
        "task": {
          "prefix": "$GAMEDIR",
          "executable": "launcher",
          "name": "wineexec"
        }
      }
    ]
  },
  "content": "files:\n- launcher: https://launcher.returnofreckoning.com/RoRLauncher.exe\ngame:\n  arch: win64\n  args: -maploadinfo\n  exe: drive_c/Program Files (x86)/Return of Reckoning/RoRLauncher.exe\n  prefix: $GAMEDIR\ninstaller:\n- task:\n    description: Creating Wine prefix\n    name: create_prefix\n    prefix: $GAMEDIR\n- task:\n    app: corefonts\n    description: Installing fonts\n    name: winetricks\n    prefix: $GAMEDIR\n- task:\n    app: vcrun2017\n    description: Installing Visual C++ 2017\n    name: winetricks\n    prefix: $GAMEDIR\n- task:\n    app: dotnet40\n    description: Installing DotNet 4.0\n    name: winetricks\n    prefix: $GAMEDIR\n- task:\n    app: d3dx9\n    description: Installing Directx3D 9.0c\n    name: winetricks\n    prefix: $GAMEDIR\n- task:\n    app: win10\n    description: Setting Windows version to Windows 10\n    name: winetricks\n    prefix: $GAMEDIR\n- execute:\n    command: mkdir -p \"$GAMEDIR/drive_c/Program Files (x86)/Return of Reckoning/\"\n- move:\n    dst: $GAMEDIR/drive_c/Program Files (x86)/Return of Reckoning/RoRLauncher.exe\n    src: launcher\n- task:\n    executable: launcher\n    name: wineexec\n    prefix: $GAMEDIR\nsystem:\n  env:\n    DXVK_HUD: 0\n    DXVK_LOG_LEVEL: none\n    DXVK_STATE_CACHE: 1\n    DXVK_STATE_CACHE_PATH: $GAMEDIR\n    __GL_SHADER_DISK_CACHE: 1\n    __GL_SHADER_DISK_CACHE_PATH: $GAMEDIR\n    mesa_glthread: 'true'\nwine:\n  dxvk: true\n  esync: true\n"
}