{
  "id": 16354,
  "game_id": 27299,
  "game_slug": "return-of-reckoning",
  "name": "Return of Reckoning",
  "year": 2019,
  "user": "Bragga",
  "runner": "wine",
  "slug": "return-of-reckoning-online-private-serve",
  "version": "Online Private Server",
  "description": "files:\r\n- lotro_installer: http://launcher.returnofreckoning.com/RoRLauncher.exe\r\n\r\n  prefix: $GAMEDIR\r\ninstaller:\r\n- task:\r\n    description: Creating Wine prefix\r\n    name: create_prefix\r\n    prefix: $GAMEDIR\r\n- task:\r\n    app: corefonts\r\n    description: Installing fonts\r\n    name: winetricks\r\n    prefix: $GAMEDIR\r\n- task:\r\n    app: vcrun2017\r\n    description: Setting Windows version to Visual C++ 2017",
  "notes": "",
  "created_at": "2019-10-22T14:28:15.501651Z",
  "updated_at": "2020-01-23T02:57:17.465791Z",
  "draft": true,
  "published": false,
  "published_by": null,
  "rating": "",
  "steamid": null,
  "gogid": null,
  "gogslug": "",
  "humblestoreid": "",
  "script": {
    "files": [
      {
        "ror_installer": "https://launcher.returnofreckoning.com/RoRInstaller.exe"
      }
    ],
    "game": {
      "prefix": "$GAMEDIR",
      "exe": "$GAMEDIR/drive_c/Program Files/Return of Reckoning/"
    },
    "wine": {
      "esync": true,
      "dxvk": true
    },
    "installer": [
      {
        "task": {
          "prefix": "$GAMEDIR",
          "name": "create_prefix",
          "description": "Creating Wine prefix"
        }
      },
      {
        "task": {
          "prefix": "$GAMEDIR",
          "app": "corefonts",
          "description": "Installing fonts",
          "name": "winetricks"
        }
      },
      {
        "task": {
          "prefix": "$GAMEDIR",
          "app": "vcrun2017",
          "description": "Setting Windows version to Visual C++ 2017",
          "name": "winetricks"
        }
      },
      {
        "task": {
          "prefix": "$GAMEDIR",
          "app": "win10",
          "description": "Setting Windows version to Windows10",
          "name": "winetricks"
        }
      },
      {
        "task": {
          "prefix": "$GAMEDIR",
          "executable": "lotro_installer",
          "name": "wineexec",
          "args": "--mode unattended"
        }
      }
    ]
  },
  "content": "files:\n- ror_installer: https://launcher.returnofreckoning.com/RoRInstaller.exe\ngame:\n  exe: $GAMEDIR/drive_c/Program Files/Return of Reckoning/\n  prefix: $GAMEDIR\ninstaller:\n- task:\n    description: Creating Wine prefix\n    name: create_prefix\n    prefix: $GAMEDIR\n- task:\n    app: corefonts\n    description: Installing fonts\n    name: winetricks\n    prefix: $GAMEDIR\n- task:\n    app: vcrun2017\n    description: Setting Windows version to Visual C++ 2017\n    name: winetricks\n    prefix: $GAMEDIR\n- task:\n    app: win10\n    description: Setting Windows version to Windows10\n    name: winetricks\n    prefix: $GAMEDIR\n- task:\n    args: --mode unattended\n    executable: lotro_installer\n    name: wineexec\n    prefix: $GAMEDIR\nwine:\n  dxvk: true\n  esync: true\n"
}