{
  "id": 2831,
  "game_id": 4810,
  "game_slug": "trackmania-nation-forever",
  "name": "TrackMania Nations Forever",
  "year": 2008,
  "user": "ssf",
  "runner": "wine",
  "slug": "trackmania-nations-forever-retail-nodrm",
  "version": "Retail (NoDRM)",
  "description": null,
  "notes": "",
  "created_at": "2016-10-02T23:33:47.195000Z",
  "updated_at": "2017-12-21T15:46:59.268961Z",
  "draft": false,
  "published": true,
  "published_by": null,
  "rating": "",
  "steamid": 11020,
  "gogid": null,
  "gogslug": "",
  "humblestoreid": "",
  "script": {
    "game": {
      "exe": "drive_c/Program Files/TmNationsForever/TmForeverLauncher.exe",
      "arch": "win32",
      "prefix": "$GAMEDIR"
    },
    "installer": [
      {
        "task": {
          "description": "Creating Wine prefix",
          "prefix": "$GAMEDIR",
          "name": "create_prefix"
        }
      },
      {
        "task": {
          "path": "HKEY_CURRENT_USER\\Software\\Wine\\DllOverrides",
          "prefix": "$GAMEDIR",
          "name": "set_regedit",
          "value": "",
          "key": "winemenubuilder.exe",
          "type": "REG_SZ"
        }
      },
      {
        "task": {
          "executable": "game",
          "args": "/silent",
          "description": "Installing...",
          "prefix": "$GAMEDIR",
          "name": "wineexec"
        }
      },
      {
        "task": {
          "app": "sandbox",
          "silent": true,
          "description": "Disabling unused WINE features",
          "prefix": "$GAMEDIR",
          "name": "winetricks"
        }
      }
    ],
    "files": [
      {
        "game": "http://files.trackmaniaforever.com/tmnationsforever_setup.exe"
      }
    ]
  },
  "content": "files:\n- game: http://files.trackmaniaforever.com/tmnationsforever_setup.exe\ngame:\n  arch: win32\n  exe: drive_c/Program Files/TmNationsForever/TmForeverLauncher.exe\n  prefix: $GAMEDIR\ninstaller:\n- task:\n    description: Creating Wine prefix\n    name: create_prefix\n    prefix: $GAMEDIR\n- task:\n    key: winemenubuilder.exe\n    name: set_regedit\n    path: HKEY_CURRENT_USER\\Software\\Wine\\DllOverrides\n    prefix: $GAMEDIR\n    type: REG_SZ\n    value: ''\n- task:\n    args: /silent\n    description: Installing...\n    executable: game\n    name: wineexec\n    prefix: $GAMEDIR\n- task:\n    app: sandbox\n    description: Disabling unused WINE features\n    name: winetricks\n    prefix: $GAMEDIR\n    silent: true\n"
}