{
  "id": 14973,
  "game_id": 5965,
  "game_slug": "lineage-ii",
  "name": "Lineage II",
  "year": null,
  "user": "xkazerike",
  "runner": "wine",
  "slug": "lineage-ii-ncsoft",
  "version": "NCsoft",
  "description": null,
  "notes": "",
  "created_at": "2019-08-11T17:53:38.527744Z",
  "updated_at": "2020-01-23T02:57:16.727234Z",
  "draft": false,
  "published": false,
  "published_by": null,
  "rating": "",
  "steamid": 373700,
  "gogid": null,
  "gogslug": "",
  "humblestoreid": "",
  "script": {
    "game": {
      "exe": "drive_c/Program Files/NCWest/NCLauncher/NCLauncher.exe",
      "arch": "win32"
    },
    "system": {
      "env": {
        "PBA_ENABLE": 1
      }
    },
    "wine": {
      "esync": true,
      "UseGLSL": "disabled"
    },
    "installer": [
      {
        "extract": {
          "file": "dx2010",
          "dst": "$CACHE/dxsetup"
        }
      },
      {
        "task": {
          "arch": "win32",
          "prefix": "$GAMEDIR",
          "name": "create_prefix"
        }
      },
      {
        "task": {
          "executable": "$CACHE/dxsetup/DXSETUP.exe",
          "arch": "win32",
          "args": "/silent",
          "prefix": "$GAMEDIR",
          "name": "wineexec"
        }
      },
      {
        "task": {
          "arch": "win32",
          "prefix": "$GAMEDIR",
          "name": "winekill"
        }
      },
      {
        "task": {
          "app": "vcrun2008 vcrun2013 physx corefonts",
          "arch": "win32",
          "prefix": "$GAMEDIR",
          "name": "winetricks"
        }
      },
      {
        "task": {
          "app": "dotnet472 win7",
          "arch": "win32",
          "description": "Installing .NET 4.7.2",
          "prefix": "$GAMEDIR",
          "name": "winetricks"
        }
      },
      {
        "task": {
          "executable": "aion",
          "arch": "win32",
          "prefix": "$GAMEDIR",
          "name": "wineexec"
        }
      }
    ],
    "files": [
      {
        "NCSOFTLAUNCHER": "http://launcher.patcher.ncsoft.com/NCLauncher2_Installer.exe?_ga=2.30289791.1342608396.1537224810-250827587.1536292294"
      },
      {
        "dx2010": "https://lutris.net/files/tools/directx-2010.tar.gz"
      }
    ]
  },
  "content": "files:\n- NCSOFTLAUNCHER: http://launcher.patcher.ncsoft.com/NCLauncher2_Installer.exe?_ga=2.30289791.1342608396.1537224810-250827587.1536292294\n- dx2010: https://lutris.net/files/tools/directx-2010.tar.gz\ngame:\n  arch: win32\n  exe: drive_c/Program Files/NCWest/NCLauncher/NCLauncher.exe\ninstaller:\n- extract:\n    dst: $CACHE/dxsetup\n    file: dx2010\n- task:\n    arch: win32\n    name: create_prefix\n    prefix: $GAMEDIR\n- task:\n    arch: win32\n    args: /silent\n    executable: $CACHE/dxsetup/DXSETUP.exe\n    name: wineexec\n    prefix: $GAMEDIR\n- task:\n    arch: win32\n    name: winekill\n    prefix: $GAMEDIR\n- task:\n    app: vcrun2008 vcrun2013 physx corefonts\n    arch: win32\n    name: winetricks\n    prefix: $GAMEDIR\n- task:\n    app: dotnet472 win7\n    arch: win32\n    description: Installing .NET 4.7.2\n    name: winetricks\n    prefix: $GAMEDIR\n- task:\n    arch: win32\n    executable: aion\n    name: wineexec\n    prefix: $GAMEDIR\nsystem:\n  env:\n    PBA_ENABLE: 1\nwine:\n  UseGLSL: disabled\n  esync: true\n"
}