{
  "id": 20718,
  "game_id": 33008,
  "game_slug": "the-incredible-machine-3",
  "name": "The Incredible Machine Version 3.0",
  "year": 1995,
  "user": "hydrian",
  "runner": "wine",
  "slug": "the-incredible-machine-3-gogwine",
  "version": "GOG+Wine",
  "description": "GOG's Installer.",
  "notes": "* Installer with throw some error messages. They can safely be ignored. \r\n* When the GOG installer completes, click 'Exit' and not 'Launch'.\r\n* Make sure the set audio setting in Wine Configuration to get audio working. Auto doesn't seem to work properly.\r\n* Throws \"No CD\" error on exit. It can be ignored.\r\n* No CD Audio. Seeing if it is possible.",
  "created_at": "2020-05-23T04:00:02.910000Z",
  "updated_at": "2020-05-24T06:16:22.460192Z",
  "draft": false,
  "published": true,
  "published_by": 20548,
  "rating": "",
  "steamid": null,
  "gogid": 1207664053,
  "gogslug": "the_incredible_machine_3",
  "humbleid": "",
  "humblestoreid": "",
  "humblestoreid_real": "",
  "script": {
    "files": [
      {
        "GOG_INSTALLER": "N/A:Please select the GOG installer"
      }
    ],
    "game": {
      "arch": "win32",
      "exe": "drive_c/GOG Games/TIM 3/TIMWIN.EXE",
      "gogid": 1207664053,
      "prefix": "$GAMEDIR"
    },
    "installer": [
      {
        "task": {
          "arch": "win32",
          "install_gecko": false,
          "install_mono": false,
          "name": "create_prefix",
          "prefix": "$GAMEDIR"
        }
      },
      {
        "task": {
          "app": "corefonts ariel",
          "arch": "win32",
          "description": "Installing fonts",
          "name": "winetricks",
          "prefix": "$GAMEDIR"
        }
      },
      {
        "task": {
          "arch": "win32",
          "args": "/SUPPRESSMSGBOXES /SP-",
          "description": "Running GOG Installer",
          "executable": "GOG_INSTALLER",
          "name": "wineexec",
          "prefix": "$GAMEDIR"
        }
      },
      {
        "task": {
          "key": "Version",
          "name": "set_regedit",
          "path": "HKEY_CURRENT_USER\\Software\\Wine\\AppDefaults\\TIMWIN.EXE",
          "prefix": "$GAMEDIR",
          "value": "win95"
        }
      },
      {
        "task": {
          "name": "winekill",
          "prefix": "$GAMEDIR"
        }
      }
    ],
    "system": {
      "exclude_processes": "HELP.EXE help.exe winevdm.exe"
    }
  },
  "content": "files:\n- GOG_INSTALLER: N/A:Please select the GOG installer\ngame:\n  arch: win32\n  exe: drive_c/GOG Games/TIM 3/TIMWIN.EXE\n  gogid: 1207664053\n  prefix: $GAMEDIR\ninstaller:\n- task:\n    arch: win32\n    install_gecko: false\n    install_mono: false\n    name: create_prefix\n    prefix: $GAMEDIR\n- task:\n    app: corefonts ariel\n    arch: win32\n    description: Installing fonts\n    name: winetricks\n    prefix: $GAMEDIR\n- task:\n    arch: win32\n    args: /SUPPRESSMSGBOXES /SP-\n    description: Running GOG Installer\n    executable: GOG_INSTALLER\n    name: wineexec\n    prefix: $GAMEDIR\n- task:\n    key: Version\n    name: set_regedit\n    path: HKEY_CURRENT_USER\\Software\\Wine\\AppDefaults\\TIMWIN.EXE\n    prefix: $GAMEDIR\n    value: win95\n- task:\n    name: winekill\n    prefix: $GAMEDIR\nsystem:\n  exclude_processes: HELP.EXE help.exe winevdm.exe\n"
}