{
  "id": 5537,
  "game_id": 379,
  "game_slug": "magicka",
  "name": "Magicka",
  "year": null,
  "user": "NuSuey",
  "runner": "winesteam",
  "slug": "magicka-steam",
  "version": "Steam",
  "description": null,
  "notes": "A Steam window will be stuck when \"Performing first time setup,\" when this happens, close the window; from the WINE System Tray, start up Magicka again. Eventually an error will be thrown and the game will start.",
  "created_at": "2017-08-26T22:11:29.969000Z",
  "updated_at": "2019-02-10T05:19:44.583044Z",
  "draft": false,
  "published": true,
  "published_by": 19464,
  "rating": "",
  "steamid": 42910,
  "gogid": null,
  "gogslug": "",
  "humblestoreid": "",
  "script": {
    "game": {
      "prefix": "$GAMEDIR/prefix",
      "appid": 42910,
      "arch": "win32"
    },
    "installer": [
      {
        "task": {
          "description": "Creating Wine prefix",
          "prefix": "$GAMEDIR",
          "arch": "win32",
          "name": "create_prefix"
        }
      },
      {
        "task": {
          "description": "Installing dotnet35",
          "arch": "win32",
          "prefix": "$GAMEDIR/prefix",
          "name": "winetricks",
          "app": "dotnet35sp1"
        }
      },
      {
        "task": {
          "description": "Installing xna31",
          "arch": "win32",
          "prefix": "$GAMEDIR/prefix",
          "name": "winetricks",
          "app": "xna31"
        }
      },
      {
        "task": {
          "description": "Installing xinput",
          "arch": "win32",
          "prefix": "$GAMEDIR/prefix",
          "name": "winetricks",
          "app": "xinput"
        }
      },
      {
        "task": {
          "description": "Installing vcrun2008",
          "prefix": "$GAMEDIR/prefix",
          "app": "vcrun2008 win7",
          "name": "winetricks"
        }
      }
    ]
  },
  "content": "game:\n  appid: 42910\n  arch: win32\n  prefix: $GAMEDIR/prefix\ninstaller:\n- task:\n    arch: win32\n    description: Creating Wine prefix\n    name: create_prefix\n    prefix: $GAMEDIR\n- task:\n    app: dotnet35sp1\n    arch: win32\n    description: Installing dotnet35\n    name: winetricks\n    prefix: $GAMEDIR/prefix\n- task:\n    app: xna31\n    arch: win32\n    description: Installing xna31\n    name: winetricks\n    prefix: $GAMEDIR/prefix\n- task:\n    app: xinput\n    arch: win32\n    description: Installing xinput\n    name: winetricks\n    prefix: $GAMEDIR/prefix\n- task:\n    app: vcrun2008 win7\n    description: Installing vcrun2008\n    name: winetricks\n    prefix: $GAMEDIR/prefix\n"
}