{
  "id": 16813,
  "game_id": 19032,
  "game_slug": "battlefield-3",
  "name": "Battlefield 3",
  "year": 2011,
  "user": "_stranger",
  "runner": "wine",
  "slug": "battlefield-3-dxvk-reshade",
  "version": "DXVK, ReShade",
  "description": "This installer will set up Origin in a suitable environment, compatible with DXVK and ReShade. BF3 has to be downloaded through Origin.",
  "notes": "For ReShade users, place ReShade32.dll in the game's folder and rename it to d3d11.dll\r\nRarely this will not work, in that case rename it to dxgi.dll\r\n\r\nDXVK is enabled by default. Make sure that you have followed this guide:\r\nhttps://github.com/lutris/lutris/wiki/How-to:-DXVK\r\n\r\nEsync is enabled by default. Make sure that you have followed this guide:\r\nhttps://github.com/lutris/lutris/wiki/How-to:-Esync\r\n\r\nIn order to launch the game with your Linux browser, a browser User Agent switcher has to be installed. For firefox this add-on is ideal:\r\nhttps://addons.mozilla.org/en-US/firefox/addon/ua-switcher\r\n\r\nWith your Linux browser go to:\r\nhttp://battlelog.battlefield.com/bf3/servers\r\nand set your User Agent to IE11 for that domain.\r\n\r\nIf you use NoScript make sure to add an exception for the following domains:\r\n    - battlefield.com\r\n    - akamaihd.net\r\n    - 127.0.0.1\r\n\r\nThe game is set to run in a vitrual desktop by default. That is because Alt+Tab does not work when the game is in fullscreen mode.\r\nMake sure to set the virtual dekstop resolution to your monitor's resolution in the settings.\r\n\r\nMake sure that the following Orgin features are disabled prior to launching the game:\r\n    - Origin WebHelper\r\n    - Origin InGame\r\n    - Origin Overlay for BF3\r\n\r\nIf the game window does not appear soon after joining a server click the windows button in the virtual desktop to have the window list updated.\r\n\r\nA DX error will pop out from time to time when launching the game. Just ignore it and launch the game again.\r\n\r\nIf an Origin update comes out do not allow Origin to update itself. Instead, launch lutris through a terminal and use the option \"Execute script\" on lutris. Follow the instructions the appear on the terminal.",
  "created_at": "2019-11-14T09:50:48.957000Z",
  "updated_at": "2020-03-08T11:56:53.136243Z",
  "draft": false,
  "published": true,
  "published_by": 20548,
  "rating": "",
  "steamid": null,
  "gogid": null,
  "gogslug": "",
  "humblestoreid": "",
  "script": {
    "files": [
      {
        "directx": "https://download.microsoft.com/download/1/7/1/1718CCC4-6315-4D8E-9543-8E28A4E18C4C/dxwebsetup.exe"
      },
      {
        "updater": "https://lutris.nyc3.cdn.digitaloceanspaces.com/games/origin/updateorigin.sh"
      },
      {
        "origin": "https://download.dm.origin.com/origin/live/OriginThinSetup.exe"
      }
    ],
    "installer": [
      {
        "task": {
          "arch": "win64",
          "description": "Creating Wine prefix...",
          "prefix": "$GAMEDIR",
          "name": "create_prefix"
        }
      },
      {
        "write_file": {
          "content": "dxgi.nvapiHack = False",
          "file": "$GAMEDIR/dxvk.conf"
        }
      },
      {
        "execute": {
          "command": "mkdir \"$GAMEDIR/cache\""
        }
      },
      {
        "chmodx": "updater"
      },
      {
        "merge": {
          "src": "updater",
          "dst": "$GAMEDIR/drive_c/Program Files (x86)/Origin"
        }
      },
      {
        "task": {
          "arch": "win64",
          "description": "Installing prerequisites...",
          "app": "win7 vcrun2008 d3dcompiler_47",
          "prefix": "$GAMEDIR",
          "name": "winetricks"
        }
      },
      {
        "task": {
          "arch": "win64",
          "executable": "directx",
          "description": "Running DirectX web installer...",
          "prefix": "$GAMEDIR",
          "name": "wineexec"
        }
      },
      {
        "task": {
          "arch": "win64",
          "prefix": "$GAMEDIR",
          "name": "wineexec",
          "exclude_processes": "QtWebEngineProcess.exe OriginWebHelperService.exe Origin.exe OriginClientService.exe",
          "args": "/silent",
          "executable": "origin",
          "description": "Installing Origin..."
        }
      },
      {
        "task": {
          "prefix": "$GAMEDIR",
          "name": "winekill"
        }
      }
    ],
    "system": {
      "exclude_processes": "QtWebEngineProcess.exe OriginWebHelperService.exe ActivationUI.exe",
      "env": {
        "__GL_SHADER_DISK_CACHE_PATH": "$GAMEDIR/cache",
        "DXVK_CONFIG_FILE": "$GAMEDIR/dxvk.conf",
        "WINE_LARGE_ADDRESS_AWARE": 1,
        "DXVK_HUD": "fps",
        "__GL_SHADER_DISK_CACHE": 1
      },
      "manual_command": "$GAMEDIR/drive_c/Program Files (x86)/Origin/updateorigin.sh"
    },
    "wine": {
      "esync": true,
      "overrides": {
        "d3d11,dxgi": "native, builtin",
        "nvapi,nvapi64": "disabled"
      },
      "Desktop": true,
      "version": "lutris-vkchildwindow-5.0-rc2-x86_64",
      "WineDesktop": "1366x768",
      "dxvk": true
    },
    "game": {
      "arch": "win64",
      "prefix": "$GAMEDIR",
      "exe": "drive_c/Program Files (x86)/Origin/Origin.exe"
    }
  },
  "content": "files:\n- directx: https://download.microsoft.com/download/1/7/1/1718CCC4-6315-4D8E-9543-8E28A4E18C4C/dxwebsetup.exe\n- updater: https://lutris.nyc3.cdn.digitaloceanspaces.com/games/origin/updateorigin.sh\n- origin: https://download.dm.origin.com/origin/live/OriginThinSetup.exe\ngame:\n  arch: win64\n  exe: drive_c/Program Files (x86)/Origin/Origin.exe\n  prefix: $GAMEDIR\ninstaller:\n- task:\n    arch: win64\n    description: Creating Wine prefix...\n    name: create_prefix\n    prefix: $GAMEDIR\n- write_file:\n    content: dxgi.nvapiHack = False\n    file: $GAMEDIR/dxvk.conf\n- execute:\n    command: mkdir \"$GAMEDIR/cache\"\n- chmodx: updater\n- merge:\n    dst: $GAMEDIR/drive_c/Program Files (x86)/Origin\n    src: updater\n- task:\n    app: win7 vcrun2008 d3dcompiler_47\n    arch: win64\n    description: Installing prerequisites...\n    name: winetricks\n    prefix: $GAMEDIR\n- task:\n    arch: win64\n    description: Running DirectX web installer...\n    executable: directx\n    name: wineexec\n    prefix: $GAMEDIR\n- task:\n    arch: win64\n    args: /silent\n    description: Installing Origin...\n    exclude_processes: QtWebEngineProcess.exe OriginWebHelperService.exe Origin.exe\n      OriginClientService.exe\n    executable: origin\n    name: wineexec\n    prefix: $GAMEDIR\n- task:\n    name: winekill\n    prefix: $GAMEDIR\nsystem:\n  env:\n    DXVK_CONFIG_FILE: $GAMEDIR/dxvk.conf\n    DXVK_HUD: fps\n    WINE_LARGE_ADDRESS_AWARE: 1\n    __GL_SHADER_DISK_CACHE: 1\n    __GL_SHADER_DISK_CACHE_PATH: $GAMEDIR/cache\n  exclude_processes: QtWebEngineProcess.exe OriginWebHelperService.exe ActivationUI.exe\n  manual_command: $GAMEDIR/drive_c/Program Files (x86)/Origin/updateorigin.sh\nwine:\n  Desktop: true\n  WineDesktop: 1366x768\n  dxvk: true\n  esync: true\n  overrides:\n    d3d11,dxgi: native, builtin\n    nvapi,nvapi64: disabled\n  version: lutris-vkchildwindow-5.0-rc2-x86_64\n"
}