{
  "id": 16872,
  "game_id": 153,
  "game_slug": "indiana-jones-and-the-fate-of-atlantis",
  "name": "Indiana Jones and the Fate of Atlantis",
  "year": 1992,
  "user": "legluondunet",
  "runner": "scummvm",
  "slug": "indiana-jones-and-the-fate-of-gog-multi5",
  "version": "GOG + MULTI5",
  "description": "This script will install \"Indiana Jones and the Fate of Atlantis\" GOG edition for ScummVM.\r\nDuring install please let all options by default.\r\nThanks to the people who contributed to play this game in the best conditions.",
  "notes": "- This script is only compatible with the game installation file for Windows in exe format provided by GOG.\r\n- Multilanguage: you could choose your preferred subtitles language during install between english, french, italian, spanish and german. The voices will still stay in english.\r\n- Please report issue concerning this script on my Github page:\r\nhttps://github.com/legluondunet/MyLittleLutrisScripts/",
  "created_at": "2019-11-17T11:30:25.595000Z",
  "updated_at": "2020-02-02T09:38:52.480863Z",
  "draft": false,
  "published": true,
  "published_by": 494,
  "rating": "",
  "steamid": 6010,
  "gogid": 1207666293,
  "gogslug": "indiana_jones_and_the_fate_of_atlantis",
  "humblestoreid": "",
  "script": {
    "game": {
      "game_id": "atlantis",
      "path": "$GAMEDIR"
    },
    "custom-name": "Indiana Jones and the Fate of Atlantis - GOG",
    "scummvm": {
      "fullscreen": true,
      "aspect": true
    },
    "installer": [
      {
        "extract": {
          "file": "inno",
          "dst": "$CACHE/innoextract"
        }
      },
      {
        "execute": {
          "file": "$CACHE/innoextract/innoextract",
          "args": "--extract $gog --output-dir \"$CACHE/indy\""
        }
      },
      {
        "merge": {
          "dst": "$GAMEDIR/",
          "src": "$CACHE/indy"
        }
      },
      {
        "extract": {
          "dst": "$CACHE",
          "src": "multi5"
        }
      },
      {
        "input_menu": {
          "options": [
            {
              "keep": "I prefer to keep the default install language"
            },
            {
              "fr": "French"
            },
            {
              "sp": "Spanish"
            },
            {
              "ge": "German"
            },
            {
              "it": "Italian"
            }
          ],
          "id": "LANG",
          "preselect": "keep",
          "description": "Please choose your preferred subtitles language:"
        }
      },
      {
        "merge": {
          "dst": "$GAMEDIR",
          "src": "$CACHE/$INPUT_LANG"
        }
      },
      {
        "execute": {
          "command": "cd $GAMEDIR; cp other/ATLANTIS.ICO other/HELPME.DOC . ; rm -f -r app commonappdata other __redist scummvm __support tmp goggame-1207666293.* ;"
        }
      }
    ],
    "files": [
      {
        "multi5": "https://github.com/legluondunet/MyLittleLutrisScripts/raw/master/Indiana%20Jones%20and%20the%20Fate%20of%20Atlantis/indi4_multi5.zip"
      },
      {
        "inno": "http://constexpr.org/innoextract/files/snapshots/innoextract-1.8-dev-2019-01-13/innoextract-1.8-dev-2019-01-13-linux.tar.xz"
      },
      {
        "gog": "N/A:Please select the game Windows setup exe file downloaded from GOG"
      }
    ]
  },
  "content": "custom-name: Indiana Jones and the Fate of Atlantis - GOG\nfiles:\n- multi5: https://github.com/legluondunet/MyLittleLutrisScripts/raw/master/Indiana%20Jones%20and%20the%20Fate%20of%20Atlantis/indi4_multi5.zip\n- inno: http://constexpr.org/innoextract/files/snapshots/innoextract-1.8-dev-2019-01-13/innoextract-1.8-dev-2019-01-13-linux.tar.xz\n- gog: N/A:Please select the game Windows setup exe file downloaded from GOG\ngame:\n  game_id: atlantis\n  path: $GAMEDIR\ninstaller:\n- extract:\n    dst: $CACHE/innoextract\n    file: inno\n- execute:\n    args: --extract $gog --output-dir \"$CACHE/indy\"\n    file: $CACHE/innoextract/innoextract\n- merge:\n    dst: $GAMEDIR/\n    src: $CACHE/indy\n- extract:\n    dst: $CACHE\n    src: multi5\n- input_menu:\n    description: 'Please choose your preferred subtitles language:'\n    id: LANG\n    options:\n    - keep: I prefer to keep the default install language\n    - fr: French\n    - sp: Spanish\n    - ge: German\n    - it: Italian\n    preselect: keep\n- merge:\n    dst: $GAMEDIR\n    src: $CACHE/$INPUT_LANG\n- execute:\n    command: cd $GAMEDIR; cp other/ATLANTIS.ICO other/HELPME.DOC . ; rm -f -r app\n      commonappdata other __redist scummvm __support tmp goggame-1207666293.* ;\nscummvm:\n  aspect: true\n  fullscreen: true\n"
}