{
  "id": 23017,
  "game_id": 38440,
  "game_slug": "cbm-prg-studio",
  "name": "CBM prg Studio",
  "year": null,
  "user": "vanstaveren",
  "runner": "wine",
  "slug": "cbm-prg-studio-3140-dotnet46-vulkan",
  "version": "3.14.0-dotnet46-vulkan",
  "description": "with MS.NET 4.6",
  "notes": "",
  "created_at": "2020-08-23T16:25:14.258026Z",
  "updated_at": "2020-08-23T16:25:14.258052Z",
  "draft": false,
  "published": false,
  "published_by": null,
  "rating": "",
  "steamid": null,
  "gogid": null,
  "gogslug": "",
  "humbleid": "",
  "humblestoreid": "",
  "humblestoreid_real": "",
  "script": {
    "files": [
      {
        "setup.zip": "https://download1857.mediafire.com/7ca7tij4wwzg/ntnsjydkwile3xz/CBMprgStudio_3_14_0_Setup_x86.zip"
      }
    ],
    "game": {
      "arch": "win64",
      "exe": "$GAMEDIR/drive_c/Program Files (x86)/CBM prg Studio/CBMPrgStudio.exe",
      "prefix": "$GAMEDIR"
    },
    "installer": [
      {
        "task": {
          "arch": "win64",
          "description": "Creating 64-bit prefix ...",
          "name": "create_prefix",
          "prefix": "$GAMEDIR"
        }
      },
      {
        "task": {
          "app": "vcrun2010",
          "arch": "win64",
          "description": "Visual C++ 2010 libraries ...",
          "name": "winetricks",
          "prefix": "$GAMEDIR"
        }
      },
      {
        "task": {
          "app": "dotnet46",
          "arch": "win64",
          "description": "MS.NET 4.6 ...",
          "name": "winetricks",
          "prefix": "$GAMEDIR"
        }
      },
      {
        "task": {
          "app": "win81",
          "arch": "win64",
          "description": "Windows version 8.1 ...",
          "name": "winetricks",
          "prefix": "$GAMEDIR"
        }
      },
      {
        "task": {
          "app": "dxvk",
          "arch": "win64",
          "description": "Vulkan ...",
          "name": "winetricks",
          "prefix": "$GAMEDIR"
        }
      },
      {
        "extract": {
          "description": "Extracting setup.zip ...",
          "dst": "$GAMEDIR",
          "file": "setup.zip"
        }
      },
      {
        "chmodx": "$GAMEDIR/CBMprgStudio_3_14_0_Setup_x86.exe"
      },
      {
        "task": {
          "description": "CBM .prg Studio ...",
          "executable": "$GAMEDIR/CBMprgStudio_3_14_0_Setup_x86.exe",
          "name": "wineexec",
          "prefix": "$GAMEDIR"
        }
      }
    ],
    "system": {
      "disable_compositor": true
    },
    "wine": {
      "dxvk": true
    }
  },
  "content": "files:\n- setup.zip: https://download1857.mediafire.com/7ca7tij4wwzg/ntnsjydkwile3xz/CBMprgStudio_3_14_0_Setup_x86.zip\ngame:\n  arch: win64\n  exe: $GAMEDIR/drive_c/Program Files (x86)/CBM prg Studio/CBMPrgStudio.exe\n  prefix: $GAMEDIR\ninstaller:\n- task:\n    arch: win64\n    description: Creating 64-bit prefix ...\n    name: create_prefix\n    prefix: $GAMEDIR\n- task:\n    app: vcrun2010\n    arch: win64\n    description: Visual C++ 2010 libraries ...\n    name: winetricks\n    prefix: $GAMEDIR\n- task:\n    app: dotnet46\n    arch: win64\n    description: MS.NET 4.6 ...\n    name: winetricks\n    prefix: $GAMEDIR\n- task:\n    app: win81\n    arch: win64\n    description: Windows version 8.1 ...\n    name: winetricks\n    prefix: $GAMEDIR\n- task:\n    app: dxvk\n    arch: win64\n    description: Vulkan ...\n    name: winetricks\n    prefix: $GAMEDIR\n- extract:\n    description: Extracting setup.zip ...\n    dst: $GAMEDIR\n    file: setup.zip\n- chmodx: $GAMEDIR/CBMprgStudio_3_14_0_Setup_x86.exe\n- task:\n    description: CBM .prg Studio ...\n    executable: $GAMEDIR/CBMprgStudio_3_14_0_Setup_x86.exe\n    name: wineexec\n    prefix: $GAMEDIR\nsystem:\n  disable_compositor: true\nwine:\n  dxvk: true\n"
}