{
  "id": 7622,
  "game_id": 16435,
  "game_slug": "magic-the-gathering-online",
  "name": "Magic The Gathering Online",
  "year": null,
  "user": "JayCoda",
  "runner": "wine",
  "slug": "magic-the-gathering-online-regular",
  "version": "Regular",
  "description": null,
  "notes": "The file path to the exe includes what looks like randomly generated folders and because of that Lutris can't set the exe for you. To do this manually you must open the Lutris Config window, select the Game options tab, click browse next to the executable field, and navigate to the exe located at:\r\n\r\n<tt>$HOME/Games/magic-the-gathering-online/drive_c/users/$USER/AppData/Local/Apps/2.0/Randomletters/Randomletters/mtgo...tionRandomletters/MGTO.exe</tt>",
  "created_at": "2018-03-21T20:18:18.759000Z",
  "updated_at": "2020-01-23T02:57:19.203132Z",
  "draft": false,
  "published": true,
  "published_by": 51687,
  "rating": "",
  "steamid": null,
  "gogid": null,
  "gogslug": "",
  "humblestoreid": "",
  "script": {
    "installer": [
      {
        "task": {
          "arch": "win32",
          "prefix": "$GAMEDIR",
          "name": "create_prefix"
        }
      },
      {
        "task": {
          "arch": "win32",
          "executable": "wineboot",
          "description": "Simulating Windows reboot.",
          "prefix": "$GAMEDIR",
          "name": "wineexec"
        }
      },
      {
        "task": {
          "arch": "win32",
          "app": "sound=pulse winegstreamer=builtin",
          "prefix": "$GAMEDIR",
          "name": "winetricks"
        }
      },
      {
        "task": {
          "arch": "win32",
          "app": "corefonts",
          "prefix": "$GAMEDIR",
          "name": "winetricks"
        }
      },
      {
        "task": {
          "arch": "win32",
          "app": "dotnet46",
          "prefix": "$GAMEDIR",
          "name": "winetricks"
        }
      },
      {
        "task": {
          "arch": "win32",
          "app": "win7",
          "prefix": "$GAMEDIR",
          "name": "winetricks"
        }
      },
      {
        "task": {
          "arch": "win32",
          "app": "gdiplus",
          "prefix": "$GAMEDIR",
          "name": "winetricks"
        }
      },
      {
        "task": {
          "arch": "win32",
          "app": "gdiplus=native",
          "prefix": "$GAMEDIR",
          "name": "winetricks"
        }
      },
      {
        "task": {
          "arch": "win32",
          "app": "ddr=gdi",
          "prefix": "$GAMEDIR",
          "name": "winetricks"
        }
      },
      {
        "task": {
          "prefix": "$GAMEDIR",
          "name": "wineexec",
          "arch": "win32",
          "args": "-s",
          "executable": "wineboot",
          "description": "Simulating Windows reboot."
        }
      },
      {
        "task": {
          "arch": "win32",
          "exclude_processes": "dfsvc.exe",
          "executable": "setup",
          "prefix": "$GAMEDIR",
          "name": "wineexec"
        }
      },
      {
        "execute": {
          "command": "find $GAMEDIR/drive_c/ -name 'MTGO.exe' -exec sh -c 'ln -vs \"$(dirname \"$0\")\" \"$1\" | cut -c 2-' {} $GAMEDIR/drive_c/MTGO \\;"
        }
      },
      {
        "merge": {
          "src": "setup",
          "dst": "$GAMEDIR/drive_c/MTGO"
        }
      }
    ],
    "files": [
      {
        "setup": {
          "url": "http://mtgoclientdepot.onlinegaming.wizards.com/setup.exe",
          "filename": "setup.exe"
        }
      }
    ],
    "system": {
      "single_cpu": true
    },
    "game": {
      "prefix": "$GAMEDIR",
      "exe": "$GAMEDIR/drive_c/MTGO/setup.exe"
    }
  },
  "content": "files:\n- setup:\n    filename: setup.exe\n    url: http://mtgoclientdepot.onlinegaming.wizards.com/setup.exe\ngame:\n  exe: $GAMEDIR/drive_c/MTGO/setup.exe\n  prefix: $GAMEDIR\ninstaller:\n- task:\n    arch: win32\n    name: create_prefix\n    prefix: $GAMEDIR\n- task:\n    arch: win32\n    description: Simulating Windows reboot.\n    executable: wineboot\n    name: wineexec\n    prefix: $GAMEDIR\n- task:\n    app: sound=pulse winegstreamer=builtin\n    arch: win32\n    name: winetricks\n    prefix: $GAMEDIR\n- task:\n    app: corefonts\n    arch: win32\n    name: winetricks\n    prefix: $GAMEDIR\n- task:\n    app: dotnet46\n    arch: win32\n    name: winetricks\n    prefix: $GAMEDIR\n- task:\n    app: win7\n    arch: win32\n    name: winetricks\n    prefix: $GAMEDIR\n- task:\n    app: gdiplus\n    arch: win32\n    name: winetricks\n    prefix: $GAMEDIR\n- task:\n    app: gdiplus=native\n    arch: win32\n    name: winetricks\n    prefix: $GAMEDIR\n- task:\n    app: ddr=gdi\n    arch: win32\n    name: winetricks\n    prefix: $GAMEDIR\n- task:\n    arch: win32\n    args: -s\n    description: Simulating Windows reboot.\n    executable: wineboot\n    name: wineexec\n    prefix: $GAMEDIR\n- task:\n    arch: win32\n    exclude_processes: dfsvc.exe\n    executable: setup\n    name: wineexec\n    prefix: $GAMEDIR\n- execute:\n    command: find $GAMEDIR/drive_c/ -name 'MTGO.exe' -exec sh -c 'ln -vs \"$(dirname\n      \"$0\")\" \"$1\" | cut -c 2-' {} $GAMEDIR/drive_c/MTGO \\;\n- merge:\n    dst: $GAMEDIR/drive_c/MTGO\n    src: setup\nsystem:\n  single_cpu: true\n"
}