{
  "id": 13087,
  "game_id": 2230,
  "game_slug": "ys-the-oath-in-felghana",
  "name": "Ys: The Oath in Felghana",
  "year": null,
  "user": "dugan-c",
  "runner": "wine",
  "slug": "ys-the-oath-in-felghana-gog",
  "version": "GOG",
  "description": null,
  "notes": "",
  "created_at": "2019-04-25T03:22:36.726000Z",
  "updated_at": "2019-04-25T03:29:51.321454Z",
  "draft": false,
  "published": true,
  "published_by": 19464,
  "rating": "",
  "steamid": 207320,
  "gogid": 1422357788,
  "gogslug": "ys_the_oath_in_felghana",
  "humblestoreid": "",
  "script": {
    "installer": [
      {
        "task": {
          "arch": "win32",
          "prefix": "$GAMEDIR",
          "name": "create_prefix"
        }
      },
      {
        "task": {
          "arch": "win32",
          "app": "vcrun2008",
          "prefix": "$GAMEDIR",
          "name": "winetricks"
        }
      },
      {
        "task": {
          "arch": "win32",
          "description": "Installing Quartz.",
          "app": "quartz",
          "prefix": "$GAMEDIR",
          "name": "winetricks"
        }
      },
      {
        "task": {
          "arch": "win32",
          "description": "Installing Amstream.",
          "app": "amstream",
          "prefix": "$GAMEDIR",
          "name": "winetricks"
        }
      },
      {
        "task": {
          "arch": "win32",
          "description": "Installing Xvid.",
          "app": "xvid win7",
          "prefix": "$GAMEDIR",
          "name": "winetricks"
        }
      },
      {
        "task": {
          "prefix": "$GAMEDIR",
          "name": "wineexec",
          "arch": "win32",
          "args": "-u",
          "executable": "wineboot",
          "description": "Simulating Windows reboot."
        }
      },
      {
        "task": {
          "prefix": "$GAMEDIR",
          "name": "wineexec",
          "arch": "win32",
          "args": "/SP- /SUPPRESSMSGBOXES /NOCANCEL",
          "executable": "setup",
          "description": "Installing The Oath in Felghana"
        }
      },
      {
        "task": {
          "arch": "win32",
          "executable": "$GAMEDIR/drive_c/GOG Games/Ys The Oath in Felghana/config_dx9.exe",
          "description": "Setting game options.",
          "prefix": "$GAMEDIR",
          "name": "wineexec"
        }
      }
    ],
    "files": [
      {
        "setup": "N/A:Select the game's setup file"
      }
    ],
    "wine": {
      "overrides": {
        "winegstreamer": "disabled"
      }
    },
    "game": {
      "arch": "win32",
      "prefix": "$GAMEDIR",
      "exe": "drive_c/GOG Games/Ys The Oath in Felghana/ysf_win_dx9.exe"
    }
  },
  "content": "files:\n- setup: N/A:Select the game's setup file\ngame:\n  arch: win32\n  exe: drive_c/GOG Games/Ys The Oath in Felghana/ysf_win_dx9.exe\n  prefix: $GAMEDIR\ninstaller:\n- task:\n    arch: win32\n    name: create_prefix\n    prefix: $GAMEDIR\n- task:\n    app: vcrun2008\n    arch: win32\n    name: winetricks\n    prefix: $GAMEDIR\n- task:\n    app: quartz\n    arch: win32\n    description: Installing Quartz.\n    name: winetricks\n    prefix: $GAMEDIR\n- task:\n    app: amstream\n    arch: win32\n    description: Installing Amstream.\n    name: winetricks\n    prefix: $GAMEDIR\n- task:\n    app: xvid win7\n    arch: win32\n    description: Installing Xvid.\n    name: winetricks\n    prefix: $GAMEDIR\n- task:\n    arch: win32\n    args: -u\n    description: Simulating Windows reboot.\n    executable: wineboot\n    name: wineexec\n    prefix: $GAMEDIR\n- task:\n    arch: win32\n    args: /SP- /SUPPRESSMSGBOXES /NOCANCEL\n    description: Installing The Oath in Felghana\n    executable: setup\n    name: wineexec\n    prefix: $GAMEDIR\n- task:\n    arch: win32\n    description: Setting game options.\n    executable: $GAMEDIR/drive_c/GOG Games/Ys The Oath in Felghana/config_dx9.exe\n    name: wineexec\n    prefix: $GAMEDIR\nwine:\n  overrides:\n    winegstreamer: disabled\n"
}