{
  "id": 14853,
  "game_id": 11513,
  "game_slug": "origin",
  "name": "Origin",
  "year": 2011,
  "user": "halbGefressen",
  "runner": "wine",
  "slug": "origin-change-me-2",
  "version": "Change Me",
  "description": "Installs the latest version of Origin with DXVK",
  "notes": "Please read before installing: <a href=\"https://github.com/lutris/lutris/wiki/Game:-Origin\">https://github.com/lutris/lutris/wiki/Game:-Origin</a>",
  "created_at": "2019-08-03T20:17:08.541413Z",
  "updated_at": "2019-08-03T20:17:08.541447Z",
  "draft": false,
  "published": false,
  "published_by": 19464,
  "rating": "",
  "steamid": null,
  "gogid": null,
  "gogslug": "",
  "humblestoreid": "",
  "script": {
    "game": {
      "exe": "drive_c/Program Files (x86)/Origin/Origin.exe",
      "arch": "win64",
      "prefix": "$GAMEDIR"
    },
    "files": [
      {
        "client": "https://origin-a.akamaihd.net/Origin-Client-Download/origin/live/OriginThinSetup.exe"
      },
      {
        "updater": "https://raw.githubusercontent.com/DrDoctor13/wine-origin-updater/master/updateorigin.sh"
      }
    ],
    "system": {
      "env": {
        "STAGING_SHARED_MEMORY": 0,
        "DXVK_CONFIG_FILE": "$GAMEDIR/dxvk.conf",
        "__GL_SHADER_DISK_CACHE": 1,
        "DXVK_HUD": 0,
        "__GL_SHADER_DISK_CACHE_PATH": "$GAMEDIR/nv-shaders"
      },
      "exclude_processes": "QtWebEngineProcess.exe ActivationUI.exe OriginWebHelperService.exe"
    },
    "installer": [
      {
        "task": {
          "description": "Creating Wine prefix",
          "prefix": "$GAMEDIR",
          "arch": "win64",
          "name": "create_prefix"
        }
      },
      {
        "execute": {
          "command": "mkdir \"$GAMEDIR/nv-shaders\""
        }
      },
      {
        "input_menu": {
          "description": "Setting DXVK workarounds please choose your GPU:",
          "id": "GPU",
          "options": [
            {
              "#Not needed for AMD. Ignore this.": "AMD"
            },
            {
              "dxgi.nvapiHack = False\nd3d11.zeroInitWorkgroupMemory = True": "Nvidia"
            }
          ],
          "preselect": "#Not needed for AMD. Ignore this."
        }
      },
      {
        "write_file": {
          "content": "$INPUT_GPU",
          "file": "$GAMEDIR/dxvk.conf"
        }
      },
      {
        "task": {
          "arch": "win64",
          "prefix": "$GAMEDIR",
          "name": "winetricks",
          "app": "nocrashdialog vcrun2017 win7"
        }
      },
      {
        "task": {
          "name": "wineexec",
          "args": "/silent",
          "description": "Installing Origin... Login window will pop-up and close.",
          "prefix": "$GAMEDIR",
          "executable": "client",
          "arch": "win64",
          "exclude_processes": "Origin.exe OriginClientService.exe OriginWebHelperService.exe QtWebEngineProcess.exe"
        }
      },
      {
        "task": {
          "prefix": "$GAMEDIR",
          "arch": "win64",
          "name": "winekill"
        }
      },
      {
        "chmodx": "updater"
      },
      {
        "merge": {
          "dst": "$GAMEDIR/drive_c/Program Files (x86)/Origin",
          "src": "updater"
        }
      }
    ],
    "wine": {
      "overrides": {
        "xaudio2_7": "native,builtin",
        "nvapi,nvapi64": "disabled"
      },
      "dxvk": true,
      "version": "tkg-protonified-3.21-x86_64"
    }
  },
  "content": "files:\n- client: https://origin-a.akamaihd.net/Origin-Client-Download/origin/live/OriginThinSetup.exe\n- updater: https://raw.githubusercontent.com/DrDoctor13/wine-origin-updater/master/updateorigin.sh\ngame:\n  arch: win64\n  exe: drive_c/Program Files (x86)/Origin/Origin.exe\n  prefix: $GAMEDIR\ninstaller:\n- task:\n    arch: win64\n    description: Creating Wine prefix\n    name: create_prefix\n    prefix: $GAMEDIR\n- execute:\n    command: mkdir \"$GAMEDIR/nv-shaders\"\n- input_menu:\n    description: 'Setting DXVK workarounds please choose your GPU:'\n    id: GPU\n    options:\n    - '#Not needed for AMD. Ignore this.': AMD\n    - ? 'dxgi.nvapiHack = False\n\n        d3d11.zeroInitWorkgroupMemory = True'\n      : Nvidia\n    preselect: '#Not needed for AMD. Ignore this.'\n- write_file:\n    content: $INPUT_GPU\n    file: $GAMEDIR/dxvk.conf\n- task:\n    app: nocrashdialog vcrun2017 win7\n    arch: win64\n    name: winetricks\n    prefix: $GAMEDIR\n- task:\n    arch: win64\n    args: /silent\n    description: Installing Origin... Login window will pop-up and close.\n    exclude_processes: Origin.exe OriginClientService.exe OriginWebHelperService.exe\n      QtWebEngineProcess.exe\n    executable: client\n    name: wineexec\n    prefix: $GAMEDIR\n- task:\n    arch: win64\n    name: winekill\n    prefix: $GAMEDIR\n- chmodx: updater\n- merge:\n    dst: $GAMEDIR/drive_c/Program Files (x86)/Origin\n    src: updater\nsystem:\n  env:\n    DXVK_CONFIG_FILE: $GAMEDIR/dxvk.conf\n    DXVK_HUD: 0\n    STAGING_SHARED_MEMORY: 0\n    __GL_SHADER_DISK_CACHE: 1\n    __GL_SHADER_DISK_CACHE_PATH: $GAMEDIR/nv-shaders\n  exclude_processes: QtWebEngineProcess.exe ActivationUI.exe OriginWebHelperService.exe\nwine:\n  dxvk: true\n  overrides:\n    nvapi,nvapi64: disabled\n    xaudio2_7: native,builtin\n  version: tkg-protonified-3.21-x86_64\n"
}