{
  "id": 12693,
  "game_id": 11513,
  "game_slug": "origin",
  "name": "Origin",
  "year": 2011,
  "user": "citrusalex",
  "runner": "wine",
  "slug": "origin-legacy",
  "version": "Legacy",
  "description": "Uses outdated Origin meant for Windows XP. Doesn't support new games, but it's less buggy.",
  "notes": "",
  "created_at": "2019-04-08T20:15:15.084141Z",
  "updated_at": "2020-01-23T02:57:16.169528Z",
  "draft": false,
  "published": false,
  "published_by": null,
  "rating": "",
  "steamid": null,
  "gogid": null,
  "gogslug": "",
  "humblestoreid": "",
  "script": {
    "game": {
      "exe": "drive_c/Program Files/Origin/Origin.exe",
      "arch": "win32",
      "prefix": "$GAMEDIR"
    },
    "installer": [
      {
        "task": {
          "arch": "win32",
          "description": "Creating Wine Prefix...",
          "prefix": "$GAMEDIR",
          "name": "create_prefix"
        }
      },
      {
        "task": {
          "app": "nocrashdialog",
          "arch": "win32",
          "description": "Hiding annoying dialogs...",
          "prefix": "$GAMEDIR",
          "name": "winetricks"
        }
      },
      {
        "task": {
          "arch": "win32",
          "description": "Setting version to xp...",
          "prefix": "$GAMEDIR",
          "name": "set_regedit",
          "path": "HKEY_CURRENT_USER\\Software\\Wine",
          "value": "winxp",
          "key": "Version"
        }
      },
      {
        "task": {
          "prefix": "$GAMEDIR",
          "name": "winekill"
        }
      },
      {
        "task": {
          "executable": "origin",
          "arch": "win32",
          "description": "Installing Origin...",
          "prefix": "$GAMEDIR",
          "name": "wineexec",
          "exclude_processes": "Origin.exe OriginClientService.exe"
        }
      },
      {
        "task": {
          "prefix": "$GAMEDIR",
          "name": "winekill"
        }
      }
    ],
    "files": [
      {
        "origin": "https://origin-a.akamaihd.net/Origin-Client-Download/origin/legacy/OriginThinSetup.exe"
      }
    ]
  },
  "content": "files:\n- origin: https://origin-a.akamaihd.net/Origin-Client-Download/origin/legacy/OriginThinSetup.exe\ngame:\n  arch: win32\n  exe: drive_c/Program Files/Origin/Origin.exe\n  prefix: $GAMEDIR\ninstaller:\n- task:\n    arch: win32\n    description: Creating Wine Prefix...\n    name: create_prefix\n    prefix: $GAMEDIR\n- task:\n    app: nocrashdialog\n    arch: win32\n    description: Hiding annoying dialogs...\n    name: winetricks\n    prefix: $GAMEDIR\n- task:\n    arch: win32\n    description: Setting version to xp...\n    key: Version\n    name: set_regedit\n    path: HKEY_CURRENT_USER\\Software\\Wine\n    prefix: $GAMEDIR\n    value: winxp\n- task:\n    name: winekill\n    prefix: $GAMEDIR\n- task:\n    arch: win32\n    description: Installing Origin...\n    exclude_processes: Origin.exe OriginClientService.exe\n    executable: origin\n    name: wineexec\n    prefix: $GAMEDIR\n- task:\n    name: winekill\n    prefix: $GAMEDIR\n"
}