{
  "id": 2202,
  "game_id": 3707,
  "game_slug": "fable-anniversary",
  "name": "Fable Anniversary",
  "year": 2014,
  "user": "strider",
  "runner": "winesteam",
  "slug": "fable-anniversary-steam",
  "version": "Steam",
  "description": "",
  "notes": "Game might start minimized, click the Fable icon on your task bar to bring up the game window or run the game in a virtual desktop.",
  "created_at": "2016-06-26T04:02:53.640921Z",
  "updated_at": "2016-11-27T09:39:02.499616Z",
  "draft": false,
  "published": true,
  "published_by": null,
  "rating": "",
  "steamid": 288470,
  "gogid": null,
  "gogslug": "",
  "humblestoreid": "",
  "script": {
    "game": {
      "appid": 288470,
      "prefix": "$GAMEDIR/prefix"
    },
    "installer": [
      {
        "extract": {
          "file": "x360ce_dinput8",
          "dst": "$GAMEDIR/Binaries/Win32"
        }
      },
      {
        "task": {
          "app": "vcrun2010",
          "silent": true,
          "description": "Installing Visual C++ 2010 Runtime",
          "prefix": "$GAMEDIR/prefix",
          "name": "winetricks"
        }
      },
      {
        "task": {
          "app": "dotnet40",
          "silent": true,
          "description": "Installing .NET 4.0",
          "prefix": "$GAMEDIR/prefix",
          "name": "winetricks"
        }
      }
    ],
    "winesteam": {
      "StrictDrawOrdering": "enabled",
      "overrides": {
        "xinput1_3": "builtin",
        "dinput8": "native,builtin"
      },
      "xinput": true
    },
    "files": [
      {
        "x360ce_dinput8": "https://lutris.net/files/tools/x360ce-dinput8.tar.gz"
      }
    ]
  },
  "content": "files:\n- x360ce_dinput8: https://lutris.net/files/tools/x360ce-dinput8.tar.gz\ngame:\n  appid: 288470\n  prefix: $GAMEDIR/prefix\ninstaller:\n- extract:\n    dst: $GAMEDIR/Binaries/Win32\n    file: x360ce_dinput8\n- task:\n    app: vcrun2010\n    description: Installing Visual C++ 2010 Runtime\n    name: winetricks\n    prefix: $GAMEDIR/prefix\n    silent: true\n- task:\n    app: dotnet40\n    description: Installing .NET 4.0\n    name: winetricks\n    prefix: $GAMEDIR/prefix\n    silent: true\nwinesteam:\n  StrictDrawOrdering: enabled\n  overrides:\n    dinput8: native,builtin\n    xinput1_3: builtin\n  xinput: true\n"
}