{
  "id": 19089,
  "game_id": 11067,
  "game_slug": "xanadu-next",
  "name": "Xanadu Next",
  "year": null,
  "user": "DaiKaiser93",
  "runner": "wine",
  "slug": "xanadu-next-gog",
  "version": "GOG",
  "description": null,
  "notes": "The game minimizes on launch, you just have to click on it to maximize it again.",
  "created_at": "2020-03-23T08:05:08.735000Z",
  "updated_at": "2020-03-24T09:49:45.356514Z",
  "draft": false,
  "published": true,
  "published_by": 20548,
  "rating": "",
  "steamid": 312560,
  "gogid": 1284895531,
  "gogslug": "xanadu_next",
  "humblestoreid": "",
  "script": {
    "files": [
      {
        "setup": "N/A:Select the game's setup file"
      }
    ],
    "game": {
      "prefix": "$GAMEDIR",
      "exe": "drive_c/GOG Games/Xanadu Next/XANADU.exe",
      "arch": "win32"
    },
    "wine": {
      "overrides": {
        "winegstreamer": "disabled"
      }
    },
    "installer": [
      {
        "task": {
          "prefix": "$GAMEDIR",
          "arch": "win32",
          "name": "create_prefix"
        }
      },
      {
        "task": {
          "prefix": "$GAMEDIR",
          "arch": "win32",
          "app": "vcrun2008",
          "name": "winetricks"
        }
      },
      {
        "task": {
          "prefix": "$GAMEDIR",
          "arch": "win32",
          "app": "quartz",
          "description": "Installing Quartz.",
          "name": "winetricks"
        }
      },
      {
        "task": {
          "prefix": "$GAMEDIR",
          "arch": "win32",
          "app": "ffdshow",
          "description": "Installing Ffdshow.",
          "name": "winetricks"
        }
      },
      {
        "task": {
          "prefix": "$GAMEDIR",
          "arch": "win32",
          "app": "amstream",
          "description": "Installing Amstream.",
          "name": "winetricks"
        }
      },
      {
        "task": {
          "prefix": "$GAMEDIR",
          "arch": "win32",
          "app": "xvid win7",
          "description": "Installing Xvid.",
          "name": "winetricks"
        }
      },
      {
        "task": {
          "arch": "win32",
          "name": "wineexec",
          "description": "Simulating Windows reboot.",
          "args": "-u",
          "prefix": "$GAMEDIR",
          "executable": "wineboot"
        }
      },
      {
        "task": {
          "arch": "win32",
          "name": "wineexec",
          "description": "Installing Xanadu Next",
          "args": "/SP- /SUPPRESSMSGBOXES /NOCANCEL",
          "prefix": "$GAMEDIR",
          "executable": "setup"
        }
      },
      {
        "task": {
          "prefix": "$GAMEDIR",
          "arch": "win32",
          "executable": "$GAMEDIR/drive_c/GOG Games/Xanadu Next/xanadu_cfg.exe",
          "name": "wineexec",
          "description": "Setting game options."
        }
      }
    ]
  },
  "content": "files:\n- setup: N/A:Select the game's setup file\ngame:\n  arch: win32\n  exe: drive_c/GOG Games/Xanadu Next/XANADU.exe\n  prefix: $GAMEDIR\ninstaller:\n- task:\n    arch: win32\n    name: create_prefix\n    prefix: $GAMEDIR\n- task:\n    app: vcrun2008\n    arch: win32\n    name: winetricks\n    prefix: $GAMEDIR\n- task:\n    app: quartz\n    arch: win32\n    description: Installing Quartz.\n    name: winetricks\n    prefix: $GAMEDIR\n- task:\n    app: ffdshow\n    arch: win32\n    description: Installing Ffdshow.\n    name: winetricks\n    prefix: $GAMEDIR\n- task:\n    app: amstream\n    arch: win32\n    description: Installing Amstream.\n    name: winetricks\n    prefix: $GAMEDIR\n- task:\n    app: xvid win7\n    arch: win32\n    description: Installing Xvid.\n    name: winetricks\n    prefix: $GAMEDIR\n- task:\n    arch: win32\n    args: -u\n    description: Simulating Windows reboot.\n    executable: wineboot\n    name: wineexec\n    prefix: $GAMEDIR\n- task:\n    arch: win32\n    args: /SP- /SUPPRESSMSGBOXES /NOCANCEL\n    description: Installing Xanadu Next\n    executable: setup\n    name: wineexec\n    prefix: $GAMEDIR\n- task:\n    arch: win32\n    description: Setting game options.\n    executable: $GAMEDIR/drive_c/GOG Games/Xanadu Next/xanadu_cfg.exe\n    name: wineexec\n    prefix: $GAMEDIR\nwine:\n  overrides:\n    winegstreamer: disabled\n"
}