{
  "id": 14247,
  "game_id": 2691,
  "game_slug": "bloodrayne",
  "name": "BloodRayne",
  "year": 2002,
  "user": "q__",
  "runner": "wine",
  "slug": "bloodrayne-gog",
  "version": "GOG",
  "description": null,
  "notes": "",
  "created_at": "2019-06-22T13:48:29.269000Z",
  "updated_at": "2019-10-14T02:04:24.431109Z",
  "draft": false,
  "published": true,
  "published_by": 19464,
  "rating": "",
  "steamid": 3810,
  "gogid": 1207658808,
  "gogslug": "bloodrayne",
  "humblestoreid": "",
  "script": {
    "game": {
      "arch": "win32",
      "prefix": "$GAMEDIR",
      "exe": "drive_c/GOG Games/BloodRayne/rayne.exe"
    },
    "wine": {
      "overrides": {
        "quartz": "n",
        "dinput8": "n",
        "devenum": "n",
        "xinput1_3": "n",
        "dinput": "n",
        "winegstreamer": "disabled"
      },
      "Audio": "alsa"
    },
    "files": [
      {
        "setup": "N/A:Please select the GOG.com Windows installer"
      }
    ],
    "installer": [
      {
        "input_menu": {
          "preselect": "1920",
          "id": "RESOLUTIONX",
          "description": "Choose horizontal resolution",
          "options": [
            {
              "1920": "1920"
            },
            {
              "1600": "1600"
            },
            {
              "2560": "2560"
            }
          ]
        }
      },
      {
        "input_menu": {
          "preselect": "1080",
          "id": "RESOLUTIONY",
          "description": "Choose vertical resolution",
          "options": [
            {
              "1080": "1080"
            },
            {
              "1600": "1600"
            },
            {
              "1440": "1440"
            }
          ]
        }
      },
      {
        "task": {
          "arch": "win32",
          "prefix": "$GAMEDIR",
          "name": "winetricks",
          "app": "quartz devenum dinput dinput8 xinput1_3"
        }
      },
      {
        "task": {
          "arch": "win32",
          "executable": "setup",
          "prefix": "$GAMEDIR",
          "name": "wineexec",
          "args": "/SP- /SUPPRESSMSGBOXES /NOCANCEL"
        }
      },
      {
        "write_config": {
          "data": {
            "Graphics": {
              "gamePIXX": "$INPUT_RESOLUTIONX",
              "gamePIXY": "$INPUT_RESOLUTIONY"
            }
          },
          "file": "$GAMEDIR/drive_c/GOG Games/BloodRayne/system/rayne.ini"
        }
      }
    ]
  },
  "content": "files:\n- setup: N/A:Please select the GOG.com Windows installer\ngame:\n  arch: win32\n  exe: drive_c/GOG Games/BloodRayne/rayne.exe\n  prefix: $GAMEDIR\ninstaller:\n- input_menu:\n    description: Choose horizontal resolution\n    id: RESOLUTIONX\n    options:\n    - '1920': '1920'\n    - '1600': '1600'\n    - '2560': '2560'\n    preselect: '1920'\n- input_menu:\n    description: Choose vertical resolution\n    id: RESOLUTIONY\n    options:\n    - '1080': '1080'\n    - '1600': '1600'\n    - '1440': '1440'\n    preselect: '1080'\n- task:\n    app: quartz devenum dinput dinput8 xinput1_3\n    arch: win32\n    name: winetricks\n    prefix: $GAMEDIR\n- task:\n    arch: win32\n    args: /SP- /SUPPRESSMSGBOXES /NOCANCEL\n    executable: setup\n    name: wineexec\n    prefix: $GAMEDIR\n- write_config:\n    data:\n      Graphics:\n        gamePIXX: $INPUT_RESOLUTIONX\n        gamePIXY: $INPUT_RESOLUTIONY\n    file: $GAMEDIR/drive_c/GOG Games/BloodRayne/system/rayne.ini\nwine:\n  Audio: alsa\n  overrides:\n    devenum: n\n    dinput: n\n    dinput8: n\n    quartz: n\n    winegstreamer: disabled\n    xinput1_3: n\n"
}