{
  "id": 7185,
  "game_id": 14194,
  "game_slug": "fortnite",
  "name": "Fortnite",
  "year": 2017,
  "user": "potz_",
  "runner": "wine",
  "slug": "fortnite-epic-games-launcher",
  "version": "Epic Games Launcher",
  "description": "The game does not work due to Easy Anti Cheat. Please let know Epic Games that you are interested in playing on Linux. Epic Games has released Fortnite on 7 different platforms and is currently the most wealthy video game company and yet they have made the decision not to support Linux. Make your voice heard and demand native support!",
  "notes": "If the <a href=\"https://cdn.discordapp.com/attachments/288951868082749441/476766447381512202/unknown.png\">BattlEye Launcher opens</a> when launching Fortnite follow these steps:\r\n\r\n1. Quit the Epic Games Launcher and make sure no Wine processes are running.\r\n2. Open regedit (right-click Fortnite > Wine registry) and navigate to <b>HKEY_CURRENT_USER\\Software\\Epic Games\\Unreal Engine\\Identifiers</b>\r\n3. Delete the <b>MachineId</b> key\r\n4. Launch Fortnite\r\n\r\nIf the BattlEye Launcher still opens repeat steps 1-4 until Fortnite opens.\r\n\r\nOptional: After installing Fortnite add \"com.epicgames.launcher://apps/Fortnite?action=launch&silent=true\" (without quotes) to the arguments field in Game options after \"-SkipBuildPatchPrereq\" to have Fortnite boot directly.",
  "created_at": "2018-01-28T22:34:02.039000Z",
  "updated_at": "2020-01-23T02:56:50.123442Z",
  "draft": false,
  "published": true,
  "published_by": 51687,
  "rating": "1",
  "steamid": null,
  "gogid": null,
  "gogslug": "",
  "humblestoreid": "",
  "script": {
    "files": [
      {
        "epic": "https://launcher-public-service-prod06.ol.epicgames.com/launcher/api/installer/download/EpicGamesLauncherInstaller.msi"
      },
      {
        "audio": "https://lutris.net/files/tools/directx-2010.tar.gz"
      }
    ],
    "game": {
      "prefix": "$GAMEDIR",
      "exe": "drive_c/Program Files (x86)/Epic Games/Launcher/Portal/Binaries/Win32/EpicGamesLauncher.exe",
      "arch": "win64",
      "args": "-SkipBuildPatchPrereq -opengl"
    },
    "wine": {
      "esync": true,
      "dxvk": true
    },
    "system": {
      "env": {
        "MESA_GL_VERSION_OVERRIDE": "4.4COMPAT"
      }
    },
    "installer": [
      {
        "extract": {
          "file": "audio",
          "dst": "$CACHE/dxsetup"
        }
      },
      {
        "task": {
          "prefix": "$GAMEDIR",
          "arch": "win64",
          "name": "create_prefix"
        }
      },
      {
        "task": {
          "prefix": "$GAMEDIR",
          "arch": "win64",
          "executable": "$CACHE/dxsetup/DXSETUP.exe",
          "name": "wineexec",
          "args": "/silent"
        }
      },
      {
        "task": {
          "prefix": "$GAMEDIR",
          "arch": "win64",
          "name": "winekill"
        }
      },
      {
        "task": {
          "prefix": "$GAMEDIR",
          "arch": "win64",
          "app": "arial",
          "name": "winetricks"
        }
      },
      {
        "task": {
          "prefix": "$GAMEDIR",
          "arch": "win64",
          "app": "faudio",
          "name": "winetricks"
        }
      },
      {
        "task": {
          "prefix": "$GAMEDIR",
          "arch": "win64",
          "name": "winekill"
        }
      },
      {
        "task": {
          "arch": "win64",
          "exclude_processes": "EpicGamesLauncher.exe",
          "name": "wineexec",
          "args": "/q",
          "prefix": "$GAMEDIR",
          "executable": "epic"
        }
      },
      {
        "task": {
          "prefix": "$GAMEDIR",
          "arch": "win64",
          "name": "winekill"
        }
      }
    ]
  },
  "content": "files:\n- epic: https://launcher-public-service-prod06.ol.epicgames.com/launcher/api/installer/download/EpicGamesLauncherInstaller.msi\n- audio: https://lutris.net/files/tools/directx-2010.tar.gz\ngame:\n  arch: win64\n  args: -SkipBuildPatchPrereq -opengl\n  exe: drive_c/Program Files (x86)/Epic Games/Launcher/Portal/Binaries/Win32/EpicGamesLauncher.exe\n  prefix: $GAMEDIR\ninstaller:\n- extract:\n    dst: $CACHE/dxsetup\n    file: audio\n- task:\n    arch: win64\n    name: create_prefix\n    prefix: $GAMEDIR\n- task:\n    arch: win64\n    args: /silent\n    executable: $CACHE/dxsetup/DXSETUP.exe\n    name: wineexec\n    prefix: $GAMEDIR\n- task:\n    arch: win64\n    name: winekill\n    prefix: $GAMEDIR\n- task:\n    app: arial\n    arch: win64\n    name: winetricks\n    prefix: $GAMEDIR\n- task:\n    app: faudio\n    arch: win64\n    name: winetricks\n    prefix: $GAMEDIR\n- task:\n    arch: win64\n    name: winekill\n    prefix: $GAMEDIR\n- task:\n    arch: win64\n    args: /q\n    exclude_processes: EpicGamesLauncher.exe\n    executable: epic\n    name: wineexec\n    prefix: $GAMEDIR\n- task:\n    arch: win64\n    name: winekill\n    prefix: $GAMEDIR\nsystem:\n  env:\n    MESA_GL_VERSION_OVERRIDE: 4.4COMPAT\nwine:\n  dxvk: true\n  esync: true\n"
}