{
  "id": 8437,
  "game_id": 2464,
  "game_slug": "pc-gamer",
  "name": "PC Gamer",
  "year": null,
  "user": "Nibiron",
  "runner": "winesteam",
  "slug": "pc-gamer-steam",
  "version": "Steam",
  "description": null,
  "notes": "",
  "created_at": "2018-05-26T22:35:52.169000Z",
  "updated_at": "2018-05-27T04:20:06.863673Z",
  "draft": false,
  "published": true,
  "published_by": null,
  "rating": "",
  "steamid": 92500,
  "gogid": null,
  "gogslug": "",
  "humblestoreid": "",
  "script": {
    "game": {
      "appid": 92500,
      "prefix": "$GAMEDIR/prefix",
      "arch": "win64"
    },
    "installer": [
      {
        "task": {
          "description": "Installing .NET 3.5",
          "name": "winetricks",
          "arch": "win64",
          "app": "dotnet35",
          "prefix": "$GAMEDIR/prefix"
        }
      },
      {
        "task": {
          "description": "Installing Visual C++ Runtime 2010",
          "name": "winetricks",
          "arch": "win64",
          "app": "vcrun2010",
          "prefix": "$GAMEDIR/prefix"
        }
      },
      {
        "task": {
          "description": "Installing DirectX9 D3D v43",
          "name": "winetricks",
          "arch": "win64",
          "app": "d3dx9_43",
          "prefix": "$GAMEDIR/prefix"
        }
      },
      {
        "task": {
          "description": "Installing DirectX11 D3D v43",
          "name": "winetricks",
          "arch": "win64",
          "app": "d3dx11_43",
          "prefix": "$GAMEDIR/prefix"
        }
      },
      {
        "task": {
          "description": "Installing DirectX11 D3D compiler v43",
          "name": "winetricks",
          "arch": "win64",
          "app": "d3dcompiler_43",
          "prefix": "$GAMEDIR/prefix"
        }
      },
      {
        "task": {
          "description": "Installing .NET 4.0",
          "name": "winetricks",
          "arch": "win64",
          "app": "dotnet40",
          "prefix": "$GAMEDIR/prefix"
        }
      }
    ]
  },
  "content": "game:\n  appid: 92500\n  arch: win64\n  prefix: $GAMEDIR/prefix\ninstaller:\n- task:\n    app: dotnet35\n    arch: win64\n    description: Installing .NET 3.5\n    name: winetricks\n    prefix: $GAMEDIR/prefix\n- task:\n    app: vcrun2010\n    arch: win64\n    description: Installing Visual C++ Runtime 2010\n    name: winetricks\n    prefix: $GAMEDIR/prefix\n- task:\n    app: d3dx9_43\n    arch: win64\n    description: Installing DirectX9 D3D v43\n    name: winetricks\n    prefix: $GAMEDIR/prefix\n- task:\n    app: d3dx11_43\n    arch: win64\n    description: Installing DirectX11 D3D v43\n    name: winetricks\n    prefix: $GAMEDIR/prefix\n- task:\n    app: d3dcompiler_43\n    arch: win64\n    description: Installing DirectX11 D3D compiler v43\n    name: winetricks\n    prefix: $GAMEDIR/prefix\n- task:\n    app: dotnet40\n    arch: win64\n    description: Installing .NET 4.0\n    name: winetricks\n    prefix: $GAMEDIR/prefix\n"
}