{
  "id": 9832,
  "game_id": 4242,
  "game_slug": "medieval-engineers",
  "name": "Medieval Engineers",
  "year": null,
  "user": "Holston",
  "runner": "winesteam",
  "slug": "medieval-engineers-steam",
  "version": "Steam",
  "description": null,
  "notes": "",
  "created_at": "2018-08-21T06:35:28.092000Z",
  "updated_at": "2018-08-22T16:53:28.635184Z",
  "draft": false,
  "published": true,
  "published_by": null,
  "rating": "",
  "steamid": 333950,
  "gogid": null,
  "gogslug": "",
  "humblestoreid": "",
  "script": {
    "game": {
      "prefix": "$GAMEDIR/prefix",
      "appid": 333950,
      "arch": "win64"
    },
    "winesteam": {
      "version": "staging-3.11-x86_64"
    },
    "installer": [
      {
        "task": {
          "prefix": "$GAMEDIR/prefix",
          "arch": "win64",
          "name": "create_prefix"
        }
      },
      {
        "task": {
          "description": "Installing corefonts. This will take a while...",
          "arch": "win64",
          "prefix": "$GAMEDIR",
          "name": "winetricks",
          "app": "corefonts"
        }
      },
      {
        "task": {
          "description": "Installing corefonts. This will take a while...",
          "arch": "win64",
          "prefix": "$GAMEDIR",
          "name": "winetricks",
          "app": "vcrun2017"
        }
      },
      {
        "task": {
          "description": "Installing corefonts. This will take a while...",
          "arch": "win64",
          "prefix": "$GAMEDIR",
          "name": "winetricks",
          "app": "dotnet40"
        }
      },
      {
        "task": {
          "description": "Installing corefonts. This will take a while...",
          "arch": "win64",
          "prefix": "$GAMEDIR",
          "name": "winetricks",
          "app": "dotnet46"
        }
      }
    ]
  },
  "content": "game:\n  appid: 333950\n  arch: win64\n  prefix: $GAMEDIR/prefix\ninstaller:\n- task:\n    arch: win64\n    name: create_prefix\n    prefix: $GAMEDIR/prefix\n- task:\n    app: corefonts\n    arch: win64\n    description: Installing corefonts. This will take a while...\n    name: winetricks\n    prefix: $GAMEDIR\n- task:\n    app: vcrun2017\n    arch: win64\n    description: Installing corefonts. This will take a while...\n    name: winetricks\n    prefix: $GAMEDIR\n- task:\n    app: dotnet40\n    arch: win64\n    description: Installing corefonts. This will take a while...\n    name: winetricks\n    prefix: $GAMEDIR\n- task:\n    app: dotnet46\n    arch: win64\n    description: Installing corefonts. This will take a while...\n    name: winetricks\n    prefix: $GAMEDIR\nwinesteam:\n  version: staging-3.11-x86_64\n"
}