{
  "id": 9424,
  "game_id": 3731,
  "game_slug": "final-fantasy-xi",
  "name": "FINAL FANTASY XI",
  "year": 2003,
  "user": "cxf",
  "runner": "wine",
  "slug": "final-fantasy-xi-lite",
  "version": "Lite",
  "description": "This script will install the game WITHOUT expansions.",
  "notes": "Due to some problems with InstallShield, the installation has to be completed manually. Please do not change the default installation path.\r\n\r\nWhen running the game for the first time, it will take hours to update the game data to its latest version, so please be patient.\r\n\r\nVirtual desktop set to 800x600 by default. Change to your preferred resolution under runner options.",
  "created_at": "2018-07-27T23:37:39.402000Z",
  "updated_at": "2019-10-19T23:07:23.186185Z",
  "draft": true,
  "published": false,
  "published_by": 19464,
  "rating": "",
  "steamid": 23360,
  "gogid": null,
  "gogslug": "",
  "humblestoreid": "",
  "script": {
    "game": {
      "exe": "drive_c/Program Files (x86)/PlayOnline/SquareEnix/FINAL FANTASY XI/polboot.exe",
      "prefix": "$GAMEDIR"
    },
    "wine": {
      "Desktop": true,
      "WineDesktop": "800x600"
    },
    "installer": [
      {
        "execute": {
          "description": "Extracting game data",
          "command": "7z x \"$CACHE/FINALFANTASYXI.Data*\" -o\"$CACHE/extracted\" -bso1 -y"
        }
      },
      {
        "execute": {
          "description": "Extracting game data",
          "command": "rm $CACHE/FINALFANTASYXI.Data.00*"
        }
      },
      {
        "task": {
          "app": "dotnet35",
          "description": "Installing .NET Framework 3.5",
          "prefix": "$GAMEDIR",
          "name": "winetricks"
        }
      },
      {
        "task": {
          "app": "d3dx9",
          "description": "Installing DirectX 9",
          "prefix": "$GAMEDIR",
          "name": "winetricks"
        }
      },
      {
        "task": {
          "app": "win7",
          "description": "Changing to Windows 7",
          "prefix": "$GAMEDIR",
          "name": "winetricks"
        }
      },
      {
        "task": {
          "executable": "$CACHE/extracted/PlayOnline/setup.exe",
          "description": "Installing PlayOnline Viewer",
          "prefix": "$GAMEDIR",
          "name": "wineexec"
        }
      },
      {
        "task": {
          "executable": "$CACHE/extracted/INST1/setup.exe",
          "prefix": "$GAMEDIR",
          "name": "wineexec"
        }
      }
    ],
    "require-binaries": "7z",
    "files": [
      {
        "installer-01": {
          "filename": "FINALFANTASYXI.Data.001",
          "url": "http://gdl.square-enix.com/ffxi/download/us/FINALFANTASYXI.Data.001"
        }
      },
      {
        "installer-02": {
          "filename": "FINALFANTASYXI.Data.002",
          "url": "http://gdl.square-enix.com/ffxi/download/us/FINALFANTASYXI.Data.002"
        }
      },
      {
        "installer-03": {
          "filename": "FINALFANTASYXI.Data.003",
          "url": "http://gdl.square-enix.com/ffxi/download/us/FINALFANTASYXI.Data.003"
        }
      }
    ]
  },
  "content": "files:\r\n- installer-01:\r\n    filename: FINALFANTASYXI.Data.001\r\n    url: http://gdl.square-enix.com/ffxi/download/us/FINALFANTASYXI.Data.001\r\n- installer-02:\r\n    filename: FINALFANTASYXI.Data.002\r\n    url: http://gdl.square-enix.com/ffxi/download/us/FINALFANTASYXI.Data.002\r\n- installer-03:\r\n    filename: FINALFANTASYXI.Data.003\r\n    url: http://gdl.square-enix.com/ffxi/download/us/FINALFANTASYXI.Data.003\r\ngame:\r\n  exe: drive_c/Program Files (x86)/PlayOnline/SquareEnix/FINAL FANTASY XI/polboot.exe\r\n  prefix: $GAMEDIR\r\ninstaller:\r\n- execute:\r\n    command: 7z x \"$CACHE/FINALFANTASYXI.Data*\" -o\"$CACHE/extracted\" -bso1 -y\r\n    description: Extracting game data\r\n- execute:\r\n    command: rm $CACHE/FINALFANTASYXI.Data.00*\r\n    description: Extracting game data\r\n- task:\r\n    app: dotnet35\r\n    description: Installing .NET Framework 3.5\r\n    name: winetricks\r\n    prefix: $GAMEDIR\r\n- task:\r\n    app: d3dx9\r\n    description: Installing DirectX 9\r\n    name: winetricks\r\n    prefix: $GAMEDIR\r\n- task:\r\n    app: win7\r\n    description: Changing to Windows 7\r\n    name: winetricks\r\n    prefix: $GAMEDIR\r\n- task:\r\n    description: Installing PlayOnline Viewer\r\n    executable: $CACHE/extracted/PlayOnline/setup.exe\r\n    name: wineexec\r\n    prefix: $GAMEDIR\r\n- task:\r\n    executable: $CACHE/extracted/INST1/setup.exe\r\n    name: wineexec\r\n    prefix: $GAMEDIR\r\nrequire-binaries: 7z\r\nwine:\r\n  Desktop: true\r\n  WineDesktop: 800x600"
}