{
  "id": 11373,
  "game_id": 17985,
  "game_slug": "total-annihilation-kingdoms",
  "name": "Total Annihilation Kingdoms",
  "year": 1999,
  "user": "nephitejnf",
  "runner": "wine",
  "slug": "total-annihilation-kingdoms-gog",
  "version": "GOG",
  "description": "This script installs Total Annihilation Kingdoms from GOG.",
  "notes": "-You can choose your preferred interface language (English, German, Italian, French, Spanish)\r\n-No full screen if game resolution is not the same as screen resolution (Menu and Video)\r\n-Automatically sets renderer to software\r\n-Set the in-game resolution in the options",
  "created_at": "2018-12-28T06:51:34.996000Z",
  "updated_at": "2020-03-21T08:30:45.705281Z",
  "draft": false,
  "published": true,
  "published_by": 20548,
  "rating": "",
  "steamid": null,
  "gogid": 1207658912,
  "gogslug": "total_annihilation_kingdoms",
  "humblestoreid": "",
  "script": {
    "files": [
      {
        "game": "N/A:Select the installer downloaded from GOG."
      }
    ],
    "game": {
      "prefix": "$GAMEDIR",
      "exe": "drive_c/GOG Games/Total Annihilation Kingdoms/Kingdoms.exe"
    },
    "wine": {
      "Desktop": true,
      "WineDesktop": "$RESOLUTION"
    },
    "installer": [
      {
        "input_menu": {
          "preselect": "ENGLISH",
          "options": [
            {
              "ENGLISH": "English"
            },
            {
              "GERMAN": "German"
            },
            {
              "ITALIAN": "Italian"
            },
            {
              "FRENCH": "French"
            },
            {
              "SPANISH": "Spanish"
            }
          ],
          "description": "Please choose your preferred Interface language:",
          "id": "LANG"
        }
      },
      {
        "task": {
          "prefix": "$GAMEDIR",
          "app": "gdiplus",
          "name": "winetricks"
        }
      },
      {
        "task": {
          "prefix": "$GAMEDIR",
          "executable": "$game",
          "name": "wineexec",
          "args": "/VERYSILENT /SUPRESSMSGBOXES"
        }
      },
      {
        "task": {
          "arch": "win64",
          "name": "set_regedit",
          "key": "RendererName",
          "prefix": "$GAMEDIR",
          "value": "Software MMX Rendering",
          "path": "HKEY_CURRENT_USER\\Software\\Cavedog Entertainment\\Kingdoms\\RendererOptions",
          "type": "REG_SZ"
        }
      },
      {
        "task": {
          "arch": "win64",
          "name": "set_regedit",
          "key": "RendererPrefs",
          "prefix": "$GAMEDIR",
          "value": "00010002",
          "path": "HKEY_CURRENT_USER\\Software\\Cavedog Entertainment\\Kingdoms\\RendererOptions",
          "type": "REG_DWORD"
        }
      },
      {
        "task": {
          "arch": "win64",
          "name": "set_regedit",
          "key": "RendererType",
          "prefix": "$GAMEDIR",
          "value": "00000002",
          "path": "HKEY_CURRENT_USER\\Software\\Cavedog Entertainment\\Kingdoms\\RendererOptions",
          "type": "REG_DWORD"
        }
      },
      {
        "task": {
          "arch": "win64",
          "name": "set_regedit",
          "key": "Language",
          "prefix": "$GAMEDIR",
          "value": "$INPUT_LANG",
          "path": "HKEY_CURRENT_USER\\Software\\Cavedog Entertainment\\Kingdoms\\InterfaceOptions",
          "type": "REG_SZ"
        }
      }
    ]
  },
  "content": "files:\n- game: N/A:Select the installer downloaded from GOG.\ngame:\n  exe: drive_c/GOG Games/Total Annihilation Kingdoms/Kingdoms.exe\n  prefix: $GAMEDIR\ninstaller:\n- input_menu:\n    description: 'Please choose your preferred Interface language:'\n    id: LANG\n    options:\n    - ENGLISH: English\n    - GERMAN: German\n    - ITALIAN: Italian\n    - FRENCH: French\n    - SPANISH: Spanish\n    preselect: ENGLISH\n- task:\n    app: gdiplus\n    name: winetricks\n    prefix: $GAMEDIR\n- task:\n    args: /VERYSILENT /SUPRESSMSGBOXES\n    executable: $game\n    name: wineexec\n    prefix: $GAMEDIR\n- task:\n    arch: win64\n    key: RendererName\n    name: set_regedit\n    path: HKEY_CURRENT_USER\\Software\\Cavedog Entertainment\\Kingdoms\\RendererOptions\n    prefix: $GAMEDIR\n    type: REG_SZ\n    value: Software MMX Rendering\n- task:\n    arch: win64\n    key: RendererPrefs\n    name: set_regedit\n    path: HKEY_CURRENT_USER\\Software\\Cavedog Entertainment\\Kingdoms\\RendererOptions\n    prefix: $GAMEDIR\n    type: REG_DWORD\n    value: '00010002'\n- task:\n    arch: win64\n    key: RendererType\n    name: set_regedit\n    path: HKEY_CURRENT_USER\\Software\\Cavedog Entertainment\\Kingdoms\\RendererOptions\n    prefix: $GAMEDIR\n    type: REG_DWORD\n    value: '00000002'\n- task:\n    arch: win64\n    key: Language\n    name: set_regedit\n    path: HKEY_CURRENT_USER\\Software\\Cavedog Entertainment\\Kingdoms\\InterfaceOptions\n    prefix: $GAMEDIR\n    type: REG_SZ\n    value: $INPUT_LANG\nwine:\n  Desktop: true\n  WineDesktop: $RESOLUTION\n"
}