{
  "id": 21569,
  "game_id": 37298,
  "game_slug": "the-settlers-3",
  "name": "The Settlers 3",
  "year": 2002,
  "user": "x_l_ours",
  "runner": "wine",
  "slug": "the-settlers-3-cddvd",
  "version": "CD/DVD",
  "description": null,
  "notes": "",
  "created_at": "2020-06-15T17:00:12.401634Z",
  "updated_at": "2020-06-15T17:00:12.401659Z",
  "draft": true,
  "published": false,
  "published_by": null,
  "rating": "",
  "steamid": null,
  "gogid": null,
  "gogslug": "",
  "humbleid": "",
  "humblestoreid": "",
  "humblestoreid_real": "",
  "script": {
    "game": {
      "arch": "win32",
      "exe": "$GAMEDIR/drive_c/Program Files/Microsoft Games/Zoo Tycoon/zoo.exe",
      "prefix": "$GAMEDIR",
      "working_dir": "$GAMEDIR/drive_c/Program Files/Microsoft Games/Zoo Tycoon"
    },
    "installer": [
      {
        "task": {
          "app": "winxp",
          "arch": "win32",
          "description": "Setting Windows Version to XP",
          "name": "winetricks",
          "prefix": "$GAMEDIR/prefix"
        }
      },
      {
        "insert-disc": {
          "description": "Insert disc 1",
          "requires": "setup.exe"
        }
      },
      {
        "task": {
          "arch": "win32",
          "name": "create_prefix",
          "prefix": "$GAMEDIR"
        }
      },
      {
        "task": {
          "executable": "$DISC/setup.exe",
          "name": "wineexec",
          "prefix": "$GAMEDIR"
        }
      },
      {
        "insert-disc": {
          "description": "Insert disc 2",
          "requires": "setup.exe"
        }
      },
      {
        "task": {
          "arch": "win32",
          "name": "create_prefix",
          "prefix": "$GAMEDIR"
        }
      },
      {
        "task": {
          "executable": "$DISC/setup.exe",
          "name": "wineexec",
          "prefix": "$GAMEDIR"
        }
      },
      {
        "task": {
          "app": "winxp",
          "arch": "win32",
          "description": "Setting Windows Version to XP",
          "name": "winetricks",
          "prefix": "$GAMEDIR/prefix"
        }
      }
    ]
  },
  "content": "game:\n  arch: win32\n  exe: $GAMEDIR/drive_c/Program Files/Microsoft Games/Zoo Tycoon/zoo.exe\n  prefix: $GAMEDIR\n  working_dir: $GAMEDIR/drive_c/Program Files/Microsoft Games/Zoo Tycoon\ninstaller:\n- task:\n    app: winxp\n    arch: win32\n    description: Setting Windows Version to XP\n    name: winetricks\n    prefix: $GAMEDIR/prefix\n- insert-disc:\n    description: Insert disc 1\n    requires: setup.exe\n- task:\n    arch: win32\n    name: create_prefix\n    prefix: $GAMEDIR\n- task:\n    executable: $DISC/setup.exe\n    name: wineexec\n    prefix: $GAMEDIR\n- insert-disc:\n    description: Insert disc 2\n    requires: setup.exe\n- task:\n    arch: win32\n    name: create_prefix\n    prefix: $GAMEDIR\n- task:\n    executable: $DISC/setup.exe\n    name: wineexec\n    prefix: $GAMEDIR\n- task:\n    app: winxp\n    arch: win32\n    description: Setting Windows Version to XP\n    name: winetricks\n    prefix: $GAMEDIR/prefix\n"
}