{
  "id": 15599,
  "game_id": 29407,
  "game_slug": "pcsx2-emulador",
  "name": "PCSX2 Emulador",
  "year": 2002,
  "user": "edjaa84",
  "runner": "wine",
  "slug": "pcsx2-emulador-estable",
  "version": "Estable",
  "description": "Emulador de Playstation 2\r\n\r\nRaPiMoDEBianPaKaGer",
  "notes": "Para mayor info anidebtuzonalibre@gmail.com",
  "created_at": "2019-09-16T01:19:55.699460Z",
  "updated_at": "2019-09-16T01:19:55.699485Z",
  "draft": true,
  "published": false,
  "published_by": null,
  "rating": "",
  "steamid": null,
  "gogid": null,
  "gogslug": "",
  "humblestoreid": "",
  "script": {
    "game": {
      "arch": "win32",
      "prefix": "$GAMEDIR",
      "working_dir": "$GAMEDIR/drive_c/Program Files/PCSX2 1.4.0/",
      "exe": "$GAMEDIR/drive_c/Program Files/PCSX2 1.4.0/pcsx2.exe"
    },
    "files": [
      {
        "dark": "N/A:Se√±ala el instalador, solo para iniciar"
      }
    ],
    "installer": [
      {
        "task": {
          "prefix": "$GAMEDIR/",
          "description": "Installing Visual C++ 2015",
          "name": "winetricks",
          "silent": true,
          "app": "vcrun2015"
        }
      },
      {
        "task": {
          "prefix": "$GAMEDIR/",
          "description": "Cambiando a Windows 7",
          "name": "winetricks",
          "silent": true,
          "app": "win7"
        }
      },
      {
        "task": {
          "prefix": "$GAMEDIR/",
          "description": "Installing DirectX 9",
          "name": "winetricks",
          "silent": true,
          "app": "d3dx9"
        }
      },
      {
        "task": {
          "prefix": "$GAMEDIR/",
          "description": "Installing DirectX 11",
          "name": "winetricks",
          "silent": true,
          "app": "d3dx11_42"
        }
      },
      {
        "task": {
          "prefix": "$GAMEDIR/",
          "description": "Installing DirectX 11",
          "name": "winetricks",
          "silent": true,
          "app": "d3dx11_43"
        }
      },
      {
        "task": {
          "prefix": "$GAMEDIR/",
          "description": "Installing d3dcompiler42",
          "name": "winetricks",
          "silent": true,
          "app": "d3dcompiler_42"
        }
      },
      {
        "task": {
          "prefix": "$GAMEDIR/",
          "description": "Installing d3dcompiler43",
          "name": "winetricks",
          "silent": true,
          "app": "d3dcompiler_43"
        }
      },
      {
        "task": {
          "prefix": "$GAMEDIR/",
          "description": "Installing d3dcompiler47",
          "name": "winetricks",
          "silent": true,
          "app": "d3dcompiler_47"
        }
      }
    ]
  },
  "content": "files:\n- dark: \"N/A:Se\\xF1ala el instalador, solo para iniciar\"\ngame:\n  arch: win32\n  exe: $GAMEDIR/drive_c/Program Files/PCSX2 1.4.0/pcsx2.exe\n  prefix: $GAMEDIR\n  working_dir: $GAMEDIR/drive_c/Program Files/PCSX2 1.4.0/\ninstaller:\n- task:\n    app: vcrun2015\n    description: Installing Visual C++ 2015\n    name: winetricks\n    prefix: $GAMEDIR/\n    silent: true\n- task:\n    app: win7\n    description: Cambiando a Windows 7\n    name: winetricks\n    prefix: $GAMEDIR/\n    silent: true\n- task:\n    app: d3dx9\n    description: Installing DirectX 9\n    name: winetricks\n    prefix: $GAMEDIR/\n    silent: true\n- task:\n    app: d3dx11_42\n    description: Installing DirectX 11\n    name: winetricks\n    prefix: $GAMEDIR/\n    silent: true\n- task:\n    app: d3dx11_43\n    description: Installing DirectX 11\n    name: winetricks\n    prefix: $GAMEDIR/\n    silent: true\n- task:\n    app: d3dcompiler_42\n    description: Installing d3dcompiler42\n    name: winetricks\n    prefix: $GAMEDIR/\n    silent: true\n- task:\n    app: d3dcompiler_43\n    description: Installing d3dcompiler43\n    name: winetricks\n    prefix: $GAMEDIR/\n    silent: true\n- task:\n    app: d3dcompiler_47\n    description: Installing d3dcompiler47\n    name: winetricks\n    prefix: $GAMEDIR/\n    silent: true\n"
}