{
  "id": 2615,
  "game_id": 585,
  "game_slug": "dust-an-elysian-tail",
  "name": "Dust: An Elysian Tail",
  "year": 2012,
  "user": "ssf",
  "runner": "wine",
  "slug": "dust-an-elysian-tail-gogcom",
  "version": "GOG.com",
  "description": "",
  "notes": "",
  "created_at": "2016-08-28T17:51:45.262131Z",
  "updated_at": "2016-09-30T21:15:20.184715Z",
  "draft": false,
  "published": true,
  "published_by": null,
  "rating": "",
  "steamid": 236090,
  "gogid": 1207660094,
  "gogslug": "dust_an_elysian_tail",
  "humbleid": "dust_anelysiantail",
  "humblestoreid": "dust_anelysiantail",
  "humblestoreid_real": "dust-an-elysian-tail",
  "script": {
    "files": [
      {
        "game": "N/A:Please select the GOG.com Windows installer."
      }
    ],
    "game": {
      "arch": "win32",
      "exe": "drive_c/game/DustAET.exe",
      "prefix": "$GAMEDIR"
    },
    "gogid": "dust_an_elysian_tail",
    "installer": [
      {
        "task": {
          "description": "Creating Wine prefix",
          "name": "create_prefix",
          "prefix": "$GAMEDIR"
        }
      },
      {
        "task": {
          "key": "winemenubuilder.exe",
          "name": "set_regedit",
          "path": "HKEY_CURRENT_USER\\Software\\Wine\\DllOverrides",
          "prefix": "$GAMEDIR",
          "type": "REG_SZ",
          "value": ""
        }
      },
      {
        "task": {
          "app": "dotnet40",
          "description": "Installing .net",
          "name": "winetricks",
          "prefix": "$GAMEDIR",
          "silent": false
        }
      },
      {
        "task": {
          "app": "xna40",
          "description": "Installing xna",
          "name": "winetricks",
          "prefix": "$GAMEDIR",
          "silent": false
        }
      },
      {
        "task": {
          "args": "/SILENT /SP- /NOCANCEL /SUPPRESSMSGBOXES '/DIR=C:/game'",
          "description": "Installing...",
          "executable": "game",
          "name": "wineexec",
          "prefix": "$GAMEDIR"
        }
      },
      {
        "task": {
          "app": "sandbox",
          "description": "Disabling unused WINE features",
          "name": "winetricks",
          "prefix": "$GAMEDIR",
          "silent": true
        }
      }
    ]
  },
  "content": "files:\n- game: N/A:Please select the GOG.com Windows installer.\ngame:\n  arch: win32\n  exe: drive_c/game/DustAET.exe\n  prefix: $GAMEDIR\ngogid: dust_an_elysian_tail\ninstaller:\n- task:\n    description: Creating Wine prefix\n    name: create_prefix\n    prefix: $GAMEDIR\n- task:\n    key: winemenubuilder.exe\n    name: set_regedit\n    path: HKEY_CURRENT_USER\\Software\\Wine\\DllOverrides\n    prefix: $GAMEDIR\n    type: REG_SZ\n    value: ''\n- task:\n    app: dotnet40\n    description: Installing .net\n    name: winetricks\n    prefix: $GAMEDIR\n    silent: false\n- task:\n    app: xna40\n    description: Installing xna\n    name: winetricks\n    prefix: $GAMEDIR\n    silent: false\n- task:\n    args: /SILENT /SP- /NOCANCEL /SUPPRESSMSGBOXES '/DIR=C:/game'\n    description: Installing...\n    executable: game\n    name: wineexec\n    prefix: $GAMEDIR\n- task:\n    app: sandbox\n    description: Disabling unused WINE features\n    name: winetricks\n    prefix: $GAMEDIR\n    silent: true\n"
}