{
  "id": 10799,
  "game_id": 23214,
  "game_slug": "archicad",
  "name": "ArchiCAD",
  "year": 2018,
  "user": "secon",
  "runner": "wine",
  "slug": "archicad-archicad-22",
  "version": "ArchiCAD 22",
  "description": null,
  "notes": "",
  "created_at": "2018-11-07T05:54:29.850000Z",
  "updated_at": "2019-01-11T23:36:22.737762Z",
  "draft": false,
  "published": true,
  "published_by": 19464,
  "rating": "",
  "steamid": null,
  "gogid": null,
  "gogslug": "",
  "humblestoreid": "",
  "script": {
    "game": {
      "exe": "drive_c/Program Files/GRAPHISOFT/ARCHICAD 22/ARCHICAD.exe",
      "arch": "win64",
      "prefix": "$GAMEDIR"
    },
    "files": [
      {
        "file": "https://dl.graphisoft.com/AC/22/INT/AC/ARCHICAD-22-INT-3006-1.4.exe"
      }
    ],
    "wine": {
      "version": "tkg-3.21-x86_64"
    },
    "installer": [
      {
        "task": {
          "description": "Creating Wine Prefix",
          "prefix": "$GAMEDIR",
          "arch": "win64",
          "name": "create_prefix"
        }
      },
      {
        "task": {
          "description": "Installing .NET 4.7.2",
          "arch": "win64",
          "prefix": "$GAMEDIR",
          "name": "winetricks",
          "app": "dotnet472"
        }
      },
      {
        "task": {
          "description": "Installing vcrun2005",
          "arch": "win64",
          "prefix": "$GAMEDIR",
          "name": "winetricks",
          "app": "vcrun2005"
        }
      },
      {
        "task": {
          "description": "Installing vcrun2008",
          "arch": "win64",
          "prefix": "$GAMEDIR",
          "name": "winetricks",
          "app": "vcrun2008"
        }
      },
      {
        "task": {
          "description": "Installing vcrun2012",
          "arch": "win64",
          "prefix": "$GAMEDIR",
          "name": "winetricks",
          "app": "vcrun2012"
        }
      },
      {
        "task": {
          "description": "Installing vcrun2015",
          "arch": "win64",
          "prefix": "$GAMEDIR",
          "name": "winetricks",
          "app": "vcrun2015"
        }
      },
      {
        "task": {
          "description": "Installing vcrun2017",
          "arch": "win64",
          "prefix": "$GAMEDIR",
          "name": "winetricks",
          "app": "vcrun2017"
        }
      },
      {
        "task": {
          "description": "Installing MS Line Services",
          "prefix": "$GAMEDIR",
          "app": "msls31",
          "name": "winetricks"
        }
      },
      {
        "task": {
          "description": "Installing Quartz",
          "arch": "win64",
          "prefix": "$GAMEDIR",
          "name": "winetricks",
          "app": "quartz"
        }
      },
      {
        "task": {
          "description": "Set Windows version to Windows 7",
          "arch": "win64",
          "prefix": "$GAMEDIR",
          "name": "winetricks",
          "app": "win7"
        }
      },
      {
        "task": {
          "description": "Running installer",
          "prefix": "$GAMEDIR",
          "executable": "file",
          "name": "wineexec"
        }
      }
    ]
  },
  "content": "files:\n- file: https://dl.graphisoft.com/AC/22/INT/AC/ARCHICAD-22-INT-3006-1.4.exe\ngame:\n  arch: win64\n  exe: drive_c/Program Files/GRAPHISOFT/ARCHICAD 22/ARCHICAD.exe\n  prefix: $GAMEDIR\ninstaller:\n- task:\n    arch: win64\n    description: Creating Wine Prefix\n    name: create_prefix\n    prefix: $GAMEDIR\n- task:\n    app: dotnet472\n    arch: win64\n    description: Installing .NET 4.7.2\n    name: winetricks\n    prefix: $GAMEDIR\n- task:\n    app: vcrun2005\n    arch: win64\n    description: Installing vcrun2005\n    name: winetricks\n    prefix: $GAMEDIR\n- task:\n    app: vcrun2008\n    arch: win64\n    description: Installing vcrun2008\n    name: winetricks\n    prefix: $GAMEDIR\n- task:\n    app: vcrun2012\n    arch: win64\n    description: Installing vcrun2012\n    name: winetricks\n    prefix: $GAMEDIR\n- task:\n    app: vcrun2015\n    arch: win64\n    description: Installing vcrun2015\n    name: winetricks\n    prefix: $GAMEDIR\n- task:\n    app: vcrun2017\n    arch: win64\n    description: Installing vcrun2017\n    name: winetricks\n    prefix: $GAMEDIR\n- task:\n    app: msls31\n    description: Installing MS Line Services\n    name: winetricks\n    prefix: $GAMEDIR\n- task:\n    app: quartz\n    arch: win64\n    description: Installing Quartz\n    name: winetricks\n    prefix: $GAMEDIR\n- task:\n    app: win7\n    arch: win64\n    description: Set Windows version to Windows 7\n    name: winetricks\n    prefix: $GAMEDIR\n- task:\n    description: Running installer\n    executable: file\n    name: wineexec\n    prefix: $GAMEDIR\nwine:\n  version: tkg-3.21-x86_64\n"
}