{
  "id": 3271,
  "game_id": 9910,
  "game_slug": "my-little-karaoke-singing-is-magic",
  "name": "My Little Karaoke: Singing is Magic",
  "year": 2012,
  "user": "djazz",
  "runner": "linux",
  "slug": "my-little-karaoke-singing-is-full",
  "version": "Full",
  "description": "Includes UltraStar Deluxe and a downloader/updater",
  "notes": "Requires about 17 GB free space. x86_64 only.",
  "created_at": "2017-02-16T12:25:29.734000Z",
  "updated_at": "2020-03-17T20:01:37.764314Z",
  "draft": false,
  "published": true,
  "published_by": 2045,
  "rating": "5",
  "steamid": null,
  "gogid": null,
  "gogslug": "",
  "humblestoreid": "",
  "script": {
    "files": [
      {
        "game": {
          "filename": "ultrastardx.tar.xz",
          "url": "https://djazz.se/nas/games/?dl=ultrastardx-200317-x86_64"
        }
      },
      {
        "updater": {
          "filename": "mlk-updater.zip",
          "url": "https://gist.github.com/daniel-j/e2f49507a77cc96b9719c4111860ced4/archive/master.zip"
        }
      },
      {
        "avatars": {
          "filename": "avatars.tar.xz",
          "url": "https://djazz.se/nas/games/?dl=my-little-karaoke-avatars"
        }
      },
      {
        "themes": {
          "filename": "themes.zip",
          "url": "https://djazz.se/nas/games/?dl=my-little-karaoke-themes"
        }
      }
    ],
    "game": {
      "exe": "launch_updater.sh",
      "args": "-ConfigFile mlkconfig.ini"
    },
    "installer": [
      {
        "extract": {
          "file": "game",
          "dst": "$GAMEDIR"
        }
      },
      {
        "extract": {
          "file": "updater",
          "dst": "$GAMEDIR"
        }
      },
      {
        "chmodx": "launch.sh"
      },
      {
        "chmodx": "ultrastardx"
      },
      {
        "chmodx": "mlk-updater.py"
      },
      {
        "chmodx": "launch_updater.sh"
      },
      {
        "write_config": {
          "file": "$GAMEDIR/mlkconfig.ini",
          "value": "MyLittleKaraoke",
          "section": "Themes",
          "key": "Theme"
        }
      },
      {
        "write_config": {
          "file": "$GAMEDIR/mlkconfig.ini",
          "value": "MyLittleKaraoke",
          "section": "Themes",
          "key": "Skin"
        }
      },
      {
        "write_config": {
          "file": "$GAMEDIR/mlkconfig.ini",
          "value": "Blue",
          "section": "Themes",
          "key": "Color"
        }
      },
      {
        "write_config": {
          "file": "$GAMEDIR/mlkconfig.ini",
          "value": "Outline",
          "section": "Lyrics",
          "key": "LyricsStyle"
        }
      },
      {
        "write_config": {
          "file": "$GAMEDIR/mlkconfig.ini",
          "value": "Slide",
          "section": "Lyrics",
          "key": "LyricsEffect"
        }
      },
      {
        "write_config": {
          "file": "$GAMEDIR/mlkconfig.ini",
          "value": "Outline",
          "section": "Jukebox",
          "key": "LyricsStyle"
        }
      },
      {
        "write_config": {
          "file": "$GAMEDIR/mlkconfig.ini",
          "value": "Slide",
          "section": "Jukebox",
          "key": "LyricsEffect"
        }
      },
      {
        "write_config": {
          "file": "$GAMEDIR/mlkconfig.ini",
          "value": "On",
          "section": "Graphics",
          "key": "Oscilloscope"
        }
      },
      {
        "extract": {
          "file": "avatars",
          "dst": "$GAMEDIR/data/avatars"
        }
      },
      {
        "chmodx": "updater"
      },
      {
        "execute": {
          "file": "$GAMEDIR/mlk-updater.py",
          "disable_runtime": true,
          "description": "Updating My Little Karaoke",
          "args": "--data-dir \"$GAMEDIR/data\" --update"
        }
      },
      {
        "extract": {
          "file": "themes",
          "dst": "$GAMEDIR/data/themes"
        }
      }
    ]
  },
  "content": "files:\r\n- game:\r\n    filename: ultrastardx.tar.xz\r\n    url: https://djazz.se/nas/games/?dl=ultrastardx-200317-x86_64\r\n- updater:\r\n    filename: mlk-updater.zip\r\n    url: https://gist.github.com/daniel-j/e2f49507a77cc96b9719c4111860ced4/archive/master.zip\r\n- avatars:\r\n    filename: avatars.tar.xz\r\n    url: https://djazz.se/nas/games/?dl=my-little-karaoke-avatars\r\n- themes:\r\n    filename: themes.zip\r\n    url: https://djazz.se/nas/games/?dl=my-little-karaoke-themes\r\ngame:\r\n  args: -ConfigFile mlkconfig.ini\r\n  exe: launch_updater.sh\r\ninstaller:\r\n- extract:\r\n    dst: $GAMEDIR\r\n    file: game\r\n- extract:\r\n    dst: $GAMEDIR\r\n    file: updater\r\n- chmodx: launch.sh\r\n- chmodx: ultrastardx\r\n- chmodx: mlk-updater.py\r\n- chmodx: launch_updater.sh\r\n- write_config:\r\n    file: $GAMEDIR/mlkconfig.ini\r\n    key: Theme\r\n    section: Themes\r\n    value: MyLittleKaraoke\r\n- write_config:\r\n    file: $GAMEDIR/mlkconfig.ini\r\n    key: Skin\r\n    section: Themes\r\n    value: MyLittleKaraoke\r\n- write_config:\r\n    file: $GAMEDIR/mlkconfig.ini\r\n    key: Color\r\n    section: Themes\r\n    value: Blue\r\n- write_config:\r\n    file: $GAMEDIR/mlkconfig.ini\r\n    key: LyricsStyle\r\n    section: Lyrics\r\n    value: Outline\r\n- write_config:\r\n    file: $GAMEDIR/mlkconfig.ini\r\n    key: LyricsEffect\r\n    section: Lyrics\r\n    value: Slide\r\n- write_config:\r\n    file: $GAMEDIR/mlkconfig.ini\r\n    key: LyricsStyle\r\n    section: Jukebox\r\n    value: Outline\r\n- write_config:\r\n    file: $GAMEDIR/mlkconfig.ini\r\n    key: LyricsEffect\r\n    section: Jukebox\r\n    value: Slide\r\n- write_config:\r\n    file: $GAMEDIR/mlkconfig.ini\r\n    key: Oscilloscope\r\n    section: Graphics\r\n    value: 'On'\r\n- extract:\r\n    dst: $GAMEDIR/data/avatars\r\n    file: avatars\r\n- chmodx: updater\r\n- execute:\r\n    args: --data-dir \"$GAMEDIR/data\" --update\r\n    description: Updating My Little Karaoke\r\n    disable_runtime: true\r\n    file: $GAMEDIR/mlk-updater.py\r\n- extract:\r\n    dst: $GAMEDIR/data/themes\r\n    file: themes"
}