{
  "id": 3269,
  "game_id": 9910,
  "game_slug": "my-little-karaoke-singing-is-magic",
  "name": "My Little Karaoke: Singing is Magic",
  "year": 2012,
  "user": "djazz",
  "runner": "linux",
  "slug": "my-little-karaoke-singing-is-ultrastar-deluxe-add",
  "version": "UltraStar Deluxe Addon",
  "description": "Requires UltraStar Deluxe to be installed first",
  "notes": "Requires 16 GB free space.",
  "created_at": "2017-02-16T12:18:14.617000Z",
  "updated_at": "2017-04-27T09:05:22.873624Z",
  "draft": false,
  "published": true,
  "published_by": null,
  "rating": "",
  "steamid": null,
  "gogid": null,
  "gogslug": "",
  "humblestoreid": "",
  "script": {
    "files": [
      {
        "downloader": {
          "filename": "downloader.sh",
          "url": "http://djazz.se/nas/games/?dl=my-little-karaoke-songs"
        }
      },
      {
        "avatars": {
          "filename": "avatars.tar.xz",
          "url": "http://djazz.se/nas/games/?dl=my-little-karaoke-avatars"
        }
      }
    ],
    "requires": "ultrastar-deluxe",
    "game": {
      "args": "-ConfigFile mlkconfig.ini",
      "exe": "launch.sh"
    },
    "installer": [
      {
        "write_config": {
          "key": "Theme",
          "file": "$GAMEDIR/mlkconfig.ini",
          "section": "Themes",
          "value": "MyLittleKaraoke"
        }
      },
      {
        "write_config": {
          "key": "Skin",
          "file": "$GAMEDIR/mlkconfig.ini",
          "section": "Themes",
          "value": "MyLittleKaraoke"
        }
      },
      {
        "write_config": {
          "key": "Color",
          "file": "$GAMEDIR/mlkconfig.ini",
          "section": "Themes",
          "value": "Blue"
        }
      },
      {
        "extract": {
          "dst": "$GAMEDIR/data/avatars",
          "file": "avatars"
        }
      },
      {
        "chmodx": "downloader"
      },
      {
        "execute": {
          "args": "$GAMEDIR/data",
          "file": "downloader",
          "description": "Updating My Little Karaoke",
          "terminal": true
        }
      }
    ]
  },
  "content": "files:\n- downloader:\n    filename: downloader.sh\n    url: http://djazz.se/nas/games/?dl=my-little-karaoke-songs\n- avatars:\n    filename: avatars.tar.xz\n    url: http://djazz.se/nas/games/?dl=my-little-karaoke-avatars\ngame:\n  args: -ConfigFile mlkconfig.ini\n  exe: launch.sh\ninstaller:\n- write_config:\n    file: $GAMEDIR/mlkconfig.ini\n    key: Theme\n    section: Themes\n    value: MyLittleKaraoke\n- write_config:\n    file: $GAMEDIR/mlkconfig.ini\n    key: Skin\n    section: Themes\n    value: MyLittleKaraoke\n- write_config:\n    file: $GAMEDIR/mlkconfig.ini\n    key: Color\n    section: Themes\n    value: Blue\n- extract:\n    dst: $GAMEDIR/data/avatars\n    file: avatars\n- chmodx: downloader\n- execute:\n    args: $GAMEDIR/data\n    description: Updating My Little Karaoke\n    file: downloader\n    terminal: true\nrequires: ultrastar-deluxe\n"
}