{
  "id": 12645,
  "game_id": 688,
  "game_slug": "hitman-blood-money",
  "name": "Hitman: Blood Money",
  "year": 2006,
  "user": "Triffnix",
  "runner": "wine",
  "slug": "hitman-blood-money-gog",
  "version": "GOG",
  "description": null,
  "notes": "Changing the video resolution in-game crashes the game. Restart the game after changing the resolution or edit drive_c/GOG Games/Hitman Blood Money/HitmanBloodMoney.ini in the game's directory instead.",
  "created_at": "2019-04-06T21:47:48.185000Z",
  "updated_at": "2019-04-08T01:31:10.670458Z",
  "draft": false,
  "published": true,
  "published_by": 19464,
  "rating": "",
  "steamid": 6860,
  "gogid": null,
  "gogslug": "",
  "humblestoreid": "",
  "script": {
    "game": {
      "exe": "drive_c/GOG Games/Hitman Blood Money/HitmanBloodMoney.exe",
      "arch": "win32",
      "prefix": "$GAMEDIR"
    },
    "files": [
      {
        "dx2010": "https://lutris.net/files/tools/directx-2010.tar.gz"
      },
      {
        "installer": "N/A:Select the EXE downloaded from GOG"
      }
    ],
    "wine": {
      "esync": true,
      "version": "tkg-protonified-4.1-x86_64"
    },
    "installer": [
      {
        "task": {
          "description": "Creating WINE prefix",
          "prefix": "$GAMEDIR",
          "arch": "win32",
          "name": "create_prefix"
        }
      },
      {
        "extract": {
          "dst": "$CACHE/dxsetup",
          "file": "dx2010"
        }
      },
      {
        "task": {
          "args": "/silent",
          "prefix": "$GAMEDIR/prefix",
          "executable": "$CACHE/dxsetup/DXSETUP.exe",
          "name": "wineexec",
          "arch": "win32"
        }
      },
      {
        "task": {
          "arch": "win32",
          "prefix": "$GAMEDIR",
          "name": "winetricks",
          "app": "vcrun2003 win7"
        }
      },
      {
        "task": {
          "description": "Running Setup, please wait...",
          "args": "/VERYSILENT /SUPPRESSMSGBOXES",
          "executable": "installer",
          "name": "wineexec",
          "arch": "win32"
        }
      }
    ]
  },
  "content": "files:\n- dx2010: https://lutris.net/files/tools/directx-2010.tar.gz\n- installer: N/A:Select the EXE downloaded from GOG\ngame:\n  arch: win32\n  exe: drive_c/GOG Games/Hitman Blood Money/HitmanBloodMoney.exe\n  prefix: $GAMEDIR\ninstaller:\n- task:\n    arch: win32\n    description: Creating WINE prefix\n    name: create_prefix\n    prefix: $GAMEDIR\n- extract:\n    dst: $CACHE/dxsetup\n    file: dx2010\n- task:\n    arch: win32\n    args: /silent\n    executable: $CACHE/dxsetup/DXSETUP.exe\n    name: wineexec\n    prefix: $GAMEDIR/prefix\n- task:\n    app: vcrun2003 win7\n    arch: win32\n    name: winetricks\n    prefix: $GAMEDIR\n- task:\n    arch: win32\n    args: /VERYSILENT /SUPPRESSMSGBOXES\n    description: Running Setup, please wait...\n    executable: installer\n    name: wineexec\nwine:\n  esync: true\n  version: tkg-protonified-4.1-x86_64\n"
}