{
  "id": 22627,
  "game_id": 30265,
  "game_slug": "blitz",
  "name": "Blitz",
  "year": null,
  "user": "darkbree",
  "runner": "wine",
  "slug": "blitz-1",
  "version": "1",
  "description": null,
  "notes": "",
  "created_at": "2020-07-29T22:23:13.052741Z",
  "updated_at": "2020-07-29T22:23:13.052765Z",
  "draft": true,
  "published": false,
  "published_by": null,
  "rating": "",
  "steamid": null,
  "gogid": null,
  "gogslug": "",
  "humbleid": "",
  "humblestoreid": "",
  "humblestoreid_real": "",
  "script": {
    "script": {
      "files": [
        {
          "BlitzInstaller": {
            "filename": "blitz-installer.exe",
            "url": "https://dl.blitz.gg/download/windows"
          }
        },
        {
          "MonoInstaller": "https://dl.winehq.org/wine/wine-mono/4.8.2/wine-mono-4.8.2.msi"
        }
      ],
      "game": {
        "exe": "drive_c/users/$USER/Local Settings/Application Data/Blitz/Blitz.exe",
        "prefix": "$GAMEDIR"
      },
      "installer": [
        {
          "task": {
            "args": "uninstaller --remove '{7290EA95-9F17-58E8-8436-4A532DA0F54E}'",
            "description": "Temporarily removing Wine Mono",
            "executable": "",
            "name": "wineexec",
            "prefix": "$GAMEDIR"
          }
        },
        {
          "task": {
            "app": "dotnet452 win7 corefonts",
            "description": "Installing prerequisites",
            "name": "winetricks",
            "prefix": "$GAMEDIR"
          }
        },
        {
          "task": {
            "description": "Running Blitz app installer",
            "exclude_processes": "Update.exe Blitz.exe blitz-installer",
            "executable": "BlitzInstaller",
            "name": "wineexec",
            "prefix": "$GAMEDIR"
          }
        },
        {
          "task": {
            "name": "winekill",
            "prefix": "$GAMEDIR"
          }
        },
        {
          "task": {
            "description": "Configuring DLL Overrides",
            "key": "mscoree",
            "name": "set_regedit",
            "path": "HKEY_CURRENT_USER\\Software\\Wine\\DllOverrides",
            "prefix": "$GAMEDIR",
            "value": ""
          }
        },
        {
          "task": {
            "description": "Configuring DLL Overrides for Blitz",
            "key": "mscoree",
            "name": "set_regedit",
            "path": "HKEY_CURRENT_USER\\Software\\Wine\\AppDefaults\\Blitz.exe\\DllOverrides",
            "prefix": "$GAMEDIR",
            "value": "native"
          }
        },
        {
          "task": {
            "description": "Reinstalling Wine Mono",
            "executable": "MonoInstaller",
            "name": "wineexec",
            "prefix": "$GAMEDIR"
          }
        }
      ],
      "requires": "league-of-legends"
    }
  },
  "content": "script:\n  files:\n  - BlitzInstaller:\n      filename: blitz-installer.exe\n      url: https://dl.blitz.gg/download/windows\n  - MonoInstaller: https://dl.winehq.org/wine/wine-mono/4.8.2/wine-mono-4.8.2.msi\n  game:\n    exe: drive_c/users/$USER/Local Settings/Application Data/Blitz/Blitz.exe\n    prefix: $GAMEDIR\n  installer:\n  - task:\n      args: uninstaller --remove '{7290EA95-9F17-58E8-8436-4A532DA0F54E}'\n      description: Temporarily removing Wine Mono\n      executable: ''\n      name: wineexec\n      prefix: $GAMEDIR\n  - task:\n      app: dotnet452 win7 corefonts\n      description: Installing prerequisites\n      name: winetricks\n      prefix: $GAMEDIR\n  - task:\n      description: Running Blitz app installer\n      exclude_processes: Update.exe Blitz.exe blitz-installer\n      executable: BlitzInstaller\n      name: wineexec\n      prefix: $GAMEDIR\n  - task:\n      name: winekill\n      prefix: $GAMEDIR\n  - task:\n      description: Configuring DLL Overrides\n      key: mscoree\n      name: set_regedit\n      path: HKEY_CURRENT_USER\\Software\\Wine\\DllOverrides\n      prefix: $GAMEDIR\n      value: ''\n  - task:\n      description: Configuring DLL Overrides for Blitz\n      key: mscoree\n      name: set_regedit\n      path: HKEY_CURRENT_USER\\Software\\Wine\\AppDefaults\\Blitz.exe\\DllOverrides\n      prefix: $GAMEDIR\n      value: native\n  - task:\n      description: Reinstalling Wine Mono\n      executable: MonoInstaller\n      name: wineexec\n      prefix: $GAMEDIR\n  requires: league-of-legends\n"
}