{
  "id": 16741,
  "game_id": 30265,
  "game_slug": "blitz",
  "name": "Blitz",
  "year": null,
  "user": "nkay08",
  "runner": "wine",
  "slug": "blitz-lol",
  "version": "lol",
  "description": "Installs the Blitz companion app in the league-of-legends prefix.\r\nleague-of-legends is required for installation.",
  "notes": "",
  "created_at": "2019-11-10T12:54:30.263130Z",
  "updated_at": "2019-11-10T12:54:30.263159Z",
  "draft": true,
  "published": false,
  "published_by": null,
  "rating": "",
  "steamid": null,
  "gogid": null,
  "gogslug": "",
  "humblestoreid": "",
  "script": {
    "installer": [
      {
        "task": {
          "description": "Installing prerequisites",
          "app": "dotnet452 win7 corefonts",
          "prefix": "$GAMEDIR",
          "name": "winetricks"
        }
      },
      {
        "task": {
          "exclude_processes": "Update.exe Blitz.exe blitz-installer",
          "executable": "BlitzInstaller",
          "description": "Running Blitz app installer",
          "prefix": "$GAMEDIR",
          "name": "wineexec"
        }
      },
      {
        "task": {
          "prefix": "$GAMEDIR",
          "name": "winekill"
        }
      }
    ],
    "requires": "league-of-legends",
    "files": [
      {
        "BlitzInstaller": {
          "url": "https://dl.blitz.gg/download/windows",
          "filename": "blitz-installer.exe"
        }
      }
    ],
    "game": {
      "prefix": "$GAMEDIR",
      "exe": "drive_c/users/$USER/Local Settings/Application Data/Blitz/Blitz.exe"
    }
  },
  "content": "files:\n- BlitzInstaller:\n    filename: blitz-installer.exe\n    url: https://dl.blitz.gg/download/windows\ngame:\n  exe: drive_c/users/$USER/Local Settings/Application Data/Blitz/Blitz.exe\n  prefix: $GAMEDIR\ninstaller:\n- task:\n    app: dotnet452 win7 corefonts\n    description: Installing prerequisites\n    name: winetricks\n    prefix: $GAMEDIR\n- task:\n    description: Running Blitz app installer\n    exclude_processes: Update.exe Blitz.exe blitz-installer\n    executable: BlitzInstaller\n    name: wineexec\n    prefix: $GAMEDIR\n- task:\n    name: winekill\n    prefix: $GAMEDIR\nrequires: league-of-legends\n"
}