{
  "id": 14907,
  "game_id": 13942,
  "game_slug": "starcraft-remastered",
  "name": "Starcraft Remastered",
  "year": 2017,
  "user": "Bloodlvst",
  "runner": "wine",
  "slug": "starcraft-remastered-new-download-source-",
  "version": "New Download Source Test",
  "description": null,
  "notes": "",
  "created_at": "2019-08-07T06:49:23.249150Z",
  "updated_at": "2019-08-07T06:49:23.249180Z",
  "draft": true,
  "published": false,
  "published_by": null,
  "rating": "",
  "steamid": null,
  "gogid": null,
  "gogslug": "",
  "humblestoreid": "",
  "script": {
    "game": {
      "exe": "drive_c/Program Files (x86)/Battle.net/Battle.net Launcher.exe",
      "arch": "win64",
      "prefix": "$GAMEDIR"
    },
    "files": [
      {
        "setup": {
          "filename": "Battle.net-Setup.exe",
          "url": "http://dist.blizzard.com/downloads/bna-installers/322d5bb9ae0318de3d4cde7641c96425/retail.1/Battle.net-Setup-enUS.exe"
        }
      }
    ],
    "wine": {
      "version": "tkg-3.20-x86_64"
    },
    "installer": [
      {
        "task": {
          "description": "Creating 64bit Wine prefix.",
          "prefix": "$GAMEDIR",
          "arch": "win64",
          "name": "create_prefix"
        }
      },
      {
        "task": {
          "description": "Installing Arial font",
          "arch": "win64",
          "prefix": "$GAMEDIR",
          "name": "winetricks",
          "app": "arial"
        }
      },
      {
        "task": {
          "description": "Setting fontsmooth=rbg",
          "arch": "win64",
          "prefix": "$GAMEDIR",
          "name": "winetricks",
          "app": "fontsmooth-rgb"
        }
      },
      {
        "task": {
          "prefix": "$GAMEDIR",
          "name": "set_regedit",
          "description": "Setting Windows 10 mode for Wine",
          "path": "HKEY_CURRENT_USER\\Software\\Wine",
          "value": "win10",
          "key": "Version",
          "arch": "win64"
        }
      },
      {
        "write_json": {
          "description": "Disabling Sound/Hardware Acceleration/Streaming in Blizzard App",
          "data": {
            "Client": {
              "GameLaunchWindowBehavior": "2",
              "HardwareAcceleration": "false",
              "Sound": {
                "Enabled": "false"
              },
              "Streaming": {
                "StreamingEnabled": "false"
              }
            }
          },
          "file": "$GAMEDIR/drive_c/users/$USER/Application Data/Battle.net/Battle.net.config"
        }
      },
      {
        "task": {
          "description": "Installing Blizzard App\n------------------------------\nDo not try to log into Battle.net. Lutris will automatically close the login window. After Lutris installer is finished, you can start Blizzard App with \"Launch the game\", and install / locate your Blizzard game.",
          "executable": "setup",
          "arch": "win64",
          "exclude_processes": "Battle.net.exe Agent.exe \"Battle.net Helper.exe\"",
          "name": "wineexec"
        }
      },
      {
        "task": {
          "prefix": "$GAMEDIR",
          "name": "winekill"
        }
      }
    ]
  },
  "content": "files:\n- setup:\n    filename: Battle.net-Setup.exe\n    url: http://dist.blizzard.com/downloads/bna-installers/322d5bb9ae0318de3d4cde7641c96425/retail.1/Battle.net-Setup-enUS.exe\ngame:\n  arch: win64\n  exe: drive_c/Program Files (x86)/Battle.net/Battle.net Launcher.exe\n  prefix: $GAMEDIR\ninstaller:\n- task:\n    arch: win64\n    description: Creating 64bit Wine prefix.\n    name: create_prefix\n    prefix: $GAMEDIR\n- task:\n    app: arial\n    arch: win64\n    description: Installing Arial font\n    name: winetricks\n    prefix: $GAMEDIR\n- task:\n    app: fontsmooth-rgb\n    arch: win64\n    description: Setting fontsmooth=rbg\n    name: winetricks\n    prefix: $GAMEDIR\n- task:\n    arch: win64\n    description: Setting Windows 10 mode for Wine\n    key: Version\n    name: set_regedit\n    path: HKEY_CURRENT_USER\\Software\\Wine\n    prefix: $GAMEDIR\n    value: win10\n- write_json:\n    data:\n      Client:\n        GameLaunchWindowBehavior: '2'\n        HardwareAcceleration: 'false'\n        Sound:\n          Enabled: 'false'\n        Streaming:\n          StreamingEnabled: 'false'\n    description: Disabling Sound/Hardware Acceleration/Streaming in Blizzard App\n    file: $GAMEDIR/drive_c/users/$USER/Application Data/Battle.net/Battle.net.config\n- task:\n    arch: win64\n    description: 'Installing Blizzard App\n\n      ------------------------------\n\n      Do not try to log into Battle.net. Lutris will automatically close the login\n      window. After Lutris installer is finished, you can start Blizzard App with\n      \"Launch the game\", and install / locate your Blizzard game.'\n    exclude_processes: Battle.net.exe Agent.exe \"Battle.net Helper.exe\"\n    executable: setup\n    name: wineexec\n- task:\n    name: winekill\n    prefix: $GAMEDIR\nwine:\n  version: tkg-3.20-x86_64\n"
}