{
  "id": 2525,
  "game_id": 7244,
  "game_slug": "orb-off-world-resource-base",
  "name": "O.R.B: Off-World Resource Base",
  "year": 2002,
  "user": "ssf",
  "runner": "wine",
  "slug": "orb-off-world-resource-base-gogcom",
  "version": "GOG.com",
  "description": "",
  "notes": "",
  "created_at": "2016-08-21T16:22:13.972554Z",
  "updated_at": "2016-09-30T21:08:07.404589Z",
  "draft": false,
  "published": true,
  "published_by": null,
  "rating": "",
  "steamid": 281390,
  "gogid": 1207659155,
  "gogslug": "orb_offworld_resource_base",
  "humblestoreid": "",
  "script": {
    "game": {
      "exe": "drive_c/game/orb.exe",
      "arch": "win32",
      "prefix": "$GAMEDIR"
    },
    "files": [
      {
        "game": "N/A:Please select the GOG.com Windows installer."
      }
    ],
    "installer": [
      {
        "task": {
          "description": "Creating Wine prefix",
          "prefix": "$GAMEDIR",
          "name": "create_prefix"
        }
      },
      {
        "task": {
          "prefix": "$GAMEDIR",
          "name": "set_regedit",
          "path": "HKEY_CURRENT_USER\\Software\\Wine\\DllOverrides",
          "value": "",
          "key": "winemenubuilder.exe",
          "type": "REG_SZ"
        }
      },
      {
        "task": {
          "description": "Installing...",
          "prefix": "$GAMEDIR",
          "executable": "game",
          "name": "wineexec",
          "args": "/VERYSILENT /SP- /NOCANCEL /SUPPRESSMSGBOXES '/DIR=C:/game'"
        }
      },
      {
        "task": {
          "description": "Disabling unused WINE features",
          "silent": true,
          "prefix": "$GAMEDIR",
          "app": "sandbox",
          "name": "winetricks"
        }
      }
    ],
    "gogid": "orb_offworld_resource_base"
  },
  "content": "files:\n- game: N/A:Please select the GOG.com Windows installer.\ngame:\n  arch: win32\n  exe: drive_c/game/orb.exe\n  prefix: $GAMEDIR\ngogid: orb_offworld_resource_base\ninstaller:\n- task:\n    description: Creating Wine prefix\n    name: create_prefix\n    prefix: $GAMEDIR\n- task:\n    key: winemenubuilder.exe\n    name: set_regedit\n    path: HKEY_CURRENT_USER\\Software\\Wine\\DllOverrides\n    prefix: $GAMEDIR\n    type: REG_SZ\n    value: ''\n- task:\n    args: /VERYSILENT /SP- /NOCANCEL /SUPPRESSMSGBOXES '/DIR=C:/game'\n    description: Installing...\n    executable: game\n    name: wineexec\n    prefix: $GAMEDIR\n- task:\n    app: sandbox\n    description: Disabling unused WINE features\n    name: winetricks\n    prefix: $GAMEDIR\n    silent: true\n"
}