{
  "id": 13407,
  "game_id": 12377,
  "game_slug": "crossout",
  "name": "Crossout",
  "year": null,
  "user": "kalter",
  "runner": "wine",
  "slug": "crossout-standalone",
  "version": "Standalone",
  "description": null,
  "notes": "Dependencies:\r\n- core fonts\r\n- d3dx9\r\n- dotnet 40\r\n- gdiplus\r\n- tahoma\r\n- vcrun20xx",
  "created_at": "2019-05-09T10:27:47.405355Z",
  "updated_at": "2019-05-09T10:27:47.405382Z",
  "draft": false,
  "published": false,
  "published_by": null,
  "rating": "",
  "steamid": 386180,
  "gogid": null,
  "gogslug": "",
  "humblestoreid": "",
  "script": {
    "game": {
      "exe": "drive_c/users/$USER/\"Local Settings\"/Application Data/Crossout/launcher.exe",
      "arch": "win64",
      "prefix": "$GAMEDIR"
    },
    "files": [
      {
        "crossout": "N/A:Select the exe downloaded from https://yupmaster.gaijinent.com/launcher/current.php?id=CrossoutLauncher"
      }
    ],
    "system": {
      "env": {
        "DXVK_LOG_LEVEL": "none",
        "DXVK_HUD": 0
      },
      "pulse_latency": true
    },
    "installer": [
      {
        "task": {
          "prefix": "$GAMEDIR",
          "arch": "win64",
          "name": "create_prefix"
        }
      },
      {
        "task": {
          "description": "Installing corefonts, tahoma, d3dx9, gdiplus, Visual C++",
          "arch": "win64",
          "prefix": "$GAMEDIR",
          "name": "winetricks",
          "app": "corefonts tahoma d3dx9 gdiplus vcrun20xx"
        }
      },
      {
        "task": {
          "description": "Installing .NET 4.0 (This takes a while, please wait)",
          "arch": "win64",
          "prefix": "$GAMEDIR",
          "name": "winetricks",
          "app": "dotnet40 win7"
        }
      },
      {
        "task": {
          "description": "Installing Launcher. Close launcher after install!",
          "prefix": "$GAMEDIR",
          "executable": "crossout",
          "arch": "win64",
          "name": "wineexec"
        }
      }
    ],
    "wine": {
      "esync": true,
      "dxvk": true,
      "version": "tkg-4.2-x86_64"
    }
  },
  "content": "files:\n- crossout: N/A:Select the exe downloaded from https://yupmaster.gaijinent.com/launcher/current.php?id=CrossoutLauncher\ngame:\n  arch: win64\n  exe: drive_c/users/$USER/\"Local Settings\"/Application Data/Crossout/launcher.exe\n  prefix: $GAMEDIR\ninstaller:\n- task:\n    arch: win64\n    name: create_prefix\n    prefix: $GAMEDIR\n- task:\n    app: corefonts tahoma d3dx9 gdiplus vcrun20xx\n    arch: win64\n    description: Installing corefonts, tahoma, d3dx9, gdiplus, Visual C++\n    name: winetricks\n    prefix: $GAMEDIR\n- task:\n    app: dotnet40 win7\n    arch: win64\n    description: Installing .NET 4.0 (This takes a while, please wait)\n    name: winetricks\n    prefix: $GAMEDIR\n- task:\n    arch: win64\n    description: Installing Launcher. Close launcher after install!\n    executable: crossout\n    name: wineexec\n    prefix: $GAMEDIR\nsystem:\n  env:\n    DXVK_HUD: 0\n    DXVK_LOG_LEVEL: none\n  pulse_latency: true\nwine:\n  dxvk: true\n  esync: true\n  version: tkg-4.2-x86_64\n"
}