{
  "id": 15416,
  "game_id": 4403,
  "game_slug": "bound-by-flame",
  "name": "Bound By Flame",
  "year": 2014,
  "user": "gabornvalorden",
  "runner": "wine",
  "slug": "bound-by-flame-gog",
  "version": "GOG",
  "description": null,
  "notes": "",
  "created_at": "2019-09-09T08:15:42.255000Z",
  "updated_at": "2019-10-06T22:52:07.997637Z",
  "draft": false,
  "published": true,
  "published_by": 19464,
  "rating": "",
  "steamid": 243930,
  "gogid": null,
  "gogslug": "",
  "humblestoreid": "",
  "script": {
    "system": {
      "env": {
        "mesa_glthread": "true",
        "DXVK_HUD": "compiler"
      }
    },
    "game": {
      "arch": "win64",
      "prefix": "$GAMEDIR",
      "exe": "drive_c/GOG Games/Bound By Flame/BoundByFlame.exe"
    },
    "wine": {
      "dxvk": true,
      "version": "lutris-4.12.1-x86_64"
    },
    "files": [
      {
        "setup": "N/A:Select the game's setup file"
      }
    ],
    "installer": [
      {
        "task": {
          "arch": "win64",
          "prefix": "$GAMEDIR",
          "name": "create_prefix"
        }
      },
      {
        "task": {
          "arch": "win64",
          "prefix": "$GAMEDIR",
          "name": "winetricks",
          "app": "vcrun2010 vcrun2017 win7 dotNet462 win7"
        }
      },
      {
        "task": {
          "prefix": "$GAMEDIR",
          "executable": "setup",
          "args": "/SP- /SUPPRESSMSGBOXES /NOCANCEL",
          "description": "Installing Bound By Flame",
          "name": "wineexec"
        }
      }
    ]
  },
  "content": "files:\n- setup: N/A:Select the game's setup file\ngame:\n  arch: win64\n  exe: drive_c/GOG Games/Bound By Flame/BoundByFlame.exe\n  prefix: $GAMEDIR\ninstaller:\n- task:\n    arch: win64\n    name: create_prefix\n    prefix: $GAMEDIR\n- task:\n    app: vcrun2010 vcrun2017 win7 dotNet462 win7\n    arch: win64\n    name: winetricks\n    prefix: $GAMEDIR\n- task:\n    args: /SP- /SUPPRESSMSGBOXES /NOCANCEL\n    description: Installing Bound By Flame\n    executable: setup\n    name: wineexec\n    prefix: $GAMEDIR\nsystem:\n  env:\n    DXVK_HUD: compiler\n    mesa_glthread: 'true'\nwine:\n  dxvk: true\n  version: lutris-4.12.1-x86_64\n"
}