{
  "id": 1744,
  "game_id": 5338,
  "game_slug": "mechwarrior-online",
  "name": "MechWarrior Online",
  "year": 2015,
  "user": "Vorgen",
  "runner": "winesteam",
  "slug": "mechwarrior-online-steam",
  "version": "Steam",
  "description": null,
  "notes": "",
  "created_at": "2015-12-23T12:41:48.840000Z",
  "updated_at": "2019-02-10T20:14:53.118852Z",
  "draft": false,
  "published": true,
  "published_by": 19464,
  "rating": "",
  "steamid": 342200,
  "gogid": null,
  "gogslug": "",
  "humblestoreid": "",
  "script": {
    "system": {
      "env": {
        "DXVK_HUD": 0
      }
    },
    "winesteam": {
      "dxvk": true,
      "version": "tkg-mwo-4.1-x86_64"
    },
    "game": {
      "arch": "win64",
      "prefix": "$GAMEDIR/prefix",
      "appid": 342200
    },
    "files": [
      {
        "dx2010": "https://lutris.net/files/tools/directx-2010.tar.gz"
      }
    ],
    "installer": [
      {
        "extract": {
          "dst": "$CACHE/dxsetup",
          "file": "dx2010"
        }
      },
      {
        "task": {
          "arch": "win64",
          "prefix": "$GAMEDIR/prefix",
          "name": "create_prefix"
        }
      },
      {
        "task": {
          "arch": "win64",
          "executable": "$CACHE/dxsetup/DXSETUP.exe",
          "prefix": "$GAMEDIR/prefix",
          "name": "wineexec",
          "args": "/silent"
        }
      },
      {
        "task": {
          "arch": "win64",
          "prefix": "$GAMEDIR/prefix",
          "name": "winekill"
        }
      },
      {
        "task": {
          "arch": "win64",
          "prefix": "$GAMEDIR/prefix",
          "name": "winetricks",
          "app": "vcrun2010"
        }
      },
      {
        "task": {
          "arch": "win64",
          "prefix": "$GAMEDIR/prefix",
          "name": "winetricks",
          "app": "dotnet472 win7"
        }
      }
    ]
  },
  "content": "files:\n- dx2010: https://lutris.net/files/tools/directx-2010.tar.gz\ngame:\n  appid: 342200\n  arch: win64\n  prefix: $GAMEDIR/prefix\ninstaller:\n- extract:\n    dst: $CACHE/dxsetup\n    file: dx2010\n- task:\n    arch: win64\n    name: create_prefix\n    prefix: $GAMEDIR/prefix\n- task:\n    arch: win64\n    args: /silent\n    executable: $CACHE/dxsetup/DXSETUP.exe\n    name: wineexec\n    prefix: $GAMEDIR/prefix\n- task:\n    arch: win64\n    name: winekill\n    prefix: $GAMEDIR/prefix\n- task:\n    app: vcrun2010\n    arch: win64\n    name: winetricks\n    prefix: $GAMEDIR/prefix\n- task:\n    app: dotnet472 win7\n    arch: win64\n    name: winetricks\n    prefix: $GAMEDIR/prefix\nsystem:\n  env:\n    DXVK_HUD: 0\nwinesteam:\n  dxvk: true\n  version: tkg-mwo-4.1-x86_64\n"
}