{
  "id": 20701,
  "game_id": 33209,
  "game_slug": "lose-your-marbles",
  "name": "Lose Your Marbles",
  "year": 1997,
  "user": "nastys",
  "runner": "wine",
  "slug": "lose-your-marbles-cd",
  "version": "CD",
  "description": null,
  "notes": "A MIDI synthesizer, such as QSynth, and a soundfont, such as Fluid R3 GM, are required for music playback.\r\nipxemu is used for IPX emulation.",
  "created_at": "2020-05-22T19:24:31.261000Z",
  "updated_at": "2020-05-24T06:16:36.834696Z",
  "draft": false,
  "published": true,
  "published_by": 20548,
  "rating": "",
  "steamid": null,
  "gogid": null,
  "gogslug": "",
  "humbleid": "",
  "humblestoreid": "",
  "humblestoreid_real": "",
  "script": {
    "files": [
      {
        "ipxemu": {
          "filename": "ipxemu-1.0.4.zip",
          "referer": "https://sourceforge.net/projects/ipxemu/files/ipxemu-1.0.4/ipxemu-1.0.4.zip/download",
          "url": "https://liquidtelecom.dl.sourceforge.net/project/ipxemu/ipxemu-1.0.4/ipxemu-1.0.4.zip"
        }
      }
    ],
    "game": {
      "arch": "win32",
      "exe": "$GAMEDIR/drive_c/Program Files/SegaSoft/Lose Your Marbles/marbles.exe",
      "prefix": "$GAMEDIR"
    },
    "installer": [
      {
        "insert-disc": {
          "requires": "otto.exe"
        }
      },
      {
        "task": {
          "arch": "win32",
          "description": "Creating Wine prefix...",
          "install_gecko": false,
          "install_mono": false,
          "name": "create_prefix",
          "prefix": "$GAMEDIR"
        }
      },
      {
        "task": {
          "app": "win95",
          "name": "winetricks",
          "prefix": "$GAMEDIR"
        }
      },
      {
        "task": {
          "app": "directplay",
          "name": "winetricks",
          "prefix": "$GAMEDIR"
        }
      },
      {
        "task": {
          "arch": "win32",
          "description": "Installing Lose Your Marbles...",
          "executable": "$DISC/setup.exe",
          "name": "wineexec",
          "prefix": "$GAMEDIR"
        }
      },
      {
        "extract": {
          "dst": "$GAMEDIR/drive_c/Program Files/SegaSoft/Lose Your Marbles/",
          "file": "ipxemu",
          "format": "zip"
        }
      }
    ],
    "wine": {
      "Desktop": true,
      "WineDesktop": "640x480",
      "dxvk": false,
      "overrides": {
        "wsock32.dll": "n"
      }
    }
  },
  "content": "files:\n- ipxemu:\n    filename: ipxemu-1.0.4.zip\n    referer: https://sourceforge.net/projects/ipxemu/files/ipxemu-1.0.4/ipxemu-1.0.4.zip/download\n    url: https://liquidtelecom.dl.sourceforge.net/project/ipxemu/ipxemu-1.0.4/ipxemu-1.0.4.zip\ngame:\n  arch: win32\n  exe: $GAMEDIR/drive_c/Program Files/SegaSoft/Lose Your Marbles/marbles.exe\n  prefix: $GAMEDIR\ninstaller:\n- insert-disc:\n    requires: otto.exe\n- task:\n    arch: win32\n    description: Creating Wine prefix...\n    install_gecko: false\n    install_mono: false\n    name: create_prefix\n    prefix: $GAMEDIR\n- task:\n    app: win95\n    name: winetricks\n    prefix: $GAMEDIR\n- task:\n    app: directplay\n    name: winetricks\n    prefix: $GAMEDIR\n- task:\n    arch: win32\n    description: Installing Lose Your Marbles...\n    executable: $DISC/setup.exe\n    name: wineexec\n    prefix: $GAMEDIR\n- extract:\n    dst: $GAMEDIR/drive_c/Program Files/SegaSoft/Lose Your Marbles/\n    file: ipxemu\n    format: zip\nwine:\n  Desktop: true\n  WineDesktop: 640x480\n  dxvk: false\n  overrides:\n    wsock32.dll: n\n"
}