{
  "id": 934,
  "game_id": 140,
  "game_slug": "unreal-tournament-2004",
  "name": "Unreal Tournament 2004",
  "year": 2004,
  "user": "Xodetaetl",
  "runner": "wine",
  "slug": "unreal-tournament-2004-gog",
  "version": "GOG",
  "description": null,
  "notes": "Recent GOG installer required (v2 or above). \r\nIf you have graphical issues, try the Direct3D renderer from the settings in-game or by deleting UT2004.ini in the game's System folder, to reset to the default configuration.",
  "created_at": "2014-10-20T08:50:56.524000Z",
  "updated_at": "2019-03-07T04:15:40.655064Z",
  "draft": false,
  "published": true,
  "published_by": 19464,
  "rating": "",
  "steamid": 13230,
  "gogid": 1207658691,
  "gogslug": "unreal_tournament_2004_ece",
  "humblestoreid": "",
  "script": {
    "game": {
      "exe": "drive_c/GOG Games/Unreal Tournament 2004/System/UT2004.exe",
      "arch": "win32",
      "prefix": "$GAMEDIR"
    },
    "files": [
      {
        "game": "N/A:Select the game's setup file downloaded from GOG."
      }
    ],
    "wine": {
      "version": "tkg-4.2-x86_64"
    },
    "installer": [
      {
        "task": {
          "description": "Creating Wine prefix",
          "prefix": "$GAMEDIR",
          "arch": "win32",
          "name": "create_prefix"
        }
      },
      {
        "task": {
          "prefix": "$GAMEDIR",
          "app": "windowmanagermanaged=n",
          "name": "winetricks"
        }
      },
      {
        "task": {
          "prefix": "$GAMEDIR",
          "executable": "game",
          "name": "wineexec"
        }
      },
      {
        "write_config": {
          "section": "Engine.Engine",
          "value": "OpenGLDrv.OpenGLRenderDevice",
          "key": "RenderDevice",
          "file": "$GAMEDIR/drive_c/GOG Games/Unreal Tournament 2004/System/UT2004.ini"
        }
      },
      {
        "write_config": {
          "section": "Editor.EditorEngine",
          "value": 64,
          "key": "CacheSizeMegs",
          "file": "$GAMEDIR/drive_c/GOG Games/Unreal Tournament 2004/System/UT2004.ini"
        }
      }
    ]
  },
  "content": "files:\n- game: N/A:Select the game's setup file downloaded from GOG.\ngame:\n  arch: win32\n  exe: drive_c/GOG Games/Unreal Tournament 2004/System/UT2004.exe\n  prefix: $GAMEDIR\ninstaller:\n- task:\n    arch: win32\n    description: Creating Wine prefix\n    name: create_prefix\n    prefix: $GAMEDIR\n- task:\n    app: windowmanagermanaged=n\n    name: winetricks\n    prefix: $GAMEDIR\n- task:\n    executable: game\n    name: wineexec\n    prefix: $GAMEDIR\n- write_config:\n    file: $GAMEDIR/drive_c/GOG Games/Unreal Tournament 2004/System/UT2004.ini\n    key: RenderDevice\n    section: Engine.Engine\n    value: OpenGLDrv.OpenGLRenderDevice\n- write_config:\n    file: $GAMEDIR/drive_c/GOG Games/Unreal Tournament 2004/System/UT2004.ini\n    key: CacheSizeMegs\n    section: Editor.EditorEngine\n    value: 64\nwine:\n  version: tkg-4.2-x86_64\n"
}