{
  "id": 13065,
  "game_id": 9982,
  "game_slug": "star-warstm-rogue-squadron-3d",
  "name": "STAR WARSâ„¢: Rogue Squadron 3D",
  "year": null,
  "user": "skyace65",
  "runner": "wine",
  "slug": "star-warstm-rogue-squadron-3d-gog",
  "version": "GOG",
  "description": null,
  "notes": "",
  "created_at": "2019-04-24T01:55:21.317000Z",
  "updated_at": "2019-04-24T02:04:36.501928Z",
  "draft": false,
  "published": true,
  "published_by": 19464,
  "rating": "",
  "steamid": 455910,
  "gogid": 1421404950,
  "gogslug": "star_wars_rogue_squadron_3d",
  "humblestoreid": "",
  "script": {
    "files": [
      {
        "game": "N/A:Please select the GOG.com Windows installer."
      }
    ],
    "game": {
      "prefix": "$GAMEDIR",
      "arch": "win32",
      "exe": "drive_c/GOG Games/Star Wars - Rogue Squadron 3D/ROGUE/ROGUE.EXE"
    },
    "installer": [
      {
        "task": {
          "description": "Creating Wine prefix",
          "name": "create_prefix",
          "arch": "win32",
          "prefix": "$GAMEDIR"
        }
      },
      {
        "task": {
          "args": "/SP- /NOCANCEL /SUPPRESSMSGBOXES",
          "name": "wineexec",
          "arch": "win32",
          "executable": "game",
          "prefix": "$GAMEDIR"
        }
      },
      {
        "task": {
          "prefix": "GAMEDIR",
          "name": "winetricks",
          "arch": "win32",
          "app": "dsound"
        }
      },
      {
        "task": {
          "description": "Enable Windows 98 compatibility mode",
          "name": "set_regedit",
          "arch": "win32",
          "key": "Version",
          "prefix": "GAMEDIR",
          "path": "HKEY_CURRENT_USER\\Software\\Wine",
          "value": "win98"
        }
      }
    ]
  },
  "content": "files:\n- game: N/A:Please select the GOG.com Windows installer.\ngame:\n  arch: win32\n  exe: drive_c/GOG Games/Star Wars - Rogue Squadron 3D/ROGUE/ROGUE.EXE\n  prefix: $GAMEDIR\ninstaller:\n- task:\n    arch: win32\n    description: Creating Wine prefix\n    name: create_prefix\n    prefix: $GAMEDIR\n- task:\n    arch: win32\n    args: /SP- /NOCANCEL /SUPPRESSMSGBOXES\n    executable: game\n    name: wineexec\n    prefix: $GAMEDIR\n- task:\n    app: dsound\n    arch: win32\n    name: winetricks\n    prefix: GAMEDIR\n- task:\n    arch: win32\n    description: Enable Windows 98 compatibility mode\n    key: Version\n    name: set_regedit\n    path: HKEY_CURRENT_USER\\Software\\Wine\n    prefix: GAMEDIR\n    value: win98\n"
}