{
  "id": 17559,
  "game_id": 7611,
  "game_slug": "the-settlers-iv-gold-edition",
  "name": "The Settlers IV: Gold Edition",
  "year": 2002,
  "user": "Kesefon",
  "runner": "wine",
  "slug": "the-settlers-iv-gold-edition-cd-german",
  "version": "CD German",
  "description": null,
  "notes": "",
  "created_at": "2019-12-24T22:45:21.356000Z",
  "updated_at": "2019-12-25T10:16:44.200498Z",
  "draft": false,
  "published": true,
  "published_by": 20548,
  "rating": "",
  "steamid": null,
  "gogid": 1207659254,
  "gogslug": "the_settlers_4_gold_edition",
  "humblestoreid": "",
  "script": {
    "game": {
      "arch": "win32",
      "exe": "drive_c/Blue Byte/Die Siedler IV/S4.exe",
      "prefix": "$GAMEDIR"
    },
    "installer": [
      {
        "insert-disc": {
          "description": "Insert disc",
          "requires": "S4/setup.exe"
        }
      },
      {
        "task": {
          "arch": "win32",
          "install_mono": false,
          "name": "create_prefix",
          "prefix": "$GAMEDIR"
        }
      },
      {
        "write_config": {
          "data": {
            "Application": {
              "Company": "BlueByte",
              "Lang": 7,
              "Name": "Settlers4",
              "Version": 0
            },
            "AskOptions-0": {
              "Result": 1,
              "Sel-0": 0,
              "Sel-1": 0
            },
            "DlgOrder": {
              "Count": 9,
              "Dlg0": "SprintfBox-0",
              "Dlg1": "SdWelcome-0",
              "Dlg2": "SdLicense-0",
              "Dlg3": "SdSetupTypeEx-0",
              "Dlg4": "SdComponentDialog-0",
              "Dlg5": "SdSelectFolder-0",
              "Dlg6": "SprintfBox-1",
              "Dlg7": "SprintfBox-2",
              "Dlg8": "AskOptions-0"
            },
            "File Transfer": {
              "OverwriteReadOnly": "NoToAll"
            },
            "InstallShield Silent": {
              "File": "Response File",
              "Version": "v5.00.000"
            },
            "SdComponentDialog-0": {
              "Component-0": "Game",
              "Component-1": "Movies",
              "Component-2": "Music",
              "Component-3": "BBInstallShieldExtension",
              "Component-count": 4,
              "Component-type": "string",
              "Game-0": "Game\\LanguageDefs",
              "Game-1": "Game\\GFX",
              "Game-2": "Game\\Maps(Other)",
              "Game-count": 3,
              "Game-type": "string",
              "Game\\Maps(Other)-0": "Game\\Maps(Other)\\Singleplayer",
              "Game\\Maps(Other)-1": "Game\\Maps(Other)\\Mutliplayer",
              "Game\\Maps(Other)-2": "Game\\Maps(Other)\\Tutorial",
              "Game\\Maps(Other)-count": 3,
              "Game\\Maps(Other)-type": "string",
              "Result": 1,
              "szDir": "C:\\Blue Byte\\Die Siedler IV"
            },
            "SdLicense-0": {
              "Result": 1
            },
            "SdSelectFolder-0": {
              "Result": 1,
              "szFolder": "Blue Byte\\Die Siedler IV"
            },
            "SdSetupTypeEx-0": {
              "Result": "Custom"
            },
            "SdWelcome-0": {
              "Result": 1
            },
            "SprintfBox-0": {
              "Result": 7
            },
            "SprintfBox-1": {
              "Result": 7
            },
            "SprintfBox-2": {
              "Result": 7
            }
          },
          "description": "Creating installer config file",
          "file": "$GAMEDIR/drive_c/setup.iss"
        }
      },
      {
        "task": {
          "args": "/s /f1\"C:\\setup.iss\"",
          "description": "Running installator.",
          "executable": "$DISC/S4/setup.exe",
          "name": "wineexec",
          "prefix": "$GAMEDIR"
        }
      }
    ]
  },
  "content": "game:\n  arch: win32\n  exe: drive_c/Blue Byte/Die Siedler IV/S4.exe\n  prefix: $GAMEDIR\ninstaller:\n- insert-disc:\n    description: Insert disc\n    requires: S4/setup.exe\n- task:\n    arch: win32\n    install_mono: false\n    name: create_prefix\n    prefix: $GAMEDIR\n- write_config:\n    data:\n      Application:\n        Company: BlueByte\n        Lang: 7\n        Name: Settlers4\n        Version: 0.0\n      AskOptions-0:\n        Result: 1\n        Sel-0: 0\n        Sel-1: 0\n      DlgOrder:\n        Count: 9\n        Dlg0: SprintfBox-0\n        Dlg1: SdWelcome-0\n        Dlg2: SdLicense-0\n        Dlg3: SdSetupTypeEx-0\n        Dlg4: SdComponentDialog-0\n        Dlg5: SdSelectFolder-0\n        Dlg6: SprintfBox-1\n        Dlg7: SprintfBox-2\n        Dlg8: AskOptions-0\n      File Transfer:\n        OverwriteReadOnly: NoToAll\n      InstallShield Silent:\n        File: Response File\n        Version: v5.00.000\n      SdComponentDialog-0:\n        Component-0: Game\n        Component-1: Movies\n        Component-2: Music\n        Component-3: BBInstallShieldExtension\n        Component-count: 4\n        Component-type: string\n        Game-0: Game\\LanguageDefs\n        Game-1: Game\\GFX\n        Game-2: Game\\Maps(Other)\n        Game-count: 3\n        Game-type: string\n        Game\\Maps(Other)-0: Game\\Maps(Other)\\Singleplayer\n        Game\\Maps(Other)-1: Game\\Maps(Other)\\Mutliplayer\n        Game\\Maps(Other)-2: Game\\Maps(Other)\\Tutorial\n        Game\\Maps(Other)-count: 3\n        Game\\Maps(Other)-type: string\n        Result: 1\n        szDir: C:\\Blue Byte\\Die Siedler IV\n      SdLicense-0:\n        Result: 1\n      SdSelectFolder-0:\n        Result: 1\n        szFolder: Blue Byte\\Die Siedler IV\n      SdSetupTypeEx-0:\n        Result: Custom\n      SdWelcome-0:\n        Result: 1\n      SprintfBox-0:\n        Result: 7\n      SprintfBox-1:\n        Result: 7\n      SprintfBox-2:\n        Result: 7\n    description: Creating installer config file\n    file: $GAMEDIR/drive_c/setup.iss\n- task:\n    args: /s /f1\"C:\\setup.iss\"\n    description: Running installator.\n    executable: $DISC/S4/setup.exe\n    name: wineexec\n    prefix: $GAMEDIR\n"
}