{
  "id": 7378,
  "game_id": 847,
  "game_slug": "divinity-dragon-commander",
  "name": "Divinity: Dragon Commander",
  "year": null,
  "user": "andrerbarata",
  "runner": "wine",
  "slug": "divinity-dragon-commander-gog",
  "version": "GOG",
  "description": null,
  "notes": "",
  "created_at": "2018-02-24T10:00:43.775000Z",
  "updated_at": "2018-03-04T23:13:03.113211Z",
  "draft": false,
  "published": true,
  "published_by": null,
  "rating": "",
  "steamid": 243950,
  "gogid": 1207659263,
  "gogslug": "divinity_dragon_commander",
  "humbleid": "",
  "humblestoreid": "",
  "humblestoreid_real": "",
  "script": {
    "files": [
      {
        "game": "N/A:Please select the GOG.com Windows installer."
      }
    ],
    "game": {
      "appid": 243950,
      "exe": "drive_c/GOG Games/Divinity - Dragon Commander/Shipping/DragonCommander.exe",
      "prefix": "$GAMEDIR"
    },
    "installer": [
      {
        "task": {
          "description": "Creating Wine prefix",
          "name": "create_prefix",
          "prefix": "$GAMEDIR"
        }
      },
      {
        "task": {
          "app": "corefonts",
          "name": "winetricks",
          "prefix": "$GAMEDIR"
        }
      },
      {
        "task": {
          "app": "d3dcompiler_43",
          "name": "winetricks",
          "prefix": "$GAMEDIR"
        }
      },
      {
        "task": {
          "app": "d3dx10",
          "name": "winetricks",
          "prefix": "$GAMEDIR"
        }
      },
      {
        "task": {
          "app": "d3dx11_42",
          "name": "winetricks",
          "prefix": "$GAMEDIR"
        }
      },
      {
        "task": {
          "app": "d3dx11_43",
          "name": "winetricks",
          "prefix": "$GAMEDIR"
        }
      },
      {
        "task": {
          "app": "d3dx9_43",
          "name": "winetricks",
          "prefix": "$GAMEDIR"
        }
      },
      {
        "task": {
          "app": "d3dx9",
          "name": "winetricks",
          "prefix": "$GAMEDIR"
        }
      },
      {
        "task": {
          "app": "msxml3",
          "name": "winetricks",
          "prefix": "$GAMEDIR"
        }
      },
      {
        "task": {
          "app": "physx",
          "name": "winetricks",
          "prefix": "$GAMEDIR"
        }
      },
      {
        "task": {
          "app": "vcrun2010",
          "name": "winetricks",
          "prefix": "$GAMEDIR"
        }
      },
      {
        "task": {
          "app": "xinput",
          "name": "winetricks",
          "prefix": "$GAMEDIR"
        }
      },
      {
        "task": {
          "executable": "game",
          "name": "wineexec",
          "prefix": "$GAMEDIR"
        }
      }
    ]
  },
  "content": "files:\n- game: N/A:Please select the GOG.com Windows installer.\ngame:\n  appid: 243950\n  exe: drive_c/GOG Games/Divinity - Dragon Commander/Shipping/DragonCommander.exe\n  prefix: $GAMEDIR\ninstaller:\n- task:\n    description: Creating Wine prefix\n    name: create_prefix\n    prefix: $GAMEDIR\n- task:\n    app: corefonts\n    name: winetricks\n    prefix: $GAMEDIR\n- task:\n    app: d3dcompiler_43\n    name: winetricks\n    prefix: $GAMEDIR\n- task:\n    app: d3dx10\n    name: winetricks\n    prefix: $GAMEDIR\n- task:\n    app: d3dx11_42\n    name: winetricks\n    prefix: $GAMEDIR\n- task:\n    app: d3dx11_43\n    name: winetricks\n    prefix: $GAMEDIR\n- task:\n    app: d3dx9_43\n    name: winetricks\n    prefix: $GAMEDIR\n- task:\n    app: d3dx9\n    name: winetricks\n    prefix: $GAMEDIR\n- task:\n    app: msxml3\n    name: winetricks\n    prefix: $GAMEDIR\n- task:\n    app: physx\n    name: winetricks\n    prefix: $GAMEDIR\n- task:\n    app: vcrun2010\n    name: winetricks\n    prefix: $GAMEDIR\n- task:\n    app: xinput\n    name: winetricks\n    prefix: $GAMEDIR\n- task:\n    executable: game\n    name: wineexec\n    prefix: $GAMEDIR\n"
}