{
  "id": 3815,
  "game_id": 68,
  "game_slug": "beneath-a-steel-sky",
  "name": "Beneath a Steel Sky",
  "year": 1994,
  "user": "strider",
  "runner": "scummvm",
  "slug": "beneath-a-steel-sky-gog",
  "version": "GOG",
  "description": "This script will install \"Beneath a Steel Sky\" GOG edition for ScummVM.\r\nThanks to the people who helped us play this game in the best conditions.",
  "notes": "- Multilanguage: you could choose your preferred game language during install between english (default), french, german, spanish and italian.\r\n- Please report issue concerning this script on my Github page:\r\nhttps://github.com/legluondunet/MyLittleLutrisScripts/",
  "created_at": "2017-05-23T01:05:45.812000Z",
  "updated_at": "2020-04-25T10:37:48.104303Z",
  "draft": false,
  "published": true,
  "published_by": 494,
  "rating": "",
  "steamid": 1368340,
  "gogid": 1207658695,
  "gogslug": "beneath_a_steel_sky",
  "humbleid": "",
  "humblestoreid": "",
  "humblestoreid_real": "",
  "script": {
    "custom-name": "Beneath a Steel Sky - GOG - ScummVM",
    "files": [
      {
        "inno": "http://constexpr.org/innoextract/files/snapshots/innoextract-1.8-dev-2019-01-13/innoextract-1.8-dev-2019-01-13-linux.tar.xz"
      },
      {
        "gog": "N/A: Plese select the GOG.com installer"
      }
    ],
    "game": {
      "args": "--language=$INPUT_LANG",
      "game_id": "sky",
      "path": "$GAMEDIR",
      "subtitles": true
    },
    "installer": [
      {
        "extract": {
          "dst": "$CACHE/innoextract",
          "file": "inno"
        }
      },
      {
        "execute": {
          "args": "--extract $gog --output-dir \"$CACHE/sky\"",
          "file": "$CACHE/innoextract/innoextract"
        }
      },
      {
        "merge": {
          "dst": "$GAMEDIR/",
          "src": "$CACHE/sky"
        }
      },
      {
        "input_menu": {
          "description": "Choose your preferred game's language:",
          "id": "LANG",
          "options": [
            {
              "en": "English"
            },
            {
              "fr": "French"
            },
            {
              "de": "German"
            },
            {
              "es": "Spanish"
            },
            {
              "it": "Italian"
            }
          ],
          "preselect": "en"
        }
      },
      {
        "execute": {
          "command": "cd \"$GAMEDIR\"; rm -f -r app commonappdata __redist scummvm __support tmp goggame-1207658695.* ;"
        }
      }
    ],
    "scummvm": {
      "aspect": true,
      "fullscreen": true
    }
  },
  "content": "custom-name: Beneath a Steel Sky - GOG - ScummVM\nfiles:\n- inno: http://constexpr.org/innoextract/files/snapshots/innoextract-1.8-dev-2019-01-13/innoextract-1.8-dev-2019-01-13-linux.tar.xz\n- gog: 'N/A: Plese select the GOG.com installer'\ngame:\n  args: --language=$INPUT_LANG\n  game_id: sky\n  path: $GAMEDIR\n  subtitles: true\ninstaller:\n- extract:\n    dst: $CACHE/innoextract\n    file: inno\n- execute:\n    args: --extract $gog --output-dir \"$CACHE/sky\"\n    file: $CACHE/innoextract/innoextract\n- merge:\n    dst: $GAMEDIR/\n    src: $CACHE/sky\n- input_menu:\n    description: 'Choose your preferred game''s language:'\n    id: LANG\n    options:\n    - en: English\n    - fr: French\n    - de: German\n    - es: Spanish\n    - it: Italian\n    preselect: en\n- execute:\n    command: cd \"$GAMEDIR\"; rm -f -r app commonappdata __redist scummvm __support\n      tmp goggame-1207658695.* ;\nscummvm:\n  aspect: true\n  fullscreen: true\n"
}