{
  "id": 18148,
  "game_id": 15061,
  "game_slug": "pinball-fx3",
  "name": "Pinball FX3",
  "year": null,
  "user": "vanstaveren",
  "runner": "wine",
  "slug": "pinball-fx3-steamdx11",
  "version": "SteamDX11",
  "description": null,
  "notes": "",
  "created_at": "2020-01-31T00:55:01.030987Z",
  "updated_at": "2020-01-31T02:38:33.337576Z",
  "draft": false,
  "published": false,
  "published_by": null,
  "rating": "",
  "steamid": 442120,
  "gogid": null,
  "gogslug": "",
  "humblestoreid": "",
  "script": {
    "game": {
      "custom-name": "Pinball FX3",
      "arch": "win64",
      "prefix": "$GAMEDIR/prefix",
      "args": "-nojoy -applaunch 442120",
      "exe": "$GAMEDIR/prefix/drive_c/Program Files (x86)/Steam/Steam.exe",
      "appid": "442120"
    },
    "system": {
      "disable_compositor": true,
      "pulse_latency": true,
      "xboxdrv": "xboxdrv"
    },
    "wine": {
      "esync": true,
      "Audio": "pulse",
      "dxvk": true,
      "env": {
        "WINEDLLOVERRIDES": "xaudio2_7=n"
      },
      "overrides": {
        "winedbg.exe": "d",
        "xaudio2_7": "n"
      }
    },
    "installer": [
      {
        "task": {
          "arch": "win64",
          "description": "Creating 64-bit prefix ...",
          "prefix": "$GAMEDIR/prefix",
          "name": "create_prefix"
        }
      },
      {
        "move": {
          "dst": "$GAMEDIR/prefix/drive_c/",
          "src": "SteamSetup.exe"
        }
      },
      {
        "chmodx": "$GAMEDIR/prefix/drive_c/SteamSetup.exe"
      },
      {
        "task": {
          "app": "d3drm",
          "arch": "win64",
          "description": "DirectX ...",
          "prefix": "$GAMEDIR/prefix",
          "name": "winetricks"
        }
      },
      {
        "task": {
          "app": "d3dcompiler_43",
          "arch": "win64",
          "description": "DirectX 11 ...",
          "prefix": "$GAMEDIR/prefix",
          "name": "winetricks"
        }
      },
      {
        "task": {
          "app": "d3dx11_43",
          "arch": "win64",
          "description": "DirectX 11 ...",
          "prefix": "$GAMEDIR/prefix",
          "name": "winetricks"
        }
      },
      {
        "task": {
          "app": "dxvk",
          "arch": "win64",
          "description": "Vulkan ...",
          "prefix": "$GAMEDIR/prefix",
          "name": "winetricks"
        }
      },
      {
        "task": {
          "executable": "$GAMEDIR/prefix/drive_c/SteamSetup.exe",
          "args": "/S",
          "description": "Steam ...",
          "prefix": "$GAMEDIR/prefix",
          "name": "wineexec"
        }
      },
      {
        "task": {
          "app": "win8",
          "arch": "win64",
          "description": "Windows version 8 ...",
          "prefix": "$GAMEDIR/prefix",
          "name": "winetricks"
        }
      }
    ],
    "files": [
      {
        "SteamSetup.exe": "https://steamcdn-a.akamaihd.net/client/installer/SteamSetup.exe"
      }
    ]
  },
  "content": "files:\n- SteamSetup.exe: https://steamcdn-a.akamaihd.net/client/installer/SteamSetup.exe\ngame:\n  appid: '442120'\n  arch: win64\n  args: -nojoy -applaunch 442120\n  custom-name: Pinball FX3\n  exe: $GAMEDIR/prefix/drive_c/Program Files (x86)/Steam/Steam.exe\n  prefix: $GAMEDIR/prefix\ninstaller:\n- task:\n    arch: win64\n    description: Creating 64-bit prefix ...\n    name: create_prefix\n    prefix: $GAMEDIR/prefix\n- move:\n    dst: $GAMEDIR/prefix/drive_c/\n    src: SteamSetup.exe\n- chmodx: $GAMEDIR/prefix/drive_c/SteamSetup.exe\n- task:\n    app: d3drm\n    arch: win64\n    description: DirectX ...\n    name: winetricks\n    prefix: $GAMEDIR/prefix\n- task:\n    app: d3dcompiler_43\n    arch: win64\n    description: DirectX 11 ...\n    name: winetricks\n    prefix: $GAMEDIR/prefix\n- task:\n    app: d3dx11_43\n    arch: win64\n    description: DirectX 11 ...\n    name: winetricks\n    prefix: $GAMEDIR/prefix\n- task:\n    app: dxvk\n    arch: win64\n    description: Vulkan ...\n    name: winetricks\n    prefix: $GAMEDIR/prefix\n- task:\n    args: /S\n    description: Steam ...\n    executable: $GAMEDIR/prefix/drive_c/SteamSetup.exe\n    name: wineexec\n    prefix: $GAMEDIR/prefix\n- task:\n    app: win8\n    arch: win64\n    description: Windows version 8 ...\n    name: winetricks\n    prefix: $GAMEDIR/prefix\nsystem:\n  disable_compositor: true\n  pulse_latency: true\n  xboxdrv: xboxdrv\nwine:\n  Audio: pulse\n  dxvk: true\n  env:\n    WINEDLLOVERRIDES: xaudio2_7=n\n  esync: true\n  overrides:\n    winedbg.exe: d\n    xaudio2_7: n\n"
}