{
  "id": 2528,
  "game_id": 7247,
  "game_slug": "the-settlers-ii-10th-anniversary",
  "name": "The Settlers II 10th Anniversary",
  "year": 2006,
  "user": "ssf",
  "runner": "wine",
  "slug": "the-settlers-ii-10th-annivers-gog",
  "version": "GOG",
  "description": null,
  "notes": "",
  "created_at": "2016-08-21T18:00:23.938000Z",
  "updated_at": "2019-03-23T22:25:53.341430Z",
  "draft": false,
  "published": true,
  "published_by": 19464,
  "rating": "",
  "steamid": null,
  "gogid": 1207659163,
  "gogslug": "the_settlers_2_10th_anniversary",
  "humblestoreid": "",
  "script": {
    "files": [
      {
        "game": "N/A:Please select the GOG.com OFFLINE Windows installer."
      }
    ],
    "game": {
      "prefix": "$GAMEDIR",
      "arch": "win32",
      "exe": "drive_c/GOG Games/The Settlers II - 10th Anniversary/bin/S2DNG.exe"
    },
    "installer": [
      {
        "task": {
          "prefix": "$GAMEDIR",
          "name": "create_prefix",
          "arch": "win32"
        }
      },
      {
        "task": {
          "description": "Installing d3dx9",
          "name": "winetricks",
          "arch": "win32",
          "app": "d3dx9",
          "prefix": "$GAMEDIR"
        }
      },
      {
        "task": {
          "description": "Installing d3dx9_36",
          "name": "winetricks",
          "arch": "win32",
          "app": "d3dx9_36",
          "prefix": "$GAMEDIR"
        }
      },
      {
        "task": {
          "args": "/silent /nogui",
          "name": "wineexec",
          "executable": "game",
          "prefix": "$GAMEDIR"
        }
      },
      {
        "task": {
          "description": "Setting Wine CSMT to 0",
          "name": "set_regedit",
          "key": "csmt",
          "prefix": "$GAMEDIR",
          "path": "HKEY_CURRENT_USER\\Software\\Wine\\Direct3D",
          "value": 0,
          "type": "REG_DWORD"
        }
      }
    ]
  },
  "content": "files:\n- game: N/A:Please select the GOG.com OFFLINE Windows installer.\ngame:\n  arch: win32\n  exe: drive_c/GOG Games/The Settlers II - 10th Anniversary/bin/S2DNG.exe\n  prefix: $GAMEDIR\ninstaller:\n- task:\n    arch: win32\n    name: create_prefix\n    prefix: $GAMEDIR\n- task:\n    app: d3dx9\n    arch: win32\n    description: Installing d3dx9\n    name: winetricks\n    prefix: $GAMEDIR\n- task:\n    app: d3dx9_36\n    arch: win32\n    description: Installing d3dx9_36\n    name: winetricks\n    prefix: $GAMEDIR\n- task:\n    args: /silent /nogui\n    executable: game\n    name: wineexec\n    prefix: $GAMEDIR\n- task:\n    description: Setting Wine CSMT to 0\n    key: csmt\n    name: set_regedit\n    path: HKEY_CURRENT_USER\\Software\\Wine\\Direct3D\n    prefix: $GAMEDIR\n    type: REG_DWORD\n    value: 0\n"
}