{
  "id": 18601,
  "game_id": 14661,
  "game_slug": "blobby-volley-2",
  "name": "Blobby Volley 2",
  "year": 2007,
  "user": "vanstaveren",
  "runner": "wine",
  "slug": "blobby-volley-2-10-vulkan",
  "version": "1.0-vulkan",
  "description": null,
  "notes": "",
  "created_at": "2020-02-29T14:51:22.818075Z",
  "updated_at": "2020-02-29T14:51:22.818105Z",
  "draft": false,
  "published": false,
  "published_by": null,
  "rating": "",
  "steamid": null,
  "gogid": null,
  "gogslug": "",
  "humblestoreid": "",
  "script": {
    "game": {
      "custom-name": "Blobby Volley 2",
      "arch": "win64",
      "prefix": "$GAMEDIR/prefix",
      "exe": "$GAMEDIR/prefix/drive_c/Program Files (x86)/Blobby Volley 2 Version 1.0/blobby.exe"
    },
    "system": {
      "disable_compositor": true,
      "pulse_latency": true,
      "xboxdrv": "xboxdrv"
    },
    "wine": {
      "esync": true,
      "Audio": "pulse",
      "version": "ge-protonified-nofshack-4.9-x86_64",
      "overrides": {
        "winedbg.exe": "d"
      },
      "dxvk": true
    },
    "installer": [
      {
        "task": {
          "arch": "win64",
          "description": "Creating 64-bit prefix ...",
          "prefix": "$GAMEDIR/prefix",
          "name": "create_prefix"
        }
      },
      {
        "move": {
          "dst": "$GAMEDIR/prefix/drive_c/",
          "src": "blobby2"
        }
      },
      {
        "task": {
          "executable": "$GAMEDIR/prefix/drive_c/blobby2-win32-1.0-installer.exe",
          "description": "Blobby Volley 2 ...",
          "prefix": "$GAMEDIR/prefix",
          "name": "wineexec"
        }
      },
      {
        "task": {
          "app": "d3dcompiler_43",
          "arch": "win64",
          "description": "DirectX 11 ...",
          "prefix": "$GAMEDIR/prefix",
          "name": "winetricks"
        }
      },
      {
        "task": {
          "app": "d3dx11_43",
          "arch": "win64",
          "description": "DirectX 11 ...",
          "prefix": "$GAMEDIR/prefix",
          "name": "winetricks"
        }
      },
      {
        "task": {
          "app": "dxvk",
          "arch": "win64",
          "description": "Vulkan ...",
          "prefix": "$GAMEDIR/prefix",
          "name": "winetricks"
        }
      },
      {
        "task": {
          "app": "win8",
          "arch": "win64",
          "description": "Windows version 8 ...",
          "prefix": "$GAMEDIR/prefix",
          "name": "winetricks"
        }
      }
    ],
    "files": [
      {
        "blobby2": "http://www.blobby-liga.de/blobby2-win32-1.0-installer.exe"
      }
    ]
  },
  "content": "files:\n- blobby2: http://www.blobby-liga.de/blobby2-win32-1.0-installer.exe\ngame:\n  arch: win64\n  custom-name: Blobby Volley 2\n  exe: $GAMEDIR/prefix/drive_c/Program Files (x86)/Blobby Volley 2 Version 1.0/blobby.exe\n  prefix: $GAMEDIR/prefix\ninstaller:\n- task:\n    arch: win64\n    description: Creating 64-bit prefix ...\n    name: create_prefix\n    prefix: $GAMEDIR/prefix\n- move:\n    dst: $GAMEDIR/prefix/drive_c/\n    src: blobby2\n- task:\n    description: Blobby Volley 2 ...\n    executable: $GAMEDIR/prefix/drive_c/blobby2-win32-1.0-installer.exe\n    name: wineexec\n    prefix: $GAMEDIR/prefix\n- task:\n    app: d3dcompiler_43\n    arch: win64\n    description: DirectX 11 ...\n    name: winetricks\n    prefix: $GAMEDIR/prefix\n- task:\n    app: d3dx11_43\n    arch: win64\n    description: DirectX 11 ...\n    name: winetricks\n    prefix: $GAMEDIR/prefix\n- task:\n    app: dxvk\n    arch: win64\n    description: Vulkan ...\n    name: winetricks\n    prefix: $GAMEDIR/prefix\n- task:\n    app: win8\n    arch: win64\n    description: Windows version 8 ...\n    name: winetricks\n    prefix: $GAMEDIR/prefix\nsystem:\n  disable_compositor: true\n  pulse_latency: true\n  xboxdrv: xboxdrv\nwine:\n  Audio: pulse\n  dxvk: true\n  esync: true\n  overrides:\n    winedbg.exe: d\n  version: ge-protonified-nofshack-4.9-x86_64\n"
}