{
  "id": 23113,
  "game_id": 30577,
  "game_slug": "clip-studio-paint",
  "name": "Clip Studio Paint",
  "year": 2001,
  "user": "DerSyd0",
  "runner": "wine",
  "slug": "clip-studio-paint-197",
  "version": "1.9.7",
  "description": null,
  "notes": "",
  "created_at": "2020-08-30T13:08:43.610306Z",
  "updated_at": "2020-08-30T13:08:43.610328Z",
  "draft": true,
  "published": false,
  "published_by": null,
  "rating": "",
  "steamid": null,
  "gogid": null,
  "gogslug": "",
  "humbleid": "",
  "humblestoreid": "",
  "humblestoreid_real": "",
  "script": {
    "game": {
      "arch": "win64",
      "exe": "$GAMEDIR/drive_c/Program Files (x86)/CELSYS/CELSYS/CLIP STUDIO 1.5/CLIP STUDIO/CLIPStudio.exe",
      "prefix": "$GAMEDIR"
    },
    "installer": [
      {
        "task": {
          "arch": "win64",
          "description": "Creating Wine 64-bit Prefix",
          "name": "create_prefix",
          "prefix": "$GAMEDIR"
        }
      },
      {
        "task": {
          "arch": "win64",
          "description": "Setting Windows 10 mode for Wine",
          "key": "Version",
          "name": "set_regedit",
          "path": "HKEY_CURRENT_USER\\Software\\Wine",
          "prefix": "$GAMEDIR",
          "value": "win10"
        }
      },
      {
        "task": {
          "app": "vcrun2005",
          "arch": "win64",
          "description": "Installing vcrun2005",
          "name": "winetricks",
          "prefix": "$GAMEDIR"
        }
      },
      {
        "task": {
          "app": "vcrun2005sp1",
          "arch": "win64",
          "description": "Installing vcrun2005sp1",
          "name": "winetricks",
          "prefix": "$GAMEDIR"
        }
      },
      {
        "task": {
          "app": "vcrun2008",
          "arch": "win64",
          "description": "Installing vcrun2008",
          "name": "winetricks",
          "prefix": "$GAMEDIR"
        }
      },
      {
        "task": {
          "app": "vcrun2010",
          "arch": "win64",
          "description": "Installing vcrun2010",
          "name": "winetricks",
          "prefix": "$GAMEDIR"
        }
      },
      {
        "task": {
          "app": "msxml4",
          "arch": "win64",
          "description": "Installing msxml4",
          "name": "winetricks",
          "prefix": "$GAMEDIR"
        }
      },
      {
        "task": {
          "app": "msxml6",
          "arch": "win64",
          "description": "Installing msxml6",
          "name": "winetricks",
          "prefix": "$GAMEDIR"
        }
      },
      {
        "task": {
          "app": "vb6run",
          "arch": "win64",
          "description": "Installing vb6run",
          "name": "winetricks",
          "prefix": "$GAMEDIR"
        }
      },
      {
        "task": {
          "app": "corefonts",
          "arch": "win64",
          "description": "Installing Corefonts",
          "name": "winetricks",
          "prefix": "$GAMEDIR"
        }
      },
      {
        "task": {
          "app": "atmlib",
          "arch": "win64",
          "description": "Installing Atmlib",
          "name": "winetricks",
          "prefix": "$GAMEDIR"
        }
      },
      {
        "task": {
          "app": "gdiplus",
          "arch": "win64",
          "description": "Installing Gdiplus",
          "name": "winetricks",
          "prefix": "$GAMEDIR"
        }
      },
      {
        "task": {
          "app": "ie6",
          "arch": "win64",
          "description": "Installing ie6",
          "name": "winetricks",
          "prefix": "$GAMEDIR"
        }
      },
      {
        "task": {
          "app": "fontsmooth-rgb",
          "arch": "win64",
          "description": "Installing fontsmooth-rgb",
          "name": "winetricks",
          "prefix": "$GAMEDIR"
        }
      },
      {
        "task": {
          "app": "gecko",
          "arch": "win64",
          "description": "Installing gecko",
          "name": "winetricks",
          "prefix": "$GAMEDIR"
        }
      },
      {
        "task": {
          "arch": "win64",
          "description": "Installing the game (WARNING: Do not run the game when the installation is complete)",
          "executable": "launcher",
          "name": "wineexec",
          "prefix": "$GAMEDIR"
        }
      }
    ],
    "system": {
      "env": {
        "DXVK_HUD": 0
      }
    },
    "wine": {
      "EAX": true,
      "VAAPI": true,
      "csmt": true,
      "dxvk": true
    }
  },
  "content": "game:\n  arch: win64\n  exe: $GAMEDIR/drive_c/Program Files (x86)/CELSYS/CELSYS/CLIP STUDIO 1.5/CLIP STUDIO/CLIPStudio.exe\n  prefix: $GAMEDIR\ninstaller:\n- task:\n    arch: win64\n    description: Creating Wine 64-bit Prefix\n    name: create_prefix\n    prefix: $GAMEDIR\n- task:\n    arch: win64\n    description: Setting Windows 10 mode for Wine\n    key: Version\n    name: set_regedit\n    path: HKEY_CURRENT_USER\\Software\\Wine\n    prefix: $GAMEDIR\n    value: win10\n- task:\n    app: vcrun2005\n    arch: win64\n    description: Installing vcrun2005\n    name: winetricks\n    prefix: $GAMEDIR\n- task:\n    app: vcrun2005sp1\n    arch: win64\n    description: Installing vcrun2005sp1\n    name: winetricks\n    prefix: $GAMEDIR\n- task:\n    app: vcrun2008\n    arch: win64\n    description: Installing vcrun2008\n    name: winetricks\n    prefix: $GAMEDIR\n- task:\n    app: vcrun2010\n    arch: win64\n    description: Installing vcrun2010\n    name: winetricks\n    prefix: $GAMEDIR\n- task:\n    app: msxml4\n    arch: win64\n    description: Installing msxml4\n    name: winetricks\n    prefix: $GAMEDIR\n- task:\n    app: msxml6\n    arch: win64\n    description: Installing msxml6\n    name: winetricks\n    prefix: $GAMEDIR\n- task:\n    app: vb6run\n    arch: win64\n    description: Installing vb6run\n    name: winetricks\n    prefix: $GAMEDIR\n- task:\n    app: corefonts\n    arch: win64\n    description: Installing Corefonts\n    name: winetricks\n    prefix: $GAMEDIR\n- task:\n    app: atmlib\n    arch: win64\n    description: Installing Atmlib\n    name: winetricks\n    prefix: $GAMEDIR\n- task:\n    app: gdiplus\n    arch: win64\n    description: Installing Gdiplus\n    name: winetricks\n    prefix: $GAMEDIR\n- task:\n    app: ie6\n    arch: win64\n    description: Installing ie6\n    name: winetricks\n    prefix: $GAMEDIR\n- task:\n    app: fontsmooth-rgb\n    arch: win64\n    description: Installing fontsmooth-rgb\n    name: winetricks\n    prefix: $GAMEDIR\n- task:\n    app: gecko\n    arch: win64\n    description: Installing gecko\n    name: winetricks\n    prefix: $GAMEDIR\n- task:\n    arch: win64\n    description: 'Installing the game (WARNING: Do not run the game when the installation\n      is complete)'\n    executable: launcher\n    name: wineexec\n    prefix: $GAMEDIR\nsystem:\n  env:\n    DXVK_HUD: 0\nwine:\n  EAX: true\n  VAAPI: true\n  csmt: true\n  dxvk: true\n"
}