{
  "id": 17081,
  "game_id": 22972,
  "game_slug": "af",
  "name": "Affinity Designer",
  "year": 2014,
  "user": "WarfaceZ",
  "runner": "wine",
  "slug": "affinity-designer-173",
  "version": "1.7.3",
  "description": null,
  "notes": "Loading screen is black",
  "created_at": "2019-11-29T08:04:53.466000Z",
  "updated_at": "2020-01-22T02:05:01.375151Z",
  "draft": false,
  "published": true,
  "published_by": 51687,
  "rating": "",
  "steamid": null,
  "gogid": null,
  "gogslug": "",
  "humblestoreid": "",
  "script": {
    "files": [
      {
        "setup": "N/A:Select Affinity designer installer"
      }
    ],
    "game": {
      "prefix": "$GAMEDIR",
      "exe": "drive_c/Program Files/Affinity/Designer/Designer.exe",
      "arch": "win64"
    },
    "wine": {
      "overrides": {
        "nvapi64": "disabled",
        "nvapi": "disabled",
        "d3d12": "disabled",
        "ucrtbase": "n,b"
      },
      "esync": true,
      "dxvk": true
    },
    "system": {
      "env": {
        "STAGING_SHARED_MEMORY": 1,
        "DXVK_HUD": "compiler",
        "__GL_SHADER_DISK_CACHE": 1,
        "DXVK_STATE_CACHE_PATH": "$GAMEDIR",
        "__GL_SHADER_DISK_CACHE_PATH": "$GAMEDIR"
      }
    },
    "installer": [
      {
        "task": {
          "prefix": "$GAMEDIR",
          "arch": "win64",
          "name": "create_prefix",
          "description": "Creating 64bit Wine prefix."
        }
      },
      {
        "task": {
          "prefix": "$GAMEDIR",
          "arch": "win64",
          "app": "arial",
          "description": "Installing Arial font",
          "name": "winetricks"
        }
      },
      {
        "task": {
          "prefix": "$GAMEDIR",
          "arch": "win64",
          "app": "dotnet35sp1",
          "description": "Installing .NET 3.5 SP1 will take a while...",
          "name": "winetricks"
        }
      },
      {
        "task": {
          "prefix": "$GAMEDIR",
          "arch": "win64",
          "app": "dotnet472",
          "description": "Installing .NET 4.7.2 will take a while...",
          "name": "winetricks"
        }
      },
      {
        "task": {
          "arch": "win64",
          "name": "set_regedit",
          "description": "Setting Windows 10 mode for Wine",
          "key": "Version",
          "prefix": "$GAMEDIR",
          "value": "win10",
          "path": "HKEY_CURRENT_USER\\Software\\Wine"
        }
      },
      {
        "task": {
          "arch": "win64",
          "name": "set_regedit",
          "description": "Wine Staging: Enabling DXVA2",
          "key": "backend",
          "prefix": "$GAMEDIR",
          "value": "va",
          "path": "HKEY_CURRENT_USER\\Software\\Wine\\DXVA2"
        }
      },
      {
        "task": {
          "prefix": "$GAMEDIR",
          "name": "winekill"
        }
      },
      {
        "task": {
          "prefix": "$GAMEDIR",
          "arch": "win64",
          "executable": "setup",
          "name": "wineexec"
        }
      },
      {
        "task": {
          "prefix": "$GAMEDIR",
          "name": "winekill"
        }
      }
    ]
  },
  "content": "files:\n- setup: N/A:Select Affinity designer installer\ngame:\n  arch: win64\n  exe: drive_c/Program Files/Affinity/Designer/Designer.exe\n  prefix: $GAMEDIR\ninstaller:\n- task:\n    arch: win64\n    description: Creating 64bit Wine prefix.\n    name: create_prefix\n    prefix: $GAMEDIR\n- task:\n    app: arial\n    arch: win64\n    description: Installing Arial font\n    name: winetricks\n    prefix: $GAMEDIR\n- task:\n    app: dotnet35sp1\n    arch: win64\n    description: Installing .NET 3.5 SP1 will take a while...\n    name: winetricks\n    prefix: $GAMEDIR\n- task:\n    app: dotnet472\n    arch: win64\n    description: Installing .NET 4.7.2 will take a while...\n    name: winetricks\n    prefix: $GAMEDIR\n- task:\n    arch: win64\n    description: Setting Windows 10 mode for Wine\n    key: Version\n    name: set_regedit\n    path: HKEY_CURRENT_USER\\Software\\Wine\n    prefix: $GAMEDIR\n    value: win10\n- task:\n    arch: win64\n    description: 'Wine Staging: Enabling DXVA2'\n    key: backend\n    name: set_regedit\n    path: HKEY_CURRENT_USER\\Software\\Wine\\DXVA2\n    prefix: $GAMEDIR\n    value: va\n- task:\n    name: winekill\n    prefix: $GAMEDIR\n- task:\n    arch: win64\n    executable: setup\n    name: wineexec\n    prefix: $GAMEDIR\n- task:\n    name: winekill\n    prefix: $GAMEDIR\nsystem:\n  env:\n    DXVK_HUD: compiler\n    DXVK_STATE_CACHE_PATH: $GAMEDIR\n    STAGING_SHARED_MEMORY: 1\n    __GL_SHADER_DISK_CACHE: 1\n    __GL_SHADER_DISK_CACHE_PATH: $GAMEDIR\nwine:\n  dxvk: true\n  esync: true\n  overrides:\n    d3d12: disabled\n    nvapi: disabled\n    nvapi64: disabled\n    ucrtbase: n,b\n"
}