{
  "id": 21478,
  "game_id": 30859,
  "game_slug": "cultures-a-la-decouverte-du-vinland",
  "name": "Cultures : À la découverte du Vinland",
  "year": 2000,
  "user": "x_l_ours",
  "runner": "wine",
  "slug": "cultures-a-la-decouverte-du-v-cddvd",
  "version": "CD/DVD",
  "description": "Dans la grande lignée des Settlers dont Cultures s'inspire ouvertement, il faut construire et développer une véritable colonie en commerçant d'abord avec les peuplades indigènes puis en les massacrant pour occuper leur territoire. Le rêve américain, en quelque sorte...",
  "notes": "",
  "created_at": "2020-06-13T20:29:38.475839Z",
  "updated_at": "2020-06-13T20:29:38.475861Z",
  "draft": true,
  "published": false,
  "published_by": null,
  "rating": "",
  "steamid": null,
  "gogid": null,
  "gogslug": "",
  "humbleid": "",
  "humblestoreid": "",
  "humblestoreid_real": "",
  "script": {
    "arch": "win32",
    "exe": "prefix/drive_c/Program Files/Funatics/",
    "game": {
      "arch": "win32",
      "prefix": "$GAMEDIR/prefix"
    },
    "installer": [
      {
        "task": {
          "app": "winxp",
          "arch": "win32",
          "description": "Setting Windows Version to XP",
          "name": "winetricks",
          "prefix": "$GAMEDIR/prefix"
        }
      },
      {
        "task": {
          "arch": "win32",
          "description": "Creating Wine Prefix",
          "name": "create_prefix",
          "prefix": "$GAMEDIR/prefix"
        }
      },
      {
        "task": {
          "app": "directmusic",
          "arch": "win32",
          "description": "Installing Direct Music",
          "name": "winetricks",
          "prefix": "$GAMEDIR/prefix"
        }
      },
      {
        "task": {
          "app": "directplay",
          "arch": "win32",
          "description": "Installing Direct Play",
          "name": "winetricks",
          "prefix": "$GAMEDIR/prefix"
        }
      },
      {
        "task": {
          "app": "d3dx9_36",
          "arch": "win32",
          "description": "Installing DirectX 9",
          "name": "winetricks",
          "prefix": "$GAMEDIR/prefix"
        }
      },
      {
        "insert-disc": {
          "requires": "autoRun.exe"
        }
      },
      {
        "task": {
          "executable": "$DISC/autoRun.exe",
          "name": "wineexec",
          "prefix": "$GAMEDIR/prefix"
        }
      },
      {
        "task": {
          "app": "winxp",
          "arch": "win32",
          "description": "Setting Windows Version to XP",
          "name": "winetricks",
          "prefix": "$GAMEDIR/prefix"
        }
      }
    ]
  },
  "content": "arch: win32\nexe: prefix/drive_c/Program Files/Funatics/\ngame:\n  arch: win32\n  prefix: $GAMEDIR/prefix\ninstaller:\n- task:\n    app: winxp\n    arch: win32\n    description: Setting Windows Version to XP\n    name: winetricks\n    prefix: $GAMEDIR/prefix\n- task:\n    arch: win32\n    description: Creating Wine Prefix\n    name: create_prefix\n    prefix: $GAMEDIR/prefix\n- task:\n    app: directmusic\n    arch: win32\n    description: Installing Direct Music\n    name: winetricks\n    prefix: $GAMEDIR/prefix\n- task:\n    app: directplay\n    arch: win32\n    description: Installing Direct Play\n    name: winetricks\n    prefix: $GAMEDIR/prefix\n- task:\n    app: d3dx9_36\n    arch: win32\n    description: Installing DirectX 9\n    name: winetricks\n    prefix: $GAMEDIR/prefix\n- insert-disc:\n    requires: autoRun.exe\n- task:\n    executable: $DISC/autoRun.exe\n    name: wineexec\n    prefix: $GAMEDIR/prefix\n- task:\n    app: winxp\n    arch: win32\n    description: Setting Windows Version to XP\n    name: winetricks\n    prefix: $GAMEDIR/prefix\n"
}