{
  "id": 18439,
  "game_id": 15622,
  "game_slug": "frozen-bubble",
  "name": "Frozen Bubble",
  "year": 2001,
  "user": "vanstaveren",
  "runner": "wine",
  "slug": "frozen-bubble-10-vulkan",
  "version": "1.0-vulkan",
  "description": "* Perl 5.6\r\n* SDL_Perl",
  "notes": "Fullscreen is not supported in this port.",
  "created_at": "2020-02-18T18:58:00.742640Z",
  "updated_at": "2020-02-18T18:58:00.742665Z",
  "draft": true,
  "published": false,
  "published_by": null,
  "rating": "",
  "steamid": null,
  "gogid": null,
  "gogslug": "",
  "humblestoreid": "",
  "script": {
    "files": [
      {
        "fbinstaller.exe": "https://sourceforge.net/projects/fbe-win32/files/Frozen Bubble 1.0/frozen Bubble/fbinstaller.exe"
      }
    ],
    "installer": [
      {
        "task": {
          "description": "Creating 64-bit prefix ...",
          "name": "create_prefix",
          "arch": "win64",
          "prefix": "$GAMEDIR/prefix"
        }
      },
      {
        "move": {
          "dst": "$GAMEDIR/prefix/drive_c/",
          "src": "fbinstaller.exe"
        }
      },
      {
        "task": {
          "description": "Frozen Bubble ...",
          "name": "wineexec",
          "executable": "$GAMEDIR/prefix/drive_c/fbinstaller.exe",
          "prefix": "$GAMEDIR/prefix"
        }
      },
      {
        "task": {
          "description": "DirectX 11 ...",
          "name": "winetricks",
          "arch": "win64",
          "app": "d3dcompiler_43",
          "prefix": "$GAMEDIR/prefix"
        }
      },
      {
        "task": {
          "description": "DirectX 11 ...",
          "name": "winetricks",
          "arch": "win64",
          "app": "d3dx11_43",
          "prefix": "$GAMEDIR/prefix"
        }
      },
      {
        "task": {
          "description": "Vulkan ...",
          "name": "winetricks",
          "arch": "win64",
          "app": "dxvk",
          "prefix": "$GAMEDIR/prefix"
        }
      },
      {
        "task": {
          "description": "Windows version 8 ...",
          "name": "winetricks",
          "arch": "win64",
          "app": "win8",
          "prefix": "$GAMEDIR/prefix"
        }
      }
    ],
    "game": {
      "prefix": "$GAMEDIR/prefix",
      "arch": "win64",
      "exe": "$GAMEDIR/prefix/drive_c/Program Files (x86)/Frozen-Bubble/frozen-bubble.exe",
      "custom-name": "Frozen Bubble"
    },
    "system": {
      "disable_compositor": true,
      "xboxdrv": "xboxdrv",
      "pulse_latency": true
    },
    "wine": {
      "Audio": "pulse",
      "dxvk": true,
      "version": "ge-protonified-nofshack-4.9-x86_64",
      "esync": true,
      "overrides": {
        "winedbg.exe": "d"
      }
    }
  },
  "content": "files:\n- fbinstaller.exe: https://sourceforge.net/projects/fbe-win32/files/Frozen Bubble\n    1.0/frozen Bubble/fbinstaller.exe\ngame:\n  arch: win64\n  custom-name: Frozen Bubble\n  exe: $GAMEDIR/prefix/drive_c/Program Files (x86)/Frozen-Bubble/frozen-bubble.exe\n  prefix: $GAMEDIR/prefix\ninstaller:\n- task:\n    arch: win64\n    description: Creating 64-bit prefix ...\n    name: create_prefix\n    prefix: $GAMEDIR/prefix\n- move:\n    dst: $GAMEDIR/prefix/drive_c/\n    src: fbinstaller.exe\n- task:\n    description: Frozen Bubble ...\n    executable: $GAMEDIR/prefix/drive_c/fbinstaller.exe\n    name: wineexec\n    prefix: $GAMEDIR/prefix\n- task:\n    app: d3dcompiler_43\n    arch: win64\n    description: DirectX 11 ...\n    name: winetricks\n    prefix: $GAMEDIR/prefix\n- task:\n    app: d3dx11_43\n    arch: win64\n    description: DirectX 11 ...\n    name: winetricks\n    prefix: $GAMEDIR/prefix\n- task:\n    app: dxvk\n    arch: win64\n    description: Vulkan ...\n    name: winetricks\n    prefix: $GAMEDIR/prefix\n- task:\n    app: win8\n    arch: win64\n    description: Windows version 8 ...\n    name: winetricks\n    prefix: $GAMEDIR/prefix\nsystem:\n  disable_compositor: true\n  pulse_latency: true\n  xboxdrv: xboxdrv\nwine:\n  Audio: pulse\n  dxvk: true\n  esync: true\n  overrides:\n    winedbg.exe: d\n  version: ge-protonified-nofshack-4.9-x86_64\n"
}