{
  "id": 14984,
  "game_id": 28778,
  "game_slug": "cyberhunter",
  "name": "Cyberhunter",
  "year": 2019,
  "user": "xkazerike",
  "runner": "wine",
  "slug": "cyberhunter-linux",
  "version": "Linux",
  "description": null,
  "notes": "",
  "created_at": "2019-08-13T00:56:33.111000Z",
  "updated_at": "2019-08-14T01:31:43.553287Z",
  "draft": false,
  "published": true,
  "published_by": 1,
  "rating": "",
  "steamid": null,
  "gogid": null,
  "gogslug": "",
  "humblestoreid": "",
  "script": {
    "game": {
      "exe": "drive_c/CyberHunter/launcher.exe",
      "prefix": "$GAMEDIR",
      "args": "-arg"
    },
    "files": [
      {
        "file1": "https://g94na.gdl.netease.com/cyber_hunter_20190729.exe"
      }
    ],
    "wine": {
      "overrides": {
        "wininet": "builtin,native"
      },
      "version": "4.3-x86_64"
    },
    "installer": [
      {
        "task": {
          "prefix": "$GAMEDIR",
          "name": "create_prefix"
        }
      },
      {
        "task": {
          "prefix": "$GAMEDIR",
          "app": "vcrun2010 wininet win7",
          "name": "winetricks"
        }
      },
      {
        "task": {
          "name": "wineexec",
          "args": "/SP- /SUPPRESSMSGBOXES /VERYSILENT /NOICONS",
          "description": "Please wait while we install Cyber Hunter",
          "prefix": "$GAMEDIR",
          "executable": "$CACHE/cyber_hunter_20190729.exe",
          "exclude_processes": "client.exe"
        }
      }
    ]
  },
  "content": "files:\n- file1: https://g94na.gdl.netease.com/cyber_hunter_20190729.exe\ngame:\n  args: -arg\n  exe: drive_c/CyberHunter/launcher.exe\n  prefix: $GAMEDIR\ninstaller:\n- task:\n    name: create_prefix\n    prefix: $GAMEDIR\n- task:\n    app: vcrun2010 wininet win7\n    name: winetricks\n    prefix: $GAMEDIR\n- task:\n    args: /SP- /SUPPRESSMSGBOXES /VERYSILENT /NOICONS\n    description: Please wait while we install Cyber Hunter\n    exclude_processes: client.exe\n    executable: $CACHE/cyber_hunter_20190729.exe\n    name: wineexec\n    prefix: $GAMEDIR\nwine:\n  overrides:\n    wininet: builtin,native\n  version: 4.3-x86_64\n"
}