{
  "id": 16730,
  "game_id": 29999,
  "game_slug": "3dmark-2000",
  "name": "3DMark 2000",
  "year": 2000,
  "user": "vanstaveren",
  "runner": "wine",
  "slug": "3dmark-2000-pro-110-complete",
  "version": "Pro 1.1.0, complete",
  "description": "* License: Legacy,\r\n* Hardware acceleration benchmark software,\r\n* Legacy key: 6VZTY-SDZ75-KA9V7,\r\n* Legacy user: Futuremark,\r\n* MP3codec DirectShow,\r\n* DirectX: 7.",
  "notes": "",
  "created_at": "2019-11-09T21:06:38.029960Z",
  "updated_at": "2019-11-09T21:06:38.029984Z",
  "draft": true,
  "published": false,
  "published_by": null,
  "rating": "",
  "steamid": null,
  "gogid": null,
  "gogslug": "",
  "humblestoreid": "",
  "script": {
    "files": [
      {
        "setup": "https://benchmarks.ul.com/downloads/3dmark2000.exe"
      }
    ],
    "installer": [
      {
        "task": {
          "arch": "win64",
          "description": "Creating 64-bit prefix ...",
          "prefix": "$GAMEDIR",
          "name": "create_prefix"
        }
      },
      {
        "task": {
          "arch": "win64",
          "description": "MP3codec DirectShow ...",
          "app": "l3codecx",
          "prefix": "$GAMEDIR",
          "name": "winetricks"
        }
      },
      {
        "task": {
          "arch": "win64",
          "description": "Windows version 98 ...",
          "app": "win98",
          "prefix": "$GAMEDIR",
          "name": "winetricks"
        }
      },
      {
        "move": {
          "src": "setup",
          "dst": "$GAMEDIR"
        }
      },
      {
        "chmodx": "$GAMEDIR/3dmark2000.exe"
      },
      {
        "task": {
          "executable": "$GAMEDIR/3dmark2000.exe",
          "description": "3DMark 2000 ...",
          "prefix": "$GAMEDIR",
          "name": "wineexec"
        }
      },
      {
        "task": {
          "value": "C:\\\\Program Files (x86)\\\\MadOnion.com\\\\3DMark2000\\\\3DMark2000.exe",
          "arch": "win64",
          "key": "ExePath",
          "name": "set_regedit",
          "description": "Register ExePath ...",
          "path": "HKEY_LOCAL_MACHINE\\Software\\Wow6432Node\\MadOnion.com\\3DMark2000",
          "type": "REG_SZ"
        }
      },
      {
        "task": {
          "value": "6VZTY-SDZ75-KA9V7",
          "arch": "win64",
          "key": "3DMarkRegKey",
          "name": "set_regedit",
          "description": "Register KeyCode ...",
          "path": "HKEY_LOCAL_MACHINE\\Software\\Wow6432Node\\MadOnion.com\\Registration2000",
          "type": "REG_SZ"
        }
      },
      {
        "task": {
          "value": "Futuremark",
          "arch": "win64",
          "key": "3DMarkRegName",
          "name": "set_regedit",
          "description": "Register KeyCode ...",
          "path": "HKEY_LOCAL_MACHINE\\Software\\Wow6432Node\\MadOnion.com\\Registration2000",
          "type": "REG_SZ"
        }
      }
    ],
    "system": {
      "disable_compositor": true
    },
    "wine": {
      "Desktop": true
    },
    "game": {
      "arch": "win64",
      "prefix": "$GAMEDIR",
      "exe": "$GAMEDIR/drive_c/Program Files (x86)/MadOnion.com/3DMark2000/3DMark2000.exe"
    }
  },
  "content": "files:\n- setup: https://benchmarks.ul.com/downloads/3dmark2000.exe\ngame:\n  arch: win64\n  exe: $GAMEDIR/drive_c/Program Files (x86)/MadOnion.com/3DMark2000/3DMark2000.exe\n  prefix: $GAMEDIR\ninstaller:\n- task:\n    arch: win64\n    description: Creating 64-bit prefix ...\n    name: create_prefix\n    prefix: $GAMEDIR\n- task:\n    app: l3codecx\n    arch: win64\n    description: MP3codec DirectShow ...\n    name: winetricks\n    prefix: $GAMEDIR\n- task:\n    app: win98\n    arch: win64\n    description: Windows version 98 ...\n    name: winetricks\n    prefix: $GAMEDIR\n- move:\n    dst: $GAMEDIR\n    src: setup\n- chmodx: $GAMEDIR/3dmark2000.exe\n- task:\n    description: 3DMark 2000 ...\n    executable: $GAMEDIR/3dmark2000.exe\n    name: wineexec\n    prefix: $GAMEDIR\n- task:\n    arch: win64\n    description: Register ExePath ...\n    key: ExePath\n    name: set_regedit\n    path: HKEY_LOCAL_MACHINE\\Software\\Wow6432Node\\MadOnion.com\\3DMark2000\n    type: REG_SZ\n    value: C:\\\\Program Files (x86)\\\\MadOnion.com\\\\3DMark2000\\\\3DMark2000.exe\n- task:\n    arch: win64\n    description: Register KeyCode ...\n    key: 3DMarkRegKey\n    name: set_regedit\n    path: HKEY_LOCAL_MACHINE\\Software\\Wow6432Node\\MadOnion.com\\Registration2000\n    type: REG_SZ\n    value: 6VZTY-SDZ75-KA9V7\n- task:\n    arch: win64\n    description: Register KeyCode ...\n    key: 3DMarkRegName\n    name: set_regedit\n    path: HKEY_LOCAL_MACHINE\\Software\\Wow6432Node\\MadOnion.com\\Registration2000\n    type: REG_SZ\n    value: Futuremark\nsystem:\n  disable_compositor: true\nwine:\n  Desktop: true\n"
}