{
  "id": 11058,
  "game_id": 23604,
  "game_slug": "adobe-digital-editions",
  "name": "Adobe Digital Editions",
  "year": 2013,
  "user": "sorsasampo",
  "runner": "wine",
  "slug": "adobe-digital-editions-20-201",
  "version": "2.0.1",
  "description": null,
  "notes": "",
  "created_at": "2018-12-02T11:12:47.718358Z",
  "updated_at": "2018-12-03T07:55:29.168914Z",
  "draft": false,
  "published": true,
  "published_by": 19464,
  "rating": "",
  "steamid": null,
  "gogid": null,
  "gogslug": "",
  "humblestoreid": "",
  "script": {
    "game": {
      "exe": "drive_c/Program Files/Adobe/Adobe Digital Editions 2.0/DigitalEditions.exe",
      "arch": "win32",
      "prefix": "$GAMEDIR"
    },
    "files": [
      {
        "setup": "http://download.adobe.com/pub/adobe/digitaleditions/ADE_2.0_Installer.exe"
      }
    ],
    "wine": {
      "version": "3.21-x86_64"
    },
    "installer": [
      {
        "task": {
          "description": "Installing corefonts",
          "arch": "win32",
          "prefix": "$GAMEDIR",
          "name": "winetricks",
          "app": "corefonts"
        }
      },
      {
        "task": {
          "description": "Installing dotnet35sp1",
          "arch": "win32",
          "prefix": "$GAMEDIR",
          "name": "winetricks",
          "app": "dotnet35sp1"
        }
      },
      {
        "task": {
          "description": "Installing windowscodecs",
          "arch": "win32",
          "prefix": "$GAMEDIR",
          "name": "winetricks",
          "app": "windowscodecs"
        }
      },
      {
        "task": {
          "description": "Installing Adobe Digital Editions 2.0",
          "executable": "setup",
          "arch": "win32",
          "name": "wineexec"
        }
      }
    ]
  },
  "content": "files:\n- setup: http://download.adobe.com/pub/adobe/digitaleditions/ADE_2.0_Installer.exe\ngame:\n  arch: win32\n  exe: drive_c/Program Files/Adobe/Adobe Digital Editions 2.0/DigitalEditions.exe\n  prefix: $GAMEDIR\ninstaller:\n- task:\n    app: corefonts\n    arch: win32\n    description: Installing corefonts\n    name: winetricks\n    prefix: $GAMEDIR\n- task:\n    app: dotnet35sp1\n    arch: win32\n    description: Installing dotnet35sp1\n    name: winetricks\n    prefix: $GAMEDIR\n- task:\n    app: windowscodecs\n    arch: win32\n    description: Installing windowscodecs\n    name: winetricks\n    prefix: $GAMEDIR\n- task:\n    arch: win32\n    description: Installing Adobe Digital Editions 2.0\n    executable: setup\n    name: wineexec\nwine:\n  version: 3.21-x86_64\n"
}