{
  "id": 11058,
  "game_id": 23604,
  "game_slug": "adobe-digital-editions",
  "name": "Adobe Digital Editions",
  "year": 2013,
  "user": "sorsasampo",
  "runner": "wine",
  "slug": "adobe-digital-editions-201",
  "version": "2.0.1",
  "description": null,
  "notes": "",
  "created_at": "2018-12-02T11:12:47.718000Z",
  "updated_at": "2019-10-28T20:56:33.338779Z",
  "draft": false,
  "published": true,
  "published_by": 51687,
  "rating": "",
  "steamid": null,
  "gogid": null,
  "gogslug": "",
  "humblestoreid": "",
  "script": {
    "files": [
      {
        "setup": "http://download.adobe.com/pub/adobe/digitaleditions/ADE_2.0_Installer.exe"
      }
    ],
    "game": {
      "arch": "win32",
      "exe": "drive_c/Program Files/Adobe/Adobe Digital Editions 2.0/DigitalEditions.exe",
      "prefix": "$GAMEDIR"
    },
    "installer": [
      {
        "task": {
          "app": "corefonts",
          "arch": "win32",
          "description": "Installing corefonts",
          "name": "winetricks",
          "prefix": "$GAMEDIR"
        }
      },
      {
        "task": {
          "app": "dotnet35sp1",
          "arch": "win32",
          "description": "Installing dotnet35sp1",
          "name": "winetricks",
          "prefix": "$GAMEDIR"
        }
      },
      {
        "task": {
          "app": "windowscodecs",
          "arch": "win32",
          "description": "Installing windowscodecs",
          "name": "winetricks",
          "prefix": "$GAMEDIR"
        }
      },
      {
        "task": {
          "arch": "win32",
          "description": "Installing Adobe Digital Editions 2.0",
          "executable": "setup",
          "name": "wineexec"
        }
      }
    ]
  },
  "content": "files:\n- setup: http://download.adobe.com/pub/adobe/digitaleditions/ADE_2.0_Installer.exe\ngame:\n  arch: win32\n  exe: drive_c/Program Files/Adobe/Adobe Digital Editions 2.0/DigitalEditions.exe\n  prefix: $GAMEDIR\ninstaller:\n- task:\n    app: corefonts\n    arch: win32\n    description: Installing corefonts\n    name: winetricks\n    prefix: $GAMEDIR\n- task:\n    app: dotnet35sp1\n    arch: win32\n    description: Installing dotnet35sp1\n    name: winetricks\n    prefix: $GAMEDIR\n- task:\n    app: windowscodecs\n    arch: win32\n    description: Installing windowscodecs\n    name: winetricks\n    prefix: $GAMEDIR\n- task:\n    arch: win32\n    description: Installing Adobe Digital Editions 2.0\n    executable: setup\n    name: wineexec\n"
}