{
  "id": 8701,
  "game_id": 3380,
  "game_slug": "dynasty-warriors-8-xtreme-legends-complete-edition",
  "name": "DYNASTY WARRIORS 8: Xtreme Legends Complete Edition",
  "year": null,
  "user": "zdzichu1",
  "runner": "wine",
  "slug": "dynasty-warriors-8-xtreme-leg-manual-installer",
  "version": "Manual installer",
  "description": "Game should be installed into \"C:\\Program Files\\Dynasty Warriors 8 Xtreme Legends\".\r\n\r\nBefore playing this game you'll probably want to configure it. To do it, right click on the game icon in the Lustris window and use \"Run EXE inside wine prefix\".\r\nThen navigate to \"drive_c/Program Files/Dynasty Warriors 8 Xtreme Legends/\" and select Config.exe.",
  "notes": "",
  "created_at": "2018-06-12T18:26:40.200000Z",
  "updated_at": "2018-06-13T06:25:18.459533Z",
  "draft": false,
  "published": true,
  "published_by": null,
  "rating": "",
  "steamid": 278080,
  "gogid": null,
  "gogslug": "",
  "humblestoreid": "",
  "script": {
    "system": {
      "xboxdrv": "--type xbox360"
    },
    "game": {
      "arch": "win32",
      "prefix": "$GAMEDIR",
      "exe": "drive_c/Program Files/Dynasty Warriors 8 Xtreme Legends/Launch.exe"
    },
    "files": [
      {
        "installer": "N/A:Select the game's setup file"
      }
    ],
    "installer": [
      {
        "task": {
          "arch": "win32",
          "prefix": "$GAMEDIR",
          "name": "create_prefix"
        }
      },
      {
        "task": {
          "prefix": "$GAMEDIR",
          "name": "winetricks",
          "app": "win7"
        }
      },
      {
        "task": {
          "prefix": "$GAMEDIR",
          "description": "Installing devenum",
          "name": "winetricks",
          "app": "devenum"
        }
      },
      {
        "task": {
          "arch": "win32",
          "prefix": "$GAMEDIR",
          "description": "Installing xact",
          "name": "winetricks",
          "app": "xact"
        }
      },
      {
        "task": {
          "arch": "win32",
          "prefix": "$GAMEDIR",
          "description": "Installing WMP9",
          "name": "winetricks",
          "app": "wmp9"
        }
      },
      {
        "task": {
          "arch": "win32",
          "executable": "installer",
          "prefix": "$GAMEDIR",
          "description": "Installing game",
          "name": "wineexec"
        }
      }
    ]
  },
  "content": "files:\n- installer: N/A:Select the game's setup file\ngame:\n  arch: win32\n  exe: drive_c/Program Files/Dynasty Warriors 8 Xtreme Legends/Launch.exe\n  prefix: $GAMEDIR\ninstaller:\n- task:\n    arch: win32\n    name: create_prefix\n    prefix: $GAMEDIR\n- task:\n    app: win7\n    name: winetricks\n    prefix: $GAMEDIR\n- task:\n    app: devenum\n    description: Installing devenum\n    name: winetricks\n    prefix: $GAMEDIR\n- task:\n    app: xact\n    arch: win32\n    description: Installing xact\n    name: winetricks\n    prefix: $GAMEDIR\n- task:\n    app: wmp9\n    arch: win32\n    description: Installing WMP9\n    name: winetricks\n    prefix: $GAMEDIR\n- task:\n    arch: win32\n    description: Installing game\n    executable: installer\n    name: wineexec\n    prefix: $GAMEDIR\nsystem:\n  xboxdrv: --type xbox360\n"
}