{
  "id": 8509,
  "game_id": 1816,
  "game_slug": "diablo-iii",
  "name": "Diablo III",
  "year": 2012,
  "user": "Dox",
  "runner": "wine",
  "slug": "diablo-iii-dxvk",
  "version": "DXVK",
  "description": null,
  "notes": "**IMPORTANT: INSTALL THE DEPENDENCIES FIRST**\r\nSee <a href=\"https://github.com/lutris/lutris/wiki/Game:-Blizzard-App\">https://github.com/lutris/lutris/wiki/Game:-Blizzard-App</a>\r\n\r\n**NOTES**\r\n- If you cannot use Vulkan / DXVK, disable DXVK. Then enable PBA for OpenGL by setting PBA_ENABLE=1 in environment variables, and you will have to use DX9 (since DX11 to OpenGL doesn't work well)\r\n- For DX9: Blizzard App > Game Settings > Enable: \"Launch 32-bit client instead of 64 bit\". This will start the game with DirectX9.\r\n- \"Displaymode 1\"  is set in Blizzard App for Fullscreen Windowed",
  "created_at": "2018-06-02T18:05:37.827000Z",
  "updated_at": "2020-01-23T02:56:48.620347Z",
  "draft": false,
  "published": true,
  "published_by": 19464,
  "rating": "4",
  "steamid": null,
  "gogid": null,
  "gogslug": "",
  "humblestoreid": "",
  "script": {
    "game": {
      "exe": "drive_c/Program Files (x86)/Battle.net/Battle.net Launcher.exe",
      "arch": "win64",
      "prefix": "$GAMEDIR"
    },
    "system": {
      "exclude_processes": "Agent.exe \"Battle.net Helper.exe\"",
      "env": {
        "PBA_ENABLE": "0",
        "DXVK_HUD": "0",
        "__GL_THREADED_OPTIMIZATIONS": "1",
        "__GL_SHADER_DISK_CACHE": "1",
        "DXVK_STATE_CACHE": "1",
        "__PBA_GEO_HEAP": "512",
        "__PBA_CB_HEAP": "128",
        "DXVK_STATE_CACHE_PATH": "$GAMEDIR",
        "__GL_SHADER_DISK_CACHE_PATH": "$GAMEDIR",
        "mesa_glthread": "true"
      }
    },
    "wine": {
      "esync": true,
      "dxvk": true
    },
    "installer": [
      {
        "task": {
          "arch": "win64",
          "description": "Creating 64bit Wine prefix.",
          "prefix": "$GAMEDIR",
          "name": "create_prefix"
        }
      },
      {
        "task": {
          "app": "arial",
          "arch": "win64",
          "description": "Installing Arial font",
          "prefix": "$GAMEDIR",
          "name": "winetricks"
        }
      },
      {
        "task": {
          "app": "fontsmooth-rgb",
          "arch": "win64",
          "description": "Setting fontsmooth=rbg",
          "prefix": "$GAMEDIR",
          "name": "winetricks"
        }
      },
      {
        "task": {
          "arch": "win64",
          "description": "Setting Windows 10 mode for Wine",
          "prefix": "$GAMEDIR",
          "name": "set_regedit",
          "path": "HKEY_CURRENT_USER\\Software\\Wine",
          "value": "win10",
          "key": "Version"
        }
      },
      {
        "write_json": {
          "file": "$GAMEDIR/drive_c/users/$USER/Application Data/Battle.net/Battle.net.config",
          "data": {
            "Client": {
              "HardwareAcceleration": "false",
              "Streaming": {
                "StreamingEnabled": "false"
              },
              "Sound": {
                "Enabled": "false"
              },
              "GameLaunchWindowBehavior": "2"
            }
          },
          "description": "Disabling Sound/Hardware Acceleration/Streaming in Blizzard App"
        }
      },
      {
        "task": {
          "executable": "setup",
          "exclude_processes": "Battle.net.exe Agent.exe \"Battle.net Helper.exe\"",
          "arch": "win64",
          "description": "Installing Blizzard App\n------------------------------\nDo not try to log into Battle.net. Lutris will automatically close the login window. After Lutris installer is finished, you can start Blizzard App with \"Launch the game\", and install / locate your Blizzard game.",
          "name": "wineexec"
        }
      },
      {
        "task": {
          "prefix": "$GAMEDIR",
          "name": "winekill"
        }
      },
      {
        "task": {
          "arch": "win64",
          "description": "Wine Staging: Enabling DXVA2",
          "prefix": "$GAMEDIR",
          "name": "set_regedit",
          "path": "HKEY_CURRENT_USER\\Software\\Wine\\DXVA2",
          "value": "va",
          "key": "backend"
        }
      }
    ],
    "files": [
      {
        "setup": {
          "filename": "Battle.net-Setup.exe",
          "url": "https://www.battle.net/download/getInstallerForGame?os=win&version=LIVE&gameProgram=BATTLENET_APP"
        }
      }
    ]
  },
  "content": "files:\n- setup:\n    filename: Battle.net-Setup.exe\n    url: https://www.battle.net/download/getInstallerForGame?os=win&version=LIVE&gameProgram=BATTLENET_APP\ngame:\n  arch: win64\n  exe: drive_c/Program Files (x86)/Battle.net/Battle.net Launcher.exe\n  prefix: $GAMEDIR\ninstaller:\n- task:\n    arch: win64\n    description: Creating 64bit Wine prefix.\n    name: create_prefix\n    prefix: $GAMEDIR\n- task:\n    app: arial\n    arch: win64\n    description: Installing Arial font\n    name: winetricks\n    prefix: $GAMEDIR\n- task:\n    app: fontsmooth-rgb\n    arch: win64\n    description: Setting fontsmooth=rbg\n    name: winetricks\n    prefix: $GAMEDIR\n- task:\n    arch: win64\n    description: Setting Windows 10 mode for Wine\n    key: Version\n    name: set_regedit\n    path: HKEY_CURRENT_USER\\Software\\Wine\n    prefix: $GAMEDIR\n    value: win10\n- write_json:\n    data:\n      Client:\n        GameLaunchWindowBehavior: '2'\n        HardwareAcceleration: 'false'\n        Sound:\n          Enabled: 'false'\n        Streaming:\n          StreamingEnabled: 'false'\n    description: Disabling Sound/Hardware Acceleration/Streaming in Blizzard App\n    file: $GAMEDIR/drive_c/users/$USER/Application Data/Battle.net/Battle.net.config\n- task:\n    arch: win64\n    description: 'Installing Blizzard App\n\n      ------------------------------\n\n      Do not try to log into Battle.net. Lutris will automatically close the login\n      window. After Lutris installer is finished, you can start Blizzard App with\n      \"Launch the game\", and install / locate your Blizzard game.'\n    exclude_processes: Battle.net.exe Agent.exe \"Battle.net Helper.exe\"\n    executable: setup\n    name: wineexec\n- task:\n    name: winekill\n    prefix: $GAMEDIR\n- task:\n    arch: win64\n    description: 'Wine Staging: Enabling DXVA2'\n    key: backend\n    name: set_regedit\n    path: HKEY_CURRENT_USER\\Software\\Wine\\DXVA2\n    prefix: $GAMEDIR\n    value: va\nsystem:\n  env:\n    DXVK_HUD: '0'\n    DXVK_STATE_CACHE: '1'\n    DXVK_STATE_CACHE_PATH: $GAMEDIR\n    PBA_ENABLE: '0'\n    __GL_SHADER_DISK_CACHE: '1'\n    __GL_SHADER_DISK_CACHE_PATH: $GAMEDIR\n    __GL_THREADED_OPTIMIZATIONS: '1'\n    __PBA_CB_HEAP: '128'\n    __PBA_GEO_HEAP: '512'\n    mesa_glthread: 'true'\n  exclude_processes: Agent.exe \"Battle.net Helper.exe\"\nwine:\n  dxvk: true\n  esync: true\n"
}