{
  "id": 19018,
  "game_id": 1816,
  "game_slug": "diablo-iii",
  "name": "Diablo III",
  "year": 2012,
  "user": "kwslavens",
  "runner": "wine",
  "slug": "diablo-iii-manuall-installer-fi",
  "version": "Manuall-Installer-fixed",
  "description": "Manual download battle.net-setup.exe. Run installer and select the installer when requested.",
  "notes": "",
  "created_at": "2020-03-21T00:48:13.098000Z",
  "updated_at": "2020-03-21T08:29:48.383615Z",
  "draft": false,
  "published": true,
  "published_by": 20548,
  "rating": "",
  "steamid": null,
  "gogid": null,
  "gogslug": "",
  "humblestoreid": "",
  "script": {
    "files": [
      {
        "setup": "N/A:Select Battle.Net installer"
      }
    ],
    "game": {
      "prefix": "$GAMEDIR",
      "exe": "drive_c/Program Files (x86)/Battle.net/Battle.net Launcher.exe",
      "arch": "win64"
    },
    "wine": {
      "esync": true,
      "dxvk": true
    },
    "system": {
      "env": {
        "__GL_SHADER_DISK_CACHE": "1",
        "__PBA_CB_HEAP": "128",
        "__PBA_GEO_HEAP": "512",
        "DXVK_STATE_CACHE": "1",
        "DXVK_HUD": "0",
        "DXVK_STATE_CACHE_PATH": "$GAMEDIR",
        "PBA_ENABLE": "0",
        "mesa_glthread": "true",
        "__GL_THREADED_OPTIMIZATIONS": "1",
        "__GL_SHADER_DISK_CACHE_PATH": "$GAMEDIR"
      },
      "exclude_processes": "Agent.exe \"Battle.net Helper.exe\""
    },
    "installer": [
      {
        "task": {
          "prefix": "$GAMEDIR",
          "arch": "win64",
          "name": "create_prefix",
          "description": "Creating 64bit Wine prefix."
        }
      },
      {
        "task": {
          "prefix": "$GAMEDIR",
          "arch": "win64",
          "app": "arial",
          "description": "Installing Arial font",
          "name": "winetricks"
        }
      },
      {
        "task": {
          "prefix": "$GAMEDIR",
          "arch": "win64",
          "app": "fontsmooth-rgb",
          "description": "Setting fontsmooth=rbg",
          "name": "winetricks"
        }
      },
      {
        "task": {
          "arch": "win64",
          "name": "set_regedit",
          "description": "Setting Windows 10 mode for Wine",
          "key": "Version",
          "prefix": "$GAMEDIR",
          "value": "win10",
          "path": "HKEY_CURRENT_USER\\Software\\Wine"
        }
      },
      {
        "write_json": {
          "file": "$GAMEDIR/drive_c/users/$USER/Application Data/Battle.net/Battle.net.config",
          "data": {
            "Client": {
              "HardwareAcceleration": "false",
              "GameLaunchWindowBehavior": "2",
              "Sound": {
                "Enabled": "false"
              },
              "Streaming": {
                "StreamingEnabled": "false"
              }
            }
          },
          "description": "Disabling Sound/Hardware Acceleration/Streaming in Blizzard App"
        }
      },
      {
        "task": {
          "exclude_processes": "Battle.net.exe Agent.exe \"Battle.net Helper.exe\"",
          "arch": "win64",
          "executable": "setup",
          "name": "wineexec",
          "description": "Installing Blizzard App\n------------------------------\nDo not try to log into Battle.net. Lutris will automatically close the login window. After Lutris installer is finished, you can start Blizzard App with \"Launch the game\", and install / locate your Blizzard game."
        }
      },
      {
        "task": {
          "prefix": "$GAMEDIR",
          "name": "winekill"
        }
      },
      {
        "task": {
          "arch": "win64",
          "name": "set_regedit",
          "description": "Wine Staging: Enabling DXVA2",
          "key": "backend",
          "prefix": "$GAMEDIR",
          "value": "va",
          "path": "HKEY_CURRENT_USER\\Software\\Wine\\DXVA2"
        }
      }
    ]
  },
  "content": "files:\n- setup: N/A:Select Battle.Net installer\ngame:\n  arch: win64\n  exe: drive_c/Program Files (x86)/Battle.net/Battle.net Launcher.exe\n  prefix: $GAMEDIR\ninstaller:\n- task:\n    arch: win64\n    description: Creating 64bit Wine prefix.\n    name: create_prefix\n    prefix: $GAMEDIR\n- task:\n    app: arial\n    arch: win64\n    description: Installing Arial font\n    name: winetricks\n    prefix: $GAMEDIR\n- task:\n    app: fontsmooth-rgb\n    arch: win64\n    description: Setting fontsmooth=rbg\n    name: winetricks\n    prefix: $GAMEDIR\n- task:\n    arch: win64\n    description: Setting Windows 10 mode for Wine\n    key: Version\n    name: set_regedit\n    path: HKEY_CURRENT_USER\\Software\\Wine\n    prefix: $GAMEDIR\n    value: win10\n- write_json:\n    data:\n      Client:\n        GameLaunchWindowBehavior: '2'\n        HardwareAcceleration: 'false'\n        Sound:\n          Enabled: 'false'\n        Streaming:\n          StreamingEnabled: 'false'\n    description: Disabling Sound/Hardware Acceleration/Streaming in Blizzard App\n    file: $GAMEDIR/drive_c/users/$USER/Application Data/Battle.net/Battle.net.config\n- task:\n    arch: win64\n    description: 'Installing Blizzard App\n\n      ------------------------------\n\n      Do not try to log into Battle.net. Lutris will automatically close the login\n      window. After Lutris installer is finished, you can start Blizzard App with\n      \"Launch the game\", and install / locate your Blizzard game.'\n    exclude_processes: Battle.net.exe Agent.exe \"Battle.net Helper.exe\"\n    executable: setup\n    name: wineexec\n- task:\n    name: winekill\n    prefix: $GAMEDIR\n- task:\n    arch: win64\n    description: 'Wine Staging: Enabling DXVA2'\n    key: backend\n    name: set_regedit\n    path: HKEY_CURRENT_USER\\Software\\Wine\\DXVA2\n    prefix: $GAMEDIR\n    value: va\nsystem:\n  env:\n    DXVK_HUD: '0'\n    DXVK_STATE_CACHE: '1'\n    DXVK_STATE_CACHE_PATH: $GAMEDIR\n    PBA_ENABLE: '0'\n    __GL_SHADER_DISK_CACHE: '1'\n    __GL_SHADER_DISK_CACHE_PATH: $GAMEDIR\n    __GL_THREADED_OPTIMIZATIONS: '1'\n    __PBA_CB_HEAP: '128'\n    __PBA_GEO_HEAP: '512'\n    mesa_glthread: 'true'\n  exclude_processes: Agent.exe \"Battle.net Helper.exe\"\nwine:\n  dxvk: true\n  esync: true\n"
}