{
  "id": 2656,
  "game_id": 1139,
  "game_slug": "men-of-war-vietnam",
  "name": "Men of War: Vietnam",
  "year": 2011,
  "user": "ssf",
  "runner": "wine",
  "slug": "men-of-war-vietnam-gogcom",
  "version": "GOG.com",
  "description": "",
  "notes": "",
  "created_at": "2016-08-31T20:32:51.577650Z",
  "updated_at": "2016-09-04T17:47:39.355850Z",
  "draft": false,
  "published": true,
  "published_by": null,
  "rating": "",
  "steamid": 63940,
  "gogid": 1428587439,
  "gogslug": "men_of_war_vietnam",
  "humblestoreid": "",
  "script": {
    "gogid": "men_of_war_vietnam",
    "files": [
      {
        "game": "N/A:Please select the GOG.com Windows installer."
      }
    ],
    "game": {
      "prefix": "$GAMEDIR",
      "exe": "$GAMEDIR/drive_c/game/vietnam.exe",
      "arch": "win32",
      "working_dir": "$GAMEDIR/drive_c/game"
    },
    "installer": [
      {
        "task": {
          "prefix": "$GAMEDIR",
          "name": "create_prefix",
          "description": "Creating Wine prefix"
        }
      },
      {
        "task": {
          "name": "set_regedit",
          "key": "winemenubuilder.exe",
          "prefix": "$GAMEDIR",
          "value": "",
          "path": "HKEY_CURRENT_USER\\Software\\Wine\\DllOverrides",
          "type": "REG_SZ"
        }
      },
      {
        "task": {
          "prefix": "$GAMEDIR",
          "executable": "game",
          "name": "wineexec",
          "description": "Installing...",
          "args": "/SP- /NOCANCEL '/DIR=C:/game'"
        }
      },
      {
        "task": {
          "prefix": "$GAMEDIR",
          "app": "directx9",
          "silent": true,
          "name": "winetricks"
        }
      },
      {
        "task": {
          "prefix": "$GAMEDIR",
          "description": "Disabling unused WINE features",
          "app": "sandbox",
          "silent": true,
          "name": "winetricks"
        }
      }
    ]
  },
  "content": "files:\n- game: N/A:Please select the GOG.com Windows installer.\ngame:\n  arch: win32\n  exe: $GAMEDIR/drive_c/game/vietnam.exe\n  prefix: $GAMEDIR\n  working_dir: $GAMEDIR/drive_c/game\ngogid: men_of_war_vietnam\ninstaller:\n- task:\n    description: Creating Wine prefix\n    name: create_prefix\n    prefix: $GAMEDIR\n- task:\n    key: winemenubuilder.exe\n    name: set_regedit\n    path: HKEY_CURRENT_USER\\Software\\Wine\\DllOverrides\n    prefix: $GAMEDIR\n    type: REG_SZ\n    value: ''\n- task:\n    args: /SP- /NOCANCEL '/DIR=C:/game'\n    description: Installing...\n    executable: game\n    name: wineexec\n    prefix: $GAMEDIR\n- task:\n    app: directx9\n    name: winetricks\n    prefix: $GAMEDIR\n    silent: true\n- task:\n    app: sandbox\n    description: Disabling unused WINE features\n    name: winetricks\n    prefix: $GAMEDIR\n    silent: true\n"
}