{
  "id": 2481,
  "game_id": 1348,
  "game_slug": "duke-nukem-manhattan-project",
  "name": "Duke Nukem: Manhattan Project",
  "year": 2002,
  "user": "ssf",
  "runner": "wine",
  "slug": "duke-nukem-manhattan-project-gogcom",
  "version": "GOG.com",
  "description": "",
  "notes": "",
  "created_at": "2016-08-17T19:15:48.668348Z",
  "updated_at": "2016-09-30T20:51:58.899346Z",
  "draft": false,
  "published": true,
  "published_by": null,
  "rating": "",
  "steamid": 240200,
  "gogid": null,
  "gogslug": "",
  "humblestoreid": "",
  "script": {
    "game": {
      "arch": "win32",
      "prefix": "$GAMEDIR",
      "exe": "drive_c/GOG Games/Duke Nukem - Manhattan Project/DukeNukemMP.exe"
    },
    "files": [
      {
        "game": "N/A:Please select the GOG.com Windows installer."
      }
    ],
    "gogid": "duke_nukem_manhattan_project",
    "installer": [
      {
        "task": {
          "prefix": "$GAMEDIR",
          "description": "Creating Wine prefix",
          "name": "create_prefix"
        }
      },
      {
        "task": {
          "prefix": "$GAMEDIR",
          "path": "HKEY_CURRENT_USER\\Software\\Wine\\DllOverrides",
          "value": "",
          "type": "REG_SZ",
          "key": "winemenubuilder.exe",
          "name": "set_regedit"
        }
      },
      {
        "task": {
          "prefix": "$GAMEDIR",
          "executable": "game",
          "args": "/VERYSILENT /SP- /NOCANCEL /SUPPRESSMSGBOXES",
          "description": "Installing",
          "name": "wineexec"
        }
      },
      {
        "task": {
          "prefix": "$GAMEDIR",
          "description": "Disabling unused WINE features",
          "name": "winetricks",
          "silent": true,
          "app": "sandbox"
        }
      }
    ]
  },
  "content": "files:\n- game: N/A:Please select the GOG.com Windows installer.\ngame:\n  arch: win32\n  exe: drive_c/GOG Games/Duke Nukem - Manhattan Project/DukeNukemMP.exe\n  prefix: $GAMEDIR\ngogid: duke_nukem_manhattan_project\ninstaller:\n- task:\n    description: Creating Wine prefix\n    name: create_prefix\n    prefix: $GAMEDIR\n- task:\n    key: winemenubuilder.exe\n    name: set_regedit\n    path: HKEY_CURRENT_USER\\Software\\Wine\\DllOverrides\n    prefix: $GAMEDIR\n    type: REG_SZ\n    value: ''\n- task:\n    args: /VERYSILENT /SP- /NOCANCEL /SUPPRESSMSGBOXES\n    description: Installing\n    executable: game\n    name: wineexec\n    prefix: $GAMEDIR\n- task:\n    app: sandbox\n    description: Disabling unused WINE features\n    name: winetricks\n    prefix: $GAMEDIR\n    silent: true\n"
}