{
  "id": 2521,
  "game_id": 796,
  "game_slug": "commandos-3-destination-berlin",
  "name": "Commandos 3: Destination Berlin",
  "year": 2003,
  "user": "ssf",
  "runner": "wine",
  "slug": "commandos-3-destination-berli-gogcom",
  "version": "GOG.com",
  "description": "GOG standalone version",
  "notes": "Resolution is fixed to 800x600 (see here for a fix: http://pcgamingwiki.com/wiki/Commandos_3:_Destination_Berlin#Video_settings)",
  "created_at": "2016-08-21T14:13:27.600667Z",
  "updated_at": "2016-09-30T16:14:23.522305Z",
  "draft": false,
  "published": true,
  "published_by": null,
  "rating": "",
  "steamid": 6840,
  "gogid": null,
  "gogslug": "commandos_2_3",
  "humblestoreid": "",
  "script": {
    "gogid": "commandos_2_3",
    "files": [
      {
        "game": "N/A:Please select the GOG.com Windows installer."
      }
    ],
    "game": {
      "prefix": "$GAMEDIR",
      "exe": "drive_c/game/Commandos3.exe",
      "arch": "win32"
    },
    "installer": [
      {
        "task": {
          "prefix": "$GAMEDIR",
          "name": "create_prefix",
          "description": "Creating Wine prefix"
        }
      },
      {
        "task": {
          "name": "set_regedit",
          "key": "winemenubuilder.exe",
          "prefix": "$GAMEDIR",
          "value": "",
          "path": "HKEY_CURRENT_USER\\Software\\Wine\\DllOverrides",
          "type": "REG_SZ"
        }
      },
      {
        "task": {
          "prefix": "$GAMEDIR",
          "executable": "game",
          "name": "wineexec",
          "description": "Installing...",
          "args": "/VERYSILENT /SP- /NOCANCEL /SUPPRESSMSGBOXES '/DIR=C:/game'"
        }
      },
      {
        "task": {
          "prefix": "$GAMEDIR",
          "description": "Disabling unused WINE features",
          "app": "sandbox",
          "silent": true,
          "name": "winetricks"
        }
      }
    ]
  },
  "content": "files:\n- game: N/A:Please select the GOG.com Windows installer.\ngame:\n  arch: win32\n  exe: drive_c/game/Commandos3.exe\n  prefix: $GAMEDIR\ngogid: commandos_2_3\ninstaller:\n- task:\n    description: Creating Wine prefix\n    name: create_prefix\n    prefix: $GAMEDIR\n- task:\n    key: winemenubuilder.exe\n    name: set_regedit\n    path: HKEY_CURRENT_USER\\Software\\Wine\\DllOverrides\n    prefix: $GAMEDIR\n    type: REG_SZ\n    value: ''\n- task:\n    args: /VERYSILENT /SP- /NOCANCEL /SUPPRESSMSGBOXES '/DIR=C:/game'\n    description: Installing...\n    executable: game\n    name: wineexec\n    prefix: $GAMEDIR\n- task:\n    app: sandbox\n    description: Disabling unused WINE features\n    name: winetricks\n    prefix: $GAMEDIR\n    silent: true\n"
}