{
  "id": 2611,
  "game_id": 5895,
  "game_slug": "faces-of-war",
  "name": "Faces of War",
  "year": null,
  "user": "ssf",
  "runner": "wine",
  "slug": "faces-of-war-gogcom",
  "version": "GOG.com",
  "description": "",
  "notes": "",
  "created_at": "2016-08-27T15:31:15.583808Z",
  "updated_at": "2016-09-30T21:10:07.201593Z",
  "draft": false,
  "published": true,
  "published_by": null,
  "rating": "",
  "steamid": 289300,
  "gogid": 1428586504,
  "gogslug": "faces_of_war",
  "humblestoreid": "",
  "script": {
    "installer": [
      {
        "task": {
          "description": "Creating Wine prefix",
          "prefix": "$GAMEDIR",
          "name": "create_prefix"
        }
      },
      {
        "task": {
          "prefix": "$GAMEDIR",
          "value": "",
          "key": "winemenubuilder.exe",
          "name": "set_regedit",
          "type": "REG_SZ",
          "path": "HKEY_CURRENT_USER\\Software\\Wine\\DllOverrides"
        }
      },
      {
        "task": {
          "args": "/VERYSILENT /SP- /NOCANCEL /SUPPRESSMSGBOXES '/DIR=C:/game'",
          "executable": "game",
          "description": "Installing...",
          "prefix": "$GAMEDIR",
          "name": "wineexec"
        }
      },
      {
        "task": {
          "silent": false,
          "app": "directx9",
          "prefix": "$GAMEDIR",
          "name": "winetricks"
        }
      },
      {
        "task": {
          "silent": true,
          "description": "Disabling unused WINE features",
          "app": "sandbox",
          "prefix": "$GAMEDIR",
          "name": "winetricks"
        }
      }
    ],
    "files": [
      {
        "game": "N/A:Please select the GOG.com Windows installer."
      }
    ],
    "gogid": "faces_of_war",
    "game": {
      "arch": "win32",
      "working_dir": "$GAMEDIR/drive_c/game",
      "prefix": "$GAMEDIR",
      "exe": "$GAMEDIR/drive_c/game/facesofwar.exe"
    }
  },
  "content": "files:\n- game: N/A:Please select the GOG.com Windows installer.\ngame:\n  arch: win32\n  exe: $GAMEDIR/drive_c/game/facesofwar.exe\n  prefix: $GAMEDIR\n  working_dir: $GAMEDIR/drive_c/game\ngogid: faces_of_war\ninstaller:\n- task:\n    description: Creating Wine prefix\n    name: create_prefix\n    prefix: $GAMEDIR\n- task:\n    key: winemenubuilder.exe\n    name: set_regedit\n    path: HKEY_CURRENT_USER\\Software\\Wine\\DllOverrides\n    prefix: $GAMEDIR\n    type: REG_SZ\n    value: ''\n- task:\n    args: /VERYSILENT /SP- /NOCANCEL /SUPPRESSMSGBOXES '/DIR=C:/game'\n    description: Installing...\n    executable: game\n    name: wineexec\n    prefix: $GAMEDIR\n- task:\n    app: directx9\n    name: winetricks\n    prefix: $GAMEDIR\n    silent: false\n- task:\n    app: sandbox\n    description: Disabling unused WINE features\n    name: winetricks\n    prefix: $GAMEDIR\n    silent: true\n"
}