{
  "id": 14437,
  "game_id": 1114,
  "game_slug": "star-wars-the-force-unleashed",
  "name": "Star Wars: The Force Unleashed Ultimate Sith Edition",
  "year": 2009,
  "user": "VortexAcherontic",
  "runner": "wine",
  "slug": "star-wars-the-force-unleashed-2-disc-retail",
  "version": "2 Disc Retail",
  "description": "This installer is for the retail version of the game with 2 DVDs.\r\nThis installer will copy the content of the first DVD to your Disk and run the setup from there. This is made to make the installer working as expected when changing disks.",
  "notes": "",
  "created_at": "2019-07-06T09:26:37.207000Z",
  "updated_at": "2020-01-23T02:56:53.427348Z",
  "draft": false,
  "published": true,
  "published_by": 1,
  "rating": "",
  "steamid": 32430,
  "gogid": 1189268228,
  "gogslug": "star_wars_the_force_unleashed_ultimate_sith_edition",
  "humblestoreid": "",
  "script": {
    "game": {
      "arch": "win32",
      "prefix": "$GAMEDIR",
      "exe": "$GAMEDIR/drive_c/Program Files/Activision/Star Wars The Force Unleashed/SWTFU Launcher.exe"
    },
    "installer": [
      {
        "task": {
          "arch": "win32",
          "description": "Creating Wine Bottle, please wait...",
          "install_mono": false,
          "prefix": "$GAMEDIR",
          "name": "create_prefix"
        }
      },
      {
        "insert-disc": {
          "description": "Insert disc 1",
          "requires": "setup.exe"
        }
      },
      {
        "merge": {
          "src": "$DISC",
          "dst": "$GAMEDIR/drive_c/swsetup",
          "description": "Extracting installation data from disc, please wait ..."
        }
      },
      {
        "execute": {
          "args": "744 -R $GAMEDIR/drive_c/swsetup",
          "file": "chmod",
          "descritpion": "Set proper file permissions for extracted data, please wait..."
        }
      },
      {
        "task": {
          "executable": "$GAMEDIR/drive_c/swsetup/setup.exe",
          "prefix": "$GAMEDIR",
          "name": "wineexec"
        }
      },
      {
        "task": {
          "arch": "win32",
          "description": "Installing Dot.Net 3.6 Service Pack 1",
          "app": "dotnet35sp1",
          "prefix": "$GAMEDIR",
          "name": "winetricks"
        }
      },
      {
        "task": {
          "arch": "win32",
          "app": "vcrun2005 win7",
          "prefix": "$GAMEDIR",
          "name": "winetricks"
        }
      },
      {
        "task": {
          "arch": "win32",
          "app": "xact",
          "prefix": "$GAMEDIR",
          "name": "winetricks"
        }
      }
    ]
  },
  "content": "game:\n  arch: win32\n  exe: $GAMEDIR/drive_c/Program Files/Activision/Star Wars The Force Unleashed/SWTFU\n    Launcher.exe\n  prefix: $GAMEDIR\ninstaller:\n- task:\n    arch: win32\n    description: Creating Wine Bottle, please wait...\n    install_mono: false\n    name: create_prefix\n    prefix: $GAMEDIR\n- insert-disc:\n    description: Insert disc 1\n    requires: setup.exe\n- merge:\n    description: Extracting installation data from disc, please wait ...\n    dst: $GAMEDIR/drive_c/swsetup\n    src: $DISC\n- execute:\n    args: 744 -R $GAMEDIR/drive_c/swsetup\n    descritpion: Set proper file permissions for extracted data, please wait...\n    file: chmod\n- task:\n    executable: $GAMEDIR/drive_c/swsetup/setup.exe\n    name: wineexec\n    prefix: $GAMEDIR\n- task:\n    app: dotnet35sp1\n    arch: win32\n    description: Installing Dot.Net 3.6 Service Pack 1\n    name: winetricks\n    prefix: $GAMEDIR\n- task:\n    app: vcrun2005 win7\n    arch: win32\n    name: winetricks\n    prefix: $GAMEDIR\n- task:\n    app: xact\n    arch: win32\n    name: winetricks\n    prefix: $GAMEDIR\n"
}