{
  "id": 16384,
  "game_id": 29949,
  "game_slug": "warhammer-online-return-to-reckoning",
  "name": "Warhammer Online: Return to Reckoning",
  "year": 2008,
  "user": "Niqu3d-1",
  "runner": "wine",
  "slug": "warhammer-online-return-to-re-torrent",
  "version": "torrent",
  "description": "Make sure to follow the join us page first \r\nhttps://www.returnofreckoning.com/join.php\r\n\r\nThis is not my original work i found it on the official RoR fourms and was posted by the user Wdesu\r\nThank you Wdesu for your help on making the script",
  "notes": "im working on trying to get this to work",
  "created_at": "2019-10-24T19:24:38.240000Z",
  "updated_at": "2019-12-25T16:38:48.778761Z",
  "draft": false,
  "published": true,
  "published_by": 20548,
  "rating": "",
  "steamid": null,
  "gogid": null,
  "gogslug": "",
  "humblestoreid": "",
  "script": {
    "game": {
      "exe": "$GAMEDIR/prefix/drive_c/Program Files (x86)/Return of Reckoning/RoRLauncher.exe",
      "working_dir": "$GAMEDIR/prefix/drive_c/Program Files (x86)/Return of Reckoning",
      "prefix": "$GAMEDIR/prefix"
    },
    "system": {
      "env": {
        "STAGING_RT_PRIORITY_SERVER": 90,
        "WINEARCH": "win64",
        "WINEDEBUG": "-all",
        "STAGING_SHARED_MEMORY": 1,
        "WINEPREFIX": "$GAMEDIR/prefix",
        "WINEDLLOVERRIDES": "winemenubuilder.exe=d d3d11=",
        "STAGING_RT_PRIORITY_BASE": 90,
        "CSMT": "enabled"
      },
      "terminal": false
    },
    "installer": [
      {
        "insert-disc": {
          "message": "Please provide a path to your game folder (it should contain RoRLauncher.exe).",
          "requires": "RoRLauncher.exe"
        }
      },
      {
        "merge": {
          "dst": "$GAMEDIR/prefix/drive_c/Program Files (x86)/Return of Reckoning",
          "src": "$DISC"
        }
      },
      {
        "task": {
          "arch": "win64",
          "description": "Creating Wine prefix",
          "prefix": "$GAMEDIR/prefix",
          "name": "create_prefix"
        }
      },
      {
        "task": {
          "app": "corefonts",
          "prefix": "$GAMEDIR/prefix",
          "name": "winetricks"
        }
      },
      {
        "task": {
          "app": "comctl32ocx",
          "prefix": "$GAMEDIR/prefix",
          "name": "winetricks"
        }
      },
      {
        "task": {
          "app": "comctl32",
          "prefix": "$GAMEDIR/prefix",
          "name": "winetricks"
        }
      },
      {
        "task": {
          "app": "comdlg32ocx",
          "prefix": "$GAMEDIR/prefix",
          "name": "winetricks"
        }
      },
      {
        "task": {
          "app": "vcrun2012",
          "prefix": "$GAMEDIR/prefix",
          "name": "winetricks"
        }
      },
      {
        "task": {
          "app": "d3dx9",
          "prefix": "$GAMEDIR/prefix",
          "name": "winetricks"
        }
      },
      {
        "task": {
          "app": "directx9",
          "prefix": "$GAMEDIR/prefix",
          "name": "winetricks"
        }
      },
      {
        "task": {
          "app": "d3dx9_36",
          "prefix": "$GAMEDIR/prefix",
          "name": "winetricks"
        }
      },
      {
        "task": {
          "app": "dotnet40",
          "prefix": "$GAMEDIR/prefix",
          "name": "winetricks"
        }
      }
    ]
  },
  "content": "game:\n  exe: $GAMEDIR/prefix/drive_c/Program Files (x86)/Return of Reckoning/RoRLauncher.exe\n  prefix: $GAMEDIR/prefix\n  working_dir: $GAMEDIR/prefix/drive_c/Program Files (x86)/Return of Reckoning\ninstaller:\n- insert-disc:\n    message: Please provide a path to your game folder (it should contain RoRLauncher.exe).\n    requires: RoRLauncher.exe\n- merge:\n    dst: $GAMEDIR/prefix/drive_c/Program Files (x86)/Return of Reckoning\n    src: $DISC\n- task:\n    arch: win64\n    description: Creating Wine prefix\n    name: create_prefix\n    prefix: $GAMEDIR/prefix\n- task:\n    app: corefonts\n    name: winetricks\n    prefix: $GAMEDIR/prefix\n- task:\n    app: comctl32ocx\n    name: winetricks\n    prefix: $GAMEDIR/prefix\n- task:\n    app: comctl32\n    name: winetricks\n    prefix: $GAMEDIR/prefix\n- task:\n    app: comdlg32ocx\n    name: winetricks\n    prefix: $GAMEDIR/prefix\n- task:\n    app: vcrun2012\n    name: winetricks\n    prefix: $GAMEDIR/prefix\n- task:\n    app: d3dx9\n    name: winetricks\n    prefix: $GAMEDIR/prefix\n- task:\n    app: directx9\n    name: winetricks\n    prefix: $GAMEDIR/prefix\n- task:\n    app: d3dx9_36\n    name: winetricks\n    prefix: $GAMEDIR/prefix\n- task:\n    app: dotnet40\n    name: winetricks\n    prefix: $GAMEDIR/prefix\nsystem:\n  env:\n    CSMT: enabled\n    STAGING_RT_PRIORITY_BASE: 90\n    STAGING_RT_PRIORITY_SERVER: 90\n    STAGING_SHARED_MEMORY: 1\n    WINEARCH: win64\n    WINEDEBUG: -all\n    WINEDLLOVERRIDES: winemenubuilder.exe=d d3d11=\n    WINEPREFIX: $GAMEDIR/prefix\n  terminal: false\n"
}