{
  "id": 13463,
  "game_id": 12334,
  "game_slug": "cold-waters",
  "name": "Cold Waters",
  "year": null,
  "user": "Preisschild",
  "runner": "wine",
  "slug": "cold-waters-gog",
  "version": "GOG",
  "description": null,
  "notes": "",
  "created_at": "2019-05-11T20:33:24.835000Z",
  "updated_at": "2019-06-13T07:08:14.929784Z",
  "draft": false,
  "published": true,
  "published_by": 19464,
  "rating": "",
  "steamid": 541210,
  "gogid": 1512372112,
  "gogslug": "cold_waters",
  "humblestoreid": "",
  "script": {
    "game": {
      "exe": "drive_c/GOG Games/Cold Waters/ColdWaters.exe",
      "arch": "win64",
      "prefix": "$GAMEDIR"
    },
    "files": [
      {
        "setup": "N/A:Select the installer for the game"
      }
    ],
    "system": {
      "env": {
        "DXVK_HUD": 0,
        "__GL_SHADER_DISK_CACHE": 1,
        "__GL_SHADER_DISK_CACHE_PATH": "$GAMEDIR",
        "DXVK_STATE_CACHE_PATH": "$GAMEDIR"
      }
    },
    "installer": [
      {
        "task": {
          "description": "Creating win64 prefix",
          "prefix": "$GAMEDIR",
          "arch": "win64",
          "name": "create_prefix"
        }
      },
      {
        "task": {
          "description": "Installing corefonts",
          "arch": "win64",
          "prefix": "$GAMEDIR",
          "name": "winetricks",
          "app": "arial"
        }
      },
      {
        "task": {
          "description": "Changing windows version to Win7",
          "arch": "win64",
          "prefix": "$GAMEDIR",
          "name": "winetricks",
          "app": "win7"
        }
      },
      {
        "task": {
          "description": "Installing faudio",
          "arch": "win64",
          "prefix": "$GAMEDIR",
          "name": "winetricks",
          "app": "faudio"
        }
      },
      {
        "task": {
          "description": "Installing the game.",
          "prefix": "$GAMEDIR",
          "executable": "setup",
          "arch": "win64",
          "name": "wineexec"
        }
      }
    ],
    "wine": {
      "esync": true,
      "dxvk": true,
      "version": "tkg-protonified-4.6-x86_64"
    }
  },
  "content": "files:\n- setup: N/A:Select the installer for the game\ngame:\n  arch: win64\n  exe: drive_c/GOG Games/Cold Waters/ColdWaters.exe\n  prefix: $GAMEDIR\ninstaller:\n- task:\n    arch: win64\n    description: Creating win64 prefix\n    name: create_prefix\n    prefix: $GAMEDIR\n- task:\n    app: arial\n    arch: win64\n    description: Installing corefonts\n    name: winetricks\n    prefix: $GAMEDIR\n- task:\n    app: win7\n    arch: win64\n    description: Changing windows version to Win7\n    name: winetricks\n    prefix: $GAMEDIR\n- task:\n    app: faudio\n    arch: win64\n    description: Installing faudio\n    name: winetricks\n    prefix: $GAMEDIR\n- task:\n    arch: win64\n    description: Installing the game.\n    executable: setup\n    name: wineexec\n    prefix: $GAMEDIR\nsystem:\n  env:\n    DXVK_HUD: 0\n    DXVK_STATE_CACHE_PATH: $GAMEDIR\n    __GL_SHADER_DISK_CACHE: 1\n    __GL_SHADER_DISK_CACHE_PATH: $GAMEDIR\nwine:\n  dxvk: true\n  esync: true\n  version: tkg-protonified-4.6-x86_64\n"
}