{
  "id": 12978,
  "game_id": 1304,
  "game_slug": "lego-harry-potter-years-1-4",
  "name": "LEGO Harry Potter: Years 1-4",
  "year": 2010,
  "user": "cxf",
  "runner": "wine",
  "slug": "lego-harry-potter-gog",
  "version": "GOG",
  "description": null,
  "notes": "",
  "created_at": "2019-04-20T08:14:44.998000Z",
  "updated_at": "2019-04-20T08:15:45.811789Z",
  "draft": false,
  "published": true,
  "published_by": 19464,
  "rating": "",
  "steamid": 21130,
  "gogid": 1423058817,
  "gogslug": "lego_harry_potter_years_14",
  "humblestoreid": "",
  "script": {
    "game": {
      "arch": "win32",
      "prefix": "$GAMEDIR",
      "exe": "drive_c/GOG Games/LEGO Harry Potter 1-4/LEGOHarryPotter.exe"
    },
    "files": [
      {
        "dx2010": "https://lutris.net/files/tools/directx-2010.tar.gz"
      },
      {
        "goginstaller": "N/A:Please select the GOG installer"
      }
    ],
    "installer": [
      {
        "task": {
          "arch": "win32",
          "prefix": "$GAMEDIR",
          "name": "create_prefix"
        }
      },
      {
        "extract": {
          "dst": "$CACHE/dxsetup",
          "file": "dx2010"
        }
      },
      {
        "task": {
          "arch": "win32",
          "executable": "$CACHE/dxsetup/DXSETUP.exe",
          "prefix": "$GAMEDIR",
          "name": "wineexec",
          "args": "/silent"
        }
      },
      {
        "task": {
          "arch": "win32",
          "prefix": "$GAMEDIR",
          "name": "winetricks",
          "app": "vcrun2005 d3dcompiler_47 win7"
        }
      },
      {
        "task": {
          "arch": "win32",
          "executable": "goginstaller",
          "prefix": "$GAMEDIR",
          "name": "wineexec",
          "args": "/SP- /SUPPRESSMSGBOXES /NORESTART"
        }
      }
    ]
  },
  "content": "files:\n- dx2010: https://lutris.net/files/tools/directx-2010.tar.gz\n- goginstaller: N/A:Please select the GOG installer\ngame:\n  arch: win32\n  exe: drive_c/GOG Games/LEGO Harry Potter 1-4/LEGOHarryPotter.exe\n  prefix: $GAMEDIR\ninstaller:\n- task:\n    arch: win32\n    name: create_prefix\n    prefix: $GAMEDIR\n- extract:\n    dst: $CACHE/dxsetup\n    file: dx2010\n- task:\n    arch: win32\n    args: /silent\n    executable: $CACHE/dxsetup/DXSETUP.exe\n    name: wineexec\n    prefix: $GAMEDIR\n- task:\n    app: vcrun2005 d3dcompiler_47 win7\n    arch: win32\n    name: winetricks\n    prefix: $GAMEDIR\n- task:\n    arch: win32\n    args: /SP- /SUPPRESSMSGBOXES /NORESTART\n    executable: goginstaller\n    name: wineexec\n    prefix: $GAMEDIR\n"
}