{
  "id": 2495,
  "game_id": 403,
  "game_slug": "thief-deadly-shadows",
  "name": "Thief: Deadly Shadows",
  "year": null,
  "user": "ssf",
  "runner": "wine",
  "slug": "thief-deadly-shadows-gogcom",
  "version": "GOG.com",
  "description": "",
  "notes": "",
  "created_at": "2016-08-18T14:53:50.198781Z",
  "updated_at": "2016-09-30T20:53:48.605387Z",
  "draft": false,
  "published": true,
  "published_by": null,
  "rating": "",
  "steamid": 6980,
  "gogid": null,
  "gogslug": "",
  "humblestoreid": "",
  "script": {
    "game": {
      "arch": "win32",
      "prefix": "$GAMEDIR",
      "exe": "drive_c/GOG Games/Thief - Deadly Shadows/System/t3.EXE"
    },
    "files": [
      {
        "game": "N/A:Please select the GOG.com Windows installer."
      }
    ],
    "gogid": "thief_3",
    "installer": [
      {
        "task": {
          "prefix": "$GAMEDIR",
          "description": "Creating Wine prefix",
          "name": "create_prefix"
        }
      },
      {
        "task": {
          "prefix": "$GAMEDIR",
          "path": "HKEY_CURRENT_USER\\Software\\Wine\\DllOverrides",
          "value": "",
          "type": "REG_SZ",
          "key": "winemenubuilder.exe",
          "name": "set_regedit"
        }
      },
      {
        "task": {
          "prefix": "$GAMEDIR",
          "description": "Installing d3d9",
          "name": "winetricks",
          "silent": true,
          "app": "d3dx9"
        }
      },
      {
        "task": {
          "prefix": "$GAMEDIR",
          "executable": "game",
          "args": "/VERYSILENT /SP- /NOCANCEL /SUPPRESSMSGBOXES",
          "description": "Installing...",
          "name": "wineexec"
        }
      },
      {
        "task": {
          "prefix": "$GAMEDIR",
          "description": "Disabling unused WINE features",
          "name": "winetricks",
          "silent": true,
          "app": "sandbox"
        }
      }
    ]
  },
  "content": "files:\n- game: N/A:Please select the GOG.com Windows installer.\ngame:\n  arch: win32\n  exe: drive_c/GOG Games/Thief - Deadly Shadows/System/t3.EXE\n  prefix: $GAMEDIR\ngogid: thief_3\ninstaller:\n- task:\n    description: Creating Wine prefix\n    name: create_prefix\n    prefix: $GAMEDIR\n- task:\n    key: winemenubuilder.exe\n    name: set_regedit\n    path: HKEY_CURRENT_USER\\Software\\Wine\\DllOverrides\n    prefix: $GAMEDIR\n    type: REG_SZ\n    value: ''\n- task:\n    app: d3dx9\n    description: Installing d3d9\n    name: winetricks\n    prefix: $GAMEDIR\n    silent: true\n- task:\n    args: /VERYSILENT /SP- /NOCANCEL /SUPPRESSMSGBOXES\n    description: Installing...\n    executable: game\n    name: wineexec\n    prefix: $GAMEDIR\n- task:\n    app: sandbox\n    description: Disabling unused WINE features\n    name: winetricks\n    prefix: $GAMEDIR\n    silent: true\n"
}