{
  "id": 7987,
  "game_id": 10067,
  "game_slug": "ghost-of-a-tale",
  "name": "Ghost of a Tale",
  "year": null,
  "user": "aloade",
  "runner": "wine",
  "slug": "ghost-of-a-tale-gog",
  "version": "GOG",
  "description": null,
  "notes": "",
  "created_at": "2018-04-25T19:53:49.809000Z",
  "updated_at": "2018-12-20T23:28:16.320257Z",
  "draft": false,
  "published": true,
  "published_by": 51687,
  "rating": "",
  "steamid": 417290,
  "gogid": 1875167847,
  "gogslug": "ghost_of_a_tale",
  "humblestoreid": "",
  "script": {
    "game": {
      "exe": "drive_c/GOG Games/Ghost of a Tale/GoaT.exe",
      "arch": "win32",
      "prefix": "$GAMEDIR"
    },
    "files": [
      {
        "installer": "N/A:Select the GOG installer:"
      }
    ],
    "wine": {
      "version": "tkg-3.21-x86_64"
    },
    "installer": [
      {
        "task": {
          "description": "Creating 32bit Wine prefix.",
          "prefix": "$GAMEDIR",
          "arch": "win32",
          "name": "create_prefix"
        }
      },
      {
        "task": {
          "prefix": "$GAMEDIR",
          "name": "set_regedit",
          "description": "Setting OS as Windows 7.",
          "path": "HKEY_CURRENT_USER\\Software\\Wine",
          "value": "win7",
          "key": "Version"
        }
      },
      {
        "task": {
          "prefix": "$GAMEDIR",
          "name": "set_regedit",
          "description": "Allow DirectX apps to stop the mouse leaving their window.",
          "path": "HKEY_CURRENT_USER\\Software\\Wine\\X11 Driver",
          "value": "Y",
          "key": "GrabFullScreen"
        }
      },
      {
        "task": {
          "prefix": "$GAMEDIR",
          "name": "set_regedit",
          "description": "Deny the window manager to decorate the windows.",
          "path": "HKEY_CURRENT_USER\\Software\\Wine\\X11 Driver",
          "value": "N",
          "key": "Decorated"
        }
      },
      {
        "task": {
          "prefix": "$GAMEDIR",
          "name": "set_regedit",
          "description": "Allow the window manager to control the windows.",
          "path": "HKEY_CURRENT_USER\\Software\\Wine\\X11 Driver",
          "value": "Y",
          "key": "Managed"
        }
      },
      {
        "task": {
          "prefix": "$GAMEDIR",
          "name": "set_regedit",
          "description": "Enabling VAAPI as backend for DXVA2 GPU decoding.",
          "path": "HKEY_CURRENT_USER\\Software\\Wine\\DXVA2",
          "value": "va",
          "key": "backend"
        }
      },
      {
        "task": {
          "description": "The installating folder MUST BE 'C:\\GOG Games\\Ghost of a Tale'. At the end don't launch the game, but click on 'Quit'.",
          "prefix": "$GAMEDIR",
          "executable": "installer",
          "name": "wineexec"
        }
      }
    ]
  },
  "content": "files:\n- installer: 'N/A:Select the GOG installer:'\ngame:\n  arch: win32\n  exe: drive_c/GOG Games/Ghost of a Tale/GoaT.exe\n  prefix: $GAMEDIR\ninstaller:\n- task:\n    arch: win32\n    description: Creating 32bit Wine prefix.\n    name: create_prefix\n    prefix: $GAMEDIR\n- task:\n    description: Setting OS as Windows 7.\n    key: Version\n    name: set_regedit\n    path: HKEY_CURRENT_USER\\Software\\Wine\n    prefix: $GAMEDIR\n    value: win7\n- task:\n    description: Allow DirectX apps to stop the mouse leaving their window.\n    key: GrabFullScreen\n    name: set_regedit\n    path: HKEY_CURRENT_USER\\Software\\Wine\\X11 Driver\n    prefix: $GAMEDIR\n    value: Y\n- task:\n    description: Deny the window manager to decorate the windows.\n    key: Decorated\n    name: set_regedit\n    path: HKEY_CURRENT_USER\\Software\\Wine\\X11 Driver\n    prefix: $GAMEDIR\n    value: N\n- task:\n    description: Allow the window manager to control the windows.\n    key: Managed\n    name: set_regedit\n    path: HKEY_CURRENT_USER\\Software\\Wine\\X11 Driver\n    prefix: $GAMEDIR\n    value: Y\n- task:\n    description: Enabling VAAPI as backend for DXVA2 GPU decoding.\n    key: backend\n    name: set_regedit\n    path: HKEY_CURRENT_USER\\Software\\Wine\\DXVA2\n    prefix: $GAMEDIR\n    value: va\n- task:\n    description: The installating folder MUST BE 'C:\\GOG Games\\Ghost of a Tale'. At\n      the end don't launch the game, but click on 'Quit'.\n    executable: installer\n    name: wineexec\n    prefix: $GAMEDIR\nwine:\n  version: tkg-3.21-x86_64\n"
}