{
  "id": 13518,
  "game_id": 26313,
  "game_slug": "the-sims-medieval",
  "name": "The Sims Medieval",
  "year": 2011,
  "user": "redandvidya",
  "runner": "wine",
  "slug": "the-sims-medieval-dvd",
  "version": "DVD",
  "description": null,
  "notes": "",
  "created_at": "2019-05-14T10:33:49.124000Z",
  "updated_at": "2019-10-28T20:14:57.517824Z",
  "draft": false,
  "published": true,
  "published_by": 51687,
  "rating": "",
  "steamid": null,
  "gogid": null,
  "gogslug": "",
  "humblestoreid": "",
  "script": {
    "game": {
      "exe": "drive_c/Program Files/Electronic Arts/The Sims Medieval/Game/Bin/TSM.exe",
      "arch": "win32",
      "prefix": "$GAMEDIR"
    },
    "system": {
      "restore_gamma": true
    },
    "wine": {
      "UseXVidMode": true
    },
    "installer": [
      {
        "task": {
          "arch": "win32",
          "prefix": "$GAMEDIR",
          "name": "create_prefix"
        }
      },
      {
        "task": {
          "app": "dotnet20 mfc42",
          "arch": "win32",
          "description": "Installing dependencies",
          "prefix": "$GAMEDIR",
          "name": "winetricks",
          "silent": true
        }
      },
      {
        "task": {
          "arch": "win32",
          "description": "Setting version to xp for SimsMedievalLauncher...",
          "prefix": "$GAMEDIR",
          "name": "set_regedit",
          "path": "HKEY_CURRENT_USER\\Software\\Wine\\AppDefaults\\SimsMedievalLauncher.exe",
          "value": "winxp",
          "key": "Version"
        }
      },
      {
        "task": {
          "arch": "win32",
          "description": "Setting version to 7 for default...",
          "prefix": "$GAMEDIR",
          "name": "set_regedit",
          "path": "HKEY_CURRENT_USER\\Software\\Wine",
          "value": "win7",
          "key": "Version"
        }
      },
      {
        "task": {
          "executable": "file1",
          "prefix": "$GAMEDIR",
          "name": "wineexec"
        }
      },
      {
        "task": {
          "prefix": "$GAMEDIR",
          "name": "winekill"
        }
      }
    ],
    "files": [
      {
        "file1": "N/A:Please select the Sims Medieval setup file"
      }
    ]
  },
  "content": "files:\n- file1: N/A:Please select the Sims Medieval setup file\ngame:\n  arch: win32\n  exe: drive_c/Program Files/Electronic Arts/The Sims Medieval/Game/Bin/TSM.exe\n  prefix: $GAMEDIR\ninstaller:\n- task:\n    arch: win32\n    name: create_prefix\n    prefix: $GAMEDIR\n- task:\n    app: dotnet20 mfc42\n    arch: win32\n    description: Installing dependencies\n    name: winetricks\n    prefix: $GAMEDIR\n    silent: true\n- task:\n    arch: win32\n    description: Setting version to xp for SimsMedievalLauncher...\n    key: Version\n    name: set_regedit\n    path: HKEY_CURRENT_USER\\Software\\Wine\\AppDefaults\\SimsMedievalLauncher.exe\n    prefix: $GAMEDIR\n    value: winxp\n- task:\n    arch: win32\n    description: Setting version to 7 for default...\n    key: Version\n    name: set_regedit\n    path: HKEY_CURRENT_USER\\Software\\Wine\n    prefix: $GAMEDIR\n    value: win7\n- task:\n    executable: file1\n    name: wineexec\n    prefix: $GAMEDIR\n- task:\n    name: winekill\n    prefix: $GAMEDIR\nsystem:\n  restore_gamma: true\nwine:\n  UseXVidMode: true\n"
}