{
  "id": 2825,
  "game_id": 7724,
  "game_slug": "paladins",
  "name": "Paladins: Champions of the Realm",
  "year": 2016,
  "user": "strider",
  "runner": "winesteam",
  "slug": "paladins-champions-of-the-rea-steam",
  "version": "Steam",
  "description": null,
  "notes": "Easy Anti Cheat system prevents the game from running.",
  "created_at": "2016-10-01T21:05:07.691000Z",
  "updated_at": "2018-11-24T21:02:07.831417Z",
  "draft": false,
  "published": true,
  "published_by": 1,
  "rating": "1",
  "steamid": 444090,
  "gogid": null,
  "gogslug": "",
  "humblestoreid": "",
  "script": {
    "game": {
      "prefix": "$GAMEDIR/prefix",
      "appid": 444090,
      "arch": "win32"
    },
    "winesteam": {
      "version": "tkg-3.21-x86_64"
    },
    "installer": [
      {
        "task": {
          "description": "Installing .NET 3.5",
          "arch": "win32",
          "prefix": "$GAMEDIR/prefix",
          "name": "winetricks",
          "app": "dotnet35"
        }
      },
      {
        "task": {
          "description": "Installing Visual C++ Runtime 2010",
          "arch": "win32",
          "prefix": "$GAMEDIR/prefix",
          "name": "winetricks",
          "app": "vcrun2010"
        }
      },
      {
        "task": {
          "description": "Installing DirectX9 D3D v43",
          "arch": "win32",
          "prefix": "$GAMEDIR/prefix",
          "name": "winetricks",
          "app": "d3dx9_43"
        }
      },
      {
        "task": {
          "description": "Installing DirectX11 D3D v43",
          "arch": "win32",
          "prefix": "$GAMEDIR/prefix",
          "name": "winetricks",
          "app": "d3dx11_43"
        }
      },
      {
        "task": {
          "description": "Installing DirectX11 D3D compiler v43",
          "arch": "win32",
          "prefix": "$GAMEDIR/prefix",
          "name": "winetricks",
          "app": "d3dcompiler_43"
        }
      },
      {
        "task": {
          "description": "Installing .NET 4.0",
          "arch": "win32",
          "prefix": "$GAMEDIR/prefix",
          "name": "winetricks",
          "app": "dotnet40"
        }
      }
    ]
  },
  "content": "game:\n  appid: 444090\n  arch: win32\n  prefix: $GAMEDIR/prefix\ninstaller:\n- task:\n    app: dotnet35\n    arch: win32\n    description: Installing .NET 3.5\n    name: winetricks\n    prefix: $GAMEDIR/prefix\n- task:\n    app: vcrun2010\n    arch: win32\n    description: Installing Visual C++ Runtime 2010\n    name: winetricks\n    prefix: $GAMEDIR/prefix\n- task:\n    app: d3dx9_43\n    arch: win32\n    description: Installing DirectX9 D3D v43\n    name: winetricks\n    prefix: $GAMEDIR/prefix\n- task:\n    app: d3dx11_43\n    arch: win32\n    description: Installing DirectX11 D3D v43\n    name: winetricks\n    prefix: $GAMEDIR/prefix\n- task:\n    app: d3dcompiler_43\n    arch: win32\n    description: Installing DirectX11 D3D compiler v43\n    name: winetricks\n    prefix: $GAMEDIR/prefix\n- task:\n    app: dotnet40\n    arch: win32\n    description: Installing .NET 4.0\n    name: winetricks\n    prefix: $GAMEDIR/prefix\nwinesteam:\n  version: tkg-3.21-x86_64\n"
}