{
  "id": 19006,
  "game_id": 32034,
  "game_slug": "steam-vulkan",
  "name": "steam-vulkan",
  "year": null,
  "user": "vanstaveren",
  "runner": "wine",
  "slug": "steam-vulkan-2020",
  "version": "2020",
  "description": "xbox-drv package needs to be installed\r\n* this plays more games than a normal install ...",
  "notes": "",
  "created_at": "2020-03-20T20:12:14.201320Z",
  "updated_at": "2020-03-20T20:12:14.201345Z",
  "draft": true,
  "published": false,
  "published_by": null,
  "rating": "",
  "steamid": null,
  "gogid": null,
  "gogslug": "",
  "humblestoreid": "",
  "script": {
    "files": [
      {
        "SteamSetup.exe": "https://steamcdn-a.akamaihd.net/client/installer/SteamSetup.exe"
      }
    ],
    "installer": [
      {
        "task": {
          "arch": "win64",
          "description": "Creating 64-bit prefix ...",
          "prefix": "$GAMEDIR/prefix",
          "name": "create_prefix"
        }
      },
      {
        "move": {
          "src": "SteamSetup.exe",
          "dst": "$GAMEDIR/prefix/drive_c/"
        }
      },
      {
        "chmodx": "$GAMEDIR/prefix/drive_c/SteamSetup.exe"
      },
      {
        "task": {
          "arch": "win64",
          "description": "DirectX ...",
          "app": "d3drm",
          "prefix": "$GAMEDIR/prefix",
          "name": "winetricks"
        }
      },
      {
        "task": {
          "arch": "win64",
          "description": "DirectX 11 ...",
          "app": "d3dcompiler_43",
          "prefix": "$GAMEDIR/prefix",
          "name": "winetricks"
        }
      },
      {
        "task": {
          "arch": "win64",
          "description": "DirectX 11 ...",
          "app": "d3dx11_43",
          "prefix": "$GAMEDIR/prefix",
          "name": "winetricks"
        }
      },
      {
        "task": {
          "arch": "win64",
          "description": "DirectX compiler ...",
          "app": "d3dcompiler_47",
          "prefix": "$GAMEDIR/prefix",
          "name": "winetricks"
        }
      },
      {
        "task": {
          "arch": "win64",
          "description": "Vulkan ...",
          "app": "dxvk",
          "prefix": "$GAMEDIR/prefix",
          "name": "winetricks"
        }
      },
      {
        "task": {
          "arch": "win64",
          "description": "Vulkan ...",
          "app": "d9vk",
          "prefix": "$GAMEDIR/prefix",
          "name": "winetricks"
        }
      },
      {
        "task": {
          "args": "/S",
          "executable": "$GAMEDIR/prefix/drive_c/SteamSetup.exe",
          "description": "Steam ...",
          "prefix": "$GAMEDIR/prefix",
          "name": "wineexec"
        }
      },
      {
        "task": {
          "arch": "win64",
          "description": "Windows version 8 ...",
          "app": "win8",
          "prefix": "$GAMEDIR/prefix",
          "name": "winetricks"
        }
      }
    ],
    "system": {
      "xboxdrv": "xboxdrv",
      "pulse_latency": true,
      "disable_compositor": true
    },
    "wine": {
      "Audio": "pulse",
      "overrides": {
        "winedbg.exe": "d"
      },
      "dxvk": true,
      "version": "ge-protonified-nofshack-4.9-x86_64",
      "esync": true
    },
    "game": {
      "prefix": "$GAMEDIR/prefix",
      "custom-name": "wine steam x64 vulkan",
      "arch": "win64",
      "args": "-nojoy",
      "appid": "client",
      "exe": "$GAMEDIR/prefix/drive_c/Program Files (x86)/Steam/Steam.exe"
    }
  },
  "content": "files:\n- SteamSetup.exe: https://steamcdn-a.akamaihd.net/client/installer/SteamSetup.exe\ngame:\n  appid: client\n  arch: win64\n  args: -nojoy\n  custom-name: wine steam x64 vulkan\n  exe: $GAMEDIR/prefix/drive_c/Program Files (x86)/Steam/Steam.exe\n  prefix: $GAMEDIR/prefix\ninstaller:\n- task:\n    arch: win64\n    description: Creating 64-bit prefix ...\n    name: create_prefix\n    prefix: $GAMEDIR/prefix\n- move:\n    dst: $GAMEDIR/prefix/drive_c/\n    src: SteamSetup.exe\n- chmodx: $GAMEDIR/prefix/drive_c/SteamSetup.exe\n- task:\n    app: d3drm\n    arch: win64\n    description: DirectX ...\n    name: winetricks\n    prefix: $GAMEDIR/prefix\n- task:\n    app: d3dcompiler_43\n    arch: win64\n    description: DirectX 11 ...\n    name: winetricks\n    prefix: $GAMEDIR/prefix\n- task:\n    app: d3dx11_43\n    arch: win64\n    description: DirectX 11 ...\n    name: winetricks\n    prefix: $GAMEDIR/prefix\n- task:\n    app: d3dcompiler_47\n    arch: win64\n    description: DirectX compiler ...\n    name: winetricks\n    prefix: $GAMEDIR/prefix\n- task:\n    app: dxvk\n    arch: win64\n    description: Vulkan ...\n    name: winetricks\n    prefix: $GAMEDIR/prefix\n- task:\n    app: d9vk\n    arch: win64\n    description: Vulkan ...\n    name: winetricks\n    prefix: $GAMEDIR/prefix\n- task:\n    args: /S\n    description: Steam ...\n    executable: $GAMEDIR/prefix/drive_c/SteamSetup.exe\n    name: wineexec\n    prefix: $GAMEDIR/prefix\n- task:\n    app: win8\n    arch: win64\n    description: Windows version 8 ...\n    name: winetricks\n    prefix: $GAMEDIR/prefix\nsystem:\n  disable_compositor: true\n  pulse_latency: true\n  xboxdrv: xboxdrv\nwine:\n  Audio: pulse\n  dxvk: true\n  esync: true\n  overrides:\n    winedbg.exe: d\n  version: ge-protonified-nofshack-4.9-x86_64\n"
}