{
  "id": 16763,
  "game_id": 2989,
  "game_slug": "metro-2033-redux",
  "name": "Metro 2033 Redux",
  "year": 2014,
  "user": "751203f8735e628528b32f1f3c8e3da1",
  "runner": "wine",
  "slug": "metro-2033-redux-epic-store",
  "version": "Epic Store",
  "description": "This installer only install the Epic Store, you must install the game manually.",
  "notes": "If the EPIC's client show you a error message (DXSETUP), you click \"NO\" or \"Accept\"",
  "created_at": "2019-11-11T12:28:41.191000Z",
  "updated_at": "2020-01-23T02:57:03.603182Z",
  "draft": false,
  "published": true,
  "published_by": 19464,
  "rating": "",
  "steamid": 286690,
  "gogid": 1436434037,
  "gogslug": "metro_2033_redux",
  "humblestoreid": "",
  "script": {
    "game": {
      "exe": "drive_c/Program Files (x86)/Epic Games/Launcher/Portal/Binaries/Win32/EpicGamesLauncher.exe",
      "arch": "win64",
      "args": "-opengl",
      "prefix": "$GAMEDIR"
    },
    "system": {
      "disable_compositor": true,
      "env": {
        "__GL_SHADER_DISK_CACHE_PATH": "$GAMEDIR/GLcacheShaders/",
        "__GL_SHADER_DISK_CACHE": 1,
        "DXVK_HUD": 0,
        "__GL_THREADED_OPTIMIZATIONS": 1,
        "DXVK_STATE_CACHE": 1,
        "mesa_glthread": "true",
        "DXVK_STATE_CACHE_PATH": "$GAMEDIR/StateCache/"
      }
    },
    "wine": {
      "esync": true,
      "dxvk": true
    },
    "installer": [
      {
        "extract": {
          "file": "dx10",
          "dst": "$CACHE/directx-2010"
        }
      },
      {
        "task": {
          "arch": "win64",
          "description": "Creating the Wine prefix (64bits)",
          "prefix": "$GAMEDIR",
          "name": "create_prefix"
        }
      },
      {
        "task": {
          "app": "arial",
          "arch": "win64",
          "description": "Adding text font",
          "prefix": "$GAMEDIR",
          "name": "winetricks"
        }
      },
      {
        "task": {
          "app": "vcrun2008",
          "arch": "win64",
          "description": "Installing libraries.",
          "prefix": "$GAMEDIR",
          "name": "winetricks"
        }
      },
      {
        "task": {
          "app": "dotnet48",
          "arch": "win64",
          "description": "Installing .NET Framework 4.8",
          "prefix": "$GAMEDIR",
          "name": "winetricks"
        }
      },
      {
        "task": {
          "app": "win7",
          "arch": "win64",
          "description": "Changing Windows version to (Win7)",
          "prefix": "$GAMEDIR",
          "name": "winetricks"
        }
      },
      {
        "task": {
          "arch": "win64",
          "prefix": "$GAMEDIR",
          "name": "winekill"
        }
      },
      {
        "task": {
          "executable": "$CACHE/directx-2010/DXSETUP.exe",
          "arch": "win64",
          "description": "(Microsoft`s software) Installing directx-2010",
          "args": "/silent",
          "name": "wineexec",
          "prefix": "$GAMEDIR"
        }
      },
      {
        "task": {
          "executable": "epicstore",
          "arch": "win64",
          "description": "Running the Epic Games`s Installer.",
          "prefix": "$GAMEDIR",
          "name": "wineexec",
          "exclude_processes": "EpicGamesLauncher.exe"
        }
      },
      {
        "task": {
          "arch": "win64",
          "prefix": "$GAMEDIR",
          "name": "winekill"
        }
      }
    ],
    "files": [
      {
        "epicstore": "https://launcher-public-service-prod06.ol.epicgames.com/launcher/api/installer/download/EpicGamesLauncherInstaller.msi"
      },
      {
        "dx10": "https://lutris.net/files/tools/directx-2010.tar.gz"
      }
    ]
  },
  "content": "files:\n- epicstore: https://launcher-public-service-prod06.ol.epicgames.com/launcher/api/installer/download/EpicGamesLauncherInstaller.msi\n- dx10: https://lutris.net/files/tools/directx-2010.tar.gz\ngame:\n  arch: win64\n  args: -opengl\n  exe: drive_c/Program Files (x86)/Epic Games/Launcher/Portal/Binaries/Win32/EpicGamesLauncher.exe\n  prefix: $GAMEDIR\ninstaller:\n- extract:\n    dst: $CACHE/directx-2010\n    file: dx10\n- task:\n    arch: win64\n    description: Creating the Wine prefix (64bits)\n    name: create_prefix\n    prefix: $GAMEDIR\n- task:\n    app: arial\n    arch: win64\n    description: Adding text font\n    name: winetricks\n    prefix: $GAMEDIR\n- task:\n    app: vcrun2008\n    arch: win64\n    description: Installing libraries.\n    name: winetricks\n    prefix: $GAMEDIR\n- task:\n    app: dotnet48\n    arch: win64\n    description: Installing .NET Framework 4.8\n    name: winetricks\n    prefix: $GAMEDIR\n- task:\n    app: win7\n    arch: win64\n    description: Changing Windows version to (Win7)\n    name: winetricks\n    prefix: $GAMEDIR\n- task:\n    arch: win64\n    name: winekill\n    prefix: $GAMEDIR\n- task:\n    arch: win64\n    args: /silent\n    description: (Microsoft`s software) Installing directx-2010\n    executable: $CACHE/directx-2010/DXSETUP.exe\n    name: wineexec\n    prefix: $GAMEDIR\n- task:\n    arch: win64\n    description: Running the Epic Games`s Installer.\n    exclude_processes: EpicGamesLauncher.exe\n    executable: epicstore\n    name: wineexec\n    prefix: $GAMEDIR\n- task:\n    arch: win64\n    name: winekill\n    prefix: $GAMEDIR\nsystem:\n  disable_compositor: true\n  env:\n    DXVK_HUD: 0\n    DXVK_STATE_CACHE: 1\n    DXVK_STATE_CACHE_PATH: $GAMEDIR/StateCache/\n    __GL_SHADER_DISK_CACHE: 1\n    __GL_SHADER_DISK_CACHE_PATH: $GAMEDIR/GLcacheShaders/\n    __GL_THREADED_OPTIMIZATIONS: 1\n    mesa_glthread: 'true'\nwine:\n  dxvk: true\n  esync: true\n"
}