{
  "id": 13664,
  "game_id": 1117,
  "game_slug": "everquest",
  "name": "EverQuest",
  "year": 2012,
  "user": "binarypie",
  "runner": "wine",
  "slug": "everquest-standalone-live",
  "version": "Standalone - Live",
  "description": "Fixes the installer so it actually installs EverQuest (Live) standalone.",
  "notes": "During Install:\r\n* Do not run the DirectX optional components.\r\n* xAfter logging in close the patcher to complete installation and re-launch game.\r\n\r\nPost Install:\r\n\r\n* Edit the eqclient.ini file\r\nCPUAffinity0=-1\r\nWindowedMode=TRUE\r\nTextureCache=FALSE\r\n\r\n\r\nKnown Issues:\r\n\r\n* Once you start the game, if you have a cursor that is off from where it clicks, just maximize the window and it will fix itself.",
  "created_at": "2019-05-21T15:30:43.028000Z",
  "updated_at": "2019-09-09T01:59:59.289573Z",
  "draft": false,
  "published": true,
  "published_by": 1,
  "rating": "",
  "steamid": 205710,
  "gogid": null,
  "gogslug": "",
  "humblestoreid": "",
  "script": {
    "system": {
      "single_cpu": true,
      "env": {
        "DXVK_HUD": 0
      }
    },
    "game": {
      "prefix": "$GAMEDIR",
      "exe": "drive_c/users/Public/Daybreak Game Company/Installed Games/EverQuest/LaunchPad.exe"
    },
    "wine": {
      "dxvk": false,
      "esync": false,
      "version": "staging-2.21-x86_64"
    },
    "files": [
      {
        "setup": {
          "url": "https://launch.daybreakgames.com/installer/EQ_setup.exe",
          "filename": "EQ_setup.exe"
        }
      }
    ],
    "installer": [
      {
        "task": {
          "arch": "win32",
          "prefix": "$GAMEDIR",
          "description": "Creating Wine prefix",
          "name": "create_prefix"
        }
      },
      {
        "task": {
          "arch": "win32",
          "prefix": "$GAMEDIR",
          "name": "winetricks",
          "app": "win7"
        }
      },
      {
        "task": {
          "prefix": "$GAMEDIR",
          "description": "Installing Corefonts",
          "app": "corefonts",
          "arch": "win32",
          "name": "winetricks",
          "silent": true
        }
      },
      {
        "task": {
          "prefix": "$GAMEDIR",
          "description": "Installing DirectX 9",
          "app": "d3dx9_43",
          "arch": "win32",
          "name": "winetricks",
          "silent": false
        }
      },
      {
        "task": {
          "prefix": "$GAMEDIR",
          "description": "Installing Windows Management Interface",
          "app": "wmi",
          "arch": "win32",
          "name": "winetricks",
          "silent": false
        }
      },
      {
        "task": {
          "prefix": "$GAMEDIR",
          "executable": "wineboot",
          "description": "Simulating Windows reboot.",
          "name": "wineexec"
        }
      },
      {
        "task": {
          "arch": "win32",
          "prefix": "$GAMEDIR",
          "name": "winetricks",
          "app": "win7"
        }
      },
      {
        "task": {
          "arch": "win32",
          "executable": "setup",
          "prefix": "$GAMEDIR",
          "description": "Installing EverQuest",
          "name": "wineexec"
        }
      }
    ]
  },
  "content": "files:\n- setup:\n    filename: EQ_setup.exe\n    url: https://launch.daybreakgames.com/installer/EQ_setup.exe\ngame:\n  exe: drive_c/users/Public/Daybreak Game Company/Installed Games/EverQuest/LaunchPad.exe\n  prefix: $GAMEDIR\ninstaller:\n- task:\n    arch: win32\n    description: Creating Wine prefix\n    name: create_prefix\n    prefix: $GAMEDIR\n- task:\n    app: win7\n    arch: win32\n    name: winetricks\n    prefix: $GAMEDIR\n- task:\n    app: corefonts\n    arch: win32\n    description: Installing Corefonts\n    name: winetricks\n    prefix: $GAMEDIR\n    silent: true\n- task:\n    app: d3dx9_43\n    arch: win32\n    description: Installing DirectX 9\n    name: winetricks\n    prefix: $GAMEDIR\n    silent: false\n- task:\n    app: wmi\n    arch: win32\n    description: Installing Windows Management Interface\n    name: winetricks\n    prefix: $GAMEDIR\n    silent: false\n- task:\n    description: Simulating Windows reboot.\n    executable: wineboot\n    name: wineexec\n    prefix: $GAMEDIR\n- task:\n    app: win7\n    arch: win32\n    name: winetricks\n    prefix: $GAMEDIR\n- task:\n    arch: win32\n    description: Installing EverQuest\n    executable: setup\n    name: wineexec\n    prefix: $GAMEDIR\nsystem:\n  env:\n    DXVK_HUD: 0\n  single_cpu: true\nwine:\n  dxvk: false\n  esync: false\n  version: staging-2.21-x86_64\n"
}