{
  "id": 20840,
  "game_id": 1117,
  "game_slug": "everquest",
  "name": "EverQuest",
  "year": 2012,
  "user": "bigbruno",
  "runner": "wine",
  "slug": "everquest-change-me",
  "version": "Change Me",
  "description": null,
  "notes": "During the installation of Everquest itself, it will need to install DirectX updates.  In this phase, take note that there is a Bing toolbar it wants to install.  This is most certainly NOT needed, and you may uncheck this box to not install it.\r\n\r\nOnce you start the game, if you have a cursor that is off from where it clicks, just maximize the window and it will fix itself.",
  "created_at": "2020-05-28T02:48:54.521572Z",
  "updated_at": "2020-05-28T02:48:54.521604Z",
  "draft": false,
  "published": false,
  "published_by": 19464,
  "rating": "",
  "steamid": 205710,
  "gogid": null,
  "gogslug": "",
  "humbleid": "",
  "humblestoreid": "",
  "humblestoreid_real": "",
  "script": {
    "files": [
      {
        "setup": "https://launch.daybreakgames.com/installer/EQ_setup.exe"
      }
    ],
    "game": {
      "exe": "drive_c/users/Public/Daybreak Game Company/Installed Games/EverQuest/LaunchPad.exe",
      "prefix": "$GAMEDIR"
    },
    "installer": [
      {
        "task": {
          "arch": "win32",
          "description": "Creating Wine prefix",
          "name": "create_prefix",
          "prefix": "$GAMEDIR"
        }
      },
      {
        "task": {
          "app": "win7",
          "arch": "win32",
          "name": "winetricks",
          "prefix": "$GAMEDIR"
        }
      },
      {
        "task": {
          "app": "corefonts",
          "description": "Installing Corefonts",
          "name": "winetricks",
          "prefix": "$GAMEDIR",
          "silent": true
        }
      },
      {
        "task": {
          "app": "wmi",
          "description": "Installing Windows Management Interface",
          "name": "winetricks",
          "prefix": "$GAMEDIR",
          "silent": false
        }
      },
      {
        "task": {
          "description": "Simulating Windows reboot.",
          "executable": "wineboot",
          "name": "wineexec",
          "prefix": "$GAMEDIR"
        }
      },
      {
        "task": {
          "description": "Installing EverQuest",
          "executable": "setup",
          "name": "wineexec",
          "prefix": "$GAMEDIR"
        }
      }
    ]
  },
  "content": "files:\n- setup: https://launch.daybreakgames.com/installer/EQ_setup.exe\ngame:\n  exe: drive_c/users/Public/Daybreak Game Company/Installed Games/EverQuest/LaunchPad.exe\n  prefix: $GAMEDIR\ninstaller:\n- task:\n    arch: win32\n    description: Creating Wine prefix\n    name: create_prefix\n    prefix: $GAMEDIR\n- task:\n    app: win7\n    arch: win32\n    name: winetricks\n    prefix: $GAMEDIR\n- task:\n    app: corefonts\n    description: Installing Corefonts\n    name: winetricks\n    prefix: $GAMEDIR\n    silent: true\n- task:\n    app: wmi\n    description: Installing Windows Management Interface\n    name: winetricks\n    prefix: $GAMEDIR\n    silent: false\n- task:\n    description: Simulating Windows reboot.\n    executable: wineboot\n    name: wineexec\n    prefix: $GAMEDIR\n- task:\n    description: Installing EverQuest\n    executable: setup\n    name: wineexec\n    prefix: $GAMEDIR\n"
}