{
  "id": 5293,
  "game_id": 1117,
  "game_slug": "everquest",
  "name": "EverQuest",
  "year": 2012,
  "user": "schotty",
  "runner": "wine",
  "slug": "everquest-standalone",
  "version": "Standalone",
  "description": null,
  "notes": "During the installation of Everquest itself, it will need to install DirectX updates.  In this phase, take note that there is a Bing toolbar it wants to install.  This is most certainly NOT needed, and you may uncheck this box to not install it.\r\n\r\nOnce you start the game, if you have a cursor that is off from where it clicks, just maximize the window and it will fix itself.",
  "created_at": "2017-08-07T01:16:16.241000Z",
  "updated_at": "2020-01-23T02:57:19.880978Z",
  "draft": false,
  "published": true,
  "published_by": 19464,
  "rating": "",
  "steamid": 205710,
  "gogid": null,
  "gogslug": "",
  "humblestoreid": "",
  "script": {
    "game": {
      "exe": "drive_c/users/Public/Daybreak Game Company/Installed Games/EverQuest/LaunchPad.exe",
      "prefix": "$GAMEDIR"
    },
    "installer": [
      {
        "task": {
          "arch": "win32",
          "description": "Creating Wine prefix",
          "prefix": "$GAMEDIR",
          "name": "create_prefix"
        }
      },
      {
        "task": {
          "app": "win7",
          "arch": "win32",
          "prefix": "$GAMEDIR",
          "name": "winetricks"
        }
      },
      {
        "task": {
          "app": "corefonts",
          "silent": true,
          "description": "Installing Corefonts",
          "prefix": "$GAMEDIR",
          "name": "winetricks"
        }
      },
      {
        "task": {
          "app": "wmi",
          "silent": false,
          "description": "Installing Windows Management Interface",
          "prefix": "$GAMEDIR",
          "name": "winetricks"
        }
      },
      {
        "task": {
          "executable": "wineboot",
          "description": "Simulating Windows reboot.",
          "prefix": "$GAMEDIR",
          "name": "wineexec"
        }
      },
      {
        "task": {
          "executable": "setup",
          "description": "Installing EverQuest",
          "prefix": "$GAMEDIR",
          "name": "wineexec"
        }
      }
    ],
    "files": [
      {
        "setup": "https://launch.daybreakgames.com/installer/EQ_setup.exe"
      }
    ]
  },
  "content": "files:\n- setup: https://launch.daybreakgames.com/installer/EQ_setup.exe\ngame:\n  exe: drive_c/users/Public/Daybreak Game Company/Installed Games/EverQuest/LaunchPad.exe\n  prefix: $GAMEDIR\ninstaller:\n- task:\n    arch: win32\n    description: Creating Wine prefix\n    name: create_prefix\n    prefix: $GAMEDIR\n- task:\n    app: win7\n    arch: win32\n    name: winetricks\n    prefix: $GAMEDIR\n- task:\n    app: corefonts\n    description: Installing Corefonts\n    name: winetricks\n    prefix: $GAMEDIR\n    silent: true\n- task:\n    app: wmi\n    description: Installing Windows Management Interface\n    name: winetricks\n    prefix: $GAMEDIR\n    silent: false\n- task:\n    description: Simulating Windows reboot.\n    executable: wineboot\n    name: wineexec\n    prefix: $GAMEDIR\n- task:\n    description: Installing EverQuest\n    executable: setup\n    name: wineexec\n    prefix: $GAMEDIR\n"
}