{
  "id": 20668,
  "game_id": 1820,
  "game_slug": "halo-combat-evolved",
  "name": "Halo: Combat Evolved",
  "year": 2001,
  "user": "lucid",
  "runner": "wine",
  "slug": "halo-combat-evolved-10",
  "version": "1.0",
  "description": "Halo Custom Edition + Chimera + Refined Maps",
  "notes": "If you didn't feel like packaging your Halo install into an installer, alternatively you can copy your entire Halo Custom Edition folder from windows to the drive_c in your wine prefix, doesn't really matter where, just make sure you set Lutris to launch haloce.exe. Other than that, everything should automatically install for you.",
  "created_at": "2020-05-21T22:10:34.331444Z",
  "updated_at": "2020-05-21T22:10:34.331470Z",
  "draft": true,
  "published": false,
  "published_by": null,
  "rating": "",
  "steamid": null,
  "gogid": null,
  "gogslug": "",
  "humblestoreid": "",
  "script": {
    "files": [
      {
        "file1": "N/A:Please locate haloce_refined_1.0.exe for installtion"
      }
    ],
    "game": {
      "arch": "win32",
      "exe": "~/games/HaloCE/haloce.exe",
      "prefix": "~/.wineGames/HaloCE",
      "working_dir": ""
    },
    "installer": [
      {
        "task": {
          "arch": "win32",
          "name": "create_prefix",
          "prefix": "$GAMEDIR"
        }
      },
      {
        "task": {
          "app": "d3dx9",
          "description": "Installing d3dx9",
          "name": "winetricks",
          "prefix": "$GAMEDIR"
        }
      },
      {
        "task": {
          "app": "d3dx9_24",
          "description": "Installing d3dx9_24",
          "name": "winetricks",
          "prefix": "$GAMEDIR"
        }
      },
      {
        "task": {
          "app": "d3dx9_24",
          "description": "Installing d3dx9_24",
          "name": "winetricks",
          "prefix": "$GAMEDIR"
        }
      },
      {
        "task": {
          "app": "d3dx9_25",
          "description": "Installing d3dx9_25",
          "name": "winetricks",
          "prefix": "$GAMEDIR"
        }
      },
      {
        "task": {
          "app": "d3dx9_26",
          "description": "Installing d3dx9_26",
          "name": "winetricks",
          "prefix": "$GAMEDIR"
        }
      },
      {
        "task": {
          "app": "d3dx9_27",
          "description": "Installing d3dx9_27",
          "name": "winetricks",
          "prefix": "$GAMEDIR"
        }
      },
      {
        "task": {
          "app": "d3dx9_28",
          "description": "Installing d3dx9_28",
          "name": "winetricks",
          "prefix": "$GAMEDIR"
        }
      },
      {
        "task": {
          "app": "d3dx9_29",
          "description": "Installing d3dx9_29",
          "name": "winetricks",
          "prefix": "$GAMEDIR"
        }
      },
      {
        "task": {
          "app": "d3dx9_30",
          "description": "Installing d3dx9_30",
          "name": "winetricks",
          "prefix": "$GAMEDIR"
        }
      },
      {
        "task": {
          "app": "d3dx9_31",
          "description": "Installing d3dx9_31",
          "name": "winetricks",
          "prefix": "$GAMEDIR"
        }
      },
      {
        "task": {
          "app": "d3dx9_31",
          "description": "Installing d3dx9_31",
          "name": "winetricks",
          "prefix": "$GAMEDIR"
        }
      },
      {
        "task": {
          "app": "d3dx9_32",
          "description": "Installing d3dx9_32",
          "name": "winetricks",
          "prefix": "$GAMEDIR"
        }
      },
      {
        "task": {
          "app": "d3dx9_33",
          "description": "Installing d3dx9_33",
          "name": "winetricks",
          "prefix": "$GAMEDIR"
        }
      },
      {
        "task": {
          "app": "d3dx9_34",
          "description": "Installing d3dx9_34",
          "name": "winetricks",
          "prefix": "$GAMEDIR"
        }
      },
      {
        "task": {
          "app": "d3dx9_35",
          "description": "Installing d3dx9_35",
          "name": "winetricks",
          "prefix": "$GAMEDIR"
        }
      },
      {
        "task": {
          "app": "d3dx9_36",
          "description": "Installing d3dx9_36",
          "name": "winetricks",
          "prefix": "$GAMEDIR"
        }
      },
      {
        "task": {
          "app": "d3dx9_37",
          "description": "Installing d3dx9_37",
          "name": "winetricks",
          "prefix": "$GAMEDIR"
        }
      },
      {
        "task": {
          "app": "d3dx9_38",
          "description": "Installing d3dx9_38",
          "name": "winetricks",
          "prefix": "$GAMEDIR"
        }
      },
      {
        "task": {
          "app": "d3dx9_39",
          "description": "Installing d3dx9_39",
          "name": "winetricks",
          "prefix": "$GAMEDIR"
        }
      },
      {
        "task": {
          "app": "d3dx9_40",
          "description": "Installing d3dx9_40",
          "name": "winetricks",
          "prefix": "$GAMEDIR"
        }
      },
      {
        "task": {
          "app": "d3dx9_41",
          "description": "Installing d3dx9_41",
          "name": "winetricks",
          "prefix": "$GAMEDIR"
        }
      },
      {
        "task": {
          "app": "d3dx9_42",
          "description": "Installing d3dx9_42",
          "name": "winetricks",
          "prefix": "$GAMEDIR"
        }
      },
      {
        "task": {
          "app": "d3dx9_43",
          "description": "Installing d3dx9_43",
          "name": "winetricks",
          "prefix": "$GAMEDIR"
        }
      },
      {
        "task": {
          "app": "msxml4",
          "description": "Installing msxml4",
          "name": "winetricks",
          "prefix": "$GAMEDIR"
        }
      },
      {
        "task": {
          "app": "mfc42",
          "description": "Installing mfc42",
          "name": "winetricks",
          "prefix": "$GAMEDIR"
        }
      },
      {
        "task": {
          "description": "Running setup for Halo CE. Leave paths default and uncheck installing Gamespy Arcade.",
          "executable": "installer",
          "name": "wineexec",
          "prefix": "$GAMEDIR"
        }
      },
      {
        "task": {
          "description": "Installing Halo Custom Edition",
          "executable": "setup",
          "name": "wineexec",
          "prefix": "$GAMEDIR"
        }
      }
    ],
    "wine": {
      "UseXVidMode": true,
      "version": "system"
    }
  },
  "content": "files:\n- file1: N/A:Please locate haloce_refined_1.0.exe for installtion\ngame:\n  arch: win32\n  exe: ~/games/HaloCE/haloce.exe\n  prefix: ~/.wineGames/HaloCE\n  working_dir: ''\ninstaller:\n- task:\n    arch: win32\n    name: create_prefix\n    prefix: $GAMEDIR\n- task:\n    app: d3dx9\n    description: Installing d3dx9\n    name: winetricks\n    prefix: $GAMEDIR\n- task:\n    app: d3dx9_24\n    description: Installing d3dx9_24\n    name: winetricks\n    prefix: $GAMEDIR\n- task:\n    app: d3dx9_24\n    description: Installing d3dx9_24\n    name: winetricks\n    prefix: $GAMEDIR\n- task:\n    app: d3dx9_25\n    description: Installing d3dx9_25\n    name: winetricks\n    prefix: $GAMEDIR\n- task:\n    app: d3dx9_26\n    description: Installing d3dx9_26\n    name: winetricks\n    prefix: $GAMEDIR\n- task:\n    app: d3dx9_27\n    description: Installing d3dx9_27\n    name: winetricks\n    prefix: $GAMEDIR\n- task:\n    app: d3dx9_28\n    description: Installing d3dx9_28\n    name: winetricks\n    prefix: $GAMEDIR\n- task:\n    app: d3dx9_29\n    description: Installing d3dx9_29\n    name: winetricks\n    prefix: $GAMEDIR\n- task:\n    app: d3dx9_30\n    description: Installing d3dx9_30\n    name: winetricks\n    prefix: $GAMEDIR\n- task:\n    app: d3dx9_31\n    description: Installing d3dx9_31\n    name: winetricks\n    prefix: $GAMEDIR\n- task:\n    app: d3dx9_31\n    description: Installing d3dx9_31\n    name: winetricks\n    prefix: $GAMEDIR\n- task:\n    app: d3dx9_32\n    description: Installing d3dx9_32\n    name: winetricks\n    prefix: $GAMEDIR\n- task:\n    app: d3dx9_33\n    description: Installing d3dx9_33\n    name: winetricks\n    prefix: $GAMEDIR\n- task:\n    app: d3dx9_34\n    description: Installing d3dx9_34\n    name: winetricks\n    prefix: $GAMEDIR\n- task:\n    app: d3dx9_35\n    description: Installing d3dx9_35\n    name: winetricks\n    prefix: $GAMEDIR\n- task:\n    app: d3dx9_36\n    description: Installing d3dx9_36\n    name: winetricks\n    prefix: $GAMEDIR\n- task:\n    app: d3dx9_37\n    description: Installing d3dx9_37\n    name: winetricks\n    prefix: $GAMEDIR\n- task:\n    app: d3dx9_38\n    description: Installing d3dx9_38\n    name: winetricks\n    prefix: $GAMEDIR\n- task:\n    app: d3dx9_39\n    description: Installing d3dx9_39\n    name: winetricks\n    prefix: $GAMEDIR\n- task:\n    app: d3dx9_40\n    description: Installing d3dx9_40\n    name: winetricks\n    prefix: $GAMEDIR\n- task:\n    app: d3dx9_41\n    description: Installing d3dx9_41\n    name: winetricks\n    prefix: $GAMEDIR\n- task:\n    app: d3dx9_42\n    description: Installing d3dx9_42\n    name: winetricks\n    prefix: $GAMEDIR\n- task:\n    app: d3dx9_43\n    description: Installing d3dx9_43\n    name: winetricks\n    prefix: $GAMEDIR\n- task:\n    app: msxml4\n    description: Installing msxml4\n    name: winetricks\n    prefix: $GAMEDIR\n- task:\n    app: mfc42\n    description: Installing mfc42\n    name: winetricks\n    prefix: $GAMEDIR\n- task:\n    description: Running setup for Halo CE. Leave paths default and uncheck installing\n      Gamespy Arcade.\n    executable: installer\n    name: wineexec\n    prefix: $GAMEDIR\n- task:\n    description: Installing Halo Custom Edition\n    executable: setup\n    name: wineexec\n    prefix: $GAMEDIR\nwine:\n  UseXVidMode: true\n  version: system\n"
}