{
  "id": 18968,
  "game_id": 1820,
  "game_slug": "halo-combat-evolved",
  "name": "Halo: Combat Evolved",
  "year": 2001,
  "user": "isra17",
  "runner": "wine",
  "slug": "halo-combat-evolved-demo",
  "version": "Demo",
  "description": "Use the demo installer from archive.org",
  "notes": "",
  "created_at": "2020-03-19T13:55:22.530000Z",
  "updated_at": "2020-03-20T10:43:29.362096Z",
  "draft": false,
  "published": true,
  "published_by": 20548,
  "rating": "",
  "steamid": null,
  "gogid": null,
  "gogslug": "",
  "humblestoreid": "",
  "script": {
    "files": [
      {
        "setup": "https://archive.org/download/HaloCombatEvolvedDemo/lotrialsetup1.exe"
      }
    ],
    "game": {
      "prefix": "$GAMEDIR",
      "exe": "drive_c/Program Files/Microsoft Games/Halo Trial/halo.exe",
      "arch": "win32"
    },
    "installer": [
      {
        "task": {
          "prefix": "$GAMEDIR",
          "arch": "win32",
          "name": "create_prefix"
        }
      },
      {
        "task": {
          "prefix": "$GAMEDIR",
          "app": "msxml3",
          "description": "Installing msxml3",
          "name": "winetricks"
        }
      },
      {
        "task": {
          "prefix": "$GAMEDIR",
          "app": "dotnet35sp1",
          "description": "Installing dotnet35sp1",
          "name": "winetricks"
        }
      },
      {
        "task": {
          "prefix": "$GAMEDIR",
          "app": "dotnet40",
          "description": "Installing dotnet40",
          "name": "winetricks"
        }
      },
      {
        "task": {
          "prefix": "$GAMEDIR",
          "app": "win7",
          "description": "Installing dotnet4.5.0",
          "name": "winetricks"
        }
      },
      {
        "task": {
          "prefix": "$GAMEDIR",
          "app": "vb6run",
          "description": "Installing vb6run",
          "name": "winetricks"
        }
      },
      {
        "task": {
          "prefix": "$GAMEDIR",
          "app": "mfc42",
          "description": "Installing mfc42",
          "name": "winetricks"
        }
      },
      {
        "task": {
          "prefix": "$GAMEDIR",
          "app": "d3dx9_43",
          "description": "Installing d3dx9",
          "name": "winetricks"
        }
      },
      {
        "task": {
          "prefix": "$GAMEDIR",
          "app": "win7",
          "description": "Windows7 check",
          "name": "winetricks"
        }
      },
      {
        "task": {
          "prefix": "$GAMEDIR",
          "executable": "setup",
          "name": "wineexec",
          "description": "Running setup. Use Express install, and close when it asks if you want to launch."
        }
      }
    ]
  },
  "content": "files:\n- setup: https://archive.org/download/HaloCombatEvolvedDemo/lotrialsetup1.exe\ngame:\n  arch: win32\n  exe: drive_c/Program Files/Microsoft Games/Halo Trial/halo.exe\n  prefix: $GAMEDIR\ninstaller:\n- task:\n    arch: win32\n    name: create_prefix\n    prefix: $GAMEDIR\n- task:\n    app: msxml3\n    description: Installing msxml3\n    name: winetricks\n    prefix: $GAMEDIR\n- task:\n    app: dotnet35sp1\n    description: Installing dotnet35sp1\n    name: winetricks\n    prefix: $GAMEDIR\n- task:\n    app: dotnet40\n    description: Installing dotnet40\n    name: winetricks\n    prefix: $GAMEDIR\n- task:\n    app: win7\n    description: Installing dotnet4.5.0\n    name: winetricks\n    prefix: $GAMEDIR\n- task:\n    app: vb6run\n    description: Installing vb6run\n    name: winetricks\n    prefix: $GAMEDIR\n- task:\n    app: mfc42\n    description: Installing mfc42\n    name: winetricks\n    prefix: $GAMEDIR\n- task:\n    app: d3dx9_43\n    description: Installing d3dx9\n    name: winetricks\n    prefix: $GAMEDIR\n- task:\n    app: win7\n    description: Windows7 check\n    name: winetricks\n    prefix: $GAMEDIR\n- task:\n    description: Running setup. Use Express install, and close when it asks if you\n      want to launch.\n    executable: setup\n    name: wineexec\n    prefix: $GAMEDIR\n"
}