{
  "id": 5435,
  "game_id": 1820,
  "game_slug": "halo-combat-evolved",
  "name": "Halo: Combat Evolved",
  "year": 2001,
  "user": "bacera",
  "runner": "wine",
  "slug": "halo-combat-evolved-cd",
  "version": "CD",
  "description": null,
  "notes": "Requires product key. Official No-CD patch installed automatically.",
  "created_at": "2017-08-20T05:28:21.587000Z",
  "updated_at": "2020-03-08T11:57:00.203699Z",
  "draft": false,
  "published": true,
  "published_by": 20548,
  "rating": "",
  "steamid": null,
  "gogid": null,
  "gogslug": "",
  "humblestoreid": "",
  "script": {
    "game": {
      "arch": "win32",
      "prefix": "$GAMEDIR",
      "exe": "drive_c/Program Files/Microsoft Games/Halo/halo.exe"
    },
    "installer": [
      {
        "insert-disc": {
          "message": "Mount the Halo Combat Evolved CD to continue",
          "requires": "Setup.Exe"
        }
      },
      {
        "task": {
          "arch": "win32",
          "prefix": "$GAMEDIR",
          "name": "create_prefix"
        }
      },
      {
        "task": {
          "description": "Installing msxml3",
          "app": "msxml3",
          "prefix": "$GAMEDIR",
          "name": "winetricks"
        }
      },
      {
        "task": {
          "description": "Installing dotnet35sp1",
          "app": "dotnet35sp1",
          "prefix": "$GAMEDIR",
          "name": "winetricks"
        }
      },
      {
        "task": {
          "description": "Installing dotnet40",
          "app": "dotnet40",
          "prefix": "$GAMEDIR",
          "name": "winetricks"
        }
      },
      {
        "task": {
          "description": "Installing dotnet4.5.0",
          "app": "win7",
          "prefix": "$GAMEDIR",
          "name": "winetricks"
        }
      },
      {
        "task": {
          "description": "Installing vb6run",
          "app": "vb6run",
          "prefix": "$GAMEDIR",
          "name": "winetricks"
        }
      },
      {
        "task": {
          "description": "Installing mfc42",
          "app": "mfc42",
          "prefix": "$GAMEDIR",
          "name": "winetricks"
        }
      },
      {
        "task": {
          "description": "Installing d3dx9",
          "app": "d3dx9_43",
          "prefix": "$GAMEDIR",
          "name": "winetricks"
        }
      },
      {
        "task": {
          "description": "Windows7 check",
          "app": "win7",
          "prefix": "$GAMEDIR",
          "name": "winetricks"
        }
      },
      {
        "task": {
          "executable": "$DISC/Setup.Exe",
          "description": "Running setup. Use Express install, and close when it asks if you want to launch.",
          "prefix": "$GAMEDIR",
          "name": "wineexec"
        }
      },
      {
        "task": {
          "executable": "$GAMEDIR/drive_c/Program Files/Microsoft Games/Halo/haloupdate.exe",
          "description": "Installing No-CD official patch from drive_c/Program Files/Microsoft Games/Halo/haloupdate.exe",
          "prefix": "$GAMEDIR",
          "name": "wineexec"
        }
      }
    ]
  },
  "content": "game:\n  arch: win32\n  exe: drive_c/Program Files/Microsoft Games/Halo/halo.exe\n  prefix: $GAMEDIR\ninstaller:\n- insert-disc:\n    message: Mount the Halo Combat Evolved CD to continue\n    requires: Setup.Exe\n- task:\n    arch: win32\n    name: create_prefix\n    prefix: $GAMEDIR\n- task:\n    app: msxml3\n    description: Installing msxml3\n    name: winetricks\n    prefix: $GAMEDIR\n- task:\n    app: dotnet35sp1\n    description: Installing dotnet35sp1\n    name: winetricks\n    prefix: $GAMEDIR\n- task:\n    app: dotnet40\n    description: Installing dotnet40\n    name: winetricks\n    prefix: $GAMEDIR\n- task:\n    app: win7\n    description: Installing dotnet4.5.0\n    name: winetricks\n    prefix: $GAMEDIR\n- task:\n    app: vb6run\n    description: Installing vb6run\n    name: winetricks\n    prefix: $GAMEDIR\n- task:\n    app: mfc42\n    description: Installing mfc42\n    name: winetricks\n    prefix: $GAMEDIR\n- task:\n    app: d3dx9_43\n    description: Installing d3dx9\n    name: winetricks\n    prefix: $GAMEDIR\n- task:\n    app: win7\n    description: Windows7 check\n    name: winetricks\n    prefix: $GAMEDIR\n- task:\n    description: Running setup. Use Express install, and close when it asks if you\n      want to launch.\n    executable: $DISC/Setup.Exe\n    name: wineexec\n    prefix: $GAMEDIR\n- task:\n    description: Installing No-CD official patch from drive_c/Program Files/Microsoft\n      Games/Halo/haloupdate.exe\n    executable: $GAMEDIR/drive_c/Program Files/Microsoft Games/Halo/haloupdate.exe\n    name: wineexec\n    prefix: $GAMEDIR\n"
}