{
  "id": 9858,
  "game_id": 16253,
  "game_slug": "they-are-billions",
  "name": "They Are Billions",
  "year": 2019,
  "user": "neowinx",
  "runner": "winesteam",
  "slug": "they-are-billions-steam-w-dxvk",
  "version": "Steam w/ DXVK",
  "description": null,
  "notes": "",
  "created_at": "2018-08-23T15:46:35.420000Z",
  "updated_at": "2020-01-31T02:38:34.378145Z",
  "draft": false,
  "published": true,
  "published_by": 19464,
  "rating": "",
  "steamid": 644930,
  "gogid": null,
  "gogslug": "",
  "humblestoreid": "",
  "script": {
    "game": {
      "appid": 644930,
      "arch": "win64",
      "prefix": "$GAMEDIR/prefix"
    },
    "system": {
      "env": {
        "DXVK_HUD": 0
      },
      "pulse_latency": true
    },
    "installer": [
      {
        "task": {
          "arch": "win64",
          "description": "Creating prefix",
          "prefix": "$GAMEDIR/prefix",
          "name": "create_prefix"
        }
      },
      {
        "task": {
          "app": "corefonts",
          "arch": "win64",
          "description": "Installing corefonts",
          "prefix": "$GAMEDIR/prefix",
          "name": "winetricks"
        }
      },
      {
        "task": {
          "app": "vcrun2017",
          "arch": "win64",
          "prefix": "$GAMEDIR/prefix",
          "name": "winetricks"
        }
      },
      {
        "task": {
          "app": "d3dx11_42",
          "arch": "win64",
          "prefix": "$GAMEDIR/prefix",
          "name": "winetricks"
        }
      },
      {
        "task": {
          "app": "d3dx11_43",
          "arch": "win64",
          "prefix": "$GAMEDIR/prefix",
          "name": "winetricks"
        }
      },
      {
        "task": {
          "app": "dotnet472",
          "arch": "win64",
          "description": "Installing .NET 4.7.2 (it may take a while)",
          "prefix": "$GAMEDIR/prefix",
          "name": "winetricks"
        }
      },
      {
        "task": {
          "app": "gdiplus",
          "arch": "win64",
          "prefix": "$GAMEDIR/prefix",
          "name": "winetricks"
        }
      },
      {
        "task": {
          "app": "win7",
          "arch": "win64",
          "prefix": "$GAMEDIR/prefix",
          "name": "winetricks"
        }
      }
    ],
    "winesteam": {
      "overrides": {
        "xaudio2_7": "native,builtin"
      },
      "dxvk": true
    }
  },
  "content": "game:\n  appid: 644930\n  arch: win64\n  prefix: $GAMEDIR/prefix\ninstaller:\n- task:\n    arch: win64\n    description: Creating prefix\n    name: create_prefix\n    prefix: $GAMEDIR/prefix\n- task:\n    app: corefonts\n    arch: win64\n    description: Installing corefonts\n    name: winetricks\n    prefix: $GAMEDIR/prefix\n- task:\n    app: vcrun2017\n    arch: win64\n    name: winetricks\n    prefix: $GAMEDIR/prefix\n- task:\n    app: d3dx11_42\n    arch: win64\n    name: winetricks\n    prefix: $GAMEDIR/prefix\n- task:\n    app: d3dx11_43\n    arch: win64\n    name: winetricks\n    prefix: $GAMEDIR/prefix\n- task:\n    app: dotnet472\n    arch: win64\n    description: Installing .NET 4.7.2 (it may take a while)\n    name: winetricks\n    prefix: $GAMEDIR/prefix\n- task:\n    app: gdiplus\n    arch: win64\n    name: winetricks\n    prefix: $GAMEDIR/prefix\n- task:\n    app: win7\n    arch: win64\n    name: winetricks\n    prefix: $GAMEDIR/prefix\nsystem:\n  env:\n    DXVK_HUD: 0\n  pulse_latency: true\nwinesteam:\n  dxvk: true\n  overrides:\n    xaudio2_7: native,builtin\n"
}