{
  "id": 18799,
  "game_id": 10579,
  "game_slug": "terasology",
  "name": "Terasology",
  "year": null,
  "user": "vanstaveren",
  "runner": "wine",
  "slug": "terasology-13rc3-vulkan",
  "version": "13rc3-vulkan",
  "description": null,
  "notes": "",
  "created_at": "2020-03-12T12:34:11.697401Z",
  "updated_at": "2020-03-20T10:46:58.528559Z",
  "draft": true,
  "published": false,
  "published_by": null,
  "rating": "",
  "steamid": null,
  "gogid": null,
  "gogslug": "",
  "humblestoreid": "",
  "script": {
    "files": [
      {
        "Terasology.zip": "https://sourceforge.net/projects/terasology.mirror/files/latest/download/TerasologyOmega.zip"
      }
    ],
    "game": {
      "arch": "win64",
      "custom-name": "Terasology",
      "exe": "$GAMEDIR/prefix/drive_c/Program Files/TerasologyOmega/Terasology.x64.exe",
      "prefix": "$GAMEDIR/prefix"
    },
    "installer": [
      {
        "task": {
          "arch": "win64",
          "description": "Creating 64-bit prefix ...",
          "name": "create_prefix",
          "prefix": "$GAMEDIR/prefix"
        }
      },
      {
        "extract": {
          "dst": "$GAMEDIR/prefix/drive_c/Program Files/TerasologyOmega/",
          "src": "Terasology.zip"
        }
      },
      {
        "task": {
          "app": "d3dcompiler_43",
          "arch": "win64",
          "description": "DirectX 11 ...",
          "name": "winetricks",
          "prefix": "$GAMEDIR/prefix"
        }
      },
      {
        "task": {
          "app": "d3dx11_43",
          "arch": "win64",
          "description": "DirectX 11 ...",
          "name": "winetricks",
          "prefix": "$GAMEDIR/prefix"
        }
      },
      {
        "task": {
          "app": "dxvk",
          "arch": "win64",
          "description": "Vulkan ...",
          "name": "winetricks",
          "prefix": "$GAMEDIR/prefix"
        }
      },
      {
        "task": {
          "app": "win8",
          "arch": "win64",
          "description": "Windows version 8 ...",
          "name": "winetricks",
          "prefix": "$GAMEDIR/prefix"
        }
      }
    ],
    "system": {
      "disable_compositor": true,
      "pulse_latency": true,
      "xboxdrv": "xboxdrv"
    },
    "wine": {
      "Audio": "pulse",
      "dxvk": true,
      "esync": true
    }
  },
  "content": "files:\r\n- Terasology.zip: https://sourceforge.net/projects/terasology.mirror/files/latest/download/TerasologyOmega.zip\r\ngame:\r\n  arch: win64\r\n  custom-name: Terasology\r\n  exe: $GAMEDIR/prefix/drive_c/Program Files/TerasologyOmega/Terasology.x64.exe\r\n  prefix: $GAMEDIR/prefix\r\ninstaller:\r\n- task:\r\n    arch: win64\r\n    description: Creating 64-bit prefix ...\r\n    name: create_prefix\r\n    prefix: $GAMEDIR/prefix\r\n- extract:\r\n    dst: $GAMEDIR/prefix/drive_c/Program Files/TerasologyOmega/\r\n    src: Terasology.zip\r\n- task:\r\n    app: d3dcompiler_43\r\n    arch: win64\r\n    description: DirectX 11 ...\r\n    name: winetricks\r\n    prefix: $GAMEDIR/prefix\r\n- task:\r\n    app: d3dx11_43\r\n    arch: win64\r\n    description: DirectX 11 ...\r\n    name: winetricks\r\n    prefix: $GAMEDIR/prefix\r\n- task:\r\n    app: dxvk\r\n    arch: win64\r\n    description: Vulkan ...\r\n    name: winetricks\r\n    prefix: $GAMEDIR/prefix\r\n- task:\r\n    app: win8\r\n    arch: win64\r\n    description: Windows version 8 ...\r\n    name: winetricks\r\n    prefix: $GAMEDIR/prefix\r\nsystem:\r\n  disable_compositor: true\r\n  pulse_latency: true\r\n  xboxdrv: xboxdrv\r\nwine:\r\n  Audio: pulse\r\n  dxvk: true\r\n  esync: true"
}