{
  "id": 18599,
  "game_id": 31856,
  "game_slug": "dreamchess",
  "name": "DreamChess",
  "year": null,
  "user": "vanstaveren",
  "runner": "wine",
  "slug": "dreamchess-030-vulkan",
  "version": "0.3.0-vulkan",
  "description": null,
  "notes": "",
  "created_at": "2020-02-29T14:38:30.102167Z",
  "updated_at": "2020-03-20T10:50:19.196927Z",
  "draft": false,
  "published": false,
  "published_by": null,
  "rating": "",
  "steamid": null,
  "gogid": null,
  "gogslug": "",
  "humblestoreid": "",
  "script": {
    "files": [
      {
        "DreamChess": "https://github.com/dreamchess/dreamchess/releases/download/0.3.0/DreamChess-0.3.0-win64.msi"
      }
    ],
    "installer": [
      {
        "task": {
          "arch": "win64",
          "description": "Creating 64-bit prefix ...",
          "prefix": "$GAMEDIR/prefix",
          "name": "create_prefix"
        }
      },
      {
        "move": {
          "src": "DreamChess",
          "dst": "$GAMEDIR/prefix/drive_c/"
        }
      },
      {
        "task": {
          "args": "start",
          "executable": "$GAMEDIR/prefix/drive_c/DreamChess-0.3.0-win64.msi",
          "description": "DreamChess ...",
          "prefix": "$GAMEDIR/prefix",
          "name": "wineexec"
        }
      },
      {
        "task": {
          "arch": "win64",
          "description": "DirectX 11 ...",
          "app": "d3dcompiler_43",
          "prefix": "$GAMEDIR/prefix",
          "name": "winetricks"
        }
      },
      {
        "task": {
          "arch": "win64",
          "description": "DirectX 11 ...",
          "app": "d3dx11_43",
          "prefix": "$GAMEDIR/prefix",
          "name": "winetricks"
        }
      },
      {
        "task": {
          "arch": "win64",
          "description": "Vulkan ...",
          "app": "dxvk",
          "prefix": "$GAMEDIR/prefix",
          "name": "winetricks"
        }
      },
      {
        "task": {
          "arch": "win64",
          "description": "Windows version 8 ...",
          "app": "win8",
          "prefix": "$GAMEDIR/prefix",
          "name": "winetricks"
        }
      }
    ],
    "system": {
      "disable_compositor": true,
      "pulse_latency": true
    },
    "wine": {
      "esync": true
    },
    "game": {
      "arch": "win64",
      "custom-name": "DreamChess",
      "prefix": "$GAMEDIR/prefix",
      "exe": "$GAMEDIR/prefix/drive_c/Program Files/DreamChess/DreamChess.exe"
    }
  },
  "content": "files:\r\n- DreamChess: https://github.com/dreamchess/dreamchess/releases/download/0.3.0/DreamChess-0.3.0-win64.msi\r\ngame:\r\n  arch: win64\r\n  custom-name: DreamChess\r\n  exe: $GAMEDIR/prefix/drive_c/Program Files/DreamChess/DreamChess.exe\r\n  prefix: $GAMEDIR/prefix\r\ninstaller:\r\n- task:\r\n    arch: win64\r\n    description: Creating 64-bit prefix ...\r\n    name: create_prefix\r\n    prefix: $GAMEDIR/prefix\r\n- move:\r\n    dst: $GAMEDIR/prefix/drive_c/\r\n    src: DreamChess\r\n- task:\r\n    args: start\r\n    description: DreamChess ...\r\n    executable: $GAMEDIR/prefix/drive_c/DreamChess-0.3.0-win64.msi\r\n    name: wineexec\r\n    prefix: $GAMEDIR/prefix\r\n- task:\r\n    app: d3dcompiler_43\r\n    arch: win64\r\n    description: DirectX 11 ...\r\n    name: winetricks\r\n    prefix: $GAMEDIR/prefix\r\n- task:\r\n    app: d3dx11_43\r\n    arch: win64\r\n    description: DirectX 11 ...\r\n    name: winetricks\r\n    prefix: $GAMEDIR/prefix\r\n- task:\r\n    app: dxvk\r\n    arch: win64\r\n    description: Vulkan ...\r\n    name: winetricks\r\n    prefix: $GAMEDIR/prefix\r\n- task:\r\n    app: win8\r\n    arch: win64\r\n    description: Windows version 8 ...\r\n    name: winetricks\r\n    prefix: $GAMEDIR/prefix\r\nsystem:\r\n  disable_compositor: true\r\n  pulse_latency: true\r\nwine:\r\n  esync: true"
}