{
  "id": 18044,
  "game_id": 2421,
  "game_slug": "hearthstone",
  "name": "Hearthstone",
  "year": 2014,
  "user": "xaduha",
  "runner": "wine",
  "slug": "hearthstone-latest",
  "version": "latest",
  "description": null,
  "notes": "",
  "created_at": "2020-01-24T23:54:41.968158Z",
  "updated_at": "2020-01-24T23:54:41.968182Z",
  "draft": true,
  "published": false,
  "published_by": null,
  "rating": "",
  "steamid": null,
  "gogid": null,
  "gogslug": "",
  "humblestoreid": "",
  "script": {
    "game": {
      "exe": "drive_c/Program Files (x86)/Battle.net/Battle.net.exe",
      "arch": "win64",
      "prefix": "$GAMEDIR"
    },
    "system": {
      "exclude_processes": "Agent.exe \"Battle.net Helper.exe\"",
      "env": {
        "__GL_SHADER_DISK_CACHE_PATH": "$GAMEDIR",
        "__GL_SHADER_DISK_CACHE": 1,
        "__GL_SHADER_DISK_CACHE_SIZE": 1000000000,
        "DXVK_CONFIG_FILE": "$GAMEDIR/dxvk.conf",
        "DXVK_STATE_CACHE_PATH": "$GAMEDIR",
        "STAGING_SHARED_MEMORY": 1
      }
    },
    "wine": {
      "esync": true,
      "overrides": {
        "ucrtbase": "n,b",
        "nvapi64": "disabled",
        "d3d12": "disabled",
        "api-ms-win-crt-private-l1-1-0": "n,b",
        "nvapi": "disabled"
      },
      "dxvk": true
    },
    "installer": [
      {
        "task": {
          "arch": "win64",
          "description": "Creating 64bit Wine prefix.",
          "prefix": "$GAMEDIR",
          "name": "create_prefix"
        }
      },
      {
        "task": {
          "app": "arial",
          "arch": "win64",
          "description": "Installing Arial font...",
          "prefix": "$GAMEDIR",
          "name": "winetricks",
          "silent": true
        }
      },
      {
        "task": {
          "prefix": "$GAMEDIR",
          "name": "winekill"
        }
      },
      {
        "write_json": {
          "file": "$GAMEDIR/drive_c/users/$USER/Application Data/Battle.net/Battle.net.config",
          "data": {
            "Client": {
              "GameSearch": {
                "BackgroundSearch": "true"
              },
              "HardwareAcceleration": "false",
              "Streaming": {
                "StreamingEnabled": "false"
              },
              "Sound": {
                "Enabled": "false"
              },
              "GameLaunchWindowBehavior": "2"
            }
          },
          "description": "Writing a Battle.Net config file"
        }
      },
      {
        "write_config": {
          "file": "$GAMEDIR/drive_c/users/$USER/My Documents/Overwatch/Settings/Settings_v0.ini",
          "value": "\"1\"",
          "key": "WindowMode",
          "description": "Enabling Borderless Windowed mode",
          "section": "Render.13"
        }
      },
      {
        "write_config": {
          "file": "$GAMEDIR/drive_c/users/$USER/My Documents/Overwatch/Settings/Settings_v0.ini",
          "value": "\"1\"",
          "key": "Type",
          "description": "Switching to WEBM format for saving Highlights",
          "section": "MovieExport.1"
        }
      },
      {
        "write_config": {
          "file": "$GAMEDIR/drive_c/users/$USER/My Documents/Overwatch/Settings/Settings_v0.ini",
          "value": "\"0\"",
          "key": "UseHardware",
          "description": "Disabling hardware acceleration for saving Highlights",
          "section": "MovieExport.1"
        }
      },
      {
        "write_file": {
          "content": "hasseennewcinematic=True",
          "description": "Adding a startup workaround for Hearthstone",
          "file": "$GAMEDIR/drive_c/users/$USER/Local Settings/Application Data/Blizzard/Hearthstone/options.txt"
        }
      },
      {
        "task": {
          "arch": "win64",
          "description": "Wine Staging: Enabling DXVA2",
          "prefix": "$GAMEDIR",
          "name": "set_regedit",
          "path": "HKEY_CURRENT_USER\\Software\\Wine\\DXVA2",
          "value": "va",
          "key": "backend"
        }
      },
      {
        "task": {
          "arch": "win32",
          "prefix": "$GAMEDIR",
          "name": "set_regedit",
          "path": "HKEY_CURRENT_USER\\Software\\Wine\\X11 Driver",
          "value": "N",
          "key": "UseTakeFocus"
        }
      },
      {
        "task": {
          "prefix": "$GAMEDIR",
          "name": "winekill"
        }
      },
      {
        "task": {
          "executable": "setup",
          "exclude_processes": "Battle.net.exe Agent.exe \"Battle.net Helper.exe\"",
          "arch": "win64",
          "description": "Installing Blizzard App. An installer will open.\n------------------------------\nTo progress, manually continue installation in that window.",
          "name": "wineexec"
        }
      },
      {
        "task": {
          "prefix": "$GAMEDIR",
          "name": "winekill"
        }
      }
    ],
    "files": [
      {
        "setup": "http://dist.blizzard.com/downloads/bna-installers/322d5bb9ae0318de3d4cde7641c96425/retail.1/Battle.net-Setup-enUS.exe"
      }
    ]
  },
  "content": "files:\n- setup: http://dist.blizzard.com/downloads/bna-installers/322d5bb9ae0318de3d4cde7641c96425/retail.1/Battle.net-Setup-enUS.exe\ngame:\n  arch: win64\n  exe: drive_c/Program Files (x86)/Battle.net/Battle.net.exe\n  prefix: $GAMEDIR\ninstaller:\n- task:\n    arch: win64\n    description: Creating 64bit Wine prefix.\n    name: create_prefix\n    prefix: $GAMEDIR\n- task:\n    app: arial\n    arch: win64\n    description: Installing Arial font...\n    name: winetricks\n    prefix: $GAMEDIR\n    silent: true\n- task:\n    name: winekill\n    prefix: $GAMEDIR\n- write_json:\n    data:\n      Client:\n        GameLaunchWindowBehavior: '2'\n        GameSearch:\n          BackgroundSearch: 'true'\n        HardwareAcceleration: 'false'\n        Sound:\n          Enabled: 'false'\n        Streaming:\n          StreamingEnabled: 'false'\n    description: Writing a Battle.Net config file\n    file: $GAMEDIR/drive_c/users/$USER/Application Data/Battle.net/Battle.net.config\n- write_config:\n    description: Enabling Borderless Windowed mode\n    file: $GAMEDIR/drive_c/users/$USER/My Documents/Overwatch/Settings/Settings_v0.ini\n    key: WindowMode\n    section: Render.13\n    value: '\"1\"'\n- write_config:\n    description: Switching to WEBM format for saving Highlights\n    file: $GAMEDIR/drive_c/users/$USER/My Documents/Overwatch/Settings/Settings_v0.ini\n    key: Type\n    section: MovieExport.1\n    value: '\"1\"'\n- write_config:\n    description: Disabling hardware acceleration for saving Highlights\n    file: $GAMEDIR/drive_c/users/$USER/My Documents/Overwatch/Settings/Settings_v0.ini\n    key: UseHardware\n    section: MovieExport.1\n    value: '\"0\"'\n- write_file:\n    content: hasseennewcinematic=True\n    description: Adding a startup workaround for Hearthstone\n    file: $GAMEDIR/drive_c/users/$USER/Local Settings/Application Data/Blizzard/Hearthstone/options.txt\n- task:\n    arch: win64\n    description: 'Wine Staging: Enabling DXVA2'\n    key: backend\n    name: set_regedit\n    path: HKEY_CURRENT_USER\\Software\\Wine\\DXVA2\n    prefix: $GAMEDIR\n    value: va\n- task:\n    arch: win32\n    key: UseTakeFocus\n    name: set_regedit\n    path: HKEY_CURRENT_USER\\Software\\Wine\\X11 Driver\n    prefix: $GAMEDIR\n    value: N\n- task:\n    name: winekill\n    prefix: $GAMEDIR\n- task:\n    arch: win64\n    description: 'Installing Blizzard App. An installer will open.\n\n      ------------------------------\n\n      To progress, manually continue installation in that window.'\n    exclude_processes: Battle.net.exe Agent.exe \"Battle.net Helper.exe\"\n    executable: setup\n    name: wineexec\n- task:\n    name: winekill\n    prefix: $GAMEDIR\nsystem:\n  env:\n    DXVK_CONFIG_FILE: $GAMEDIR/dxvk.conf\n    DXVK_STATE_CACHE_PATH: $GAMEDIR\n    STAGING_SHARED_MEMORY: 1\n    __GL_SHADER_DISK_CACHE: 1\n    __GL_SHADER_DISK_CACHE_PATH: $GAMEDIR\n    __GL_SHADER_DISK_CACHE_SIZE: 1000000000\n  exclude_processes: Agent.exe \"Battle.net Helper.exe\"\nwine:\n  dxvk: true\n  esync: true\n  overrides:\n    api-ms-win-crt-private-l1-1-0: n,b\n    d3d12: disabled\n    nvapi: disabled\n    nvapi64: disabled\n    ucrtbase: n,b\n"
}