{
  "id": 8500,
  "game_id": 2421,
  "game_slug": "hearthstone",
  "name": "Hearthstone",
  "year": 2014,
  "user": "Dox",
  "runner": "wine",
  "slug": "hearthstone-dx11-to-vulkan-dxvk",
  "version": "DX11 to Vulkan (DXVK)",
  "description": "HearthStone - DX11 - 64 bit - Wine Staging + DXVK + esync.",
  "notes": "**IMPORTANT: INSTALL THE DEPENDENCIES FIRST**\r\nSee <a href=\"https://github.com/lutris/lutris/wiki/Game:-Blizzard-App\">https://github.com/lutris/lutris/wiki/Game:-Blizzard-App</a>",
  "created_at": "2018-06-02T15:27:40.491000Z",
  "updated_at": "2019-02-16T03:13:46.720076Z",
  "draft": false,
  "published": true,
  "published_by": 19464,
  "rating": "4",
  "steamid": null,
  "gogid": null,
  "gogslug": "",
  "humblestoreid": "",
  "script": {
    "system": {
      "exclude_processes": "Agent.exe \"Battle.net Helper.exe\"",
      "env": {
        "__GL_SHADER_DISK_CACHE": 1,
        "__GL_SHADER_DISK_CACHE_PATH": "$GAMEDIR",
        "DXVK_HUD": 0
      }
    },
    "game": {
      "arch": "win64",
      "prefix": "$GAMEDIR",
      "exe": "drive_c/Program Files (x86)/Battle.net/Battle.net Launcher.exe"
    },
    "wine": {
      "dxvk": true,
      "esync": true,
      "version": "tkg-unity-4.1-x86_64"
    },
    "files": [
      {
        "setup": {
          "url": "https://www.battle.net/download/getInstallerForGame?os=win&version=LIVE&gameProgram=BATTLENET_APP",
          "filename": "Battle.net-Setup.exe"
        }
      }
    ],
    "installer": [
      {
        "task": {
          "arch": "win64",
          "prefix": "$GAMEDIR",
          "description": "Creating 64bit Wine prefix.",
          "name": "create_prefix"
        }
      },
      {
        "task": {
          "arch": "win64",
          "prefix": "$GAMEDIR",
          "description": "Installing Arial font",
          "name": "winetricks",
          "app": "arial"
        }
      },
      {
        "task": {
          "prefix": "$GAMEDIR",
          "description": "Setting vcruntime140 to native for Hearthstone.exe",
          "value": "native",
          "arch": "win64",
          "path": "HKEY_CURRENT_USER\\Software\\Wine\\AppDefaults\\Hearthstone.exe\\DllOverrides",
          "key": "vcruntime140",
          "name": "set_regedit"
        }
      },
      {
        "task": {
          "prefix": "$GAMEDIR",
          "description": "Setting Windows 10 mode for Wine",
          "value": "win10",
          "arch": "win64",
          "path": "HKEY_CURRENT_USER\\Software\\Wine",
          "key": "Version",
          "name": "set_regedit"
        }
      },
      {
        "task": {
          "prefix": "$GAMEDIR",
          "description": "Wine Staging: Enabling DXVA2",
          "value": "va",
          "arch": "win64",
          "path": "HKEY_CURRENT_USER\\Software\\Wine\\DXVA2",
          "key": "backend",
          "name": "set_regedit"
        }
      },
      {
        "write_json": {
          "description": "Disabling Sound/Hardware Acceleration/Streaming in Blizzard App",
          "data": {
            "Client": {
              "Sound": {
                "Enabled": "false"
              },
              "HardwareAcceleration": "false",
              "GameLaunchWindowBehavior": "2",
              "Streaming": {
                "StreamingEnabled": "false"
              }
            }
          },
          "file": "$GAMEDIR/drive_c/users/$USER/Application Data/Battle.net/Battle.net.config"
        }
      },
      {
        "task": {
          "arch": "win64",
          "executable": "setup",
          "description": "Installing Blizzard App\n------------------------------\nDo not try to log into Battle.net. Lutris will automatically close the login window. After Lutris installer is finished, you can start Blizzard App with \"Launch the game\", and install / locate your Blizzard game.",
          "name": "wineexec",
          "exclude_processes": "Battle.net.exe Agent.exe \"Battle.net Helper.exe\""
        }
      },
      {
        "task": {
          "prefix": "$GAMEDIR",
          "name": "winekill"
        }
      }
    ]
  },
  "content": "files:\n- setup:\n    filename: Battle.net-Setup.exe\n    url: https://www.battle.net/download/getInstallerForGame?os=win&version=LIVE&gameProgram=BATTLENET_APP\ngame:\n  arch: win64\n  exe: drive_c/Program Files (x86)/Battle.net/Battle.net Launcher.exe\n  prefix: $GAMEDIR\ninstaller:\n- task:\n    arch: win64\n    description: Creating 64bit Wine prefix.\n    name: create_prefix\n    prefix: $GAMEDIR\n- task:\n    app: arial\n    arch: win64\n    description: Installing Arial font\n    name: winetricks\n    prefix: $GAMEDIR\n- task:\n    arch: win64\n    description: Setting vcruntime140 to native for Hearthstone.exe\n    key: vcruntime140\n    name: set_regedit\n    path: HKEY_CURRENT_USER\\Software\\Wine\\AppDefaults\\Hearthstone.exe\\DllOverrides\n    prefix: $GAMEDIR\n    value: native\n- task:\n    arch: win64\n    description: Setting Windows 10 mode for Wine\n    key: Version\n    name: set_regedit\n    path: HKEY_CURRENT_USER\\Software\\Wine\n    prefix: $GAMEDIR\n    value: win10\n- task:\n    arch: win64\n    description: 'Wine Staging: Enabling DXVA2'\n    key: backend\n    name: set_regedit\n    path: HKEY_CURRENT_USER\\Software\\Wine\\DXVA2\n    prefix: $GAMEDIR\n    value: va\n- write_json:\n    data:\n      Client:\n        GameLaunchWindowBehavior: '2'\n        HardwareAcceleration: 'false'\n        Sound:\n          Enabled: 'false'\n        Streaming:\n          StreamingEnabled: 'false'\n    description: Disabling Sound/Hardware Acceleration/Streaming in Blizzard App\n    file: $GAMEDIR/drive_c/users/$USER/Application Data/Battle.net/Battle.net.config\n- task:\n    arch: win64\n    description: 'Installing Blizzard App\n\n      ------------------------------\n\n      Do not try to log into Battle.net. Lutris will automatically close the login\n      window. After Lutris installer is finished, you can start Blizzard App with\n      \"Launch the game\", and install / locate your Blizzard game.'\n    exclude_processes: Battle.net.exe Agent.exe \"Battle.net Helper.exe\"\n    executable: setup\n    name: wineexec\n- task:\n    name: winekill\n    prefix: $GAMEDIR\nsystem:\n  env:\n    DXVK_HUD: 0\n    __GL_SHADER_DISK_CACHE: 1\n    __GL_SHADER_DISK_CACHE_PATH: $GAMEDIR\n  exclude_processes: Agent.exe \"Battle.net Helper.exe\"\nwine:\n  dxvk: true\n  esync: true\n  version: tkg-unity-4.1-x86_64\n"
}