{
  "id": 8502,
  "game_id": 2421,
  "game_slug": "hearthstone",
  "name": "Hearthstone",
  "year": 2014,
  "user": "Dox",
  "runner": "wine",
  "slug": "hearthstone-dx9-to-opengl",
  "version": "DX9 to OpenGL",
  "description": "HearthStone - DX9 to OpenGL - 32 bit - Wine Staging. Use this for Low-End PC Systems, or if you only have pre-Skylake Intel Graphics.",
  "notes": "**IMPORTANT: INSTALL THE DEPENDENCIES FIRST**\r\nSee <a href=\"https://github.com/lutris/lutris/wiki/Game:-Blizzard-App\">https://github.com/lutris/lutris/wiki/Game:-Blizzard-App</a>\r\n\r\n***NOTES***\r\n- DX9 is enabled by the installer using: Blizzard App > Game Settings > \"Additional command line arguments\" > \"-force-d3d9\".\r\n- Intro video might not work, just press ESC to skip it.",
  "created_at": "2018-06-02T15:53:14.046000Z",
  "updated_at": "2019-01-23T14:08:09.752375Z",
  "draft": false,
  "published": true,
  "published_by": 51687,
  "rating": "3",
  "steamid": null,
  "gogid": null,
  "gogslug": "",
  "humblestoreid": "",
  "script": {
    "game": {
      "exe": "drive_c/Program Files/Battle.net/Battle.net Launcher.exe",
      "arch": "win32",
      "prefix": "$GAMEDIR"
    },
    "files": [
      {
        "setup": {
          "filename": "Battle.net-Setup.exe",
          "url": "https://www.battle.net/download/getInstallerForGame?os=win&version=LIVE&gameProgram=BATTLENET_APP"
        }
      }
    ],
    "system": {
      "env": {
        "__GL_SHADER_DISK_CACHE": "1",
        "__GL_SHADER_DISK_CACHE_PATH": "$GAMEDIR"
      },
      "exclude_processes": "Agent.exe \"Battle.net Helper.exe\""
    },
    "installer": [
      {
        "task": {
          "description": "Creating 32bit Wine prefix.",
          "prefix": "$GAMEDIR",
          "arch": "win32",
          "name": "create_prefix"
        }
      },
      {
        "task": {
          "description": "Installing Arial font",
          "arch": "win64",
          "prefix": "$GAMEDIR",
          "name": "winetricks",
          "app": "arial"
        }
      },
      {
        "task": {
          "prefix": "$GAMEDIR",
          "name": "set_regedit",
          "description": "Setting vcruntime140 to native for Hearthstone.exe",
          "path": "HKEY_CURRENT_USER\\Software\\Wine\\AppDefaults\\Hearthstone.exe\\DllOverrides",
          "value": "native",
          "key": "vcruntime140",
          "arch": "win32"
        }
      },
      {
        "task": {
          "prefix": "$GAMEDIR",
          "name": "set_regedit",
          "description": "Setting Windows 10 mode for Wine",
          "path": "HKEY_CURRENT_USER\\Software\\Wine",
          "value": "win10",
          "key": "Version",
          "arch": "win32"
        }
      },
      {
        "write_json": {
          "description": "Disabling Sound/Hardware Acceleration/Streaming in Blizzard App",
          "data": {
            "Client": {
              "GameLaunchWindowBehavior": "2",
              "HardwareAcceleration": "false",
              "Sound": {
                "Enabled": "false"
              },
              "Streaming": {
                "StreamingEnabled": "false"
              }
            },
            "Games": {
              "hs_beta": {
                "AdditionalLaunchArguments": "-force-d3d9",
                "ServerUid": "hs_beta"
              }
            }
          },
          "file": "$GAMEDIR/drive_c/users/$USER/Application Data/Battle.net/Battle.net.config"
        }
      },
      {
        "task": {
          "description": "Installing Blizzard App\n------------------------------\nDo not try to log into Battle.net. Lutris will automatically close the login window. After Lutris installer is finished, you can start Blizzard App with \"Launch the game\", and install / locate your Blizzard game.",
          "executable": "setup",
          "arch": "win32",
          "exclude_processes": "Battle.net.exe Agent.exe \"Battle.net Helper.exe\"",
          "name": "wineexec"
        }
      },
      {
        "task": {
          "prefix": "$GAMEDIR",
          "name": "winekill"
        }
      },
      {
        "task": {
          "prefix": "$GAMEDIR",
          "name": "set_regedit",
          "description": "Wine Staging: Enabling DXVA2",
          "path": "HKEY_CURRENT_USER\\Software\\Wine\\DXVA2",
          "value": "va",
          "key": "backend",
          "arch": "win32"
        }
      }
    ]
  },
  "content": "files:\r\n- setup:\r\n    filename: Battle.net-Setup.exe\r\n    url: https://www.battle.net/download/getInstallerForGame?os=win&version=LIVE&gameProgram=BATTLENET_APP\r\ngame:\r\n  arch: win32\r\n  exe: drive_c/Program Files/Battle.net/Battle.net Launcher.exe\r\n  prefix: $GAMEDIR\r\ninstaller:\r\n- task:\r\n    arch: win32\r\n    description: Creating 32bit Wine prefix.\r\n    name: create_prefix\r\n    prefix: $GAMEDIR\r\n- task:\r\n    app: arial\r\n    arch: win64\r\n    description: Installing Arial font\r\n    name: winetricks\r\n    prefix: $GAMEDIR\r\n- task:\r\n    arch: win32\r\n    description: Setting vcruntime140 to native for Hearthstone.exe\r\n    key: vcruntime140\r\n    name: set_regedit\r\n    path: HKEY_CURRENT_USER\\Software\\Wine\\AppDefaults\\Hearthstone.exe\\DllOverrides\r\n    prefix: $GAMEDIR\r\n    value: native\r\n- task:\r\n    arch: win32\r\n    description: Setting Windows 10 mode for Wine\r\n    key: Version\r\n    name: set_regedit\r\n    path: HKEY_CURRENT_USER\\Software\\Wine\r\n    prefix: $GAMEDIR\r\n    value: win10\r\n- write_json:\r\n    data:\r\n      Client:\r\n        GameLaunchWindowBehavior: '2'\r\n        HardwareAcceleration: 'false'\r\n        Sound:\r\n          Enabled: 'false'\r\n        Streaming:\r\n          StreamingEnabled: 'false'\r\n      Games:\r\n        hs_beta:\r\n          AdditionalLaunchArguments: -force-d3d9\r\n          ServerUid: hs_beta\r\n    description: Disabling Sound/Hardware Acceleration/Streaming in Blizzard App\r\n    file: $GAMEDIR/drive_c/users/$USER/Application Data/Battle.net/Battle.net.config\r\n- task:\r\n    arch: win32\r\n    description: 'Installing Blizzard App\r\n\r\n      ------------------------------\r\n\r\n      Do not try to log into Battle.net. Lutris will automatically close the login\r\n      window. After Lutris installer is finished, you can start Blizzard App with\r\n      \"Launch the game\", and install / locate your Blizzard game.'\r\n    exclude_processes: Battle.net.exe Agent.exe \"Battle.net Helper.exe\"\r\n    executable: setup\r\n    name: wineexec\r\n- task:\r\n    name: winekill\r\n    prefix: $GAMEDIR\r\n- task:\r\n    arch: win32\r\n    description: 'Wine Staging: Enabling DXVA2'\r\n    key: backend\r\n    name: set_regedit\r\n    path: HKEY_CURRENT_USER\\Software\\Wine\\DXVA2\r\n    prefix: $GAMEDIR\r\n    value: va\r\nsystem:\r\n  env:\r\n    __GL_SHADER_DISK_CACHE: '1'\r\n    __GL_SHADER_DISK_CACHE_PATH: $GAMEDIR\r\n  exclude_processes: Agent.exe \"Battle.net Helper.exe\""
}