{
  "id": 16231,
  "game_id": 2421,
  "game_slug": "hearthstone",
  "name": "Hearthstone",
  "year": 2014,
  "user": "Shorel.Aran",
  "runner": "linux",
  "slug": "hearthstone-dx9-2-opengl",
  "version": "DX9 2 OpenGL",
  "description": "fixed link fot blizzard app \"connection error\" issue",
  "notes": "",
  "created_at": "2019-10-16T20:05:56.135340Z",
  "updated_at": "2019-10-16T20:05:56.135364Z",
  "draft": false,
  "published": false,
  "published_by": null,
  "rating": "",
  "steamid": null,
  "gogid": null,
  "gogslug": "",
  "humblestoreid": "",
  "script": {
    "system": {
      "exclude_processes": "Agent.exe \"Battle.net Helper.exe\"",
      "env": {
        "__GL_SHADER_DISK_CACHE": "1",
        "__GL_SHADER_DISK_CACHE_PATH": "$GAMEDIR"
      }
    },
    "game": {
      "arch": "win32",
      "prefix": "$GAMEDIR",
      "exe": "drive_c/Program Files/Battle.net/Battle.net Launcher.exe"
    },
    "files": [
      {
        "setup": {
          "url": "http://dist.blizzard.com/downloads/bna-installers/322d5bb9ae0318de3d4cde7641c96425/retail.1/Battle.net-Setup-enUS.exe",
          "filename": "Battle.net-Setup.exe"
        }
      }
    ],
    "installer": [
      {
        "task": {
          "arch": "win32",
          "prefix": "$GAMEDIR",
          "description": "Creating 32bit Wine prefix.",
          "name": "create_prefix"
        }
      },
      {
        "task": {
          "arch": "win64",
          "prefix": "$GAMEDIR",
          "description": "Installing Arial font",
          "name": "winetricks",
          "app": "arial"
        }
      },
      {
        "task": {
          "prefix": "$GAMEDIR",
          "description": "Setting vcruntime140 to native for Hearthstone.exe",
          "value": "native",
          "arch": "win32",
          "path": "HKEY_CURRENT_USER\\Software\\Wine\\AppDefaults\\Hearthstone.exe\\DllOverrides",
          "key": "vcruntime140",
          "name": "set_regedit"
        }
      },
      {
        "task": {
          "prefix": "$GAMEDIR",
          "description": "Setting Windows 10 mode for Wine",
          "value": "win10",
          "arch": "win32",
          "path": "HKEY_CURRENT_USER\\Software\\Wine",
          "key": "Version",
          "name": "set_regedit"
        }
      },
      {
        "write_json": {
          "description": "Disabling Sound/Hardware Acceleration/Streaming in Blizzard App",
          "data": {
            "Client": {
              "Sound": {
                "Enabled": "false"
              },
              "HardwareAcceleration": "false",
              "GameLaunchWindowBehavior": "2",
              "Streaming": {
                "StreamingEnabled": "false"
              }
            },
            "Games": {
              "hs_beta": {
                "ServerUid": "hs_beta",
                "AdditionalLaunchArguments": "-force-d3d9"
              }
            }
          },
          "file": "$GAMEDIR/drive_c/users/$USER/Application Data/Battle.net/Battle.net.config"
        }
      },
      {
        "task": {
          "arch": "win32",
          "executable": "setup",
          "description": "Installing Blizzard App\n------------------------------\nDo not try to log into Battle.net. Lutris will automatically close the login window. After Lutris installer is finished, you can start Blizzard App with \"Launch the game\", and install / locate your Blizzard game.",
          "name": "wineexec",
          "exclude_processes": "Battle.net.exe Agent.exe \"Battle.net Helper.exe\""
        }
      },
      {
        "task": {
          "prefix": "$GAMEDIR",
          "name": "winekill"
        }
      },
      {
        "task": {
          "prefix": "$GAMEDIR",
          "description": "Wine Staging: Enabling DXVA2",
          "value": "va",
          "arch": "win32",
          "path": "HKEY_CURRENT_USER\\Software\\Wine\\DXVA2",
          "key": "backend",
          "name": "set_regedit"
        }
      }
    ]
  },
  "content": "files:\n- setup:\n    filename: Battle.net-Setup.exe\n    url: http://dist.blizzard.com/downloads/bna-installers/322d5bb9ae0318de3d4cde7641c96425/retail.1/Battle.net-Setup-enUS.exe\ngame:\n  arch: win32\n  exe: drive_c/Program Files/Battle.net/Battle.net Launcher.exe\n  prefix: $GAMEDIR\ninstaller:\n- task:\n    arch: win32\n    description: Creating 32bit Wine prefix.\n    name: create_prefix\n    prefix: $GAMEDIR\n- task:\n    app: arial\n    arch: win64\n    description: Installing Arial font\n    name: winetricks\n    prefix: $GAMEDIR\n- task:\n    arch: win32\n    description: Setting vcruntime140 to native for Hearthstone.exe\n    key: vcruntime140\n    name: set_regedit\n    path: HKEY_CURRENT_USER\\Software\\Wine\\AppDefaults\\Hearthstone.exe\\DllOverrides\n    prefix: $GAMEDIR\n    value: native\n- task:\n    arch: win32\n    description: Setting Windows 10 mode for Wine\n    key: Version\n    name: set_regedit\n    path: HKEY_CURRENT_USER\\Software\\Wine\n    prefix: $GAMEDIR\n    value: win10\n- write_json:\n    data:\n      Client:\n        GameLaunchWindowBehavior: '2'\n        HardwareAcceleration: 'false'\n        Sound:\n          Enabled: 'false'\n        Streaming:\n          StreamingEnabled: 'false'\n      Games:\n        hs_beta:\n          AdditionalLaunchArguments: -force-d3d9\n          ServerUid: hs_beta\n    description: Disabling Sound/Hardware Acceleration/Streaming in Blizzard App\n    file: $GAMEDIR/drive_c/users/$USER/Application Data/Battle.net/Battle.net.config\n- task:\n    arch: win32\n    description: 'Installing Blizzard App\n\n      ------------------------------\n\n      Do not try to log into Battle.net. Lutris will automatically close the login\n      window. After Lutris installer is finished, you can start Blizzard App with\n      \"Launch the game\", and install / locate your Blizzard game.'\n    exclude_processes: Battle.net.exe Agent.exe \"Battle.net Helper.exe\"\n    executable: setup\n    name: wineexec\n- task:\n    name: winekill\n    prefix: $GAMEDIR\n- task:\n    arch: win32\n    description: 'Wine Staging: Enabling DXVA2'\n    key: backend\n    name: set_regedit\n    path: HKEY_CURRENT_USER\\Software\\Wine\\DXVA2\n    prefix: $GAMEDIR\n    value: va\nsystem:\n  env:\n    __GL_SHADER_DISK_CACHE: '1'\n    __GL_SHADER_DISK_CACHE_PATH: $GAMEDIR\n  exclude_processes: Agent.exe \"Battle.net Helper.exe\"\n"
}