{
  "id": 14908,
  "game_id": 2421,
  "game_slug": "hearthstone",
  "name": "Hearthstone",
  "year": 2014,
  "user": "lightking813",
  "runner": "wine",
  "slug": "hearthstone-dx9-to-opengl-fixed",
  "version": "DX9 to OpenGL (fixed)",
  "description": "HearthStone - DX9 to OpenGL - 32 bit - Wine Staging. Use this for Low-End PC Systems, or if you only have pre-Skylake Intel Graphics.\r\n\r\n**IMPORTANT: INSTALL THE DEPENDENCIES FIRST**\r\nSee https://github.com/lutris/lutris/wiki/Game:-Blizzard-App",
  "notes": "***NOTES***\r\n- DX9 is enabled by the installer using: Blizzard App > Game Settings > \"Additional command line arguments\" > \"-force-d3d9\".\r\n- Intro video might not work, just press ESC to skip it.\r\n- Fixed download failure due to broken link",
  "created_at": "2019-08-07T10:13:12.200572Z",
  "updated_at": "2019-08-07T10:13:12.200595Z",
  "draft": false,
  "published": false,
  "published_by": null,
  "rating": "",
  "steamid": null,
  "gogid": null,
  "gogslug": "",
  "humblestoreid": "",
  "script": {
    "game": {
      "exe": "drive_c/Program Files/Battle.net/Battle.net Launcher.exe",
      "arch": "win32",
      "prefix": "$GAMEDIR"
    },
    "files": [
      {
        "setup": {
          "filename": "Battle.net-Setup.exe",
          "url": "https://us.battle.net/download/getInstaller?os=win&installer=Hearthstone-Setup.exe"
        }
      }
    ],
    "system": {
      "env": {
        "__GL_SHADER_DISK_CACHE": "1",
        "__GL_SHADER_DISK_CACHE_PATH": "$GAMEDIR"
      },
      "exclude_processes": "Agent.exe \"Battle.net Helper.exe\""
    },
    "installer": [
      {
        "task": {
          "description": "Creating 32bit Wine prefix.",
          "prefix": "$GAMEDIR",
          "arch": "win32",
          "name": "create_prefix"
        }
      },
      {
        "task": {
          "description": "Installing Arial font",
          "arch": "win64",
          "prefix": "$GAMEDIR",
          "name": "winetricks",
          "app": "arial"
        }
      },
      {
        "task": {
          "prefix": "$GAMEDIR",
          "name": "set_regedit",
          "description": "Setting vcruntime140 to native for Hearthstone.exe",
          "path": "HKEY_CURRENT_USER\\Software\\Wine\\AppDefaults\\Hearthstone.exe\\DllOverrides",
          "value": "native",
          "key": "vcruntime140",
          "arch": "win32"
        }
      },
      {
        "task": {
          "prefix": "$GAMEDIR",
          "name": "set_regedit",
          "description": "Setting Windows 10 mode for Wine",
          "path": "HKEY_CURRENT_USER\\Software\\Wine",
          "value": "win10",
          "key": "Version",
          "arch": "win32"
        }
      },
      {
        "write_json": {
          "description": "Disabling Sound/Hardware Acceleration/Streaming in Blizzard App",
          "data": {
            "Client": {
              "GameLaunchWindowBehavior": "2",
              "HardwareAcceleration": "false",
              "Sound": {
                "Enabled": "false"
              },
              "Streaming": {
                "StreamingEnabled": "false"
              }
            },
            "Games": {
              "hs_beta": {
                "AdditionalLaunchArguments": "-force-d3d9",
                "ServerUid": "hs_beta"
              }
            }
          },
          "file": "$GAMEDIR/drive_c/users/$USER/Application Data/Battle.net/Battle.net.config"
        }
      },
      {
        "task": {
          "description": "Installing Blizzard App\n------------------------------\nDo not try to log into Battle.net. Lutris will automatically close the login window. After Lutris installer is finished, you can start Blizzard App with \"Launch the game\", and install / locate your Blizzard game.",
          "executable": "setup",
          "arch": "win32",
          "exclude_processes": "Battle.net.exe Agent.exe \"Battle.net Helper.exe\"",
          "name": "wineexec"
        }
      },
      {
        "task": {
          "prefix": "$GAMEDIR",
          "name": "winekill"
        }
      },
      {
        "task": {
          "prefix": "$GAMEDIR",
          "name": "set_regedit",
          "description": "Wine Staging: Enabling DXVA2",
          "path": "HKEY_CURRENT_USER\\Software\\Wine\\DXVA2",
          "value": "va",
          "key": "backend",
          "arch": "win32"
        }
      }
    ]
  },
  "content": "files:\n- setup:\n    filename: Battle.net-Setup.exe\n    url: https://us.battle.net/download/getInstaller?os=win&installer=Hearthstone-Setup.exe\ngame:\n  arch: win32\n  exe: drive_c/Program Files/Battle.net/Battle.net Launcher.exe\n  prefix: $GAMEDIR\ninstaller:\n- task:\n    arch: win32\n    description: Creating 32bit Wine prefix.\n    name: create_prefix\n    prefix: $GAMEDIR\n- task:\n    app: arial\n    arch: win64\n    description: Installing Arial font\n    name: winetricks\n    prefix: $GAMEDIR\n- task:\n    arch: win32\n    description: Setting vcruntime140 to native for Hearthstone.exe\n    key: vcruntime140\n    name: set_regedit\n    path: HKEY_CURRENT_USER\\Software\\Wine\\AppDefaults\\Hearthstone.exe\\DllOverrides\n    prefix: $GAMEDIR\n    value: native\n- task:\n    arch: win32\n    description: Setting Windows 10 mode for Wine\n    key: Version\n    name: set_regedit\n    path: HKEY_CURRENT_USER\\Software\\Wine\n    prefix: $GAMEDIR\n    value: win10\n- write_json:\n    data:\n      Client:\n        GameLaunchWindowBehavior: '2'\n        HardwareAcceleration: 'false'\n        Sound:\n          Enabled: 'false'\n        Streaming:\n          StreamingEnabled: 'false'\n      Games:\n        hs_beta:\n          AdditionalLaunchArguments: -force-d3d9\n          ServerUid: hs_beta\n    description: Disabling Sound/Hardware Acceleration/Streaming in Blizzard App\n    file: $GAMEDIR/drive_c/users/$USER/Application Data/Battle.net/Battle.net.config\n- task:\n    arch: win32\n    description: 'Installing Blizzard App\n\n      ------------------------------\n\n      Do not try to log into Battle.net. Lutris will automatically close the login\n      window. After Lutris installer is finished, you can start Blizzard App with\n      \"Launch the game\", and install / locate your Blizzard game.'\n    exclude_processes: Battle.net.exe Agent.exe \"Battle.net Helper.exe\"\n    executable: setup\n    name: wineexec\n- task:\n    name: winekill\n    prefix: $GAMEDIR\n- task:\n    arch: win32\n    description: 'Wine Staging: Enabling DXVA2'\n    key: backend\n    name: set_regedit\n    path: HKEY_CURRENT_USER\\Software\\Wine\\DXVA2\n    prefix: $GAMEDIR\n    value: va\nsystem:\n  env:\n    __GL_SHADER_DISK_CACHE: '1'\n    __GL_SHADER_DISK_CACHE_PATH: $GAMEDIR\n  exclude_processes: Agent.exe \"Battle.net Helper.exe\"\n"
}