{
  "id": 9246,
  "game_id": 1303,
  "game_slug": "mafia",
  "name": "Mafia",
  "year": 2002,
  "user": "elukas01",
  "runner": "wine",
  "slug": "mafia-gog",
  "version": "GOG",
  "description": null,
  "notes": "",
  "created_at": "2018-07-16T21:19:34.953000Z",
  "updated_at": "2018-07-17T06:20:53.362310Z",
  "draft": false,
  "published": true,
  "published_by": null,
  "rating": "",
  "steamid": 40990,
  "gogid": 1595659240,
  "gogslug": "mafia",
  "humblestoreid": "",
  "script": {
    "winesteam": {
      "overrides": {
        "winegstreamer": "disabled"
      }
    },
    "installer": [
      {
        "task": {
          "app": "vcrun6",
          "prefix": "$GAMEDIR/prefix",
          "name": "winetricks"
        }
      },
      {
        "task": {
          "executable": "$setup_mafia",
          "prefix": "$GAMEDIR/prefix",
          "name": "wineexec"
        }
      },
      {
        "task": {
          "prefix": "$GAMEDIR/prefix",
          "value": "14 00 00 05 00 00 00 04 00 00 20 00 00 00 00 00 00 00 00 00 00 00 01 00 00 00 01 00 01 00 01 01 00 01 00 00 00 00 01 00 00 80 3f 00 00 80 3f 02 00 00 00 02 00 00 00 03 00 00 00 02 00 00 00",
          "arch": "win64",
          "key": "LS3D_setup",
          "name": "set_regedit",
          "path": "HKEY_CURRENT_USER\\Software\\Illusion Softworks\\Mafia",
          "type": "REG_BINARY"
        }
      }
    ],
    "files": [
      {
        "setup_mafia": "N/A:Please select the GOG installer"
      }
    ],
    "game": {
      "prefix": "$GAMEDIR/prefix",
      "exe": "$GAMEDIR/prefix/drive_c/GOG Games/Mafia/Setup.exe"
    }
  },
  "content": "files:\n- setup_mafia: N/A:Please select the GOG installer\ngame:\n  exe: $GAMEDIR/prefix/drive_c/GOG Games/Mafia/Setup.exe\n  prefix: $GAMEDIR/prefix\ninstaller:\n- task:\n    app: vcrun6\n    name: winetricks\n    prefix: $GAMEDIR/prefix\n- task:\n    executable: $setup_mafia\n    name: wineexec\n    prefix: $GAMEDIR/prefix\n- task:\n    arch: win64\n    key: LS3D_setup\n    name: set_regedit\n    path: HKEY_CURRENT_USER\\Software\\Illusion Softworks\\Mafia\n    prefix: $GAMEDIR/prefix\n    type: REG_BINARY\n    value: 14 00 00 05 00 00 00 04 00 00 20 00 00 00 00 00 00 00 00 00 00 00 01 00\n      00 00 01 00 01 00 01 01 00 01 00 00 00 00 01 00 00 80 3f 00 00 80 3f 02 00 00\n      00 02 00 00 00 03 00 00 00 02 00 00 00\nwinesteam:\n  overrides:\n    winegstreamer: disabled\n"
}