{
  "id": 18607,
  "game_id": 4427,
  "game_slug": "colin-mcrae-rally",
  "name": "Colin McRae Rally",
  "year": 2014,
  "user": "esrefyus",
  "runner": "wine",
  "slug": "colin-mcrae-rally-download-exexutable",
  "version": "Download (Exexutable)",
  "description": null,
  "notes": "",
  "created_at": "2020-02-29T18:22:53.097383Z",
  "updated_at": "2020-02-29T18:22:53.097409Z",
  "draft": true,
  "published": false,
  "published_by": null,
  "rating": "",
  "steamid": 287340,
  "gogid": null,
  "gogslug": "",
  "humbleid": "",
  "humblestoreid": "",
  "humblestoreid_real": "",
  "script": {
    "files": [
      {
        "game": "N/A:Select the game's setup file"
      }
    ],
    "game": {
      "arch": "win32",
      "exe": "drive_c/Program Files/TmNationsForever/TmForeverLauncher.exe",
      "prefix": "$GAMEDIR"
    },
    "installer": [
      {
        "task": {
          "description": "Creating Wine prefix",
          "name": "create_prefix",
          "prefix": "$GAMEDIR"
        }
      },
      {
        "task": {
          "key": "winemenubuilder.exe",
          "name": "set_regedit",
          "path": "HKEY_CURRENT_USER\\Software\\Wine\\DllOverrides",
          "prefix": "$GAMEDIR",
          "type": "REG_SZ",
          "value": ""
        }
      },
      {
        "task": {
          "app": "d3dx9",
          "name": "winetricks",
          "prefix": "$GAMEDIR"
        }
      },
      {
        "task": {
          "args": "/silent",
          "description": "Installing...",
          "executable": "game",
          "name": "wineexec",
          "prefix": "$GAMEDIR"
        }
      },
      {
        "task": {
          "app": "sandbox",
          "description": "Disabling unused WINE features",
          "name": "winetricks",
          "prefix": "$GAMEDIR",
          "silent": true
        }
      }
    ]
  },
  "content": "files:\n- game: N/A:Select the game's setup file\ngame:\n  arch: win32\n  exe: drive_c/Program Files/TmNationsForever/TmForeverLauncher.exe\n  prefix: $GAMEDIR\ninstaller:\n- task:\n    description: Creating Wine prefix\n    name: create_prefix\n    prefix: $GAMEDIR\n- task:\n    key: winemenubuilder.exe\n    name: set_regedit\n    path: HKEY_CURRENT_USER\\Software\\Wine\\DllOverrides\n    prefix: $GAMEDIR\n    type: REG_SZ\n    value: ''\n- task:\n    app: d3dx9\n    name: winetricks\n    prefix: $GAMEDIR\n- task:\n    args: /silent\n    description: Installing...\n    executable: game\n    name: wineexec\n    prefix: $GAMEDIR\n- task:\n    app: sandbox\n    description: Disabling unused WINE features\n    name: winetricks\n    prefix: $GAMEDIR\n    silent: true\n"
}