{
  "id": 10275,
  "game_id": 21842,
  "game_slug": "pro-evolution-soccer-6",
  "name": "PRO EVOLUTION SOCCER 6",
  "year": 2006,
  "user": "lazanet",
  "runner": "wine",
  "slug": "pro-evolution-soccer-6-dvd",
  "version": "DVD",
  "description": null,
  "notes": "",
  "created_at": "2018-09-21T17:24:16.083941Z",
  "updated_at": "2018-09-22T01:23:27.341472Z",
  "draft": false,
  "published": true,
  "published_by": null,
  "rating": "",
  "steamid": null,
  "gogid": null,
  "gogslug": "",
  "humblestoreid": "",
  "script": {
    "game": {
      "exe": "drive_c/Program Files/KONAMI/Pro Evolution Soccer 6/PES6.exe",
      "arch": "win32",
      "prefix": "$GAMEDIR"
    },
    "wine": {
      "overrides": {
        "dxgi": "disable",
        "nvcuda": "disable"
      },
      "version": "staging-3.3-i386"
    },
    "installer": [
      {
        "insert-disc": {
          "requires": "setup.exe"
        }
      },
      {
        "task": {
          "description": "Creating 64bit Wine prefix.",
          "prefix": "$GAMEDIR",
          "arch": "win64",
          "name": "create_prefix"
        }
      },
      {
        "task": {
          "prefix": "$GAMEDIR",
          "name": "set_regedit",
          "description": "Enabling CSMT for better graphic performance.",
          "path": "HKEY_CURRENT_USER\\Software\\Wine\\DllRedirects",
          "value": "wined3d-csmt.dll",
          "key": "wined3d"
        }
      },
      {
        "task": {
          "description": "Installing PES6.\nThe installating folder MUST BE 'C:\\Program Files\\KONAMI\\Pro Evolution Soccer 6'",
          "prefix": "$GAMEDIR",
          "executable": "$DISC/Setup.exe",
          "name": "wineexec"
        }
      }
    ]
  },
  "content": "game:\n  arch: win32\n  exe: drive_c/Program Files/KONAMI/Pro Evolution Soccer 6/PES6.exe\n  prefix: $GAMEDIR\ninstaller:\n- insert-disc:\n    requires: setup.exe\n- task:\n    arch: win64\n    description: Creating 64bit Wine prefix.\n    name: create_prefix\n    prefix: $GAMEDIR\n- task:\n    description: Enabling CSMT for better graphic performance.\n    key: wined3d\n    name: set_regedit\n    path: HKEY_CURRENT_USER\\Software\\Wine\\DllRedirects\n    prefix: $GAMEDIR\n    value: wined3d-csmt.dll\n- task:\n    description: 'Installing PES6.\n\n      The installating folder MUST BE ''C:\\Program Files\\KONAMI\\Pro Evolution Soccer\n      6'''\n    executable: $DISC/Setup.exe\n    name: wineexec\n    prefix: $GAMEDIR\nwine:\n  overrides:\n    dxgi: disable\n    nvcuda: disable\n  version: staging-3.3-i386\n"
}