{
  "id": 23434,
  "game_id": 31969,
  "game_slug": "age-of-empires-iii",
  "name": "Age of Empires III",
  "year": 2005,
  "user": "Google_AU",
  "runner": "wine",
  "slug": "age-of-empires-iii-cd-3x",
  "version": "CD 3X",
  "description": null,
  "notes": "",
  "created_at": "2020-09-19T18:14:42.035071Z",
  "updated_at": "2020-09-19T18:14:42.035097Z",
  "draft": true,
  "published": false,
  "published_by": null,
  "rating": "",
  "steamid": null,
  "gogid": null,
  "gogslug": "",
  "humbleid": "",
  "humblestoreid": "",
  "humblestoreid_real": "",
  "script": {
    "game": {
      "exe": "drive_c/Program Files (x86)/Microsoft Games/Age of Empires III/age3y.exe",
      "prefix": "$GAMEDIR"
    },
    "installer": [
      {
        "task": {
          "app": "winxp",
          "description": "Setting up wine to windows xp",
          "name": "winetricks",
          "prefix": "$GAMEDIR"
        }
      },
      {
        "task": {
          "app": "corefonts d9vk quartz mfc42 l3codecx msxml4 vcrun6 riched20",
          "description": "Installing required libraries",
          "name": "winetricks",
          "prefix": "$GAMEDIR"
        }
      },
      {
        "insert-disc": {
          "description": "Insert disc 1",
          "requires": "Disk1C~1.cab"
        }
      },
      {
        "merge": {
          "description": "Copying files",
          "dst": "$GAMEDIR/cds",
          "src": "$DISC"
        }
      },
      {
        "insert-disc": {
          "description": "Insert disc 2",
          "requires": "Disk2C~1.cab"
        }
      },
      {
        "merge": {
          "description": "Copying Disk2C~1.cab",
          "dst": "$GAMEDIR/cds",
          "src": "$DISC/Disk2C~1.cab"
        }
      },
      {
        "insert-disc": {
          "description": "Insert disc 3",
          "requires": "Disk3C~1.cab"
        }
      },
      {
        "merge": {
          "description": "Copying Disk3C~1.cab",
          "dst": "$GAMEDIR/cds",
          "src": "$DISC/Disk3C~1.cab"
        }
      },
      {
        "task": {
          "description": "Installing the game",
          "executable": "$GAMEDIR/cds/install.exe",
          "name": "wineexec",
          "prefix": "$GAMEDIR"
        }
      }
    ],
    "wine": {
      "esync": true
    }
  },
  "content": "game:\n  exe: drive_c/Program Files (x86)/Microsoft Games/Age of Empires III/age3y.exe\n  prefix: $GAMEDIR\ninstaller:\n- task:\n    app: winxp\n    description: Setting up wine to windows xp\n    name: winetricks\n    prefix: $GAMEDIR\n- task:\n    app: corefonts d9vk quartz mfc42 l3codecx msxml4 vcrun6 riched20\n    description: Installing required libraries\n    name: winetricks\n    prefix: $GAMEDIR\n- insert-disc:\n    description: Insert disc 1\n    requires: Disk1C~1.cab\n- merge:\n    description: Copying files\n    dst: $GAMEDIR/cds\n    src: $DISC\n- insert-disc:\n    description: Insert disc 2\n    requires: Disk2C~1.cab\n- merge:\n    description: Copying Disk2C~1.cab\n    dst: $GAMEDIR/cds\n    src: $DISC/Disk2C~1.cab\n- insert-disc:\n    description: Insert disc 3\n    requires: Disk3C~1.cab\n- merge:\n    description: Copying Disk3C~1.cab\n    dst: $GAMEDIR/cds\n    src: $DISC/Disk3C~1.cab\n- task:\n    description: Installing the game\n    executable: $GAMEDIR/cds/install.exe\n    name: wineexec\n    prefix: $GAMEDIR\nwine:\n  esync: true\n"
}