{
  "id": 20712,
  "game_id": 8223,
  "game_slug": "sid-meiers-civilization-vi",
  "name": "Sid Meier's Civilization VI",
  "year": 2016,
  "user": "ScooterDelta",
  "runner": "wine",
  "slug": "sid-meiers-civilization-vi-epic-games",
  "version": "Epic Games",
  "description": null,
  "notes": "",
  "created_at": "2020-05-22T21:12:07.661000Z",
  "updated_at": "2020-06-22T00:29:30.974144Z",
  "draft": false,
  "published": true,
  "published_by": 51687,
  "rating": "1",
  "steamid": 289070,
  "gogid": null,
  "gogslug": "",
  "humbleid": "",
  "humblestoreid": "",
  "humblestoreid_real": "sid-meiers-civilization-6",
  "script": {
    "files": [
      {
        "epic": "https://launcher-public-service-prod06.ol.epicgames.com/launcher/api/installer/download/EpicGamesLauncherInstaller.msi"
      }
    ],
    "game": {
      "arch": "win64",
      "args": "-SkipBuildPatchPrereq -opengl",
      "exe": "drive_c/Program Files (x86)/Epic Games/Launcher/Portal/Binaries/Win32/EpicGamesLauncher.exe",
      "prefix": "$GAMEDIR"
    },
    "installer": [
      {
        "task": {
          "arch": "win64",
          "name": "create_prefix",
          "prefix": "$GAMEDIR"
        }
      },
      {
        "task": {
          "arch": "win64",
          "name": "winekill",
          "prefix": "$GAMEDIR"
        }
      },
      {
        "task": {
          "app": "arial vcrun2019 cjkfonts win10",
          "arch": "win64",
          "description": "Installing dependencies",
          "name": "winetricks",
          "prefix": "$GAMEDIR"
        }
      },
      {
        "task": {
          "arch": "win64",
          "name": "winekill",
          "prefix": "$GAMEDIR"
        }
      },
      {
        "copy": {
          "dst": "$CACHE/epic/",
          "src": "epic"
        }
      },
      {
        "task": {
          "arch": "win64",
          "args": "/i \"$CACHE/epic/EpicGamesLauncherInstaller.msi\" /q",
          "exclude_processes": "EpicGamesLauncher.exe",
          "executable": "msiexec",
          "name": "wineexec",
          "prefix": "$GAMEDIR"
        }
      },
      {
        "task": {
          "arch": "win64",
          "name": "winekill",
          "prefix": "$GAMEDIR"
        }
      }
    ],
    "system": {
      "env": {
        "DXVK_HUD": "compiler",
        "__GL_SHADER_DISK_CACHE": 1,
        "__GL_SHADER_DISK_CACHE_PATH": "$GAMEDIR"
      }
    },
    "wine": {
      "dxvk": true,
      "esync": true
    }
  },
  "content": "files:\r\n- epic: https://launcher-public-service-prod06.ol.epicgames.com/launcher/api/installer/download/EpicGamesLauncherInstaller.msi\r\ngame:\r\n  arch: win64\r\n  args: -SkipBuildPatchPrereq -opengl\r\n  exe: drive_c/Program Files (x86)/Epic Games/Launcher/Portal/Binaries/Win32/EpicGamesLauncher.exe\r\n  prefix: $GAMEDIR\r\ninstaller:\r\n- task:\r\n    arch: win64\r\n    name: create_prefix\r\n    prefix: $GAMEDIR\r\n- task:\r\n    arch: win64\r\n    name: winekill\r\n    prefix: $GAMEDIR\r\n- task:\r\n    app: arial vcrun2019 cjkfonts win10\r\n    arch: win64\r\n    description: Installing dependencies\r\n    name: winetricks\r\n    prefix: $GAMEDIR\r\n- task:\r\n    arch: win64\r\n    name: winekill\r\n    prefix: $GAMEDIR\r\n- copy:\r\n    dst: $CACHE/epic/\r\n    src: epic\r\n- task:\r\n    arch: win64\r\n    args: /i \"$CACHE/epic/EpicGamesLauncherInstaller.msi\" /q\r\n    exclude_processes: EpicGamesLauncher.exe\r\n    executable: msiexec\r\n    name: wineexec\r\n    prefix: $GAMEDIR\r\n- task:\r\n    arch: win64\r\n    name: winekill\r\n    prefix: $GAMEDIR\r\nsystem:\r\n  env:\r\n    DXVK_HUD: compiler\r\n    __GL_SHADER_DISK_CACHE: 1\r\n    __GL_SHADER_DISK_CACHE_PATH: $GAMEDIR\r\nwine:\r\n  dxvk: true\r\n  esync: true"
}