{
  "id": 2769,
  "game_id": 2954,
  "game_slug": "star-wars-rogue-squadron",
  "name": "Star Wars: Rogue Squadron",
  "year": 1998,
  "user": "strider",
  "runner": "wine",
  "slug": "star-wars-rogue-squadron-gog",
  "version": "GOG",
  "description": "",
  "notes": "",
  "created_at": "2016-09-23T22:10:22.888230Z",
  "updated_at": "2016-09-23T23:17:53.296283Z",
  "draft": false,
  "published": true,
  "published_by": null,
  "rating": "",
  "steamid": null,
  "gogid": null,
  "gogslug": "",
  "humblestoreid": "",
  "script": {
    "files": [
      {
        "game": "N/A:Please select the GOG.com Windows installer."
      }
    ],
    "game": {
      "prefix": "$GAMEDIR",
      "exe": "$GAMEDIR/drive_c/GOG Games/Star Wars - Rogue Squadron 3D/Launch Star Wars - Rogue Squadron 3D.lnk",
      "working_dir": "$GAMEDIR/drive_c/game"
    },
    "installer": [
      {
        "task": {
          "prefix": "$GAMEDIR",
          "name": "create_prefix",
          "description": "Creating Wine prefix"
        }
      },
      {
        "task": {
          "prefix": "$GAMEDIR",
          "executable": "game",
          "name": "wineexec",
          "description": "Installing...",
          "args": "/VERYSILENT /SP- /NOCANCEL /SUPPRESSMSGBOXES"
        }
      },
      {
        "task": {
          "prefix": "GAMEDIR",
          "app": "dsound",
          "name": "winetricks"
        }
      },
      {
        "task": {
          "name": "set_regedit",
          "description": "Enable Windows 98 compatibility mode",
          "key": "Version",
          "prefix": "GAMEDIR",
          "value": "win98",
          "path": "HKEY_CURRENT_USER\\Software\\Wine"
        }
      }
    ]
  },
  "content": "files:\n- game: N/A:Please select the GOG.com Windows installer.\ngame:\n  exe: $GAMEDIR/drive_c/GOG Games/Star Wars - Rogue Squadron 3D/Launch Star Wars -\n    Rogue Squadron 3D.lnk\n  prefix: $GAMEDIR\n  working_dir: $GAMEDIR/drive_c/game\ninstaller:\n- task:\n    description: Creating Wine prefix\n    name: create_prefix\n    prefix: $GAMEDIR\n- task:\n    args: /VERYSILENT /SP- /NOCANCEL /SUPPRESSMSGBOXES\n    description: Installing...\n    executable: game\n    name: wineexec\n    prefix: $GAMEDIR\n- task:\n    app: dsound\n    name: winetricks\n    prefix: GAMEDIR\n- task:\n    description: Enable Windows 98 compatibility mode\n    key: Version\n    name: set_regedit\n    path: HKEY_CURRENT_USER\\Software\\Wine\n    prefix: GAMEDIR\n    value: win98\n"
}