{
  "id": 909,
  "game_id": 2954,
  "game_slug": "star-wars-rogue-squadron",
  "name": "Star Wars: Rogue Squadron",
  "year": 1998,
  "user": "med_freeman",
  "runner": "wine",
  "slug": "star-wars-rogue-squadron-cd-nglide-102",
  "version": "CD (nGlide 1.02)",
  "description": "CD Version with new installer",
  "notes": "",
  "created_at": "2014-10-01T10:29:15.625000Z",
  "updated_at": "2018-12-14T03:45:45.545337Z",
  "draft": false,
  "published": true,
  "published_by": 1,
  "rating": "",
  "steamid": null,
  "gogid": null,
  "gogslug": "",
  "humblestoreid": "",
  "script": {
    "game": {
      "exe": "drive_c/Program Files/LucasArts/ROGUE/ROGUE.EXE",
      "arch": "win32",
      "prefix": "GAMEDIR"
    },
    "installer": [
      {
        "insert-disc": {
          "message": "Insert the Rogue Squadron CD to continue",
          "requires": "rogue"
        }
      },
      {
        "task": {
          "executable": "${rogue-installer}",
          "args": "/nocdprompt",
          "description": "Installing Rogue Squadron",
          "prefix": "GAMEDIR",
          "name": "wineexec"
        }
      },
      {
        "task": {
          "app": "dsound",
          "prefix": "GAMEDIR",
          "name": "winetricks"
        }
      },
      {
        "task": {
          "path": "HKEY_CURRENT_USER\\Software\\Wine",
          "description": "Enable Windows 98 compatibility mode",
          "prefix": "GAMEDIR",
          "name": "set_regedit",
          "value": "win98",
          "key": "Version"
        }
      }
    ],
    "files": [
      {
        "rogue-installer": "http://github.com/medfreeman/RogueSquadron3DInstaller/raw/master/RS3DInstaller-0.96_nglide_102.exe"
      }
    ]
  },
  "content": "files:\n- rogue-installer: http://github.com/medfreeman/RogueSquadron3DInstaller/raw/master/RS3DInstaller-0.96_nglide_102.exe\ngame:\n  arch: win32\n  exe: drive_c/Program Files/LucasArts/ROGUE/ROGUE.EXE\n  prefix: GAMEDIR\ninstaller:\n- insert-disc:\n    message: Insert the Rogue Squadron CD to continue\n    requires: rogue\n- task:\n    args: /nocdprompt\n    description: Installing Rogue Squadron\n    executable: ${rogue-installer}\n    name: wineexec\n    prefix: GAMEDIR\n- task:\n    app: dsound\n    name: winetricks\n    prefix: GAMEDIR\n- task:\n    description: Enable Windows 98 compatibility mode\n    key: Version\n    name: set_regedit\n    path: HKEY_CURRENT_USER\\Software\\Wine\n    prefix: GAMEDIR\n    value: win98\n"
}