{
  "id": 21377,
  "game_id": 2852,
  "game_slug": "startopia",
  "name": "Startopia",
  "year": 2001,
  "user": "x_l_ours",
  "runner": "wine",
  "slug": "startopia-cddvd",
  "version": "CD/DVD",
  "description": "Startopia is a real-time strategy/city management game. Set in a post-apocalyptic future, it is your job to rebuild the once-thriving network of space-stations. You must compete against several other enterprises, using economic and military means to expand your power.",
  "notes": "",
  "created_at": "2020-06-10T19:37:10.788000Z",
  "updated_at": "2020-06-11T14:57:07.853855Z",
  "draft": false,
  "published": true,
  "published_by": 20548,
  "rating": "",
  "steamid": 243040,
  "gogid": 1207659100,
  "gogslug": "startopia",
  "humbleid": "",
  "humblestoreid": "",
  "humblestoreid_real": "",
  "script": {
    "arch": "win32",
    "exe": "prefix/drive_c/Program Files/Eidos Interactive/Mucky Foot/Startopia/Startopia.exe",
    "game": {
      "arch": "win32",
      "prefix": "$GAMEDIR/prefix"
    },
    "installer": [
      {
        "task": {
          "app": "winxp",
          "arch": "win32",
          "description": "Setting Windows Version to XP",
          "name": "winetricks",
          "prefix": "$GAMEDIR/prefix"
        }
      },
      {
        "task": {
          "arch": "win32",
          "description": "Creating Wine Prefix",
          "name": "create_prefix",
          "prefix": "$GAMEDIR/prefix"
        }
      },
      {
        "task": {
          "app": "directmusic",
          "arch": "win32",
          "description": "Installing Direct Music",
          "name": "winetricks",
          "prefix": "$GAMEDIR/prefix"
        }
      },
      {
        "task": {
          "app": "directplay",
          "arch": "win32",
          "description": "Installing Direct Play",
          "name": "winetricks",
          "prefix": "$GAMEDIR/prefix"
        }
      },
      {
        "task": {
          "app": "d3dx9_36",
          "arch": "win32",
          "description": "Installing DirectX 9",
          "name": "winetricks",
          "prefix": "$GAMEDIR/prefix"
        }
      },
      {
        "insert-disc": {
          "requires": "autoRun.exe"
        }
      },
      {
        "task": {
          "executable": "$DISC/autoRun.exe",
          "name": "wineexec",
          "prefix": "$GAMEDIR/prefix"
        }
      },
      {
        "task": {
          "app": "winxp",
          "arch": "win32",
          "description": "Setting Windows Version to XP",
          "name": "winetricks",
          "prefix": "$GAMEDIR/prefix"
        }
      }
    ]
  },
  "content": "arch: win32\nexe: prefix/drive_c/Program Files/Eidos Interactive/Mucky Foot/Startopia/Startopia.exe\ngame:\n  arch: win32\n  prefix: $GAMEDIR/prefix\ninstaller:\n- task:\n    app: winxp\n    arch: win32\n    description: Setting Windows Version to XP\n    name: winetricks\n    prefix: $GAMEDIR/prefix\n- task:\n    arch: win32\n    description: Creating Wine Prefix\n    name: create_prefix\n    prefix: $GAMEDIR/prefix\n- task:\n    app: directmusic\n    arch: win32\n    description: Installing Direct Music\n    name: winetricks\n    prefix: $GAMEDIR/prefix\n- task:\n    app: directplay\n    arch: win32\n    description: Installing Direct Play\n    name: winetricks\n    prefix: $GAMEDIR/prefix\n- task:\n    app: d3dx9_36\n    arch: win32\n    description: Installing DirectX 9\n    name: winetricks\n    prefix: $GAMEDIR/prefix\n- insert-disc:\n    requires: autoRun.exe\n- task:\n    executable: $DISC/autoRun.exe\n    name: wineexec\n    prefix: $GAMEDIR/prefix\n- task:\n    app: winxp\n    arch: win32\n    description: Setting Windows Version to XP\n    name: winetricks\n    prefix: $GAMEDIR/prefix\n"
}