{
  "id": 15775,
  "game_id": 5826,
  "game_slug": "diablo",
  "name": "Diablo",
  "year": 1996,
  "user": "legluondunet",
  "runner": "wine",
  "slug": "diablo-gog",
  "version": "GOG",
  "description": "This script will install \"Diablo\" and his extension \"Hellfire\" GOG edition.During install please let all options by default.Thanks to the people who contributed to play this game in the best conditions.",
  "notes": "- Please report issue concerning this script on my github page:\r\nhttps://github.com/legluondunet/MyLittleLutrisScripts/",
  "created_at": "2019-09-24T22:15:58.119000Z",
  "updated_at": "2019-09-25T14:31:55.516465Z",
  "draft": false,
  "published": false,
  "published_by": 494,
  "rating": "",
  "steamid": null,
  "gogid": 1412601690,
  "gogslug": "diablo",
  "humblestoreid": "",
  "script": {
    "files": [
      {
        "installer": "N/A:Select the game's setup file"
      }
    ],
    "game": {
      "prefix": "$GAMEDIR",
      "arch": "win64",
      "exe": "$GAMEDIR/drive_c/GOG Games/Diablo/dx/DiabloLauncher.exe"
    },
    "installer": [
      {
        "task": {
          "description": "Creating WINE prefix",
          "name": "create_prefix",
          "arch": "win64",
          "prefix": "$GAMEDIR"
        }
      },
      {
        "task": {
          "args": "/SILENT /SUPPRESSMSGBOXES",
          "name": "wineexec",
          "executable": "installer",
          "description": "Running Setup, please wait...",
          "prefix": "$GAMEDIR"
        }
      },
      {
        "task": {
          "name": "set_regedit",
          "arch": "win64",
          "key": "background",
          "prefix": "$GAMEDIR",
          "path": "HKEY_CURRENT_USER\\Control Panel\\Colors\\",
          "value": "0 0 0",
          "type": "REG_SZ"
        }
      },
      {
        "task": {
          "name": "set_regedit",
          "arch": "win64",
          "key": "ddraw",
          "prefix": "$GAMEDIR",
          "path": "HKEY_CURRENT_USER\\Software\\Wine\\DllOverrides\\",
          "value": "native,builtin",
          "type": "REG_SZ"
        }
      }
    ],
    "wine": {
      "Desktop": true
    },
    "custom-name": "Diablo - GOG"
  },
  "content": "custom-name: Diablo - GOG\r\nfiles:\r\n- installer: N/A:Select the game's setup file\r\ngame:\r\n  arch: win64\r\n  exe: $GAMEDIR/drive_c/GOG Games/Diablo/dx/DiabloLauncher.exe\r\n  prefix: $GAMEDIR\r\ninstaller:\r\n- task:\r\n    arch: win64\r\n    description: Creating WINE prefix\r\n    name: create_prefix\r\n    prefix: $GAMEDIR\r\n- task:\r\n    args: /SILENT /SUPPRESSMSGBOXES\r\n    description: Running Setup, please wait...\r\n    executable: installer\r\n    name: wineexec\r\n    prefix: $GAMEDIR\r\n- task:\r\n    arch: win64\r\n    key: background\r\n    name: set_regedit\r\n    path: HKEY_CURRENT_USER\\Control Panel\\Colors\\\r\n    prefix: $GAMEDIR\r\n    type: REG_SZ\r\n    value: 0 0 0\r\n- task:\r\n    arch: win64\r\n    key: ddraw\r\n    name: set_regedit\r\n    path: HKEY_CURRENT_USER\\Software\\Wine\\DllOverrides\\\r\n    prefix: $GAMEDIR\r\n    type: REG_SZ\r\n    value: native,builtin\r\nwine:\r\n  Desktop: true"
}