{
  "id": 2242,
  "game_id": 6491,
  "game_slug": "raiden-iv-overkill",
  "name": "Raiden IV: Overkill",
  "year": 2013,
  "user": "ssf",
  "runner": "wine",
  "slug": "raiden-iv-overkill-gogcom",
  "version": "GOG.com",
  "description": null,
  "notes": "note if the game has a black screen, reinstall vcrun2012 and set the correct dll overrides",
  "created_at": "2016-07-03T17:54:02.673917Z",
  "updated_at": "2018-06-22T16:44:28.879539Z",
  "draft": false,
  "published": true,
  "published_by": null,
  "rating": "",
  "steamid": 323460,
  "gogid": 1445524380,
  "gogslug": "raiden_iv_overkill",
  "humblestoreid": "",
  "script": {
    "game": {
      "exe": "drive_c/game/game.exe",
      "arch": "win32",
      "prefix": "$GAMEDIR"
    },
    "gogid": "raiden_iv_overkill",
    "installer": [
      {
        "task": {
          "description": "Creating Wine prefix",
          "prefix": "$GAMEDIR",
          "name": "create_prefix"
        }
      },
      {
        "task": {
          "app": "vcrun2012",
          "silent": false,
          "description": "Disabling unused WINE features",
          "prefix": "$GAMEDIR",
          "name": "winetricks"
        }
      },
      {
        "task": {
          "app": "vcrun2013",
          "silent": false,
          "description": "Disabling unused WINE features",
          "prefix": "$GAMEDIR",
          "name": "winetricks"
        }
      },
      {
        "task": {
          "executable": "game",
          "args": "/DIR=C:/game",
          "description": "Installing Raiden IV",
          "prefix": "$GAMEDIR",
          "name": "wineexec"
        }
      },
      {
        "task": {
          "app": "sandbox",
          "silent": true,
          "description": "Disabling unused WINE features",
          "prefix": "$GAMEDIR",
          "name": "winetricks"
        }
      }
    ],
    "files": [
      {
        "game": "N/A:Please select the GOG.com Windows installer."
      }
    ]
  },
  "content": "files:\r\n- game: N/A:Please select the GOG.com Windows installer.\r\ngame:\r\n  arch: win32\r\n  exe: drive_c/game/game.exe\r\n  prefix: $GAMEDIR\r\ngogid: raiden_iv_overkill\r\ninstaller:\r\n- task:\r\n    description: Creating Wine prefix\r\n    name: create_prefix\r\n    prefix: $GAMEDIR\r\n- task:\r\n    app: vcrun2012\r\n    description: Disabling unused WINE features\r\n    name: winetricks\r\n    prefix: $GAMEDIR\r\n    silent: false\r\n- task:\r\n    app: vcrun2013\r\n    description: Disabling unused WINE features\r\n    name: winetricks\r\n    prefix: $GAMEDIR\r\n    silent: false\r\n- task:\r\n    args: '/DIR=C:/game'\r\n    description: Installing Raiden IV\r\n    executable: game\r\n    name: wineexec\r\n    prefix: $GAMEDIR\r\n- task:\r\n    app: sandbox\r\n    description: Disabling unused WINE features\r\n    name: winetricks\r\n    prefix: $GAMEDIR\r\n    silent: true"
}