{
  "id": 7513,
  "game_id": 6300,
  "game_slug": "pathologic-classic-hd",
  "name": "Pathologic Classic HD",
  "year": null,
  "user": "mrwils",
  "runner": "winesteam",
  "slug": "pathologic-classic-hd-steam",
  "version": "Steam",
  "description": null,
  "notes": "",
  "created_at": "2018-03-13T09:11:37.712000Z",
  "updated_at": "2019-06-12T04:28:51.567363Z",
  "draft": false,
  "published": true,
  "published_by": 19464,
  "rating": "",
  "steamid": 384110,
  "gogid": 1445852217,
  "gogslug": "pathologic_classic_hd",
  "humblestoreid": "",
  "script": {
    "game": {
      "prefix": "$GAMEDIR/prefix",
      "appid": 384110,
      "arch": "win32"
    },
    "files": [
      {
        "codecs": "https://lutris.net/files/tools/windowsmedia-kb942423-x86-intl.exe"
      }
    ],
    "installer": [
      {
        "task": {
          "prefix": "$GAMEDIR/prefix",
          "arch": "win32",
          "name": "create_prefix"
        }
      },
      {
        "task": {
          "description": "Installing corefonts",
          "arch": "win32",
          "prefix": "$GAMEDIR/prefix",
          "name": "winetricks",
          "app": "corefonts"
        }
      },
      {
        "task": {
          "description": "Installing DirectX components",
          "arch": "win32",
          "prefix": "$GAMEDIR/prefix",
          "name": "winetricks",
          "app": "d3dcompiler_43"
        }
      },
      {
        "task": {
          "description": "Installing DirectX components",
          "arch": "win32",
          "prefix": "$GAMEDIR/prefix",
          "name": "winetricks",
          "app": "d3dx9"
        }
      },
      {
        "task": {
          "description": "Installing devenum",
          "arch": "win32",
          "prefix": "$GAMEDIR/prefix",
          "name": "winetricks",
          "app": "devenum"
        }
      },
      {
        "task": {
          "description": "Installing quartz",
          "arch": "win32",
          "prefix": "$GAMEDIR/prefix",
          "name": "winetricks",
          "app": "quartz"
        }
      },
      {
        "task": {
          "description": "Installing tahoma",
          "arch": "win32",
          "prefix": "$GAMEDIR/prefix",
          "name": "winetricks",
          "app": "tahoma"
        }
      },
      {
        "task": {
          "description": "Installing Windows Media Player 9",
          "arch": "win32",
          "prefix": "$GAMEDIR/prefix",
          "name": "winetricks",
          "app": "wmp9"
        }
      },
      {
        "task": {
          "description": "Installing Windows Media Player 10",
          "arch": "win32",
          "prefix": "$GAMEDIR/prefix",
          "name": "winetricks",
          "app": "wmp10"
        }
      },
      {
        "task": {
          "name": "wineexec",
          "args": "/q",
          "description": "Installing video codecs",
          "prefix": "$GAMEDIR/prefix",
          "executable": "codecs",
          "arch": "win32"
        }
      }
    ]
  },
  "content": "files:\n- codecs: https://lutris.net/files/tools/windowsmedia-kb942423-x86-intl.exe\ngame:\n  appid: 384110\n  arch: win32\n  prefix: $GAMEDIR/prefix\ninstaller:\n- task:\n    arch: win32\n    name: create_prefix\n    prefix: $GAMEDIR/prefix\n- task:\n    app: corefonts\n    arch: win32\n    description: Installing corefonts\n    name: winetricks\n    prefix: $GAMEDIR/prefix\n- task:\n    app: d3dcompiler_43\n    arch: win32\n    description: Installing DirectX components\n    name: winetricks\n    prefix: $GAMEDIR/prefix\n- task:\n    app: d3dx9\n    arch: win32\n    description: Installing DirectX components\n    name: winetricks\n    prefix: $GAMEDIR/prefix\n- task:\n    app: devenum\n    arch: win32\n    description: Installing devenum\n    name: winetricks\n    prefix: $GAMEDIR/prefix\n- task:\n    app: quartz\n    arch: win32\n    description: Installing quartz\n    name: winetricks\n    prefix: $GAMEDIR/prefix\n- task:\n    app: tahoma\n    arch: win32\n    description: Installing tahoma\n    name: winetricks\n    prefix: $GAMEDIR/prefix\n- task:\n    app: wmp9\n    arch: win32\n    description: Installing Windows Media Player 9\n    name: winetricks\n    prefix: $GAMEDIR/prefix\n- task:\n    app: wmp10\n    arch: win32\n    description: Installing Windows Media Player 10\n    name: winetricks\n    prefix: $GAMEDIR/prefix\n- task:\n    arch: win32\n    args: /q\n    description: Installing video codecs\n    executable: codecs\n    name: wineexec\n    prefix: $GAMEDIR/prefix\n"
}