{
  "id": 18281,
  "game_id": 84,
  "game_slug": "assault-cube",
  "name": "AssaultCube",
  "year": 2013,
  "user": "vanstaveren",
  "runner": "wine",
  "slug": "assaultcube-12-vulkan",
  "version": "1.2-vulkan",
  "description": null,
  "notes": "",
  "created_at": "2020-02-08T21:33:07.208091Z",
  "updated_at": "2020-02-08T21:33:07.208116Z",
  "draft": false,
  "published": false,
  "published_by": null,
  "rating": "",
  "steamid": null,
  "gogid": null,
  "gogslug": "",
  "humblestoreid": "",
  "script": {
    "files": [
      {
        "AssaultCube": "https://github.com/assaultcube/AC/releases/download/v1.2.0.2/AssaultCube_v1.2.0.2.exe"
      }
    ],
    "installer": [
      {
        "task": {
          "description": "Creating 64-bit prefix ...",
          "name": "create_prefix",
          "arch": "win64",
          "prefix": "$GAMEDIR/prefix"
        }
      },
      {
        "move": {
          "dst": "$GAMEDIR/prefix/drive_c/",
          "src": "AssaultCube"
        }
      },
      {
        "task": {
          "description": "AssaultCube 1.2 ...",
          "name": "wineexec",
          "executable": "$GAMEDIR/prefix/drive_c/AssaultCube_v1.2.0.2.exe",
          "prefix": "$GAMEDIR/prefix"
        }
      },
      {
        "task": {
          "description": "DirectX 11 ...",
          "name": "winetricks",
          "arch": "win64",
          "app": "d3dcompiler_43",
          "prefix": "$GAMEDIR/prefix"
        }
      },
      {
        "task": {
          "description": "DirectX 11 ...",
          "name": "winetricks",
          "arch": "win64",
          "app": "d3dx11_43",
          "prefix": "$GAMEDIR/prefix"
        }
      },
      {
        "task": {
          "description": "Vulkan ...",
          "name": "winetricks",
          "arch": "win64",
          "app": "dxvk",
          "prefix": "$GAMEDIR/prefix"
        }
      },
      {
        "task": {
          "description": "Windows version 8 ...",
          "name": "winetricks",
          "arch": "win64",
          "app": "win8",
          "prefix": "$GAMEDIR/prefix"
        }
      }
    ],
    "game": {
      "prefix": "$GAMEDIR/prefix",
      "arch": "win64",
      "exe": "$GAMEDIR/prefix/drive_c/Program Files (x86)/AssaultCube/assaultcube.bat",
      "custom-name": "AssaultCube"
    },
    "system": {
      "disable_compositor": true,
      "xboxdrv": "xboxdrv",
      "pulse_latency": true
    },
    "wine": {
      "Audio": "pulse",
      "dxvk": true,
      "version": "ge-protonified-nofshack-4.9-x86_64",
      "esync": true,
      "overrides": {
        "winedbg.exe": "d"
      }
    }
  },
  "content": "files:\n- AssaultCube: https://github.com/assaultcube/AC/releases/download/v1.2.0.2/AssaultCube_v1.2.0.2.exe\ngame:\n  arch: win64\n  custom-name: AssaultCube\n  exe: $GAMEDIR/prefix/drive_c/Program Files (x86)/AssaultCube/assaultcube.bat\n  prefix: $GAMEDIR/prefix\ninstaller:\n- task:\n    arch: win64\n    description: Creating 64-bit prefix ...\n    name: create_prefix\n    prefix: $GAMEDIR/prefix\n- move:\n    dst: $GAMEDIR/prefix/drive_c/\n    src: AssaultCube\n- task:\n    description: AssaultCube 1.2 ...\n    executable: $GAMEDIR/prefix/drive_c/AssaultCube_v1.2.0.2.exe\n    name: wineexec\n    prefix: $GAMEDIR/prefix\n- task:\n    app: d3dcompiler_43\n    arch: win64\n    description: DirectX 11 ...\n    name: winetricks\n    prefix: $GAMEDIR/prefix\n- task:\n    app: d3dx11_43\n    arch: win64\n    description: DirectX 11 ...\n    name: winetricks\n    prefix: $GAMEDIR/prefix\n- task:\n    app: dxvk\n    arch: win64\n    description: Vulkan ...\n    name: winetricks\n    prefix: $GAMEDIR/prefix\n- task:\n    app: win8\n    arch: win64\n    description: Windows version 8 ...\n    name: winetricks\n    prefix: $GAMEDIR/prefix\nsystem:\n  disable_compositor: true\n  pulse_latency: true\n  xboxdrv: xboxdrv\nwine:\n  Audio: pulse\n  dxvk: true\n  esync: true\n  overrides:\n    winedbg.exe: d\n  version: ge-protonified-nofshack-4.9-x86_64\n"
}