{
  "id": 16256,
  "game_id": 29776,
  "game_slug": "4story",
  "name": "4Story",
  "year": 2009,
  "user": "rainken",
  "runner": "wine",
  "slug": "4story-gameforge",
  "version": "Gameforge",
  "description": null,
  "notes": "",
  "created_at": "2019-10-17T10:25:44.730986Z",
  "updated_at": "2020-04-19T07:27:05.233639Z",
  "draft": true,
  "published": true,
  "published_by": null,
  "rating": "",
  "steamid": null,
  "gogid": null,
  "gogslug": "",
  "humbleid": "",
  "humblestoreid": "",
  "humblestoreid_real": "",
  "script": {
    "files": [
      {
        "4story_installer": "https://pl.4story.gameforge.com/game/downloadclient"
      }
    ],
    "game": {
      "arch": "win32",
      "exe": "$GAMEDIR/drive_c/Program Files/GameforgeLive/GameforgeLive.exe",
      "prefix": "$GAMEDIR"
    },
    "installer": [
      {
        "task": {
          "arch": "win32",
          "description": "Setting prefix for game.",
          "name": "create_prefix",
          "prefix": "$GAMEDIR"
        }
      },
      {
        "task": {
          "app": "win7",
          "arch": "win32",
          "description": "Setting Wine to Windows 7 32-Bit",
          "name": "winetricks",
          "prefix": "$GAMEDIR"
        }
      },
      {
        "task": {
          "arch": "win32",
          "description": "Please don't change default game install path .",
          "executable": "4story_installer",
          "name": "wineexec",
          "prefix": "$GAMEDIR"
        }
      },
      {
        "task": {
          "arch": "win32",
          "name": "winekill",
          "prefix": "$GAMEDIR"
        }
      }
    ]
  },
  "content": "files:\n- 4story_installer: https://pl.4story.gameforge.com/game/downloadclient\ngame:\n  arch: win32\n  exe: $GAMEDIR/drive_c/Program Files/GameforgeLive/GameforgeLive.exe\n  prefix: $GAMEDIR\ninstaller:\n- task:\n    arch: win32\n    description: Setting prefix for game.\n    name: create_prefix\n    prefix: $GAMEDIR\n- task:\n    app: win7\n    arch: win32\n    description: Setting Wine to Windows 7 32-Bit\n    name: winetricks\n    prefix: $GAMEDIR\n- task:\n    arch: win32\n    description: Please don't change default game install path .\n    executable: 4story_installer\n    name: wineexec\n    prefix: $GAMEDIR\n- task:\n    arch: win32\n    name: winekill\n    prefix: $GAMEDIR\n"
}