{
  "id": 3031,
  "game_id": 8483,
  "game_slug": "bethesda-launcher",
  "name": "Bethesda Launcher",
  "year": 2015,
  "user": "RobLoach",
  "runner": "wine",
  "slug": "bethesda-launcher-latest-w-dxvk",
  "version": "Latest w/ DXVK",
  "description": null,
  "notes": "Included is a script named <tt>helper.sh</tt>, placed in the launcher folder, it's used to workaround an issue with installing and updating games. \r\n\r\nIt's located in Bethesda Launcher folder <tt>$GAMEDIR/drive_c/Program Files (x86)/Bethesda.Net Launcher</tt>\r\n\r\nTo use: Install your game through the launcher and wait for the error, open a terminal, <tt>cd</tt> into your Bethesda.net Launcher folder, and run <tt>./helper.sh</tt>. Install your game.",
  "created_at": "2016-11-21T06:36:28.101000Z",
  "updated_at": "2020-04-15T20:37:00.403468Z",
  "draft": false,
  "published": true,
  "published_by": 494,
  "rating": "",
  "steamid": null,
  "gogid": null,
  "gogslug": "",
  "humblestoreid": "",
  "script": {
    "files": [
      {
        "setup": "https://download.cdp.bethesda.net/BethesdaNetLauncher_Setup.exe"
      }
    ],
    "game": {
      "prefix": "$GAMEDIR",
      "exe": "drive_c/Program Files (x86)/Bethesda.net Launcher/BethesdaNetLauncher.exe",
      "arch": "win64",
      "working_dir": "$GAMEDIR/drive_c/Program Files (x86)/Bethesda.net Launcher"
    },
    "wine": {
      "dxvk": true
    },
    "system": {
      "env": {
        "DXVK_HUD": 0
      }
    },
    "installer": [
      {
        "task": {
          "prefix": "$GAMEDIR",
          "arch": "win64",
          "name": "create_prefix"
        }
      },
      {
        "task": {
          "prefix": "$GAMEDIR",
          "arch": "win64",
          "app": "vcrun2012 corefonts win7",
          "name": "winetricks"
        }
      },
      {
        "task": {
          "arch": "win64",
          "name": "set_regedit",
          "key": "GrabFullscreen",
          "prefix": "$GAMEDIR",
          "value": "Y",
          "path": "HKEY_CURRENT_USER\\Software\\Wine\\X11 Driver",
          "type": "REG_SZ"
        }
      },
      {
        "task": {
          "arch": "win64",
          "exclude_processes": "BethesdaNetLauncher.exe",
          "name": "wineexec",
          "description": "Installing Bethesda.Net launcher, please do not sign in, the launcher will shortly close after being launched. If not, you can safely close it, and wait for the end of the installation.",
          "args": "/silent",
          "prefix": "$GAMEDIR",
          "executable": "setup"
        }
      }
    ]
  },
  "content": "files:\n- setup: https://download.cdp.bethesda.net/BethesdaNetLauncher_Setup.exe\ngame:\n  arch: win64\n  exe: drive_c/Program Files (x86)/Bethesda.net Launcher/BethesdaNetLauncher.exe\n  prefix: $GAMEDIR\n  working_dir: $GAMEDIR/drive_c/Program Files (x86)/Bethesda.net Launcher\ninstaller:\n- task:\n    arch: win64\n    name: create_prefix\n    prefix: $GAMEDIR\n- task:\n    app: vcrun2012 corefonts win7\n    arch: win64\n    name: winetricks\n    prefix: $GAMEDIR\n- task:\n    arch: win64\n    key: GrabFullscreen\n    name: set_regedit\n    path: HKEY_CURRENT_USER\\Software\\Wine\\X11 Driver\n    prefix: $GAMEDIR\n    type: REG_SZ\n    value: Y\n- task:\n    arch: win64\n    args: /silent\n    description: Installing Bethesda.Net launcher, please do not sign in, the launcher\n      will shortly close after being launched. If not, you can safely close it, and\n      wait for the end of the installation.\n    exclude_processes: BethesdaNetLauncher.exe\n    executable: setup\n    name: wineexec\n    prefix: $GAMEDIR\nsystem:\n  env:\n    DXVK_HUD: 0\nwine:\n  dxvk: true\n"
}