{
  "id": 18615,
  "game_id": 12,
  "game_slug": "openarena",
  "name": "OpenArena",
  "year": 2005,
  "user": "vanstaveren",
  "runner": "wine",
  "slug": "openarena-088-vulkan",
  "version": "0.8.8-vulkan",
  "description": null,
  "notes": "",
  "created_at": "2020-02-29T23:53:43.059249Z",
  "updated_at": "2020-02-29T23:53:43.059275Z",
  "draft": false,
  "published": false,
  "published_by": null,
  "rating": "",
  "steamid": null,
  "gogid": null,
  "gogslug": "",
  "humblestoreid": "",
  "script": {
    "game": {
      "custom-name": "OpenArena",
      "arch": "win64",
      "prefix": "$GAMEDIR/prefix",
      "exe": "$GAMEDIR/prefix/drive_c/Program Files/openarena.exe"
    },
    "system": {
      "disable_compositor": true,
      "pulse_latency": true,
      "xboxdrv": "xboxdrv"
    },
    "wine": {
      "esync": true,
      "Audio": "pulse",
      "version": "ge-protonified-nofshack-4.9-x86_64",
      "overrides": {
        "winedbg.exe": "d"
      },
      "dxvk": true
    },
    "installer": [
      {
        "task": {
          "arch": "win64",
          "description": "Creating 64-bit prefix ...",
          "prefix": "$GAMEDIR/prefix",
          "name": "create_prefix"
        }
      },
      {
        "extract": {
          "dst": "$GAMEDIR/prefix/drive_c/Program Files/",
          "src": "OpenArena.zip"
        }
      },
      {
        "task": {
          "app": "d3dcompiler_43",
          "arch": "win64",
          "description": "DirectX 11 ...",
          "prefix": "$GAMEDIR/prefix",
          "name": "winetricks"
        }
      },
      {
        "task": {
          "app": "d3dx11_43",
          "arch": "win64",
          "description": "DirectX 11 ...",
          "prefix": "$GAMEDIR/prefix",
          "name": "winetricks"
        }
      },
      {
        "task": {
          "app": "dxvk",
          "arch": "win64",
          "description": "Vulkan ...",
          "prefix": "$GAMEDIR/prefix",
          "name": "winetricks"
        }
      },
      {
        "task": {
          "app": "win8",
          "arch": "win64",
          "description": "Windows version 8 ...",
          "prefix": "$GAMEDIR/prefix",
          "name": "winetricks"
        }
      }
    ],
    "files": [
      {
        "OpenArena.zip": "https://sourceforge.net/projects/oarena/files/latest/download/openarena-0.8.8.zip"
      }
    ]
  },
  "content": "files:\n- OpenArena.zip: https://sourceforge.net/projects/oarena/files/latest/download/openarena-0.8.8.zip\ngame:\n  arch: win64\n  custom-name: OpenArena\n  exe: $GAMEDIR/prefix/drive_c/Program Files/openarena.exe\n  prefix: $GAMEDIR/prefix\ninstaller:\n- task:\n    arch: win64\n    description: Creating 64-bit prefix ...\n    name: create_prefix\n    prefix: $GAMEDIR/prefix\n- extract:\n    dst: $GAMEDIR/prefix/drive_c/Program Files/\n    src: OpenArena.zip\n- task:\n    app: d3dcompiler_43\n    arch: win64\n    description: DirectX 11 ...\n    name: winetricks\n    prefix: $GAMEDIR/prefix\n- task:\n    app: d3dx11_43\n    arch: win64\n    description: DirectX 11 ...\n    name: winetricks\n    prefix: $GAMEDIR/prefix\n- task:\n    app: dxvk\n    arch: win64\n    description: Vulkan ...\n    name: winetricks\n    prefix: $GAMEDIR/prefix\n- task:\n    app: win8\n    arch: win64\n    description: Windows version 8 ...\n    name: winetricks\n    prefix: $GAMEDIR/prefix\nsystem:\n  disable_compositor: true\n  pulse_latency: true\n  xboxdrv: xboxdrv\nwine:\n  Audio: pulse\n  dxvk: true\n  esync: true\n  overrides:\n    winedbg.exe: d\n  version: ge-protonified-nofshack-4.9-x86_64\n"
}