{
  "id": 9592,
  "game_id": 15000,
  "game_slug": "south-park-the-fractured-but-whole",
  "name": "South Park The Fractured But Whole",
  "year": null,
  "user": "romulasry",
  "runner": "winesteam",
  "slug": "south-park-the-fractured-but-steam",
  "version": "Steam",
  "description": null,
  "notes": "",
  "created_at": "2018-08-05T09:03:43.547000Z",
  "updated_at": "2019-06-24T03:27:37.853096Z",
  "draft": false,
  "published": true,
  "published_by": 1,
  "rating": "1",
  "steamid": 488790,
  "gogid": null,
  "gogslug": "",
  "humblestoreid": "",
  "script": {
    "game": {
      "prefix": "$GAMEDIR/prefix",
      "appid": 488790,
      "arch": "win64"
    },
    "files": [
      {
        "dx2010": "https://lutris.net/files/tools/directx-2010.tar.gz"
      },
      {
        "uplay": "https://ubistatic3-a.akamaihd.net/orbit/launcher_installer/UplayInstaller.exe"
      }
    ],
    "system": {
      "disable_runtime": false,
      "env": {
        "DXVK_CONFIG_FILE": "$GAMEDIR/dxvk.conf",
        "DXVK_HUD": 0
      }
    },
    "installer": [
      {
        "task": {
          "prefix": "$GAMEDIR/prefix",
          "arch": "win64",
          "name": "create_prefix"
        }
      },
      {
        "write_config": {
          "section": "Max feature level",
          "value": "10_1",
          "key": "d3d11.maxFeatureLevel",
          "file": "$GAMEDIR/dxvk.conf"
        }
      },
      {
        "extract": {
          "dst": "$CACHE/dxsetup",
          "file": "dx2010"
        }
      },
      {
        "task": {
          "args": "/silent",
          "prefix": "$GAMEDIR/prefix",
          "executable": "$CACHE/dxsetup/DXSETUP.exe",
          "name": "wineexec",
          "arch": "win64"
        }
      },
      {
        "task": {
          "arch": "win64",
          "prefix": "$GAMEDIR/prefix",
          "name": "winetricks",
          "app": "vcrun2010 vcrun2012 corefonts win7"
        }
      },
      {
        "task": {
          "args": "/S",
          "prefix": "$GAMEDIR/prefix",
          "executable": "uplay",
          "name": "wineexec",
          "arch": "win64"
        }
      },
      {
        "task": {
          "prefix": "$GAMEDIR/prefix",
          "arch": "win64",
          "name": "winekill"
        }
      }
    ],
    "winesteam": {
      "esync": true,
      "dxvk": true,
      "version": "tkg-4.0-x86_64"
    }
  },
  "content": "files:\r\n- dx2010: https://lutris.net/files/tools/directx-2010.tar.gz\r\n- uplay: https://ubistatic3-a.akamaihd.net/orbit/launcher_installer/UplayInstaller.exe\r\ngame:\r\n  appid: 488790\r\n  arch: win64\r\n  prefix: $GAMEDIR/prefix\r\ninstaller:\r\n- task:\r\n    arch: win64\r\n    name: create_prefix\r\n    prefix: $GAMEDIR/prefix\r\n- write_config:\r\n    file: $GAMEDIR/dxvk.conf\r\n    key: d3d11.maxFeatureLevel\r\n    section: Max feature level\r\n    value: '10_1'\r\n- extract:\r\n    dst: $CACHE/dxsetup\r\n    file: dx2010\r\n- task:\r\n    arch: win64\r\n    args: /silent\r\n    executable: $CACHE/dxsetup/DXSETUP.exe\r\n    name: wineexec\r\n    prefix: $GAMEDIR/prefix\r\n- task:\r\n    app: vcrun2010 vcrun2012 corefonts win7\r\n    arch: win64\r\n    name: winetricks\r\n    prefix: $GAMEDIR/prefix\r\n- task:\r\n    arch: win64\r\n    args: /S\r\n    executable: uplay\r\n    name: wineexec\r\n    prefix: $GAMEDIR/prefix\r\n- task:\r\n    arch: win64\r\n    name: winekill\r\n    prefix: $GAMEDIR/prefix\r\nsystem:\r\n  disable_runtime: false\r\n  env:\r\n    DXVK_CONFIG_FILE: $GAMEDIR/dxvk.conf\r\n    DXVK_HUD: 0\r\nwinesteam:\r\n  dxvk: true\r\n  esync: true\r\n  version: tkg-4.0-x86_64"
}