{
  "id": 2702,
  "game_id": 7624,
  "game_slug": "garden-of-coloured-lights",
  "name": "Garden of coloured lights",
  "year": null,
  "user": "ssf",
  "runner": "wine",
  "slug": "garden-of-coloured-lights-108",
  "version": "1.0.8",
  "description": "",
  "notes": "",
  "created_at": "2016-09-07T19:17:36.980003Z",
  "updated_at": "2016-10-02T13:30:40.134211Z",
  "draft": false,
  "published": true,
  "published_by": null,
  "rating": "",
  "steamid": null,
  "gogid": null,
  "gogslug": "",
  "humblestoreid": "",
  "script": {
    "files": [
      {
        "game": "http://netix.dl.sourceforge.net/project/garden/garden/1.0.8/garden-1.0.8-RC.exe"
      }
    ],
    "game": {
      "arch": "win32",
      "exe": "drive_c/Program Files/garden/garden.exe",
      "prefix": "$GAMEDIR"
    },
    "installer": [
      {
        "task": {
          "description": "Creating Wine prefix",
          "name": "create_prefix",
          "prefix": "$GAMEDIR"
        }
      },
      {
        "task": {
          "key": "winemenubuilder.exe",
          "name": "set_regedit",
          "path": "HKEY_CURRENT_USER\\Software\\Wine\\DllOverrides",
          "prefix": "$GAMEDIR",
          "type": "REG_SZ",
          "value": ""
        }
      },
      {
        "task": {
          "args": "/S",
          "description": "Installing...",
          "executable": "game",
          "name": "wineexec",
          "prefix": "$GAMEDIR"
        }
      },
      {
        "task": {
          "app": "sandbox",
          "description": "Disabling unused WINE features",
          "name": "winetricks",
          "prefix": "$GAMEDIR",
          "silent": true
        }
      },
      {
        "task": {
          "app": "vd=640x480",
          "name": "winetricks",
          "prefix": "$GAMEDIR",
          "silent": true
        }
      }
    ],
    "system": {
      "use_us_layout": true
    }
  },
  "content": "files:\n- game: http://netix.dl.sourceforge.net/project/garden/garden/1.0.8/garden-1.0.8-RC.exe\ngame:\n  arch: win32\n  exe: drive_c/Program Files/garden/garden.exe\n  prefix: $GAMEDIR\ninstaller:\n- task:\n    description: Creating Wine prefix\n    name: create_prefix\n    prefix: $GAMEDIR\n- task:\n    key: winemenubuilder.exe\n    name: set_regedit\n    path: HKEY_CURRENT_USER\\Software\\Wine\\DllOverrides\n    prefix: $GAMEDIR\n    type: REG_SZ\n    value: ''\n- task:\n    args: /S\n    description: Installing...\n    executable: game\n    name: wineexec\n    prefix: $GAMEDIR\n- task:\n    app: sandbox\n    description: Disabling unused WINE features\n    name: winetricks\n    prefix: $GAMEDIR\n    silent: true\n- task:\n    app: vd=640x480\n    name: winetricks\n    prefix: $GAMEDIR\n    silent: true\nsystem:\n  use_us_layout: true\n"
}