{
  "id": 10036,
  "game_id": 418,
  "game_slug": "alan-wake",
  "name": "Alan Wake",
  "year": 2010,
  "user": "OsamaBinlada",
  "runner": "wine",
  "slug": "alan-wake-gog",
  "version": "GOG",
  "description": null,
  "notes": "",
  "created_at": "2018-09-04T08:35:14.516000Z",
  "updated_at": "2018-09-05T08:08:44.060586Z",
  "draft": false,
  "published": true,
  "published_by": null,
  "rating": "",
  "steamid": 108710,
  "gogid": 1207659037,
  "gogslug": "alan_wake",
  "humblestoreid": "",
  "script": {
    "game": {
      "arch": "win32",
      "prefix": "$GAMEDIR",
      "exe": "$GAMEDIR/drive_c/GOG Games/Alan Wake/alanwake.exe"
    },
    "wine": {
      "dxvk": false
    },
    "files": [
      {
        "install": "N/A:Select the Windows setup file downloaded from GOG"
      }
    ],
    "installer": [
      {
        "task": {
          "arch": "win32",
          "prefix": "$GAMEDIR",
          "description": "Installing d3dcompiler_43",
          "name": "winetricks",
          "app": "d3dcompiler_43"
        }
      },
      {
        "task": {
          "arch": "win32",
          "prefix": "$GAMEDIR",
          "description": "Installing d3dx9",
          "name": "winetricks",
          "app": "d3dx9"
        }
      },
      {
        "task": {
          "arch": "win32",
          "prefix": "$GAMEDIR",
          "description": "Installing gdiplus",
          "name": "winetricks",
          "app": "gdiplus"
        }
      },
      {
        "task": {
          "arch": "win32",
          "prefix": "$GAMEDIR",
          "description": "Installing vcrun2005",
          "name": "winetricks",
          "app": "vcrun2005"
        }
      },
      {
        "task": {
          "arch": "win32",
          "prefix": "$GAMEDIR",
          "description": "Installing xact",
          "name": "winetricks",
          "app": "xact"
        }
      },
      {
        "task": {
          "arch": "win32",
          "executable": "install",
          "prefix": "$GAMEDIR",
          "description": "Installing the Game",
          "name": "wineexec"
        }
      }
    ]
  },
  "content": "files:\n- install: N/A:Select the Windows setup file downloaded from GOG\ngame:\n  arch: win32\n  exe: $GAMEDIR/drive_c/GOG Games/Alan Wake/alanwake.exe\n  prefix: $GAMEDIR\ninstaller:\n- task:\n    app: d3dcompiler_43\n    arch: win32\n    description: Installing d3dcompiler_43\n    name: winetricks\n    prefix: $GAMEDIR\n- task:\n    app: d3dx9\n    arch: win32\n    description: Installing d3dx9\n    name: winetricks\n    prefix: $GAMEDIR\n- task:\n    app: gdiplus\n    arch: win32\n    description: Installing gdiplus\n    name: winetricks\n    prefix: $GAMEDIR\n- task:\n    app: vcrun2005\n    arch: win32\n    description: Installing vcrun2005\n    name: winetricks\n    prefix: $GAMEDIR\n- task:\n    app: xact\n    arch: win32\n    description: Installing xact\n    name: winetricks\n    prefix: $GAMEDIR\n- task:\n    arch: win32\n    description: Installing the Game\n    executable: install\n    name: wineexec\n    prefix: $GAMEDIR\nwine:\n  dxvk: false\n"
}