{
  "id": 14269,
  "game_id": 26657,
  "game_slug": "juiced",
  "name": "Juiced",
  "year": 2005,
  "user": "Jungledede",
  "runner": "wine",
  "slug": "juiced-dvd",
  "version": "DVD",
  "description": null,
  "notes": "",
  "created_at": "2019-06-23T14:17:18.567469Z",
  "updated_at": "2019-06-23T14:17:18.567498Z",
  "draft": true,
  "published": false,
  "published_by": null,
  "rating": "",
  "steamid": null,
  "gogid": null,
  "gogslug": "",
  "humbleid": "",
  "humblestoreid": "",
  "humblestoreid_real": "",
  "script": {
    "script": {
      "files": [
        {
          "installer": "N/A:Select the game's setup file"
        }
      ],
      "game": {
        "arch": "win64",
        "exe": "$GAMEDIR/Juiced.exe",
        "prefix": "$GAMEDIR",
        "working_dir": "$GAMEDIR"
      },
      "installer": [
        {
          "task": {
            "arch": "win32",
            "description": "Creating Wine Prefix...",
            "name": "create_prefix",
            "prefix": "$GAMEDIR"
          }
        },
        {
          "task": {
            "app": "nocrashdialog",
            "arch": "win32",
            "description": "Hiding crash dialogs...",
            "name": "winetricks",
            "prefix": "$GAMEDIR",
            "silent": "true"
          }
        },
        {
          "task": {
            "arch": "win32",
            "description": "Setting version to xp...",
            "key": "Version",
            "name": "set_regedit",
            "path": "HKEY_CURRENT_USER\\Software\\Wine",
            "prefix": "$GAMEDIR",
            "value": "winxp"
          }
        },
        {
          "task": {
            "arch": "win32",
            "executable": "installer",
            "name": "wineexec",
            "prefix": "$GAMEDIR"
          }
        }
      ],
      "wine": {
        "Desktop": true,
        "WineDesktop": "1024x768"
      }
    }
  },
  "content": "script:\n  files:\n  - installer: N/A:Select the game's setup file\n  game:\n    arch: win64\n    exe: $GAMEDIR/Juiced.exe\n    prefix: $GAMEDIR\n    working_dir: $GAMEDIR\n  installer:\n  - task:\n      arch: win32\n      description: Creating Wine Prefix...\n      name: create_prefix\n      prefix: $GAMEDIR\n  - task:\n      app: nocrashdialog\n      arch: win32\n      description: Hiding crash dialogs...\n      name: winetricks\n      prefix: $GAMEDIR\n      silent: 'true'\n  - task:\n      arch: win32\n      description: Setting version to xp...\n      key: Version\n      name: set_regedit\n      path: HKEY_CURRENT_USER\\Software\\Wine\n      prefix: $GAMEDIR\n      value: winxp\n  - task:\n      arch: win32\n      executable: installer\n      name: wineexec\n      prefix: $GAMEDIR\n  wine:\n    Desktop: true\n    WineDesktop: 1024x768\n"
}