{
  "id": 20007,
  "game_id": 5393,
  "game_slug": "worms-world-party-remastered",
  "name": "Worms World Party Remastered",
  "year": 2015,
  "user": "Sungazer",
  "runner": "wine",
  "slug": "worms-world-party-remastered-gog",
  "version": "GOG",
  "description": "Do not change install directory during installation",
  "notes": "/SILENT extraction argument doesn't work",
  "created_at": "2020-04-26T13:53:29.100000Z",
  "updated_at": "2020-04-27T07:09:56.398251Z",
  "draft": false,
  "published": true,
  "published_by": 20548,
  "rating": "",
  "steamid": 270910,
  "gogid": 1433238834,
  "gogslug": "worms_world_party_remastered",
  "humbleid": "",
  "humblestoreid": "",
  "humblestoreid_real": "",
  "script": {
    "files": [
      {
        "installer": "N/A:Please select the GOG.com Windows installer"
      }
    ],
    "game": {
      "arch": "win32",
      "exe": "$GAMEDIR/prefix/drive_c/GOG Games/Worms World Party Remastered/w2.exe",
      "prefix": "$GAMEDIR/prefix"
    },
    "installer": [
      {
        "task": {
          "arch": "win32",
          "description": "Creating Wine prefix",
          "install_gecko": false,
          "install_mono": false,
          "name": "create_prefix",
          "prefix": "$GAMEDIR/prefix"
        }
      },
      {
        "task": {
          "args": "/SP- /SUPPRESSMSGBOXES /NOCANCEL",
          "executable": "installer",
          "name": "wineexec",
          "prefix": "$GAMEDIR/prefix"
        }
      },
      {
        "task": {
          "app": "directx9",
          "arch": "win32",
          "description": "Installing DirectX 9",
          "name": "winetricks",
          "prefix": "$GAMEDIR/prefix",
          "silent": true
        }
      },
      {
        "task": {
          "app": "d3dx9_43",
          "arch": "win32",
          "description": "Installing DirectX 9_43",
          "name": "winetricks",
          "prefix": "$GAMEDIR/prefix",
          "silent": true
        }
      },
      {
        "task": {
          "app": "xact",
          "arch": "win32",
          "description": "Installing xact",
          "name": "winetricks",
          "prefix": "$GAMEDIR/prefix"
        }
      },
      {
        "task": {
          "app": "wmp10",
          "arch": "win32",
          "description": "Installing wmp10",
          "name": "winetricks",
          "prefix": "$GAMEDIR/prefix"
        }
      },
      {
        "task": {
          "app": "vcrun2005",
          "arch": "win32",
          "description": "Installing vcrun2005",
          "name": "winetricks",
          "prefix": "$GAMEDIR/prefix"
        }
      }
    ],
    "system": {
      "disable_monitoring": true,
      "disable_runtime": false,
      "pulse_latency": true,
      "reset_pulse": true
    },
    "winesteam": {
      "overrides": {
        "xaudio2_6": "native",
        "xaudio2_7": "native"
      }
    }
  },
  "content": "files:\n- installer: N/A:Please select the GOG.com Windows installer\ngame:\n  arch: win32\n  exe: $GAMEDIR/prefix/drive_c/GOG Games/Worms World Party Remastered/w2.exe\n  prefix: $GAMEDIR/prefix\ninstaller:\n- task:\n    arch: win32\n    description: Creating Wine prefix\n    install_gecko: false\n    install_mono: false\n    name: create_prefix\n    prefix: $GAMEDIR/prefix\n- task:\n    args: /SP- /SUPPRESSMSGBOXES /NOCANCEL\n    executable: installer\n    name: wineexec\n    prefix: $GAMEDIR/prefix\n- task:\n    app: directx9\n    arch: win32\n    description: Installing DirectX 9\n    name: winetricks\n    prefix: $GAMEDIR/prefix\n    silent: true\n- task:\n    app: d3dx9_43\n    arch: win32\n    description: Installing DirectX 9_43\n    name: winetricks\n    prefix: $GAMEDIR/prefix\n    silent: true\n- task:\n    app: xact\n    arch: win32\n    description: Installing xact\n    name: winetricks\n    prefix: $GAMEDIR/prefix\n- task:\n    app: wmp10\n    arch: win32\n    description: Installing wmp10\n    name: winetricks\n    prefix: $GAMEDIR/prefix\n- task:\n    app: vcrun2005\n    arch: win32\n    description: Installing vcrun2005\n    name: winetricks\n    prefix: $GAMEDIR/prefix\nsystem:\n  disable_monitoring: true\n  disable_runtime: false\n  pulse_latency: true\n  reset_pulse: true\nwinesteam:\n  overrides:\n    xaudio2_6: native\n    xaudio2_7: native\n"
}