{
  "id": 10449,
  "game_id": 5393,
  "game_slug": "worms-world-party-remastered",
  "name": "Worms World Party Remastered",
  "year": 2015,
  "user": "ZoeyGlobe",
  "runner": "winesteam",
  "slug": "worms-world-party-remastered-steam",
  "version": "Steam",
  "description": null,
  "notes": "",
  "created_at": "2018-10-07T21:45:26.924000Z",
  "updated_at": "2020-01-31T02:38:32.229420Z",
  "draft": false,
  "published": true,
  "published_by": null,
  "rating": "",
  "steamid": 270910,
  "gogid": 1433238834,
  "gogslug": "worms_world_party_remastered",
  "humblestoreid": "",
  "script": {
    "game": {
      "appid": 270910,
      "prefix": "$GAMEDIR/prefix",
      "arch": "win32"
    },
    "winesteam": {
      "overrides": {
        "xaudio2_7": "native",
        "xaudio2_6": "native"
      }
    },
    "installer": [
      {
        "task": {
          "description": "Creating Wine prefix",
          "name": "create_prefix",
          "arch": "win32",
          "prefix": "$GAMEDIR/prefix",
          "install_mono": false,
          "install_gecko": false
        }
      },
      {
        "task": {
          "description": "Installing DirectX 9",
          "name": "winetricks",
          "arch": "win32",
          "silent": true,
          "prefix": "$GAMEDIR/prefix",
          "app": "directx9"
        }
      },
      {
        "task": {
          "description": "Installing DirectX 9_43",
          "name": "winetricks",
          "arch": "win32",
          "silent": true,
          "prefix": "$GAMEDIR/prefix",
          "app": "d3dx9_43"
        }
      },
      {
        "task": {
          "description": "Installing xact",
          "name": "winetricks",
          "arch": "win32",
          "app": "xact",
          "prefix": "$GAMEDIR/prefix"
        }
      },
      {
        "task": {
          "description": "Installing wmp10",
          "name": "winetricks",
          "arch": "win32",
          "app": "wmp10",
          "prefix": "$GAMEDIR/prefix"
        }
      },
      {
        "task": {
          "description": "Installing vcrun2005",
          "name": "winetricks",
          "arch": "win32",
          "app": "vcrun2005",
          "prefix": "$GAMEDIR/prefix"
        }
      }
    ],
    "system": {
      "disable_monitoring": true,
      "disable_runtime": false,
      "reset_pulse": true,
      "pulse_latency": true
    }
  },
  "content": "game:\n  appid: 270910\n  arch: win32\n  prefix: $GAMEDIR/prefix\ninstaller:\n- task:\n    arch: win32\n    description: Creating Wine prefix\n    install_gecko: false\n    install_mono: false\n    name: create_prefix\n    prefix: $GAMEDIR/prefix\n- task:\n    app: directx9\n    arch: win32\n    description: Installing DirectX 9\n    name: winetricks\n    prefix: $GAMEDIR/prefix\n    silent: true\n- task:\n    app: d3dx9_43\n    arch: win32\n    description: Installing DirectX 9_43\n    name: winetricks\n    prefix: $GAMEDIR/prefix\n    silent: true\n- task:\n    app: xact\n    arch: win32\n    description: Installing xact\n    name: winetricks\n    prefix: $GAMEDIR/prefix\n- task:\n    app: wmp10\n    arch: win32\n    description: Installing wmp10\n    name: winetricks\n    prefix: $GAMEDIR/prefix\n- task:\n    app: vcrun2005\n    arch: win32\n    description: Installing vcrun2005\n    name: winetricks\n    prefix: $GAMEDIR/prefix\nsystem:\n  disable_monitoring: true\n  disable_runtime: false\n  pulse_latency: true\n  reset_pulse: true\nwinesteam:\n  overrides:\n    xaudio2_6: native\n    xaudio2_7: native\n"
}