{
  "id": 12156,
  "game_id": 857,
  "game_slug": "assassins-creed-iii",
  "name": "Assassin's Creed III",
  "year": 2012,
  "user": "VortexAcherontic",
  "runner": "wine",
  "slug": "assassins-creed-iii-uplay-dxvk",
  "version": "Uplay DXVK",
  "description": null,
  "notes": "",
  "created_at": "2019-02-24T20:47:06.785000Z",
  "updated_at": "2020-01-23T02:57:21.974584Z",
  "draft": false,
  "published": true,
  "published_by": 19464,
  "rating": "",
  "steamid": 208480,
  "gogid": null,
  "gogslug": "",
  "humblestoreid": "",
  "script": {
    "files": [
      {
        "uplay": "https://ubistatic3-a.akamaihd.net/orbit/launcher_installer/UplayInstaller.exe"
      }
    ],
    "game": {
      "prefix": "$GAMEDIR",
      "arch": "win64",
      "exe": "drive_c/Program Files (x86)/Ubisoft/Ubisoft Game Launcher/Uplay.exe"
    },
    "installer": [
      {
        "task": {
          "description": "Creating Wine prefix",
          "name": "create_prefix",
          "arch": "win64",
          "prefix": "$GAMEDIR"
        }
      },
      {
        "task": {
          "description": "Setting Windows version to 7",
          "name": "winetricks",
          "arch": "win64",
          "app": "win7",
          "prefix": "$GAMEDIR"
        }
      },
      {
        "task": {
          "description": "Installing corefonts",
          "name": "winetricks",
          "arch": "win64",
          "app": "corefonts",
          "prefix": "$GAMEDIR"
        }
      },
      {
        "task": {
          "description": "Installing DirectX dlls",
          "name": "winetricks",
          "arch": "win64",
          "app": "d3dx11_43 d3dcompiler_43",
          "prefix": "$GAMEDIR"
        }
      },
      {
        "task": {
          "description": "Installing Visual C++ librairies (2008 & 2010)",
          "name": "winetricks",
          "arch": "win64",
          "app": "vcrun2008 vcrun2010",
          "prefix": "$GAMEDIR"
        }
      },
      {
        "task": {
          "args": "/S",
          "name": "wineexec",
          "executable": "uplay",
          "prefix": "$GAMEDIR"
        }
      },
      {
        "task": {
          "prefix": "$GAMEDIR",
          "name": "winekill",
          "arch": "win64"
        }
      }
    ],
    "wine": {
      "dxvk": true,
      "esync": true
    }
  },
  "content": "files:\n- uplay: https://ubistatic3-a.akamaihd.net/orbit/launcher_installer/UplayInstaller.exe\ngame:\n  arch: win64\n  exe: drive_c/Program Files (x86)/Ubisoft/Ubisoft Game Launcher/Uplay.exe\n  prefix: $GAMEDIR\ninstaller:\n- task:\n    arch: win64\n    description: Creating Wine prefix\n    name: create_prefix\n    prefix: $GAMEDIR\n- task:\n    app: win7\n    arch: win64\n    description: Setting Windows version to 7\n    name: winetricks\n    prefix: $GAMEDIR\n- task:\n    app: corefonts\n    arch: win64\n    description: Installing corefonts\n    name: winetricks\n    prefix: $GAMEDIR\n- task:\n    app: d3dx11_43 d3dcompiler_43\n    arch: win64\n    description: Installing DirectX dlls\n    name: winetricks\n    prefix: $GAMEDIR\n- task:\n    app: vcrun2008 vcrun2010\n    arch: win64\n    description: Installing Visual C++ librairies (2008 & 2010)\n    name: winetricks\n    prefix: $GAMEDIR\n- task:\n    args: /S\n    executable: uplay\n    name: wineexec\n    prefix: $GAMEDIR\n- task:\n    arch: win64\n    name: winekill\n    prefix: $GAMEDIR\nwine:\n  dxvk: true\n  esync: true\n"
}