{
  "id": 8328,
  "game_id": 857,
  "game_slug": "assassins-creed-iii",
  "name": "Assassin's Creed III",
  "year": 2012,
  "user": "Onurb",
  "runner": "winesteam",
  "slug": "assassins-creed-iii-steam-w-dxvk",
  "version": "Steam w/ DXVK",
  "description": null,
  "notes": "",
  "created_at": "2018-05-19T10:32:07.508000Z",
  "updated_at": "2020-01-31T02:38:35.520890Z",
  "draft": false,
  "published": true,
  "published_by": 19464,
  "rating": "",
  "steamid": 208480,
  "gogid": null,
  "gogslug": "",
  "humblestoreid": "",
  "script": {
    "files": [
      {
        "dx2010": "https://lutris.net/files/tools/directx-2010.tar.gz"
      },
      {
        "uplay": "https://ubistatic3-a.akamaihd.net/orbit/launcher_installer/UplayInstaller.exe"
      }
    ],
    "game": {
      "appid": 208480,
      "prefix": "$GAMEDIR/prefix",
      "arch": "win64"
    },
    "winesteam": {
      "dxvk": true,
      "esync": true
    },
    "installer": [
      {
        "task": {
          "prefix": "$GAMEDIR/prefix",
          "name": "create_prefix",
          "arch": "win64"
        }
      },
      {
        "input_menu": {
          "options": [
            {
              "#dxgi.nvapiHack = False": "AMD"
            },
            {
              "dxgi.nvapiHack = False": "Nvidia"
            }
          ],
          "description": "Choose your GPU:",
          "preselect": "#dxgi.nvapiHack = False",
          "id": "GPU"
        }
      },
      {
        "write_file": {
          "content": "$INPUT_GPU",
          "file": "$GAMEDIR/dxvk.conf"
        }
      },
      {
        "extract": {
          "dst": "$CACHE/dxsetup",
          "file": "dx2010"
        }
      },
      {
        "task": {
          "args": "/silent",
          "name": "wineexec",
          "arch": "win64",
          "executable": "$CACHE/dxsetup/DXSETUP.exe",
          "prefix": "$GAMEDIR/prefix"
        }
      },
      {
        "task": {
          "prefix": "$GAMEDIR/prefix",
          "name": "winetricks",
          "arch": "win64",
          "app": "vcrun2008 corefonts win7"
        }
      },
      {
        "task": {
          "args": "/S",
          "name": "wineexec",
          "arch": "win64",
          "executable": "uplay",
          "prefix": "$GAMEDIR/prefix"
        }
      },
      {
        "task": {
          "prefix": "$GAMEDIR/prefix",
          "name": "winekill",
          "arch": "win64"
        }
      }
    ],
    "system": {
      "disable_runtime": false,
      "env": {
        "DXVK_CONFIG_FILE": "$GAMEDIR/dxvk.conf",
        "DXVK_HUD": 0
      }
    }
  },
  "content": "files:\n- dx2010: https://lutris.net/files/tools/directx-2010.tar.gz\n- uplay: https://ubistatic3-a.akamaihd.net/orbit/launcher_installer/UplayInstaller.exe\ngame:\n  appid: 208480\n  arch: win64\n  prefix: $GAMEDIR/prefix\ninstaller:\n- task:\n    arch: win64\n    name: create_prefix\n    prefix: $GAMEDIR/prefix\n- input_menu:\n    description: 'Choose your GPU:'\n    id: GPU\n    options:\n    - '#dxgi.nvapiHack = False': AMD\n    - dxgi.nvapiHack = False: Nvidia\n    preselect: '#dxgi.nvapiHack = False'\n- write_file:\n    content: $INPUT_GPU\n    file: $GAMEDIR/dxvk.conf\n- extract:\n    dst: $CACHE/dxsetup\n    file: dx2010\n- task:\n    arch: win64\n    args: /silent\n    executable: $CACHE/dxsetup/DXSETUP.exe\n    name: wineexec\n    prefix: $GAMEDIR/prefix\n- task:\n    app: vcrun2008 corefonts win7\n    arch: win64\n    name: winetricks\n    prefix: $GAMEDIR/prefix\n- task:\n    arch: win64\n    args: /S\n    executable: uplay\n    name: wineexec\n    prefix: $GAMEDIR/prefix\n- task:\n    arch: win64\n    name: winekill\n    prefix: $GAMEDIR/prefix\nsystem:\n  disable_runtime: false\n  env:\n    DXVK_CONFIG_FILE: $GAMEDIR/dxvk.conf\n    DXVK_HUD: 0\nwinesteam:\n  dxvk: true\n  esync: true\n"
}