{
  "id": 17686,
  "game_id": 13774,
  "game_slug": "grimoire-heralds-of-the-winged-exemplar",
  "name": "Grimoire: Heralds of the Winged Exemplar",
  "year": 2017,
  "user": "LeXofLeviafan",
  "runner": "wine",
  "slug": "grimoire-heralds-of-the-winge-gog",
  "version": "GOG",
  "description": null,
  "notes": "",
  "created_at": "2020-01-01T12:22:27.783872Z",
  "updated_at": "2020-01-23T02:57:09.411786Z",
  "draft": true,
  "published": false,
  "published_by": null,
  "rating": "",
  "steamid": 650670,
  "gogid": null,
  "gogslug": "",
  "humblestoreid": "",
  "script": {
    "files": [
      {
        "installer": "N/A:Select the EXE downloaded from GOG"
      }
    ],
    "game": {
      "prefix": "$GAMEDIR",
      "exe": "drive_c/GOG Games/Grimoire/Grimoire.exe"
    },
    "installer": [
      {
        "task": {
          "description": "Creating WINE prefix",
          "name": "create_prefix",
          "prefix": "$GAMEDIR"
        }
      },
      {
        "task": {
          "args": "/VERYSILENT /SUPPRESSMSGBOXES",
          "name": "wineexec",
          "executable": "installer",
          "description": "Running Setup, please wait..."
        }
      },
      {
        "task": {
          "prefix": "$GAMEDIR",
          "name": "winetricks",
          "app": "dmband"
        }
      },
      {
        "task": {
          "prefix": "$GAMEDIR",
          "name": "winetricks",
          "app": "dmime"
        }
      },
      {
        "task": {
          "prefix": "$GAMEDIR",
          "name": "winetricks",
          "app": "dmloader"
        }
      },
      {
        "task": {
          "prefix": "$GAMEDIR",
          "name": "winetricks",
          "app": "dmsynth"
        }
      },
      {
        "task": {
          "prefix": "$GAMEDIR",
          "name": "winetricks",
          "app": "dmusic"
        }
      },
      {
        "task": {
          "prefix": "$GAMEDIR",
          "name": "winetricks",
          "app": "gmdls"
        }
      }
    ]
  },
  "content": "files:\n- installer: N/A:Select the EXE downloaded from GOG\ngame:\n  exe: drive_c/GOG Games/Grimoire/Grimoire.exe\n  prefix: $GAMEDIR\ninstaller:\n- task:\n    description: Creating WINE prefix\n    name: create_prefix\n    prefix: $GAMEDIR\n- task:\n    args: /VERYSILENT /SUPPRESSMSGBOXES\n    description: Running Setup, please wait...\n    executable: installer\n    name: wineexec\n- task:\n    app: dmband\n    name: winetricks\n    prefix: $GAMEDIR\n- task:\n    app: dmime\n    name: winetricks\n    prefix: $GAMEDIR\n- task:\n    app: dmloader\n    name: winetricks\n    prefix: $GAMEDIR\n- task:\n    app: dmsynth\n    name: winetricks\n    prefix: $GAMEDIR\n- task:\n    app: dmusic\n    name: winetricks\n    prefix: $GAMEDIR\n- task:\n    app: gmdls\n    name: winetricks\n    prefix: $GAMEDIR\n"
}