{
  "id": 1298,
  "game_id": 819,
  "game_slug": "dark-souls",
  "name": "Dark Souls",
  "year": 2012,
  "user": "strider",
  "runner": "winesteam",
  "slug": "dark-souls-steam",
  "version": "Steam",
  "description": "Dark Souls: Prepare to die edition for Steam",
  "notes": "",
  "created_at": "2015-02-22T22:21:47.774000Z",
  "updated_at": "2018-07-19T13:27:29.358374Z",
  "draft": false,
  "published": true,
  "published_by": null,
  "rating": "",
  "steamid": 211420,
  "gogid": null,
  "gogslug": "",
  "humblestoreid": "",
  "script": {
    "game": {
      "appid": 211420,
      "arch": "win32",
      "prefix": "$GAMEDIR/prefix"
    },
    "installer": [
      {
        "extract": {
          "file": "dsfix",
          "dst": "$GAMEDIR/DATA"
        }
      },
      {
        "task": {
          "app": "quartz",
          "arch": "win32",
          "description": "Installing Quartz",
          "prefix": "$GAMEDIR/prefix",
          "name": "winetricks",
          "silent": true
        }
      },
      {
        "task": {
          "app": "devenum",
          "arch": "win32",
          "description": "Installing devenum",
          "prefix": "$GAMEDIR/prefix",
          "name": "winetricks",
          "silent": true
        }
      },
      {
        "task": {
          "app": "wmp9",
          "arch": "win32",
          "description": "Installing Windows Media Player 9",
          "prefix": "$GAMEDIR/prefix",
          "name": "winetricks",
          "silent": true
        }
      }
    ],
    "winesteam": {
      "overrides": {
        "xinput1_3": "native,builtin",
        "dinput8": "native,builtin"
      },
      "xinput": true
    },
    "files": [
      {
        "dsfix": "https://lutris.net/files/games/dark-souls/dsfix-xinput.tar.gz"
      }
    ]
  },
  "content": "files:\n- dsfix: https://lutris.net/files/games/dark-souls/dsfix-xinput.tar.gz\ngame:\n  appid: 211420\n  arch: win32\n  prefix: $GAMEDIR/prefix\ninstaller:\n- extract:\n    dst: $GAMEDIR/DATA\n    file: dsfix\n- task:\n    app: quartz\n    arch: win32\n    description: Installing Quartz\n    name: winetricks\n    prefix: $GAMEDIR/prefix\n    silent: true\n- task:\n    app: devenum\n    arch: win32\n    description: Installing devenum\n    name: winetricks\n    prefix: $GAMEDIR/prefix\n    silent: true\n- task:\n    app: wmp9\n    arch: win32\n    description: Installing Windows Media Player 9\n    name: winetricks\n    prefix: $GAMEDIR/prefix\n    silent: true\nwinesteam:\n  overrides:\n    dinput8: native,builtin\n    xinput1_3: native,builtin\n  xinput: true\n"
}