{
  "id": 9721,
  "game_id": 593,
  "game_slug": "overlord-ii",
  "name": "Overlord II",
  "year": null,
  "user": "LeXofLeviafan",
  "runner": "wine",
  "slug": "overlord-ii-gog",
  "version": "GOG",
  "description": "This is the Wine+GOG version. You need to provide the GOG windows installer",
  "notes": "",
  "created_at": "2018-08-13T11:15:27.922419Z",
  "updated_at": "2018-08-16T06:23:07.602601Z",
  "draft": false,
  "published": true,
  "published_by": null,
  "rating": "",
  "steamid": 12810,
  "gogid": 1580446481,
  "gogslug": "overlord_ii",
  "humbleid": "",
  "humblestoreid": "",
  "humblestoreid_real": "",
  "script": {
    "files": [
      {
        "game": "N/A:Please select the GOG.com Windows installer."
      }
    ],
    "game": {
      "exe": "$GAMEDIR/drive_c/game/Overlord2.exe",
      "prefix": "$GAMEDIR"
    },
    "installer": [
      {
        "task": {
          "description": "Creating Wine prefix",
          "name": "create_prefix",
          "prefix": "$GAMEDIR"
        }
      },
      {
        "task": {
          "args": "/SUPPRESSMSGBOXES '/DIR=C:/game'",
          "description": "Installing...",
          "executable": "game",
          "name": "wineexec",
          "prefix": "$GAMEDIR"
        }
      },
      {
        "task": {
          "app": "directx9",
          "description": "Installing DirectX 9",
          "name": "winetricks",
          "prefix": "$GAMEDIR/prefix",
          "silent": true
        }
      },
      {
        "task": {
          "app": "vcrun2005",
          "description": "Installing MSVC 2005",
          "name": "winetricks",
          "prefix": "$GAMEDIR/prefix",
          "silent": true
        }
      },
      {
        "task": {
          "app": "physx",
          "description": "Installing PhysX",
          "name": "winetricks",
          "prefix": "$GAMEDIR/prefix",
          "silent": true
        }
      }
    ]
  },
  "content": "files:\n- game: N/A:Please select the GOG.com Windows installer.\ngame:\n  exe: $GAMEDIR/drive_c/game/Overlord2.exe\n  prefix: $GAMEDIR\ninstaller:\n- task:\n    description: Creating Wine prefix\n    name: create_prefix\n    prefix: $GAMEDIR\n- task:\n    args: /SUPPRESSMSGBOXES '/DIR=C:/game'\n    description: Installing...\n    executable: game\n    name: wineexec\n    prefix: $GAMEDIR\n- task:\n    app: directx9\n    description: Installing DirectX 9\n    name: winetricks\n    prefix: $GAMEDIR/prefix\n    silent: true\n- task:\n    app: vcrun2005\n    description: Installing MSVC 2005\n    name: winetricks\n    prefix: $GAMEDIR/prefix\n    silent: true\n- task:\n    app: physx\n    description: Installing PhysX\n    name: winetricks\n    prefix: $GAMEDIR/prefix\n    silent: true\n"
}