{
  "id": 5619,
  "game_id": 6711,
  "game_slug": "disneys-aladdin",
  "name": "Disney's Aladdin",
  "year": 1993,
  "user": "maxlefou",
  "runner": "dosbox",
  "slug": "disneys-aladdin-ms-dos",
  "version": "MS-DOS",
  "description": null,
  "notes": "",
  "created_at": "2017-09-07T19:42:54.551000Z",
  "updated_at": "2020-01-09T09:26:00.210060Z",
  "draft": false,
  "published": true,
  "published_by": null,
  "rating": "",
  "steamid": 561100,
  "gogid": 1364995551,
  "gogslug": "disney_aladdin",
  "humblestoreid": "",
  "script": {
    "game": {
      "main_file": "ALADDIN.EXE",
      "config_file": "$GAMEDIR/dosbox_aladdin.conf"
    },
    "files": [
      {
        "file1": "N/A:Select the game's archive file"
      }
    ],
    "require-binaries": "7z",
    "installer": [
      {
        "extract": {
          "file": "$file1",
          "dst": "$CACHE/game"
        }
      },
      {
        "execute": {
          "file": "7z",
          "description": "Extracting the data files...",
          "args": "x \"$CACHE/game/DISK1.DAT\""
        }
      },
      {
        "execute": {
          "file": "7z",
          "description": "Extracting more data files...",
          "args": "x \"$CACHE/game/DISK2.DAT\""
        }
      },
      {
        "merge": {
          "src": "$CACHE/game",
          "dst": "$GAMEDIR"
        }
      },
      {
        "write_config": {
          "file": "$GAMEDIR/dosbox_aladdin.conf",
          "value": true,
          "section": "render",
          "key": "aspect"
        }
      },
      {
        "write_config": {
          "file": "$GAMEDIR/dosbox_aladdin.conf",
          "value": false,
          "section": "sdl",
          "key": "fullscreen"
        }
      },
      {
        "write_config": {
          "file": "$GAMEDIR/dosbox_aladdin.conf",
          "value": "sb16",
          "section": "sblaster",
          "key": "sbtype"
        }
      },
      {
        "write_config": {
          "file": "$GAMEDIR/dosbox_aladdin.conf",
          "value": "max",
          "section": "cpu",
          "key": "cycles"
        }
      },
      {
        "task": {
          "executable": "SETSND.EXE",
          "name": "dosexec",
          "description": "Setting sound. just type Y and Enter directly."
        }
      }
    ]
  },
  "content": "files:\r\n- file1: N/A:Select the game's archive file\r\ngame:\r\n  config_file: $GAMEDIR/dosbox_aladdin.conf\r\n  main_file: ALADDIN.EXE\r\ninstaller:\r\n- extract:\r\n    dst: $CACHE/game\r\n    file: $file1\r\n- execute:\r\n    args: x \"$CACHE/game/DISK1.DAT\"\r\n    description: Extracting the data files...\r\n    file: 7z\r\n- execute:\r\n    args: x \"$CACHE/game/DISK2.DAT\"\r\n    description: Extracting more data files...\r\n    file: 7z\r\n- merge:\r\n    dst: $GAMEDIR\r\n    src: $CACHE/game\r\n- write_config:\r\n    file: $GAMEDIR/dosbox_aladdin.conf\r\n    key: aspect\r\n    section: render\r\n    value: true\r\n- write_config:\r\n    file: $GAMEDIR/dosbox_aladdin.conf\r\n    key: fullscreen\r\n    section: sdl\r\n    value: false\r\n- write_config:\r\n    file: $GAMEDIR/dosbox_aladdin.conf\r\n    key: sbtype\r\n    section: sblaster\r\n    value: sb16\r\n- write_config:\r\n    file: $GAMEDIR/dosbox_aladdin.conf\r\n    key: cycles\r\n    section: cpu\r\n    value: max\r\n- task:\r\n    description: Setting sound. just type Y and Enter directly.\r\n    executable: SETSND.EXE\r\n    name: dosexec\r\nrequire-binaries: 7z"
}