{
  "id": 17544,
  "game_id": 28722,
  "game_slug": "dead-space-3",
  "name": "Dead Space 3",
  "year": 2013,
  "user": "soredake",
  "runner": "wine",
  "slug": "dead-space-3-origin",
  "version": "Origin",
  "description": null,
  "notes": "",
  "created_at": "2019-12-24T18:32:37.953000Z",
  "updated_at": "2020-01-18T13:14:28.235994Z",
  "draft": false,
  "published": true,
  "published_by": 20548,
  "rating": "",
  "steamid": null,
  "gogid": null,
  "gogslug": "",
  "humblestoreid": "",
  "script": {
    "files": [
      {
        "client": "https://origin-a.akamaihd.net/Origin-Client-Download/origin/live/OriginThinSetup.exe"
      },
      {
        "updater": "https://raw.githubusercontent.com/DrDoctor13/wine-origin-updater/master/updateorigin.sh"
      }
    ],
    "installer": [
      {
        "task": {
          "description": "Creating Wine prefix",
          "name": "create_prefix",
          "arch": "win64",
          "prefix": "$GAMEDIR"
        }
      },
      {
        "execute": {
          "command": "mkdir \"$GAMEDIR/nv-shaders\""
        }
      },
      {
        "input_menu": {
          "options": [
            {
              "#Not needed for AMD. Ignore this.": "AMD"
            },
            {
              "dxgi.nvapiHack = False\nd3d11.zeroInitWorkgroupMemory = True": "Nvidia"
            }
          ],
          "description": "Setting DXVK workarounds please choose your GPU:",
          "preselect": "#Not needed for AMD. Ignore this.",
          "id": "GPU"
        }
      },
      {
        "write_file": {
          "content": "$INPUT_GPU",
          "file": "$GAMEDIR/dxvk.conf"
        }
      },
      {
        "task": {
          "prefix": "$GAMEDIR",
          "name": "winetricks",
          "arch": "win64",
          "app": "nocrashdialog d3dcompiler_43 d3dcompiler_47 d3dx9 win7"
        }
      },
      {
        "task": {
          "description": "Installing Origin... Login window will pop-up and close.",
          "name": "wineexec",
          "arch": "win64",
          "executable": "client",
          "args": "/silent",
          "prefix": "$GAMEDIR",
          "exclude_processes": "Origin.exe OriginClientService.exe OriginWebHelperService.exe QtWebEngineProcess.exe"
        }
      },
      {
        "task": {
          "prefix": "$GAMEDIR",
          "name": "winekill",
          "arch": "win64"
        }
      },
      {
        "chmodx": "updater"
      },
      {
        "merge": {
          "dst": "$GAMEDIR/drive_c/Program Files (x86)/Origin",
          "src": "updater"
        }
      }
    ],
    "game": {
      "prefix": "$GAMEDIR",
      "arch": "win64",
      "exe": "drive_c/Program Files (x86)/Origin/Origin.exe"
    },
    "system": {
      "exclude_processes": "QtWebEngineProcess.exe ActivationUI.exe OriginWebHelperService.exe",
      "env": {
        "DXVK_CONFIG_FILE": "$GAMEDIR/dxvk.conf",
        "__GL_SHADER_DISK_CACHE_PATH": "$GAMEDIR/nv-shaders",
        "__GL_SHADER_DISK_CACHE": 1,
        "STAGING_SHARED_MEMORY": 0
      }
    },
    "wine": {
      "dxvk": true,
      "overrides": {
        "nvapi,nvapi64": "disabled"
      }
    }
  },
  "content": "files:\r\n- client: https://origin-a.akamaihd.net/Origin-Client-Download/origin/live/OriginThinSetup.exe\r\n- updater: https://raw.githubusercontent.com/DrDoctor13/wine-origin-updater/master/updateorigin.sh\r\ngame:\r\n  arch: win64\r\n  exe: drive_c/Program Files (x86)/Origin/Origin.exe\r\n  prefix: $GAMEDIR\r\ninstaller:\r\n- task:\r\n    arch: win64\r\n    description: Creating Wine prefix\r\n    name: create_prefix\r\n    prefix: $GAMEDIR\r\n- execute:\r\n    command: mkdir \"$GAMEDIR/nv-shaders\"\r\n- input_menu:\r\n    description: 'Setting DXVK workarounds please choose your GPU:'\r\n    id: GPU\r\n    options:\r\n    - '#Not needed for AMD. Ignore this.': AMD\r\n    - ? 'dxgi.nvapiHack = False\r\n\r\n        d3d11.zeroInitWorkgroupMemory = True'\r\n      : Nvidia\r\n    preselect: '#Not needed for AMD. Ignore this.'\r\n- write_file:\r\n    content: $INPUT_GPU\r\n    file: $GAMEDIR/dxvk.conf\r\n- task:\r\n    app: nocrashdialog d3dcompiler_43 d3dcompiler_47 d3dx9 win7\r\n    arch: win64\r\n    name: winetricks\r\n    prefix: $GAMEDIR\r\n- task:\r\n    arch: win64\r\n    args: /silent\r\n    description: Installing Origin... Login window will pop-up and close.\r\n    exclude_processes: Origin.exe OriginClientService.exe OriginWebHelperService.exe\r\n      QtWebEngineProcess.exe\r\n    executable: client\r\n    name: wineexec\r\n    prefix: $GAMEDIR\r\n- task:\r\n    arch: win64\r\n    name: winekill\r\n    prefix: $GAMEDIR\r\n- chmodx: updater\r\n- merge:\r\n    dst: $GAMEDIR/drive_c/Program Files (x86)/Origin\r\n    src: updater\r\nsystem:\r\n  env:\r\n    DXVK_CONFIG_FILE: $GAMEDIR/dxvk.conf\r\n    STAGING_SHARED_MEMORY: 0\r\n    __GL_SHADER_DISK_CACHE: 1\r\n    __GL_SHADER_DISK_CACHE_PATH: $GAMEDIR/nv-shaders\r\n  exclude_processes: QtWebEngineProcess.exe ActivationUI.exe OriginWebHelperService.exe\r\nwine:\r\n  dxvk: true\r\n  overrides:\r\n    nvapi,nvapi64: disabled"
}