{
  "id": 18596,
  "game_id": 25694,
  "game_slug": "dead-air",
  "name": "Dead Air",
  "year": null,
  "user": "soredake",
  "runner": "wine",
  "slug": "dead-air-installer",
  "version": "Installer",
  "description": null,
  "notes": "",
  "created_at": "2020-02-29T12:02:26.513357Z",
  "updated_at": "2020-02-29T12:02:31.386051Z",
  "draft": false,
  "published": true,
  "published_by": null,
  "rating": "",
  "steamid": null,
  "gogid": null,
  "gogslug": "",
  "humblestoreid": "",
  "script": {
    "files": [
      {
        "installer": "N/A:Select the game's setup file"
      }
    ],
    "game": {
      "prefix": "$GAMEDIR",
      "exe": "drive_c/Program Files (x86)/Dead Air/xrEngine.exe",
      "working_dir": "$GAMEDIR/drive_c/Program Files (x86)/Dead Air"
    },
    "wine": {
      "esync": true,
      "dxvk": true
    },
    "installer": [
      {
        "task": {
          "prefix": "$GAMEDIR",
          "name": "create_prefix",
          "description": "Setting up wine prefix"
        }
      },
      {
        "task": {
          "prefix": "$GAMEDIR",
          "executable": "$installer",
          "name": "wineexec",
          "description": "Install to default location"
        }
      },
      {
        "task": {
          "prefix": "$GAMEDIR",
          "description": "Installing needed libraries",
          "app": "d3dcompiler_43 d3dcompiler_47 d3dx9 d3dx10 d3dx11_42 d3dx11_43",
          "silent": true,
          "name": "winetricks"
        }
      }
    ]
  },
  "content": "files:\n- installer: N/A:Select the game's setup file\ngame:\n  exe: drive_c/Program Files (x86)/Dead Air/xrEngine.exe\n  prefix: $GAMEDIR\n  working_dir: $GAMEDIR/drive_c/Program Files (x86)/Dead Air\ninstaller:\n- task:\n    description: Setting up wine prefix\n    name: create_prefix\n    prefix: $GAMEDIR\n- task:\n    description: Install to default location\n    executable: $installer\n    name: wineexec\n    prefix: $GAMEDIR\n- task:\n    app: d3dcompiler_43 d3dcompiler_47 d3dx9 d3dx10 d3dx11_42 d3dx11_43\n    description: Installing needed libraries\n    name: winetricks\n    prefix: $GAMEDIR\n    silent: true\nwine:\n  dxvk: true\n  esync: true\n"
}