{
  "id": 13019,
  "game_id": 219,
  "game_slug": "dead-space",
  "name": "Dead Space",
  "year": 2008,
  "user": "cxf",
  "runner": "wine",
  "slug": "dead-space-gog",
  "version": "GOG",
  "description": null,
  "notes": "At the end of the GOG installer you may get: \"Runtime Error\" - You can just press OK and ignore this.",
  "created_at": "2019-04-21T20:28:02.401335Z",
  "updated_at": "2019-09-15T19:55:09.030149Z",
  "draft": false,
  "published": true,
  "published_by": null,
  "rating": "",
  "steamid": 17470,
  "gogid": 1312818781,
  "gogslug": "dead_space",
  "humblestoreid": "",
  "script": {
    "game": {
      "prefix": "$GAMEDIR",
      "exe": "drive_c/GOG Games/Dead Space/Dead Space.exe"
    },
    "wine": {
      "dxvk": true,
      "version": "lutris-nofshack-4.15-x86_64",
      "dxvk_version": "1.3.4",
      "esync": true
    },
    "files": [
      {
        "dx2010": "https://lutris.net/files/tools/directx-2010.tar.gz"
      },
      {
        "setup": "N/A:Select gog Windows setup exe"
      }
    ],
    "installer": [
      {
        "task": {
          "prefix": "$GAMEDIR",
          "name": "create_prefix"
        }
      },
      {
        "extract": {
          "dst": "$CACHE/dxsetup",
          "file": "dx2010"
        }
      },
      {
        "task": {
          "prefix": "$GAMEDIR",
          "executable": "$CACHE/dxsetup/DXSETUP.exe",
          "args": "/silent",
          "name": "wineexec"
        }
      },
      {
        "task": {
          "prefix": "$GAMEDIR",
          "name": "winetricks",
          "app": "vcrun2005 win7"
        }
      },
      {
        "task": {
          "prefix": "$GAMEDIR",
          "executable": "setup",
          "args": "/SP- /SUPPRESSMSGBOXES /NOCANCEL",
          "name": "wineexec"
        }
      }
    ]
  },
  "content": "files:\r\n- dx2010: https://lutris.net/files/tools/directx-2010.tar.gz\r\n- setup: N/A:Select gog Windows setup exe\r\ngame:\r\n  exe: drive_c/GOG Games/Dead Space/Dead Space.exe\r\n  prefix: $GAMEDIR\r\ninstaller:\r\n- task:\r\n    name: create_prefix\r\n    prefix: $GAMEDIR\r\n- extract:\r\n    dst: $CACHE/dxsetup\r\n    file: dx2010\r\n- task:\r\n    args: /silent\r\n    executable: $CACHE/dxsetup/DXSETUP.exe\r\n    name: wineexec\r\n    prefix: $GAMEDIR\r\n- task:\r\n    app: vcrun2005 win7\r\n    name: winetricks\r\n    prefix: $GAMEDIR\r\n- task:\r\n    args: /SP- /SUPPRESSMSGBOXES /NOCANCEL\r\n    executable: setup\r\n    name: wineexec\r\n    prefix: $GAMEDIR\r\nwine:\r\n  dxvk: true\r\n  dxvk_version: 1.3.4\r\n  esync: true\r\n  version: lutris-nofshack-4.15-x86_64"
}