{
  "id": 8789,
  "game_id": 19386,
  "game_slug": "playstation-now",
  "name": "PlayStation Now",
  "year": 2018,
  "user": "cxf",
  "runner": "wine",
  "slug": "playstation-now-latest",
  "version": "Latest",
  "description": "Play Playstation games on Linux.",
  "notes": "-Known issues: \r\n-- \"PlayStation Now\" does not exit cleanly with Wine, you have to force application exit with Lutris \"Stop\" button or \"Kill all wine process\".\r\n-- White rectangular window at the right bottom. Click on it and type F4 to close it.\r\n-- not very stable,  make regularly saves of your game.",
  "created_at": "2018-06-18T21:19:20.940000Z",
  "updated_at": "2020-03-27T20:19:05.690349Z",
  "draft": false,
  "published": true,
  "published_by": 494,
  "rating": "",
  "steamid": null,
  "gogid": null,
  "gogslug": "",
  "humblestoreid": "",
  "script": {
    "files": [
      {
        "psnow": "https://download-psnow.playstation.com/downloads/psnow/pc/PlayStationNow-11.0.2.exe"
      }
    ],
    "game": {
      "arch": "win64",
      "prefix": "$GAMEDIR",
      "exe": "drive_c/Program Files (x86)/PlayStationNow/psnowlauncher.exe"
    },
    "installer": [
      {
        "task": {
          "arch": "win64",
          "install_gecko": false,
          "install_mono": false,
          "prefix": "$GAMEDIR",
          "name": "create_prefix"
        }
      },
      {
        "task": {
          "arch": "win64",
          "app": "win7",
          "prefix": "$GAMEDIR",
          "name": "winetricks"
        }
      },
      {
        "task": {
          "arch": "win64",
          "app": "vcrun2013",
          "prefix": "$GAMEDIR",
          "name": "winetricks"
        }
      },
      {
        "task": {
          "arch": "win64",
          "args": "/extract \"c:\"",
          "executable": "psnow",
          "prefix": "$GAMEDIR",
          "name": "wineexec"
        }
      },
      {
        "task": {
          "arch": "win64",
          "args": "/i \"C:\\294C619\\PlayStationNow.msi\" SETUPEXEDIR=\"C:\\294C619\"",
          "executable": "msiexec",
          "prefix": "$GAMEDIR",
          "name": "wineexec"
        }
      },
      {
        "task": {
          "prefix": "$GAMEDIR",
          "value": "00000000",
          "arch": "win64",
          "key": "csmt",
          "name": "set_regedit",
          "path": "HKEY_CURRENT_USER\\Software\\Wine\\Direct3D\\",
          "type": "REG_DWORD"
        }
      },
      {
        "task": {
          "prefix": "$GAMEDIR",
          "value": "0 0 0",
          "arch": "win64",
          "key": "background",
          "name": "set_regedit",
          "path": "HKEY_CURRENT_USER\\Control Panel\\Colors\\",
          "type": "REG_SZ"
        }
      }
    ],
    "wine": {
      "Desktop": true,
      "dxvk": true
    },
    "move": {
      "src": "$GAMEDIR/drive_c/294C619",
      "dst": "$CACHE"
    }
  },
  "content": "files:\n- psnow: https://download-psnow.playstation.com/downloads/psnow/pc/PlayStationNow-11.0.2.exe\ngame:\n  arch: win64\n  exe: drive_c/Program Files (x86)/PlayStationNow/psnowlauncher.exe\n  prefix: $GAMEDIR\ninstaller:\n- task:\n    arch: win64\n    install_gecko: false\n    install_mono: false\n    name: create_prefix\n    prefix: $GAMEDIR\n- task:\n    app: win7\n    arch: win64\n    name: winetricks\n    prefix: $GAMEDIR\n- task:\n    app: vcrun2013\n    arch: win64\n    name: winetricks\n    prefix: $GAMEDIR\n- task:\n    arch: win64\n    args: /extract \"c:\"\n    executable: psnow\n    name: wineexec\n    prefix: $GAMEDIR\n- task:\n    arch: win64\n    args: /i \"C:\\294C619\\PlayStationNow.msi\" SETUPEXEDIR=\"C:\\294C619\"\n    executable: msiexec\n    name: wineexec\n    prefix: $GAMEDIR\n- task:\n    arch: win64\n    key: csmt\n    name: set_regedit\n    path: HKEY_CURRENT_USER\\Software\\Wine\\Direct3D\\\n    prefix: $GAMEDIR\n    type: REG_DWORD\n    value: '00000000'\n- task:\n    arch: win64\n    key: background\n    name: set_regedit\n    path: HKEY_CURRENT_USER\\Control Panel\\Colors\\\n    prefix: $GAMEDIR\n    type: REG_SZ\n    value: 0 0 0\nmove:\n  dst: $CACHE\n  src: $GAMEDIR/drive_c/294C619\nwine:\n  Desktop: true\n  dxvk: true\n"
}