{
  "id": 19086,
  "game_id": 1685,
  "game_slug": "ys-origin",
  "name": "Ys Origin",
  "year": null,
  "user": "DaiKaiser93",
  "runner": "wine",
  "slug": "ys-origin-gog",
  "version": "GOG",
  "description": null,
  "notes": "",
  "created_at": "2020-03-23T06:47:23.839000Z",
  "updated_at": "2020-03-24T09:49:51.840943Z",
  "draft": false,
  "published": true,
  "published_by": 20548,
  "rating": "",
  "steamid": 207350,
  "gogid": 1422357892,
  "gogslug": "ys_origin",
  "humblestoreid": "",
  "script": {
    "files": [
      {
        "setup": "N/A:Select the game's setup file"
      }
    ],
    "game": {
      "prefix": "$GAMEDIR",
      "exe": "drive_c/GOG Games/Ys Origin/yso_win.exe",
      "arch": "win32"
    },
    "wine": {
      "overrides": {
        "winegstreamer": "disabled"
      }
    },
    "installer": [
      {
        "task": {
          "prefix": "$GAMEDIR",
          "arch": "win32",
          "name": "create_prefix"
        }
      },
      {
        "task": {
          "prefix": "$GAMEDIR",
          "arch": "win32",
          "app": "vcrun2008",
          "name": "winetricks"
        }
      },
      {
        "task": {
          "prefix": "$GAMEDIR",
          "arch": "win32",
          "app": "quartz",
          "description": "Installing Quartz.",
          "name": "winetricks"
        }
      },
      {
        "task": {
          "prefix": "$GAMEDIR",
          "arch": "win32",
          "app": "amstream",
          "description": "Installing Amstream.",
          "name": "winetricks"
        }
      },
      {
        "task": {
          "prefix": "$GAMEDIR",
          "arch": "win32",
          "app": "xvid win7",
          "description": "Installing Xvid.",
          "name": "winetricks"
        }
      },
      {
        "task": {
          "arch": "win32",
          "name": "wineexec",
          "description": "Simulating Windows reboot.",
          "args": "-u",
          "prefix": "$GAMEDIR",
          "executable": "wineboot"
        }
      },
      {
        "task": {
          "arch": "win32",
          "name": "wineexec",
          "description": "Installing Ys Origin",
          "args": "/SP- /SUPPRESSMSGBOXES /NOCANCEL",
          "prefix": "$GAMEDIR",
          "executable": "setup"
        }
      },
      {
        "task": {
          "prefix": "$GAMEDIR",
          "arch": "win32",
          "executable": "$GAMEDIR/drive_c/GOG Games/Ys Origin/config.exe",
          "name": "wineexec",
          "description": "Setting game options."
        }
      }
    ]
  },
  "content": "files:\n- setup: N/A:Select the game's setup file\ngame:\n  arch: win32\n  exe: drive_c/GOG Games/Ys Origin/yso_win.exe\n  prefix: $GAMEDIR\ninstaller:\n- task:\n    arch: win32\n    name: create_prefix\n    prefix: $GAMEDIR\n- task:\n    app: vcrun2008\n    arch: win32\n    name: winetricks\n    prefix: $GAMEDIR\n- task:\n    app: quartz\n    arch: win32\n    description: Installing Quartz.\n    name: winetricks\n    prefix: $GAMEDIR\n- task:\n    app: amstream\n    arch: win32\n    description: Installing Amstream.\n    name: winetricks\n    prefix: $GAMEDIR\n- task:\n    app: xvid win7\n    arch: win32\n    description: Installing Xvid.\n    name: winetricks\n    prefix: $GAMEDIR\n- task:\n    arch: win32\n    args: -u\n    description: Simulating Windows reboot.\n    executable: wineboot\n    name: wineexec\n    prefix: $GAMEDIR\n- task:\n    arch: win32\n    args: /SP- /SUPPRESSMSGBOXES /NOCANCEL\n    description: Installing Ys Origin\n    executable: setup\n    name: wineexec\n    prefix: $GAMEDIR\n- task:\n    arch: win32\n    description: Setting game options.\n    executable: $GAMEDIR/drive_c/GOG Games/Ys Origin/config.exe\n    name: wineexec\n    prefix: $GAMEDIR\nwine:\n  overrides:\n    winegstreamer: disabled\n"
}