{
  "id": 4977,
  "game_id": 7937,
  "game_slug": "robot-exploration-squad",
  "name": "Robot Exploration Squad",
  "year": null,
  "user": "FakeShemp",
  "runner": "wine",
  "slug": "robot-exploration-squad-groupees",
  "version": "Groupees",
  "description": "",
  "notes": "",
  "created_at": "2017-07-12T12:54:05.444000Z",
  "updated_at": "2018-05-19T03:41:56.090161Z",
  "draft": false,
  "published": true,
  "published_by": null,
  "rating": "",
  "steamid": 393600,
  "gogid": null,
  "gogslug": "",
  "humblestoreid": "",
  "script": {
    "files": [
      {
        "file1": "N/A:Please select the Groupees archive"
      }
    ],
    "game": {
      "prefix": "$GAMEDIR",
      "arch": "win32",
      "exe": "drive_c/Program Files/Robot Exploration Squad/RobotExplorationSquad.exe"
    },
    "installer": [
      {
        "extract": {
          "dst": "$CACHE",
          "file": "$file1"
        }
      },
      {
        "merge": {
          "dst": "$GAMEDIR/drive_c/Program Files/Robot Exploration Squad",
          "src": "$CACHE/Application Files/RobotExplorationSquad_1_0_0_9"
        }
      },
      {
        "task": {
          "prefix": "$GAMEDIR",
          "name": "winetricks",
          "app": "xna40"
        }
      },
      {
        "task": {
          "prefix": "$GAMEDIR",
          "name": "winetricks",
          "app": "wmp9"
        }
      },
      {
        "task": {
          "prefix": "$GAMEDIR",
          "name": "winetricks",
          "app": "devenum"
        }
      },
      {
        "task": {
          "prefix": "$GAMEDIR",
          "name": "winetricks",
          "app": "quartz"
        }
      }
    ]
  },
  "content": "files:\n- file1: N/A:Please select the Groupees archive\ngame:\n  arch: win32\n  exe: drive_c/Program Files/Robot Exploration Squad/RobotExplorationSquad.exe\n  prefix: $GAMEDIR\ninstaller:\n- extract:\n    dst: $CACHE\n    file: $file1\n- merge:\n    dst: $GAMEDIR/drive_c/Program Files/Robot Exploration Squad\n    src: $CACHE/Application Files/RobotExplorationSquad_1_0_0_9\n- task:\n    app: xna40\n    name: winetricks\n    prefix: $GAMEDIR\n- task:\n    app: wmp9\n    name: winetricks\n    prefix: $GAMEDIR\n- task:\n    app: devenum\n    name: winetricks\n    prefix: $GAMEDIR\n- task:\n    app: quartz\n    name: winetricks\n    prefix: $GAMEDIR\n"
}