{
  "id": 2515,
  "game_id": 1016,
  "game_slug": "painkiller-black-edition",
  "name": "Painkiller: Black Edition",
  "year": 2005,
  "user": "strider",
  "runner": "wine",
  "slug": "painkiller-black-edition-gog",
  "version": "GOG",
  "description": "",
  "notes": "",
  "created_at": "2016-08-20T00:18:49.036991Z",
  "updated_at": "2016-09-19T22:17:35.347039Z",
  "draft": false,
  "published": true,
  "published_by": null,
  "rating": "",
  "steamid": 39530,
  "gogid": 1207658715,
  "gogslug": "painkiller",
  "humblestoreid": "",
  "script": {
    "game": {
      "exe": "drive_c/Painkiller/Bin/Painkiller.exe",
      "arch": "win32",
      "prefix": "$GAMEDIR"
    },
    "files": [
      {
        "game": "N/A:Please select the GOG.com Windows installer(EXE file)."
      }
    ],
    "installer": [
      {
        "task": {
          "description": "Creating Wine prefix",
          "prefix": "$GAMEDIR",
          "name": "create_prefix"
        }
      },
      {
        "task": {
          "prefix": "$GAMEDIR",
          "name": "set_regedit",
          "path": "HKEY_CURRENT_USER\\Software\\Wine\\DllOverrides",
          "value": "",
          "key": "winemenubuilder.exe",
          "type": "REG_SZ"
        }
      },
      {
        "task": {
          "description": "Installing...",
          "prefix": "$GAMEDIR",
          "executable": "game",
          "name": "wineexec",
          "args": "/NOCANCEL '/DIR=C:/Painkiller'"
        }
      },
      {
        "task": {
          "description": "Disabling unused WINE features",
          "silent": true,
          "prefix": "$GAMEDIR",
          "app": "sandbox",
          "name": "winetricks"
        }
      }
    ]
  },
  "content": "files:\n- game: N/A:Please select the GOG.com Windows installer(EXE file).\ngame:\n  arch: win32\n  exe: drive_c/Painkiller/Bin/Painkiller.exe\n  prefix: $GAMEDIR\ninstaller:\n- task:\n    description: Creating Wine prefix\n    name: create_prefix\n    prefix: $GAMEDIR\n- task:\n    key: winemenubuilder.exe\n    name: set_regedit\n    path: HKEY_CURRENT_USER\\Software\\Wine\\DllOverrides\n    prefix: $GAMEDIR\n    type: REG_SZ\n    value: ''\n- task:\n    args: /NOCANCEL '/DIR=C:/Painkiller'\n    description: Installing...\n    executable: game\n    name: wineexec\n    prefix: $GAMEDIR\n- task:\n    app: sandbox\n    description: Disabling unused WINE features\n    name: winetricks\n    prefix: $GAMEDIR\n    silent: true\n"
}