{
  "id": 16694,
  "game_id": 30072,
  "game_slug": "3dmark_2006",
  "name": "3DMark 2006",
  "year": 2006,
  "user": "vanstaveren",
  "runner": "wine",
  "slug": "3dmark-2006-advanced-120-complet",
  "version": "Advanced 1.2.0, complete",
  "description": "* License: Legacy,\r\n* Hardware acceleration benchmark software,\r\n* Legacy key: 3DM06-YKL9-C7R6-73WW-AAPA-VHKW,\r\n* Legacy user: Futuremark,\r\n* Tested: 3DMark 2001 to 2006. \r\n  They all 'work' with the Futuremark SystemInfo 4.15.0, \r\n  that \"comes from downloading and installing 2006\".\r\n* SystemInfo : 4.15.0,\r\n* MP3codec DirectShow,\r\n* DirectX: 9c,\r\n* D9VK,\r\n* OpenAl,\r\n* Visual C++: 2005, 2010.",
  "notes": "",
  "created_at": "2019-11-08T01:11:59.334000Z",
  "updated_at": "2020-01-23T02:59:35.446874Z",
  "draft": false,
  "published": true,
  "published_by": 20548,
  "rating": "",
  "steamid": null,
  "gogid": null,
  "gogslug": "",
  "humblestoreid": "",
  "script": {
    "files": [
      {
        "setup": "https://benchmarks.ul.com/downloads/3dmark06.exe"
      }
    ],
    "installer": [
      {
        "task": {
          "arch": "win64",
          "description": "Creating 64-bit prefix ...",
          "prefix": "$GAMEDIR",
          "name": "create_prefix"
        }
      },
      {
        "task": {
          "arch": "win64",
          "description": "MP3codec DirectShow ...",
          "app": "l3codecx",
          "prefix": "$GAMEDIR",
          "name": "winetricks"
        }
      },
      {
        "task": {
          "arch": "win64",
          "description": "Visual C++ 2010 libraries ...",
          "app": "vcrun2010",
          "prefix": "$GAMEDIR",
          "name": "winetricks"
        }
      },
      {
        "task": {
          "arch": "win64",
          "description": "Visual C++ 2005 libraries ...",
          "app": "vcrun2005",
          "prefix": "$GAMEDIR",
          "name": "winetricks"
        }
      },
      {
        "task": {
          "arch": "win64",
          "description": "Windows version 8.1 ...",
          "app": "win81",
          "prefix": "$GAMEDIR",
          "name": "winetricks"
        }
      },
      {
        "task": {
          "arch": "win64",
          "description": "Vulkan ...",
          "app": "d9vk_master",
          "prefix": "$GAMEDIR",
          "name": "winetricks"
        }
      },
      {
        "move": {
          "src": "setup",
          "dst": "$GAMEDIR"
        }
      },
      {
        "chmodx": "$GAMEDIR/3dmark06.exe"
      },
      {
        "task": {
          "executable": "$GAMEDIR/3dmark06.exe",
          "description": "3DMark 2006 ...",
          "prefix": "$GAMEDIR",
          "name": "wineexec"
        }
      },
      {
        "task": {
          "value": "3DM06-YKL9-C7R6-73WW-AAPA-VHKW",
          "arch": "win64",
          "key": "KeyCode",
          "name": "set_regedit",
          "description": "Register KeyCode ...",
          "path": "HKEY_LOCAL_MACHINE\\Software\\Wow6432Node\\Futuremark\\3DMark06",
          "type": "REG_SZ"
        }
      },
      {
        "task": {
          "value": "3DM06-YKL9-C7R6-73WW-AAPA-VHKW",
          "arch": "win64",
          "key": "KeyCode",
          "name": "set_regedit",
          "description": "Register KeyCode ...",
          "path": "HKEY_USERS\\S-1-5-21-0-0-0-1000\\Software\\Futuremark\\3DMark",
          "type": "REG_SZ"
        }
      }
    ],
    "system": {
      "disable_compositor": true
    },
    "wine": {
      "Desktop": true,
      "dxvk": true
    },
    "game": {
      "arch": "win64",
      "prefix": "$GAMEDIR",
      "exe": "$GAMEDIR/drive_c/Program Files (x86)/Futuremark/3DMark06/3DMark06.exe"
    }
  },
  "content": "files:\n- setup: https://benchmarks.ul.com/downloads/3dmark06.exe\ngame:\n  arch: win64\n  exe: $GAMEDIR/drive_c/Program Files (x86)/Futuremark/3DMark06/3DMark06.exe\n  prefix: $GAMEDIR\ninstaller:\n- task:\n    arch: win64\n    description: Creating 64-bit prefix ...\n    name: create_prefix\n    prefix: $GAMEDIR\n- task:\n    app: l3codecx\n    arch: win64\n    description: MP3codec DirectShow ...\n    name: winetricks\n    prefix: $GAMEDIR\n- task:\n    app: vcrun2010\n    arch: win64\n    description: Visual C++ 2010 libraries ...\n    name: winetricks\n    prefix: $GAMEDIR\n- task:\n    app: vcrun2005\n    arch: win64\n    description: Visual C++ 2005 libraries ...\n    name: winetricks\n    prefix: $GAMEDIR\n- task:\n    app: win81\n    arch: win64\n    description: Windows version 8.1 ...\n    name: winetricks\n    prefix: $GAMEDIR\n- task:\n    app: d9vk_master\n    arch: win64\n    description: Vulkan ...\n    name: winetricks\n    prefix: $GAMEDIR\n- move:\n    dst: $GAMEDIR\n    src: setup\n- chmodx: $GAMEDIR/3dmark06.exe\n- task:\n    description: 3DMark 2006 ...\n    executable: $GAMEDIR/3dmark06.exe\n    name: wineexec\n    prefix: $GAMEDIR\n- task:\n    arch: win64\n    description: Register KeyCode ...\n    key: KeyCode\n    name: set_regedit\n    path: HKEY_LOCAL_MACHINE\\Software\\Wow6432Node\\Futuremark\\3DMark06\n    type: REG_SZ\n    value: 3DM06-YKL9-C7R6-73WW-AAPA-VHKW\n- task:\n    arch: win64\n    description: Register KeyCode ...\n    key: KeyCode\n    name: set_regedit\n    path: HKEY_USERS\\S-1-5-21-0-0-0-1000\\Software\\Futuremark\\3DMark\n    type: REG_SZ\n    value: 3DM06-YKL9-C7R6-73WW-AAPA-VHKW\nsystem:\n  disable_compositor: true\nwine:\n  Desktop: true\n  dxvk: true\n"
}