{
  "id": 2520,
  "game_id": 795,
  "game_slug": "commandos-2-men-of-courage",
  "name": "Commandos 2: Men of Courage",
  "year": 2001,
  "user": "ssf",
  "runner": "wine",
  "slug": "commandos-2-men-of-courage-gogcom",
  "version": "GOG.com",
  "description": "GOG standalone version",
  "notes": "",
  "created_at": "2016-08-21T14:05:39.797691Z",
  "updated_at": "2016-09-30T20:53:28.449185Z",
  "draft": false,
  "published": true,
  "published_by": null,
  "rating": "",
  "steamid": 6830,
  "gogid": 1207658803,
  "gogslug": "commandos_2_3",
  "humblestoreid": "",
  "script": {
    "installer": [
      {
        "task": {
          "description": "Creating Wine prefix",
          "prefix": "$GAMEDIR",
          "name": "create_prefix"
        }
      },
      {
        "task": {
          "prefix": "$GAMEDIR",
          "value": "",
          "key": "winemenubuilder.exe",
          "name": "set_regedit",
          "type": "REG_SZ",
          "path": "HKEY_CURRENT_USER\\Software\\Wine\\DllOverrides"
        }
      },
      {
        "task": {
          "args": "/VERYSILENT /SP- /NOCANCEL /SUPPRESSMSGBOXES '/DIR=C:/game'",
          "executable": "game",
          "description": "Installing...",
          "prefix": "$GAMEDIR",
          "name": "wineexec"
        }
      },
      {
        "task": {
          "silent": true,
          "description": "Disabling unused WINE features",
          "app": "sandbox",
          "prefix": "$GAMEDIR",
          "name": "winetricks"
        }
      }
    ],
    "files": [
      {
        "game": "N/A:Please select the GOG.com Windows installer."
      }
    ],
    "gogid": "commandos_2_3",
    "game": {
      "arch": "win32",
      "prefix": "$GAMEDIR",
      "exe": "drive_c/game/comm2.exe"
    }
  },
  "content": "files:\n- game: N/A:Please select the GOG.com Windows installer.\ngame:\n  arch: win32\n  exe: drive_c/game/comm2.exe\n  prefix: $GAMEDIR\ngogid: commandos_2_3\ninstaller:\n- task:\n    description: Creating Wine prefix\n    name: create_prefix\n    prefix: $GAMEDIR\n- task:\n    key: winemenubuilder.exe\n    name: set_regedit\n    path: HKEY_CURRENT_USER\\Software\\Wine\\DllOverrides\n    prefix: $GAMEDIR\n    type: REG_SZ\n    value: ''\n- task:\n    args: /VERYSILENT /SP- /NOCANCEL /SUPPRESSMSGBOXES '/DIR=C:/game'\n    description: Installing...\n    executable: game\n    name: wineexec\n    prefix: $GAMEDIR\n- task:\n    app: sandbox\n    description: Disabling unused WINE features\n    name: winetricks\n    prefix: $GAMEDIR\n    silent: true\n"
}