{
  "id": 15047,
  "game_id": 244,
  "game_slug": "the-elder-scrolls-v-skyrim",
  "name": "The Elder Scrolls V: Skyrim",
  "year": 2011,
  "user": "alfyn",
  "runner": "wine",
  "slug": "the-elder-scrolls-v-skyrim-dvd-or-digital",
  "version": "DVD or Digital",
  "description": null,
  "notes": "",
  "created_at": "2019-08-18T07:58:39.401339Z",
  "updated_at": "2019-08-18T07:58:39.401366Z",
  "draft": true,
  "published": false,
  "published_by": null,
  "rating": "",
  "steamid": 72850,
  "gogid": null,
  "gogslug": "",
  "humblestoreid": "",
  "script": {
    "game": {
      "exe": "drive_c/Program Files/The Elder Scrolls V/PlaySkyrim.exe",
      "arch": "win64",
      "prefix": "$GAMEDIR"
    },
    "files": [
      {
        "setup": "N/A:Select the installer for the game."
      }
    ],
    "system": {
      "env": {
        "DXVK_HUD": 0,
        "__GL_SHADER_DISK_CACHE": 1,
        "__GL_SHADER_DISK_CACHE_PATH": "$GAMEDIR",
        "DXVK_STATE_CACHE_PATH": "$GAMEDIR"
      }
    },
    "installer": [
      {
        "task": {
          "description": "Creating win64 prefix",
          "prefix": "$GAMEDIR",
          "arch": "win64",
          "name": "create_prefix"
        }
      },
      {
        "task": {
          "description": "Installing corefonts",
          "arch": "win64",
          "prefix": "$GAMEDIR",
          "name": "winetricks",
          "app": "arial"
        }
      },
      {
        "task": {
          "description": "Changing windows version to Win7",
          "arch": "win64",
          "prefix": "$GAMEDIR",
          "name": "winetricks",
          "app": "win7"
        }
      },
      {
        "task": {
          "description": "Installing faudio",
          "arch": "win64",
          "prefix": "$GAMEDIR",
          "name": "winetricks",
          "app": "faudio"
        }
      },
      {
        "task": {
          "description": "Installing the game. You might get an error at the end of the installation, just close the installer window and don't click on retry",
          "prefix": "$GAMEDIR",
          "executable": "setup",
          "arch": "win64",
          "name": "wineexec"
        }
      }
    ],
    "wine": {
      "esync": true,
      "overrides": {
        "winedbg.exe": "disabled"
      },
      "dxvk": true,
      "version": "tkg-protonified-4.6-x86_64"
    }
  },
  "content": "files:\n- setup: N/A:Select the installer for the game.\ngame:\n  arch: win64\n  exe: drive_c/Program Files/The Elder Scrolls V/PlaySkyrim.exe\n  prefix: $GAMEDIR\ninstaller:\n- task:\n    arch: win64\n    description: Creating win64 prefix\n    name: create_prefix\n    prefix: $GAMEDIR\n- task:\n    app: arial\n    arch: win64\n    description: Installing corefonts\n    name: winetricks\n    prefix: $GAMEDIR\n- task:\n    app: win7\n    arch: win64\n    description: Changing windows version to Win7\n    name: winetricks\n    prefix: $GAMEDIR\n- task:\n    app: faudio\n    arch: win64\n    description: Installing faudio\n    name: winetricks\n    prefix: $GAMEDIR\n- task:\n    arch: win64\n    description: Installing the game. You might get an error at the end of the installation,\n      just close the installer window and don't click on retry\n    executable: setup\n    name: wineexec\n    prefix: $GAMEDIR\nsystem:\n  env:\n    DXVK_HUD: 0\n    DXVK_STATE_CACHE_PATH: $GAMEDIR\n    __GL_SHADER_DISK_CACHE: 1\n    __GL_SHADER_DISK_CACHE_PATH: $GAMEDIR\nwine:\n  dxvk: true\n  esync: true\n  overrides:\n    winedbg.exe: disabled\n  version: tkg-protonified-4.6-x86_64\n"
}