{
  "id": 11486,
  "game_id": 14852,
  "game_slug": "dark-age-of-camelot",
  "name": "Dark Age Of Camelot",
  "year": 2002,
  "user": "zer0_",
  "runner": "wine",
  "slug": "dark-age-of-camelot-phoenix-free-shard",
  "version": "Phoenix Free Shard",
  "description": "Phoenix Free Shard Installer",
  "notes": "Close the patcher after the game patches to allow the installation to continue.",
  "created_at": "2019-01-06T21:18:28.721000Z",
  "updated_at": "2019-03-04T23:52:00.720193Z",
  "draft": false,
  "published": true,
  "published_by": 19464,
  "rating": "",
  "steamid": null,
  "gogid": null,
  "gogslug": "",
  "humblestoreid": "",
  "script": {
    "game": {
      "exe": "drive_c/Program Files/Electronic Arts/Dark Age of Camelot/Phoenix.exe",
      "arch": "win32",
      "prefix": "$GAMEDIR"
    },
    "files": [
      {
        "setup": "http://darkageofcamelot.com/sites/daoc/files/downloads/DAoCSetup.exe"
      },
      {
        "phoenix": {
          "filename": "launcher.zip",
          "url": "https://forum.playphoenix.online/assets/launcher.zip"
        }
      }
    ],
    "wine": {
      "version": "tkg-3.21-x86_64"
    },
    "installer": [
      {
        "task": {
          "description": "Creating Wine prefix",
          "prefix": "$GAMEDIR",
          "arch": "win32",
          "name": "create_prefix"
        }
      },
      {
        "task": {
          "arch": "win32",
          "prefix": "$GAMEDIR",
          "name": "winetricks",
          "app": "win7"
        }
      },
      {
        "task": {
          "description": "Installing Corefonts",
          "prefix": "$GAMEDIR",
          "app": "corefonts",
          "name": "winetricks"
        }
      },
      {
        "task": {
          "description": "Installing DAOC",
          "prefix": "$GAMEDIR",
          "executable": "setup",
          "name": "wineexec"
        }
      },
      {
        "extract": {
          "dst": "$GAMEDIR/drive_c/Program Files/Electronic Arts/Dark Age of Camelot/",
          "file": "phoenix"
        }
      },
      {
        "task": {
          "description": "Patch Game",
          "prefix": "$GAMEDIR",
          "executable": "$GAMEDIR/drive_c/Program Files/Electronic Arts/Dark Age of Camelot/camelot.exe",
          "name": "wineexec"
        }
      }
    ]
  },
  "content": "files:\n- setup: http://darkageofcamelot.com/sites/daoc/files/downloads/DAoCSetup.exe\n- phoenix:\n    filename: launcher.zip\n    url: https://forum.playphoenix.online/assets/launcher.zip\ngame:\n  arch: win32\n  exe: drive_c/Program Files/Electronic Arts/Dark Age of Camelot/Phoenix.exe\n  prefix: $GAMEDIR\ninstaller:\n- task:\n    arch: win32\n    description: Creating Wine prefix\n    name: create_prefix\n    prefix: $GAMEDIR\n- task:\n    app: win7\n    arch: win32\n    name: winetricks\n    prefix: $GAMEDIR\n- task:\n    app: corefonts\n    description: Installing Corefonts\n    name: winetricks\n    prefix: $GAMEDIR\n- task:\n    description: Installing DAOC\n    executable: setup\n    name: wineexec\n    prefix: $GAMEDIR\n- extract:\n    dst: $GAMEDIR/drive_c/Program Files/Electronic Arts/Dark Age of Camelot/\n    file: phoenix\n- task:\n    description: Patch Game\n    executable: $GAMEDIR/drive_c/Program Files/Electronic Arts/Dark Age of Camelot/camelot.exe\n    name: wineexec\n    prefix: $GAMEDIR\nwine:\n  version: tkg-3.21-x86_64\n"
}