{
  "id": 8277,
  "game_id": 12186,
  "game_slug": "the-sims-2",
  "name": "The Sims 2",
  "year": 2004,
  "user": "citrusalex",
  "runner": "wine",
  "slug": "the-sims-2-wined3d-origin",
  "version": "WineD3D | Origin",
  "description": "This installer uses a patched version of wine that allows it to run The Sims 2, and also adds certain mods to fix Wine-specific issues with the game.It is made for the Ultimate Collection version from Origin.",
  "notes": "IMPORTANT: READ THE MANUAL AND INSTALL DEPENDENCIES!\r\nSee <a href=\"https://github.com/lutris/lutris/wiki/Game:-The-Sims-2\">https://github.com/lutris/lutris/wiki/Game:-The-Sims-2</a>\r\n\r\n- The game will fail to launch with Origin-In-Game enabled. Please disable it in Origin's preferences to launch The Sims 2.\r\n- For support, contact @Tannis Root on Linux Gamers Group server.",
  "created_at": "2018-05-13T16:03:22.762000Z",
  "updated_at": "2020-01-22T02:21:05.327918Z",
  "draft": false,
  "published": false,
  "published_by": 51687,
  "rating": "3",
  "steamid": null,
  "gogid": null,
  "gogslug": "",
  "humblestoreid": "",
  "script": {
    "files": [
      {
        "fixes": "https://github.com/tannisroot/installer-fixes/raw/master/sims2_fixes.tar.xz"
      },
      {
        "origin": "https://origin-a.akamaihd.net/Origin-Client-Download/origin/legacy/OriginThinSetup.exe"
      }
    ],
    "game": {
      "prefix": "$GAMEDIR",
      "arch": "win32",
      "exe": "drive_c/Program Files/Origin/Origin.exe"
    },
    "installer": [
      {
        "task": {
          "description": "Creating Wine Prefix...",
          "name": "create_prefix",
          "arch": "win32",
          "prefix": "$GAMEDIR"
        }
      },
      {
        "task": {
          "description": "Disabling crash dialogs...",
          "path": "HKEY_CURRENT_USER\\Software\\Wine\\WineDbg",
          "key": "ShowCrashDialog",
          "prefix": "$GAMEDIR",
          "name": "set_regedit",
          "arch": "win32",
          "type": "REG_DWORD",
          "value": 0
        }
      },
      {
        "task": {
          "description": "Setting version to xp...",
          "name": "set_regedit",
          "arch": "win32",
          "key": "Version",
          "prefix": "$GAMEDIR",
          "path": "HKEY_CURRENT_USER\\Software\\Wine",
          "value": "winxp"
        }
      },
      {
        "task": {
          "description": "Setting Vertex Shader Model to 2...",
          "path": "HKEY_CURRENT_USER\\Software\\Wine\\Direct3D",
          "key": "MaxShaderModelVS",
          "prefix": "$GAMEDIR",
          "name": "set_regedit",
          "arch": "win32",
          "type": "REG_DWORD",
          "value": "00000002"
        }
      },
      {
        "task": {
          "description": "Setting Pixel Shader Model to 2...",
          "path": "HKEY_CURRENT_USER\\Software\\Wine\\Direct3D",
          "key": "MaxShaderModelPS",
          "prefix": "$GAMEDIR",
          "name": "set_regedit",
          "arch": "win32",
          "type": "REG_DWORD",
          "value": "00000002"
        }
      },
      {
        "task": {
          "prefix": "$GAMEDIR",
          "name": "winekill"
        }
      },
      {
        "task": {
          "description": "Installing Vcrun 2013",
          "name": "winetricks",
          "arch": "win32",
          "silent": true,
          "prefix": "$GAMEDIR",
          "app": "vcrun2013"
        }
      },
      {
        "task": {
          "description": "Installing Vcrun 2010",
          "name": "winetricks",
          "arch": "win32",
          "silent": true,
          "prefix": "$GAMEDIR",
          "app": "vcrun2010"
        }
      },
      {
        "extract": {
          "dst": "$GAMEDIR/drive_c/users/$USER/My Documents/EA Games/The Sims™ 2 Ultimate Collection/Downloads",
          "file": "fixes"
        }
      },
      {
        "write_file": {
          "content": "boolprop useshaders true\nboolProp   createNVidiaWorkaroundTexture false\nboolProp   bumpMapping false\n",
          "file": "$GAMEDIR/drive_c/users/$USER/My Documents/EA Games/The Sims™ 2 Ultimate Collection/Config/userstartup.cheat"
        }
      },
      {
        "task": {
          "prefix": "$GAMEDIR",
          "name": "winekill"
        }
      },
      {
        "task": {
          "description": "Installing Origin...",
          "name": "wineexec",
          "arch": "win32",
          "executable": "origin",
          "prefix": "$GAMEDIR",
          "exclude_processes": "Origin.exe OriginClientService.exe"
        }
      },
      {
        "task": {
          "prefix": "$GAMEDIR",
          "name": "winekill"
        }
      }
    ],
    "system": {
      "env": {
        "WINE_LARGE_ADDRESS_AWARE": 1
      }
    }
  },
  "content": "files:\r\n- fixes: https://github.com/tannisroot/installer-fixes/raw/master/sims2_fixes.tar.xz\r\n- origin: https://origin-a.akamaihd.net/Origin-Client-Download/origin/legacy/OriginThinSetup.exe\r\ngame:\r\n  arch: win32\r\n  exe: drive_c/Program Files/Origin/Origin.exe\r\n  prefix: $GAMEDIR\r\ninstaller:\r\n- task:\r\n    arch: win32\r\n    description: Creating Wine Prefix...\r\n    name: create_prefix\r\n    prefix: $GAMEDIR\r\n- task:\r\n    arch: win32\r\n    description: Disabling crash dialogs...\r\n    key: ShowCrashDialog\r\n    name: set_regedit\r\n    path: HKEY_CURRENT_USER\\Software\\Wine\\WineDbg\r\n    prefix: $GAMEDIR\r\n    type: REG_DWORD\r\n    value: 0\r\n- task:\r\n    arch: win32\r\n    description: Setting version to xp...\r\n    key: Version\r\n    name: set_regedit\r\n    path: HKEY_CURRENT_USER\\Software\\Wine\r\n    prefix: $GAMEDIR\r\n    value: winxp\r\n- task:\r\n    arch: win32\r\n    description: Setting Vertex Shader Model to 2...\r\n    key: MaxShaderModelVS\r\n    name: set_regedit\r\n    path: HKEY_CURRENT_USER\\Software\\Wine\\Direct3D\r\n    prefix: $GAMEDIR\r\n    type: REG_DWORD\r\n    value: '00000002'\r\n- task:\r\n    arch: win32\r\n    description: Setting Pixel Shader Model to 2...\r\n    key: MaxShaderModelPS\r\n    name: set_regedit\r\n    path: HKEY_CURRENT_USER\\Software\\Wine\\Direct3D\r\n    prefix: $GAMEDIR\r\n    type: REG_DWORD\r\n    value: '00000002'\r\n- task:\r\n    name: winekill\r\n    prefix: $GAMEDIR\r\n- task:\r\n    app: vcrun2013\r\n    arch: win32\r\n    description: Installing Vcrun 2013\r\n    name: winetricks\r\n    prefix: $GAMEDIR\r\n    silent: true\r\n- task:\r\n    app: vcrun2010\r\n    arch: win32\r\n    description: Installing Vcrun 2010\r\n    name: winetricks\r\n    prefix: $GAMEDIR\r\n    silent: true\r\n- extract:\r\n    dst: \"$GAMEDIR/drive_c/users/$USER/My Documents/EA Games/The Sims\\u2122 2 Ultimate\\\r\n      \\ Collection/Downloads\"\r\n    file: fixes\r\n- write_file:\r\n    content: 'boolprop useshaders true\r\n\r\n      boolProp   createNVidiaWorkaroundTexture false\r\n\r\n      boolProp   bumpMapping false\r\n\r\n      '\r\n    file: \"$GAMEDIR/drive_c/users/$USER/My Documents/EA Games/The Sims\\u2122 2 Ultimate\\\r\n      \\ Collection/Config/userstartup.cheat\"\r\n- task:\r\n    name: winekill\r\n    prefix: $GAMEDIR\r\n- task:\r\n    arch: win32\r\n    description: Installing Origin...\r\n    exclude_processes: Origin.exe OriginClientService.exe\r\n    executable: origin\r\n    name: wineexec\r\n    prefix: $GAMEDIR\r\n- task:\r\n    name: winekill\r\n    prefix: $GAMEDIR\r\nsystem:\r\n  env:\r\n    WINE_LARGE_ADDRESS_AWARE: 1"
}