{
  "id": 8878,
  "game_id": 12186,
  "game_slug": "the-sims-2",
  "name": "The Sims 2",
  "year": 2004,
  "user": "citrusalex",
  "runner": "wine",
  "slug": "the-sims-2-wined3d-universal-dv",
  "version": "WineD3D | Universal DVD",
  "description": "Installs DVD version of The Sims 2. It's universal for all editions and offline installers.",
  "notes": "<b>IMPORTANT: READ THE MANUAL AND INSTALL DEPENDENCIES!</b>\r\nSee <a href=\"https://github.com/lutris/lutris/wiki/Game:-The-Sims-2\">https://github.com/lutris/lutris/wiki/Game:-The-Sims-2</a>\r\n\r\n- <b>Please select the executable in the Lutris configuration after installing the game.</b>\r\n\r\n- <b>To fix various issues with the game</b> (broken family thumbnails, models exploding), start the game once, exit when it enters the town selection menu, then <b>Stop</b> the game in the Lutris client. Next time you launch it, the fixes will already be applied.\r\n\r\n- As this installer has only been tested with the Ultimate Collection, correct functionality of other editions is not guaranteed.\r\n\r\n- For support, contact @Tannis Root on Linux Gamers Group server.",
  "created_at": "2018-06-23T22:17:31.934000Z",
  "updated_at": "2020-01-22T02:21:18.730039Z",
  "draft": false,
  "published": false,
  "published_by": 51687,
  "rating": "3",
  "steamid": null,
  "gogid": null,
  "gogslug": "",
  "humbleid": "",
  "humblestoreid": "",
  "humblestoreid_real": "",
  "script": {
    "files": [
      {
        "fixes": "https://github.com/tannisroot/installer-fixes/raw/master/sims2_fixes.tar.xz"
      },
      {
        "script": "https://raw.githubusercontent.com/tannisroot/installer-fixes/master/sims2fix.sh"
      },
      {
        "file": "N/A:Select the game's setup file"
      }
    ],
    "game": {
      "arch": "win32",
      "prefix": "$GAMEDIR"
    },
    "installer": [
      {
        "task": {
          "arch": "win32",
          "description": "Creating Wine Prefix...",
          "name": "create_prefix",
          "prefix": "$GAMEDIR"
        }
      },
      {
        "task": {
          "app": "mfc42",
          "arch": "win32",
          "description": "Installing dependencies...",
          "name": "winetricks",
          "prefix": "$GAMEDIR",
          "silent": "true"
        }
      },
      {
        "task": {
          "arch": "win32",
          "description": "Setting version to xp...",
          "key": "Version",
          "name": "set_regedit",
          "path": "HKEY_CURRENT_USER\\Software\\Wine",
          "prefix": "$GAMEDIR",
          "value": "winxp"
        }
      },
      {
        "task": {
          "arch": "win32",
          "description": "Setting Vertex Shader Model to 2...",
          "key": "MaxShaderModelVS",
          "name": "set_regedit",
          "path": "HKEY_CURRENT_USER\\Software\\Wine\\Direct3D",
          "prefix": "$GAMEDIR",
          "type": "REG_DWORD",
          "value": "00000002"
        }
      },
      {
        "task": {
          "arch": "win32",
          "description": "Setting Pixel Shader Model to 2...",
          "key": "MaxShaderModelPS",
          "name": "set_regedit",
          "path": "HKEY_CURRENT_USER\\Software\\Wine\\Direct3D",
          "prefix": "$GAMEDIR",
          "type": "REG_DWORD",
          "value": "00000002"
        }
      },
      {
        "copy": {
          "dst": "$GAMEDIR",
          "src": "script"
        }
      },
      {
        "chmodx": "$GAMEDIR/sims2fix.sh"
      },
      {
        "extract": {
          "dst": "$GAMEDIR/drive_c/users/$USER/My Documents/EA Games/The Sims™ 2 Ultimate Collection/Downloads",
          "file": "fixes"
        }
      },
      {
        "write_file": {
          "content": "boolprop useshaders true\nboolProp   createNVidiaWorkaroundTexture false\n",
          "file": "$GAMEDIR/drive_c/users/$USER/My Documents/EA Games/The Sims™ 2 Ultimate Collection/Config/userstartup.cheat"
        }
      },
      {
        "task": {
          "name": "winekill",
          "prefix": "$GAMEDIR"
        }
      },
      {
        "task": {
          "arch": "win32",
          "description": "Installing The Sims 2...",
          "executable": "file",
          "name": "wineexec",
          "prefix": "$GAMEDIR"
        }
      },
      {
        "task": {
          "name": "winekill",
          "prefix": "$GAMEDIR"
        }
      }
    ],
    "system": {
      "env": {
        "WINE_LARGE_ADDRESS_AWARE": 1
      },
      "prelaunch_command": "$GAMEDIR/sims2fix.sh"
    }
  },
  "content": "files:\r\n- fixes: https://github.com/tannisroot/installer-fixes/raw/master/sims2_fixes.tar.xz\r\n- script: https://raw.githubusercontent.com/tannisroot/installer-fixes/master/sims2fix.sh\r\n- file: N/A:Select the game's setup file\r\ngame:\r\n  arch: win32\r\n  prefix: $GAMEDIR\r\ninstaller:\r\n- task:\r\n    arch: win32\r\n    description: Creating Wine Prefix...\r\n    name: create_prefix\r\n    prefix: $GAMEDIR\r\n- task:\r\n    app: mfc42\r\n    arch: win32\r\n    description: Installing dependencies...\r\n    name: winetricks\r\n    prefix: $GAMEDIR\r\n    silent: 'true'\r\n- task:\r\n    arch: win32\r\n    description: Setting version to xp...\r\n    key: Version\r\n    name: set_regedit\r\n    path: HKEY_CURRENT_USER\\Software\\Wine\r\n    prefix: $GAMEDIR\r\n    value: winxp\r\n- task:\r\n    arch: win32\r\n    description: Setting Vertex Shader Model to 2...\r\n    key: MaxShaderModelVS\r\n    name: set_regedit\r\n    path: HKEY_CURRENT_USER\\Software\\Wine\\Direct3D\r\n    prefix: $GAMEDIR\r\n    type: REG_DWORD\r\n    value: '00000002'\r\n- task:\r\n    arch: win32\r\n    description: Setting Pixel Shader Model to 2...\r\n    key: MaxShaderModelPS\r\n    name: set_regedit\r\n    path: HKEY_CURRENT_USER\\Software\\Wine\\Direct3D\r\n    prefix: $GAMEDIR\r\n    type: REG_DWORD\r\n    value: '00000002'\r\n- copy:\r\n    dst: $GAMEDIR\r\n    src: script\r\n- chmodx: $GAMEDIR/sims2fix.sh\r\n- extract:\r\n    dst: \"$GAMEDIR/drive_c/users/$USER/My Documents/EA Games/The Sims\\u2122 2 Ultimate\\\r\n      \\ Collection/Downloads\"\r\n    file: fixes\r\n- write_file:\r\n    content: 'boolprop useshaders true\r\n\r\n      boolProp   createNVidiaWorkaroundTexture false\r\n\r\n      '\r\n    file: \"$GAMEDIR/drive_c/users/$USER/My Documents/EA Games/The Sims\\u2122 2 Ultimate\\\r\n      \\ Collection/Config/userstartup.cheat\"\r\n- task:\r\n    name: winekill\r\n    prefix: $GAMEDIR\r\n- task:\r\n    arch: win32\r\n    description: Installing The Sims 2...\r\n    executable: file\r\n    name: wineexec\r\n    prefix: $GAMEDIR\r\n- task:\r\n    name: winekill\r\n    prefix: $GAMEDIR\r\nsystem:\r\n  env:\r\n    WINE_LARGE_ADDRESS_AWARE: 1\r\n  prelaunch_command: $GAMEDIR/sims2fix.sh"
}