{
  "id": 18891,
  "game_id": 15621,
  "game_slug": "cube-world",
  "name": "Cube World",
  "year": 2019,
  "user": "zekminster",
  "runner": "wine",
  "slug": "cube-world-change-me-1",
  "version": "Change Me",
  "description": null,
  "notes": "",
  "created_at": "2020-03-15T21:21:00.974240Z",
  "updated_at": "2020-03-15T21:21:00.974267Z",
  "draft": false,
  "published": false,
  "published_by": 1,
  "rating": "",
  "steamid": 1128000,
  "gogid": null,
  "gogslug": "",
  "humblestoreid": "",
  "script": {
    "installer": [
      {
        "task": {
          "arch": "win32",
          "description": "Creating 32bit Wine prefix.",
          "prefix": "$GAMEDIR",
          "name": "create_prefix"
        }
      },
      {
        "task": {
          "description": "Installing Visual C++ 2012 libs.",
          "app": "vcrun2012",
          "prefix": "$GAMEDIR",
          "name": "winetricks"
        }
      },
      {
        "task": {
          "description": "Installing WinHTTP.",
          "app": "winhttp",
          "prefix": "$GAMEDIR",
          "name": "winetricks"
        }
      },
      {
        "task": {
          "description": "Set orm=backbuffer.",
          "app": "orm=backbuffer",
          "prefix": "$GAMEDIR",
          "name": "winetricks"
        }
      },
      {
        "task": {
          "executable": "setup",
          "prefix": "$GAMEDIR",
          "name": "wineexec"
        }
      }
    ],
    "files": [
      {
        "setup": "N/A:Select Cube World setup executable"
      }
    ],
    "game": {
      "arch": "win32",
      "prefix": "$GAMEDIR",
      "exe": "drive_c/Program Files/Cube World/CubeLauncher.exe"
    }
  },
  "content": "files:\r\n- setup: N/A:Select Cube World setup executable\r\ngame:\r\n  arch: win32\r\n  exe: drive_c/Program Files/Cube World/CubeLauncher.exe\r\n  prefix: $GAMEDIR\r\ninstaller:\r\n- task:\r\n    arch: win32\r\n    description: Creating 32bit Wine prefix.\r\n    name: create_prefix\r\n    prefix: $GAMEDIR\r\n- task:\r\n    app: vcrun2012\r\n    description: Installing Visual C++ 2012 libs.\r\n    name: winetricks\r\n    prefix: $GAMEDIR\r\n- task:\r\n    app: winhttp\r\n    description: Installing WinHTTP.\r\n    name: winetricks\r\n    prefix: $GAMEDIR\r\n- task:\r\n    app: orm=backbuffer\r\n    description: Set orm=backbuffer.\r\n    name: winetricks\r\n    prefix: $GAMEDIR\r\n- task:\r\n    executable: setup\r\n    name: wineexec\r\n    prefix: $GAMEDIR"
}