{
  "id": 14910,
  "game_id": 15621,
  "game_slug": "cube-world",
  "name": "Cube World",
  "year": 2019,
  "user": "IceAmaura",
  "runner": "wine",
  "slug": "cube-world-change-me",
  "version": "Change Me",
  "description": null,
  "notes": "",
  "created_at": "2019-08-07T15:04:54.530489Z",
  "updated_at": "2019-08-07T15:04:54.530530Z",
  "draft": false,
  "published": false,
  "published_by": 19464,
  "rating": "",
  "steamid": 1128000,
  "gogid": null,
  "gogslug": "",
  "humblestoreid": "",
  "script": {
    "files": [
      {
        "setup": "N/A:Select cube world setup"
      }
    ],
    "game": {
      "prefix": "$GAMEDIR",
      "exe": "drive_c/Program Files/Cube World/Cube.exe",
      "arch": "win32"
    },
    "installer": [
      {
        "task": {
          "prefix": "$GAMEDIR",
          "arch": "win32",
          "name": "create_prefix",
          "description": "Creating 32bit Wine prefix."
        }
      },
      {
        "task": {
          "prefix": "$GAMEDIR",
          "app": "vcrun2012",
          "description": "Installing Visual C++ 2012 libs.",
          "name": "winetricks"
        }
      },
      {
        "task": {
          "prefix": "$GAMEDIR",
          "app": "xact",
          "description": "Installing MS XACT Engine (32bits).",
          "name": "winetricks"
        }
      },
      {
        "task": {
          "prefix": "$GAMEDIR",
          "app": "orm=backbuffer",
          "description": "Set orm=backbuffer.",
          "name": "winetricks"
        }
      },
      {
        "task": {
          "prefix": "$GAMEDIR",
          "executable": "setup",
          "name": "wineexec"
        }
      }
    ]
  },
  "content": "files:\n- setup: N/A:Select cube world setup\ngame:\n  arch: win32\n  exe: drive_c/Program Files/Cube World/Cube.exe\n  prefix: $GAMEDIR\ninstaller:\n- task:\n    arch: win32\n    description: Creating 32bit Wine prefix.\n    name: create_prefix\n    prefix: $GAMEDIR\n- task:\n    app: vcrun2012\n    description: Installing Visual C++ 2012 libs.\n    name: winetricks\n    prefix: $GAMEDIR\n- task:\n    app: xact\n    description: Installing MS XACT Engine (32bits).\n    name: winetricks\n    prefix: $GAMEDIR\n- task:\n    app: orm=backbuffer\n    description: Set orm=backbuffer.\n    name: winetricks\n    prefix: $GAMEDIR\n- task:\n    executable: setup\n    name: wineexec\n    prefix: $GAMEDIR\n"
}