{
  "id": 18294,
  "game_id": 85,
  "game_slug": "world-of-tanks",
  "name": "World of Tanks",
  "year": 2010,
  "user": "demoxcz",
  "runner": "wine",
  "slug": "world-of-tanks-change-me-11",
  "version": "Change Me",
  "description": "Version for installing the Wargaming Center under Windows 7, to fix the start problems under Windows 10.",
  "notes": "",
  "created_at": "2020-02-09T17:25:14.018709Z",
  "updated_at": "2020-02-09T17:25:14.018739Z",
  "draft": false,
  "published": false,
  "published_by": 494,
  "rating": "",
  "steamid": null,
  "gogid": null,
  "gogslug": "",
  "humblestoreid": "",
  "script": {
    "files": [
      {
        "game": {
          "url": "https://redirect.wargaming.net/WoT/latest_web_install_eu",
          "filename": "WoT_internet_install_eu.exe"
        }
      }
    ],
    "installer": [
      {
        "task": {
          "arch": "win64",
          "description": "Creating Wine prefix",
          "prefix": "$GAMEDIR",
          "name": "create_prefix"
        }
      },
      {
        "task": {
          "prefix": "$GAMEDIR",
          "name": "wineexec",
          "exclude_processes": "explorer.exe rpcss.exe winedevice.exe plugplay.exe WargamingGameUpdater.exe WoTLauncher.exe",
          "args": "/VERYSILENT /CLOSEAPPLICATIONS",
          "executable": "game",
          "description": "Installing World of Tanks"
        }
      },
      {
        "task": {
          "arch": "win64",
          "prefix": "$GAMEDIR",
          "name": "winekill"
        }
      },
      {
        "task": {
          "arch": "win64",
          "description": "Setting Wine to win7",
          "app": "corefonts win7",
          "prefix": "$GAMEDIR",
          "name": "winetricks"
        }
      }
    ],
    "system": {
      "disable_runtime": false,
      "env": {
        "__GL_SHADER_DISK_CACHE_PATH": "$GAMEDIR",
        "DXVK_HUD": 0,
        "__GL_SHADER_DISK_CACHE": 1
      }
    },
    "wine": {
      "Desktop": true,
      "dxvk": true,
      "overrides": {
        "xaudio2_7": "native,builtin"
      },
      "WineDesktop": "1920x1080",
      "version": "lutris-4.21-x86_64"
    },
    "game": {
      "arch": "win64",
      "prefix": "$GAMEDIR",
      "exe": "drive_c/Games/World_of_Tanks/WoTLauncher.exe"
    }
  },
  "content": "files:\n- game:\n    filename: WoT_internet_install_eu.exe\n    url: https://redirect.wargaming.net/WoT/latest_web_install_eu\ngame:\n  arch: win64\n  exe: drive_c/Games/World_of_Tanks/WoTLauncher.exe\n  prefix: $GAMEDIR\ninstaller:\n- task:\n    arch: win64\n    description: Creating Wine prefix\n    name: create_prefix\n    prefix: $GAMEDIR\n- task:\n    args: /VERYSILENT /CLOSEAPPLICATIONS\n    description: Installing World of Tanks\n    exclude_processes: explorer.exe rpcss.exe winedevice.exe plugplay.exe WargamingGameUpdater.exe\n      WoTLauncher.exe\n    executable: game\n    name: wineexec\n    prefix: $GAMEDIR\n- task:\n    arch: win64\n    name: winekill\n    prefix: $GAMEDIR\n- task:\n    app: corefonts win7\n    arch: win64\n    description: Setting Wine to win7\n    name: winetricks\n    prefix: $GAMEDIR\nsystem:\n  disable_runtime: false\n  env:\n    DXVK_HUD: 0\n    __GL_SHADER_DISK_CACHE: 1\n    __GL_SHADER_DISK_CACHE_PATH: $GAMEDIR\nwine:\n  Desktop: true\n  WineDesktop: 1920x1080\n  dxvk: true\n  overrides:\n    xaudio2_7: native,builtin\n  version: lutris-4.21-x86_64\n"
}