{
  "id": 9330,
  "game_id": 85,
  "game_slug": "world-of-tanks",
  "name": "World of Tanks",
  "year": 2010,
  "user": "cxf",
  "runner": "wine",
  "slug": "world-of-tanks-asia-dxvk-win7",
  "version": "Asia DXVK / Win7",
  "description": "Version for installing the Wargaming Center under Windows 7, to fix the start problems under Windows 10.",
  "notes": "",
  "created_at": "2018-07-23T06:01:56.127000Z",
  "updated_at": "2020-01-23T02:56:54.545921Z",
  "draft": false,
  "published": true,
  "published_by": 20548,
  "rating": "",
  "steamid": null,
  "gogid": null,
  "gogslug": "",
  "humblestoreid": "",
  "script": {
    "files": [
      {
        "game": {
          "filename": "WoT_internet_install_asia.exe",
          "url": "https://wot.gcdn.co/asia/files/WoT_internet_install_asia.exe"
        }
      }
    ],
    "game": {
      "arch": "win64",
      "exe": "drive_c/Games/World_of_Tanks/WoTLauncher.exe",
      "prefix": "$GAMEDIR"
    },
    "installer": [
      {
        "task": {
          "arch": "win64",
          "description": "Creating Wine prefix",
          "name": "create_prefix",
          "prefix": "$GAMEDIR"
        }
      },
      {
        "task": {
          "args": "/VERYSILENT /CLOSEAPPLICATIONS",
          "description": "Installing World of Tanks",
          "exclude_processes": "explorer.exe rpcss.exe winedevice.exe plugplay.exe WargamingGameUpdater.exe WoTLauncher.exe",
          "executable": "game",
          "name": "wineexec",
          "prefix": "$GAMEDIR"
        }
      },
      {
        "task": {
          "arch": "win64",
          "name": "winekill",
          "prefix": "$GAMEDIR"
        }
      },
      {
        "task": {
          "app": "corefonts win7",
          "arch": "win32",
          "description": "Setting Wine to Windows 7",
          "name": "winetricks",
          "prefix": "$GAMEDIR"
        }
      }
    ],
    "system": {
      "disable_runtime": false,
      "env": {
        "DXVK_HUD": 0,
        "__GL_SHADER_DISK_CACHE": 1,
        "__GL_SHADER_DISK_CACHE_PATH": "$GAMEDIR"
      }
    },
    "wine": {
      "Desktop": true,
      "WineDesktop": "1920x1080",
      "dxvk": true,
      "overrides": {
        "xaudio2_7": "native,builtin"
      }
    }
  },
  "content": "files:\n- game:\n    filename: WoT_internet_install_asia.exe\n    url: https://wot.gcdn.co/asia/files/WoT_internet_install_asia.exe\ngame:\n  arch: win64\n  exe: drive_c/Games/World_of_Tanks/WoTLauncher.exe\n  prefix: $GAMEDIR\ninstaller:\n- task:\n    arch: win64\n    description: Creating Wine prefix\n    name: create_prefix\n    prefix: $GAMEDIR\n- task:\n    args: /VERYSILENT /CLOSEAPPLICATIONS\n    description: Installing World of Tanks\n    exclude_processes: explorer.exe rpcss.exe winedevice.exe plugplay.exe WargamingGameUpdater.exe\n      WoTLauncher.exe\n    executable: game\n    name: wineexec\n    prefix: $GAMEDIR\n- task:\n    arch: win64\n    name: winekill\n    prefix: $GAMEDIR\n- task:\n    app: corefonts win7\n    arch: win32\n    description: Setting Wine to Windows 7\n    name: winetricks\n    prefix: $GAMEDIR\nsystem:\n  disable_runtime: false\n  env:\n    DXVK_HUD: 0\n    __GL_SHADER_DISK_CACHE: 1\n    __GL_SHADER_DISK_CACHE_PATH: $GAMEDIR\nwine:\n  Desktop: true\n  WineDesktop: 1920x1080\n  dxvk: true\n  overrides:\n    xaudio2_7: native,builtin\n"
}