{
  "id": 7921,
  "game_id": 85,
  "game_slug": "world-of-tanks",
  "name": "World of Tanks",
  "year": 2010,
  "user": "Ironlenny",
  "runner": "wine",
  "slug": "world-of-tanks-na-dxvk",
  "version": "NA DXVK",
  "description": null,
  "notes": "",
  "created_at": "2018-04-17T03:18:55.466000Z",
  "updated_at": "2019-10-26T00:16:33.369783Z",
  "draft": false,
  "published": true,
  "published_by": 19464,
  "rating": "",
  "steamid": null,
  "gogid": null,
  "gogslug": "",
  "humblestoreid": "",
  "script": {
    "system": {
      "env": {
        "__GL_SHADER_DISK_CACHE": 1,
        "__GL_SHADER_DISK_CACHE_PATH": "$GAMEDIR",
        "DXVK_HUD": 0
      },
      "disable_runtime": false
    },
    "game": {
      "arch": "win64",
      "prefix": "$GAMEDIR",
      "exe": "drive_c/Games/World_of_Tanks/WoTLauncher.exe"
    },
    "wine": {
      "WineDesktop": "1920x1080",
      "overrides": {
        "xaudio2_7": "native,builtin"
      },
      "dxvk": true,
      "Desktop": true,
      "version": "lutris-4.16-x86_64"
    },
    "files": [
      {
        "game": {
          "url": "https://wot.gcdn.co/na/files/WoT_internet_install_na.exe",
          "filename": "WoT_internet_install_na.exe"
        }
      }
    ],
    "installer": [
      {
        "task": {
          "arch": "win64",
          "prefix": "$GAMEDIR",
          "description": "Creating Wine prefix",
          "name": "create_prefix"
        }
      },
      {
        "task": {
          "prefix": "$GAMEDIR",
          "executable": "game",
          "description": "Installing World of Tanks",
          "args": "/VERYSILENT /CLOSEAPPLICATIONS",
          "exclude_processes": "explorer.exe rpcss.exe winedevice.exe plugplay.exe WargamingGameUpdater.exe WoTLauncher.exe",
          "name": "wineexec"
        }
      },
      {
        "task": {
          "arch": "win64",
          "prefix": "$GAMEDIR",
          "name": "winekill"
        }
      },
      {
        "task": {
          "arch": "win64",
          "prefix": "$GAMEDIR",
          "description": "Setting Wine to Windows 10",
          "name": "winetricks",
          "app": "corefonts win10"
        }
      }
    ]
  },
  "content": "files:\n- game:\n    filename: WoT_internet_install_na.exe\n    url: https://wot.gcdn.co/na/files/WoT_internet_install_na.exe\ngame:\n  arch: win64\n  exe: drive_c/Games/World_of_Tanks/WoTLauncher.exe\n  prefix: $GAMEDIR\ninstaller:\n- task:\n    arch: win64\n    description: Creating Wine prefix\n    name: create_prefix\n    prefix: $GAMEDIR\n- task:\n    args: /VERYSILENT /CLOSEAPPLICATIONS\n    description: Installing World of Tanks\n    exclude_processes: explorer.exe rpcss.exe winedevice.exe plugplay.exe WargamingGameUpdater.exe\n      WoTLauncher.exe\n    executable: game\n    name: wineexec\n    prefix: $GAMEDIR\n- task:\n    arch: win64\n    name: winekill\n    prefix: $GAMEDIR\n- task:\n    app: corefonts win10\n    arch: win64\n    description: Setting Wine to Windows 10\n    name: winetricks\n    prefix: $GAMEDIR\nsystem:\n  disable_runtime: false\n  env:\n    DXVK_HUD: 0\n    __GL_SHADER_DISK_CACHE: 1\n    __GL_SHADER_DISK_CACHE_PATH: $GAMEDIR\nwine:\n  Desktop: true\n  WineDesktop: 1920x1080\n  dxvk: true\n  overrides:\n    xaudio2_7: native,builtin\n  version: lutris-4.16-x86_64\n"
}