{
  "id": 17957,
  "game_id": 85,
  "game_slug": "world-of-tanks",
  "name": "World of Tanks",
  "year": 2010,
  "user": "happymeal1887",
  "runner": "wine",
  "slug": "world-of-tanks-eu-promod-ssl-fixed",
  "version": "EU + ProMod SSL Fixed",
  "description": "DXVK  /  (EU) + ProMod",
  "notes": "Wine 4.0 + FAudio + .NET 4.8 + DSound + DMusic + CoreFonts",
  "created_at": "2020-01-19T12:29:54.444000Z",
  "updated_at": "2020-01-23T02:57:04.081902Z",
  "draft": false,
  "published": true,
  "published_by": 20548,
  "rating": "",
  "steamid": null,
  "gogid": null,
  "gogslug": "",
  "humbleid": "",
  "humblestoreid": "",
  "humblestoreid_real": "",
  "script": {
    "files": [
      {
        "game": {
          "filename": "WoT_internet_install_eu.exe",
          "url": "https://wot.gcdn.co/eu/files/WoT_internet_install_eu.exe"
        }
      },
      {
        "modpack1": {
          "filename": "promod.zip",
          "url": "https://www.oldskool.vip/promod/ProMod.zip"
        }
      }
    ],
    "game": {
      "arch": "win64",
      "exe": "drive_c/Games/World_of_Tanks/WoTLauncher.exe",
      "prefix": "$GAMEDIR"
    },
    "installer": [
      {
        "task": {
          "arch": "win64",
          "description": "Creating Wine prefix",
          "install_mono": false,
          "name": "create_prefix",
          "prefix": "$GAMEDIR"
        }
      },
      {
        "task": {
          "args": "/VERYSILENT /CLOSEAPPLICATIONS",
          "description": "Installing World of Tanks",
          "exclude_processes": "explorer.exe rpcss.exe winedevice.exe plugplay.exe WargamingGameUpdater.exe WoTLauncher.exe",
          "executable": "game",
          "name": "wineexec",
          "prefix": "$GAMEDIR"
        }
      },
      {
        "task": {
          "arch": "win64",
          "name": "winekill",
          "prefix": "$GAMEDIR"
        }
      },
      {
        "task": {
          "app": "win10",
          "arch": "win64",
          "description": "Setting Wine to Windows 10",
          "name": "winetricks",
          "prefix": "$GAMEDIR"
        }
      },
      {
        "extract": {
          "dst": "drive_c/Games/",
          "file": "modpack1",
          "format": "zip"
        }
      },
      {
        "task": {
          "app": "corefonts",
          "arch": "win64",
          "description": "install MS core fonts",
          "name": "winetricks",
          "prefix": "$GAMEDIR"
        }
      },
      {
        "task": {
          "app": "dotnet48",
          "arch": "win64",
          "description": "install .NET 4.8",
          "name": "winetricks",
          "prefix": "$GAMEDIR"
        }
      },
      {
        "task": {
          "app": "dsound",
          "arch": "win64",
          "description": "install DSound",
          "name": "winetricks",
          "prefix": "$GAMEDIR"
        }
      },
      {
        "task": {
          "app": "dmusic",
          "arch": "win64",
          "description": "install DMusic",
          "name": "winetricks",
          "prefix": "$GAMEDIR"
        }
      },
      {
        "task": {
          "app": "faudio",
          "arch": "win64",
          "description": "install FAudio",
          "name": "winetricks",
          "prefix": "$GAMEDIR"
        }
      },
      {
        "task": {
          "description": "Installing ProMod",
          "executable": "drive_c/Games/ProMod.exe",
          "name": "wineexec",
          "prefix": "$GAMEDIR"
        }
      },
      {
        "task": {
          "arch": "win64",
          "name": "winekill",
          "prefix": "$GAMEDIR"
        }
      }
    ],
    "system": {
      "disable_runtime": false,
      "env": {
        "DXVK_HUD": 0
      }
    },
    "wine": {
      "Desktop": true,
      "WineDesktop": "1920x1080",
      "dxvk": true,
      "overrides": {
        "xaudio2_7": "native,builtin"
      }
    }
  },
  "content": "files:\n- game:\n    filename: WoT_internet_install_eu.exe\n    url: https://wot.gcdn.co/eu/files/WoT_internet_install_eu.exe\n- modpack1:\n    filename: promod.zip\n    url: https://www.oldskool.vip/promod/ProMod.zip\ngame:\n  arch: win64\n  exe: drive_c/Games/World_of_Tanks/WoTLauncher.exe\n  prefix: $GAMEDIR\ninstaller:\n- task:\n    arch: win64\n    description: Creating Wine prefix\n    install_mono: false\n    name: create_prefix\n    prefix: $GAMEDIR\n- task:\n    args: /VERYSILENT /CLOSEAPPLICATIONS\n    description: Installing World of Tanks\n    exclude_processes: explorer.exe rpcss.exe winedevice.exe plugplay.exe WargamingGameUpdater.exe\n      WoTLauncher.exe\n    executable: game\n    name: wineexec\n    prefix: $GAMEDIR\n- task:\n    arch: win64\n    name: winekill\n    prefix: $GAMEDIR\n- task:\n    app: win10\n    arch: win64\n    description: Setting Wine to Windows 10\n    name: winetricks\n    prefix: $GAMEDIR\n- extract:\n    dst: drive_c/Games/\n    file: modpack1\n    format: zip\n- task:\n    app: corefonts\n    arch: win64\n    description: install MS core fonts\n    name: winetricks\n    prefix: $GAMEDIR\n- task:\n    app: dotnet48\n    arch: win64\n    description: install .NET 4.8\n    name: winetricks\n    prefix: $GAMEDIR\n- task:\n    app: dsound\n    arch: win64\n    description: install DSound\n    name: winetricks\n    prefix: $GAMEDIR\n- task:\n    app: dmusic\n    arch: win64\n    description: install DMusic\n    name: winetricks\n    prefix: $GAMEDIR\n- task:\n    app: faudio\n    arch: win64\n    description: install FAudio\n    name: winetricks\n    prefix: $GAMEDIR\n- task:\n    description: Installing ProMod\n    executable: drive_c/Games/ProMod.exe\n    name: wineexec\n    prefix: $GAMEDIR\n- task:\n    arch: win64\n    name: winekill\n    prefix: $GAMEDIR\nsystem:\n  disable_runtime: false\n  env:\n    DXVK_HUD: 0\nwine:\n  Desktop: true\n  WineDesktop: 1920x1080\n  dxvk: true\n  overrides:\n    xaudio2_7: native,builtin\n"
}