{
  "id": 9330,
  "game_id": 85,
  "game_slug": "world-of-tanks",
  "name": "World of Tanks",
  "year": 2010,
  "user": "cxf",
  "runner": "wine",
  "slug": "world-of-tanks-asia-dxvk",
  "version": "Asia DXVK",
  "description": null,
  "notes": "",
  "created_at": "2018-07-23T06:01:56.127000Z",
  "updated_at": "2019-02-16T05:06:40.819899Z",
  "draft": false,
  "published": true,
  "published_by": 19464,
  "rating": "",
  "steamid": null,
  "gogid": null,
  "gogslug": "",
  "humblestoreid": "",
  "script": {
    "game": {
      "exe": "drive_c/Games/World_of_Tanks/WoTLauncher.exe",
      "arch": "win64",
      "prefix": "$GAMEDIR"
    },
    "files": [
      {
        "game": {
          "filename": "WoT_internet_install_asia.exe",
          "url": "https://wot.gcdn.co/asia/files/WoT_internet_install_asia.exe"
        }
      }
    ],
    "system": {
      "disable_runtime": false,
      "env": {
        "DXVK_HUD": 0
      }
    },
    "installer": [
      {
        "task": {
          "description": "Creating Wine prefix",
          "prefix": "$GAMEDIR",
          "arch": "win64",
          "name": "create_prefix"
        }
      },
      {
        "task": {
          "name": "wineexec",
          "args": "/VERYSILENT /CLOSEAPPLICATIONS",
          "description": "Installing World of Tanks",
          "prefix": "$GAMEDIR",
          "executable": "game",
          "exclude_processes": "explorer.exe rpcss.exe winedevice.exe plugplay.exe WargamingGameUpdater.exe WoTLauncher.exe"
        }
      },
      {
        "task": {
          "prefix": "$GAMEDIR",
          "arch": "win64",
          "name": "winekill"
        }
      },
      {
        "task": {
          "description": "Setting Wine to Windows 10",
          "arch": "win64",
          "prefix": "$GAMEDIR",
          "name": "winetricks",
          "app": "win10"
        }
      }
    ],
    "wine": {
      "Desktop": true,
      "overrides": {
        "xaudio2_7": "native,builtin"
      },
      "WineDesktop": "1920x1080",
      "dxvk": true,
      "version": "tkg-4.0-x86_64"
    }
  },
  "content": "files:\n- game:\n    filename: WoT_internet_install_asia.exe\n    url: https://wot.gcdn.co/asia/files/WoT_internet_install_asia.exe\ngame:\n  arch: win64\n  exe: drive_c/Games/World_of_Tanks/WoTLauncher.exe\n  prefix: $GAMEDIR\ninstaller:\n- task:\n    arch: win64\n    description: Creating Wine prefix\n    name: create_prefix\n    prefix: $GAMEDIR\n- task:\n    args: /VERYSILENT /CLOSEAPPLICATIONS\n    description: Installing World of Tanks\n    exclude_processes: explorer.exe rpcss.exe winedevice.exe plugplay.exe WargamingGameUpdater.exe\n      WoTLauncher.exe\n    executable: game\n    name: wineexec\n    prefix: $GAMEDIR\n- task:\n    arch: win64\n    name: winekill\n    prefix: $GAMEDIR\n- task:\n    app: win10\n    arch: win64\n    description: Setting Wine to Windows 10\n    name: winetricks\n    prefix: $GAMEDIR\nsystem:\n  disable_runtime: false\n  env:\n    DXVK_HUD: 0\nwine:\n  Desktop: true\n  WineDesktop: 1920x1080\n  dxvk: true\n  overrides:\n    xaudio2_7: native,builtin\n  version: tkg-4.0-x86_64\n"
}