{
  "id": 20772,
  "game_id": 85,
  "game_slug": "world-of-tanks",
  "name": "World of Tanks",
  "year": 2010,
  "user": "narnah",
  "runner": "wine",
  "slug": "world-of-tanks-change-me",
  "version": "Change Me",
  "description": null,
  "notes": "Change wine to win7 for WGC work. Update Lutris version to 4.21",
  "created_at": "2020-05-25T19:38:36.810922Z",
  "updated_at": "2020-05-25T19:38:36.810948Z",
  "draft": false,
  "published": false,
  "published_by": 20548,
  "rating": "",
  "steamid": null,
  "gogid": null,
  "gogslug": "",
  "humbleid": "",
  "humblestoreid": "",
  "humblestoreid_real": "",
  "script": {
    "files": [
      {
        "game": {
          "filename": "WoT_internet_install_ru.exe",
          "url": "https://wot.gcdn.co/ru/files/WoT_internet_install_ru.exe"
        }
      }
    ],
    "game": {
      "arch": "win64",
      "exe": "drive_c/Games/World_of_Tanks/WoTLauncher.exe",
      "prefix": "$GAMEDIR"
    },
    "installer": [
      {
        "task": {
          "arch": "win64",
          "description": "Creating Wine prefix",
          "name": "create_prefix",
          "prefix": "$GAMEDIR"
        }
      },
      {
        "task": {
          "args": "/VERYSILENT /CLOSEAPPLICATIONS",
          "description": "Installing World of Tanks",
          "exclude_processes": "explorer.exe rpcss.exe winedevice.exe plugplay.exe WargamingGameUpdater.exe WoTLauncher.exe",
          "executable": "game",
          "name": "wineexec",
          "prefix": "$GAMEDIR"
        }
      },
      {
        "task": {
          "arch": "win64",
          "name": "winekill",
          "prefix": "$GAMEDIR"
        }
      },
      {
        "task": {
          "app": "corefonts win7",
          "arch": "win64",
          "description": "Setting Wine to Windows 7",
          "name": "winetricks",
          "prefix": "$GAMEDIR"
        }
      }
    ],
    "system": {
      "disable_runtime": false,
      "env": {
        "DXVK_HUD": 0,
        "__GL_SHADER_DISK_CACHE": 1,
        "__GL_SHADER_DISK_CACHE_PATH": "$GAMEDIR"
      }
    },
    "wine": {
      "Desktop": true,
      "WineDesktop": "1920x1080",
      "dxvk": true,
      "overrides": {
        "xaudio2_7": "native,builtin"
      }
    }
  },
  "content": "files:\r\n- game:\r\n    filename: WoT_internet_install_ru.exe\r\n    url: https://wot.gcdn.co/ru/files/WoT_internet_install_ru.exe\r\ngame:\r\n  arch: win64\r\n  exe: drive_c/Games/World_of_Tanks/WoTLauncher.exe\r\n  prefix: $GAMEDIR\r\ninstaller:\r\n- task:\r\n    arch: win64\r\n    description: Creating Wine prefix\r\n    name: create_prefix\r\n    prefix: $GAMEDIR\r\n- task:\r\n    args: /VERYSILENT /CLOSEAPPLICATIONS\r\n    description: Installing World of Tanks\r\n    exclude_processes: explorer.exe rpcss.exe winedevice.exe plugplay.exe WargamingGameUpdater.exe\r\n      WoTLauncher.exe\r\n    executable: game\r\n    name: wineexec\r\n    prefix: $GAMEDIR\r\n- task:\r\n    arch: win64\r\n    name: winekill\r\n    prefix: $GAMEDIR\r\n- task:\r\n    app: corefonts win7\r\n    arch: win64\r\n    description: Setting Wine to Windows 7\r\n    name: winetricks\r\n    prefix: $GAMEDIR\r\nsystem:\r\n  disable_runtime: false\r\n  env:\r\n    DXVK_HUD: 0\r\n    __GL_SHADER_DISK_CACHE: 1\r\n    __GL_SHADER_DISK_CACHE_PATH: $GAMEDIR\r\nwine:\r\n  Desktop: true\r\n  WineDesktop: 1920x1080\r\n  dxvk: true\r\n  overrides:\r\n    xaudio2_7: native,builtin"
}