{
  "id": 8064,
  "game_id": 85,
  "game_slug": "world-of-tanks",
  "name": "World of Tanks",
  "year": 2010,
  "user": "yzwqqins",
  "runner": "wine",
  "slug": "world-of-tanks-ru-dxvk",
  "version": "RU DXVK",
  "description": "Version for installing the Wargaming Center under Windows 7, to fix the start problems under Windows 10.",
  "notes": "",
  "created_at": "2018-05-05T16:34:33.926000Z",
  "updated_at": "2020-01-31T16:24:09.364702Z",
  "draft": false,
  "published": true,
  "published_by": 20548,
  "rating": "",
  "steamid": null,
  "gogid": null,
  "gogslug": "",
  "humblestoreid": "",
  "script": {
    "files": [
      {
        "game": {
          "filename": "WoT_internet_install_ru.exe",
          "url": "https://wot.gcdn.co/ru/files/WoT_internet_install_ru.exe"
        }
      }
    ],
    "installer": [
      {
        "task": {
          "description": "Creating Wine prefix",
          "name": "create_prefix",
          "arch": "win64",
          "prefix": "$GAMEDIR"
        }
      },
      {
        "task": {
          "description": "Installing World of Tanks",
          "name": "wineexec",
          "executable": "game",
          "prefix": "$GAMEDIR",
          "args": "/VERYSILENT /CLOSEAPPLICATIONS",
          "exclude_processes": "explorer.exe rpcss.exe winedevice.exe plugplay.exe WargamingGameUpdater.exe WoTLauncher.exe"
        }
      },
      {
        "task": {
          "prefix": "$GAMEDIR",
          "name": "winekill",
          "arch": "win64"
        }
      },
      {
        "task": {
          "description": "Setting Wine to Windows 7",
          "name": "winetricks",
          "arch": "win32",
          "app": "corefonts win7",
          "prefix": "$GAMEDIR"
        }
      }
    ],
    "game": {
      "prefix": "$GAMEDIR",
      "arch": "win64",
      "exe": "drive_c/Games/World_of_Tanks/WoTLauncher.exe"
    },
    "system": {
      "disable_runtime": false,
      "env": {
        "__GL_SHADER_DISK_CACHE_PATH": "$GAMEDIR",
        "DXVK_HUD": 0,
        "__GL_SHADER_DISK_CACHE": 1
      }
    },
    "wine": {
      "dxvk": true,
      "WineDesktop": "1920x1080",
      "Desktop": true,
      "overrides": {
        "xaudio2_7": "native,builtin"
      }
    }
  },
  "content": "files:\n- game:\n    filename: WoT_internet_install_ru.exe\n    url: https://wot.gcdn.co/ru/files/WoT_internet_install_ru.exe\ngame:\n  arch: win64\n  exe: drive_c/Games/World_of_Tanks/WoTLauncher.exe\n  prefix: $GAMEDIR\ninstaller:\n- task:\n    arch: win64\n    description: Creating Wine prefix\n    name: create_prefix\n    prefix: $GAMEDIR\n- task:\n    args: /VERYSILENT /CLOSEAPPLICATIONS\n    description: Installing World of Tanks\n    exclude_processes: explorer.exe rpcss.exe winedevice.exe plugplay.exe WargamingGameUpdater.exe\n      WoTLauncher.exe\n    executable: game\n    name: wineexec\n    prefix: $GAMEDIR\n- task:\n    arch: win64\n    name: winekill\n    prefix: $GAMEDIR\n- task:\n    app: corefonts win7\n    arch: win32\n    description: Setting Wine to Windows 7\n    name: winetricks\n    prefix: $GAMEDIR\nsystem:\n  disable_runtime: false\n  env:\n    DXVK_HUD: 0\n    __GL_SHADER_DISK_CACHE: 1\n    __GL_SHADER_DISK_CACHE_PATH: $GAMEDIR\nwine:\n  Desktop: true\n  WineDesktop: 1920x1080\n  dxvk: true\n  overrides:\n    xaudio2_7: native,builtin\n"
}